volume_number	page_number	x1	y1	x2	y2	tokens_count	mean_confidence	text	image
5016	2	3717	5921	4389	6209	37	0.94474	Проверяются результаты полета и бом- барцировки, Все самолеты вернулись на свои базы, все летчики здоровы и невре димы. Цели поражены, бомбы большой си- лы попали именно туда, куда они пред- назначались. «Теперь отдыхать», --- гово- рит командир.	vol-5016-page-02-seg-076-3717-5921-4389-6209.png
5016	2	3721	6225	4381	6339	9	0.91174	Политрук Т. ОРЛОЗ. ДЕЙСТВУЮЩАЯ АРМИЯ, 4 ноября: (По телеграфу).	vol-5016-page-02-seg-077-3721-6225-4381-6339.png
5016	3	318	424	4425	484	8	0.91647	5 ноября 1941 г., среда № 261 (5016).	vol-5016-page-03-seg-001-0318-0424-4425-0484.png
5016	3	458	552	1487	742	3	0.95431	Массирование артиллерийского огня	vol-5016-page-03-seg-002-0458-0552-1487-0742.png
5016	3	282	754	968	1615	125	0.96671	В боевой практике артиллеристов N со- единения широко применяется массирова- ние огня. Такой огонь считается наиболее эффективным для воздействия на технику и живую силу врага на малых и средних дистанциях. Стрельба нескольких батарей иле дивизионов по одной цели позволяет создать в короткое время большую плот- ность огня. Этим достигаются моральное потрясение фашистских войск, надежное подавление и уничтожение целей. Под- вергнутые массированному обстрелу, нем- цы не успевают принять мер против все- сокрушающей мощи советских снарядов. В течение четырех с лишним месяцев вой- ны мы не раз совершали массированные огневые налеты, при зеленая корпусную ар- тиллерию, а иногда артиллерию соседа для подавления разнообразных объектов. К ним относились узлы сопротивления, вражеские батареи, скопления пехоты, танков, мото- рисованные колонны. В каждом таком слу- чае огромную роль играла внезапность налета.	vol-5016-page-03-seg-003-0282-0754-0968-1615.png
5016	3	282	1627	960	2053	60	0.96426	Внезапность обеспечивалась различными способами переносом огня от заранее пристрелянного репера или цели и полной подготовкой данных по карте. Каждая ба- тарея с наступлением рассвета пристрели- вала определенный бугорок, угол кукуруз- ного поля, развилку дорог шахматном порядке. Таким образом, где бы ни появ- лялась цель, москно было легко и быст- ро открыть по ней огонь, пользуясь дан- подготовленными по ближайшей точке.	vol-5016-page-03-seg-004-0282-1627-0960-2053.png
5016	3	278	2057	960	2840	107	0.96561	Управление массированным огнем обыч- но осуществлялось с пункта начальника артиллерии соединения. Когда появляется важная цель, штаб начальника артилле- рии передает его указание: кто привле- кается для стрельбы, каково количество отпускаемых снарядов. При этом, конечно, учитывались предельные нормы техниче- ского режима. Командиры батарей произво- дят соответствующие расчеты, затем до- кладывают о своей готовности. По коман- де "огонь" артиллерия одновременно на- чинает стрельбу. Батарея стреляет залпом. Насколько эффективен массированный огонь, видно из многочисленных примеров. Наибольший урон фашистским полчищам- наносился в боях за населенные пункты, когда, не считаясь с потерями, немцы лез- ли на прорыв густыми цепями и больши- ми колоннами. Наши артиллеристы косили врагов сотнями, громили множество ма- шин.	vol-5016-page-03-seg-005-0278-2057-0960-2840.png
5016	3	276	2848	956	3487	87	0.96616	Авиационная разведка донесла о сосредо- точении двухсот автомашин фашистского понтонного полка с переправочными сред- ствами. Пятиминутный огневой налет че- тырех наших дивизионов разогнал фаши- стов. Более двадцати машин остались раз- битыми в парке, остальные ринулись в разные стороны. Но скоро удалось немцам собрать рассеявшийся полк. Под городом Б. немцы в течение четырех часов сосредоточивались для наступления. Было замечено тринадцать батальонных колонн. Каждый раз, когда батальоны фа- шистов приближались к нам, массирован- ный огонь артиллерии преграждал им путь. Баллоны рассыпались, Потеряв 30--50 процентов своего состава, враг ослабил натиск.	vol-5016-page-03-seg-006-0276-2848-0956-3487.png
5016	3	280	3489	956	3561	13	0.95128	В боях за город Ч. мы несколько раз применяли массированный огонь по немец-	vol-5016-page-03-seg-007-0280-3489-0956-3561.png
5016	3	982	762	1665	3164	348	0.96246	ким узлам сопротивления. Эффективности этнх опневых налетов поражались сами враги. По показаниям пленных пенецкого 72-го пехотного полка, лишь за один дель боя нашей артиллерией выведено из строя 80 процентов командного и 70 процентов рядового состава этой части. На том ме- сте, гле располагались фашисты, ничего но осталось. Деревья вырывались с кор- нами. В этом районе была подавлена пена- блодаемая фашистская батарея. Борьба с вражеской артиллерией была ожесточенной и на других участках фрон- та. районе M. наши наблюдатели обнаружили четырехорулийпую батарею. Стиля бризантными гранатами, она по давала возможности нашей не хотел поднять- сковывала ес. Для падежного подавле- ния батареи был выделен дивизноп кор- пусной артиллерии. Вел огонь тов. Цаплин. готовились тщательно. На это не пожалели времени. Затрата его компен- справилась результатами. После короткого мощного полета одно вражеское оружие сказалось опрокинутым, три других подби- тыми. Их птенцы куда-то перетащили. Чтобы более свободно маневрировать траекториями при массировании огня, мы располагали опиевые позиции эшелониро- ванно в глубину. Даже легкие системы (конечно, исключая полковую и батальон- ную) находились не ближе четырех кило- метров передовым подразделениям пе- хоты. В борьбе с атакующими танками масси- рованный огонь часто оказывался нецеле- сообразным. Цель двигается - быстро, а на подготовку огня все же требуется известное время. В таких случаях лучше использовать огонь отдельных орудий (включая корпус- пые и зенитные) для стрельбы прямой на- водкой. В одном из боев наши 150-мм орудия подбили 8 танков из 16 атаковав- ших нас. В другом случае капитан Краси- коб и лейтенант Окуневский из таких же орудий разгромили немецкую конную ар- типлерию и 7 танков. Огневой вал один из видов чассиро- ванного отня - также нали причинялся. Достигалось полное подавление неприятеля. Нашей пехоте оставалось, не теряя удоб- ного момента и не отрываясь от степы разрывов, закрепляться на занятых ру- бежах. заключение несколько слов об ор- ганизации всякого рода плановых и не- плановых сосредоточений огня. Успех здесь в значительной мере определяется работой разведки. Своевременно обнаружить цель, достоверно определить местонахожде- - значит создать условия для макси- мального использования всей мощи артил- лерийского огня. В этом отношении наши артиллеристы были всегда на высоте свое- 10 положения. Нередко командир штаб соединения пользуются данными артилле- рийской разведки.	vol-5016-page-03-seg-008-0982-0762-1665-3164.png
5016	3	980	3166	1653	3547	50	0.96702	Нельзя упускать из внимания и связь Быстрота открытия огня нескольких бата- рей у нас обеспечивалась тем, что работ- ники штаба сами «сидели на проводах» немедленно доводя решение командира до исполнителей. Телефонистам же не прихо- дилось напоминать об их обязанностях, Если линия нарушалась ее немедленно восстанавливали. Полковник Р. БРИЧЕНОК. Южный фронт.	vol-5016-page-03-seg-009-0980-3166-1653-3547.png
5016	3	382	3617	1563	3701	6	0.97617	НАУЧНЫЕ РАБОТЫ ПРЕПОДАВАТЕЛЕЙ Куйбышевской ВОЕННО-МЕДИЦИНСКОЙ АКАДЕМИИ	vol-5016-page-03-seg-010-0382-3617-1563-3701.png
5016	3	278	3727	960	4269	68	0.95539	Профессора и преподаватели Куйбышев- ской военно-медицинской академии ведут большую научно-исследовательскую рабо- ту. Особенно напряженно проходит она сейчас, в дни великой отечественной вой- ны. Проблемы, над которыми работают профессура и научные сотрудники, имеют военно-прикладное значение. Группа пре- полавателей и профессоров недавно закон- чила ряд ценных трудов, которые будут использованы на фронте войсковыми врачами. Бригерач Осетров недавно защитил диссертацию на соискание ученой степени кандидата медицинских наук на тему: "Травматические поврежде-	vol-5016-page-03-seg-011-0278-3727-0960-4269.png
5016	3	984	3727	1659	4261	79	0.95635	нии уха, горла и носа и их этапное лече- ние». Успешно защитил диссертацию на те- му: "Причины пищевых токсико-инфек- ций» военврач 2-го ранга Львовский. Большой научный и практический ин- терес представляет диссертация военврача 1-го ранга Чутко: «Повреждения глаз в боевой обстановке и организация помощи". Оригинальность темы и блестящая ee разработка были специально отмечены Ученым советом академии, который реко- мендовал напечатать эту работу в каче- стве пособия для врачей действующей армии. Тов. Чутко присвоена ученая сте- лень кандидата медицинских наук.	vol-5016-page-03-seg-012-0984-3727-1659-4261.png
5016	3	1805	546	2936	692	9	0.93906	Налет советских самолетов на Данциг Кен Кенигсберг и Ригу	vol-5016-page-03-seg-013-1805-0546-2936-0692.png
5016	3	1691	706	2366	886	27	0.93266	В ночь с 3 на 4 ноября наши самолеты совершили налет на города - Данциг, Кенигсберг и Ригу. На военные и про- мышленные объекты этих городов сброшены	vol-5016-page-03-seg-014-1691-0706-2366-0886.png
5016	3	2382	702	3054	868	18	0.94071	фугасные и зажигательные бомбы. Наблю дались взрывы большой силы и люжары. Все налпи самолеты вернулись на свои базы.	vol-5016-page-03-seg-015-2382-0702-3054-0868.png
5016	3	1907	940	2834	1000	4	0.93424	Листовки для немецких солдат	vol-5016-page-03-seg-016-1907-0940-2834-1000.png
5016	3	1685	1020	2358	1495	67	0.94882	ЗАПАДНЫЙ ФРОНТ, 4 ноября. (От нашего корреспондента). Небольшой ли- сток синей бумаги. На нем снимок уби- того немецкого солдата Курта Дитриха. Ря- дом семейная фотография Дитриха --- жена, дети, он сам. Краткая и выразительная подпись: «Недавно он был вместе со своими близкими. Это его семейная фотография. Те- перь оп лежит убитый. Гитлеру еще мало могил на чужой стороне. Немецкий солдат! Такая участь ждет и тебя под Москвой».	vol-5016-page-03-seg-017-1685-1020-2358-1495.png
5016	3	1683	1513	2356	1903	53	0.95158	На другой стороне листка обращение Начинается оно так: «Немецкий солдат! Гитлер снова погнал тебя в наступление, обещая, что это последнее наступление, за которым последует отдых. Он бросает тебя на верную смерть". Далее листова говорит немецкому солдату, что война приносит выгоду только магнатам Рура, прусским по- мещикам, но не рабочим и крестьянам Гер- мании.	vol-5016-page-03-seg-018-1683-1513-2356-1903.png
5016	3	1683	1917	2354	2121	24	0.92719	"Бонсай войну! Не давай опутывать себя ложью, переходи на сторону Красной армии!» --- призывает листовка германского солдата. Тираж листовки 2 миллиона. Политуправлением фронта напечатаны	vol-5016-page-03-seg-019-1683-1917-2354-2121.png
5016	3	2382	1026	3052	1301	39	0.95707	на-днях еще две листовки, рассказывающие германскому солдату правду о войне. Ти- раж этих листовок - полтора миллиона эк землляров. Все листовки сброшены нашими летчиками на территории противника. Каждый дая листовка может служить пропуском для перехода на сторону Красной армии.	vol-5016-page-03-seg-020-2382-1026-3052-1301.png
5016	3	2382	1311	3052	1745	55	0.94420	южный фронт, 3 ноября. (По теле фону от наш, спец. корр. ). Советские ли- стовки, разбрасываемые ежедневно в ты сячах экземпляров на территории, временн занятой немецко-фашистскими войсками оказывают большое влияние на немецких солдат. Обманутые немецкие рабочие крестьяне, одетые в шинели, узнают в них правду о войне, о губительной поли- тике Гитлера, ведущего немецкий народ гибели.	vol-5016-page-03-seg-021-2382-1311-3052-1745.png
5016	3	2378	1763	3048	2115	47	0.93968	пленных немецких солдат часто об- наруживают листовки, спрятанные на гру- ди, люд бельем. Солдаты рассказывают что они прячут листовки потому, что офи- церы преследуют тех, кто читает листов- ки. По сведениям Политуправления фрон- та, за месяцы войны среди немецких солдат распространено свыше 60 миллио- нов экземпляров листовок.	vol-5016-page-03-seg-022-2378-1763-3048-2115.png
5016	3	1989	2191	2728	2252	3	0.97047	Хорошее полевое жилье	vol-5016-page-03-seg-023-1989-2191-2728-2252.png
5016	3	1683	2270	2354	2626	49	0.95489	ДЕЙСТВУЮЩАЯ АРМИЯ, 4 ноября (По телефону от наш, спец. корр. ). авиационной части, которой командует тов. Пруцков, заканчивается оборудование зем- лянок. Каждая из них рассчитана на 8- 10 человек. Все землянки построены на сухом месте. Стены и потолки укреплены бревнами и досками. Землянки имеют электрическое освещение и радиофициро- ваны.	vol-5016-page-03-seg-024-1683-2270-2354-2626.png
5016	3	1687	2640	2352	2886	32	0.95698	B землянках-общежитиях поставле ны железные кровати, тумбочки и вешалки для верхней одежды. Земляне отепляют ся металлическими времянками и кирпич- ными печами. В некоторых землянках под- разделения старшего лейтенанта Дунаева стены покрыты обоями,	vol-5016-page-03-seg-025-1687-2640-2352-2886.png
5016	3	2380	2270	3050	2558	42	0.95886	Образцовую землянку оборудовал воен- техник 2-го ранга Лихачев. У входа ее сделаны специальная решетка для очистка грязи с сапог и лестница. Землянка име- ет специальные помещения --- раздевалку для хранения обмундирования и спец- одежды, умывальник. Для каждого коман дира поставлена отдельная тумбочка.	vol-5016-page-03-seg-026-2380-2270-3050-2558.png
5016	3	2382	2572	3048	2882	38	0.95579	В ряде подразделений построены землян- ки-столовые. Эти же помещения одновре менно будут использованы как ленинские комнаты. В них вывешены портреты ру- ководителей партии и правительства, ок- тябрьские лозунги и т. д. Хорошо также оборудована землянка командного пункта части.	vol-5016-page-03-seg-027-2382-2572-3048-2882.png
5016	3	1743	4125	3002	4261	37	0.95043	Действующая армия. Старший авиатехник эскадрильи N авиачасти тов. Костюкое подал заявление о вступлении в кандидаты ВКП(б). На снимке: секретарь парт- бюро тов, Догадин (справа) принимает от Костюкова заявление и анкету. Снимок специального фотокорреспондента «Красной звезды» Г. Белянина	vol-5016-page-03-seg-029-1743-4125-3002-4261.png
5016	3	714	4351	1183	4393	2	0.94170	Ем. ЯРОСЛАВСКИЙ	vol-5016-page-03-seg-030-0714-4351-1183-4393.png
5016	3	514	4461	1403	4626	7	0.92079	Все силы народа - на помощь фронту	vol-5016-page-03-seg-031-0514-4461-1403-4626.png
5016	3	280	4658	956	5194	94	0.96037	В мире не было и нет армии, более тес- но связанной с народом, чем Красная ар- мия. Это - подлинно народная армия. бойцы, командиры, комиссары, политработ- ники - всв они - плоть от плоти своего народа, любят народ горячей любовью со- великих патриотов, не жалеют сил и са- мой жизни, чтобы отстоять свободу наро- да, его честь, достояние и жизнь. В гроз- ные дни отечественной войны не только в нашей стране, но и во всем мире растет восхищение Красной армией, мужественно принимающей на себя удары всей военной машины фашистских извергов, воюющих за порабощение человечества.	vol-5016-page-03-seg-032-0280-4658-0956-5194.png
