volume_number	page_number	x1	y1	x2	y2	tokens_count	mean_confidence	text	image
5823	4	252	5305	911	5628	47	0.96883	ЛОНДОН, 16 июня. (ТАСС) Штаб вер- ховного командования экспедиционных сил союзников сообщил том, что генерал Эйзенхауэр в сопровождении своего заме- стителя главного маршала авиации Тед- дера посетил 15 июня восточный сектор нормандского плацдарма. Они совешались с генералом Монтгомери, маршалом авиа- ции Кенингхэмом и другими английскими военными руководителями.	vol-5823-page-04-seg-013-0252-5305-0911-5628.png
5823	4	344	5684	823	5813	8	0.89148	Генерал Брэдли командует американскими наземными войсками во Франции	vol-5823-page-04-seg-014-0344-5684-0823-5813.png
5823	4	253	5832	911	5998	24	0.95813	ЛОНДОН, 16 июня. (ТАСС). Штаб вер- ховного командования экспедиционных сил союзников официально объявил, что гене- рал Брэдли командует американскими на земными войсками во Франции.	vol-5823-page-04-seg-015-0253-5832-0911-5998.png
5823	4	1011	548	2196	669	8	0.92274	Сообщения штаба верховного командования : экспедиционных сил союзников	vol-5823-page-04-seg-016-1011-0548-2196-0669.png
5823	4	936	702	1592	1115	64	0.96099	ЛОНДОН, 16 июня. (ТАСС). В опубли- кованном сегодня утром коммюнике штаба верховного командования экспедиционных сил союзников говорится: «Ни на одном участке фронта не про- изошло существенных изменений, но вой- ска союзников продвинулись дальше на запад от Пон л"Аббе (в 9 км. юго-запад- нее Сент-Мер-Эглиз). Все попытки про- тивника захватить инициативу потерпели неудачу; вражеские контратаки были ус- пешно отражены. Наша ударная сила не- уклонно возрастала.	vol-5823-page-04-seg-017-0936-0702-1592-1115.png
5823	4	933	1117	1588	1592	73	0.97819	15 июня авиация союзников совершила 3 тысячи самолетовылетов. Большое число вылетов произвели базирующиеся на аэро- дромы во Франции самолеты, атаковавшие объекты по указаниям армейских штабов. второй половине дня средние бомбар- дировщики наносили удары по складам горючего и снаряжения, мостам и другим коммуникационным объектам на всем про- тяжении от Валони на полуострове Ко- тантен до Лаваля и Домфрона, примерно 75 милях за линиями противника. Один средний бомбардировщик не вернулся на базу. Истребители-бомбардировщики и истреби-	vol-5823-page-04-seg-018-0933-1117-1588-1592.png
5823	4	934	1656	1588	1781	17	0.93940	ЛОНДОН, 16 июня. (ТАСС). В вечер- нем сообщении штаба верховного командо- вания экспедиционных сил союзников гсво- рится:	vol-5823-page-04-seg-019-0934-1656-1588-1781.png
5823	4	934	1789	1588	2196	63	0.98552	«Продвижение войск союзников в запад- ном направлении от Пон л'Аббе на полу- острове Котантен продолжается. Наши войска добились местных успехов в сек- торе Тилли-сюр-Сель, но город остается в руках противника. С обеих сторон отмеча- лись активные действия патрулей. Неблагоприятная погода утром снова ограничивала деятельность нашей авиации, которая свелась к патрулированию над районами высадки и прилегающими водами Ла-Манша, а также над непосредственной зоной боев.	vol-5823-page-04-seg-020-0934-1789-1588-2196.png
5823	4	1610	706	2268	1588	152	0.96841	тели, в том числе снабженные ракетными установками, действовали в течение всего дня, В числе объектов операции этих само- летов были железнодорожные депо в Ле Мане, Фужере, Майене, Вире, Гранвиле, Фолиньо и Шартре, а также мост через реку Орн. К востоку от Кана истребители- бомбардировщики атаковали войска и тан- ки противника, укрывающиеся в лесах и садах. Другие соединения самолетов под- вергли бомбардировке паромные переправы через Сену, наблюдательные посты, радио- станции, скопления артиллерии и несколь- ко мостов и железнодорожных линий воз- ле Сен-Ло. В этих операциях было унич- тожено 14 самолетов противника. Авиация союзников потеряла 7 самолетов. В ночь на 16 июня крупные соединения тяжелых бомбардировщиков атаковали ско- пления торпедных катеров, катеров-развед- чиков и тральщиков противника в гавани Булонь, а также железнодорожные центры в Валансьенне и Лане и склады горючего в Шательро. 14 бомбардировщиков не вер- нулись на свои базы. Несколько самоле- тов противника было уничтожено и повре- ждено над Францией ночными истребите- лями.	vol-5823-page-04-seg-021-1610-0706-2268-1588.png
5823	4	1608	1660	2264	2196	76	0.96737	15 июня военный корабль «Рэмильес» обстрелял вражескую артиллерийскую ба- тарею в Бенергиле на нашем восточном фланге и после артиллерийской дуэли, продолжавшейся несколько часов, заставил ее замолчать. Военный корабль «Нельсон» обстрелял к северу от Гавра вражескую батарею, державшую под обстрелом место якорной стоянки кораблей. Вражеские ба- тареи и скопления войск в течение дня обстреливались крейсерами союзников. На западном фланге американские корабли «Техас». «Невада» и «Арканзас» вели интенсивный огонь, поддерживая наши сухопутные части близ Изиньи и Каран- тана»,	vol-5823-page-04-seg-022-1608-1660-2264-2196.png
5823	4	1048	2275	2148	2375	8	0.93949	ПОЛОЖЕНИЕ В РАЙОНЕ ВЫСАДКИ ВОЙСК : союзников :	vol-5823-page-04-seg-023-1048-2275-2148-2375.png
5823	4	934	2395	1590	3893	251	0.96618	ЛОНДОН, 16 июня. (ТАСС). Специаль ный корреспондент агентства Рейтер Стринжер, находящийся с американскими войсками во Франции, в информации, да- тированной 15 июня, пишет, что в районе всего предмостного укрепления на полу- острове Котантен американские войска (которыми командует генерал Брэдли) про- должают отражать усилившееся сопроти- вление противника и атаки возрастающего количества танков противника, подброшен- ных, очевидно, из района Шербура для того, чтобы помешать продвижению амери- канских войск. Американские патрули снова вступили в Монтебур, за который ведется упорная борьба. Им удалось укре- питься в предместьях города. В то же бремя другие части начали обходить Мон- тебур, который после 3 суток непрерыв- ного обстрела представляет собой груду развалин ЛОНДОН, 16 июня. (ТАСС). Как пере- тает специальный корреспондент агентства Рейтер Мэзон, находящийся при штабе верховного командования экспедиционных сил союзников, после 10 дней ожесточен- ных танковых боев линия фронта союзни- ков на важном участке Комон--Тилли-сюр- Сель -Кан утром 16 июня оставалась почти без изменений. Обе стороны неодно- кратно уступали и вновь отвоевывали тер- риторию; но весьма ожесточенные бои по- прежнему ведутся вдоль всей линии. Некоторый успех достигнут союзниками районе Тилли-сюр-Сель, но в районе Виллер-Бокаж танки союзников под нати- ском противника отошли к пункту, нахо- дяшемуся примерно в 2,5 мили к юго-во- стоку от Комона. На западе американские войска посте- пенно расширяют свой клин в глубь полу- острова Котантен и находятся сейчас в 7,5 мили от Ла Э дюПюи и в 6 милях от Сен Совер-ле-Виконт - важных же- лезнодорожных узлов на магистрали, веду- шей к Шербуру. Если американцы смогут занять возвышенность к западу от Ла Э	vol-5823-page-04-seg-024-0934-2395-1590-3893.png
5823	4	1610	2400	2264	2660	39	0.97321	дю-Пюи, то они добьются господства над полуостровом Котантен. B Монтебуре попрежнему происходят уличные бои. Город уже несколько раз переходил из рук в руки, но занятие аме- риканскими войсками Киневиля упрочивает их положение в районе к северу от Мон- тебура.	vol-5823-page-04-seg-025-1610-2400-2264-2660.png
5823	4	1610	2670	2264	3089	69	0.96936	В штабе верховного командования экспе- диционных сил союзников утром 16 июня царило настроение уверенности. Предмост- ные укрепления союзников удерживаются прочно, и накапливание сил идет успешно. ЛОНДОН, 15 июня. (ТАСС) Как пере- дает корреспондент агентства Рейтер при штабе верховного командования экспеди- ционных сил союзников, крупная контрата- ка германских танков в районе Виллер Бокаж была отбита с большими потерями для немцев. Уничтожено 9 германских тан- ков «Тигр» и 8 танков «Пантера».	vol-5823-page-04-seg-026-1610-2670-2264-3089.png
5823	4	1606	3091	2262	3891	134	0.97388	ЛОНДОН, 16 июня. (ТАСС). Корреспон- дент агентства Рейтер при штабе верховно- го командования экспедиционных сил союз- ников Вильям Стин сообщает, что, по оцен- ке штаба, потери германской авиации за первую неделю военных действий во Фран- ции очень серьезны. Необходимость вос- полнить потерю 396 самолетов, уничтожен- ных союзниками, ляжет тяжелым бременем на германское самолетостроение. Потери союзников, составляющие менее одного про- цента числа действовавших самолетов, лег- ко восполнимы, если учесть, что англий- ские и американские авиационные заводы выпускают в среднем по одному самолету каждые пять минут. ЛОНДОН, 16 июня. (ТАСС). Корреспон- дент агентства Рейтер. находящийся с экспедиционными военно-воздушными си- лами во Франции, сообщил, что вечером 15 июня самолеты «Митчелл» из состава 2-го тактического авиационного корпуса совершили налет на штаб германской тан- ковой группы в районе Сен Вигор-де-Мезе- ре, примерно в 25 милях к западу от Кана.	vol-5823-page-04-seg-027-1606-3091-2262-3891.png
5823	4	1083	3968	2131	4053	7	0.95279	УЧАСТИЕ АМЕРИКАНСКОГО ФЛОТА В ОПЕРАЦИЯХ по вторжению	vol-5823-page-04-seg-028-1083-3968-2131-4053.png
5823	4	1227	4084	1587	4105	3	0.96985	Заявление морского м	vol-5823-page-04-seg-029-1227-4084-1587-4105.png
5823	4	931	4122	1588	5117	162	0.97103	ВАШИНГТОН, 16 июня. (ТАСС). Мор- ской министр США Форрестол сообщил на пресс-конференции, что американский флот, принимающий участие в операциях северного побережья Франции, насчиты- вает более 1.300 судов, в том числе 3 лин- кора («Невада», «Арканзас» и «Техас»), 3 крейсера («Аугуста», «Тускалуза» и «Куинси»), более 30 эсминцев, a также транспорты, эскортные эсминцы и десант- ные суда. Военно-морские силы США на- ходятся под командованием контр-адмира- ла Кэрка и составляют третью часть все- го флота вторжения Объединенных наций. Форрестол подчеркнул, что немцам не удалось осуществить предполагавшиеся мероприятия против вторжения во Фран- цию. Ожидалось, что германская авиация, легкие надводные корабли и подводный флот будут производить ожесточенные атаки, пытаясь помешать высадке союзных войск через Ла-Манш. Тот факт, что нем- ны не предприняли таких атак, привел к тому, что Германия Потеряла одну из лучших возможностей, представившихся ей в войне. Форрестол далее отметил, что немцы могли бы атаковать армию вторжения, ко- гда она была сконцентрирована в Англии или на пути к французскому побережью, когда туда медленно шли крупные соеди-	vol-5823-page-04-seg-030-0931-4122-1588-5117.png
5823	4	1600	4076	1967	4107	3	0.91174	астра США Форрестола	vol-5823-page-04-seg-031-1600-4076-1967-4107.png
5823	4	1606	4124	2260	4312	32	0.97247	нения, либо уже в месте назначения. Фор- рестол указал, что он не может понять почему немцы не атаковали, и что он склонен приписать это скорее отсутствию них возможности, чем отсутствию бди- тельности.	vol-5823-page-04-seg-032-1606-4124-2260-4312.png
5823	4	1606	4316	2264	5111	132	0.97018	Военно-морские силы союзников выпол- нили, по словам Форрестола, свою первую задачу, состоявшую в том, чтобы помочь войскам закрепиться во Франции. Сейчас военно-морские силы продолжают обеспе- чивать огневое прикрытие наступающим войскам, а часть кораблей начала конвои- ровать через Ла-Манш суда с новыми вой- сками. Союзники, которые прочно контро- лируют морские пути, будут продолжать доставлять войска и материалы во всё воз- растающем количестве. Форрестол подчеркнул, что скоростное строительство кораблей является одним из важнейших факторов обеспечения амери- канским флотом контроля на море на всех театрах войны. Строительство эскортных эсминцев и десантных судов шло скорее, чем предполагалось. Срок строительства эсминцев водоизмещением в 2.100 тонн с 30 месяцев сократился до 18, линкоров 52 до 45, авианосцев типа «Эссекс» c 44 до 30, подводных лодок-с 27 до 18. крейсеров водоизмещением в 10 тыс. тонн 50 до 27 месяцев.	vol-5823-page-04-seg-033-1606-4316-2264-5111.png
5823	4	1134	5172	2079	5226	3	0.97962	действия английской авиации	vol-5823-page-04-seg-034-1134-5172-2079-5226.png
5823	4	933	5247	1588	5634	61	0.96958	ЛОНДОН, 16 июня. (ТАСС). Английское министерство авиации сообщает, что вече- июня самолеты береговой авиации «Бофайтер» в сопровождении истребителей «Мустанг» атаковали германские суда, в ТОМ числе крупный торговый пароход. вспомогательные корабли, и 10 минных тральщиков Фризских островов. Два не- приятельских торговых судна были пото- плены, один вспомогательный корабль выбросился на берег, один минный траль- цик взорвался и затонул, а на 5 траль-	vol-5823-page-04-seg-035-0933-5247-1588-5634.png
5823	4	1604	5247	2262	5628	60	0.95725	щеках вспыхнули пожары. Кроме того, 2 минных тральщика были обстреляны из пушек. Все английские самолеты верну- лись на базы. ЛОНДОН, 16 июня. (ТАСС). По сооб- шению корреспондента агентства Рейтер при штабе верховного командования экспе- диционных сил союзников, крупные соеди- нения английских тяжелых бомбардиров- in иков совершили во второй половине дня 15 июня налет на неприятельские торпед- ные катеры в Булони.	vol-5823-page-04-seg-036-1604-5247-2262-5628.png
5823	4	1138	5699	2058	5740	5	0.93711	США ИСПАНСКИЙ ЭКСПОРТ В ГЕРМАНИЮ	vol-5823-page-04-seg-037-1138-5699-2058-5740.png
5823	4	933	5765	1588	5992	30	0.95364	Нью-порк, 15 июня. (ТАСС). Вашинг- тонский корреспондент агентства Тасс- шиэйтед Пресс передает, что, по получен- ным сведениям, государственный департа- мент предложил послу США в Испании Хейсу потребовать от испанского прави-	vol-5823-page-04-seg-038-0933-5765-1588-5992.png
5823	4	1608	5767	2262	5990	37	0.96065	гельства прекращения экспорта в Герма- нию всех важнейших материалов, в том числе вольфрама, оливкового масла, шкур кож, шерсти. Это новое требование вызва- но изм нением военной обстановки и нало- жением Португалией эмбарго на экспорт вольфрама в Германию.	vol-5823-page-04-seg-039-1608-5767-2262-5990.png
5823	4	2358	409	3545	540	8	0.96895	Шведская газета о советском поступление на Карельском перешейке	vol-5823-page-04-seg-040-2358-0409-3545-0540.png
5823	4	2285	557	2941	1290	131	0.96529	ГЕТЕБОРГ, 16 июня. (ТАСС). Газета «Гетеборгс хандельстиднинг" пишет: «События, происходящие теперь на Ка- рельском перешейке, не представляют ни- чего неожиданного: Россия действует так, как ей и подобало действовать после от- клонения Финляндией русских условий. Но интересно, на что рассчитывали в Хель- синки? Неужели там думали, что русские тихо и покорно скажут: «Ну, если вы не хотите, то ничего не поделаешь. Пускай всё останется, как было». Финны не пра- вы, полагая, что русские начали наступле- ние потому, что вторжение западных союз- ников облегчило их военное положение. Финны переоценивают свои возможности в борьбе с русскими. Россия имеет доста- точно средств для того, чтобы вести вой- ну в Финляндии и одновременно снабжать весь русский фронт всем необходимым. Странно, что Финляндия уже забыла про- исшедшее на восточном фронте в 1943 году. Все предупреждения английской и	vol-5823-page-04-seg-041-2285-0557-2941-1290.png
