volume_number	page_number	x1	y1	x2	y2	tokens_count	mean_confidence	text	image
5832	3	2916	1964	3576	2281	47	0.95731	Батальон, наступавший с фронта, мед- ленно продвигался, соевая группы враже- ских автоматчиков. Тем временем другой батальон потел без дорог. прямо по лес- ной гуще. Не встречая противника. он обошел опорный пункт, атаковать его овладел им. Немцы в панике бежали бро- сая исправные пушки, автотранспорт другое военное имущество.	vol-5832-page-03-seg-038-2916-1964-3576-2281.png
5832	3	2914	2287	3576	2925	97	0.95672	Соблюдение маршрута движения. орга- низация непосредственного охранения. ::: строгая маскировочная дисциплина. чет- кая связь всё это должно быть пред- метом постоянной заботы командира, Этс особенно важно ночью, когда все трудно- наступления в лесу усугубляются Командир одного полка получил задачу. двигаясь через лес, овладеть в глубине его населенным пунктом и отрезать тем са- мым путь отхода противнику. Плетстоял совершить ночной марш по болотистому ле- су, что и потребовало особо четкой орга- пизапии движения. Артиллерию оставили на походном положении. C собой взяли только 82-мм. минометы с боевым ком- плектом мин. И то и другое пришлось не- сти на руках.	vol-5832-page-03-seg-039-2914-2287-3576-2925.png
5832	3	2914	2935	3574	3391	73	0.95701	В голове колонны полка двигалась раз- вилка с саперами. За ней, в 100 метрах позади, шли автоматчики. Затем слово- вали главные силы полка. Каждая тота выслала в обе стороны дозоры попосред- ственного охранения, двигавшиеся парал- лельно всей колонне. Связь между бое- вым охранением и головой колонны глав- ных сил осуществлялась пипочкой. Комап- тир полка был связан с подразделениями по радио. Установлены были также сиг- палы ракетами, а в ротах и взводах - рожками.	vol-5832-page-03-seg-040-2914-2935-3574-3391.png
5832	3	2912	3397	3583	3716	44	0.96164	Полк вышел к назначенному пункту. Чтобы проверить, насколько точно выдер- жан маршрут, командир полка попросил командира соединения дать несколько артиллерийских выстрелов по тому пунк- ту, к которому требовалось выйти Это позволило окончательно уточнить место- нахождение полка. Маневр, искусно вы- полненный данный полком, имел большое	vol-5832-page-03-seg-041-2912-3397-3583-3716.png
5832	3	3595	629	4272	3645	437	0.95299	значение в деле разгрома довольно задачи- тельной группировки противника. Наибольшего эффекта обходящие подраз- деления достигают тогда, когда они пере- хватывают пути отхода противника. Их задача овладевать важными пунктами углами дорог и тем самым заставлять пре- сходить с дороги, бросать тех- пику. Так, стрелковый полк, дей- ствуя в глубине обороны противника, при- менил следующий маневр. По сведениям разведки было установлено, что против- ник несколькими отрядами, артилле- рней и другой техникой двигался на село Липовка, стремясь выйти на шоссе. Для перехвата путей немецкого отхода был выброшен стрелковый батальон, кото- рый с хода атаковал село и овладел им. Противник двигался на юго-восток не отдал наших войск в этом районе. На подступах к селу наш батальон вне- запно встретил его сильным огнем. Путь немцам был отрезан. Бросая в панике ма- нины, орудия и другое имущество, немцы стремились прорваться на юг, по попадали под огонь наших подразделений и уничто- оказались на месте. При выброске отряда на перехват пу- тей отхода противника необходимо зара- нее подготавливать подразделеняя, кото- рые должны своевременно оказать отряду помощь. В данном примере командир пол- ка так и сделал. Когда немцы начали предпринимать контратаки, пытаясь про- рваться Липовку, командир быстро выдвинул на занятый рубеж новые под- разделения. Совместными силами отряда и этих подразделений удалось не только отразить контратаки, по разгромить противляка. Были захвачены пленные п трофей. Во время преследования против- ника в лесисто-болотистой местности осо- бепное значение приобретают ночные дей- твия пехотных подразделений. задача не позволить противнику в течение но- чи закрепиться в тех пунктах, к которых отступил анем. Цель ночного преследо- вапия заключается также в том, чтобы помешать противнику оторваться или со- зершить перегрупчировку. Иными словами говоря, пало использовать ночное для по:трерываюств воздействия на про- реплика в ходе преследования. Ночной бой отрядов обычно проводится по заранее разработанному плану. Боль- шую. роль тут будут играть: предвари- : тельная подготовка личного состава, тша- тельная и заблаговременная разведка, увязка действий отдельных групп отряда и строжайшая маскировка. На одном уча- стке после напряженных сливных боев противник отошел к крупному селу, где начал закреплять я. По всему было вил- по, что немцы не преследования ночных условиях. Именно поэтому на- - по командование решило провести ночь- ной бой. Оно рыброспло вперед подвижный отряд. Тщательно соблюдая маскировку. отряд занял походное положение для атаки немцев в селе. Перед атакой были разведаны маршруты п обекты ее. Атака папалагь по условлому сигналу строит с одинаковых расстояний Про- не в состоянии был разобраться в большие потери, он оставил село. Весьма важно выходить кля агапкина такой рубеж, захват которого своим на- людмушества противника, когда располагается на выгодных позициях. Посточу нато стремиться тюникать фланги в ты.т противнику по таким направлениям, которые оп считает мало- тоступльемп пригодными для маневра - поступающей стороны.	vol-5832-page-03-seg-042-3595-0629-4272-3645.png
5832	3	3630	3651	4214	3714	5	0.91826	Подполковник П. РАЗДОРСВ действующая армия.	vol-5832-page-03-seg-043-3630-3651-4214-3714.png
5832	3	186	3793	453	3828	2	0.97502	И, ЭРЕНБУРГ	vol-5832-page-03-seg-044-0186-3793-0453-3828.png
5832	3	494	3793	1323	3870	1	0.95742	НАСТУПЛЕНИЕ	vol-5832-page-03-seg-045-0494-3793-1323-3870.png
5832	3	171	3895	846	6063	348	0.94663	Наше наступление потрясает прежде всего размахом. Огонь уже охватил всё небо Белоруссии. За одним фронтом ожи- вает другой. Прорывы расширяются, и на занад движется лавина. Битва в Белорус- сии идет от Западной Двины до Полесья. За первые дни боев освобождено бо- лее четырех с половиной тысяч пасе- ленных пунктов. Ожили заживо погре- бенные Витебск и Орша. Слышат шаги жизни Могилев и Бобруйск. События раз- ворачиваются пастельно быстро, что ра- стерялись не только немецкие генералы. но в Геббельс, он не успевает приду- мать смягчающих обстоятельств для отсту- поющего рейхсвера. Такого дейюта ны еще не видели. Один удар за другой, и все в пель без промаха. Там, где Красная Армия начинает поступать, птицы броса- ют всё и железобетонные укрепления, и орудья, и грозные приказы Гитлера: Как будто стоит кухоннику нажать кнопку, и рушатся немецкие дзоты. Московские нитчики узнали настоящую страду: салют за салютом. Это настолько похоже на на чало развязки, что грон московских ору- дий кажется биением огромного сердца: Россия при зрелище побед предчувствует последнюю победу. ": Как не похож этот нюнь на прошлогод- ний пуль! Тагила немны еще попытались наступать, а после Понырей и Прохоровки они яростно цеплялись за каждый клок земли. Орел и Белгород потребовали дол- рех недель. За год чы перевоспитали нем- пев. Мы научили их удирать. Мы выбили из них последние воспоминания о сорок первом. Мы настолько ослабили герман- скую армию, что июль 1943 года должен казаться немецким генералам доисториче- ским . счастьем. Донбасс, Минус, Днепр. Порсунь, Гомель, Смоленск, Новгород, Мга, поток Тернополь, Днестр, Одесса, Крым вот то солнце осени, зимы и весны, на котором растаяли немецкие дивизия. Не похоже это лето на прошлое и по клема- ту чира. Год тому назад Гитлер спокойно глядел па запал. Нормандия тогда была фрицев пляжем. Гитлер тогда думал отделаться Сицилией. Он перебра- сывал лигезин из Франции в Россию. Оп еще ног планировать, выжидать, выкру- унваться. Всё это позади. Наше новое на- ступление замечательно не только по сво- размаху в по достигнутым успехам, оно замечательно и потому, что это первое поступление красной Армии, под- держиваемое операциями союзников. Гит- дер больше не может маневрировать, Ему осталось одно гадать, где будет наве-	vol-5832-page-03-seg-046-0171-3895-0846-6063.png
5832	3	861	3891	1527	5909	323	0.95697	сеп очередной удар. Мясник превратился в вола у бойни. В этом пафос нового на- ступления. Было время, когда немецкая ложь от- равляла мир. Долгие годы Гитлер запуги- вал народы легендой о своей непобедимо- сти. Он был не полководцем, даже не по- титиком, а гипнотизером, усыплявшим же- лающих. Постепенно все разгадали приро немецкой лжи, даже американские изо- ляциописты, даже доверчивые обыватели, проживавшие в разных странах Европы и на разных языках говорившие, что им, де- скать, Гитлер не страшен. Эти балбесы давно прозрели. Теперь немецкая ложь превратилась в тот газ, который поража- ет войска, применяющие газы: желая об- уснуть мир, немцы обманывают себя. Ведь всего две недели тому назад песен- кие газеты глубокомысленно писали, что Красная Армия не будет наступать, так как, во-первых, у «русских истощились резервы», во-вторых, «русские предостав- ляют англо-саксам продолжать кампанию". Эти статьи были написаны не для нем- пев, а для англичан и американцев. Но последние усмехались: они ведь знали. что Россия сильна и что Россия никому не передоверила своего права перебить за- кватчиков, которые еще терзают Минск. Псков, Львов, Таллин, Каунас, Ригу. Кто поверил Геббельсу? Не Черчилль и не Руз- вольт. --- они хорошо знали, что Шербур и Витебск отчеркнуты на карте тегерапским карандашом. Немецкой лжи поверили только немцы. Фрицы в Витебске сняли пояса и ухмылялись: «Пусть те в Hop- мандии сражаются»... Читая сообщения Геббельса о русских потерях, фрицы бла- кепно засыпали. Их разбудил грохот на- ших орудий... Нал немецкой ложью теперь смеется весь мир. Бельгийские патриоты, пародируя немецких военных обозревате- лей, пишут в подпольной газете: «Больше- вики, начиная с июня 1941 года, потеря- ли по самым скромным расчетам в шесть с половиной раз больше, чем они ввели за это время в действие. Это много, но этого еще недостаточно. Однако не вправе ска- зать, что когда, благодаря эластичной обо- роне, красная Армия будет уничтожена в девятнадцатый или в двалпатый раз, мы увидим, что победа обеспечена одной из воюющих сторон». Теперь фрицы в Бело- руссии и в Нормандии расплачиваются за пежепкую ложь.	vol-5832-page-03-seg-047-0861-3891-1527-5909.png
5832	3	861	5913	1529	6055	22	0.95291	«Россия окончательно истощена», писа- ла в мае «Фелькишер беобахтер». Я не про- шу драпающего фрина сосчитать снаряды, падающие вокруг, или представить себе.	vol-5832-page-03-seg-048-0861-5913-1529-6055.png
5832	3	1550	3797	2216	4080	40	0.95900	сколько солдат его горят. Но может быть немецкие журналисты задумаются над пе- речнем генералов и полковников в при- казах нашего Главнокомандующего... Впро- чем эти журналисты уже строчат жалост- ливые отчеты о "невероятном скоплении русских и гигантской концентрации со- ветской техники".	vol-5832-page-03-seg-049-1550-3797-2216-4080.png
5832	3	1540	4087	2210	6052	316	0.95398	«Русские будут наступать против финнов, но предоставят англо-саксам са- мим расплачиваться за нормандскую аван- тюру», -писала 16 июня "Кракауэр цей- тунг». Я не знаю, что пишет сегодня эта газета. Выборг далеко от Кракова. Шер- бур еще дальше, но я думаю. что Жло- бин сильно обеспокоил краковских фрицев. у немцев были превосходные укрепления: они располагали и руками рабов и долгими месяцами затишья. Они устроили очередной вал. немецкие валы это классические беженцы. Был вель вал и в Нормандии. Что позволило Красной Армии в столь короткий срок опрокинуть очередной вал? Я назову в первую очередь пашу артиллерию. Из- давна мы гордимся нашими артиллериста- ми; даже в самые горькие дни муже- ство, их умение приподымали нас Мы возвели артиллерийское искусство на еще не быгалую высоту. Мы пеним приняли- ный огонь. Чем жила Германия в истекшую зиму, которая может быть окажется ее последней зимой? Мечтой о неуправляе- мых самолетах, со этих слепых орульях направленных против мирного на- селения. В ту же зиму мы удвоили утроили нашу артиллерийскую мощь. Мы знаем, в кого бьем, и пьем мы без про- маха. Перело мной записная книжка од- пого советского артиллериста. старшины Орлова. Короткие записи: "Вст огонь по немецкому тягачу с пушкой, прямым по- паданием уничтожил... Вел огонь по от- ступающему врагу, уничтожил взвода пехоты...". Я назвал "новое оружье" Гит- лера, его неуправляемые самолеты, слепым снайпером. А у налией артиллерии очень хорошие глаза, Прежде про русских пуш- карей говорили. что они комару в левый глаз попадут. Нелегко попасть в слона: пель большая, но шкура крепкая, нало знать, куда целиться. Мы скажем, что советские артиллеристы валят первого залпа. Неуправляемый самолет и наша артиллерия, вот символ двух миров. Мы много и часто писали о росте на- ших командиров. Я хочу сейчас подчерк- нуть одно: мы учились на трудностях; сопротивление материала помогло нам стать мастерами. Легкие успехи развиа- щают: тому пример германская армия. Это не знает, как трудно было разбить нем- цев в Сталинграде! Ведь это были силь-	vol-5832-page-03-seg-050-1540-4087-2210-6052.png
