volume_number	page_number	x1	y1	x2	y2	tokens_count	mean_confidence	text	image
5768	3	2952	2697	3620	4207	212	0.95595	Всё это тов. Козлов установил лично на месте. Знание работы первичных ор- ганизаций дало ему возможность вклю- чить в свой план наиболее злободневные вопросы и выдвинуть ряд мероприятий перед начальником политотдела: органи- зация планирования работы комсоргов полков и эскадрилий; пропаганда боевых итогов за день; организация помощи мо- лодым летчикам в овладении техникой; организация переписки с тылом. Вот одно из таких расписаний личной работы тсв. Козлова на время команди- ровки в полк: подготовить и провести совместно c командованием совещание комсомольцев о сохранении военного иму- щества; ознакомиться с практикой про- ведения заседаний бюро ВЛКСМ полка и присутствовать на нем; вручить комсо- мольский билет тов. Дроздецкому. Билет вручить в присутствии комсомольцев несоюзной молодежи; побеседовать с воз- душными стрелками комсомольцами тт. Косых и Ковбасюк о поведении в бою; провести собрание комсомольского актива. Из этого плана видео, что комсомоль- екий руковсцитель тщательно готовится к своему выезду в низовые комсомольские организации и оказывает действенную по- мощь комсомольскому активу. B N части тов. Козлов провел совеща- ние комсомольцев по уходу и сбережению пулемета. С докладом на нем выступили ---- опытные воздушные стрелки тт. Нисик- басов и Лозовой. Молодой воздушный стрелок тоз. Кропачев рассказал, как устраняет задержки пулемета в воздухе. Проведение подобного совещания было предусмотрено планом. Но пришлось тов. Козлову заняться и такой работой, кото- рая совсем не намечалась, проверкой	vol-5768-page-03-seg-057-2952-2697-3620-4207.png
5768	3	3643	2025	4299	2168	22	0.93654	комсомольского хозяйства. Вызвано это тем, что планы работы здесь составля- лись не так, как нужно, протоколы ве- дутся небрежно и т. п.	vol-5768-page-03-seg-058-3643-2025-4299-2168.png
5768	3	3639	2169	4295	2643	72	0.95017	Большое внимание со стороны комсо- мольского руководителя требуется воспи- танию актива. Как же организует эту работу тов. Козлов? Он прежде всего широко практикует созыв собраний акти- ва. Часто на них сам выступает с докла- лами. Активистов он вводит в курс рабо- ты, ставит задачи по воспитанию лич- ного состава и т. п. Кроме того, с акти- вом проводятся беседы, организуются до- клады, лекции. Часто комсомольские ап- тивисты собираются при политотделе на семинары.	vol-5768-page-03-seg-059-3639-2169-4295-2643.png
5768	3	3637	2658	4297	3281	91	0.94800	Постоянная забота о росте активистов и личное общение руководителя дают пре- красные результаты. За короткий срок многие комсомольцы заметно выросли и стали примерными волнами и вожаками молодежи. Так, например, тов. Лыков начал свою боевую работу рядовым лет- Сейчас оп командир эскадры- льп, член бюро ВЛКСМ. Тов. Лыков лично уничтожил до 190 автомашин и 70 танков противника. Тов. Александров Геннадий не так давно был также ря- довым летчиком. Сейчас оп старший лей- тенант, командир эскадрильи. Его полраз- деление по праву считается лучшим в части. Тов. Александрову присвоено зва- ние Героя Советского Союза.	vol-5768-page-03-seg-060-3637-2658-4297-3281.png
5768	3	3637	3291	4291	3433	14	0.95820	Эти товарищи, кроме боевой работы активно ведут агитацию, выступают докладами, руководят комсомольскими ср- ганизациями,	vol-5768-page-03-seg-061-3637-3291-4291-3433.png
5768	3	3631	3447	4287	4109	98	0.94918	Большое внимание уделяется и полн- тическому воспитанию несоюзной молоде- : же. Прежде всего несоюзная молодежь г-ячески приближают к работе комсомола. Молодых воинов приглашают на собрания, дают им отдельные поручения, помогают в учебе. В итоге они чувствуют, что ему интересуются, с ними считаются. Кроме этого созываются собрания несоюзной мо- падежи, изучается с ней устав комсомо- ла, проводятся беседы на разные темы, как то: «Кто может быть комсомольцем?» «Что такое ВЛКСМ и его задачи». Здесь взяты далеко не все стороны ра- боты комсомольского руководителя соели- нелия. Но и из этого видно, что опыт гов. Козлова полезно использовать другим комсомольским работникам.	vol-5768-page-03-seg-062-3631-3447-4287-4109.png
5768	3	3660	4124	4241	4197	5	0.92754	Капитан С. АЗАРОВ действующая армия.	vol-5768-page-03-seg-063-3660-4124-4241-4197.png
5768	3	3035	4257	4207	4303	5	0.95358	Помощь работников искусств детям фронтовиков	vol-5768-page-03-seg-064-3035-4257-4207-4303.png
5768	3	2941	4324	3606	5070	111	0.97487	Завтра Центральный дом работников ис- кусств в Москве открывает большой ве сенний базар в фонд помощи детям фрон новиков. В организации базара примут участие виднейшие мастера искусств, ли- тературы, музыки и кино. Лауреат Сталинской премии художник Соколов-Скаля написал для картинной гал- : лереи базара специальное панно. Зал ЦДРИ украшают работы других известных художников, скульпторов и графиков. Кар- тины и скульптуры подарены авторами фонд помощи детям фронтовиков. На книжной полке базар вниманию посетителей предлагается большой вы- бор книг и фотоавтографов виднейших писателей и поэтов страны. Нотный кюск располагает большим количест- нот музыкальных произведений, посвященных Отечественной войне с авто- графами наших крупнейших композиторов В фотокиоске -- фотокарточки мастеров театра, кино, балета, музыки, литературы.	vol-5768-page-03-seg-065-2941-4324-3606-5070.png
5768	3	3626	4322	4282	4711	59	0.97748	Известные художники, фотографы и кари- натуристы будут на базаре моментально исполнять заказы посетителей. В павильо- не звукозаписи можно будет записать свой голос. В комнате уникальных пластинок можно прослушать интересные граммзапи- си. В фойе организованы «уголки театров», лавка детских игрушек, парфюмерный, та- бачный и галантерейный ларьки, фруктовый киоск, цветочный магазин. Все товары в этих ларьках специально оформлены работ- никами искусств.	vol-5768-page-03-seg-066-3626-4322-4282-4711.png
5768	3	3626	4716	4282	5072	54	0.96473	B ежедневных концертах на базаре примут участие Краснознаменный ансамбль красноармейской песни и пляски, Государ- ственный русский народный хор имени Пятницкого, джаз-оркестр Л. Утесова, об- разцовый оркестр НКО СССР под управ- лением Чернецкого, солисты оперы и бале- та, ведущие актеры московских театров. На аукционе будут распроданы художе- ственные произведения, предметы личного обихода и другие товары.	vol-5768-page-03-seg-067-3626-4716-4282-5072.png
5768	3	369	6086	2645	6123	17	0.94818	одесском порту 10 апреля. 1. Горит взорванный немцами холодильник. 2. Немецкий эшелон с самолетами, захваченный нашими войсками	vol-5768-page-03-seg-068-0369-6086-2645-6123.png
5768	3	3381	6094	4122	6127	6	0.95744	Снимки нашего спец. фотокорр. А. Боровского	vol-5768-page-03-seg-069-3381-6094-4122-6127.png
5768	4	2010	330	2579	365	2	0.92352	красная ведьма	vol-5768-page-04-seg-001-2010-0330-2579-0365.png
5768	4	3562	328	4289	363	8	0.91118	13 апреля 1944 г., четверг. № 88 (5768)	vol-5768-page-04-seg-002-3562-0328-4289-0363.png
5768	4	403	438	1558	550	3	0.90655	Третья военная весна	vol-5768-page-04-seg-003-0403-0438-1558-0550.png
5768	4	423	561	1544	659	2	0.97501	колхозной деревне	vol-5768-page-04-seg-004-0423-0561-1544-0659.png
5768	4	303	671	965	1246	81	0.96086	Замечательные победы Красной Армии, сметающей врага с нашей священной зем- ля, воодушевляют колхозное крестьянство на новые трудовые подвиги. "Крестьяне Советского Союза, сказал товарищ Сталин, преобразовавшие в годы мир- ного строительства на основе колхозного строя отсталое земледелие в передовое сельское хозяйство, во время Отечествен- ной войны проявили небывалое в истории де рэвин высокое сознание общенародных интересов. Они самоотверженным трудом на помощь фронту показали, что совет- ское крестьянство считает нынешнюю войну против немцев своим кровным де- лом, войной за свою жизнь и свободу».	vol-5768-page-04-seg-005-0303-0671-0965-1246.png
5768	4	303	1258	959	1577	50	0.95166	Первые же дни весенних полевых ра- бот показали, что советская деревня и в нынешнем году стремится с честью вы- полнить свой долг перед Родиной. Несмот- ря па трудности военного времени, кол- хозники прилагают все усилия к тому, чтобы обеспечить страну и Красную Ар- мию хлебом и другими продуктами сель- ского хозяйства.	vol-5768-page-04-seg-006-0303-1258-0959-1577.png
5768	4	298	1588	956	1948	50	0.94965	Плодороднейшие районы, возвращенные нашей стране героической Красной Арми- eii--Украина, Кубань, Северный Кавказ, пентральные черноземные районы -долж- ны в 1944 г. сыграть важную роль в сель- скохозяйственном балансе Советского Сою- в и. Вся страна борется за то, чтобы вся площадь освобожденной от немецких оккупантов земли была полностью и B срок засеяна.	vol-5768-page-04-seg-007-0298-1588-0956-1948.png
5768	4	290	1960	950	2496	63	0.96224	В освобожденных районах проводится огромная работа. Восстанавливаются раз- рушенные фашистскими бандитами МТС колхозы, налаживается снабжение их сельскохозяйственными машинами, инвен- тарем, туда направляются опытные карты специалистов сельского зяйства. Десятки тысяч председателей колхозов, бригадиров, звеньевых в осво- бождепных районах окончили курсы специальные семинары. В течение зимы в одной только Ворошиловградской обла- сти подготовлено около 9 тысяч тракто- ристов, 300 бригадиров тракторных брита1, 450 ремонтных рабочих.	vol-5768-page-04-seg-008-0290-1960-0950-2496.png
5768	4	282	2502	944	3183	100	0.95888	Высокий патриотизм советских колх03- ипков вызвал новый подъем соревнования за повышение агротехники на колхозных полях, за увеличение урожайности и ва- лового сбора всех сельскохозяйственных культур. Из районов весеннего сева на- чали уже поступать первые сведения, говорящие о Xole сельскохозяйственных работ. В Узбекистане сев яровых колесо- вых п сахарной свеклы закончился. В разгаре сев люцерны и проса. Этпми культурами засеяно уже площадк, вдвое превышающая прошлогоднюю. Начался массовый сев хлопчатника. Колхозы ряда районов Азербайджана, выполнив план ярового сева, продолжают сеять сверх за- дания. Всего по республике засеяна яро- вымп культурами площадь, вчетверо боль- шая, чем к этому же времени в 1943 г.	vol-5768-page-04-seg-009-0282-2502-0944-3183.png
5768	4	277	3199	936	3628	64	0.96303	За пять рабочих дней выполнил план сева колосовых культур совх03 «Гигант» Восемьдесят процентов засеянной в нем площади занимает пшеница. Посев про- изведен отборными сортовыми семенами. Сейчас тракторный парк совхоза переклю- чен на подсев люцерны, боронование ози- мых, окончание бслашки поздних культур. Палата раннего нара, к которой присту- нает совхоз, будет произведена на плс- щади в 14 тысяч гектаров, - в два раза превышающей довоенную!	vol-5768-page-04-seg-010-0277-3199-0936-3628.png
5768	4	275	3637	931	3920	40	0.96035	Одним из ярких показателей возросшей организованности колхозной деревни яв- ляется то, что нервные полтора миллиона гектаров засеяны почти вдвое быстрее, чем в предыдущем году. Втрое по сравне- нию с 1943 г. возросли и темпы весенней вспашки, определяющие успех весеннего себа.	vol-5768-page-04-seg-011-0275-3637-0931-3920.png
5768	4	269	3934	925	4180	29	0.95993	Благоприятными для урожая являются метеорологические условия первого пе- риода нынешней весны. Медленное таяние снегов попеременным размерзанием почвы и кратковременным возвратом лодов и снегопадов способствовало погло- щению почвой талых вод.	vol-5768-page-04-seg-012-0269-3934-0925-4180.png
5768	4	263	4199	925	4984	120	0.96280	Для успеха весеннего сева и выполне- ния всего годового плана сельскохозяйст- васиных работ крупнейшее значение имеет хорошая работа тракторного парка. По плану, установленному правительством, намечен дальнейший рост механизации сельского хозяйства. Половина всех ве- сенних работ по обработке почвы будет проведена тракторамп, в то время как в прошлом голу тракторная обработка со- ставляла 43 процента. Годовой объем тракторных работ МТС, включая молотьбу, по Советскому Союзу в целом должен воз- расти по сравнению с 1943 г. на 50 про- тентов. Для того, чтобы выполнить это задание, работники МТС должны серьезно напрячь свои силы II ресурсы, резко улучшить свою работу и ликвидировать недостатки, имевшие место в пропiлом го- лу. Первые сведения с колхозных полей показывают, что МТС располагают для - этого всеми возможностями.	vol-5768-page-04-seg-013-0263-4199-0925-4984.png
5768	4	269	4997	917	5065	10	0.95562	Знаменателем факт, что мастерские МТС отремонтировали на 60 с лиш	vol-5768-page-04-seg-014-0269-4997-0917-5065.png
5768	4	977	675	1637	1244	72	0.96130	ним тысяч тракторов больше, чем прошлом году к атому же сроку. Ремонт тракторов и сельскохозяйственных машин был проведен высокими темпами благо- даря большой помощи, которую оказы- вает промышленность сельскому хозяйст- ву. Многие предприятия союзной и мест- пой промышленности, помимо выпуска своей основной продукции, изготовляют запасные части к тракторам и сельско- хозяйственным машинам. Инициатором этого явился артиллерийский завод имени Сталина, шефствующий над одной из МТС. Примеру артиллерийского завода последовало множество других предприя- тий.	vol-5768-page-04-seg-015-0977-0675-1637-1244.png
5768	4	979	1258	1633	1510	28	0.95616	Помощь, оказываемая промышленными предприятиями машинно-тракторным стоп- циям, этим не ограничивается. Они по- сылают в деревню бригады квалифициро- ванных рабочих, выделяют необходимые для ремонта машин материалы и инстру- менты.	vol-5768-page-04-seg-016-0979-1258-1633-1510.png
5768	4	975	1521	1629	1808	37	0.95498	С огромным подъемом работают сотруд- ники машинно-тракторных станций в ос- вебожденных районах. Ноказательно, что. подведя итоги соревнования по ремонту тракторов в феврале 1944 г., СНК СССР постановил вручить Ворошиловградской области переходящее Красное знамя Госу- дарственного Комитета Обороны.	vol-5768-page-04-seg-017-0975-1521-1629-1808.png
5768	4	969	1821	1625	2181	52	0.96539	Колхозники Ворошиловградской области обязались расширить нынешней весной посевную площадь на две трети, поднять качество полевых работ и вырастить вы- сокий урокай. С помощью государства они обеспечили себя семенами, отремонтирова- ли сельскохозяйственный инвентарь. Они вывезли на поля более 65 тысяч тони на- воза и 25 тысяч центнеров золы, чтобы быстрее поднять плодородие почвы.	vol-5768-page-04-seg-018-0969-1821-1625-2181.png
5768	4	961	2191	1617	2910	107	0.95707	На кубани все 164 МТС в срок отре- монтировали трактора и вывели их в по- ле. Перевыполняют задания по вспашке полей Львовская и Павловская МТС Крас- нодарского края. Хорошо ведут полевые работы машинно-тракторные станции Ставропольского края, Петровская МТС, например, получила недавно нереходящее Красное знамя Наркомзема СССР за ус- пешный ремонт машинно-тракторного пар- ка. Первыми в крае выполнили план сева ранних яровых колосовых культур колхо- зы, обслуживаемые Трудовой МТС. Работу они провели в сжатые сроки и на высо- ком агротехническом уровне. Колхоз имени Молотова, Изобильненского района, за шесть дней посеял колосовые на площади в 400 гектаров. В те те сроки посеял колосовые колхоз имени Кирова, Молотов- ского района.	vol-5768-page-04-seg-019-0961-2191-1617-2910.png
5768	4	959	2925	1612	3279	50	0.96835	Колхозники Буденновского района моби- лизовали все ресурсы для успешного проведения сева. Кроме тракторов, на по- лях работали 1.260 лошадей, волов и ма- лопродуктивных коров. В результате кол- хозы района, завершив сев ранних коло- совых культур, приступили к обработке почвы под поздние пропашные культуры и подготовила уже 10 тысяч гектаров пашни.	vol-5768-page-04-seg-020-0959-2925-1612-3279.png
