volume_number	page_number	x1	y1	x2	y2	tokens_count	mean_confidence	text	image
5551	1	1112	271	2336	333	3	0.93655	Смерть немецким оккупантам!	vol-5551-page-01-seg-001-1112-0271-2336-0333.png
5551	1	413	360	2370	719	7	0.97323	ЦЕНТРАЛЬНЫЙ ОРГАН НАРОДНОГО КОМИССАРИАТА ОБОРОНЫ СОЮЗА ССР	vol-5551-page-01-seg-002-0413-0360-2370-0719.png
5551	1	461	736	1795	793	8	0.95011	N: 180 (5551) 1 августа 1943 г., воскресенье	vol-5551-page-01-seg-003-0461-0736-1795-0793.png
5551	1	2096	740	2345	789	2	0.84759	ЦЕНА 20 коп.	vol-5551-page-01-seg-005-2096-0740-2345-0789.png
5551	1	2761	271	4199	343	5	0.86173	е г о д н	vol-5551-page-01-seg-006-2761-0271-4199-0343.png
5551	1	2499	364	3451	768	60	0.91779	От Советского Информбюро (1 стр. ). Майор В. Буков. -- Атака опорного пункта про- тивника с хода (2 стр. ). Подполковник Н. Шауров. --- Борьба с немецкими корректировщиками (2 стр. ). Полковник К. Прокопович. --- Маневр зенитными средствами (2 стр. ). Полковник И. Хитров. Разведка при наступле- нии (2 стр. ). М. Галактионов. -- Первая мировая война (3 стр. ).	vol-5551-page-01-seg-007-2499-0364-3451-0768.png
5551	1	3541	364	4501	768	52	0.91018	Подполковник И. Березин. - Пропаганда героизма (3 стр. ). ОБЗОР ПЕЧАТИ. - Не злоупотреблять тимати- : четкими полосами и подборками (3 стр. ). A. Твардовский. Дорога. Стихи (3 стр. ). E. Габрилович. --- Упорство (4 стр. ). Положение в Италии (4 стр. ). Шестьсот дней под властью немецких извергов (4 стр. ).	vol-5551-page-01-seg-008-3541-0364-4501-0768.png
5551	1	485	871	1696	1043	5	0.92597	Отлично организовывать каждый ночной бой	vol-5551-page-01-seg-009-0485-0871-1696-1043.png
5551	1	387	1064	1075	2916	269	0.94687	На Орловском направлении наши войска продолжают наступать. Враг унорно сопро- тивляется, предпринимая ожесточенные контратаки, но части красной Армии каж- дый день отвоевывают всё новые рубежи. Задача состоит в том, чтобы неустанно наращивать мощь ваших ударов по про- тивнику, наносить сму всё больший урон, настойчиво развивать успех наступления. Огромную роль в решении этой задачи призваны сыграть мужественные и умелые, отлично организованные ночные действия. Ночь всегда была верным союзником отважных и умелых воинов. В условиях современной войны роль ночных действий особенно возросла. Мощь огня обороны, обилие разнообразной боевой техники те- перь в ряде случаев ограничивают успех дневного боя. На одном участке фронта свыше недели продолжались бои за важную в тактическом отношении высоту. Чаша весов колебалась то в одну, то в другую сторону. Но стоило нашим подразделениям, отлично подготовившись, совершить смелый маневр ночью, - и задача была решена. Весь опыт войны говорит о том, что ночь благоприятствует действиям хорошо сколо- ченных войск, ведомых мужественными, искусными командирами. Темнота способст- вует внезапности удара, уменьшает поте- ри от огня противника, ослабляет его со- противление. Полностью использовать пре- имущества ночи для нанесения стреми- тельных и мощных ударов врагу пря- мая обязанность наших войск. Ночные действия, во многом облегчая решение боевых задач, связаны в то же время с рядом серьезных трудностей. Ма- лейший просчет командира, организующего ночной бой, малейшая оплошность рядового исполнителя влекут здесь за собой особен- но пагубные последствия. Действия ночью пред являют особенно высокие и жесткие требования ко всем сторонам организации управления боем. Здесь, больше чем где бы то ни было, нужна самая тщательная, предусмотрительная подготовка. Успех ноч- ного боя немыслим без образцовой слажен- ности, безукоризненной четкости действий всех до одного звеньев войскового орга- низма.	vol-5551-page-01-seg-010-0387-1064-1075-2916.png
5551	1	364	2924	1045	4717	255	0.94035	Опыт войны подчеркивает, что ночью нельзя увлекаться сложными маневрами, как бы заманчивы ни казались они на первый взгляд. Наши уставы требуют, что бы план ночного наступления был прост по замыслу, а войска получали ночью ог- раниченные задачи, прямолинейные корот- направления для атаки, Случайность. сопутствующая в той или иной мере всем боевых действиям, наиболее частый гость в ночных операциях. К тому же тем- нота, естественно, затрудняет управление войсками в динамике боя. Это обязывает к самой кропотливой и всесторонней разра- ботке плана ночных действий. В каждом отдельном случае, принимая решение на ночной бой, командир обязан всесторонне оценить обстановку, взвесить все ее эле- менты и заранее предусмотреть несколько возможных вариантов развития событий. Само собой разумеется, что успех ноч- ных действий во многом определяется тел. как работает войсковая разведка, насколь- ко хорошо известна система обороны про- тивника, его силы, условия местности Однако некоторые наши командиры учиты вают только одну сторону этого вопроса, сводя всю деятельность разведки лишь б изучению противника, Бесспорно, что это один из важнейших факторов боевого ***** обеспечения, но ограничиваться только этим было бы неправильно и пагубно. На- до не менее тщательно разведать также исходные рубежи наступления и атаки, на- метить пути движения и обеспечить их опознавательными знаками. В Н-ской "ча- сти командиры, выходя на рекогносциров- ку, взяли с собой проводников. Во время рекогносцировки проводники тщательно изучили подступы к вражеской обороне, установили маяки и ночью безошибочно вывели свои подразделения в указанные места. Должно быть правилом, что перед началом каждого ночного боя намечаются ориентиры на местности, определяются азимуты, указывают направления по луне звездам. Все силы, все средства нужно	vol-5551-page-01-seg-011-0364-2924-1045-4717.png
5551	1	1098	1066	1757	1246	24	0.93494	использовать для того, чтобы обеспечить быстроту маневра, скрытность движения и правильный выход в намеченные районы Это --- уже добрая половина боевого ус- пеха ночью.	vol-5551-page-01-seg-012-1098-1066-1757-1246.png
5551	1	1087	1254	1755	1977	112	0.95007	Известно, что в обороне немцы широко пользуются всевозможными заграждениями. Между тем, ночью любое, пусть даже са- ное малое, препятствие может превратить- ся в серьезную преграду, которая не толь- ко снизит темп движения, приведет к из- лицгним потерям, но и раскроет наступле- ние еще перед передним краем вражеской обороны. Это означает, что необходимо за- благовременно расчищать путь наступле- ния. Нельзя, конечно, да и не нужно, задаваться целью произвести полную расчистку по всей ширине полосы насту- пления. Для первого этапа боя достаточно выявить, где именно расположены минные поля и проволочные заграждения, и четко обозначить их. Не только командир, но и каждый боец обязан твердо знать места проделанных проходов, средства и способы преодоления оставшихся заграждений.	vol-5551-page-01-seg-013-1087-1254-1755-1977.png
5551	1	1077	1994	1742	2793	127	0.94865	В ночном бою главная роль принадле- жит пехоте. Но это ни в коей мере не умаляет здесь и роли других родов войск. Ночью, как и днем, нужно бить врага не растопыренными пальцами, а крепко стис- ноты кулаком, завоевывая победу соеди- ненными усилиями всех видов оружия. Не- обходима только подлинно образцовая орга- низация взаимодействия. Артиллерия минометы должны быть заранее подготов- лены к велению заградительного огня пе- ред фронтом и на фронтах наступающих, также к поражению важнейших целей. Многое могут делать ночью и наши танки. Надо только не запугивать себя трудностями ночного боя, не раздувать этих трудностей, умело преодолевать их, тщательно гото- вить каждую танковую атаку. В темноте танкисты, как и лехота, не должны увле- каться сложными маневрами, применяя на- шины для коротких ударов, продвигаясь в боевых порядках пехоты.	vol-5551-page-01-seg-014-1077-1994-1742-2793.png
5551	1	1066	2804	1730	3749	143	0.94286	Всё это в полной мере относится и действиям авиации. Ее активная поддержка может и должна играть немалую роль в исходе каждого ночного боя. Случается однако, что некоторые общевойсковые командиры, планируя ночные действия, или вообще упускают из виду авиацию, или выдвигают перед ней чрезвычайно общие, расплывчатые задачи. Немудрено, что таких случаях наши летчики не находят объектов для бомбардировки и порой сбра- сывают бомбовый груз не там, где тре- буется по обстановке. В ходе войны вы- явилось уже немало испытанных способов обозначения направлений для своих само- летов, указания целей для их удара и ру- бежей, где находятся свои войска. Надо полностью использовать все эти приемы. От пехотных командиров нужно настойчиво требовать самого педантичного выполнения всех правил взаимодействия с авиацией на поле боя. Ночью, как и днем, ни одного вылета вхолостую, ни одной бомбы мимо цели такова задача, которую нельзя решить успешно без помощи пехотных командиров.	vol-5551-page-01-seg-015-1066-2804-1730-3749.png
5551	1	1049	3757	1717	4434	91	0.93635	Ночной бой предъявляет повышенные требования моральным качества воина. Сплоченность части, самообладание бойцов и командиров, их умение в любых условиях действовать решительно и пред- приимчиво --- это один из основных фак- торов успеха. «Ночной бой тем и хорош, писал Драгомиров, --- что при нем не видно, кто сильнее, и бьет только тот, кто отважнее и не боится гибели». Когда сознанием этого проникнется каждый бо- ец, когда мастерское управление ноч- ным боем будет неизменно сочетаться с мужественными, решительными действиями всех до одного бойцов и командиров, ничто не сможет преградить пути к успе- xy.	vol-5551-page-01-seg-016-1049-3757-1717-4434.png
5551	1	1045	4442	1709	4715	41	0.92897	Продуманно и кропотливо, не упуская из виду ни одной мелочи, подготовлять каждый ночной бой. Не давать немцам ни минуты передышки, под покровом темно- ты, как и день, настойчиво и решительно уничтожать живую силу и технику врага, очищать от него советскую землю!	vol-5551-page-01-seg-017-1045-4442-1709-4715.png
5551	1	647	4814	1436	4882	3	0.86468	Героизм 15 гвардейцев	vol-5551-page-01-seg-018-0647-4814-1436-4882.png
5551	1	360	4903	1020	5123	29	0.94044	ДЕЙСТВУЮЩАЯ АРМИЯ, 31 июля. (По телеграфу). Взвод прикрывал перегрупны- ровку батальона. В это время пошли в контратаку немецкие танки: впереди три тяжелых, за ними средние. За танками двигались автоматчики.	vol-5551-page-01-seg-019-0360-4903-1020-5123.png
5551	1	352	5127	1019	5636	71	0.93331	Будем драться, - сказал гвардии лейтенант Никифоров парторгу роты гвар- дии старшему сержанту Ойскольду. Оба они поглядели на бойцов, которые находились в траншее. Вот залегли у пулемета, ожи- дая команды "огонь", гвардии красноар- мейцы Говоров и Батеха. Крепко сжали в руках автоматы гвардии сержант Копейко, гвардии красноармейцы Крестин, Булатов, Кудебердинов и Ревин. Уверенно ждали врага бронебойщики гвардии лейтенант Плюснин, гвардии сержант Бутырин, гвар- дии красноармейцы Амиров, Трушин, Лис- няков и жидков.	vol-5551-page-01-seg-020-0352-5127-1019-5636.png
5551	1	349	5639	1011	6148	76	0.94090	Стреляя из пушек и пулеметов, немен- кие танки подходили всё ближе. Первыми же выстрелами бронебойщики Амиров и Трушин подбили два танка. Остальные ма- шины остановились неподалеку от траншеи усилили огонь. Гвардейцы неотступно следили за дей- ствиями врага. Как только Никифоров по- дал команду «огонь», ливень свинца об- рушился на немецких автоматчиков. Завя- зался жаркий бой. Немцы непрерывно стреляли из автоматов и танкового ору- жия. Один снаряд разорвался в траншее п серьезно ранил гвардейцев Трушина и Ли-	vol-5551-page-01-seg-021-0349-5639-1011-6148.png
5551	1	1038	4909	1704	5784	131	0.94704	снякова. В единоборство с тяжелым тан- ком вступил гвардии сержант Бутырин и несколькими выстрелами поджег его. Хладнокровно и уверенно один за дру гим выводил из строя немецкие танки гвар- дни красноармеец Амиров. Он поджег еще две машины, подбил тяжелый танк. Гро- хот вражеских снарядов и свист пуль не страшили отважного бронебойщика. Еще несколько выстрелов, --- и горит четвер- тый тань. Осколком снаряда отбило сочни- ки у противотанкового ружья. Гвардеец Ампров, спокойно подоткнул под ружье ши- нельную скатку и продолжал вести огонь. Немецкие автоматчики кинулись было вперед, но встреченные пулями, залегли, понеся новые потери. Опять горстке храбрецов попытались прорваться враже- ские танки, но и эта попытка была без- успешной. Снова целится Амиров, глаз его попрежнему верен, рука тверда, Выстрел, еще выстрел стола дыма взлетает над пятой вражеской машиной, подожжен- ной его пулей.	vol-5551-page-01-seg-022-1038-4909-1704-5784.png
5551	1	1032	5789	1694	6146	51	0.94176	Вот уже немецкие автоматчики пытают- ся спастись бегством. Их подкашивают гвардейцы огнем станкового пулемета, ав- томатов, винтовок. Бой кончился. Перед траншеей героев стояло восемь подбитых и сожженных тан- ков, на подступах к ней лежало 050.10 сотни убитых гитлеровцев. Гвардейцы по- терь не имели, кроме двух раненых в са- мои начале боя	vol-5551-page-01-seg-023-1032-5789-1694-6146.png
5551	1	1842	863	3053	1039	8	0.96267	ОТ СОВЕТСКОГО ИНФОРМБЮРО Оперативная сводка за 31 июля	vol-5551-page-01-seg-024-1842-0863-3053-1039.png
5551	1	1783	1056	3110	1575	99	0.92183	В течение 31 июля наши войска на ОРЛОВСКОМ направлении, преодолевая сопротивление и контратаки противника, продолжали наступление и заняли не- сколько населенных пунктов. На БЕЛГОРОДСКОМ направлении -- усиленные поиски разведчиков. Донбассе в районе ЮГО-ЗАПАДНЕЕ ВОРОШИЛОВГРАДА наши войска про- должали успешно отбивать атаки крупных сил пехоты и танков противника с большими для него потерями. На ЛЕНИНГРАДСКОМ фронте в районах севернее и восточнее Мга --- усилен- ные поиски разведчиков. В течение 30 июля на всех фронтах наши войска подбили и уничтожили 103 немецких танка, из них 95 в района Донбасса. В воздушных боях и огнем : зенитной артиллерии сбито 58 самолетов противника.	vol-5551-page-01-seg-025-1783-1056-3110-1575.png
5551	1	1774	1666	2430	1743	7	0.91894	На Орловском направлении наши войска продолжали наступление.	vol-5551-page-01-seg-027-1774-1666-2430-1743.png
5551	1	1762	1759	2430	2438	87	0.93713	Севернее Орла Н-ское соединение заняло несколько населенных пунктов. Немцы оказывали упорное сопротивление и неод- нократно переходили в контратаки. За день боя уничтожено более 800 солдат офицеров противника. Кроме того, тяжелые потери понесли гитлеровцы от огня гвар- дейцев-минометчиков. Большая колонна немецкой пехоты, двигавшаяся по шоссе, была накрыта огнем наших минометных подразделений и в большей своей части уничтожена. Бойцы части, где командиром г. Лихошвай, выбив противника из одного населенного пункта, захватили у немцев 12 орудий, 14 минометов, 20 пулеметов, 6 противотанковых ружей, много автома- тов, винтовок и склад боеприпасов.	vol-5551-page-01-seg-028-1762-1759-2430-2438.png
5551	1	1755	2453	2419	2888	62	0.92374	Восточнее Орла бойцы Н-ской части результате боя овладели сильно укреплен- ными позициями немцев. Противник, пыта- ясь восстановить положение, предпринял одну за другой четыре контратаки, но по- нес большие потери и был вынужден от- ступить. На поле боя подсчитано до 600 вражеских трупов. Захвачены 5 орудий, из них 2 самоходных, 2 врытых в землю танка, 7 минометов, 16 пулеметов и дру- гие трофеи.	vol-5551-page-01-seg-029-1755-2453-2419-2888.png
5551	1	1747	2907	2410	3226	45	0.92427	Южнее Орла Н-ское соединение отрази- ло три контратаки немцев. На другом уча- стке бойцы Н-ской части овладели онор- ным пунктом противника. В бою за этот пункт сожжено 8 немецких танков, уни- чтожены артиллерийская и две минометных батареи. На поле боя осталось свыше 200 трупов гитлеровцев,	vol-5551-page-01-seg-030-1747-2907-2410-3226.png
