volume_number	page_number	x1	y1	x2	y2	tokens_count	mean_confidence	text	image
5299	3	2390	4489	3067	5864	212	0.96003	даром вовлечь врага в невыгодные для него операции, вынудить его к рискован- ному выдвижению и разброске своих сил чтобы мощным внезапным ударом пороки нуть и разбить их. Для такого маневра нужно не только знать, но и понимать своего противника, верно уловить его сла- бые струнки и вызвать его демонстратив- пыми действиями на неосторожный ма невр. Это военная хитрость, примененная широком оперативном плане. Бутузов применял ее с величайшим искусством и тонкостью. Весной 1811 г. в качестве главнокоман- дующего Кутузов прибывает в русскую Молдавскую армию. Армия примерно в 46.000 человек -кордоном располагается на Дунае; ее предыдущие действия были неудачны; настроение в войсках подавлен- ное. Против русской армии на протево- положном (правом) берегу Дуная группи- руются крупные турецкие силы под коман- дованием Ахмет-бея. Агентурные данные определяют их в 75.000 человек, на самом деле турок было больше. В бою под Рущуком Кутузов опрокинул турецкие силы и принудил их к отступле- нию. Но преследовать противника Кутузов не стал. Больше того, он отступил сам, при- казал разрушить укрепление Рущука и переправил свои войска через Дунай и отошел с ними к Бухаресту. Турки начали переправу через Дунай. Кутузов, намеренно заменивший турок На левый берег, выделил из своих войск небольшой отряд под командованием ген. Маркова, который ночью переправился че- рез Дунай и напал там на ожидавшие пе- реправы турецкие обозы.	vol-5299-page-03-seg-061-2390-4489-3067-5864.png
5299	3	2380	5874	3047	6297	65	0.95757	Под натиском отряда Маркова турецкие обозы, не оказав сопротивления, разбежа- лись, оставив без боеприпасов и продоволь ствия армию Ахмет-бея, переправившуюся на левый берег. Положение этой армии- оказалось критическим, и вскоре она при- нуждена была капитулировать. В войне 1812 г. полководческий гений Кутузова достиг вершины своего развития Здесь, как никогда, проявились его нужен- ство в самых тяжелых обстоятельствах и решимость взять на себя всю полноту от	vol-5299-page-03-seg-062-2380-5874-3047-6297.png
5299	3	3083	4493	3757	5404	142	0.95732	бетственности за судьбы армии и родины Действия Кутузова наглядно показыва ют, как находить выход при самых за труднительных обстоятельствах, никогда не упуская времени и возможности на нести поражение противнику, оригинально подходить к решению задачи и поражать врага внезапностью нападения, создавая преимущества путем военной хитрости. Вечер 26 августа (по старому стилю). Только что окончилось Бородинское ораже- ние. Обе стороны остались на своих пози- циях; сражение долевно возобновиться с утра 27 августа, но потери в армии очень большие, и Кутузов решает отступить к Москве. Уже тогда Бутузов должен был решить вопрос и о судьбе самой Москвы. Это решение потом 1 сентября высказал на военном совете в Филях. «Вы боитесь отступления через Мо-- скву, - говорил он, a я смотрю на это, как на провидение. ибо это спасет армию. Наполеон как бурный поток, который мы еще не можем остано- вить. Москва будет губкой, которая его	vol-5299-page-03-seg-063-3083-4493-3757-5404.png
5299	3	3075	5412	3745	6004	90	0.95869	В этих словах высказана мысль главно- командующего дальнейшем поведении русской армии. Пока французская армия находится в Москве, русская армия дол- жна произвести такое движение, которое поставило бы ее в выгодное положение отношению к французской. Отвела свою армию от Москвы по Ря- занской дороге и прикрыв ее отход ка- зачьими частями, Кутузов от Кулакова неожиданно повернул армию вправо и по вел ее по правому берегу р. Пахры в на- правлении Подольска. Арьергардным ка- зачьим отрядам, оставшимся на Рязанской дороге, было указано увлекать преследую- щие французские части в направлении Коломны и Рязани	vol-5299-page-03-seg-064-3075-5412-3745-6004.png
5299	3	3069	6016	3737	6305	37	0.94005	9 сентября русская армия вышла Красной Пахре на Московско-Калужской дороге и расположилась здесь лагерями возведя оборонительные сооружения южному берегу Пахры. Французские аван- гарды, наткнувшись у Боровского моста на казачьи части, принудили их отсту- лить. Преследуя казаков, французы	vol-5299-page-03-seg-065-3069-6016-3737-6305.png
5299	3	3763	4495	4457	6089	249	0.95319	Бронниц; казаки здесь рассеялись французы с удивлением узнали, что через этот пункт русская армия не проходила Наполеон, когда ему стало об этом из- вестно, терялся в догадках, куда могла деваться русская армия, Кутузов же в это время сообщал царю: «До сих пор полу чаю я сведения об успехе моего фальши вого движения: неприятель идет за каза каки, оставленными мною на Рязанской 10роге». В 1814 г., в сражении при Шампобере, Наполеон говорил одному русскому генера лу: «Ваша хитрая лиса Кутузов меня сильно подвел своим фланговым маршем». Русская армия оказалась на фланге напо- леоновской армии. Она угрожала его ком- муникациям, прочно опиралась на свою ба- зу --- Калугу, обволакивала французские войска, находившиеся в Москве, партиза- нами и находилась ближе к Смоленску, чем французская армия. Искусно совершенный Кутузовым флан- говый марш сильно измени. положение борющихся сторон в пользу русской ар- мии. Наполеон всеми последующими свои- Ми действиями, 10 выхода из Москвы и после оставления ее, не мог устранить той опасности, которую создал ему Куту- 30 В фланговым маршем. Попытка его у Малоярославца прорваться на Ка- лужскую дорогу оказалась неудачной. Кутузов был готов дать французам ре- шительное сражение. Но преимущество в силах и средствах было теперь на стороне русской армии. Наполеон не пошел на новое сражение. В Малоярославце он при- знал себя побежденным и приказал отсту- пать к Можайску, чтобы двинуться на Смоленск по той дороге, по которой его армия пришла в Москву. От Малоярослав- ца армия Наполеона пошла навстречу своей гибели; только жалкие остатки ев в декабре 1812 г. перешли русскую гра-	vol-5299-page-03-seg-066-3763-4495-4457-6089.png
5299	3	3759	6091	4433	6269	24	0.94745	Пзучая настеретво маневрирования Ку тузова, командир Красной Армии изощ- ряет свой ум и волю для самостоятельных действий в иных, более сложных условиях современной войны	vol-5299-page-03-seg-067-3759-6091-4433-6269.png
5299	3	3919	6279	4383	6321	3	0.96306	Полковник Н. Подорожны	vol-5299-page-03-seg-068-3919-6279-4383-6321.png
5299	4	2124	486	2715	520	8	0.94369	C H A 3 В Е Д А	vol-5299-page-04-seg-001-2124-0486-2715-0520.png
5299	4	3695	478	4429	510	7	0.87393	6 октября 1942 г., вторник. 235 (5299)	vol-5299-page-04-seg-002-3695-0478-4429-0510.png
5299	4	472	596	2344	719	6	0.98291	Воля народа к борьбе и победе	vol-5299-page-04-seg-003-0472-0596-2344-0719.png
5299	4	781	723	2047	789	3	0.90896	«Радуга»-повесть Ванды Василевской)	vol-5299-page-04-seg-004-0781-0723-2047-0789.png
5299	4	388	813	1050	1403	110	0.96186	Прошлой зимой, в лютые морозы, на яс- ном небе видна была радуга. Ее замечали в разных местах. Ее видели и в одной ук- раинской деревне, которую за месяц перед тем заняли немцы. Онп были поражены странным явлением. Солдаты смотрели ту- по: может быть, это так и полагается большевиков, чтобы зимой бывала радуга? Немецкий офицер капитан Курт Вернер не- доумевал. Он изучал Россию перед войной, владел русским и украинским языком. Он знал, что зимой не бывает радуги. Что же означает это странное явление? Он не по- нимал этого, как не понимал и иногого другого. Россия была совсем не такой, как об этом написано в немецких книгах, по которым он готовился войне.	vol-5299-page-04-seg-005-0388-0813-1050-1403.png
5299	4	388	1415	1044	1552	22	0.95396	Радута тревожила его. Он спросил у ста- рой крестьянка Федосии Кравчук, в избе которой жил вместе со своей любовницей, жалкой продажной тварью:	vol-5299-page-04-seg-006-0388-1415-1044-1552.png
5299	4	388	1562	1040	1626	5	0.93276	Говорят, радуга доброе предзнамено- ванне...	vol-5299-page-04-seg-007-0388-1562-1040-1626.png
5299	4	380	1642	1042	1985	50	0.95405	Старая крестьянка пожала плечами. Да, да, говорят, радута --- доброе предзнаменование... - странным голосом от ветила она. Федосия думала о своем, непрестанно ду- мала о своем, и радуга доброе предзна - менование, сливалась у нее с мыслями о чудесном часе освобождения, мыслями приходе Красной Армии, о расплате с вра- газги.	vol-5299-page-04-seg-008-0380-1642-1042-1985.png
5299	4	378	1999	1040	2378	59	0.95868	Писательница Ванда Василевская вме- сто с Красной Армией проделывала ес путь. Вместе с Красной Армией она про- шма украинские села, ставшие ей такими близкими и родными. Она видела, как провожают прощальным взглядом красно- армейцев, эти взгляды врезались глубоко в душу, они рождали великую скорбь и святой гнев, нежную любовь к тем, кто остался во власти врага, и неутомимую мести.	vol-5299-page-04-seg-009-0378-1999-1040-2378.png
5299	4	372	2388	1034	3095	109	0.96390	Мы вернемся, мы придем, гово- рила она вместе с другими, и эти слова звучали, как клятва. Она видела радугу знала, что это привет далекого севера, чтс эти полыхающие розовые, фиолетовые. зеленые лучи, раскрасившие украинское небо, прошли через Ленинград и Москву и дивная картина природы сливалась с образом грядущего освобождения народа. Радугу Ванда Василевская избрала сим- волом для своей новой повести, которая стала значительным событием в советской литературе, выделилась, вышла на первое место среди художественных произведений, посвященных войне. С волнением читаешь эту повесть, в которой суровая правдивость сочетается с т.лубоким патриотическим чув- свои, в которой ненависть к врагу, лю- бовь к родине выражены такими сильны- ми, волнующими словами и образами.	vol-5299-page-04-seg-010-0372-2388-1034-3095.png
5299	4	366	3103	1028	3659	100	0.96450	В повести описана одна украинская де- ревня, события, которые разыгрались в те- чение нескольких дней. Но такова жизнен- ность и типичность людей и явлений, что перед читателем раздвигаются широко рам- ки повести - перед ним вся Украина под залогом немца, все оккупированные места нашей родины, вся наша страна, и хотя Красная Армия появляется только в заклю- чительной главе, о ней все время идет речь, она все время перед глазами, как эта радуга на небе, как эта непоколебимая ве- ра в сердце, что наши придут, что победа будет за нами, что враг будет уничтожен, и все горькие обиды народа будут ото-	vol-5299-page-04-seg-011-0366-3103-1028-3659.png
5299	4	360	3671	1022	3952	44	0.95194	«Радуга» - это повесть. Но это призыв командирам Красной Армии: почните, братья, ни на минуту не забывайте, что вас тут, на вас наде- ются, что мысль о вашем приходе поддер живает людей в страшных их страданиях, в смертельной тоске одних, в героической борьбе других.	vol-5299-page-04-seg-012-0360-3671-1022-3952.png
5299	4	354	3960	1020	4590	110	0.96309	Обычная деревня. Крест-накрест распо- ложилась она у большой дороги. Так опи- сывает ее старая крестьянка разведчику Красной Армии, он, человек из чужих краев, чувствует себя в этой деревне, как в своей, родной. Немцы уж месяц как за- наш ее, заполнили несколько домов на площади, расселись по хатам, но дерев- ня осталась своей, и у каждого колхозни- ка, каждой колхозницы боец Красной Ар- получит необходимые ему сведения. Деревня захвачена немцами, но она не вы- шла из боя. Она участвует в войне своими средствами, и немцы это знают, чувству- ют, и начальник немецкого отряда капи- тан Курт Вернер приходит в бешенство от сознания своего бессилия. Деревня за- хвачена, но она не покорена.	vol-5299-page-04-seg-013-0354-3960-1020-4590.png
5299	4	348	4600	1014	5513	159	0.96316	Все было сделано немцами, чтобы сми- рить, подчинить народ, заставить признать власть немцев, заставить забыть о прош- лом, о советской жизни, о советской стра- не, разорвать все связи с Красной Армией, с другими советскими народами. Виселица стоит посреди деревни, и на пей для уст- рашения крестьян раскачивается на ветре труп молодого парня. Он пытался пробрать... ся партизанам. Под горой у речки ле- жат трупы убитых месяц назад красноар- мейцев. Они погибли в бою за эту дерев- ню. Немцы не позволяют хоронить их, не позволяют снять с виселицы труп парня. Удалось запугать этим деревию? Нет. За- гутаны в деревне только немцы. Страх владеет всеми и солдатами и офицерами. деревне остались только женщины, дети, старики: Но немцы чувствуют себя в ней, как в осажденной крепости. Проис- ходят странные, загадочные для них явле- ния. Они схватили партизанку и бросили в сарай. Мальчишка пробрался к сараю, чтобы дать пленнице кусок хлеба. Маль- чишку немцы застрелили. Но его труп пропал Как это могло случиться?	vol-5299-page-04-seg-014-0348-4600-1014-5513.png
5299	4	348	5525	1008	5768	37	0.95386	Дьявольские места, говорит один солдат. Кто его мог взять? Рашке гово- рит, что они ничего не слышали. А ведь снег скрипит при каждом движении. - Кто может знать. мрачно пробор- мотал другой. Разве тут поймешь что- нибудь?	vol-5299-page-04-seg-015-0348-5525-1008-5768.png
5299	4	344	5774	1006	6097	51	0.95293	Мать послала Мишку на опасное дело... Мать пробралась по снегу и похитила опасностью для жизни труп мальчика-ге- роя. Мать тайно похоронила его в своей чтобы немцы не надругались над телом, и другие дети, крошечная Зина и малыш Сашко, помогали матери и пони мали, что это делается против врага, про- тив немца	vol-5299-page-04-seg-016-0344-5774-1006-6097.png
5299	4	1078	817	1736	918	18	0.93946	Мать, Федосья Кравчук, тайно пробный рается на берег и заботливо убирает труп своего сына Васи, вмерзший в землю.	vol-5299-page-04-seg-017-1078-0817-1736-0918.png
5299	4	1076	934	1732	1072	21	0.96341	Мать, партизанка Олена Костюк, поте рявшая мужа на войне, приходит с опас- ностью для жизни в деревню, чтобы дате жизнь сыну.	vol-5299-page-04-seg-018-1076-0934-1732-1072.png
5299	4	1070	1090	1732	1574	82	0.96059	«В деревне триста домов, и из каждого кто-нибудь да пошел на войну». Эта справка освещает повесть. Кровными ни- тями деревня связана с Красной Армией... В деревне триста домов. и в каждом есть мать. Великим чувством материнства про- низана вся повесть. Из глубочайшего чув- ства материнской любви рождается вели- чайшая ненависть к врагу. Из образа по- руганной матери возникает образ поруган- ной матери-родины. У каждой матери сын, и все сыновья в Красной Армии, и вся Красная Армия стала родной, сыновней в каждой деревне.	vol-5299-page-04-seg-019-1070-1090-1732-1574.png
5299	4	1068	1594	1728	1762	24	0.95799	Мать воина... Мировая поэзия знает мно- го сильных художественных образов этой матери. Во время Крымской войны в 1854 году Некрасов написал свои знаменитые стихи	vol-5299-page-04-seg-020-1068-1594-1728-1762.png
5299	4	1142	1786	1626	2025	31	0.95550	Одн Одни я в мире подсмотрел Святые, искренние слезы - То слезы бедных матерей! Им не забыть своих детей, Погибших на кровавой ниве, Как не поднять плакучей иве Своих поникнувших ветвей...	vol-5299-page-04-seg-021-1142-1786-1626-2025.png
5299	4	1064	2043	1724	2286	43	0.95952	Сильный для своего времени образ. Но Ванда Василевская показывает нам мате рей, которые не плачут. Смерть сына от руки врага зажигает в материнском серд- це чувство, которое сильнее скорби, в ко- тором личная боль растворяется, перера- стает в ненависть к врагу, в месть.	vol-5299-page-04-seg-022-1064-2043-1724-2286.png
5299	4	1060	2302	1720	2547	39	0.96079	Немцы убили Мишку. Маленькая Зина плачет. Рыдания подступают к горлу нате ри, Малючихи. Она кормила, халита десять лет сынишку. Малючиха боится, что не выдержит, что сейчас завоет на всю дв- ревню страшным материнским плачем. Но она говорит сурово дочке:	vol-5299-page-04-seg-023-1060-2302-1720-2547.png
