volume_number	page_number	x1	y1	x2	y2	tokens_count	mean_confidence	text	image
5628	3	924	4224	1588	4512	38	0.94818	Источник идейности, боеспособности, ор- ганизованности комсомола в руковод- стве большевистской партии, ее вождей Ленина и Сталина. С полным основанием мы говорим партия большевиков наш разум, наша воля, наша сила, наша родная мать, взрастившая и вскормившая комсомольское племя. (Аплодисменты).	vol-5628-page-03-seg-019-0924-4224-1588-4512.png
5628	3	237	4626	901	4812	24	0.93201	Война явилась суровой и жестокой про- веркой физических и моральных качеств нашей молодежи. Надо считать доказан- ным, что наша молодежь эту проверку войной выдержала.	vol-5628-page-03-seg-021-0237-4626-0901-4812.png
5628	3	235	4814	903	6133	173	0.95788	Война вместе с тем явилась и гене- ральной проверкой для комсомола, при- званного в новой обстановке всей своей работой помочь большевистской партии сплотить советскую молодежь на борьбу немецкими захватчиками. Надо считать доказанным, что комсомол, как передовой отряд советской молодежи, ату проверку выдержал. Товарищи, всю нашу молодежь, весь комсомол воодушевляют слова приветствия Центрального комитета нашей большевист- ской партии, в котором сказано: «В Великой Отечественной войне совет- ская молодежь проявила высокое сознание своего долга перед Родиной и несокруши- мую волю к разгрому врага. Она явилась достойной преемницей героических трали- ций нашего народа, боевых традиций пар- тпп большевиков. Молодые советские воп- летчики, танкисты, артиллеристы, пехотипны, бойны всех родов войск, юные партизаны и партизанки бесстрашно бьют- ся с подлыми захватчиками. Наши юноши и девушки, заменяя на производстве ушел на фронт отцов и старших братьев. напряженным трудом помогают Брачной Армии громить врага. Советская молодежь успешно овладевает знаниями, техникой производства в военным делом Комсомол горячо взялся за восстановление хозяйства и культурных учреждений в районах, ос вобожленных от немелкох погромнаков Молодые патриоты отдают все свои силы щите укреплению социалистического отечества".	vol-5628-page-03-seg-022-0235-4814-0903-6133.png
5628	3	924	4624	1586	4952	43	0.94440	Комсомольцы и молодежь приняли к неуклонному исполнению указание това- рища Сталина о необходимости перестать быть беззаботными, мобилизовать себя и перестроить всю свою работу на новый, военный лад, не знающий пощады врагу. Наша молодежь смело пошла навстречу опасностям и неизбежным трудностям во енного времени.	vol-5628-page-03-seg-023-0924-4624-1586-4952.png
5628	3	924	4956	1584	5281	46	0.95135	Иначе советская молодежь и не могла ответить на призыв вождя. Каков образ жизни людей, таковы их мысли, --- учит товарищ Сталин. Образ жизни нашей мо- лодежи --- новый, советский. Большевист ское, советское воспитание обеспечило вы- работку у нашей молодежи качеств, ха- рактеризующих нового человека нашего времени.	vol-5628-page-03-seg-024-0924-4956-1584-5281.png
5628	3	924	5286	1584	5609	50	0.95638	Партия прививала нашей молодежи сме- лость и отвагу, скромность, настойчивость в достижении поставленной цели, беспре- дельную любовь к Родине, яростную нена- висть к ее врагам, неиссякаемую веру в правоту нашего дела. и девушка в нашей стране растут в сознании того, что ист в жизни высшего счастья, чем счастье быть бойцом.	vol-5628-page-03-seg-025-0924-5286-1584-5609.png
5628	3	922	5617	1584	6121	78	0.95230	Мы не хотим жить, как трава растет Комсомолец, молодой патриот Родины хо- чет не просто жить, а жить и бороться бороться и побеждать! (Аплодисменты). Немецкие громилы, ворвавшись на на- шу землю, неслыханными злодеяниями- массовыми убийствами пи в чем неповин- вых людей, пытками, грабежамп, пожара- ми, хотели сломить волю советского народа к борьбе. Но гитлеровские мерзав- по просчитались! Червяк никогда не пой- мет тушение полета. --- пол зать летать не может. Немецкие захват- не понимают и когда не поймут	vol-5628-page-03-seg-026-0922-5617-1584-6121.png
5628	3	2322	880	2983	1094	16	0.89262	Участок Пнiра-Полок - обнаружены : мины. Участок Шваровка--Погодино 80 взрывов пути. Участок Плюсса-Борисов. Было 350 взрывов.	vol-5628-page-03-seg-027-2322-0880-2983-1094.png
5628	3	2315	1098	2979	1313	30	0.95130	Участок Дрисса-Свольно. Поезд наско чит на мину. Разбит вагон с танками. Участок Лида-Молодечно. Поезд паско- чил па мину. Вышли из строя предохра- нительные вагоны, паровоз и два следую- их вагона.	vol-5628-page-03-seg-028-2315-1098-2979-1313.png
5628	3	1614	880	2298	3776	323	0.94608	природу советского человека. чело- век живет не только для себя, но прежде всего для общества, для народа, его волю к борьбе пе слоиншь инчем. Чтобы сломить волю таких людей к борьбе, па- до убить всё их окружающее, надо убить народ, страну. По яспо, что убить пашу страну невозможно! Всё преходяще, парол бессмертен, учат товарищ Сталин. " (Аплодисменты). Война против немецких захватчиков в всем величин раскрыла те материальные и духовные силы, ко- торые покорил наш парод за годы совет- ской власти. Она па- глядно показала, ка- . . . . замечательные люли выросли в па- шей стране, какие пелечерпаемые та- лапты поднялись по народных масс. «Мы знаем, - - го- ворпл Лепин, что есть десятки, тысяч резервов рабо- че-крестьянской мо- лодежи, которые идут нам тем более ши- роко, с тем большим самоотвержением, чем нам труднее», : В дал суровых не- --- пытапий наша моло- ложь, комсомольцы практическими дела- подтвердили эти слова Лепина. Мил- лионы комсомольцев взяли в руки ору- жие, чтобы отстоять честь, свободу, неза- виспмость нашей Ро- дины. В огне боев выросло их уменье, закалились воля мужество, созрела смертельная пена- ВЕСТЬ немецким захватчикам. Эти чувства руководили комсомольцами и молодежью, когда они в трудные дня вместе со страшный вставали на защиту Одессы, Севастополя, Тулы, Сталинграда, Москвы от нашествия немецких полчищ. Эти чувства руководят комсомольцами и молодежью славного города Лепина, герон- чески защищающегося от немецких зах- ватчиков. Приведу только две цифры девять из каждых десяти комсомольцев Ленинграда на фронте. Каждый второй комсомолец в Ленинграде награжден орде- ном пли медалью. (Аплодисменты). Эти чувства руководят комсомольцами и молодежью, борющейся с немцами по ту сторону фронта, в тылу врага. По призы- ву товарища Сталина во временно заня- тых районах широко развернулась парти- запская борьба, Партизанское движение под руководством партийных организаций выросло в крупную стратегическую силу Верховного Главнокомандования. Среди пар- тизан-подрыванов большую часть сос- тавляют комсомольцы и молодежь. В рука партизан недавно попал документ, из ко- горого видно, как действуют народные мстители, как чувствуют себя захватчика на пашей земле.	vol-5628-page-03-seg-029-1614-0880-2298-3776.png
5628	3	1613	3783	2277	4180	49	0.95270	Вот что говорится в утреннем сообще нии дирекции государственных железных дорог в Минске от 19 сентября 1943 года «Положение очень напряженное! Дейст- ваня партизан невыносимо увеличиваются. Сохранять движение c переключением больше невозможно, так как железнодо- рожные линии подвергаются нападению партизан. Все узловые вокзалы переполне- ны из-за невозможности использования линий».	vol-5628-page-03-seg-030-1613-3783-2277-4180.png
5628	3	1613	4186	2277	4362	25	0.94427	В донесении о «чрезвычайных происше- ствиях» за сутки перечислены десятки крушений, произведенных партизанами. Вот отрывок из этого документа о проис шествиях только за 1 час.	vol-5628-page-03-seg-031-1613-4186-2277-4362.png
5628	3	1607	4497	2275	5007	69	0.94467	Комсомольцы и молодежь тыла вместе со всем народом упорно и настойчиво рабо- тают над выполнением задачи, поставлен- ной товарищем Сталиным, - обеспечить Красную Армию всем необходимым для разгрома врага. За время войны в промышленность, на транспорт, в сельское хозяйство влились миллионы новых рабочих, среди которых значительную долю составляет молодежь. Только из школ Ф30, ремесленных и же- лезнодорожных училищ в промышленность и на транспорт пришло полтора миллиона юношей и девушек.	vol-5628-page-03-seg-033-1607-4497-2275-5007.png
5628	3	1605	5013	2273	5757	102	0.94997	Героическими усилиями нашего рабоче- го класса в годы войны, несмотря на труд- нейшие условия, достигнуты большие ус- пехи. Только за последний год производи- тельность труда в основных отраслях на- шей промышленности серьезно выросла: танковой - на 38 проп.; в авиационной на 30 прод.; в электропромышленности на 27 проц.; в промышленности воору- жения на 15 проц. Возрос и валовой вы- пуск продукции. Безусловно, в завоевании этих успехов сыграла свою роль и моло- дежь, составляющая большинство рабочих на многих предприятиях. Немало сделали комсомольцы и моло- дежь в сельском хозяйстве. И здесь, так же как и в промышленности, комсомол выступил инициатором ряда патриотиче- ских начинаний.	vol-5628-page-03-seg-034-1605-5013-2273-5757.png
5628	3	1607	5766	2265	5916	20	0.95547	Необходимо подчеркнуть, что и в про- мышлепнисти, и на транспорте, и в сель- ском хозяйстве замечательно показывает себя женская молодежь,	vol-5628-page-03-seg-035-1607-5766-2265-5916.png
5628	3	1603	5920	2265	6121	26	0.92377	В первые же дни войны товарищ Сталин поставил задачу. пепрерьев готовить людское резервы пополнения Красной Армии. С этой целью в стране было введено всеобщее военное обучение.	vol-5628-page-03-seg-036-1603-5920-2265-6121.png
5628	3	2311	2725	2969	2865	13	0.94198	Участок Новозыбков --- Новгород-Север СКИЙ - взорваны пути. Участок Унеча--Кричев. 100 взрывое пути.	vol-5628-page-03-seg-037-2311-2725-2969-2865.png
5628	3	2307	2869	2967	3011	17	0.95546	Участок Иржач- Сураж --- 20 взрывов Вот она всепородная война против не мецких захватчиков! (Бурные аплодисмен ты).	vol-5628-page-03-seg-038-2307-2869-2967-3011.png
5628	3	2307	3017	2969	3195	25	0.94884	В рядах народных мстителей выросло много замечательных героев, чьи имена известны каждому гражданину нашей Ро- дины. На примерах их борьбы будут вос- питываться многие поколения.	vol-5628-page-03-seg-039-2307-3017-2969-3195.png
5628	3	2298	3199	2967	4364	175	0.95506	Ленин указывал, что Россия способна давать не только одиночек героев, но мо жет выдвигать этих героев сотнями, тыся- чами. Массовый характер героизма совет- ских людей в дли Отечественной войны подтверждает эти слова Владимира Ильича твердо верившего в творческие силы, храб- рость и мужество нашего народа. Доста точно сослаться на такой факт, как герои- ческое форсирование нашими войсками Днепра. 866 бойцов, офицеров и генералов получили звание Героя Советского Союза за успешное осуществление этой операции. 0 массовом характере героизма нашей мо- лодежи говорят и такие цифры. Только первое полугодие этого года в Красной Ар- мии награждено орденами и медалями бо- лее ста тысяч комсомольцев. Среди Героев Советского Союза более пятисот ком- сомольцев воспитанников комсомола. Путь к геройству открыт для каждого мо- лодого человека нашей Родины, для бой- ца любого рода оружия, для каждого мо- лодого партизана и партизанки! СЕГОДНЯ, от имени комсомола и всей советской молодежи мы посылаем горячий привет и пожелания новых боевых успе- хоз нашим бойцам, офицерам, генералам, мужественным партизанам и партизанкам, комсомольцам и комсомолкам, находящимся в рядах Действующей Армии из парти- занских отрядах. (Аплодисменты).	vol-5628-page-03-seg-040-2298-3199-2967-4364.png
5628	3	2294	4497	2958	5482	132	0.95156	счел своей обязанностью при- нять активное участие в работе всевобу- ча. Силами комсомольцев и молодежи бы- ли оборудованы десятки тысяч военно- учебных пунктов. По инициативе моло дежи, желающей получить более высокую военную подготовку, в системе всевобуча были созданы комсомольско-молодежные подразделения снайперов, автоматчиков, пулеметчиков, минометчиков, истребителей танков, специальные снайперские школы. Война вызвала известные трудности в работе школ. Понадобилось серьезнее и глубже помогать учителям в воспитании детей, значительно больше, чем это было до войны, заниматься вопросами мате- реально-бытового обеспечения школ и уча- щихся. Комсомольцы и молодежь зарабо- тали и собрали десятки миллионов руб- лей для детей, пострадавших от немеп- ких захватчиков, собрали и изготовили около трех миллионов различных предме- тов, в том числе обувь, одежду, белье. На текстильных предприятиях для детей в неурочное время только за один месяц выработано свыше 7 миллионов метров ткани.	vol-5628-page-03-seg-041-2294-4497-2958-5482.png
5628	3	2292	5489	2948	5641	17	0.94627	Такова пеполная характеристика уча- стия комсомольцев и молодежи в Отече- ственной войне советского народа против немецких захватчиков.	vol-5628-page-03-seg-042-2292-5489-2948-5641.png
5628	3	2277	5647	2947	6114	61	0.95036	Ленин говорил, что политической жизни месяпы военного времени зачис- ляются историей за годы. Условия мир- ной жизни породили серьезные пробелы в воспитании нашей молодежи. В ходе войны молодежь нашла в себе лостаточ- но сил, чтобы эти пробелы в значитель- ной мере исправить. Комсомольцы, моло- ложь фронта и тыла проходят суровую школу воспитания в бою труде. Они многому научились, накопили большой опыт	vol-5628-page-03-seg-043-2277-5647-2947-6114.png
5628	3	3000	882	3666	2231	211	0.94786	: Наша молодежь научилась не чураться любой черновой работы, без колебании на любой участок, куда требует Ро- дина. Советская молодежь научилась боль- ше, чем это было до войны, видеть ве- ликое в малом. Сбор лома, например является будничным делом. Но без лома нет металла, а без металла нет пушек, снарядов, танков, самолетов. Молодежь осознала это, и вот ее будничный труд дал стране 4 миллиона топи лома лом этот собран молодежью в неурочное вре- : мя. Можно сослаться и на другие факты. Сотни тысяч пионеров и учащихся вы- езжали в этом голу, так же как и в пре- дылущем, на уборку урожая, на сбор да- корастущих полезных растений. Наша ио- лолежь глубоко осознала, что не можем вырвать победу врага лишь пеной огромных 'усилий, ценой напряжения всех наших сил, использования всех паших возможностей. Советская мслолежь поняла. что в такой войне, какую прохолптся вести нашему народу, важны и пены труд и усилия каждого человека. Защита отечества есть первая и свя- теплая обязанность каждого гражданина Советского Союза. Помня об этом, комсо- мольцы, молодежь, начиная готовиться 25-й годовщине комсомола, говорили самый лучший способ отметить юбилей - это еще лучше воевать, еще лучше рабо- тать и учиться. На предприятиях, в колхозах молодежь новой силой развернула в эти дни со- циалистическое соревнование. Со всех концов страны, с предприя-	vol-5628-page-03-seg-044-3000-0882-3666-2231.png
5628	3	3040	2337	3193	2370	1	0.93932	Говарищи	vol-5628-page-03-seg-045-3040-2337-3193-2370.png
5628	3	2998	2372	3658	2590	29	0.93993	Красная Армия, поддерживаемая всем нашим народом, нанесла врагу тяжелые удары. Но было бы неправильным успо- каиваться на достигнутом. Такое бах- вальство п зазнайство вредно и недостой- но для нас.	vol-5628-page-03-seg-046-2998-2372-3658-2590.png
