volume_number	page_number	x1	y1	x2	y2	tokens_count	mean_confidence	text	image
5476	2	227	2928	899	3495	93	0.95172	Товарищ Сталин указал, что немец- армия, каб и вся Германия, пережи- вает кризис. Да, зимой мы нанесли немцам не один крепкий удар. Одна наша часть освободила от фашистской нечисти десят- ки сёл и деревень, спасла от рабства ты- сочи советских людей. Наши бойцы непло- хо знают свое оружие, умеют применять его в бою. Но в сталинском приказе под- черкнуто, что нам нельзя успокаиваться на достигнутом. Будем еще настойчи- вее совершенствовать боевое мастерство, еще глубже осваивать боевой опыт, чтобы в решающих сражениях крепче разить вра- ra, бить его наверняка. Глубокой любовью своей военной про-	vol-5476-page-02-seg-008-0227-2928-0899-3495.png
5476	2	918	2142	1590	3495	192	0.95469	фессии дышала речь командира-разведчика тов. Королева: Товарищ Сталин поставил перед на- ни особо важную задачу: «Изучать против- ника, улучшать разведку - глаза и уши армии, помнить, что без этого нельзя бить врага наверняка». Мы выполним это тре- бование Верховного Главнокомандующего. Будем еще прилежнее вести разведку, по- вышать свои боевые навыки, Наши лучшие люди орденоносцы Шелемахин и Брусков передают опыт молодым бойцам, учат их действиям в сложной обстановке. Мы уве- рены, что недалек тот день, когда Красная Армия совместно с армиями наших союзни- ков сломает хребет фашистскому зверю. Бойцы и командиры тыловых подразде- лений, ознакомившись с приказом Верхов- ного Главнокомандующего, обязались еще упорнее улучшать деятельность войсковых тылов, обеспечить образцовое состояние фронтовых дорог, своевременно доставлять на передовые позиции боеприпасы, продо- вольствие и снаряжение. Свои обязатель- ства тыловики подкрепляют конкретными делами. Артиллерийская мастерская соеди- нения досрочно выполнила план ремонта по всем видам оружия, организовав работу подвижных бригад непосредственно на пе- редовых позициях. Водители автобатальона, где заместителем командира по политиче- ской части тов. Иванов, успешно выполня- ют задания по доставке в части боепри- пасов, продовольствия и обмундирования. Особенно хорошо работают колонны под руководством сержантов Лакеева и Корни- енко, которые досрочно завершают рейсы, экономят сотни килограммов горючего.	vol-5476-page-02-seg-009-0918-2142-1590-3495.png
5476	2	544	3554	1279	3599	5	0.90874	Уче Учеба на опыте войны	vol-5476-page-02-seg-010-0544-3554-1279-3599.png
5476	2	227	3628	897	3912	41	0.94438	Митинги и беседы, посвященные перво- майскому приказу товарища Сталина, про- ходили в Части, которой командует пол- ковник Ковалев, прямо у боевых машин. Бойцы и командиры говорили о том, что приказ Верховного Главнокомандующего влия в них новые силы для борьбы с врагом.	vol-5476-page-02-seg-011-0227-3628-0897-3912.png
5476	2	225	3914	895	4524	91	0.93665	Наступит время, и фашистские раз- бойники будут уничтожены, стерты с ли- ца земли. , В этом уверены все нычки участники великой Отечественной войны, говорит ефрейтор Позднякова. --- Но побе- да сама не придет, ее надо завоевать. Залог наших успехов это полное и своевременное выполнение приказа това- рища Сталина. Выполнить приказ -- зна- чит одержать победу над озверелым вра- гом. Товарищ Сталин приказал нам все- мерно совершенствовать боевую выучку. Не талея сил своих, будем учиться еще больше, еще напряженнее. Не теряя ни одной минуты, бойцы и командиры приступают выполнению ста- линского приказа.	vol-5476-page-02-seg-012-0225-3914-0895-4524.png
5476	2	225	4525	893	4776	37	0.94491	Нас не могут теперь удовлетворить вчерашние показатели, как бы ни были они хороши, --- заявляют бойцы и коман- диры. --- Наша боевая подготовка должна непрерывно расти. Только тогда мы бу- дем образцовыми солдатами и офицерами Красной Армии.	vol-5476-page-02-seg-013-0225-4525-0893-4776.png
5476	2	225	4778	893	4988	30	0.94981	желание стать настоящим мастером своего дела охватило каждого, говорит командир подразделения старший лейтенант Перенков. --- Сердце радуется, когда смот- рип на своих боевых товарищей, стре- мящихся каждую минуту использовать для	vol-5476-page-02-seg-014-0225-4778-0893-4988.png
5476	2	918	3626	1586	4552	131	0.95230	учебы. С большим рвением изучают бойцы материальную часть оружия и прицельные приборы. Бывалые воины --- младший сер жант Фролов, ефрейторы Гветадзе и Алек- сеев, сержант Певчев, красноармеец Сиг- батулин и другие собирают молодых воп- нов и передают им свой опыт. Молодые красноармейцы стараются постигнуть все детали боя. Чтобы возможно эффективнее использо- вать технику в бою, подразделение, воз- главляемое старшим лейтенантом Кирилло- вым, устраивает на-днях техническую кон- ференцию. В других подразделениях орга- низуются встречи бойцов и командиров по специальностям с целью поделиться накоп- ленным опытом, освоить всё новое, что пригодится в предстоящих боях. Значительно возрос интерес в учебе и среди штабных работников. Для них будут проведены специальные лекции и доклады, главным образом, по вопросам управления огнем. К более глубокому изучению мате- реальной части оружия и аппаратуры, пра- вил стрельбы приступают политработники части.	vol-5476-page-02-seg-015-0918-3626-1586-4552.png
5476	2	912	4558	1582	4983	62	0.94989	В этой части, где успех боевой работь зависит от секунд, умеют дорожить вре- менем, понимают, что высокие темпы ве- дения огня требуют четкости, слаженно- сти, автоматизма действий орудийных ра- счетов. Поэтому совершенно необходимо систематическая тренировка, и сейчас, по- сле первомайского приказа товарища Сталина, она стала еще интенсивнее... Тре- нировочныв занятия проводятся в услови- ях, приближенных к боевым, как днем, так и ночью.	vol-5476-page-02-seg-016-0912-4558-1582-4983.png
5476	2	406	5043	1383	5091	5	0.93781	БЕСЕДЫ В ЗЕМЛЯНКАХ И ТРАНШЕЯХ	vol-5476-page-02-seg-017-0406-5043-1383-5091.png
5476	2	222	5100	891	5679	86	0.95165	ДЕЙСТВУЮЩАЯ АРМИЯ, 5 мая. (По телеграфу от наш. корр. ). Во всех частях подразделениях N соединения приказ 195 Верховного Главнокомандующего Маршала Советского Союза товарища Ста- лина вызвал огромный полем. Бойцы, ко- мандиры и политработники заявляют, что этот приказ дал им боевую программу действий для уничтожения немецких окку- пантов. После того, как приказ был про- читан перед строем, политработники аги- таторы проводили с бойцами групповые бе- седы в землянках и траншеях переднего края. Бойцы делились мыслями и чувства- ми, которые зародил в них приказ Верхов- ного Главнокомандующего.	vol-5476-page-02-seg-018-0222-5100-0891-5679.png
5476	2	222	5683	886	5784	10	0.94235	Знатный истребитель вражеских танков командир орудия орденоносец Князев ска- за	vol-5476-page-02-seg-019-0222-5683-0886-5784.png
5476	2	220	5789	888	6114	50	0.93220	Умелому волну танк не страшен. Наш расчет только в одном бою подбил и поджег восемь немецких танков. Но мы еще лучше изучим свое дело. Там, где сто- ит наше орудие, вражеские танки не пройдут. От руки молодого снайпера Чашина уже погибли 23 немпа. Тов. Чашин заявил, вы- ступая на митинге:	vol-5476-page-02-seg-020-0220-5789-0888-6114.png
5476	2	912	5106	1576	5338	35	0.95090	- Красная Армия нанесла серьезные по- ражения гитлеровским войскам. Но распла та с врагом не окончена. Она не окончит ся до тех пор, пока мы не истребим всех гитлеровских бандитов, пришедших на на- шу землю.	vol-5476-page-02-seg-021-0912-5106-1576-5338.png
5476	2	910	5343	1576	5488	16	0.95347	части, которой командует гвардии полковник Черенков, после прочтения при каза Верховного Главнокомандующего вы- ступил старшина-орденоносец Евдокимов:	vol-5476-page-02-seg-022-0910-5343-1576-5488.png
5476	2	907	5495	1575	6106	96	0.94626	своем приказе товарищ Сталин под- черенул, что неж цы прекратили крикливую болтовню о молниеносной войне и теперь уныло причитают о неизбежности затяжной войны. Видно, не от хорошей жизни заго- ворили фашисты другим языком. Это мы, фронтовики, заставили их заговорить по- иному. Но успокаиваться нам еще слишком рано. Предстоит напряженная борьба, и мы будем вести ее со всей яростью. Товарищ Сталин требует, чтобы мы без устали со- вершенствовали свою боевую выучку. Без военного уменья и мастерства нет по- беды. Я отвечу на приказ вождя еще бо- лее энергичной подготовкой бойцов своего подразделения к решающим схваткам с вра-	vol-5476-page-02-seg-023-0907-5495-1575-6106.png
5476	2	1863	1969	2034	2022	1	0.89201	Слово	vol-5476-page-02-seg-024-1863-1969-2034-2022.png
5476	2	1726	2062	2167	2106	1	0.91485	сталинградцев	vol-5476-page-02-seg-025-1726-2062-2167-2106.png
5476	2	1611	2131	2277	2455	49	0.94420	ДЕЙСТВУЮЩАЯ АРМИЯ, 5 мая. (По телеграфу от наш. корр. ). Славный бое- вой путь прошла N гвардейская стрелко- вая часть. Ее бойцы дрались на Дону, в приволжских степях, у стен Сталинграда. В жестоких боях гвардейцы нанесли про- тивнику ощутительные удары, разгромив несколько отборных немецких частей, ок- руженных под Сталинградом.	vol-5476-page-02-seg-026-1611-2131-2277-2455.png
5476	2	1611	2470	2275	2793	48	0.95091	Первомайский приказ товарища Сталина вызвал в части новый подъем политичес кой активности. Из уст в уста передают гвардейцы содержание приказа, оживленно говорят о нем на митингах и беседах. Ос- новная мысль всех выступлений за- крепить достигнутые в зимних боях если- хи, совершенствовать боевую выучку. быть готовым решающим сражениям.	vol-5476-page-02-seg-027-1611-2470-2275-2793.png
5476	2	1613	2812	2271	2882	10	0.94465	Арбую речь произнес на одном митинге гвардии старший сержант Шаманский:	vol-5476-page-02-seg-028-1613-2812-2271-2882.png
5476	2	1609	2890	2273	3246	59	0.93991	Мы гордимся успехами в последних боях, но знаем, что впереди тяжелые. кровопролитные сражения. Враг уже из- ведал на своей шкуре сигу сокрушитель- ных ударов Красной Армии. Будем же упорнее учиться военному делу, чтобы еще не раз показал немцам, как дерутся по- зомби солдат Суворова и Кутузова, Мини- на и Поларексго, как умеют драться га свою родину воины Красной Армии.	vol-5476-page-02-seg-029-1609-2890-2273-3246.png
5476	2	1609	3263	2271	3442	24	0.93629	Старшего сержанта Шиманского сисляет командир отделения снайперов Горбачев. Бойцы его отделения за короткий срок истребили не одну сотню немецких захват- чибов. Знатный снайпер сказал:	vol-5476-page-02-seg-030-1609-3263-2271-3442.png
5476	2	1609	3459	2273	3671	34	0.94334	Мы должны умножить свои успехи. Приказ Маршала Сталина влил в нас новые силы: Поклянемся, боевые друзья, что не посрамим чести русского оружия, не за- пятна чем славы Сталинграда, высоко про- песен наше гвардейское знамя.	vol-5476-page-02-seg-031-1609-3459-2273-3671.png
5476	2	1609	3689	2273	4125	62	0.94325	После митинга гвардейцы разошлись по околам и блиндажам. Каждый из них хо- тел делом ответить на приказ Верховного Главнокомандующего. Вот возвратились н засады снайперы Вошкобуев и Афанасьев. В этот день они убили по одному немцу. Наводчик Покус, стреляя прямой наводкой, уничтожил четыре вражеских повозни боеприпасами. Разведчик Здешко возвра- тился из ночного томска с «языком». Слова гвардейцев не расходятся с их боевыми делами.	vol-5476-page-02-seg-032-1609-3689-2273-4125.png
5476	2	1654	4203	2224	4305	4	0.98662	ЛЕТЧИКИ ПОВЫШАЮТ свои знания	vol-5476-page-02-seg-033-1654-4203-2224-4305.png
5476	2	1603	4319	2271	5049	108	0.95744	ДЕЙСТВУЮЩАЯ АРМИЯ, 5 мая. (По телеграфу от наш. корр. ). Первомайский приказ Верховного Главнокомандующего был встречен в N авиационной части с большим подъемом. У всего личного соста- ва одно желание --- боевыми делами отве- тить на приказ вождя. На митинге летчики и техники заверили командование в том, что они неустанно будут совершенствовать свою выучку и быстро добьются высоких показателей в боевой подготовке. Многие техники и младшие авиаспециалисты обя- зались самостоятельно сдать экстерном зачеты по изучению новой материальной части. Механик сержант Тучкин заявил, что он в кратчайший срок подготовится для сдачи зачетов в объеме знаний авиа- техника. Моторист старший сержант Да- нилов будет готовиться к исполнению обя- занностей механика.	vol-5476-page-02-seg-034-1603-4319-2271-5049.png
5476	2	1597	5055	2265	5738	99	0.94984	Учитывая особенности боевой обстанов- ки, авиационный штаб, которым руководит подполковник Мазовер, разработал новую программу командирской учебы, по кото- рой уже начались занятия. В основу про- гранны положен индивидуальный подход к командирам. Каждый летчик и техник, в зависимости от подготовки, будет совер- шенствовать свои теоретические знания и практические навыки как в системе командирской учебы, так и самостоятельно. До сих пор в части не было серьезного контроля над командирской учебой. Сей- час штаб установил сроки обязательной сдачи зачетов по программе. Особое вни- мание обращено на подготовку молодых летчиков. Боевая работа этой категории командиров тоже строится с учетом лич- ной подготовленности каждого.	vol-5476-page-02-seg-035-1597-5055-2265-5738.png
5476	2	1595	5746	2260	6102	49	0.93996	Большое место в системе командирской учебы отведено теоретическим конферен- циям. Как показал прежний опыт, эта форма работы оказалась одной из самых интересных. Не так давно в части были проведены конференции по вопросам са- молетовождения по радио и двусторонней связи с землей. В дальнейшем подобные конференции будут практиковаться более часто	vol-5476-page-02-seg-036-1595-5746-2260-6102.png
5476	2	2295	419	4341	609	5	0.94574	того требует дело победы. ***	vol-5476-page-02-seg-037-2295-0419-4341-0609.png
5476	2	2503	643	4146	736	3	0.98286	боевом воспитании танкистов	vol-5476-page-02-seg-038-2503-0643-4146-0736.png
5476	2	2298	766	2971	2552	262	0.95739	Танковые войска появились не так дав- но. В отличие от пехоты, артиллерии, са- перных частей, имеющих вековую историю, боевые традиции танкистов складываются только сейчас. Именно это заставляет нас особенно внимательно и строго отно- ситься к вопросам воспитания и становле- ния воина-танкиста. - Самая природа танковых войск продик- товала принципы и методы боевого воспи- тания. Танкист это человек особого склада, человек, для которого маневр, стремительность, крепкая дисциплина, вы- держка и спокойствие в минуты самой острой опасности основа боевой жизни. Нормальное состояние для этого рода войск постоянно находиться лицом в лицу с противником, под его огнем и напористо действовать, менять направления, преодоле- вать препятствия, не испытывая какой бы го ни было нерешительности, Танкист всегда пахнет, что именно атака, внезап- ное появление в гуще боевых порядков врага и есть его призвание. Воспитанием танкистов занимаются и до боя, оно продолжается на поле боя, где каждому командиру-танкисту, а подчас и отдельному экипажу приходится, сообразу- ясь с обстановкой, самостоятельно прини- мать решения, помня о той общей задаче, которая была поставлена перед подразделе- нием или частью. Успешные операции Красной Армии участием больших групп танковых войск выдвинули перед нами ряд новых вопросов подготовки и воспитания танкистов. Школа советских танкистов окончательно сфор- мировалась в дни Отечественной войны. Танки участвовали в обороне и в наступ- лении, они прошли через горнило танко- вых сражений, они маневрировали на об- ширных оперативных просторах. В много- численных и разнообразных по своему ха- рактеру боях сложились тактические прин- ципы действий. был найден общий язык с другими родами войск, выявлены недо- статки, мешавшие успешному использова- нию танков, выросли замечательные кадры. практика которых легла в основу нашей танковой науки.	vol-5476-page-02-seg-039-2298-0766-2971-2552.png
