volume_number	page_number	x1	y1	x2	y2	tokens_count	mean_confidence	text	image
5551	2	2929	5746	3592	6110	64	0.96180	ДЕЙСТВУЮЩАЯ АРМИЯ, 31 июля (По телеграфу от наш. корр. ). На-днях группе бойцов младших командиров N части были вручены медали "За отвагуэ и «За боевые заслуги» Вручение наград происходило в траншеях на передовых по- зициях Первым получил. медаль «За эт- вагу" младший сержант Полянский. Во время. недавней атаки он со своим отделе нием ворвался в немецкий окоп в личным примером воодушевил бойцов. В результа-	vol-5551-page-02-seg-043-2929-5746-3592-6110.png
5551	2	3611	5751	4273	6106	53	0.96091	те решительной атаки враг был отброшен занимаемых позиций. Затем медаль «За отвагу» вручается младшему сержанту Кулакову. В самый напряженный момент боя, когда командир подразделения вышел из строя, Кулаков взял на себя командование в с возгласом «За Сталина! Вперед!» увлек за собой всё подразделение. Медали получила и другие волны, отл чившиеся славными боевыми подвигами.	vol-5551-page-02-seg-044-3611-5751-4273-6106.png
5551	3	400	242	1208	275	7	0.91517	августа 1943 г., воскресенье. № 180 (5551)	vol-5551-page-03-seg-001-0400-0242-1208-0275.png
5551	3	2104	246	2698	288	9	0.89262	К Р А С Н А 3 Е А	vol-5551-page-03-seg-002-2104-0246-2698-0288.png
5551	3	478	362	1552	464	2	0.96499	Пропаганда героизма	vol-5551-page-03-seg-003-0478-0362-1552-0464.png
5551	3	595	483	1415	516	5	0.93947	(От специального корреспондента «Красной звезды»	vol-5551-page-03-seg-004-0595-0483-1415-0516.png
5551	3	341	538	1009	979	59	0.94510	В начале июля у местечка Сухой разыгралось одно из крупных сраже- ний нынешнего лета. На небольшой уча- сток земли, обороняемый батальоном ка- питана Бельгина, немцы обрушили спло- шной ливень смертоносного огня. Приору- бая себе дверь, они буквально засыпали всё пространство авиационными бомбами артиллерийскими снарядами. только после этого, когда им казалось, что не осталось ничего живого, двинули свыше сотни танков.	vol-5551-page-03-seg-005-0341-0538-1009-0979.png
5551	3	339	988	1001	1239	37	0.93836	Но батальон был жив. Батальон стоя. на месте. Сбрасывая с себя землю. вы- росли над окопами бронебойщики. Абдулин сразил первый танк. Машина за- кружилась и встала. С фланга "тигр". Боец Ганджа вышел на поединок ним и победил.	vol-5551-page-03-seg-006-0339-0988-1001-1239.png
5551	3	332	1242	1000	1685	72	0.94286	А темп боя всё нарастал. Силы явно были неравны. Поредели цепи отважных. всё же батальон без устали сражался. Танки прорвались на линию окопов в на- чали их утюжить. Немцы разлили горю- чую смесь. Горело всё: трава, земля, же- лезо. Двенадцать часов продолжался этот неописуемый ад. II, несмотря на всё, по- белли советские воины. Они подбила до двух десятков машин и уничтожили, свы- ше пятисот солдат. Ценою крови многих товарищей рубеж был удержан.	vol-5551-page-03-seg-007-0332-1242-1000-1685.png
5551	3	330	1694	996	1948	37	0.93454	В какие формы может вылиться полите- ческая работа в данных условиях боя? Как должны действовать политработники? Нам кажется, главное тут правильно определить свое место, проявить находчи- вость и мужество. П политработники ба- тальона оказались на высоте положения.	vol-5551-page-03-seg-008-0330-1694-0996-1948.png
5551	3	324	1958	988	2246	38	0.93026	Первое это личный пример. Речи произносить было уже некогда - всё бы ло сказано раньше. действительно, ког- да немецкие автоматчики готовились последнему броску, когда создалось исклю чительно трудное положение, как из-под земля вырос парторг батальона тов. Су- шков.	vol-5551-page-03-seg-009-0324-1958-0988-2246.png
5551	3	326	2248	982	2322	6	0.89696	Смельчаки, за мной. раздался знакомый голос.	vol-5551-page-03-seg-010-0326-2248-0982-2322.png
5551	3	322	2332	982	2620	41	0.91913	двумя противотанковых он бросился навстречу врагу. Его приме- ру последовали другие. Завязалась оже- сточенная схватка, в которой каждый из бойцов проявил величайший героизм. Но вожаком героев, призывом к храбрости бы. парторг. И его смелое действие было са- мым сильным большевистским словом.	vol-5551-page-03-seg-011-0322-2332-0982-2620.png
5551	3	316	2628	982	3026	55	0.92079	Как только предоставлялась малейшая возможность, агитаторы брались за свое непосредственное дело. - Когда боеп Ганджа подонл первого «тигра», из уст в уста пошло это сообщение по окопам Сформу- лировал и первый передал эту весть ком- мунист Колесов. Богдан пал комбат Бель- гин, по рядам пронесся волнующий при- зыв; Отомстим за любимого командира Выше стойкость; товарищи	vol-5551-page-03-seg-012-0316-2628-0982-3026.png
5551	3	309	3036	973	3320	45	0.91679	Даже тогда, когда, кажется, трудно было поднять голову, политработники ухи- трялись поведать бойцам о героизме то- варищей, подсказать, как лучше бить тая- ки врага. Всё это делалось быстро, крат- ко, в нескольких словах И всё же это была настоящая, большевистская агитация, самая боевая самая нужная.	vol-5551-page-03-seg-013-0309-3036-0973-3320.png
5551	3	305	3332	971	3835	79	0.92322	В разгар сражения ничто так не шевляет бойца, как весть об успехах сво- ей части, о подвигах своих товарищей. В бою за пулеметом, в орудийпом ра- счете, в стрелковой ячейке, в танке воину видна главным образом своя рабо- та. Сообщение же о действиях всего под разделения, о героизме товарищей связы- вает бойца со всем коллективом, B001Y- шевляет, вливаст в него новые силы. Пропаганда героических подвигов совет- ских воинов пожалуй, самая важная, самая действенная форма политической работы на поле боя.	vol-5551-page-03-seg-014-0305-3332-0971-3835.png
5551	3	305	3846	968	3990	17	0.93289	в этом отношения партинно-коусо- хольские организации политработники соединения, и где начальником политотдела тов. Смольянов, правильно поняли свою	vol-5551-page-03-seg-015-0305-3846-0968-3990.png
5551	3	1028	544	1687	941	63	0.93778	задачу и хорошо поставили пропаганду героических подвигов. Они использовал для этого различные Формы агита- ции, начиная с беседы в отделении, взво- де и кончая коротким устным лозунгом, трехстрочной запиской, передаваемой по цепи. Они сумели быстро разнести весть о подвиге батальона тов. Бельгина. Че- рез сутки об этом знали не только в дн- визон, в которую входил батальон, но и все части высшего соединения.	vol-5551-page-03-seg-016-1028-0544-1687-0941.png
5551	3	1022	948	1681	1423	69	0.93947	В нынешних боях особое распростране- ние приобрела клятва воинов перед боем в критический момент боя. В соединении, где начальником политотдела тов. Соловь- св, в отдельных частях перед выходом в бой зачитывалось специальное письмо, котором бойцы клялись быть стойкими до конца, свято блюсти воинскую присягу, биться, не щадя своей жизни. Небольшие митинги, посвященные началу боя, ми- типи, где произносллись клятвы "стоять насмерть», были наиболее сильной поли- :: :: гической зарядкой.	vol-5551-page-03-seg-017-1022-0948-1681-1423.png
5551	3	1015	1428	1675	2051	91	0.93522	В критический момент сражения, когда враг подбросил резервы и начал теснить один наш батальон, вдруг бойцы услыша- ли громкий голос своего командира: Братны! Шапки долой! Поклянсися не пропустить врага! Выстоим победим! Взволнованный голос звал к мужеству. Он окрылял бойцов, увеличивал их силы. II по полю сражения неслось в ответ: Клянемся выстоять! В другом месте в самый острый мо- мент сражения среди атакованных бойнов появится -командир. Ротмистров. Тут же в 0010 он произнес такой силы агитационную речь, что она во сто крат увеличила на- пор на врага и помогла повернуть ero влиять.	vol-5551-page-03-seg-018-1015-1428-1675-2051.png
5551	3	1007	2053	1668	2392	51	0.93553	Было бы непростительно не сказать величайшей роли в пропаганде тероизма в бою наших дивизионных газет. Учтя из- вестные недостатки, многие газеты по-на- стоящему поставили эту работу. . Газета «В решающий бой» по праву. за- служила звание «боевой окопной газеты». Всё то, что вчера произошло в бою, уже было в сегодняшнем номере.	vol-5551-page-03-seg-019-1007-2053-1668-2392.png
5551	3	1007	2394	1662	2690	45	0.93683	В двух- трехстрочных заметках сообщает о героизме воинов. "Лейтенант Замедько вчера подбил один вражеский танк и одну автомашину. Командир маши- ны Найденов уничтожил танк «тигр». 11 далее совет: «Цельтесь в ленивец танка "тп.р". Там уязвимое место. Наши гвар- дейцы говорят: "Не мёд на ноги слаб".	vol-5551-page-03-seg-020-1007-2394-1662-2690.png
5551	3	988	2694	1654	3895	168	0.92961	Но газета не ограничивалась только трехстрочными, зачетками. В каждом но- мере она дает самое существенное, самое нужное, исходя из опыта боя. Политическая работа в последних боях приняла самые разнообразные формы. Пе- чатались всевозножные лист овен, писались письма на родину героев, проводились раз- нообразные беседы, выпускались памятка пехотинцам, танкистам, артиллериста я. Во многих соединениях появились «агитчено- даны», в которых были брошюры, газе- ты, конверты, чернила, ручки, перья. Командиры некоторых дивизий стали практиковать посылку писем отличявшим- ся героям: «Вам, герою, уничтожившему десять немцев, -- пишет комдив сержанту Усманову, - я шлю сердечный привет в вашу мужественную руку». Командир поздравляет Усманова с победой и выра. дает надежду, что он в впредь будет сра- жаться храбро. Примерно такого со- держания письма отправляются в госпита- ли раненым бойцам. Характерной особенностью агиталиоп- ной работы в польских боях является ее массовость, участие в ней Не только печатных политработников, но командиров и бойцов. Наряду с этим по- высилось и качество агвтоции, роди. разнообразие форм А всё вместе взятое значительно повысило стойкость и боевой дух наших войск.	vol-5551-page-03-seg-021-0988-2694-1654-3895.png
5551	3	996	3899	1603	3990	5	0.93584	Подполковник И. БЕРЕЗИН ДЕЙСТВУЮЩАЯ АРМИЯ.	vol-5551-page-03-seg-022-0996-3899-1603-3990.png
5551	3	1740	1223	2994	1324	21	0.94982	БЕЛГОРОДСКОЕ НАПРАВЛЕНИЕ. Орудийный расчет старшего сержанта P. Хиляса в последних боях уничтожил риятельских танка. На снимке орудие ведет огонь по противнику.	vol-5551-page-03-seg-023-1740-1223-2994-1324.png
5551	3	2153	1337	2990	1373	7	0.96123	Снимок нашего спец. фотокорр. капитана Ф. Левшина	vol-5551-page-03-seg-024-2153-1337-2990-1373.png
5551	3	2100	1463	2632	1548	6	0.95395	Д О Р О Г А	vol-5551-page-03-seg-025-2100-1463-2632-1548.png
5551	3	1732	1567	2132	1713	14	0.93358	Большое лето фронтовое Текло по сторонам шоссе Густой, дремучий травою, Уставшей думать о косе.	vol-5551-page-03-seg-026-1732-1567-2132-1713.png
5551	3	1730	1742	2252	1912	14	0.92342	у шлагбаумов контрольных Курились мирные дышки, На грядках силу брал свекольник, Солдатской слушаясь руки...	vol-5551-page-03-seg-027-1730-1742-2252-1912.png
5551	3	1728	1916	2269	2062	15	0.92931	Но каждый холмик придорожный, И лес, недвижный в стороне, Безлюдьем, скрытностью тревожной Напоминали о войне...	vol-5551-page-03-seg-028-1728-1916-2269-2062.png
5551	3	1726	2098	2206	2239	20	0.93491	и типнина была до срока. А грянул срок - и началось И по шоссе пошли потоком На запад тысячи колес.	vol-5551-page-03-seg-029-1726-2098-2206-2239.png
5551	3	1724	2273	2205	2421	15	0.94121	Пошли это означало, Что, впереди, на фронте, вновь Земля уже дрожия-дрожала II пылью присыпала кровь...	vol-5551-page-03-seg-030-1724-2273-2205-2421.png
5551	3	1723	2449	2218	2590	16	0.93203	В страду вступило третье лето И та смертельная страда, Своим огнем обняв полсвета, Грозилась вырваться сюда.	vol-5551-page-03-seg-031-1723-2449-2218-2590.png
5551	3	1717	2624	2256	2772	16	0.91672	Грозилась прянуть в глубь России Заполонив ее поля... силой встать навстречу силе Спешили небо и земля.	vol-5551-page-03-seg-032-1717-2624-2256-2772.png
5551	3	1719	2802	2210	2945	16	0.91943	hустеми, десом, как попало, дороге, ходок и тяжел, Пошел греметь металл стоялый Огнем огонь давить пошел,	vol-5551-page-03-seg-033-1719-2802-2210-2945.png
5551	3	1713	2979	2212	3121	18	0.90489	Бензина, масел жаркий запах Повеял густо в глушь полей. Войска, войска попали на запад На дальний говор батарей...	vol-5551-page-03-seg-034-1713-2979-2212-3121.png
5551	3	1711	3153	2197	3300	16	0.94602	тот, кто два горячих лета У фронтовых видал дорог, Он новые, нынешним приметам Душой порадоваться мог.	vol-5551-page-03-seg-035-1711-3153-2197-3300.png
5551	3	1705	3330	2322	3651	35	0.92581	Не тот был строй калужских. брянских Сибирских воинов. Не тот Грузовиков заокеанских И русских танков добрый ход. Не тот в пути порядок чинный; даже выправка не та У часового, что картинно Войска приветствовал с поста.	vol-5551-page-03-seg-036-1705-3330-2322-3651.png
5551	3	2411	1575	2871	1721	17	0.93353	фронта вестница живая, Вмещая год в короткий час, Не тот дорога фронтовая Сегодня в тыл несла рассказ,	vol-5551-page-03-seg-037-2411-1575-2871-1721.png
5551	3	2410	1753	2929	1893	18	0.92469	Оттуда, с рубежей атаки, Где солнце застил смертный дым Куда порой боец не всякий До места доползал живых.	vol-5551-page-03-seg-038-2410-1753-2929-1893.png
5551	3	2406	1928	3017	2243	37	0.92418	Оттуда ныль гарь на каске Провез парнишка впереди, Что руку в толстой перевязке Держал, как ляльку, на груди. Оттуда лица были строже, Но день иной и год иной. II возглас: "Немцы!" -- не встревожит. Большой дороги фронтовой.	vol-5551-page-03-seg-039-2406-1928-3017-2243.png
5551	3	2400	2263	2937	2410	16	0.92633	Они прошли неровной, сборной, Какой-то встрепанной толпой, Прошли с поспешностью покорной Кто как шагая в разнобой.	vol-5551-page-03-seg-040-2400-2263-2937-2410.png
5551	3	2396	2428	2854	2578	18	0.91140	Гуртом сбиваясь к середине, Они оттуда шли, с войны. Колени, локти были в глине И лица грязные бледны.	vol-5551-page-03-seg-041-2396-2428-2854-2578.png
5551	3	2396	2594	2835	2749	14	0.92041	И было всё обыкновенно На той дороге фронтовой. И охранял колонну пленных Немногочисленный конвой.	vol-5551-page-03-seg-042-2396-2594-2835-2749.png
5551	3	2392	2768	2852	2914	15	0.92382	кто-то воду пил из фляги И отдувался, молодец. А кто-то ждал, когда бумаги Проверит девушка-боец.	vol-5551-page-03-seg-043-2392-2768-2852-2914.png
5551	3	2391	2941	2899	3081	16	0.91061	А там танкист в открытом люкс Стоял, могучее дитя, И вытирал тряпицей руки, Зубами белыми блестя.	vol-5551-page-03-seg-044-2391-2941-2899-3081.png
5551	3	2392	3108	2812	3252	15	0.92337	А некий мальчик босоногий С неполным ягод котелком. Привал устройв на дороге, Сухим закусывал пайком.	vol-5551-page-03-seg-045-2392-3108-2812-3252.png
5551	3	2387	3275	2865	3425	19	0.93604	А кто-то, стоя на подножке Грузовика, что волу брал, Насчет того, как от бомбежки Он уцелел, для смеху врал...	vol-5551-page-03-seg-046-2387-3275-2865-3425.png
5551	3	2385	3436	2785	3588	15	0.93815	И третье лето фронтовов Текло по сторонам шоссе Глухою, пыльною травою, Забывшей думать о косе,	vol-5551-page-03-seg-047-2385-3436-2785-3588.png
5551	3	2687	3616	2962	3654	2	0.95910	A. ТВАРДОВСКИЙ	vol-5551-page-03-seg-048-2687-3616-2962-3654.png
5551	3	1846	3740	2806	3778	6	0.97449	ЗАБОТА О СЕМЬЯХ ВОИНОВ КРАСНОЙ АРМИИ	vol-5551-page-03-seg-049-1846-3740-2806-3778.png
5551	3	1664	3789	2318	3992	26	0.94518	ТАШКЕНТ, 31 июля. (ТАСС). Большую помощь семьям защитников Родины ока- зывают правительство, общественные орга низации и трудящиеся Узбекистана С нз- чала нынешнего года областные отделы по	vol-5551-page-03-seg-050-1664-3789-2318-3992.png
5551	3	2343	3800	3000	3998	28	0.94793	гособеспечению и бытовому устройству предоставили работу 35 000 членам семей фронтовиков, 25.000 детей определены в различные детские учреждения. Только по 7 областям республики семьям фронтовиков выделено 28.362 квартиры.	vol-5551-page-03-seg-051-2343-3800-3000-3998.png
5551	3	3079	445	4398	599	6	0.96302	НЕ ЗЛОУПОТРЕБЛЯТЬ ТЕМАТИЧЕСКИМИ ПОЛОСАМИ И ПОДБОРКАМИ	vol-5551-page-03-seg-053-3079-0445-4398-0599.png
5551	3	3059	633	3723	1396	121	0.95049	Многообразна жизнь нашей армии! дая часть, каждое соединение --- это ис- ключительно сложный организм. Здесь бойцы разнообразных военных специаль- ностей, множество подразделений, каждое со своими особенностями и задачами. Бо- лее двух лет люди живут на войне, она стала для них повседневным бытом во.1- нуют их самые различные боевые и бы- товые вопросы. В газете своей дивизии, армии красноармейский читатель ищет от- вета на эти вопросы. С другой стороны, и красноармейская газета обязана постоянно заглядывать во все уголки своей дивизия, влиять на все слон читателей. Справиться с этой задачей может только такая газета, которая заботится о разнообразии своих материалов, изо дня в день освещает раз- личные стороны жизни, дает место замет- кан не из одного, а из многих подразде- лений и частей.	vol-5551-page-03-seg-054-3059-0633-3723-1396.png
