volume_number	page_number	x1	y1	x2	y2	tokens_count	mean_confidence	text	image
5551	2	222	1647	882	3091	221	0.94064	ДЕЙСТВУЮЩАЯ АРМИЯ, 31 июля. (По телеграфу). Как показывают бои севернее Орла, немецкая оборона на всю ее глуби- ну состоит из большого количества узлов сопротивления. В некоторых районах эти узлы сопротивления являются весьма круп- ными, каждый из них объединяет ряд опорных пунктов. Наступая, наши войска в ожесточенных боях с противником вгрызаются в его обо- рону, один за другим уничтожают немец- кие узлы сопротивления. Борьба за такие узлы сопротивления наиболее успешно тех случаях, когда наши войска наруша- ют огневую связь между опорными пунк тами, дробят вражеский узел сопротивле- ния на отдельные участки, а затем ата- куют и уничтожают опорные пункты по- рознь. Узел сопротивления противника обычно держится до тех пор, пока опор- ные пункты, из которых он состоит, нахо- дятся в тактическом взаимодействии. Ho как только это взаимодействие приходит в расстройство --- узел сопротивления начи- нает пункт за пунктом разваливаться, по- на не рушится окончательно. Есть два метода борьбы наступающих войск за опорный пункт неприятеля. Bo- первых, обход и блокировка и, во-вторых, атака с хода. Опыт учит, что второй не- тод - атака с хода дает, как пра- вило, прекрасные результаты. Преимущество его состоит в том, что удар наносится неожиданно для противни- ка. Поучителен в этом отношении бой за одну небольшую деревню юго-западнее Болхова. Эта деревня была превращена немцами в опорный пункт, который входил в узел сопротивления и прикрывал по- следний с фронта.	vol-5551-page-02-seg-006-0222-1647-0882-3091.png
5551	2	222	3095	884	4284	185	0.94695	Когда наступающие было еще в не- скольких километрах от деревни, ОНИ уже знали, что здесь у немцев подготов- лена прочная оборона и гарнизон деревня способен упорно сопротивляться. Действи- тельно, как только в районе немецкого уз- ла сопротивления началось наше наступле- ние, противник предпринял ожесточенную контратаку со стороны этой деревни. Ско- вывая частью сил немцев с фронта и от- ражая их контратаку, наше командование бросило основные свои силы в обход вра- жеского опорного пункта с целью раздроб- ления узла сопротивления противника. Перед подразделениями, совершавшими обход, были поставлены две задачи: отре- зать деревню от других, опорных пунктов неприятеля в затем сразу же атаковать его гарнизон с фланга. Этот замысел был рассчитан на ошеломление противника вне- запным ударом с той стороны. откуда не могли ожидать нашей атаки, по- скольку здесь у них пмелась связь с дру- гим опорным пунктом и их фланг при- крывался соседней деревней. Фланговая атака наших подразделений облегчалась еще и тем, что часть своего гарнизо- на противник бросил в контратаку. Бой длился недолго. Нашим подразделе- ниям пришлось пройти лишь около трех километров, чтобы ВКЛИНИТЬСЯ между неприятельскими опорными пунктами разобщить их. как уже сказано, эти опор-	vol-5551-page-02-seg-007-0222-3095-0884-4284.png
5551	2	903	1647	1561	3015	204	0.93925	ные пункты имели связь между собой, во она оказалась недостаточной для того, чтобы преградить путь вклинившимся под- разделениям. Как только наша группа вышла на линию первых двух опорных пунктов, бомандир ее, старший лейтенант Жатько, сейчас же выделил часть сил для удара по немецкому гарнизону с фланга. Преодолев незначительное сопротивление немцев, выделенные подразделения про- двинулись еще примерно на километр и оказались возле деревни. Чтобы не дать противнику опомниться и подготовиться отражению нашей атаки, они прямо с хода нанесли ему фланговый удар. Вместе с тем наступающие вынуждены были выделить часть сил для прикрытия своего фланга на случай контратак со стороны соседнего опорного пункта про- тивника. И это не было лишним. Немцы две раза переходили в контратаку, стре- мясь восстановить взаимодействие между этими опорными пунктами. Но обе контр- атаки были отбиты. Тем временем наши бойцы быстро вор- вались в деревню, отрезанную от враже- ского узла сопротивления, и уничтожили в ней несколько огневых точек. Немцы, ви- димо, поняли в этот момент, что насту- пающим удалось обойти их опорный пункт и он оказался изолированным от узла сопротивления. Очутившийся пол ударами с двух сторон, неприятель вы- нужден был оттянуть в деревню свои сп- лы, участвовавшие в контратаке. Но этим воспользовались наши подразделения, на- ступавшие с фронта, и усилили свой нажим.	vol-5551-page-02-seg-008-0903-1647-1561-3015.png
5551	2	903	3021	1559	4279	179	0.93711	Вскоре в немецком гарнизоне началась паника. Немцы стали отступать. Этот мо- мент использовал командир группы, ата ковавшей противника с фланга. Чтобы от резать немцам путь отхода, он выделил одно подразделение, которое, продвинув- шись километра на полтора вперед, пе- рехватило дорогу. Не прошло и десяти мн- нут, как это подразделение встретило от- ступавших немцев сильным ружейным и пулеметным огнем. Неприятель кинулся назад, чтобы отойти по другой дороге, но тут его встретили наши подразделения. наступавшие с фланга. Прошло немного времени; немецкий гарнизон был истреблен почти поголовно Лишь отдельным гитлеровцам удалось убе- жать. Всё свое оружие и транспорт они вынуждены были бросить. Так заверши. лась эта внезапная атака вражеского опор- ного пункта. Успех ее был обеспечен хо- рошо задуманным и умело выполненным маневром, внезапностью удара, знанием противника, искусно организованной по стоянной разведкой, позволявшей на ходу определять наиболее выгодный маневр. Вклинившись между двумя опорными пун- ктами, наши подразделения прямо с хода атаковали тот из них, который оказался отрезанным от узла сопротивления. Эта атака отличалась большой быстротой, что лишило противника возможности перебро сеть нужные силы для отражения нашей атаки с фланта. Майор В. БУКОВ.	vol-5551-page-02-seg-009-0903-3021-1559-4279.png
5551	2	282	4353	1502	4432	4	0.98519	Борьба с немецкими корректировщиками	vol-5551-page-02-seg-010-0282-4353-1502-4432.png
5551	2	220	4449	880	5789	187	0.94675	В немецкой авиацией для корректирова- ния артиллерийского огня и разведен в ин- тересах артиллерии применяются самоле- ты «Хеншель-126» и «Фокке-Вульф-189». Выполняя боевые полеты, эти машины не- редко заходят в наше расположение на большую глубину и при отсутствии проти- водействия со стороны истребителей нахо- дятся довольно длительное время над на- шими боевыми порядками Если же появ- ляются истребители, то неженские коррек- тировщики быстро покидают район дейст- вий, стараясь уйти на свою территорию. Зачастую вражеским корректировщикам не удается своевременно уйти, в они под- вергаются атакам истребителей. Тогда «XIII-126» в «ФВ-189», используя свою маневренность, пытаются выйти из-под удара пикированием, змейкой. спиралью, переворотами, чтобы снизиться до брею- щего полета перебраться во-свояси под прикрытие зенитной артиллерии. Наши лет- чики своевременно разгадывают подобные маневры врага. Однажды старший лейтенант Масляков в паре с младшим лейтенантом Коробейнико- вым на -самолетах дважды ата- ковали корректировщик "XIII-126" сзади сверху. Подбитый ими чемп, маневрируя по высоте и направлению переходя в крутую спираль, стал уходить на свою территорию. При этом он отстреливался из заднего пулемета. Перейдя на бреющий полет, «Alli-126» завел преследующих за линию фронта на глубину до .15 километ- ров, где они были встречены сильным зе- нитным огнем.	vol-5551-page-02-seg-011-0220-4449-0880-5789.png
5551	2	222	5793	878	6116	44	0.94133	Эта и некоторые пругие встречи «XIII-126» подсказали летному составу. что атаковывать немецкие корректировщик- ки сзади сверху и, последовательно повто- рять эти атаки невыгодно. «XIII-126» и особенно «ФВ-189» обладают хороших обзором, дающим возможность их экипажах быстро обнаружить на дальних дистанциях наши истребители и соответствующим ма-	vol-5551-page-02-seg-012-0222-5793-0878-6116.png
5551	2	897	4446	1557	6108	243	0.94377	невром уйти из-под удара. Опыт показы- вает, что в борьбе с вражескими корректи- ровщиками наиболее эффективной будет атака, выполненная внезапно из-за обла- ков, со стороны солнца или снизу, когда истребитель маскируется фоном земли. Если атаку производит пара истребите- лей, то одному из них следует демонстра- гивным наладением сверху привлечь вни- мание вражеского экипажа, а второй ист- ребитель в это время атакует с другого направления или снизу. Так действовали младшие лейтенанты Афанасьев в Гальчен- ко. Вылетев на самолетах «Лавочкин-5» по вызову постов воздушного наблюдения, они встретили и атаковали «ФВ-189». После первой же атаки номер пикированием в змейкой старался уйти на бреющий полет, но взятый нашими истребителями в клещи был подбит, загорелся и врезался в землю. Наиболее успешно проходит воздушный бой с корректировщиками противника при эшелонирование истребителей по высоте. Когда атакует истребитель, находящийся выше, противник прибегает своему из- любленному маневру - переходу на брею- щий полет. Однако при этом он попадает под огонь истребителя, находящегося во втором ярусе. Поскольку внимание экипа- жа корректировщика приковано в атакую- тему переднему самолету, атака второго истребителя обычно бывает внезапной. Недавно капитан Разоренков, веля звено истребителей, обнаружил на высоте около 2 500 метров "Хеншель-126". Капитан пошел на сближение с немцем. в то же время приказав ведомых снизиться. После первой атаки капитана немо, делая пере- вороты. стал терять высоту и уходить к своим. На высоте около 700 метров неожиданно натолкнулся на снизившиеся самолеты нашего звена Внезапно атакован- ный младшим лейтенантом Мокиенко, «Хеншель-126» был тотчас же сбит. Подполковник Н. ШАУРОВ. действующая армия.	vol-5551-page-02-seg-013-0897-4446-1557-6108.png
5551	2	1654	1449	2852	1518	3	0.94963	БОЙ МЕЛКИХ ПОДРАЗДЕЛЕНИЙ	vol-5551-page-02-seg-014-1654-1449-2852-1518.png
5551	2	1580	1540	2239	2846	195	0.94416	ДЕЙСТВУЮЩАЯ АРМИЯ, 31 июля. (По телеграфу от наш. корр. ). На одном уча- стке под Ленинградом передний край вра- жеской обороны проходил по сильно пе- . ресеченной местности. В центре находи- лась безымянная высота. Немцы прочно укрепили этот выгодный в тактическом от- ношении рубеж. На высоте имелась ши- роко разветвленна система траншей, а также большое количество дзотов, перед которыми тянулась густая сеть проволоч- ных заграждений. С высоты противник хо- рошо просматривал и простреливал окру- жающую местность, имея огневую связь с позициями, расположенными на соседних высотках. Подступы к высоте прострели- вались перекрестным огнем. Подразделение под командованием тов Ковалева получило задачу захватить этот рубеж. С наступлением темноты по вра- жеским позициям стали бить наши орудия минометы. Одновременно подверглись огневой обработке и соседние высотки, где находились вражеские фланкирующие пуле. меты. Использовав момент, когда против- ник находился под сильным огневым воз- действием, группа автоматчиков, возглав- ляемая лейтенантом Рыловым, начала под- бираться к боевым порядкам немцев с тем, чтобы во время общей атаки нанести про- тивнику внезапный удар во фланг. Под прикрытием мощного огня саперы проделали три прохода во вражеских за- граждениях. Затем артиллеристы и мино- метчики по сигналу перенесли свой огонь на фланговые позиции врага. В ту же ми-	vol-5551-page-02-seg-015-1580-1540-2239-2846.png
5551	2	2263	1538	2918	1943	60	0.95265	нуту рота под командой старшего лейте нанта Ядрышникова дружно поднялась и пошла в атаку. Станковые пулеметы и рот- ные минометы, находившиеся в ее боевых порядках, не давали немцам поднять го- ловы, и противник не смог оказать орга низованное огневое сопротивление, Пуле: метные и минометные расчеты двигались перекатами и вели интенсивный огонь по тем местам, где появлялись вспышки вра- жеских выстрелов.	vol-5551-page-02-seg-016-2263-1538-2918-1943.png
5551	2	2260	1952	2918	2241	39	0.93837	Первой ворвалась в траншеи противника группа бойцов, которой командовал стар- шина Банк. Завязался ожесточенный руко- пашный бой. Вскоре сюда подоспели другие группы, возглавляемые тт. Пархо- менко, Скотниковым, Козловым. Дружно и энергично теснили врага наши пехотинцы, отбивая траншею за траншеей.	vol-5551-page-02-seg-017-2260-1952-2918-2241.png
5551	2	2262	2252	2916	2578	44	0.94943	Наконец, немцы дрогнули. Этот момент удачно использовала группа автоматчиков лейтенанта Рылова, которая ударила нем- цам во фланг. Подразделение овладело вы- сотой и прочно закрепилось на ней. Бой цы насчитали, более сотни вражеских тру- пов, захватили противотанковую пушку два миномета, шесть пулеметов, склад бое припасов.	vol-5551-page-02-seg-018-2262-2252-2916-2578.png
5551	2	2262	2592	2916	2842	36	0.93709	Успех этого ночного боя был обеспечен быстротой продвижения нашей цехоты, ес умением сочетать маневр с огнем и дей- ствовать мелкими группами, поддерживая тесный контакт с саперами и артиллерией Серьезно повлиял на исход боя точный огонь артиллерии.	vol-5551-page-02-seg-019-2262-2592-2916-2842.png
5551	2	1660	2929	2844	2992	3	0.94759	МАНЕВР ЗЕНИТНЫМИ СРЕДСТВАМИ	vol-5551-page-02-seg-020-1660-2929-2844-2992.png
5551	2	1580	3021	2243	4142	163	0.94575	Наиболее надежное прикрытие войск от налетов с воздуха достигается в резуль- тате активных действий зенитных средств. В этом, случае под активностью зенитной артиллерии мы подразумеваем такой образ действий, когда батареи нс стоят на одном месте в ожидании противника, а переме- щаются в зависимости от воздушной наземной обстановки, т. маневрируют. Такая тактика боевого применения зенит- ной артиллерии обеспечивает эффективное противодействие вражеской авиации на тех участках, где воздушный противник кон- центрирует свои усилия в данный момент. Батареи нашей части не задерживаются подолгу на одном месте. Как правило, они меняют свои позиции после того. как об- наруживают себя огнем, оставляя одно-два орудия для стрельбы, чтобы ввести в за- блуждение противника относительно стоты района. При очередном налете противник обычно старается обходить участки, где он натолкнулся на серьезный отпор. Однако, снижаясь для бомбежки нового района. его самолеты снова попадают под удары зенитных бата- рей, сменивших к этому времени огневые позиции. Кроме того, мы применяем заса- ды, выделяя в каждую из них батарею или взвод малокалиберной зенитной артил- лерии.	vol-5551-page-02-seg-021-1580-3021-2243-4142.png
5551	2	1578	4153	2239	4476	43	0.92050	Благодаря маневрированию зенитными средствами и систематической организации засад нам удалось в течение нескольких дней, при относительно незначительной воздушной активности врага уничтожить 11 немецких самолетов. Мы заставили не- мецких летчиков отказаться от пикирова- ния и подняться на высоту до трех вило- метров и выше.	vol-5551-page-02-seg-022-1578-4153-2239-4476.png
