volume_number	page_number	x1	y1	x2	y2	tokens_count	mean_confidence	text	image
6084	3	1764	1095	2421	2608	210	0.95527	Заключение Договора 0 дружбе, взаимной помощи и послевоенном сотруд- ничестве между Советским Союзом и Поль- ской Республикой, - сказал он, - имеет большое историческое значение. Oil кла- дет конец старой нагубной политике недружелюбного отношения, отчужденности и военных конфликтов, существовавшей между этими двумя государствами. Вот по- чему народы СССР и Польши с величай- шим воодушевлением встретили сообщение заключении Договора между Советским Союзом и Польшей. Этот документ - но- вый удар по немецко-фашистским захват- чикам и их польским прислужникам, предавшим Польшу Гитлеру. Затем выступил инженер-капитан Зон- гов. Красная Армия, заявил он, 9 громит гитлеровские полчища в Берлине. Недалек тот час, когда наши войска во- друзья знамя победы над германской сто- лицей. Весть о заключении Договора 0 дружбе, взаимной помощи и послевоенном сотрудничестве между СССР и Польшей вселяет в сердца воинов Красной Армии и всего передового человечества уверенность в том, что германской агрессии на Восто- ке не суждено больше повториться. До- говор ограждает славянские народы от опасности нового вероломного нападения германского империализма. Выступившие на митинге майор Сквор- пов, младший лейтенант Златкис, сержант Краснов и другие в своих речах вырази- ли полное удовлетворение Договором. Участники митинга приняли резолюцию, в которой они приветствуют Договор меж- ду Советским Союзом и Польской Респуб- ликой, как выражение мудрой политики советского правительства, направленной к установлению мира во всем мире.	vol-6084-page-03-seg-029-1764-1095-2421-2608.png
6084	3	1822	2670	2365	2786	4	0.97657	НАДЕЖНЫЙ ОПЛОТ против агрессии	vol-6084-page-03-seg-030-1822-2670-2365-2786.png
6084	3	1762	2815	2415	3008	20	0.95901	Горячо откликнулись на советско-поль- ский Договор работники Московского автомобильного завода имени Сталина. На митинге в штампо-механическом цехе выступил слесарь Мануйлов.	vol-6084-page-03-seg-031-1762-2815-2415-3008.png
6084	3	1760	3014	2421	3783	111	0.95573	Сообщение о подписании Договора **** СССР с Польской Республикой совпало с радостными вестями с фронтов Отечест- венной войны. Наши доблестные войска ворвались в Берлин. Логово фашистского зверя будет разгромлено. Сыны советского народа не щадили своей крови, чтобы освободить славянские народы от немец- кого пга. Красная Армия вернула поль- скому народу сВободу и независимость. Договор еще больше укрепляет дружбу обеих стран. Он поможет им успешно закончить войну и будет служить надеж- ным оплотом против какой-либо попытки Германии повторить агрессию. Мы, рабо- чие, пеликом одобряем этот мудрый Дого- вор. Мы обещаем нашему правительству, любимому учителю и вожд10 товарищу Сталину трудиться с еще большим под'- емом, чтобы помочь фронту скорее завер- шить разгром врага.	vol-6084-page-03-seg-032-1760-3014-2421-3783.png
6084	3	1762	3791	2419	3955	17	0.94577	Бригадир Захарченко в своем выступ- лении отметил, что Договор между СССР и Польшей имеет большее международное значение.	vol-6084-page-03-seg-033-1762-3791-2419-3955.png
6084	3	1762	3965	2417	4654	71	0.94656	Он не только отвечает жизненным интересам двух братских народов, но и усиливает позицию всех Об единенных на- ций в борьбе с германским империализ- мом. В Договоре ярко выражено стремление сотрудничать во всех международных дей- ствиях, которые будут содействовать упрочению мира безопасности народов. Митинги, посвященные советско-поль- скому Договору, прошли в цехе моторов, прессовом и других цехах. Автозаводцы с огромным подъемом приня- ли приветствие Верховному Главнокоман- дующему Маршалу Советского Союза товарищу Сталину. (ТАСС).	vol-6084-page-03-seg-034-1762-3965-2417-4654.png
6084	3	2571	699	3630	817	6	0.96853	БЕЛОРУССКИЙ НАРОД ГОРЯЧО ПРИВЕТСТВУЕТ! СОВЕТСКО-ПОЛЬСКИЙ ДОГОВОР	vol-6084-page-03-seg-036-2571-0699-3630-0817.png
6084	3	2440	823	3087	1526	99	0.94883	МИНСК, 22 апреля. (ТАСС). На пред- приятиях и учреждениях Советской Белоруссии проходят митинги, собрания, беседы, посвященные подписанию Догово- ра о дружбе, взаимной помощи и после- военном сотрудничестве между Советским С01030м и Польской Республикой. На ми- тинге в минском депо выступил маши- нист-стахановец тов. Савин: - Все советские люди с единодушным одобрением встретили сообщение о совет- ско-польском Договоре, --- заявил он. Этот Договор свидетельствует том, что народы СССР и Польши еще теснее обед и- нились в борьбе против общего врага гитлеровской Германии. Каждому из нас ясно, что новый Договор укрепляет силу всех Об единенных наций в борьбе против немецко-фашистских захватчиков.	vol-6084-page-03-seg-037-2440-0823-3087-1526.png
6084	3	2440	1534	3089	1940	57	0.95548	Гитлеровские палачи хотели истребить славянские народы русских, поляков, белоруссов, украинцев. Героическая Крас- ная Армия отстояла свою Родину, очисти- та советскую землю от фашистской нечи- сти и протянула руку братской помощи исстрадавшимся народам Польши. В эти дни Красная Армия и армии наших союзников наносят сокрушительные уда- ры по гитлеровцам с востока, запада юга. Эти удары приближают час победы	vol-6084-page-03-seg-038-2440-1534-3089-1940.png
6084	3	3107	842	3758	1089	31	0.94567	Об единенных наций над врагом, желан- ный час победы! Новый Договор с большим удовлетворе нием встречен среди интеллигенции бело русской столицы. Учительница школы № 1 Каганович- ского района тов. Шишкалова заявила:	vol-6084-page-03-seg-039-3107-0842-3758-1089.png
6084	3	3097	1105	3758	1940	113	0.96000	На протяжении многих лег поль- скому народу угрожала опасность нападе- ния со стороны германского милитаризма, который всегда лелеял агрессивные замыс- лы в отношении как Польши, так и Рос- сни. Договор о дружбе, взаимной помощи и послевоенном сотрудничестве между СССР и Польшей сплачивает и умножает силы народов обеих стран в их борьбе против немецко-фашистских захватчиков. Он закладывает прочные основы тесной дружбы между двумя славянскими наро- дами. Вместе с тем этот Договор является большим вкладом в общее дело Об'единен- ных наций. Он зиждется на международ- ных принципах мира и безопасности, ко- торыми проникнута вся политика стран участников антигитлеровской коали- ции. На митингах, состоявшихся на многих предприятиях республики, рабочие Бело- руссии единодушно одобряют исторический советско-польский Договор.	vol-6084-page-03-seg-040-3097-1105-3758-1940.png
6084	3	2670	2015	3524	2123	5	0.97201	Договор, умножающий силы свободолюбивых народов	vol-6084-page-03-seg-041-2670-2015-3524-2123.png
6084	3	2438	2133	3089	2567	58	0.95114	КПЕВ, 22 апреля. (ТАСС). Трудящиеся Советской Украины с глубоким удовлетво- рением встретили сообщение об истори- ческом Договоре между СССР и Польской Республикой. В момент передачи текста Дог Договора по радио на улицах и площадях у репродукторов собрались многолюдные толпы киевлян. Документ, возглашающий дружбу и взаимную помощь двух сосед- них славянских народов, оживленно 00- суждается среди рабочих, колхозников, интеллигенции.	vol-6084-page-03-seg-042-2438-2133-3089-2567.png
6084	3	2436	2585	3091	3275	99	0.95752	Советско-польский Договор о друж- бе, взаимной помощи и послевоенном сот- рудничестве будет е радостью встречен всеми искренними поборниками мира и безопасности, заявил директор завода имени Артема тов. Власов. --- Советский и польский народы ведут совместную борьбу против немецко-фашистских зах- ватчиков. Обе страны преисполнены ре- шимости довести эту борьбу до победа- посного конца. Новый Договор умножает наши силы, он отвечает коренным интере- сам народов всех Объединенных наций, бо- рющихся за будущий прочный мир, за безопасность, Красная Армия, Польское Войско и армии наших союзников дове- идут до конца разгром гитлеровской Герма- нии. Однако славянские народы, как Все свободолюбивые народы мира, кровно	vol-6084-page-03-seg-043-2436-2585-3091-3275.png
6084	3	3109	2148	3758	2504	56	0.95520	заинтересованы в том, чтобы обезопасить себя от новых попыток агрессии со сто- роны Германии. Этот Договор укрепляет нашу уверенность в будущем, он закла- дывает новый кирпич в великое здание мира и безопасности. Заявление товарища Сталина о том, что «Договор означает ук- репление единого фронта Объединенных наций против общего врага в Европе» выражает мысли всех советских людей.	vol-6084-page-03-seg-044-3109-2148-3758-2504.png
6084	3	3109	2519	3760	3273	111	0.96179	У польского и советского народов нет причин для раздоров, их обединяет одно стремление - быстрее разгромить гитлеровскую Германию и обеспечить прочный послевоенный мир, заявил участник войны, председатель колхоза имени Второй пятилетки, Фастовского района, тов. Козлов. - В битвах нынеш- ней войны советские и польские воины вы- ступают, как братья по оружию. Отныне дружба СССР с Польшей будет еще боль- ше развиваться и крепнуть. Советский Союз, оказавший помощь Польше в осво- бождении ее от немецких захватчиков, поможет польскому народу быстрее вос- становить его разрушенное немцами хо- зяйство. Все труженики советско10 тыла своим стахановским трудом на заводах и полях самоотверженно помогали и будут помогать доблестной Красной Армии В борьбе за окончательный разгром врага.	vol-6084-page-03-seg-045-3109-2519-3760-3273.png
6084	3	2637	3346	3563	3466	7	0.97171	Немецкому сапогу не топтать больше славянских земель!	vol-6084-page-03-seg-046-2637-3346-3563-3466.png
6084	3	2438	3501	3087	3680	21	0.96387	Просторный зал заполнили филлеры - пехотинцы, артиллеристы, танкисты, лет- чики. Это - вчерашние фронтовики, ныне - слушатели Высших всеармейских военно-политических курсов.	vol-6084-page-03-seg-047-2438-3501-3087-3680.png
6084	3	2434	3688	3087	3903	27	0.95433	Начальник политотдела курсов полков- ник Воронков открывает митинг, посвя- щенный подписанию Договора о дружбе, взаимной помощи и послевоенном сотруд- ничестве между Советским Союзом и Поль- ской Республикой.	vol-6084-page-03-seg-048-2434-3688-3087-3903.png
6084	3	2436	3912	3085	4017	12	0.95205	Начальник курсов гвардии генерал- майор Ковалевский говорит об огромном значении этого документа:	vol-6084-page-03-seg-049-2436-3912-3085-4017.png
6084	3	2436	4028	3087	4382	52	0.95710	Договор выражает волю народов Со- ветского Союза и Польской Республики. В огне освободительной борьбы против не- мецких захватчиков родилась новая демо- кратическая Польша. В огне этой борьбы закалялась братская дружба между наши- ми славянскими народами. Эта дружба за- креплена кровью, пролитой воинами Красной Армии и Польского войска в боях за освобождение Польши,	vol-6084-page-03-seg-050-2436-4028-3087-4382.png
6084	3	2436	4393	3081	4469	6	0.94909	Слово получает слушатель майор Азар сков.	vol-6084-page-03-seg-051-2436-4393-3081-4469.png
6084	3	2436	4480	3087	4660	25	0.93754	Подписание ДогоВора между Совет- ским Союзом и Польской Республикой, говорит он, это новый удар по гитле- ровским разбойникам. Договор гарантирует прочную дружбу между двумя соседними	vol-6084-page-03-seg-052-2436-4480-3087-4660.png
6084	3	3109	3505	3758	4183	90	0.95815	государствами и соответствует интересам обоих народов. горячей речью выступил слушатель курсов майор Овцинов - участник боев за освобождение Польши. Красная Армия, сказал он, в жестоких боях с врагом освободила брат- ский народ Польши, вернула ему нацио- нальную независимость, отнятую немецко- фашистскими захватчиками. Слова то- варища Сталина о том, что мы хотим видеть сильную, независимую и демокра- тическую Польшу, подтверждены теперь Договором о дружбе, взаимной помощи и послевоенном сотрудничестве между Co- ветским Союзом и Польской Республикой. Этот Договор надежный барьер против немецкой агрессии на востоке, залог мо- гущества и независимости Польши.	vol-6084-page-03-seg-053-3109-3505-3758-4183.png
6084	3	3107	4193	3760	4650	62	0.95681	Митинг единогласно принимает резолю- пию, в которой, между прочим, говорится: «Мы переживаем исторические дни. Красная Армия и армии наших союзников наносят последние смертоносные удары по гитлеровской Германии. Войска Красной Армии ведут уже бои в пригородах Берлина. Сила, авторитет нашей Родины признаются всеми народами мира. Договор между Советским Союзом и Польшей - это торжество мудрой сталин- ской политики, залог процветания народов СССР Польши»	vol-6084-page-03-seg-054-3107-4193-3760-4650.png
6084	3	3862	709	4361	865	5	0.97587	МОЩНЫЙ БАРЬЕР ПРОТИВ НЕМЕЦКОЙ АГРЕССИИ	vol-6084-page-03-seg-055-3862-0709-4361-0865.png
6084	3	3779	883	4438	1825	120	0.95475	калинин, 23 апреля. (По телеграфу). Во всех частях калининского гарнизона прошли митинги, посвященные подписа- Договора о дружбе, взаимной помощи и послевоенном сотрудничестве между Co- ветским Союзом п Польской Республикой. Красноармеец Вознюк в своем выступ- лении подчеркнул, что советско-польский Договор лишний раз продемонстрировал последовательность и мудрость внешней политики Советского Союза, направленной на всемерное укрепление единого фронта Об единенных наций против гитлеризма. Только дружба и союз свободолюби- вых народов, сказал тов. Вознюк, обеспечат действительно прочный и дли- тельный мир и не позволят немецким империалистам вновь поднять голову. Во всех подразделениях калининского гарнизона проведены политинформации, бе- седы и читки материалов, опубликованных центральных тазетах. Внимательно вдумываясь в каждое слово, читают бой- цы, сержанты и офицеры речь товарища Сталина, произнесенную им при подписа- нии Договора.	vol-6084-page-03-seg-056-3779-0883-4438-1825.png
6084	3	3804	1880	4407	1982	4	0.96159	КАЗАКИ ДОНА ОДОБРЯЮТ ДОГОВОР	vol-6084-page-03-seg-057-3804-1880-4407-1982.png
6084	3	3777	1999	4436	3043	157	0.95592	РОСТОВ-на-ДОНУ, 23 апреля. (ТАСС). огромным подъемом встретило советское казачество подписание Договора между Co- ветским Союзом и Польской Республикой. Как только по радио был передан текст Договора и речей товарища Сталина и г-на Осубка-Моравского, колхозные агитаторы выехали в полевые станы, чтобы рас- сказать казакам и казачкам об историчес- ком документе. На полях возникли митин- ги, вылившиеся в подлинную демонстра- цию братской дружбы советского и поль- ского народов. Выступивший на митинге председатель колхоза «Украина», Erop- лакского района, тов. Новиков заявил: Заключенный между СССР и Поль- шей Договор - еще одно свидетельство не- разрывной дружбы между народами СССР e- и Польши. Эта дружба возникла во вре- мя войны, в совместной борьбе Красной Армии и Польского Войска против общего врага немецкого фашизма. Каждый из нас, советских людей, горячо, от всей ду- ши приветствует подписание Договора. Каждый из нас стремится к тому, чтобы народы Советского Союза и Польши вечно жили в мире и согласии. Этот Договор помогает общему делу всех Объединенных наций,	vol-6084-page-03-seg-058-3777-1999-4436-3043.png
6084	3	3783	3103	4430	3197	3	0.96422	ДРУЖБА, СКРЕПЛЕННАЯ КРОВЬЮ	vol-6084-page-03-seg-059-3783-3103-4430-3197.png
6084	3	3783	3223	4432	3580	53	0.94627	В жестоких боях и сражениях с извеч- ным врагом германским империализ- мом закалилась дружба Советского Союза Польши. В сентябре 1943 года в бое- вые ряды встала 1-я Польская дивизия имени Тадеуша Костюшко. Вместе с вой- сками Красной Армии она начала вести успешные бон с немецко-фашистскими ордами на дальних подступах к границам своей Родины.	vol-6084-page-03-seg-060-3783-3223-4432-3580.png
