volume_number	page_number	x1	y1	x2	y2	tokens_count	mean_confidence	text	image
5094	2	464	1016	1149	3012	298	0.95667	минометчиков, как и в других родах войск, успех боя во многом зависит от разведки. По десяткам мелких, неулови- мых, на первый взгляд, признаков мино- метные разведчики угадывают и опреде- ляют огневые точки врага. Взобравшись на ель на опушке леса или на чердак полу- разрушенной коды, они терпеливо наблю- дают и подмечают: бревно лежит иначе, не так, как вчера, среди поля низко сте- лется на снегом едва заметный дымок Значит, здесь зарылся немеп. Однажды боец Теоргий Бакакин незамет- но подобрался к занятой противником де- ревне и увидал, что фашисты поджигают дома. Чего они так торопятся, если наше наступление еще не начиналось? Бакакин продолжал наблюдать. На другой день он увидел, что фаннисты сустятся на пепели- щах обнаженных домов, устраивают здесь блиндажи дзоты. Бакакин засек места вражеских укреплений. и минометчики за- сыпали их нинзми, а наша пехота с незна- чительными потерями заняла деревню, на- колившуюся на скрещении важных дорог. В другой раз разведчики установили, что немцы, готовя оборону деревни, вынесли укрепления далеко в сторону. Там они за- рысь в землю, надеясь, что наша пехота попадет под их Фланкирующий огонь. внести пахотой перемещались вперед и огневые позиции минометных батарей. Немецкие блиндажи были разрушены. : Стрельбой из минометов управляют мо- лодые, но опытные командиры. Лейтенанты Башаков, Жариков, Принцев, Верховцев - подлинные мастера своего дела. Чтобы ви- деть врага, они иногда подолгу ползут в белых халатах по глубокому снегу и, уме- преодолевая все препятствия, пробира- ится к наблюдательным пунктам. В одном 13 последних боев наблюдательный пункт лейтенант Вертовцева находился всего в 50 метрах от противника. Двадцатилетний лейтенант Верховцев- лучший корректировщик огня. Из ниноме- га он стреляет так, как хороший снайпер бьет из винтовки, -быстро и точно. На пристрелку полагается четыре мины, а Верховцев со второго-третьего выстрела непременно накрывает цель. Кроме того, он мастер ложных переносов огня. II хотя этот прием всем хорошо известен, Верхов-	vol-5094-page-02-seg-007-0464-1016-1149-3012.png
5094	2	1171	1028	1833	1545	84	0.95747	цев применяет его так, что противник всегда попадает в западню. Немецкие автоматчики засели в дерев- не. Правее находился лес, а в лесу возле высоты- перекресток дорог. Сделав при- стрелку по деревне, Верховцев выпустил несколько мин по высоте и прекратил огонь. Немцы оттянули свои силы из де- ревни на опушку леса и тоже стали вы- делать. Они рассчитывали, что последует беглый огонь либо по деревне, либо по перекрестку дорог у высоты. Но Верховного внезапно открыл сильный огонь по опушке леса. Большая группа фашистов была уничтожена.	vol-5094-page-02-seg-008-1171-1028-1833-1545.png
5094	2	1163	1549	1827	2274	114	0.96149	Вместе с Верховцевым учился миномет- ному делу лейтенант Кошоков, осетин по национальности. Кошаков принял командо- вание батареей на поле боя. Это было больше двух месяцев назад, когда немцы потеснили нашу часть. Врагу удалось не- ожиданно прорваться как раз на том уча- стке, где были минометчики. В штабе уже пронесся слух, что все расчеты погибли, но они остались целы и невредимы. Под огнем немецких автоматчиков Кошоков сплотил вокруг себя бойцов и с боем вы- шел из вражеского кольца. На протяжении нескольких километров минометчики вели непрерывный огонь по наседавшим фа- шистам. Один расчет стрелял, а остальные отходили, потом разворачивался другой и выручал товарищей. С тех пор Кошоков всегда впереди, и бойцы смело идут за отважным лейтенантом.	vol-5094-page-02-seg-009-1163-1549-1827-2274.png
5094	2	1157	2282	1817	2814	65	0.95443	Командир подразделения Тененбаум комиссар Шилин склонились над картой... Получен новый боевой приказ. Спова впе- ред, на запад. Бойцы-минометчики воз- буждены, каждый желает скорсе встре- титься с врагом. На-днях они видели в церкви освобожденного города Bepensa зверски замученных раненых красноар- мейцев, попавших к немцам в плен. Ми- нометчики поклялись тогда отомстить гитлеровцам, беспощално истреблять не- менных оккупантов. Свое оружие они считают особенно подходящим для этого дела.	vol-5094-page-02-seg-010-1157-2282-1817-2814.png
5094	2	1159	2824	1811	2928	13	0.93331	C С каждым днем растет количество ми- нометных подразделений, растут кадры наших минометчиков.	vol-5094-page-02-seg-011-1159-2824-1811-2928.png
5094	2	1187	2972	1527	3002	2	0.96288	ЗАПАДНЫЙ ФРОНТ...	vol-5094-page-02-seg-012-1187-2972-1527-3002.png
5094	2	648	3080	1625	3140	5	0.97024	За смерть брата и товарища	vol-5094-page-02-seg-013-0648-3080-1625-3140.png
5094	2	458	3158	1129	3975	124	0.95464	Южный фронт, 5 февраля. (По теле- графу от наш. спец. корр. ). экишах командира машины Витина входили два брата Цукановых. Василий был водителем, Виктор башенным стрелком. Братья не раз участвовали в жарких боях с фаши- стами, проявляя мужество, стойкость, уме- ние отлично владеть техникой. Недавно четыре наших танка, в тем число машина Витона. прокладывали путь пехоте к укрепленному немцами саду. Ожесточенным артиллерийским огнем встретили их фашисты. Один снаряд про- бил башенный люк, и осколком был убит отважный танкист Виктор Цуканов. Василий Цуканов не потерял самообла- дания. Он поклялся отомстить врагу за смерть брата. На место стрелка сет в баш- радист Староверов. Танк продолжал свой боевой путь. Видя, что аргимерия не в силах оста- новить советских танкистов, гитлеровцы ввели в бой свои девятнадцать танков. Про-	vol-5094-page-02-seg-014-0458-3158-1129-3975.png
5094	2	1615	2936	1773	2968	2	0.95612	И. ДЕДОВ...	vol-5094-page-02-seg-015-1615-2936-1773-2968.png
5094	2	1145	3158	1811	3969	125	0.96325	тив четырех советских! Не дрогнули наши славные танкисты, смело ввязались в оже- сточенную схватку. Умело маневрируя они взяли инициативу боя в свои руки и стали громить врага метким огнем. Вскоре одна фашистская бронированная машина загоре.тась, другая заглохла с под- битой гусеницей. Остальные семнадцать поспешили удрать. А танк Витина начал беспощадно крошить вражеские огневые точки, разрушать окопы, щели. блиндажи. Крепко расплатился Василий Пуканов весь экипать за смерть брата. Не де- сяток фашистов нашел себе могилу под огнем и гусеницами танка. Сутки пробыть в бото танк Витина. Все это время рядом Василием Цукановым находилось тело его погибшего брата, без- молвно взывая к мщению. Башенный стре- ток был похоронен тогда, когда наши ча- сти разгромили сильный узел сотрогивле- ния фашистов и пехота окончательно за- крепилась в занятом районе.	vol-5094-page-02-seg-016-1145-3158-1811-3969.png
5094	2	1937	1623	2918	1653	8	0.93388	Южный ФРОНТ. На снимке: партизаны выходят на разведку	vol-5094-page-02-seg-017-1937-1623-2918-1653.png
5094	2	3499	1613	3781	1643	3	0.90772	Снимок И. Тофана	vol-5094-page-02-seg-018-3499-1613-3781-1643.png
5094	2	2073	1719	3661	1821	7	0.93688	Почему атака не была доведена до коне-	vol-5094-page-02-seg-019-2073-1719-3661-1821.png
5094	2	2380	1835	3359	1871	5	0.90731	(От специального корреспондента «Красной звезды»	vol-5094-page-02-seg-020-2380-1835-3359-1871.png
5094	2	1837	1887	2508	3339	237	0.96445	Бой, проведенный батальоном, которым командует старший лейтенант Коваленко протекал и закончился успешно. Батальон продвинулся вперед на два километра, истребил более 300 фашистов, захватил 4 орудия, 5 станковых и 28 ручных пуле- метов. Если рассматривать эти результаты вне конкретной тактической обстановки, то можно заявить, что руководство действи- ями батальона было безошибочно и благо- приятные моменты в ходе боя использо- ваны до конца. Однако более вниматель- ный анализ показывает, что батальон вполне мог достигнуть большего, если бы в решающие минуты не остановился на полпути и ловил атаку по полного успеха. Боевая задача была получена в полдень. Требовалось сбить фашистов с важных по- зиций. Ночью батальон, имея две роты первом эшелоне, а третью во втором, дви- нулся вперед. Враг находился на расстоя- нии одного километра. и вся местность впереди обстреливалась пулеметным и мн- нометным огнем. Небольшое количество ка- нав и воронок от снарядов но позволило бы бойцам укрываться от огня днем. Поэтому решение командира наступать ночью бык вполне правильным. Темнота давала воз- можность скрытно подойти вплотную к вражеским позициям и обрушить на нем- цев всю силу огня и штыкового удара. Поднявшийся ветер со снегом немало способствовал осуществлению замысла. Первый эшелон батальона бесшумно под б- рался к противнику, неожиданно забросал его гранатами, а затем дружной штыков й атакой выбил из окопов. Фашисты пани- ке бежали, оставив больше сотни трупов, 10 15 пулеметов. Наши бойцы по пятам преследовали немцев, уничтожали их ком и прикладом. Стрельба в такой момент опасна можно поразить своих.	vol-5094-page-02-seg-021-1837-1887-2508-3339.png
5094	2	1835	3343	2496	3967	99	0.96170	Немцы отступили за широкий, наполнен- ный водой противотанковый ров и откры- ли оттуда беспоряючный огонь. Наши ро- ты, достигнув противотанкового рва. за- вязали перестрелку с неприятелем. Вско- ре командир батальона Козалепко приказал бойцам окопаться. Наступление временно задержалось, потому что не оказалось переходных мостиков. Окопавшись, батальон пробыл злость 10 утра и с рассветом опять пошел в атаку. Он действовал весьма искусно, но лишь с большим трудом продвинулся еще на кило- метр вперед. Правда, при этом были за- хвачены орудия и пулеметы, которые фа- шисты успели за ночь подтянуть на этот участок. Вклинтвшись расположение врага и прочно засев здесь, батальон В	vol-5094-page-02-seg-022-1835-3343-2496-3967.png
5094	2	2528	1891	3186	2402	84	0.96277	дальнейшем облегчил наступление соседей Таким образом успешные по своему об шему итогу действия батальона распала ются на два этапа ночной и дневной Между ними была многочасовая пауза Она-то и явилась, на наш взгляд, серьез ной тактической ошибкой. Ведь противня! отступал. был дезорганизован, моральн подавлен внезапностью нанесенного удар. и большими потерями. Лучших условий для преследования и желать нельзя иди по пятам, не отрываясь, бей врага как говорится, и в хвост и в гриву. Одна ко командир батальона задержал своих бойцов у рва из-за отсутствия мостиков.	vol-5094-page-02-seg-023-2528-1891-3186-2402.png
5094	2	2520	2418	3184	2960	90	0.95819	Одно дело, когда подразделение натолк- нулось на мощный организованный отпор Тут, хочешь не хочешь, а надо залечь... осмотреться, произвести разведку, удачнее расставить огневые средства. подготовить обходный маневр и т. 1. Но в данном слу- чае обстановка вполне благоприятствовала дальнейшему наступлению. Отдельных не- мецких автоматчиков можно было уничто- жить, форсировав ров. Правда, под рукой по было перекидных мостиков или же бре- вен. Днем их не подготовили, хотя было достаточно свободного времени. По и при отсутствии мостиков можно было кое-что- сделать, лишь бы не терять времени, не выпускать из рук боевую унициативу.	vol-5094-page-02-seg-024-2520-2418-3184-2960.png
5094	2	2520	2976	3178	3457	77	0.96014	Следовало, не задумываясь, с хода пе- ребросить вброл группы бойцов с пуле метают на ту сторону рва. Пока бы эти смельчаки (а в батальоне таких доста- точно!) очищали местность от фашистов можно было из ремней и веревок изго товить импровизированный перекидной мо- стик и переправлять по нему отдельные партии стрелков. Конечно, преодолевая ров, некоторые войны вымокли бы. Но они смогли бы потом, отойдя в тыл, об- сушиться. Такие трудности обычны на войне и не останавливают красноармей- цев.	vol-5094-page-02-seg-025-2520-2976-3178-3457.png
5094	2	2520	3477	3178	3963	68	0.96114	этот чрезвычайно ответственный мо- мент командир батальона тов. Коваленко. показавший себя в дальнейшем хорошим организатором боя, не проявил должной настойчивости. Прошло больше часа. пока подразделения привели себя в порядок в заняли новые места для атаки. Bpar опра- вился от первого удара, окопался. стал вести более планомерный огонь. тогда уже попытка нескольких бойцов перепра- виться сорвалась. Инициатива огневого нападения стала переходить к неприя- телто. Возможности для наступления все же	vol-5094-page-02-seg-026-2520-3477-3178-3963.png
5094	2	3212	1885	3873	2272	66	0.95453	еще не были исчерпаны. Энергичной раз- вилкой можно было нащупать слабые ме- ста вражеской обороны и ударить по ним или же бросить в бой свежую, третью роту для обхода позиций врага с флан- гов, пока он не успел подтянуть из тыла орудия и минометы. Только следовал с действовать быстро, решительно, не раз. лумывая, помнить о том, что инициативу упустить легко, а вернуть обратно го разло труднее.	vol-5094-page-02-seg-027-3212-1885-3873-2272.png
5094	2	3208	2282	3873	2768	73	0.95874	Пока командир батальона решал, кан будет удобнее переправить бойцов чере ров, искал легкого выхода из положения с флангов открыли стрельбу немецкие ав- томатчики. попытки заставить ба- тальон откатиться назад были тщетны но потребовалась борьба с ними, и на это ушла вся ночь. Автоматчиков поддержа - ли минометы, открывшие заградительный огонь перед рвом, раздалось несколько орудийных выстрелов. Волей-неволей при- шлось ждать рассвета, чтобы точнее оп- релелить огневые точки фашистов и за- тем ударить наверняка.	vol-5094-page-02-seg-028-3208-2282-3873-2768.png
5094	2	3204	2778	3869	3196	65	0.95630	Таким образом ночной этап боевых действий не закончился полным уничто- жением перцев на этом участке, и атака батальона задержалась на полпути. На- чался более трудный, дневной этап на- ступления. Здесь тов. Коваленко прило- лил все усилия, чтобы наверстать поте рянное. Оп правильно и остроумно рас- ставил огневые средства, умело пепользо- вал группы автоматчиков и, разрезав их помощью немецкую оборону на ря изолированных секторов, достиг успеха.	vol-5094-page-02-seg-029-3204-2778-3869-3196.png
5094	2	3202	3202	3863	3915	107	0.96039	Бойцы батальона действовали дерзко сноровисто, ноказав образцы боевой 10- блести. Так, красноармеец Ерофеев унич- тожил два вражеских пулемета вместе расчетами, лично истребил огнем и при- клатом более дваццати фашистов. Тем обиднее, что ночью батальон оста- новился в самый выгодный для преследования дования момент, не использовал до конца растерянность и бессилие немцев. Насту- пление особенно эффективно тогда, когда оно протекает непрерывно, когда села урала нарастает, подобно снежной лави не. Не буль этой досадной паузы в лей- ствиях ночью, батальон сумел бы с мень- шими усилиями и потерями добиться еще более серьезных успехов, и потери фаши- стов в живой силе, в технике, в террито- рии были бы гораздо значительнее.	vol-5094-page-02-seg-030-3202-3202-3863-3915.png
5094	2	3447	3925	3817	3959	2	0.93069	Капитан Слесарев	vol-5094-page-02-seg-031-3447-3925-3817-3959.png
5094	2	578	4063	2388	4167	3	0.97030	Вторые задачи истребителей	vol-5094-page-02-seg-032-0578-4063-2388-4167.png
