volume_number	page_number	x1	y1	x2	y2	tokens_count	mean_confidence	text	image
5763	1	971	348	2139	407	2	0.92821	Смерть нов	vol-5763-page-01-seg-002-0971-0348-2139-0407.png
5763	1	275	432	2193	782	7	0.97200	ЦЕНТРАЛЬНЫЙ ОРГАН НАРОДНОГО КОМИССАРИАТА ОБОРОНЫ СОЮЗА ССР	vol-5763-page-01-seg-003-0275-0432-2193-0782.png
5763	1	321	806	732	865	2	0.94599	83 (5763)	vol-5763-page-01-seg-004-0321-0806-0732-0865.png
5763	1	965	819	1531	865	5	0.94018	7 апреля 1944 г., пятница	vol-5763-page-01-seg-006-0965-0819-1531-0865.png
5763	1	1848	815	2171	867	2	0.85318	ЦЕНА 20 КОП.	vol-5763-page-01-seg-007-1848-0815-2171-0867.png
5763	1	2318	444	3256	840	58	0.92576	От Советского Информбюро. Оперативная свод- ка за 6 апреля (1 стр. ). . Указы Президиума Верховного Совета СССР (1 стр. ). Письма трудящихся товарищу Сталину и ответы товарища Сталина (2 стр. ). По Полковник В. Желанов. -- Управление артилле- рийским огнем из танка (2 стр. ). Капитан А. Беляев, --- Отражение немецких атак юго-западнее Тарнополя (2 стр. ).	vol-5763-page-01-seg-009-2318-0444-3256-0840.png
5763	1	3349	436	4284	840	53	0.92992	Старший лейтенант В. Курбатов. -- На (2 стр. ). Подполковник П. Коломейцев. -- Окружение (3 стр. ). Гвардии полковник С. Пшеничный. Политиче- ская работа в ходе боя (3 стр. ). Илья Эренбург. -- Фрицы с запада (3 стр. ). ОБЗОР ПЕЧАТИ. - Конкретнее и глубже про- пагандировать боевой опыт гвардейцев (4 стр. ).	vol-5763-page-01-seg-010-3349-0436-4284-0840.png
5763	1	363	942	1515	1225	8	0.88763	Наступающим наземным войскам - активную поддержку с воздуха	vol-5763-page-01-seg-011-0363-0942-1515-1225.png
5763	1	271	1260	927	1806	73	0.95801	Наступление наших более продолжает- ся. В ходе его оперативная и тактическая обстановка изобилует острыми моментами. Их порождает маневренная тактика Крас- пой Армии, с помощью которой вражеские группировки дробятся, расчленяются на части, а затем подвергаются окружению и уничтожению. В подобных условиях перед нашими авиационными командирами и летчиками встает ряд весьма ответствен- ных задач. Свонул активными действия- ми на поле боя и немецких томах сны призваны всемерно облегчить наземным войскам разгром силы и техники пративника.	vol-5763-page-01-seg-012-0271-1260-0927-1806.png
5763	1	267	1823	921	2408	83	0.95874	Маневр, широко применяемый нашей пехотой и танками, требует подобной же маневренной тактики от бомбардировщи- ков, штурмовиков и истребителей. Разгром крупных группировок путем преследова- ния и окружения осуществляется тем быстрее и с меньшей затратой сил, чем активнее участвует в ппм авиация. При- нято считать, что в наступлении огонь с воздуха должен исполнять п усиливать ар- тиллерийское воздействие на противника при прорыве его стороны или штурме опорных пунктов. Но одного этого мало! нынешних сражениях взаимодействие авиации с наземными войсками может выливаться в самые различные формы.	vol-5763-page-01-seg-013-0267-1823-0921-2408.png
5763	1	257	2427	919	3193	114	0.95626	Наглядным примером маневренного вза- " пыодействия «воздуха» и «земли» могут дослужить действия N авиасоединения, имевшие на-днях место на юге. Здесь на одном участке фронта наши наземные войска из-за распутицы не угли сразу охватить одну группу немецких войск в кольцо. Подвижным отрядам удалось зайти тыл врагу и перерезать ле- которые коммуникации. Однако немцы могли просачиваться вие дорог. Тогла на помощь пришла авиация, которая оконча- тельно лишила врага возможности выйти из-под удара. Эту задачу блестяще реши- ип штурмовики. Они по сути дела зам- кнули кольцо. Целыми днями небольшие группы "Ильюшиных-2" ходили по этому кольцу, одновременно ведя разведку рай- она окружения. Как только враг делал по- пытку пробиться на запад, он немедленно подвергался мощным ударам с воздуха.	vol-5763-page-01-seg-014-0257-2427-0919-3193.png
5763	1	255	3210	911	3758	79	0.95720	Известно, что одним из наиболее эф- фективных методов поддержки наземных войск с воздуха являются сосредоточен- ные удары бомбардировщиков и штурмо- виков. Однако боевая практика зпает мно- го примеров, когда по условиям наземной и воздушной обстановки реальную по- мощь сойскам могут оказать и небольшие группы самолетов. В ряде случаев на том другом участке фронта изменчивая погода может долустать только такие по- леты. Отказ от них был бы ошибочен. Важно так спланировать осуществить ати вылеты, чтобы воздействие на грага было непрерывным.	vol-5763-page-01-seg-015-0255-3210-0911-3758.png
5763	1	248	3774	907	4834	165	0.95927	В нынешней обстановке ата непрерыв- ность авиационного воздействия приобре- тает особое значение. Продолжая спрос тивляться на одном рубеже, немцы уже готовятся к обороне на другое. Непрерыв- ная воздушная разведка должна своевре- менно и полно вскрыть замысел врага, най- ти его новый рубеж, сосредоточение огне- вых средств и резервы. Это дает материал для решения общевойсковым команди- ром очередной задачи на маневр и окру- жение; это дает возможность определен- ным группам боевой авиации обрушиться на врага огнем с воздуха, помешать ему спокойно готовиться к отражению наших атак. Отходя под ударами наших войск и в свою очередь изневрируя, немцы стара- ются всеми мерами выскользнуть из окру- акения, сохранить свою живую силу и технику. Непрерывными ударами с возду- ха по отходящим колонну противника штурмовики и бомбардировщики обязаны не только замедлять темп отхода неприя- тельских войск, но и ставить их в без- выходные условия, создавая пробки на дорогах, разрушая переправы, настигая немцев в дефиле, сголяя их с дорог в по- ле и тем самым подставляя под удар наших подвижных частей.	vol-5763-page-01-seg-016-0248-3774-0907-4834.png
5763	1	244	4855	904	5488	81	0.94745	В условиях маневренного наступления, проводимого на широком фронте, перед каждым летчиком, появившимся над пе- приятелем, возникает множество целей. Там заблокированный нашей пехотой опорный пункт немцев; здесь - колонна отходящих войск противника; поблизости застрявшие в грязи автомашины с бое- припасами; тут - окопы и артиллерий- ские позиции; на железнодорожной стан- ции эшелоны... Куда в первую очередь направить сеой удар? Какая цель важнее? Решая это, авиационный офицер всегда должен исходить из того, чтобы своими действиями всемерно облегчить работу на- тей пехоты и танков.	vol-5763-page-01-seg-017-0244-4855-0904-5488.png
5763	1	940	1256	1596	1764	68	0.96339	Инициативно и грамотно разбираясь сложившейся обстановке, всё время под- держивая живую связь с общевойсковыми командирами, авиационные начальники обязаны подвергать ударам с воздуха первую очередь именно то, что является в данный момент решающим. Надо помнить, что готовых рецептов, годных в любой обстановке, не существует. Успех взаи- модействия авиации с наземными войска- ми в условиях широкого маневра зиждется прежде всего на инициативе и решатель- пости авиационных командиров и самих летчиков.	vol-5763-page-01-seg-018-0940-1256-1596-1764.png
5763	1	936	1777	1590	2427	98	0.95872	В свою очередь общевойсковые началь- ники обязаны приложить максимум уси- лий к тому, чтобы получить от действий авиации желаемые результаты. Мало ска- зать: "Бейте в такой-то квадрат". Выле- тающие сюда подразделения боизарлиров- ящиков штурмовиков должны быть всё время связаны с действующими здесь на- шими войсками. В обстановке маневрен- ного наступления порою возможны извест- ное перемешивание частей, неожиданные изменения в направлении их движения. Поэтому «земля» в любую минуту должна быть готова к показу условными сигнала- ми: "Мы - свои войска" и к нацелива- нию той или другой группы самолетов на новые, более важные в сложившейся об- становко объекты поражения.	vol-5763-page-01-seg-019-0936-1777-1590-2427.png
5763	1	927	2435	1587	4501	270	0.95919	Помимо всего этого общевойсковые командиры обязаны своевременно исполь- завывать в своих интересах результаты штурмовых и бомбардировочных ударов. Эффект авиационной поддержки заклю- чается не только в количестве уничто- женных машин, танков, орудий и живой силы противника. Одного этого мало. Следует добиваться, чтобы сила авиаци- онного удара была тотчас использована «землей». Если штурмовики огнем с воз- луха создали пробку на дороге и подвер- гают непрерывному воздействию сгрудив- шиеся здесь силы врага, - пехота и танки обязаны соответствующим манером развить этот успех, добить противника. Если нашим летчикам удалось разбить ие- реправы врага, -- наземные войска обя- заны без промедления усилить натиск на прижатого к реке противника и, пользу- ясь возникшей паникой, в сжатые сроки разгромить его. Штурмовики и бомбардировщики в на- ступлении призваны оказывать непосред- ственную огневую п маневренную под- держку наземным войскам. Перед истре- бителями стоят по менее важные задачи. За последние три месяца боев наши ист ребители совместно зенитчиками уже сбили не одну тысячу немецких самолетов. Однако немцы не оставляют попыток за- держивать наше наступление контратака- с воздуха. На отдельных участках фронта они поднимают в небо крупные группы самолетов, направляя их в пер- вую очередь на наши подвижные соеди- нения, переправы, войсковые тылы и т. д. Изгоняя вражескую авиацию с поля боя. сопровождая свои бомбардировщики и штурмовики, наши истребители вместе с тем обязаны надежно прикрывать всё расположение своих войск. Эта их дея- тельность должна проходить при самом тесном взаимодействии с зенитной артил- лерией. Командиры истребительных ча- стей обязаны применять инициативные приемы борьбы, парируя попытки врага не только стандартными действиями воз- душных патрулей, но и методом боевой работы пз засад, путем свободной охоты. перехвата воздушного противника на мар- шрутах и т. д.	vol-5763-page-01-seg-020-0927-2435-1587-4501.png
5763	1	919	4514	1577	5120	86	0.95003	Весенняя распутица и бездорожье ста- вят перед авиацией еще такую весьма важную задачу, как снабжение боеприпа- сами наших маневрирующих частей. В боях под Николаевом одна из таких ча- стей, прорвавшихся в тыл врага, в тече- ние нескольких дней получила по воздуху до тысячи тонн груза. Это позволило ей вести активные бон, не выпуская из меш- на отступавших немцев. Транспортировка боеприпасов, продовольствия и других гру- 30В - важный и ответственный участок - действий авиации, Эта работа, как и воз- действие на врага огнем, должна быть не- прерывной.	vol-5763-page-01-seg-021-0919-4514-1577-5120.png
5763	1	919	5126	1571	5484	47	0.96095	Наступление продолжается. Деятельно разрабатывая и применяя всё новые прие- мы и способы взаимодействия с наземны- войсками, неустанно громя немцев в воздухе, на поле боя, в тылу и на ком- муникациях, наши летчики будут способ- ствовать этим дальнейшему нарастанию силы наших ударов по врагу, дальнейшим победам советского оружия.	vol-5763-page-01-seg-022-0919-5126-1571-5484.png
5763	1	332	5573	1487	5680	9	0.96754	ЖЕЛЕЗНОДОРОЖНЫЙ ТРАНСПОРТ ПЕРЕВЫПОЛНИЛ ПЛАН ПЕРЕВОЗОК 1-го КВАРТАЛА 1944 ГОДА	vol-5763-page-01-seg-023-0332-5573-1487-5680.png
5763	1	248	5701	900	6028	34	0.94306	Железнодорожники Советского Союза. воодушевленные исторических докладом товарища Сталина 6-го ноября 1943 г. и величайшими победами красной Армии, выполняя свои обязательства, данные в письме железнодорожников товарищу Сталину, перевыполнили план 1-го кзар- тала январь, февраль, март).	vol-5763-page-01-seg-024-0248-5701-0900-6028.png
5763	1	250	6036	892	6148	15	0.93282	План погрузки за март выполнен на 102.8 прод. и за 1-й квартал на 102;6 проц.	vol-5763-page-01-seg-025-0250-6036-0892-6148.png
5763	1	915	5701	1569	6136	53	0.94664	Среди железнодорожников развертывает- ся новый подъем предмайского социали- стического соревнования за выполнение и перевыполнение апрельского плана по- грузки, за сще лучшее обслуживание нужд фронта и оказание помощи нашей доблестной Красной Армии, которая под искусным водительством великого Марша - ла Советского Союза товарища Сталина успешно изгоняет немецко-фашистских захватчиков с нашей священной совет- слой земли	vol-5763-page-01-seg-026-0915-5701-1569-6136.png
5763	1	1673	938	2874	1036	3	0.97331	ОТ СОВЕТСКОГО ИНФОРМБЮРО	vol-5763-page-01-seg-027-1673-0938-2874-1036.png
5763	1	1765	1052	2785	1109	5	0.97321	Оперативная сводка за 6 апреля	vol-5763-page-01-seg-028-1765-1052-2785-1109.png
5763	1	1619	1138	2929	2121	208	0.94860	В течение 6 апреля наши войска продолжали вести бои по уничтожению окруженной группировки противника в районе западнее СКАЛА и, снимая кольцо окружения, овладели рядом опорных пунктов обороны немцев и среди них СКАЛА, БОРЩОВ, МЕЛЬНИЦА-ПОДОЛЬСКАЯ, ЦЫГАНЫ. При этом нашими войсками захва- чены следующие трофеи: танков --- 6, самолетов на аэродроме транспортных 29, истребителей --- 4, автомашин --- 600 и другое военное имущество. Одно- временно к юго-западу от города ТАРНОПОЛЬ наши войска отбивали атаки круп- ных сил пехоты и танков противника, стремившихся пробиться на помощь к своей окруженной группировке. В ходе ожесточенных боев противник понес большие по- тери в живой силе и технике. На КИШИНЕВСКОМ направлении наши войска продолжали вести наступатель- ные бои, в ходе которых заняли несколько населенных пунктов. На ОДЕССКОМ направлении наши войска, развивая наступление, овладели районным центром Одесской области ГРОСУЛОВО, также с боями заняли более 100 других населенных пунктов, в том числе крупные населенные пункты МЕ- щанка, ково-Петровка, поплавское, карманоВО, МАРЬЯНОВКА, КОНСТАН- ТИНОВКА, НОВО-ВАНДАЛИНКА, БЛАГОЕВО, АЛЕКСАНДРОВКА, ПАВЛИНКА, КО- ВАЯ КУБАНКА, БЛАГОДАТНОЕ, СВЕРДЛОВА (22 нилометра северо-восточнее ОДЕССА) и железнодорожную станцию КАРПОВО (юго-восточнее РАЗДЕЛЬНАЯ). На других участках фронта --- бои местного значения. В течение 5 апреля наши войска на всех фронтах иодбили и уничтожили 84 немецких танка. В воздушных боях и огнем зенитной артиллерии сбито 44 са- молета противника.	vol-5763-page-01-seg-029-1619-1138-2929-2121.png
5763	1	1608	2196	2262	2733	76	0.96355	Войска 1-го Украинского фронта про- должали вести бон по уничтожению груп- инровки противника, окружелной в райо- не западнее города Скала. Части II-ского соединения нанесли немцам удар с во- стока и выбила их из опорных пунктов Скала, Борщов, Мельница-Подольская, Цыганы и ряда других населенных пунк- тов. Противник понес тяжелые потери. Только в районе населенных пунктов Иванков и Мушкатовка уничтожено свы- ше 1.000 немецких солдат и офицеров. Отступая, гитлеровцы сожгли и взорвали десятки танков, бронетранспортеров и много автомашин.	vol-5763-page-01-seg-031-1608-2196-2262-2733.png
5763	1	1600	2743	2258	3385	85	0.96898	Немцы крупными силами днем и ночью предпринимали контратаки в западном направлении, стремясь прорвать кольцо окружения. Советские артиллеристы, тан- кисты и пехотинцы всюду встречают гит- леровцев- плотной стеной не, производя опустошения в рядах противника. Частн одного нашего соединения, отбивая вра- жеские контратаки, уничтожили до пол- ка немецкой пехоты. Советские летчики, блокируя с воздуха район расположения окруженной группировки противника, в течение дня сбили в воздушных боях 19 немецких самолетов. Захваченные в плен немецкие солдаты рассказывают, что старшие немецкие офицеры улетают на транспортных самолетах из района окру- жсния.	vol-5763-page-01-seg-032-1600-2743-2258-3385.png
