volume_number	page_number	x1	y1	x2	y2	tokens_count	mean_confidence	text	image
5848	4	965	1952	1625	2137	33	0.98009	Джонстон утвердительно ответил на во- прос о том, все ли советские закупки про- изводятся советским правительством, и указал, что он не замечал никаких призна- ков возвращения к тому, что американцы называют частной инициативой.	vol-5848-page-04-seg-011-0965-1952-1625-2137.png
5848	4	963	2150	1627	2939	135	0.96917	Джонстон заявил, что он сомневается в том, чтобы Советский Союз покупал после войны значительные количества потреби- тельских товаров в США, так как он хо- чет производить эти товары .самостоятель- но. Однако Советский Союз будет охотно покупать машинное оборудование для про- изводства потребительских товаров. Он указал, что обсуждал вопрос о советско- американском товарообмене, однако без особой детализации, вследствие того, что война еще не закончилась и условия не определились. Джонстон указал, что това- рообмен возможен, однако Советский Союз рассчитывает оплачивать закупки в Соеди- ненных Штатах либо золотом, либо ино- странной валютой, полученной в результате экспорта в соседние страны или на дру- гие рынки. Отвечая на вопрос ТОМ, исходили ли Сталин и Джонстон из пред- положения о том, что капиталистическая страна может заключать сделки с комму- нистической, Джонстон ответил, что они, несомненно, «считали это само собой разу- меющимся».	vol-5848-page-04-seg-012-0963-2150-1627-2939.png
5848	4	336	3020	1565	3056	4	0.97732	МЕЖПАРЛАМЕНТСКИЙ КОНГРЕСС АМЕРИКАНСКИХ СТРАН	vol-5848-page-04-seg-013-0336-3020-1565-3056.png
5848	4	277	3074	942	3268	28	0.94688	МЕКСИКО. 15 июля. (ТАСС). Парла- ментские комиссии США, Мексики, Перу. Уругвая, Колумбии, Сальвадора, Костари- ки, Никарагуа, Панамы и Чили решили собраться на межпарламентский американ- ский конгресс. Создается специальный	vol-5848-page-04-seg-014-0277-3074-0942-3268.png
5848	4	959	3077	1617	3266	28	0.96957	организационный комитет, который зай- мется подготовкой к конгрессу. Предсе- дателем комитета является Педро Кастель бланко (президент палаты депутатов чи- лийского парламента). От США в коми- тег назначен Харман.	vol-5848-page-04-seg-015-0959-3077-1617-3266.png
5848	4	423	3341	1502	3378	7	0.88368	Французские патриоты повредили кабель Париж - Берлин	vol-5848-page-04-seg-016-0423-3341-1502-3378.png
5848	4	277	3389	938	3545	21	0.96308	ЛОНДОН, 15 июля. (ТАСС). Как пере- дает агентство Рейтер, по полученным вс французских кругах сведениям, француз- ские патриоты повредили подземный ка-	vol-5848-page-04-seg-017-0277-3389-0938-3545.png
5848	4	959	3387	1617	3545	27	0.96157	бель, соединяющий Париж с Берлином. В департаменте Вьенна выведена из строя ли- ния высокого напряжения, по которой пе- редавалась электроэнергия на базу подвод- ных лодок в Рошфоре.	vol-5848-page-04-seg-018-0959-3387-1617-3545.png
5848	4	1731	434	2252	619	6	0.94965	ЗАЯВЛЕНИЕ ЮГОСЛАВСКОГО министра внутренних дел КОССОНОВИЧА	vol-5848-page-04-seg-019-1731-0434-2252-0619.png
5848	4	1652	642	2320	1217	90	0.96635	нью-йорк, 15 июля. (ТАСС). Юго- славский министр внутренних дел Коссо- нович в беседе радиокомментатором Гильмаром заявил, что создание нового югославского правительства означает реши- тельный поворот в югославской политиче- ской жизни и является симптоматичным для нового подхода к европейским пробле- мам. Югославская борьба за освобождение продемонстрировала не только мужество и патриотизм югославов, но также их поли- тическую зрелость. В неумолимой борьбе против немцев и квислингов сербы, хор- ваты и словены не только сохранили единство, но и заложили. основы подлинно народной демократии. Новое югославское правительство представляет собой логиче- ский результат этого развития.	vol-5848-page-04-seg-020-1652-0642-2320-1217.png
5848	4	1650	1221	2314	1694	74	0.97056	На вопрос Гильмара, как югославское правительство намеревается разрешить сербско-хорватскую проблему, Коссонович сказал, что проблема, стоящая перед Юго- славией, заключается в борьбе между де- мократией и фашизмом, а не в борьбе ме- жду сербами и хорватами. Югославы хо- тят единства и демократии, при наличии которых будут разрешены все второстепен- ные проблемы. Югославская армия, состоя- шая из представителей всех национальных рупп, религий и политических партий, служит наилучшим доказательством того, что демократия и единство будут достиг- нуты.	vol-5848-page-04-seg-021-1650-1221-2314-1694.png
5848	4	1648	1706	2310	2150	71	0.97388	Комментируя выдвинутое Фотичем обви- нение, что новое югославское правитель- ство якобы не имеет в своем составе сер- веб, Коссонович указал, что он сам, а так- же член правительства Вукосавлевич сербы, а король Петр является правнуком Кара-Геэргия - основателя современного сербского государства. Коссонович сказал, что новое правитель- ство призывает всех югославов объединить- ся под руководством Тито в войне про- тиз Гитлера. Всякий, кто отказывается от- кликнуться на этот призыв, помогает Гит- леру.	vol-5848-page-04-seg-022-1648-1706-2310-2150.png
5848	4	1692	2221	2262	2343	5	0.96097	Массовое бегство Финнов ШВЕЦИЮ Продолжается	vol-5848-page-04-seg-023-1692-2221-2262-2343.png
5848	4	1640	2362	2304	3551	212	0.97582	СТОКГОЛЬМ. 15 июля. (ТАСС). При- ток беженцев из Финляндии в Швецию всё увеличивается. Большая часть их при- бывает на лодках через Ботнический залив, несмотря на то, что на всем фин- ском побережье этого залива запрещено движение на лодках. Кроме того, бежен- цы, особенно солдаты, начали переходить сухопутную границу севернее Хапаранды. В шведских газетах опубликовано, частности, сообщение о бегстве из Финлян- лии в Швецию финского пастора Лаури Лаутинена из Кемиярви. Полгода тому назад этот пастор выступил против уча- стия финнов в войне на стороне Германии, был посажен в тюрьму и теперь бежал. Шведская газета «Арбетарен», касаясь этого вопроса в передовой под названием «Разлагающаяся Финляндия», пишет: «Бег- ство из Финляндии, судя по всему, с каж- дым днем увеличивается. Подобные явле- ния лучше, чем что-либо другое, свиде- тельствуют о действительном положении Финляндии. Тот факт, что в Швецию бежал целый отряд финских войск, являет- ся более существенным, чем бегство от- дельных лиц, если даже этих отдельных лиц и набирается много. Бегство целого отряда показывает, что вопросы, связанные c этим бегством, открыто обсуждаются теперь в финских частях. Иначе никак нельзя об яснить это организованное массо- вое бегство. Война до того надсела фин- скому народу, что многие стараются ис- пользовать самый последний выход из по- ложения - бегство, если даже оно и свя- зано с риском для жизни».	vol-5848-page-04-seg-024-1640-2362-2304-3551.png
5848	4	2541	436	3487	582	17	0.97307	военные действия В С Е В Е Р Н О Ф Р А Н Ц И И	vol-5848-page-04-seg-025-2541-0436-3487-0582.png
5848	4	2487	605	3520	686	7	0.95255	Сообщения штаба верховного командования экспедиционных сил союзников	vol-5848-page-04-seg-026-2487-0605-3520-0686.png
5848	4	2339	704	2999	832	17	0.95646	ЛОНДОН, 15 июля. (ТАСС). В опубли- кованном сегодня утром сообщении штаба верховного командования экспедиционных сил союзников говорится:	vol-5848-page-04-seg-027-2339-0704-2999-0832.png
5848	4	2331	842	2999	1921	194	0.96802	«У основания полуострова Котантен со- юзники заняли новую территорию. Запад- нее Лессе наши патрули продвинулись че- рез Сен-Жермен-сюр-Э к Мезьеру. Про- тивник оказал незначительное сопроти- вление. Мы продвинулись к Леске, за- няв Бове и Ла Журденри. В нескольких милях восточнее наши войска заняли Ла Лонд и достигли района затопления на реке Э. Наступая через Горж и Сен-Жер- мен, наши части достигли Ле Гранж и сое- динились к югу от Омме с войсками, про- двигающимися восточнее болот Горж. Ме- жду Сентени и рекой Вир и в районе во- сточнее Сен-Ло осуществлен ряд местных продвижений. На остальных участках фрон- та ничего существенного не произошло. Вчера во второй половине дня тяжелые бомбардировщики совершили налеты на вражеские объекты в районе Амьена. Сред- ние бомбардировщики атаковали мосты в Бурт и Мере. Совершены также налеты на автоколонны южнее Кана, на вражеские позиции в районе Сен-Ло и неприятель- скую радиоустановку вблизи Гавра." В те- чение 14 июля сбито 24 неприятельских самолета. 7 наших машин не вернулись на свои базы. В ночь на 15 июля тяжелые бомбардировщики совершили налет на же- лезнодорожный узел Вильнев Сен-Жорж. Легкие бомбардировщики атаковали казар- мы, находящиеся юго-западнее Пуатье. Авиация союзников сбила минувшей ночью : два вражеских самолета».	vol-5848-page-04-seg-028-2331-0842-2999-1921.png
5848	4	3022	706	3680	832	19	0.96365	ЛОНДОН, 15 июля. (ТАСС). В вечер- нем сообщении штаба верховного командо- вания экспедиционных сил союзников от 15 июля говорится:	vol-5848-page-04-seg-029-3022-0706-3680-0832.png
5848	4	3018	852	3680	1198	63	0.96548	«Войска союзников, продолжая продви- жение на правом фланге фронта, вступили в предместья Лесси и достигли затоплен- ных местностей в районе реки Э на фрон- те протяжением в несколько миль. Дерев- ни Сент-Оппортюн, Писсо и Сен-Патрис- де-Клед очищены от противника. Дальше к востоку мы прошли через Гонфревиль и Ней к берегам реки Сев. В течение 14 ию- ля артиллерия противника вела ожесточен- ный огонь.	vol-5848-page-04-seg-030-3018-0852-3680-1198.png
5848	4	3014	1206	3678	1646	71	0.97364	Ранним утром 15 июля истребители-бом- бардировщики на бреющем полете бомбили и обстреливали из пулеметов вражеские войска и артиллерийские позиции в районе Сен-Ло. Другие отряды истребителей во время разведывательных полетов близ Ка- на встретили вражескую эскадрилью, нас- читываешую свыше 30 самолетов, уничто- жили 2 из них и вернулись без потерь. 14 июля авиация противника проявляла значительную активность. Наши зенитные студия сбили в восточном секторе фронта 5 вражеских самолетов и повредили еще несколько.	vol-5848-page-04-seg-031-3014-1206-3678-1646.png
5848	4	3014	1667	3676	1919	45	0.96444	Рано утром 15 июля в бухте Сены бы- ли перехвачены торпедные катера против- ника, пытавшиеся прорваться к западу от Гавра. Катеры противника подверглись преследованию. Один катер был похож- жен. Позднее у входа в гавань были ата- кованы вражеские патрульные суда, кото- рым был причинен ущерб".	vol-5848-page-04-seg-032-3014-1667-3676-1919.png
5848	4	2695	1991	3287	2019	4	0.90692	ВОЕННЫЕ ДЕЙСТВИЯ В ИТАЛИИ	vol-5848-page-04-seg-033-2695-1991-3287-2019.png
5848	4	2495	2064	3506	2196	9	0.92835	Войска союзников находятся в 10 км км. от Ливорно	vol-5848-page-04-seg-034-2495-2064-3506-2196.png
5848	4	2323	2216	2993	2824	114	0.96047	лондон, 15 июля. (TACC). Штаб войск союзников в Италии сообщает, что в ночь на 14 июля французские и амери- канские части 5-й армии заняли важные возвышенности между реками Чечина и Арно. Не давая врагу передышки, фран- цузские части американской 5-й армии 14 14 июля продвинулись вперед, заняли Под- жибонси важный узел дорог между Арецпо и Ливорно -- и продвинулись на всем участке фронта. Западнее американ- ские части также продвинулись и заняли Печчоли и Кьянни. Их передовые отряды находятся сейчас в 16 км. от Арно и во- сточнее Ливорно. На побережье Лигурии- ского моря передовые части союзников на- ходятся в 10 км. от окрестностей Ливор- но. На центральном участке фронта обе стороны вели интенсивный артиллерийский	vol-5848-page-04-seg-035-2323-2216-2993-2824.png
5848	4	3008	2219	3674	2822	104	0.96657	огонь. В долине верхнего течения реки Тибр войска союзников продвинулись не- значительно. В горном секторе войска со- юзников заняли Гуальдо Тадино, Фоссато ди Вико и Чинголи и приближаются к городу Фабриано. На адриатическом уча- стке фронта положение без перемен. Вчера соединение тяжелых бомбардиров- шиков средней численности совершило на- лет на 4 нефтеочистительных завода сортировочную станцию в Будапеште. Тя желые бомбардировщики совершили также налет на сортировочную станцию в Ман- туе, в Северной Италии. Самолеты, вхо- дящие в состав тактической авиации со узников, совершали налеты на неприя- тельские коммуникации и другие объекты в Северной Италии и в зоне боев, а также на неприятельские объекты в Югославии.	vol-5848-page-04-seg-036-3008-2219-3674-2822.png
5848	4	2752	2887	3260	2927	3	0.96424	бои в югославии	vol-5848-page-04-seg-037-2752-2887-3260-2927.png
5848	4	2323	2949	2987	3551	102	0.96199	ЖЕНЕВА, 15 июля. (ТАСС). Как пере- дают из Югославии, Верховный штаб на- родно-освободительной армии Югославии сообщает, что в Сербии уже несколько дней идут упорные бои на широком фрон- те между Ибарским ущельем и Западной и Южной Моравии. В этот район немцы и болгары перебросили крупные силы. Из Боснии в этот район направлены также четники Михайловича и отряды Недича. Немцы и четники предпринима от атаки из Ибарского ущелья через Колесник и из района Крушеваца. В секторе Алексинац- Ниш-, Лесковац крупные болгарские силы и недичевцы предпринимают ожесточенные атаки. На всех этих участках югославские части наносят противнику большие по- тери. Центральной и Западной Боснии ча-	vol-5848-page-04-seg-038-2323-2949-2987-3551.png
5848	4	3010	2949	3668	3177	27	0.97432	сти югославской народно-освободительной армии продолжают наступательные опера- ции на участке Бугойно-Зиямет, где раз- громлена немецкая колонна. В Горском Котаре югославские части преследуют...отступающую в направлении Карловаца немецкую дивизию.	vol-5848-page-04-seg-039-3010-2949-3668-3177.png
5848	4	3008	3187	3668	3341	22	0.97462	B Бании продолжаются операции по очистке территории от немцев. На желез- нодорожной линии Костайница Суня югославские партизаны взорвали полотно на значительном протяжении.	vol-5848-page-04-seg-040-3008-3187-3668-3341.png
5848	4	3008	3349	3666	3447	10	0.97768	Босанской Кранне ведутся операции по ликвидации немецкого гарнизона окрестностях Цазина.	vol-5848-page-04-seg-041-3008-3349-3666-3447.png
5848	4	3004	3451	3664	3545	13	0.95229	B Хорватском Загорье югославские ча- сти ведут успешные наступательные опе- рации на Калнике.	vol-5848-page-04-seg-042-3004-3451-3664-3545.png
5848	4	3703	423	4366	596	10	0.93598	Создание в сша , национального ГРАЖДАНСКОГО НОМ. ТЕТА политического действия	vol-5848-page-04-seg-043-3703-0423-4366-0596.png
5848	4	3697	609	4370	1631	149	0.96709	ВАШИНГТОН, 15 июля. (ТАСС). Пред- седатель комитета политического действия конгресса производственных профсоюзов (КПП) Хиллмэн объявил, что свыше видных американских общественных дея- телей организовали «Национальный граж- данский комитет политического действия" для проведения кампании за переизбрание Рузвельта и за избрание такого состава конгресса, который поддержит политику Рузвельта. В число членов нового коми- тета входят видные профсоюзные деятели, представители интеллигенции, а также ру- ководители различных групп американцев иностранного происхождения. В исполни- тельный орган комитета входит 11 членов, том числе бывший губернатор штата Миннесота Бенсон, председатель КПП Мэррей, председатель национального сою- за фермеров Паттон, председатель проф- союза рабочих автомобильной промышлен- ности, входящего в КПП, Томас, предсе- латель комитета политического действия КПП Хиллмэн и др. Хиллман пригласил вступить в члены комитета всех прогрес- сивных американцев независимо от их фор- мальной партийной принадлежности. Отвечая на вопросы представителей пе- чати, Хиллмэн заявил, что комитет поли- тического действия поддерживает выдвиже- ние кандидатуры Уоллеса на пост вице- президента.	vol-5848-page-04-seg-044-3697-0609-4370-1631.png
5848	4	3793	1689	4270	1723	2	0.91733	Предотвращенная попытка	vol-5848-page-04-seg-045-3793-1689-4270-1723.png
5848	4	3772	1725	4295	1762	4	0.92338	военного мятежа в Мексике	vol-5848-page-04-seg-046-3772-1725-4295-1762.png
