volume_number	page_number	x1	y1	x2	y2	tokens_count	mean_confidence	text	image
6232	1	1094	253	2189	321	4	0.94563	За нашу Советскую Родину.	vol-6232-page-01-seg-001-1094-0253-2189-0321.png
6232	1	297	344	2204	719	8	0.97035	соединяйтесь ЦЕНТРАЛЬНЫЙ ОРГАН НАРОДНОГО КОМИСССАРИАТА ОБОРОНЫ СОЮЗА ССР	vol-6232-page-01-seg-002-0297-0344-2204-0719.png
6232	1	322	742	599	791	2	0.88995	244 (6232)	vol-6232-page-01-seg-003-0322-0742-0599-0791.png
6232	1	961	746	1583	792	5	0.95662	16 октября 1945 г., вторник	vol-6232-page-01-seg-004-0961-0746-1583-0792.png
6232	1	1918	736	2191	794	2	0.86080	ЦЕНА 20 КОП.	vol-6232-page-01-seg-005-1918-0736-2191-0794.png
6232	1	2566	261	3256	330	6	0.91297	е г о д н я	vol-6232-page-01-seg-006-2566-0261-3256-0330.png
6232	1	2293	350	3225	781	54	0.93295	указы Президиума Верховного Совета СССР (1 стр. ). Праздник украинского народа. Торжественное за- седание, посвященное первой годовщине освобож- дения Украины (1 стр. ). Опровержение ТАСС (2 стр. ). Майор А. Рыбин, -- Показное занятие для офи- церов самоходной артиллерии (2 стр. ). По Подполковник П. Селиванов. -- Методика строе- вой подготовки (2 стр. ).	vol-6232-page-01-seg-007-2293-0350-3225-0781.png
6232	1	3347	361	4280	446	14	0.92397	I вардии майор А. Орлов. -- Зенитчики в боях за города-крепости (2 стр. ).	vol-6232-page-01-seg-009-3347-0361-4280-0446.png
6232	1	3345	450	4278	537	11	0.93436	Старший лейтенант В. Фоменко. - Дон встречает казаков-победителей (3 стр. ).	vol-6232-page-01-seg-010-3345-0450-4278-0537.png
6232	1	3343	539	4280	792	30	0.92128	Тм, Рудь. -- На запорожском направлении. Люди автополка (3 стр. ). Борис Ласкин.--Команда ЦДКА завоевала кубок (3 стр. ). Рез Результаты выборов во временное Национальное собрание Чехословакии (4 стр. ).	vol-6232-page-01-seg-011-3343-0539-4280-0792.png
6232	1	348	870	1525	1090	4	0.98145	Непреодолимая сила страны социализма	vol-6232-page-01-seg-012-0348-0870-1525-1090.png
6232	1	264	1114	924	2129	141	0.96406	Грандиозная стройка развертывается на необъятных просторах нашей Родины. Со- ветский народ-победитель, засучив рука- ва, принялся за великий труд, который поднимет наше государство на новую ступень могущества и славы и далеко двинет вперед его производительные силы и благосостояние широких народных масс. Цель ясна и величественна. Нужно за- лечить тяжелые раны, нанесенные наше- му хозяйству войной. Нужно не только восстановить экономику советских райо- нов, подвергшихся вражеской оккупации, в них жило около половины нашего населения! но и значительно превы- сить довоенный хозяйственный уровень всей советской страны в целом. Как ука- зано в сообщении ЦК и Совнарко- ма СССР, в новом, четвертом пятилетнем плане «имеется в виду предусмотреть полное восстановление народного хозяй- ства районов СССР, подвергавшихся немец- кой оккупации, послевоенную перестрой- ку народного хозяйства и дальнейшее развитие всех районов СССР, в результате чего должен быть значительно превзой- ден довоенный уровень развития народ- ного хозяйства СССР».	vol-6232-page-01-seg-013-0264-1114-0924-2129.png
6232	1	257	2137	910	2713	81	0.96988	Нет сомнения, что наш рабочий класс, наше крестьянство и интеллигенция, столь блестяще выполнявшие планы пре- дыдущих сталинских пятилеток, реализу- ют с новыми славными успехами и чет- вертый пятилетний план. Если в тяже- лейших условиях войны столь быстро шло восстановление экономики наших ос- вобожденных районов, если и тогда совет- ская страна находила силы и ресурсы для того, чтобы быстро двигать вперед всю нашу тяжелую индустрию, металлургию, топливную промышленность, машинострое- ние, то тем большие ВОЗМОЖНОСТИ для под'ема нашей экономической мощи от- крываются сейчас.	vol-6232-page-01-seg-014-0257-2137-0910-2713.png
6232	1	249	2723	907	3837	161	0.96603	Планомерно и уверенно переключается советская страна на рельсы мирного хо- зяйственного развития. Полным ходом идет строительство новых предприятий. Общий объем капитального строительства по стране в целом уже достиг довоенных размеров, a по нашим освобожденным районам даже превысил их. Донбасс, вос- ставший из рупн, уже дает почти поло- вину довоенной продукции. Агрегат за аг- регатом, цех за цехом, завод за заводом- том числе и крупнейшие --- переходят с выработки военной продукции на граж- данскую. Знаменательным является факт упразднения Народного комиссариата тан- ковой промышленности и образования на его базе и на базе других наркоматов Народного комиссариата транспортного ма- шиностроения. С каждым днем вырастает производство ширпотреба. Непрерывным и всё растущим потоком вливаются на на- ши предприятия новые новые тысячи работников из состава демобилизованных воинов Красной Армии. Они занимают свои почетные места у станка, за рулем трактора, у топки паровоза, в колхозных звеньях и в заводских лабораториях. Каж- дый день приносит сообщения о выдаю- щихся производственных успехах работ- ников нашей промышленности, транспор- та, сельского хозяйства.	vol-6232-page-01-seg-015-0249-2723-0907-3837.png
6232	1	235	3846	893	4610	88	0.95930	новыми силами решаем мы новые хозяйственные задачи. Эти силы наша победоносная могущественная социалисти- ческая держава обрела в годы великих испытаний Отечественной войны. Совет- ское государство вышло из этой невидан- ной доселе войны еще более прочным и жизнеспособным. Советский народ, руко- водимый сталинским гением, еще теснее сплотился вокруг своей большевистской партии, стал еще более организованным, еще более окрепло его морально-полити- ческое единство, невиданной мощи достит советский патриотизм. Благодаря этим мо- гучим политическим факторам растет во- енно-экономическая мощь нашей страны. Достаточно указать на социалистическое соревнование в честь победы, которое ох-	vol-6232-page-01-seg-016-0235-3846-0893-4610.png
6232	1	914	1114	1591	4216	416	0.96149	ватило город и деревню, распространилось по всему нашему народному хозяйству поднимая производительность труда, колп- чествешные и качественные показатели производства. За годы войны небывалых масштабов достигло стахановское движение, творче- скал производственная инициатива трудя- щихся масс, их изобретательность, пова- торство наших инженерно-технических кадров. Эти ценнейшие успехи, умножае- мые сейчас, служат сильнейшим рычагом дальнейшего подъема советского хозяйства, Наша Родина гордится замечательными достижениями, которых добились совет- синие люди за годы войны в области тех- ники, экономики, организации труда. Во время войны мы научились гораздо луч- ше выявлять и пепользовать производст- венные резервы. Достаточно привести лишь несколько примеров этих достиже- ний ускорение несколько раз тем- пов строительства и темпов освоения новых Видов продукции, широкое распростране- ние массово-поточного метода пропзводст- ва, внедрение сотен новых видов высоко- производительных станков, обновление технической базы ряда отраслей производ- ства и т. д. Благодаря мудрости и даль- новидности большевистской партии исклю- чительное внимание уделялось во время войны росту тяжелой индустрии -- этой материальной основы нашего военно-эко- номического могущества, основы развития всей нашей экономики. За военные годы гигантски выросла экономика восточных районов Урала, Сибири, Среднеазиат- (ских республик. Всё это создает прочную базу для успешного решения новых хо- зяйственных задач, для выполнения но- вых хозяйственных планов. «Социалистический строй, порожденный Октябрьской революцией, дал нашему на- роду и нашей армии великую и непреобо- рисую сплю" (Стадия). Советское госу- даретво наглялио показало всему миру величайшие преимущества социалистиче- ского строя, создав слаженное военное хозяйство в изумительно короткий срок. Ныне эти преимущества социализма нахо- дят свое отражение в процессе перестрой- ни пашей экономики на мирный лад. Наша социалистическая страна не знает экономических кризисов безработицы. Право на труд - одно 113 величайших благодеяний сопнализма- у нас полностью гарантировано и осуществлено. 11 каждый демобилизуемый воин Красной Армии знает, что он окружен материнской забо- той Родины, что сму обеспечена работа в соответствии с его профессией и способно- стэмп. Преимущества социалистической систе- мы хозяйства становятся всё более ясны и за рубежом нашей страны. Американ- ский экономист Флемм еще в 1942 г. писал: "Когда война кончится, производ- ственный аппарат России будет подготов- лен к еще гораздо более высокому уровню производства. Но русские будут радовать- ся этому, а не пугаться, как это проис- ходит в нашей стране. Русские не при- дется расходовать накопленные силы в борьбе с безработицей или в разборке на- логовой долговой пирамиды". Окончание войны приводит у нас не к сокращению производства, а к его дальнейшему под'е- му. Преимущества социализма придают непреоборимую силу нашей Родине. Со- ветский народ под мудрым руководством партии Ленина- Сталина добьется нового расцвета своей социалистической страны, еще большего укрепления ее военного и экономического могущества.	vol-6232-page-01-seg-017-0914-1114-1591-4216.png
6232	1	910	4220	1560	4608	41	0.95435	чувством гордости за свою могучую державу, беззаветной преданности социа- листической Родине, делу Ленина - Сталина идут советские люди навстречу выдающемуся политическому событию в жизни нашей страны выборам в Вер- ховный Совет СССР. Эти выборы проде- монстрируют возросшую силу социалисти- ческой демократии.	vol-6232-page-01-seg-018-0910-4220-1560-4608.png
6232	1	237	4672	1551	4889	35	0.95010	Книга товарища И. В. Сталина «О Великой Отечественной войне Советского Союза» на эвенкийском языке КРАСНОЯРСК, 15 октября. (ТАСС). Отечественной войне Советского Союза» на эвенкийском языке. Краевое издательство выпустило книгу товарища II. B. Сталина «0 Великой	vol-6232-page-01-seg-019-0237-4672-1551-4889.png
6232	1	415	4943	1377	4980	5	0.87571	В исполкоме Московского областного Совета	vol-6232-page-01-seg-020-0415-4943-1377-4980.png
6232	1	355	5018	1425	5067	3	0.94500	помощь демобилизованным воинам	vol-6232-page-01-seg-021-0355-5018-1425-5067.png
6232	1	224	5082	879	6016	135	0.98589	Исполнительный комитет Московского областного Совета депутатов трудящихся обсудил вопрос об оказании помощи демо- билизованным войнам Красной Армии, инвалидам Отечественной войны и семьям военнослужащих. Исполкомы районных советов оказывают демобилизованным большую помощь. Более 17 тысяч человек получили работу на про- мышленных предприятиях и в учреждениях, столько же - в сельском хозяйстве. Ты- сяче бывших фронтовиков предоставлены новые квартиры, жилища 5.270 демобили- зованных капитально отремонтированы. На строительство индивидуальных домов от- пущено свыше четырех миллионов рублей государственных кредитов. В районах об ласти созданы фонды продовольственных и промышленных товаров, выдазаемых демо- билизованным воинам и их семьям. За последние месяцы отпущено около полу- миллиона рублей, десятки тысяч килограм- мос зерна, много обуви, мануфактуры, го тобой одежды, топлива. 1.645 семей полу- чили телок, поросят, птицу. Подавляющее большинство бывших вои- нов Красной Армии активно участвует в социалистическом соревновании, перевыпол- няет установленные нормы. Демобилизо	vol-6232-page-01-seg-022-0224-5082-0879-6016.png
6232	1	899	5082	1553	6012	138	0.98763	ванный красноармеец тов. Тимофеев, из- бранный по возвращении из армии предсе- дателем правления колхоза в Луховицком районе, в короткий срок улучшил хозяй- ство, ставшее сейчас образцовым. Таких же результатов добились бывший участник Отечественной войны тов. Рогов, ныне старший конюх артели, и многие другие Исполнительный комитет областного совета обязал руководителей предприятий организовать производственное обучение демобилизованных, не имеющих специаль- ности, на курсах или в порядке индивиду- ального и бригадного ученичества. Област- ному отделу местной промышленности и управлению промысловой кооперации пору- чего изготовить для детей демобилизован- ных и инвалидов Отечественной войны ко- жаную и валяную обувь, которая должна поступить в торговую сеть не позднее декабря. Председателям исполкомов районных и городских советов предложено принять меры к своевременному сбору и хранению урожая, полученного со сверхплановых по- севоз колхозных касс взаимопомощи, для обеспечения нуждающихся семей демоби- лизованных, инвалидов Отечественной вой ны и военнослужащих. (ТАСС).	vol-6232-page-01-seg-023-0899-5082-1553-6012.png
6232	1	1667	866	2877	1141	26	0.97209	УКАЗ ПРЕЗИДИУМА ВЕРХОВНОГО СОВЕТА СССР Об участии в выборах в Верховный Совет СССР военнослужащих частей и соединений Красной Армии и Военно-Морского Флота, находящихся за пределами СССР	vol-6232-page-01-seg-024-1667-0866-2877-1141.png
6232	1	1618	1160	2926	1665	130	0.95758	Руководствуясь статьей 138 Конституции СССР, устанавливающей, что граж- дане, состоящие в рядах Красной Армии, пользуются правом избирать и быть из- бранными наравне со всеми гражданами СССР, и считая необходимым, чтобы воен- нослужащие частей и соединений Красной Армии Военно-Морского Флота, находя- щихся за пределами СССР, осуществили избирательные права, предоставленные им Конституцией СССР, и приняли участие в выборах высшего органа государственной власти СССР, Президиум Верховного Совета Союза Советских Социалистических Республик постановляет: Установить, что военнослужащие частей и соединений Красной Армии п Воен- но-Морского Флота, находящихся за пределами СССР, принимают участие в выборах в Верховный Совет СССР по особым избирательным округам, образуемым в этих частях и соединениях по норме -- 100 тысяч избирателей на один округ, и изби- рают по каждому избирательному округу одного депутата в Совет Союза и одного депутата в Совет Национальностей.	vol-6232-page-01-seg-025-1618-1160-2926-1665.png
6232	1	1678	1678	2858	1794	20	0.93990	Председатель Президиума Верховного Совета СССР М. КАЛИНИН Секретарь Президиума Верховного Совета СССР А. ГОРКИН. Москва, Кремль. 14 октября 1945 г.	vol-6232-page-01-seg-026-1678-1678-2858-1794.png
6232	1	1767	1845	2765	1887	5	0.97556	УКАЗ ПРЕЗИДИУМА ВЕРХОВНОГО СОВЕТА СССР	vol-6232-page-01-seg-027-1767-1845-2765-1887.png
6232	1	1616	1910	2914	2013	7	0.97564	Об образовании общесоюзного Народного комиссариата транспортного машиностроения	vol-6232-page-01-seg-028-1616-1910-2914-2013.png
6232	1	1614	2028	2916	2407	71	0.94778	1. Образовать общесоюзный Народный комиссариат транспортного машинострое- ния на базе Народного комиссариата танковой промышленности и его предприятий заводов паровозостроения Народного комиссариата тяжелого машиностроения и за- водов вагоностроения Народного комиссариата среднего машиностроения. 2. Упразднить Народный комиссариат танковой промышленности. 3. Передать Народному комиссариату транспортного машиностроения предприятия и организации, согласно списку, утвержденному Совнаркомом СССР. Председатель Президиума Верховного Совета СССР М. КАЛИНИН. Секретарь Президиума Верховного Совета СССР А. ГОРКИН. Москва, Кремль. 14 октября 1945 г.	vol-6232-page-01-seg-029-1614-2028-2916-2407.png
6232	1	1765	2467	2761	2508	5	0.96638	УКАЗ ПРЕЗИДИУМА ВЕРХОВНОГО СОВЕТА СССР	vol-6232-page-01-seg-030-1765-2467-2761-2508.png
6232	1	1612	2533	2908	2638	11	0.96441	О назначении тов. Малышева В. А. Народным комиссаром транспортного машиностроения СССР	vol-6232-page-01-seg-031-1612-2533-2908-2638.png
