volume_number	page_number	x1	y1	x2	y2	tokens_count	mean_confidence	text	image
5094	2	3885	4494	4538	4800	40	0.95685	За выдающиеся успехи в боевой и по литической подготовке Военный Совет ок руга наградит денежными премиями ря бойцов и командиров мотобатальона. В чи сло награжденных младший воентех ник Бакшеев, младший лейтенант Акулов сержант Герасименко. младший сержан Осинцев, красноармейцы Вьюнов и	vol-5094-page-02-seg-052-3885-4494-4538-4800.png
5094	2	3907	4866	4510	4978	4	0.98247	ГЕРОЙСКИЙ ПОСТУПОК ЮНОЙ ПАТРИОТКИ	vol-5094-page-02-seg-053-3907-4866-4510-4978.png
5094	2	3883	4998	4534	5140	19	0.95527	Отступая под натиском советских вой из одной деревни, фашисты заминирова. на пути продвижения наших частей дс рогу и поле.	vol-5094-page-02-seg-054-3883-4998-4534-5140.png
5094	2	3885	5152	4546	5288	18	0.94598	За расстановкой вражеских мин и ло вушек наблюдалз пританвшаяся за снеж ным сугробом ученица 10 класса Pas Ионова.	vol-5094-page-02-seg-055-3885-5152-4546-5288.png
5094	2	3887	5298	4532	5761	58	0.94641	Когда наши бойцы подходили пированным участкам, юная патриотк бросилась наперерез нашим частям. Фа шисты открыли по ней огонь из автс матов и смертельно ранили отважну девушку. Умирая на руках красноармей цев, она все же успела предупредить минированных участках. Части благополучно обошли нинироват ные подступы к селу и, метя фашиста за гибель мужественной патриотки, без пощадно уничтожали отступающих не!	vol-5094-page-02-seg-056-3887-5298-4532-5761.png
5094	2	3887	5775	4528	6031	25	0.94346	самом селе фашисты заложили мосту мины огромной взрывной силе При содействии колхозников наши са поры быстро обнаружили их и обезвредить Капитан М. МОРОЗОВ западный фронт.	vol-5094-page-02-seg-057-3887-5775-4528-6031.png
5094	3	560	242	1297	274	6	0.89835	февраля 1342 г., пятница, 30 (5034).	vol-5094-page-03-seg-001-0560-0242-1297-0274.png
5094	3	572	354	4554	482	10	0.97008	Мы не забудем эту виселицу. Не забудем и не простим.	vol-5094-page-03-seg-003-0572-0354-4554-0482.png
5094	3	578	2169	4512	2232	51	0.96334	Мы публикуем снимки, на которых фашистский мерзавец с садистическим хладнокровием запечатлел этапы казни пяти советских граждан. Снимки найдены у немецкого сфицера, убитого в районе Яропольца (северо-западнее Волрколамска) Судя по показаниям пленного немца Г. Эшер, снимки сделаны у города Велиж (Смоленской "области), где Эшер видел чудовищную расправу и виселицу с пятью повешенными.	vol-5094-page-03-seg-004-0578-2169-4512-2232.png
5094	3	514	2306	1813	2476	4	0.97151	КОМСОМОЛЬСКИЕ ОРГАНИЗАЦИИ НА ФРОНТЕ	vol-5094-page-03-seg-005-0514-2306-1813-2476.png
5094	3	486	2508	1149	3216	97	0.96216	C первых дней отечественной войны армейские комсомольцы показывают об- разцы храбрости и геройства, готовность сражаться за родину до последней капли крови. В славной семье Героев Советско- го Союза десятки комсомольцев пред- ставителей всех родов оружия: летчиков, танкистов, стрелков, артиллеристов. Тыся- чи комсомольцев-фронтовиков награждены правительственными наградами. Только на одном Юго-Западном фронте орденами и медалями награждено 2.238 комсомольцев. На примерах героизма этих товарищей нужно воспитывать всю нашу армейскую чолодесьь, развивать в ней бесстрашие отвагу, готовность к самопожертвованию. В этом состоит одна из первейших задач комсомольских организаций Красной Ap- мии. Надо добиться, чтобы каждый комсо- молец стал героон отечественной войны.	vol-5094-page-03-seg-006-0486-2508-1149-3216.png
5094	3	462	3224	1147	5154	252	0.96454	На призыв товарища Сталина «ист- всех неинев 10 одиного, пробрав- па территорию нашей родины в ка- чества ее оккупантов», армейские комсо- мольцы ответили новыми боевыми подви- гами --- уничтожением гитлеровских голо- ворезов. Особого внимания заслуживает участие организаций ВЛКСМ в подготовке комсомольцев-снайперов. Поициатором это- Го движения оказалась комсомольская организация, где секретарем бюро тов. Чернышов (Северо-Западный фронт). первой провела конференцию комесмоль- цев-снайперов. Участники конференции 18 лучших снайперов, уничтоживших свыше 400 фашистов, обратились ко всем комсомольцам с призывом стать мастера- сверхнизкой стрельбы. Инициатива комсомольцев Северо-Запад- ного фронта встретила поллержку на других фронтах. На Ленинградском фрон- те. в частности. за короткое время из числа комсомольцев выiвипулось пемало подлинных мастеров снайперской стрельбы. Особенно популярен здесь снайпер-комсо- молеп Феодосий Смолячков, который уни- что тыл 125 солдат и офицеров. На обращение восемнадцати быстро от- кликнулись комсомольцы части, сс- кретарем бюро ВЛКСМ тов. Лискикий. Ito предложению тов. Ансилкого в части были проведены краткосрочные курсы ров. Снайперским искусством овладели 45 комсомольцев. и сейчас опи успешно истребляют немецких захватчиков. Нужно всячески поощрять и развивать инициативу и участно комсомольских ор- ганизаций в подготовке снайперов. Большое значение писет также работа организаций ВЛКСМ по подготовке ком- сомольцев --- истребителей танков. Чтобы уничтожить вражескую машину. одной смелости мало нужно еще и умение. Знания и навыки приобретаются в груп- пах по подготовке истребителей танков. II комсомольцы становятся душой таких групп. Пример хорошей работы в этом отно- шении показывают комсомольцы Юго-За- нального и Южного фронтов. В группах по подготовке истребителей танков на Юго- Западном фронте об'елинено свыше 4.000 членов ВЛКСМ. На Южном фронте такими группами охвачены 4.500 комсомоль-	vol-5094-page-03-seg-007-0462-3224-1147-5154.png
5094	3	448	5156	1121	5969	115	0.96505	Армейский комсомол призван много сделать для идейного воспитания красно- армейцев. Живым словом. в задушевных товарищеских беседах комсомольцы долж- ны повседневно развивать в каждом крас- ничриейце качества воина-патриота. На комсомольские организации и их руково- дителей ложится немалая ответственность за реализацию директивы Главного поли- тического управления Красной Армии ликвидации запущенности в устной про- паганде и агитации". Там. где комсомоль- ские руководители поняли всю важность этой директивы. мы имеем уже неплохие результаты. Особенно надо отметить рабо- ту. проведенную в этой области комсо- польским отделом политуправления Северо... Западного Фронта. Работники отдела нача- ли с того. что сами подготовили ряд до- кладов, затем выехали в комсомольские организации частей. В активную пропа- гандистекую работу включилось немало п помощников начальников политотделов, F	vol-5094-page-03-seg-008-0448-5156-1121-5969.png
5094	3	1171	2506	1837	3805	190	0.96483	ним относятся тт. Кудрин, Гапенко, Шер- батых, Матицын, Пилипенко, которые ре- гулярно беседуют с комсомольцами, вы- ступают с докладами для актива. сожалению, не везде комсомольские организации по-бсебому взялись за агита- ционно-пропагандистскую работу. Пекото вые комсомольские руководители ничего еще не сделали, чтобы ликвидировать за- пущенность в устной пропаганде и агнта- Это можно связать, например, о по- мощнико начальника политотдела N со- единенил старшем политруке Прянникове. До сих пор он не удосужился ознакомить с директивой Политуправления даже се- кретарей первачных комсомольских орга- низаций. Такое положение нетерпимо. Предметом постоянной заботы комсо- мольских руководителей должно быть во- влечение в ряды ВЛКСМ новых товарищей. Однако не все еще комсомольские руко- водители попали политическое значение повседневной работы по росту рядов ком- сомола и своевременного вручения вновь принятым товарищам комсомольских биле- тов. Плохо поставлено это дело в соедине- пии, где помощником начальника полет- стдела батальонный комиссар Гвоздев. Здесь в частях ипого хороших бойцов, же- лающих вступить в комсомол. по никакой работы с ними не ведется. Такие. напри- мер, товарищи, Бак Чуйкин, Привалов, Толстенев, в комсомоле состоят уже три месяца, а билетов еще не имеют. На 10 января по соединению насчитывалось 363 члена ВЛКСМ без комсомольских до- кументов.	vol-5094-page-03-seg-009-1171-2506-1837-3805.png
5094	3	1135	3809	1825	5925	302	0.96350	Ип и комсомольские руководители пы- таются об'яснить неудовлетворительный рост рядов комсомольских организаций по- вышением возраста красноармейцев. Такие оправдания не стоят ломаного гроша. Они свидетельствуют лишь том, что люди, выдвигающие эти "аргументы", привели мыслить средними цифрами п разучились замечать живого человека. Из поля зрения ускользнули сотни молодых бойцов, которых нужно воспитывать и готовить для вступления в комсомол. Надо решительно устранить все недоче- ты, тормозящие прием передовой молодежи в ряды ВЛКСМ. Напи ближайшая задача так организовать воспитательную па- боту среди красноармейской молодежи, чтобы подготовить к вступлению в ком- сомол всех молодых патентов. Одновременно с этим необходимо усп- лить подготовку лучших комсомольцев к вступлению в партию. Особенно это ка- сается стрелковых частей. Сейчас, по ука- запито Главного политуправления, во всех первичных парторгализациях обсуждаются доклады секретарей бюро В.ЛКСМ о состоя- пии комсомольской работы и подготовке лучших комсомольцев к вступлению пар- Это мероприятие имеет большое зна- чение. Дело чести комсомола --- достойно выполнить свою роль резерва партия и в ближайшее время подготовить и рекомен- ловать в ряды ВКП(б) отважных, отличив- шахся в боях комсомольшев. В заключение несколько замечаний о кадрах комсомольских работников ис- пользования этих кадров в боевой обста- новке. Нередки случаи. когда секретари первичных организаций ВЛКСМ и помощ- пики по комсомолу по не сколь: петель кряду выполняют роль «толкачей», а сво- ей непосредственной работой совершенно но занимаются. Например, помощник на- чатьникз полнтотлела одного из соодине- пий Калининского фронта стариний полит- рук Романов полмесяца путешествовал по частям и за все это время ни разу не заинтересовался всерьез практической лея- тельностью комсомольских бюро. прези- думов. комсоргов. То же самое можно ска- зать о помощнике по комсомолу тов. Что- раеве (Западный фронт). За 21-день пре- бывзиия в частых оп не заглянуть из комсомольских организаций. Комиссары частей и начальники по- литорганов должны понять. что комсо- мольские руководители окажут шую помощь B партийно-политической работе, если будут заниматься непосредст- ванно своим делай	vol-5094-page-03-seg-010-1135-3809-1825-5925.png
5094	3	1213	5933	1751	5969	4	0.92122	Бригадный комиссар И видюков	vol-5094-page-03-seg-011-1213-5933-1751-5969.png
5094	3	1991	2324	3068	2394	2	0.96867	пятеро повешенных	vol-5094-page-03-seg-012-1991-2324-3068-2394.png
5094	3	1883	2428	3196	2582	31	0.93422	На убитом немецком офицере нашли восемь фотографий: офицер заснял, как немцы повесили пять русских юношей. Очевидец может забыть, перепутать, приукрасить рассказ. У фото объектива бесстрастный глаз, и нет улики страшнее фотографий.	vol-5094-page-03-seg-013-1883-2428-3196-2582.png
5094	3	1881	2592	3192	2742	39	0.93551	Это было осенью в русской деревне неподалеку от Велижа. Немцы схватили пятерых. Кто эти люди? Мы не знаем их имен. По виду - сельские граждане. Один из них еще подросток. У него лицо ребенка Немцы их поволокли к виселице.	vol-5094-page-03-seg-014-1881-2592-3192-2742.png
5094	3	1881	2756	3192	2950	43	0.94222	Немцы тогда наступали. Они еще верили в свою победу. Они были веселы. Они не знали, что им придется узнать поражение, холод, лох мотья. На фотографиях они веселы, видно, что вешать им по душе. Пятерых быстроили. Сейчас их повесят. Они спокойно смотрят на палачей.	vol-5094-page-03-seg-015-1881-2756-3192-2950.png
5094	3	1881	2960	3188	3074	20	0.93137	Вот солдаты проверяют, достаточно ли крепки веревки. Два щего- леватых офицера смотрят на виселицу. Чувствуется праздничная сума- тоха: вешатели готовятся.	vol-5094-page-03-seg-016-1881-2960-3188-3074.png
5094	3	1881	3078	3186	3271	35	0.94443	Пятерых ведут к виселице. Бот петли накинуты. Фотограф смотрит - не прозевать бы... А пя теро спокойно глядят вдаль. Веревки не выдержали, двое сорвались. Среди палачей смятение Но фотографу хоть бы что - он снимает...	vol-5094-page-03-seg-017-1881-3078-3186-3271.png
5094	3	1869	3279	3188	3637	87	0.94854	Двоих вешают вторично, теперь без церемоний душат наспех И вот они качаются на осеннем ветру - пятеро повешенных. На фотографиях нет фотографа. Но мы видим холодное тупое лицо немецкого офицера со стекляшками вместо глаз. Он удачно провел тот день: он присутствовал при повешении и он сделал ряд удачных фото графий. Он напечатал их на глянцевой бумаге с обрезом. Он хотел их поднести своей невесте. Это - фотолюбитель и это любитель висе- лицы. Это сладострастный, извращенный немец. Он бодро щелкал затво- ром. Он заснял все фазы человеческой агонии.	vol-5094-page-03-seg-018-1869-3279-3188-3637.png
5094	3	1869	3643	3184	3995	89	0.95720	Мужественно встретили пятеро русских странную смерть. Они зна ли, что они сильнее палачей. Они знали, что они сильнее смерти. Они умерли за своих близких, за свое село, за свою родину. Нет смерти для человека, который умирает за других, он продолжает жить в памяти и в плоти своего народа. Вот почему на лицах пятерых высокое чув- ство - презрение к смерти. Может быть палачи думали, что русские будут кричать, плакать, молить о пощаде. А они свысока глядели на своих мучителей. Они знали, что победит жизнь. Они знали, что победит Россия.	vol-5094-page-03-seg-019-1869-3643-3184-3995.png
5094	3	1863	3997	3180	4710	162	0.95024	Пятеро повешенных не думали, что когда-нибудь русские люди уви- дят их смертную муку. Эти восемь фотографий запомнит весь наш на- ролл. С благоговением мы смотрим на лица героев - великие дети вели- кого народа. Мы смотрим, и беспримерный гнев овладевает нами: палачи еще хо- дят по нашей земле. Сейчас они еще сколачивают виселицы, мылят веревку и среди снега, замерзая, они еще пробуют отогреться зрелищем человеческого страдания. Они еще в нашей стране, эти вешатели! Боец, посмотри внимательно на восемь фотографий. Спрячь газету положи ее на сердце, Пусть она, как уголь, знает тебя день и ночь. Ты не знаешь этих людей, но это твои братья. Их привели. Над ними глумились. Их медленно задушили. И гад с аппаратом снимал - немке на память... Кто увидел эти фотографии, тот их не забудет. Вспомнит их под Вязьмой, вспомнит в Киеве. Вспомнит, переступив через границу. Есть на свете правда, есть возмездие! Вещателям на земле не жить. Это наша клятва. Это - наше последнее «прости» пятерым повешенным. Илья ЭРЕНБУРГ	vol-5094-page-03-seg-020-1863-3997-3180-4710.png
5094	3	2220	4776	2810	4838	2	0.94217	на равнине	vol-5094-page-03-seg-021-2220-4776-2810-4838.png
5094	3	1875	4874	2456	5010	13	0.95199	Холодные ветры проходят, как тени Да лыжник бесшумно скользит Ракитовый куст в ледяном	vol-5094-page-03-seg-022-1875-4874-2456-5010.png
5094	3	1875	5014	2456	5084	5	0.93761	оперенье Поднялся с туманных низин.	vol-5094-page-03-seg-023-1875-5014-2456-5084.png
5094	3	1871	5120	2456	5290	21	0.95438	Не слышно в селеньях дыхания хлеба, Лишь печи чернеют во мгле, И кажется, будто суровое небо Плывет, словно дым, по земле.	vol-5094-page-03-seg-024-1871-5120-2456-5290.png
5094	3	1871	5330	2452	5499	14	0.94339	А в темной ночи озаряют зарницы Открытые вьюгам тела, Шагали по русской равнине убийцы	vol-5094-page-03-seg-025-1871-5330-2452-5499.png
5094	3	2564	4864	3040	4900	4	0.93653	Их верная месть нагнала	vol-5094-page-03-seg-026-2564-4864-3040-4900.png
5094	3	2562	4930	3140	5166	21	0.94699	Вцепившись руками в богатую землю Как воры в пылу грабежа, Они на полях, что чужих не приемлют С пустыми глазами лежат.	vol-5094-page-03-seg-027-2562-4930-3140-5166.png
