volume_number	page_number	x1	y1	x2	y2	tokens_count	mean_confidence	text	image
5789	4	873	1627	1527	2277	95	0.94790	Юлий Чепурин - участник сталин- градской обороны. Он ощутил дейст- вительность в ее живых чертах. В этом законность его успеха. Коллектив театра сумел это зерно правды, это дыхание жи- вой действительности сделать достоянием зрителя. Внутреннему ходу действия под- чинено каждое движение на сцене, каж- дая интонация голоса актеров. Похвалы достойна игра заслуженных артистов рес- публики П. Константинова, А. Хохлова, Г. Васильева, А. Хованского, В. Пестов- ского. Хорот о ведут свои роли В. Ратом- ский, Р. Ракитин, А. Герасимов и другие. В одновременно скромном и богатом дра- матическом очерке «Сталинградцы» мы видим дружную работу талантливых лю- дей.	vol-5789-page-04-seg-016-0873-1627-1527-2277.png
5789	4	877	2279	1527	2383	12	0.93839	Но пьеса не свободна от недостатков. четвертой картины внутренний строй спектакля меняется.	vol-5789-page-04-seg-017-0877-2279-1527-2383.png
5789	4	873	2391	1527	3839	213	0.95780	И так же, как по поводу первых кар- тин хочется сказать «отлично», так по поводу четвертой и пятой картин про- сится отметка более низкая. Вторая поло- вина пьесы явно слабее первой. В «Сталинградцах» резко, не смеши- ваясь, проходят две струи. Правдивый, полный внутреннего, подлинного волне- ния драматургический очерк, содержа- щий в себе большое напряжение, очерк волнующий и трогающий -- в этой части спектакль идет стройно. автор, и по- становщик, и актеры, и художник, да п, самое главное, зритель - все участвуют сталинградской трагедии. A вторая струя условная, основанная на шаб- лонной сюжетной схеме. Она как бы под- черкивает своей слабостью силу первых картин. Ну, и естественно -- этп первые картины своей правдой подчеркивают недостатки последующих. В этой пьесе, может быть по причине неопытности молодого, бесспорно одарен- ного автора, сосуществуют полюсы, обыч- но не сходящиеся на страницах одной книги и в картинах одной пьесы, ибо они противоположны. Поэтому-то спектакль этот, в общем трогающий и сильный, может заставить задуматься многих работников нашего искусства. Нужно продолжить поиски ху- дожественных средств, чтобы наиболее ярко передать драму и торжество жизни, чтобы взволновать и растрогать (как это делают первые картины спектакля «Ста- линградцы») нашего советского человека. так много перестрадавшего, передумавше- го и так великолепно, так беззаветно де- рущегося за самую большую правду зем- ли, за идеи партии Ленина- Сталина.	vol-5789-page-04-seg-018-0873-2391-1527-3839.png
5789	4	559	3953	1163	3984	3	0.94339	действия авиации союзников	vol-5789-page-04-seg-019-0559-3953-1163-3984.png
5789	4	1238	3857	1487	3895	2	0.91042	Вас. ГРОССМАН	vol-5789-page-04-seg-020-1238-3857-1487-3895.png
5789	4	305	4010	1412	4161	5	0.93789	Налеты на Берлин, Брауншвейг, Бухарест	vol-5789-page-04-seg-021-0305-4010-1412-4161.png
5789	4	188	4172	855	5588	226	0.97226	ЛОНДОН, 7 мая. (ТАСС). Штаб амери- канских вооруженных сил на европейском театре операций сообщает, что 7 мая весьма крупные соединения американских «Летающих крепостей» и «Либерейторов» в сопровождении очень большого количе- ства истребителей совершили налет на военные объекты в Берлине и в других пунктах Германии. лондон, 7 мая. (ТАСС). Как ссоб- щает английское министерство информации, в дневном налете американской авиации на Берлин и другие военные объекты в Запад- ной Германии 7 мая участвовало свыше 750 тяжелых бомбардировщиков «Летаю- щая крепость» и «Либерейтор», входящих в состав 8-го авиационного корпуса, и та- кое же количество американских истреби- телей «Сандерболт», «Лайтнинг» и «Му- станг» и английских самолетов «Мустанг» из состава 8-го и 9-го авиационных кор- пусов. ЛОНДОН, 8 мая. (ТАСС). Штаб амери- канских экспедиционных сил в Европе со- общил, что весьма крупные соединения тя- желых бомбардировщиков американского 8 авиационного корпуса днем 8 мая со- вершили налет на обекты в районе Бер- лина и Брауншвейга. Налет на Берлин был совершен бомбардировщиками «Летающая крепость». Самолеты «Либерейтор» бомби- ли Брауншвейг. По сообщению английско- го министерства информации, в этой опе- рации участвовало около 1.000 - бомбарди- ровщиков и почти такое же число истре- бителей. ЛОНДОН, 8 мая. (ТАСС). Специальный корреспондент агентства Рейтер передает из штаба войск союзников в Италии о том, что вчера соединение бомбардировщи- ков «Летающая крепость» в сопровожде- нии истребителей "Тандерболт" совершило налет на железнодорожный мост на желез- нодорожной линии Белград-Панчево. В	vol-5789-page-04-seg-022-0188-4172-0855-5588.png
5789	4	867	4180	1525	5590	236	0.96273	тот же день тяжелые бомбардировщики, входящие в состав средиземноморской авиации союзников, совершили налет на главную сортировочную станцию Буха- реста. В этом налете участвовали бомбар- дировщики «Либерейтор» и «Летающая крепость», сопровождавшиеся самолетами «Лайтнинг» и «Мустанг». По словам лет- чиков, на сортировочную станцию и распо- ложенные поблизости сооружения было сброшено большое количество бомб. Лет- чики наблюдали пожары и взрывы. ЛОНДОН, 8 мая. (ТАСС). Английское министерство авиации сообщает, что в ночь на 8 мая крупные силы английской бом- бардировочной азиации совершили налет на Францию. Бомбардировкам подверглись аэродром и склад боеприпасов в Ренне, аэродромы в Нанте и Туре, склад боепри- пасов в Сальбри (примерно в 50. км. югу от Орлеана) и военные объекты на по- бережье Нормандии. Согласно первым до- несениям, атаки были весьма концентриро- ванными. Совершен также налет на Левер- кузен (севернее Кельна). Английская ави- ация производила минирование неприятель- ских вод. 9 английских самолетов не вер- нулись на свои базы. ЛОНДОН, 8 мая. (ТАСС). Штаб амери- канских вооруженных сил на европейском театре сообщил, что вечером 7 мая само- леты «Сандерболт» подвергли бомбарди- ровке пикирования аэродромы вблизи Лилля и Эвре, сортировочную станцию в районе Арраса и железнодорожный мост на реке Сене вблизи Руана. Все амери- канские самолеты вернулись на свои базы. ЛОНДОН, 8 мая. (ТАСС). Английское министерство авиации сообщает, что вече- ром 6 мая и в ночь на 7 мая самолеты английской береговой обороны нанесли по- вреждения пяти торговым судам против- ника и большому количеству конвойных судов у Фризских островов.	vol-5789-page-04-seg-023-0867-4180-1525-5590.png
5789	4	336	5640	1375	5723	7	0.93824	ПОТЕРИ АНГЛИЙСКОЙ И ГЕРМАНСКОЙ АВИАЦИИ за неделю	vol-5789-page-04-seg-024-0336-5640-1375-5723.png
5789	4	194	5740	854	5936	33	0.97271	ЛОНДОН, 8 мая. (ТАСС). Как передает агентство Рейтер, английская авиация за неделю, закончившуюся 7 мая, потеряла во время налетов на объекты Западной Европе 79 самолетов. Немцы потеряли над Европой 18 самолетов. На средиземномор-	vol-5789-page-04-seg-025-0194-5740-0854-5936.png
5789	4	867	5746	1535	5934	37	0.95509	ском театре союзники потеряли за неделю 53, а немцы 30 самолетов; в Индии и Бирме английская авиация потеряла 4, a японская -- 12 самолетов. Над Англией немцы потеряли 4 самолета, английская авиация потерь над Англией не снесла.	vol-5789-page-04-seg-026-0867-5746-1535-5934.png
5789	4	1590	363	2169	465	4	0.94079	подписанию советско- ЧЕХОСЛОВАЦКОГО СОГЛАШЕНИЯ	vol-5789-page-04-seg-027-1590-0363-2169-0465.png
5789	4	1550	482	2208	1279	127	0.96969	ЛОНДОН, 8 мая. (ТАСС). Как передает лондонское радио, исполняющий обязанно- сти министра иностранных дел Чехословац- кого правительства Губерт Рипка заявил сегодня в связи с заключением Советско- Чехословацкого соглашения: Красная Армия заканчивает подготовку своему последнему решительному насту- плению. Чехи должны выполнить свой долг по отношению к своей стране и к своим союзникам, оказывая полное содей- ствие русским войскам. Рипка выразил глу- бокое удовлетворение отношением Совет- ского Правительства к пожеланиям чехов и чешским законам при подписании пакта. Министр иностранных дел Чехословацкой республики Массарик, находящийся сейчас в Филадельфии, заявил, что до заключения последней главы этой войны судьба Гер- манию должна находиться в руках генера- лов, командующих союзными войсками Эйзенхауэра и Монтгомери и их замеча- тельного русского союзника. Эта война дол- жна положить раз и навсегда конец всякому возникновению новой агрессии,	vol-5789-page-04-seg-028-1550-0482-2208-1279.png
5789	4	1560	1352	2196	1479	4	0.98584	ГАЗЕТА «ЧЕХОСЛОВАК» СОВЕТСКО-ЧЕХОСЛОВАЦКОМ СОГЛАШЕНИИ	vol-5789-page-04-seg-029-1560-1352-2196-1479.png
5789	4	1546	1502	2206	3072	248	0.96754	ЛОНДОН, 7 мая. (ТАСС). В связи с чехословацко-советским соглашением газета «Ча «Чехословак» пишет в передовой статье: «С искренней радостью и величайшим удовлетворением встретит чехословацкая общественность за границей и народ на родине известие о заключении между чехо- словацким и советским правительствами соглашения, разрешающего все важнейшие и самые срочные вопросы, которые вста- нут перед нами после вступления союзной Красной Армии на государственную терри- торию Чехословакии. После славных побед советских войск настал исторический мо- мент, когда советские войска, несущие на своих штыках свободу нашему исстрадав- шемуся народу, приблизились к террито- рии нашей республики». Далее газета характеризует соглашение как "вклад в дело всей политики союзни- ков» и продолжает: «Чехословацкий на- род выражает благодарность братским народам СССР и его великому премьеру Маршалу Сталину, а также руководителям советской внешней политики за их дружбу. Эта дружба, объединяющая народы Чехо- словацкой республики с народами СССР и основанная на солидарности славянских народов, а также на долголетней тради- ции русско-чехословацких отношений и прочном союзе, была за последние годы вновь скреплена тесным политическим со- трудничеством и борьбой. Чехословацкий народ никогда не забудет дипломатиче- ской, моральной и политической поддерж- ки, которую СССР оказал ему в его борьбе за свободу. Никогда не забудет он также тесного сотрудничества, выраже- нием которого явилось соглашение от 18 июля 1941 г. Это сотрудничество было скреплено совместно пролитой кровью на многих полях сражений и той братской любовью, которой советский народ окру- жил чехословацкую бригаду, сражающуюся на стороне героической Красной Армии. Новое чехословацко-советское соглашение, заключаемое с согласия остальных вели- ких союзников, явится новым крупным успехом нашей политики».	vol-5789-page-04-seg-030-1546-1502-2206-3072.png
5789	4	1592	3143	2156	3299	5	0.95717	ДЕБАТЫ НАЦИОНАЛЬНОЙ ВО ФРАНЦУЗСКОЙ КОНСУЛЬТАТИВНОЙ	vol-5789-page-04-seg-031-1592-3143-2156-3299.png
5789	4	1544	3314	2202	4247	142	0.97547	лондон, 7 мая. (ТАСС). Агентство АФИ передает из Алжира, что во фран- цузской Консультативной Ассамблее co- стоялись дебаты по вопросу о националь- ной обороне. Военный комиссар Андрэ Дьетельм за- явил: «Перед армией стоят две основные задачи - вести войну и обеспечить мир и порядок во Французской империи, а вскоре и на освобожденных территориях Франции. Проблема людских резервов ар- мии разрешена путем мобилизации 14 про- центов французского населения владений Франции, а проблема военных материалов частично разрешена благодаря поставкам союзников. Чистка армии от фашистских элементов через две недели закончится». Комиссар авиации Гренье, выступивший после Дьетельма, рассказал, каким путем правительство намеревается восполнить не- достаток летных кадров, и обратился к женщинам с призывом вступать в авиацию. Перечислив доблестные французские эска- дрильи, в настоящее время сражающиеся на различных фронтах, Гренье под апло- цисменты упомянул о сражающейся на со- ветско-германском фронте против гитле- ровцев французской эскадрилье «Норман- дия».	vol-5789-page-04-seg-032-1544-3314-2202-4247.png
5789	4	1546	4249	2196	4409	28	0.95731	Коснувшись вопроса чистке, Гренье сказал, что он намерен оценивать офице- ров в зависимости не от того, что они ду- мали вчера, а от того, что они делают сегодня.	vol-5789-page-04-seg-033-1546-4249-2196-4409.png
5789	4	1544	4411	2198	5117	110	0.95921	Выступивший вслед за Гренье комиссар военно-морского флота Жакино сказал, что комиссариат морского флота в 1944--45 гг... будет уделять внимание главным образом эсминцам, легким крейсерам и морской авиации. Французский флот приступил к несению службы берегов Северной Африки, и союзники должным образом оце- нивают помощь французского флота. После непродолжительных дебатов Ас- самблея приняла резолюцию, выражающую уверенность в том, что все действия Ко- митета Национального Освобождения бу- дут направлены на расширение военных усилий для ускорения освобождения Фран- ции и что комитет приложит все силы для того, чтобы добиться полной общности взглядов армии и борцов сопротивления. Генерал де Голль, выступая на заседа- нии Консультативной Ассамблеи, заявил. что Комитет Национального Освобождения полностью присоединяется к резолюции.	vol-5789-page-04-seg-034-1544-4411-2198-5117.png
5789	4	1556	5170	2189	5255	4	0.94852	празднование годовщины ОСВОБОЖДЕНИЯ ТУНИСА	vol-5789-page-04-seg-035-1556-5170-2189-5255.png
5789	4	1544	5267	2196	5497	39	0.97105	ЛОНДОН, 8 мая. (ТАСС). Агентство Рейтер передает сообщение алжирского ра- дио о том, что 6 мая в Тунис прибыл ге- нерал де Голль в сопровождении генерала Карту, чтобы присутствовать на юбилейном торжестве по поводу первой годовщины ос- вобождения Туниса.	vol-5789-page-04-seg-036-1544-5267-2196-5497.png
5789	4	1633	5548	2104	5632	2	0.94154	ГИБЕЛЬ ГЕРМАНСКОГО	vol-5789-page-04-seg-037-1633-5548-2104-5632.png
5789	4	1542	5646	2202	5936	45	0.96911	ЛОНДОН, 8 мая. (ТАСС). Английское морское министерство сообщило, что лег- кие силы английского военно-морского флота утром 8-го мая торпедировали и потопили германский эсминец класса «Эль- бинг", уже до того поврежденный и ли- шившийся управления в результате столк- новения с канадским эсминцем «Гайда» вблизи острова Уэссан,	vol-5789-page-04-seg-038-1542-5646-2202-5936.png
5789	4	2260	359	3524	565	11	0.94618	Газета , разоблачает пропагандистскую : деятельность в США польского эмигрантского правительства	vol-5789-page-04-seg-039-2260-0359-3524-0565.png
5789	4	2223	579	2881	1254	103	0.95899	6 мая. (ТАСС). Газета «ПМ» поместила статью, озаглавленную «Поль- ское правительство вмешивается в полити- ку США». В этой статье сообщается, что министерство юстиции США, проводящее расследование деятельности «польского ин- формационного центра" в Нью-Йорке, не- давно установило, что польские должност- ные лица расходуют крупные суммы на пропаганду среди американских граждан, не будучи зарегистрированными качестве иностранных агентов. По словам газеты, ми- нистерство юстиции отказалось сообщить обнаруженные им факты финансовых зло- употреблений польского информационного центра, но частное расследование, прове- дение газетой, обнаружило, что поляки расходуют на пропаганду в два раза боль- ше средств, чем предусмотрено их офици- альным бюджетом, составившим 470 тысяч долларов в 1944 году.	vol-5789-page-04-seg-040-2223-0579-2881-1254.png
