volume_number	page_number	x1	y1	x2	y2	tokens_count	mean_confidence	text	image
5663	1	1024	233	2210	294	3	0.95226	Смерть немецким оккупантам.	vol-5663-page-01-seg-001-1024-0233-2210-0294.png
5663	1	322	313	2262	660	9	0.91293	. . ЦЕНТРАЛЬНЫЙ ОРГАН НАРОДНОГО КОМИССАРИАТА ОБОРОНЫ СОЮЗА ССР	vol-5663-page-01-seg-002-0322-0313-2262-0660.png
5663	1	364	692	654	753	2	0.90958	292 (5663)	vol-5663-page-01-seg-003-0364-0692-0654-0753.png
5663	1	1009	694	1650	747	5	0.94117	11 декабря 1943 г., суббота	vol-5663-page-01-seg-004-1009-0694-1650-0747.png
5663	1	1984	692	2229	738	2	0.83299	ЦЕНА 20 КОП.	vol-5663-page-01-seg-005-1984-0692-2229-0738.png
5663	1	2343	229	4379	692	34	0.96680	Войска 2-го Украинского фронта, продолжая развивать наступление, овладели важнейшим железнодорожным узлом правобережной Украины и мощным опорным пунктом обороны немцев на Кировоградском направлении-городом Знаменка. Слава нашим доблестным войскам, освобождающим совет- скую землю от немецких захватчиков!	vol-5663-page-01-seg-006-2343-0229-4379-0692.png
5663	1	908	819	1757	981	5	0.91326	II P И К А	vol-5663-page-01-seg-008-0908-0819-1757-0981.png
5663	1	288	973	1324	4653	255	0.95897	Верховного Глав Генералу армии 1. Войска 2-го УКРАИНСКОГО фронта, продолжая развивать наступление, 9 декаб- ря в результате трехдневных напряженных - боев овладели городом ЗНАМЕНКА - важнейшим железнодорожным узлом пра- вобережной Украины и мощным опорным пунктом обороны немцев на Кировоград- ском направлении. """" В боях за овладение городом ЗНАМЕН- - КА отличились войска генерал-лейтенанта ЖАДОВА, генерал-майора РОДИМЦЕВА, танкисты генерал - полковника танковых войск РОТМИСТРОВА и летчики генерал- лейтенанта авиации ГОРЮНОВА. Особенно отличились: 6 Гвардейская Кременчугская воздушно- " десантная дивизия генерал-майора СМИР- НОВА, 110 Гвардейская Александрийская стрелковая дивизия полковника ОГОРО- ДО ВА, 214 Кременчугско-Александрийская стрелковая дивизия полковника ЖУКОВА, 233 Кременчугская стрелковая дивизия полковника ВОДОПЬЯНОВА, 95 Гвардей- ская Полтавская стрелковая дивизия пол- ковника ОЛЕЙНИКОВА, 18 танковый кор- пус полковника ФИРСОВИЧ, 29 танковый корпус генерал-майора танковых войск КИРИЧЕНКО, 32 танковая бригада полков- - ника ВИТЕБСКОГО, 110 танковая бригада - - подполковника РЕШЕТНИКОВА, 53 мото- стрелковая бригада полковника СЫРОЕШ- - КИНО, 6 истребительная противотанковая - - артиллерийская бригада полковника БА- ЛАШОВА, 301 Полтавский истребительный противотанковый артиллерийский полк подполковника ВЛАСЕНКО, 308 Гвардей- ский Кременчугско-Александрийский мино- : метный полк подполковника ГОЛЬДИНА, - 256 отдельный инженерный батальон майо- ра ПИНЬЧУКОВА, 1446 самоходный артил- лерийский полк майора ЛУНЕВА, 312 ноч- : ная легко-бомбардировочная авиационная дивизия полковника КУЗНЕЦОВА, 203 ист- ребительная авиационная дивизия генерал- -- майора авиации БАРАНЧУК, 181 танковая бригада подполковника ИНДАКИНА, 1438 самоходный артиллерийский полк подпол- ковника ЗАТЫЛКИНА, 76 Гвардейский ми- нометный полк подполковника СЕМЕНА- - - - ВА, 994 авиационный полк капитана СУХИ- " НИНА, 108 истребительный противотанко- вый артиллерийский полк майора ДМИТ- - РИЕНКО и 271 минометный полк капитана РЫЖИКОВА. -	vol-5663-page-01-seg-009-0288-0973-1324-4653.png
5663	1	1313	973	2332	4664	261	0.94760	нокомандующего нии КОНЕВУ В ознаменование одержанной победы со- единениям и частям, отличившимся в боях за освобождение города ЗНАМЕНКА, при- своить наименование "ЗНАМЕНСКИХ". Впредь эти соединения и части имено- - вать: 6-я Гвардейская Кременчугско-Знамен- ская воздушно-десантная дивизия, 233-я Кременчугско-Знаменская стрелка- - вая дивизия, 18-й Знаменский танковый корпус, . . . 29-й Знаменский танковый корпус, 32-я Знаменская танковая бригада, 110-я Знаменская танковая бригада, 53-я Знаменская мото-стрелковая бригада, 6-я Знаменская истребительная противо- танковая артиллерийская бригада, 256-й Знаменский отдельный инженерный батальон, 1446-й Знаменский самоходный артилле- - - рийский полк, 312-я Знаменская ночная легко-бомбарди- ровочная авиационная дивизия, 203-я Знаменская истребительная авиа- ционная дивизия, 181-я Знаменская танковая бригада, 1438-й Знаменский самоходный артилле- рийский полк, 76-й Гвардейский Знаменский миномет- : ный полк, 994-й Знаменский авиационный полк, . . . . 108-й Знаменский истребительный проти- вотанковый артиллерийский полк, 271-й Знаменский минометный полк. 214-ю Кременчугско - Александрийскую стрелковую дивизию, 308-й Гвардейский Кременчугско-Александрийский миномет- : ный полк, 110-ю Гвардейскую Александрий- скую стрелковую дивизию, 95-10 Гвардей- скую Полтавскую стрелковую дивизию и - 301-й Полтавский истребительный противо- танковый артиллерийский полк, второй и третий раз отличившиеся в боях с немец- кими захватчиками, представить к награж- ". дению орденами КРАСНОГО ЗНАМЕНИ. f Сегодня, 10 декабря, в 18 часов столица нашей Родины МОСКВА от имени Родины салютует нашим доблестным войскам, освободившим город ЗНАМЕНКА, - две- надцатью артиллерийскими залпами из ста ---- двадцати четырех орудий. . За отличные боевые действия ОБ'ЯВЛЯЮ БЛАГОДАРНОСТЬ всем руководимым Ва- : ми войскам, участвовавшим в боях за осво- бождение города ЗНАМЕНКА. . . . . . Вечная слава героям, павшим в борьбе за свободу и независимость нашей Родины! - Смерть немецким захватчикам!	vol-5663-page-01-seg-010-1313-0973-2332-4664.png
5663	1	368	4690	2239	4918	11	0.95955	Верховный Главнокомандующий Маршал Советского Союза И. СТАЛИН. 10 декабря 1943 года.	vol-5663-page-01-seg-011-0368-4690-2239-4918.png
5663	1	476	5000	2142	5190	13	0.96711	УКАЗ ПРЕЗИДИУМА ВЕРХОВНОГО СОВЕТА СССР О награждении соединений Красной Армии орденом Красного Знамени	vol-5663-page-01-seg-012-0476-5000-2142-5190.png
5663	1	303	5216	1288	5339	19	0.91065	За образцовое на фронте борьбы при этом доблесть выполнение боевых заданийКомандования с немецкими захватчиками и проявленные и мужество наградить:	vol-5663-page-01-seg-013-0303-5216-1288-5339.png
5663	1	546	5357	1051	5396	3	0.99189	Орденом красного знамени	vol-5663-page-01-seg-014-0546-5357-1051-5396.png
5663	1	362	5414	1265	5524	14	0.93672	214 Кременчугско-Александрийскую стрелковую дивизин 110 Гвардейскую Александрийскую стрелковую дивизию. 95 Гвардейскую Полтавскую стрелковую дивизию.	vol-5663-page-01-seg-015-0362-5414-1265-5524.png
5663	1	1330	5210	2307	5358	12	0.92756	308 Гвардейский Бременчугско-Александрийс метный полк. 301 Полтавский истребительный противотанковый артил лерийский полк.	vol-5663-page-01-seg-016-1330-5210-2307-5358.png
5663	1	1356	5374	2277	5520	19	0.93105	Председатель Президиума Верховного Совета СССР КАЛИНИН Секретарь Президиума Верховного Совета СССР А. ГОРКИН Москва, Кремль, 10 декабря 1943 года.	vol-5663-page-01-seg-017-1356-5374-2277-5520.png
5663	1	516	5594	2093	5725	13	0.95745	Москва от имени Родины салютует доблестным войскам 2-го Украинского фронта, освободившим город Знаменка	vol-5663-page-01-seg-018-0516-5594-2093-5725.png
5663	1	294	5744	950	6072	40	0.94397	Вчера Москва от имени Родины салю- товара нашим доблестным войскам, овла девшим городом Знаменка важнейшим железнодорожным узлом правобережной Украины и мощным опорным пунктом обороны немцев на Кировоградском на правлении. В 18 часов зимнее вечернее небо ярко осветилось разнодветными ракетными ог-	vol-5663-page-01-seg-019-0294-5744-0950-6072.png
5663	1	975	5744	1635	6070	50	0.92917	ням и. Грянул первый артиллерийский зало из ста двадцати четырех орудий, возвестивший о новой победе, одержал- ной войсками 2-го Украинского фронта Двенадцать раз пронеслись в морозном воздухе раскаты победного салюта, и каж- лый зало поднимал в сердце советского человека великую радость и окрылял гор- достью за далих храбрых воинов, очи-	vol-5663-page-01-seg-020-0975-5744-1635-6070.png
5663	1	1654	5747	2307	5812	6	0.91986	щающих советскую землю от фашистских захватчиков.	vol-5663-page-01-seg-021-1654-5747-2307-5812.png
5663	1	1652	5820	2311	6070	32	0.94010	Дружным "ура" в ликующими возгла сами приветствовали кителе етолинь на улицах и площадях Красную Армию и Верховного Главнокомандующего Маршала Советского -Союза товарища Сталина. Салют транслировался по радио. Его слушала вся страна. (TALC).	vol-5663-page-01-seg-022-1652-5820-2311-6070.png
5663	1	2447	812	4171	1070	10	0.94179	Москва, Кремль Иосифу Виссарионовичу СТАЛИНУ : От молодежи города Киева	vol-5663-page-01-seg-023-2447-0812-4171-1070.png
5663	1	2358	1100	3011	1178	7	0.88749	Дорогой и любимый наш Посиф Висса- рпонович!	vol-5663-page-01-seg-024-2358-1100-3011-1178.png
5663	1	2354	1187	3013	1535	41	0.93702	Мы, молодежь освобожденного киева славной столицы Советской Украины. шлем Вам и героической Красной Армии от всего сердца нашего и от души, испол- ненной счастья и радости, пламенный привет и слова безграничной благодарности за освобождение нас от тяжелого гнета не- мецких захватчиков.	vol-5663-page-01-seg-025-2354-1187-3013-1535.png
5663	1	2349	1542	3013	2823	175	0.93943	Сердце Украины, слава и гордость на- шего народа, златоглавый Биев - снова советский. Как нерушимая крепость, стоит город Киев на крутом берегу Днепра. стоит, как символ могущества и непо- корности нашего народа. Мы росли и вос- питывались в этом величавом городе. Мы счастливо жили в Стране Советов, лелеяв- тей нас, как родная мать. Из наших ря- дов выходили герои труда, ученые, поэты. художники, инженеры. Бак седой Днепр несет горло и величаво свои могучие воды, так счастливо и радостно протекала наша молодость. Немцы, эта черная разнуздан ная сила своеволия и разбоя, ворвались в нашу прекрасную жизнь, разрушили в исковеркали ее. Больше двух лет немеп кие людоеды гнали молодежь Киева на ка- торгу в немецкую неволю. В концлагерях смерти, в застенках гестапо пытали и рас- стреливалв лучших представителей моло- дежи: девушек сестер наших, юно шей - братьев наших. Они изо всех сил пытались уничтожить нашу молодежь, сде- лать нас рабами. Они пытались уничто- жить на нашей земле всё советское, раз- рушить богатую нашу культуру и ее на- средство. Они хотели вытравить у нас чувство национальной гордости, заставить	vol-5663-page-01-seg-026-2349-1542-3013-2823.png
5663	1	3038	1102	3690	1176	8	0.93275	нас забыть родной язык, пытались опеме учить нас.	vol-5663-page-01-seg-027-3038-1102-3690-1176.png
5663	1	3030	1187	3690	2381	150	0.94129	Не чудные украинские песни, а слезы горе были нашими спутниками в эти тяжелое время. Захлебываясь кровью, враг уничтожал всё, что веками строилось на- шим народом, что дорого сердцу советско- го человека. Более ста лет стоял Киев- ский университет, из которого выходили тысячи специалистов различных отраслей пауки. Немцы сожгли его. Осквернили они великий исторический памятник Киево-Печерскую лавру, уничтожили сожгли публичную библиотеку, музон книгохранилища, кинотеатры и клубы школы и детские учреждения. Но ны не склонили голову перед немецкими палача- мп. виселицы, ни пытки не сломили нас, нашего духа, нашей воли к борьбе с гитлеровскими захватчиками. В дни тя- жилых испытаний мы твердо верили. что Вы, наш родной отец, знаете о наших му- ках и ускоряете час нашего освобожде- ния. Наши надежды, наша вера в победу. в приход красных воинов-освободителей по- могали нан в борьбе с угнетателями, да- вали нам силы пережить время тяжкой неволи и дождаться праздника освобожде- нея, праздника возрождения нашего.	vol-5663-page-01-seg-028-3030-1187-3690-2381.png
5663	1	3026	2389	3681	2821	55	0.93678	На всю жизнь останется в память 6 ноября 1943 года. В этот день (об лестные дивизии Красной Армии принес ли нам долгожданное освобождение. Это была счастливейшая минута в жизни мо голых киевлян черной немецкой неволи остались позади. Нам снова светит солице великой Советской Родины. За принесенные нам счастье и свободу глубокая благодарность и слава героиче-	vol-5663-page-01-seg-029-3026-2389-3681-2821.png
5663	1	3713	1098	4372	1523	49	0.93526	скпм бойцам, офицерам и генералам освободителям нашим. Глубокая и сердеч- ная благодарность старшему брату наше великому русскому народу и всем народам братских республик, пославших сыновей своих на бой с лютым врагом на освобождение нас от немецкого раб- ства. Безграничная благодарность лично Вам, дорогой Иосиф Виссарионович, диро- гой наш отеп.	vol-5663-page-01-seg-030-3713-1098-4372-1523.png
5663	1	3708	1554	4372	2115	68	0.92204	Сегодня мы клянемся Вам, что всю юношескую силу, энергию и пыл прило- джем, чтобы восстановить наш родной го рол. Наш величавый Киев будет скоро поднят из руин, мы восстановим нашу промышленность и транспорт, восстановим наши институты и школы, кинотеатры и клубы, оборудуем библиотеки и лаборато- рин. Мы беремся за творческий труд, и пусть наша самоотверженность послужит быстрейшему разгрому захватчиков, осво вождению всей нашей Советской Родины от немецко-фашистской нечисти,	vol-5663-page-01-seg-031-3708-1554-4372-2115.png
5663	1	3715	2144	4362	2222	6	0.89320	Проклятие и смерть немецким захват чикам!	vol-5663-page-01-seg-032-3715-2144-4362-2222.png
5663	1	3708	2239	4360	2328	9	0.92698	Да здравствует наша славная Родина- великий, могущественный Советский Союз	vol-5663-page-01-seg-033-3708-2239-4360-2328.png
5663	1	3709	2332	4364	2478	13	0.91307	Да здравствует Советская Украина! Да здравствует нерушимая дружба уб- раинского и русского народов!	vol-5663-page-01-seg-034-3709-2332-4364-2478.png
5663	1	3706	2495	4360	2618	12	0.91967	Да здравствует Красная Армия на- ша слава, наша гордость, наша освобо лительница!	vol-5663-page-01-seg-035-3706-2495-4360-2618.png
5663	1	3708	2635	4360	2717	6	0.90854	Да здравствует наш вождь великий Сталин!	vol-5663-page-01-seg-036-3708-2635-4360-2717.png
5663	1	2476	2899	3688	3077	8	0.97269	от советского информбюро Оперативная сводка за 10 декабря	vol-5663-page-01-seg-037-2476-2899-3688-3077.png
5663	1	2358	3098	3675	3559	72	0.93969	Войска 2-го Украинского фронта, после трехдневных упорных боев, 9 декабря овладели городом и железнодорожным узлом ЗНАМЕНКА. В течение 10 декабря на КИРОВОГРАДСКОМ направлении наши войска с боя- ми заняли населенные пункты ГРИГОРЬЕВКА, ПЛЕШАНОВО, ТОПИЛО, КОЛАНИ, КУЧЕРОВКА, ХИРОВКА, КОНСТАНТИНОВКА, ВЛАДИМИР, ВЕРШИНА-КАМЕНКА, ПЕТРОВСКИЙ. ЧЕЧЕЛЕВКА и железнодорожные станции ХИРОВКА, ЧАБАНОВКА. В районе южнее МАЛИН наши войска успешно отбивали атаки крупных сил пехоты и танков противника и нанесли ему большие потери в живой силе и технике.	vol-5663-page-01-seg-038-2358-3098-3675-3559.png
5663	1	2364	3569	3671	3662	7	0.92112	На других участках фронта разведка иллерийско-минометная перестрелка.	vol-5663-page-01-seg-039-2364-3569-3671-3662.png
5663	1	2362	3675	3670	3818	34	0.92681	В течение 9 декабря наши войска на всех фронтах подбили и уничтожили 122 немецких танка, из них 92 в районе северо-восточнее ЧЕРНЯХОВА. В воз- душных боях и огнем зенитной артиллерии сбито 14 самолетов противника.	vol-5663-page-01-seg-040-2362-3675-3670-3818.png
5663	1	2336	3930	2998	5043	148	0.94686	Войска 2-го Украинского фронта, в ре- зультате трехдневных напряженных боев овладели городом и важнейшим железно- дорожным узлом Знаменка. Сломив оборо- ну немцев на дальних подступах к Зна- менке, наши танкисты прорвались в тыл противника и перерезали коммуникации немцев. Одновременно советские войска на- несли противнику решительный удар фронта. Немцы оказывали упорное сопро- тивление. На окраинах города и перекре- стках уилл они врыли в землю танки и, опираясь на заранее созданные укрепле- ния, неоднократно переходили в контрата- ки. Подавляя огневое сопротивление и отбивая контратаки немцев, советские бой- пы ворвались в город и отвоевывали врага улипу за улипей. Вчера вечером наши войска полностью очистили желез- нодорожный узел и город Знаменка от немецко-фашистских захватчиков. В боях за Знаменку противник понес тяжелые потери. По неполным данным только за 9 декабря уничтожено до 1.500 гитлеров- цев и 23 нечетких танка. Захвачено мно- го орудий, боеприпасов и различного воен- ного имущества. Взято значительное чис- пленных	vol-5663-page-01-seg-042-2336-3930-2998-5043.png
