volume_number	page_number	x1	y1	x2	y2	tokens_count	mean_confidence	text	image
5016	1	1331	478	2316	530	4	0.94289	Пролетарии всех стран, соединяйтесь.	vol-5016-page-01-seg-002-1331-0478-2316-0530.png
5016	1	324	550	2326	890	7	0.98373	ЦЕНТРАЛЬНЫЙ ОРГАН НАРОДНОГО КОМИССАРИАТА ОБОРОНЫ СОЮЗА ССР	vol-5016-page-01-seg-003-0324-0550-2326-0890.png
5016	1	362	920	606	972	3	0.94522	№ 26I (5016)	vol-5016-page-01-seg-004-0362-0920-0606-0972.png
5016	1	1112	924	1653	974	5	0.94239	5 ноября 1941 г., среда	vol-5016-page-01-seg-005-1112-0924-1653-0974.png
5016	1	2149	918	2406	968	2	0.87427	ЦЕНА 15 коп.	vol-5016-page-01-seg-006-2149-0918-2406-0968.png
5016	1	2556	460	4488	952	47	0.95015	Братский привет нашим братьям украинцам, белоруссам, молда- ванам, литовцам, латышам, эстонцам, карелам, временно попавшие под ярмо немецко-фашистских мерзавцев! Братья! Организуйте партизанские отряды, громите тылы вражеских войск, уничтожайте немецко-фашистских разбойников и ждите нашего прихода, -мы еще придем! (Из лозунгов ЦК ВКП(б) к XXIV годовщине Великой Октябрьской Социалистической Революции).	vol-5016-page-01-seg-007-2556-0460-4488-0952.png
5016	1	544	1044	1465	1339	3	0.96999	дисциплина на соренто	vol-5016-page-01-seg-008-0544-1044-1465-1339.png
5016	1	302	1357	994	2478	149	0.94985	Борьба разгорается все сильнее. Враг продолжает рваться к Москве и Ленинграду, в глубь Донбасса и Крыма. День и ночь, не затихая, идут ожесточенные, кровопролит- ные бои. Бросая в огонь сражений дивизию за дивизией, фашисты на некоторых участках все еще теснят наши части. Неприятель продвигается в Донбассе значительно мед- леннее, правда, чем прежде, но продви- гается. Ареной борьбы стали уже районы Горловки и Артемовска. В Крыму, уложив почти целую свою армейскую группировку. немцы добились успеха и теперь с бешеной активностью силятся развить этот успех. Развернулась борьба в районе Симферополя, Евпатории и Феодосии. На оциом из важ- лых участков битвы за Ленинград враг пытался предпринять новое наступление. чтобы перерезать коммуникации наших : Войск. Однако упорство и решительность действий защитников города Ленина сорва- ли замысел немцев. Враг здесь отбит, во многих районах инициатива переходит в наши руки. Усиленный напор фашистов и энергичные контрмеры частей Красной ар- мини характерны также для Западного фронта.	vol-5016-page-01-seg-009-0302-1357-0994-2478.png
5016	1	296	2488	980	2922	62	0.93675	В целом обстановка попрежнему напря- жена, опасность попрежнему велика. Вра- жеский натиск нарастает, но одновременно повсюду нарастает и сила нашего сопро- тивления. Фашисты торопятся, они знают, что каждый потерянный день приближает их к гибели. Фашисты торопятся, нель- 3.1 медлить и нам. Умножим усилия борьбе за Москву и Ленинград, за Донбасс и Брым! Не по дням, а по часам будем крепить отпор врагу!	vol-5016-page-01-seg-010-0296-2488-0980-2922.png
5016	1	286	2930	974	3769	118	0.95885	Сейчас, когда буря достигла огромной силы, когда гитлеровские орлы прорвались одним из важнейших жизненных центров нашей страны, от каждого воина Красной армии больше, чем когда-либо, требуется несгибаемое упорство, непоборимая стой- кость. Что бы ни случилось, как бы не нажимал враг, - держись крепко. В любой обстановке биться до конца, при любых условиях сдерживать рубежи обороны вот высший для нас закон. мы в силах и обязаны добиться, что- бы так сражались все до одного наши люди. У нас есть для этого все данные. Нужна лишь твердая командирская воля. Нужна лишь раньше всего и больше всего - железная советская воинская дис- диплина. Именно в дальнейшем и неустан- ном укреплении дисциплины --- один из основных путей к укреплению нашего отпора врагу.	vol-5016-page-01-seg-011-0286-2930-0974-3769.png
5016	1	286	3777	970	4488	96	0.95500	Дисциплина это одна из главных сил армии. Какой бы энтузиазм ни горел в ду- шах воинев, как бы они ни ненавидели грага, ни рвались в бой, не до- биться успеха, если они не спаяны вое- дино строжайшей воинской дисциплиной. Только дисциплинированность, только безус- ловное и безграничное повиновение всех и каждого воле старших начальников, де- тает действия тысяч и сотен тысяч воинов осмысленными и целеустремленными. Толь- ко дисциплинированность, только полное и точное выполнение в любых условиях при- казов командования, обеспечивает успех на поле боя. Только в дисциплинирован- пости проявляются, наконец, с наибольшей полнотой высокие моральные качества лютей.	vol-5016-page-01-seg-012-0286-3777-0970-4488.png
5016	1	1010	1357	1687	1997	94	0.95393	Дисциплина умножает силу воина. Вся- кая война связана со множеством опасно- стей, лишений и неизбежных неудач. Что Чтобы не дрогнуть перед ними, не сломить- ся под их тяжестью, устоять, мало одного лишь душевного порыва. Когда че- ловек отчетливо сознает, что приказа нель- зя не выполнить, как нельзя.л не дышать, он выполнит его, несмотря ни на что. Дисциплина в силах побороть страх смер- ти. Дисциплинированность, ясное понима- ние своего долга держат бойца на ногах, когда он валится ног, поднимают в атаку под градом пуль и разрывами мин. дают силу устоять под самым яростным напором врага.	vol-5016-page-01-seg-013-1010-1357-1687-1997.png
5016	1	1010	2005	1681	2163	22	0.94671	Именно такая дисциплина нам нужна Именно такая дисциплина должна прони- зывать все звенья наших войск - снизу доверху, от бойца до генерала.	vol-5016-page-01-seg-014-1010-2005-1681-2163.png
5016	1	1004	2167	1683	2648	65	0.95843	Каждый воин Красной армии должен отчетливо сознавать, что ни при каких об- стоятельствах не может быть отступлений от установленного воинского порядка. Что бы пи случилось, воин всегда остается воином, обязанным беспрекословие павино- ваться воле старшего начальника. Бакие бы события ни происходили, как бы усложнялась обстановка, -- приказ всегда есть приказ и он должен быть выполнен быстро, беспрекословно, любой ценой, если это даже может стоить жизни.	vol-5016-page-01-seg-015-1004-2167-1683-2648.png
5016	1	1002	2658	1677	3010	45	0.95475	Было бы наивным предполагать, что высокая дисциплинированность приходит сама собой. У нас много героев, которые готовы сражаться и сражаются до послед- ней капли крови, не щадя себя. Это, однако, совершенно не исключает роли командира, как создателя железной воин- ской дисциплины, а лишь облегчает его задачи.	vol-5016-page-01-seg-016-1002-2658-1677-3010.png
5016	1	998	3020	1675	3531	69	0.95218	Состояние дисциплины всегда опреде ляется тем, как заботится об ее укрепле- нии командир Нельзя закрывать глаза на то, что у нас есть еще отдельные отста- лые элементы, есть и люди слабые духом, есть, наконец, просто необстрелянные лю- ди. Вот здесь-то и необходимы сильная командирская воля и дисциплина. Личная дисциплинированность, самого комантира его умение твердой рукой водворять и поддерживать железный порядок в своем подразделении, в своей части вот что решает.	vol-5016-page-01-seg-017-0998-3020-1675-3531.png
5016	1	994	3541	1671	4207	91	0.95247	Командиру предоставлены большие пра- ва, он облечен всей полнотой власти. Де- ло лишь за тем, чтобы решительно исполь- зовать свои права, твердо осуществлять свою власть. Никаких отступлений от установленного воинского порядка, ника- кой распущенности! Надо помнить, что мелочей здесь нет - всякое зло под бес- пощадно истреблять в зародыше. Никакого потворства нарушителям дисциплины! того, кто отступает от своего воинского долга, надо взыскивать строго и немед- ленно. Лучше сразу же уничтожить на месте нескольких слизняков, смолоду- начавших, дезертировавших с поля боя или перебежавших к врагу, чем дать по- губить тысячи честных людей.	vol-5016-page-01-seg-018-0994-3541-1671-4207.png
5016	1	994	4215	1667	4371	24	0.94166	Мы сражаемся с сильным и коварным врагом. Идет борьба не на жизнь, а на смерть. Сплоченность и стойкость наших рядов решат исход этой борьбы.	vol-5016-page-01-seg-019-0994-4215-1667-4371.png
5016	1	992	4377	1663	4492	15	0.93309	Дисциплина мать победы в бою... Крепче железную советскую воинскую дисциплину в тылу и на фронте!	vol-5016-page-01-seg-020-0992-4377-1663-4492.png
5016	1	438	4572	1509	4634	5	0.96724	«Мы уверены в вашей победе»	vol-5016-page-01-seg-021-0438-4572-1509-4634.png
5016	1	284	4650	962	4866	29	0.96118	На лия тов. М. И. Калинина получена телеграмма следующего содержания: Три тысячи армян, сославшись на нас- соевый митинг, состоявшийся под руковод- ствоу армянского «Комитета Победы», шлют горячие приветствия советскому	vol-5016-page-01-seg-022-0284-4650-0962-4866.png
5016	1	988	4650	1659	4818	14	0.94108	народу и Красной Армии, самоотвержение защищающей свою родину. Мы уверены в вашей окончательной победе.	vol-5016-page-01-seg-023-0988-4650-1659-4818.png
5016	1	1042	4832	1617	4868	4	0.93301	Председатель --- профессор КАБАКЯН	vol-5016-page-01-seg-024-1042-4832-1617-4868.png
5016	1	514	4946	1419	5008	3	0.94464	Навстречу великому празднику	vol-5016-page-01-seg-025-0514-4946-1419-5008.png
5016	1	282	5022	960	5384	48	0.95375	МОСКОВСКИЙ ВОЕННЫЙ ОКРУГ, 4 но- ября. (По телефону от наш. спец. корр. ). Высокими достижениями в боевой и по- литической подготовке встречают 24-10 го- товщину Великой Октябрьской Социалисти- ческой Революции бойцы N резервного стрелкового полка. Недавно здесь закончи- лась инспекторская проверка по политиче- ской подготовке. Общая оценка «отлично».	vol-5016-page-01-seg-026-0282-5022-0960-5384.png
5016	1	280	5386	956	5637	30	0.95938	которыми командует старший лей- тенант Мичугин, лейтенанты Мордвинов и Силицкий все стрелковые задачи отработа- с диенами "отлично" и "хорошо". Сейчас бойцы этих подразделений с успехом осваивают новые средства противотанковой борьбы.	vol-5016-page-01-seg-027-0280-5386-0956-5637.png
5016	1	982	5028	1659	5633	80	0.95895	Недавно часть пополнилась молодыми бойцами 1922 года рождения. Большинст- во из них прошло допризывную подготов- ку. Молодые бойцы хорошо осваивают тех- нику, состоящую на вооружении полка. В связи с приближением праздника в подразделениях состоялись партийные комсомольские собрания. Агитаторы пойраз- деления, где политруком Клименко, прово- дят с бойцами беседы на тему: «Партия Ленина- Сталина руководительница в организатор исторических побед» и «Что дала советская власть трудящимся». красноармейцами и младшим начать- составом проводятся политиче- ские занятия о 24-й годовщине Великой Октябрьской Социалистической Революции.	vol-5016-page-01-seg-028-0982-5028-1659-5633.png
5016	1	484	5711	1429	5817	8	0.94725	С ЧЕСТЬЮ ВЫПОЛНЯЮТ СВОЙ ДОЛГ ПЕРЕД КРАСНОЙ АРМИЕЙ	vol-5016-page-01-seg-029-0484-5711-1429-5817.png
5016	1	274	5835	954	6311	70	0.95754	СВЕРДЛОВСК, 4 ноября. (ТАСС). Маши- ностроители Н-ского завода встречают XXIV годовщину Октябрьской революции новыми достижениями. Карусельщик т. Бе- ленков дает по 5 норм в смену. Комсомо- лец-строгальщик тов. Акманов вырабаты- вает от двух до четырех норм. Молодой расточник т. Шукшин на обработке самой трудной детали добился выдающегося до- стижения. При норме в девять часов он расточил летуаль за два часа. Коллектив стахановцев, инженеров, ма- стеров цеха, где начальником тов. Лифшиц,	vol-5016-page-01-seg-030-0274-5835-0954-6311.png
5016	1	974	5839	1651	6307	60	0.96168	с честью выполняет свой долг перед герои- ческой Красной армией. Максимально ис пользуя внутренние резервы, цех своевре- менно выполнил важнейший заказ, обеспе- чив сборку деталей для выпуска мощных машин. Директор завода премировал тт. Вылегжанина, королева, Митюшникова, заведующего планово-распределительным бюро цеха т. Реполовского, планировщиков Распопина, Головина, Левицкого и лучших станочников цеха, показавших образны стахановского труда, тт. Кочева, Тюри- на Абрамова других	vol-5016-page-01-seg-031-0974-5839-1651-6307.png
5016	1	1789	1044	3022	1141	3	0.96708	ОТ СОВЕТСКОГО ИНФОРМБЮРО	vol-5016-page-01-seg-032-1789-1044-3022-1141.png
5016	1	1887	1161	2908	1225	4	0.97083	Утреннее сообщение 4 ноября	vol-5016-page-01-seg-033-1887-1161-2908-1225.png
5016	1	1717	1245	2390	1345	17	0.95377	В течение ночи на 4 ноября наши вой ска вели бон с противником на всех фрон- тах.	vol-5016-page-01-seg-034-1717-1245-2390-1345.png
5016	1	1715	1403	2388	1541	22	0.95413	Часть тов. Гончарова, действующая на Южном фронте, за один день боевых дет- ствий уничтожила 20 немецких танков свыше 3 батальонов вражеской пехоты.	vol-5016-page-01-seg-035-1715-1403-2388-1541.png
5016	1	1713	1599	2386	1915	53	0.95397	Одна наша часть. действующая на ha- рельском фронте, прорвалась в тыл пр4 тивника и ударила по наступающим бело- финским частям. В коротком бою было уничтожено более 2 рот пехоты против - ника. Захвачены большие трофеи, в том числе несколько орудий, 4 рации, 15 пол- вод с боеприпасами, 50 велосипедов и пе- сколько грузовиков.	vol-5016-page-01-seg-036-1713-1599-2386-1915.png
5016	1	1705	1971	2384	2566	93	0.95767	Дикие зверства и насилие чинят пс мецко-фашистские мерзавцы в захвачен- ных ими районах. В селе Теренино Смо- ленской области немецкий офицер собрал всех крестьян и об'явил, что каждый двор должен поставить для германской армии определенное количество продоволь- ствия. Крестьяне заявили офицеру, чт все продукты у них уже отняты побывав- шим у них фашистским отрядом. Тогда немцы отобрали из числа присутствовав- ших на собрании четырех стариков, при- вязали их к столбам и начали на глаза всех жителей села пытать их огнем и колоть тесаками. Через несколько часов все четыре крестьянина скончались, не вынеся пыток.	vol-5016-page-01-seg-037-1705-1971-2384-2566.png
5016	1	2410	1245	3086	1883	107	0.95650	В деревне Березовка этой же полости немецкие солдаты ограбили все дома, за хватив даже поношенное белье. Вечером фашисты перелились и стали насиловать женщин и девушек. На утро отряд уехал и забрал с собой всех женщин от 16 до 30 лет. В ответ на просьбы и слезы ро- жителей солдаты открыли огонь из вин- товок и пистолетов. Пьяная банта оста- вила после себя разгромленную деревню и груду трупов расстрелянных жителей. В деревне Колпино Смоленской области фа- шисты погнали всех крестьян строить ио- сты. бараки и блиндажи для германских частей. Ни один из мобилизованных обрат- но в деревню не вернулся. Все крестьяне по окончании строительства укрепленных точек были расстреляны.	vol-5016-page-01-seg-038-2410-1245-3086-1883.png
5016	1	2404	1933	3080	2568	95	0.95751	B Чехословакии с каждым днем все сильнее развертывается борьба против не мепко-фашистских оккупантов. Кровавый террор, установленный фашистами в стра- не, лишь усиливает ненависть народа к немцам. Чехословацкие патриоты распро- страняют листовки, в которых призывают поселение ответить на кровавую расправу палача Гейдриха новыми актами диверсии саботажа. На железных дорогах Чехо- словакия не прекращаются крушения и аварии. 27 октября па линии Брно-Сви- тави произошло 2 крупных крушения эталонов с танками и орудиями. Разбито 25 танков и 40 орудий. 26 октября на военном заводе в г. Страконице вепыхнул пожар, во время которого сгорела значи- тельная часть готовой продукции.	vol-5016-page-01-seg-039-2404-1933-3080-2568.png
5016	1	1885	2626	2896	2680	4	0.96068	Вечернее сообщение 4 ноября	vol-5016-page-01-seg-040-1885-2626-2896-2680.png
5016	1	1705	2708	2378	2952	32	0.94845	В течение 4 ноября наши войска вели бои с противником на всех фронтах. Особенно бенно ожесточенные бои происходили на Крымском, Можайском и Калининском участках фронта. За 3 ноября уничтожено 5 немецких самолетов.	vol-5016-page-01-seg-041-1705-2708-2378-2952.png
5016	1	1711	2956	2374	3020	9	0.92717	За 4 ноября под Москвой уничтожено 11 немецких самолетов	vol-5016-page-01-seg-042-1711-2956-2374-3020.png
5016	1	1699	3078	2374	3425	51	0.95332	Наши авиачасти, действующие на За- падном и Южном фронтах, продолжают наносить врагу большой урал. 3 ноября в результате успешных налетов нашей авиации на войска противника было уни- чтожено 22 танка, 250 автомашин с пе- хотой и военными грузами, 15 полевых прудий. много зенитных пулеметов, припасов и несколько складов с военны снаряжением.	vol-5016-page-01-seg-043-1699-3078-2374-3425.png
