volume_number	page_number	x1	y1	x2	y2	tokens_count	mean_confidence	text	image
5663	2	1594	1030	2258	1548	79	0.94799	Трудно назвать другой пункт на этом участке фронта, которым немцы так до- рожили бы, как Знаменкой. Пока в руках неприятеля находилась Знаменка с приле гающей к ней магистралью, оп мог без особых затруднений снабжать боеприпаса- мн. техникой и резервами группировки своих войск во многих районах Юга и ма- неврировать резервами вдоль всей линии фронта. С потерей Знаменки положение ме- няется коренным образом. Вся железнодо- рожная сеть к югу от этого узла оказа- лась изолированной, лишенной собствен- ных топливных ресурсов.	vol-5663-page-02-seg-028-1594-1030-2258-1548.png
5663	2	1590	1567	2250	2121	75	0.94222	Характерно, что взятие Знаменки яви- лось результатом методического паступле пня советских войск в самое неблагопри- ятное время гола - в период распутицы бездорожья. Как известно, в этом году :::: летние планы немцев потерпели полный крах. Судя по показаниям пленных и дру- гим документам, неприятель с большим нетерпением дожидался поздней осени. Оп полагал, что осенью нажим наших войск ослабеет и ему можно будет привести свои части в порядок, усовершенствовать ру- бежи обороны, подготовиться к зимним боям.	vol-5663-page-02-seg-029-1590-1567-2250-2121.png
5663	2	1584	2148	2244	2742	82	0.93960	Однако и осень жестоко обманула нем цев. Пошли холодные дожди, разбухли от обилия влаги дороги и поля, но затишья на этом участке фронта не наступило. Наши части, не упуская из рук инициа тиву действий, продолжали наносить вра- гу удар за ударом. Они настойчиво рас- ширяли плацдарм, захваченный западнее юго-западнее Кременчуга, то здесь, то там прорывали оборону немцев, смелыми маневрами создавали угрозу флангам и тылам вражеских группировок. Удары на- носились в неожиданных для противника направлениях, где он был меньше всего подготовлен к бою.	vol-5663-page-02-seg-030-1584-2148-2244-2742.png
5663	2	1578	2762	2237	3083	40	0.93390	Это заставляло германское командова- ние перебрасывать войска с участка на участок, чтобы укреплять свою оборону, которая трещала по всем швам. В дейст- вительности же это приводило к обратным результатам. Вместо укрепления против- ник ослаблял свою оборону. Наступление наших войск продолжалось.	vol-5663-page-02-seg-031-1578-2762-2237-3083.png
5663	2	2336	550	2892	616	5	0.90127	(От специального корреспондента «Красной звезды»).	vol-5663-page-02-seg-032-2336-0550-2892-0616.png
5663	2	2280	700	2943	1138	60	0.95488	После прорыва вражеской обороны в ран- оне Зыбкое -Ворошиловка наступающие вышли на важные коммуникации против- ника, поставив под угрозу окружения его крюковскую группировку. Гитлеровцы ста- ли отступать, бросая технику, обозы, скла- лы. Преследуя по пятам противника, на- ши части освободили от него десятки на- селенных пунктов, в том числе города Крюков п Ново-Георгиевск, очистили пол- ностью железную дорогу Кременчуг Пятихатка.	vol-5663-page-02-seg-033-2280-0700-2943-1138.png
5663	2	2275	1148	2941	1730	85	0.94976	условиях абсолютного бездорожья и распутицы, через взорванные переправы, разрушенные мосты советские воины непоколебимой настойчивостью пробивались вперед. Это требовало огромного напряже- ния сил. 18 километров прошли за один день части N соединения по раскисшему чернозему. Когда останавливались автома- шины и тракторы, бойцы сами впрягались орудия и тащили их на себе. Там, где лошади не могли провезти повозки с бое- припасами, те же бойцы взваливали на себя снаряды, мины, ящики с патронами. Продвижение войск продолжалось, и нем- не могли его остановить, хотя и пред- принимали десятки контратак.	vol-5663-page-02-seg-034-2275-1148-2941-1730.png
5663	2	2267	1749	2931	2349	81	0.93405	Характерной особенностью боев запад- нее и юго-западнее Кременчуга явилось также умелое взаимодействие отдельных, изолированных друг от друга участков фронта. Днепр был в свое время форси- рован в нескольких местах, и каждое сое- динение имело свой плацдарм на правом берегу. В первое время эти плацдармы были крохотны, простреливались насквозь, имели ненадежные коммуникации. По ме- ре углубления прорыва вражеской оборо- ны маленькие плацдармы соединялись в один большой, и этот процесс обведи- не ние плацдармов на правом берегу Днеп- ра продолжается по сей день.	vol-5663-page-02-seg-035-2267-1749-2931-2349.png
5663	2	2258	2368	2926	3043	89	0.94540	В боях за мелкие плапдарны с особой силой проявились огромная выдержка, упорство, исключительная стойкость на- ших воинов. В течение многих дней дер- жались, например, несколько советских батальонов в районе немецких контратак. Они героически отражали частые удары немецкой пехоты и танков, выдерживали сильнейшую бомбежку и артиллерийский обстрел, но не отступали ни на шаг. Нем- цы потеряли здесь десятки танков, сотни солдат и офицеров, но гарнизон нашего плацдарма был непоколебим. А когда по- дошли подкрепления, этот гарнизон, забыв об усталости, поднялся в наступление одним из первых ворвался в город Ново- Георгиевск.	vol-5663-page-02-seg-036-2258-2368-2926-3043.png
5663	2	2299	3051	2916	3085	6	0.84403	С первой недели декабря начались ноч	vol-5663-page-02-seg-037-2299-3051-2916-3085.png
5663	2	2964	500	3628	1039	74	0.94396	ные заморозки, что сразу же сказалось на темпах продвижения наших войск. Вскоре, после мощной артиллерийской авиационной подготовки, были прерв ны прочные оборонительные позиции немцев, прикрывавшие железную дорогу Смела- Знаменка. Развивая достигнутый успех, наступающие нанесли противнику огром- ный урон и перерезали эту железную до- рогу. Южнее наши части, сломив сопро- гивленио пемцев, овладели городом Алек- сандрия и заняли ряд других важных опорных пунктов противника. Этим самым уже была создана угроза обхода и окру- жения Знаменки.	vol-5663-page-02-seg-038-2964-0500-3628-1039.png
5663	2	2958	1051	3620	1705	100	0.94481	Дальнейшие события развивались еще более стремительным темпом. Уже к 9 де какая обстановка сложилась так. что нем- цы оказались в полукольце. Оборона про- тивника была прорвана на обоих флан- гах знаменского гарнизона неприятеля. Несмотря на то, что немцы усилили сопро- тивление и еще чаще стали переходить контратаки, им пришлось под натиском советских войск отступать всё дальше дальше. Наши части в итоге ожесточен- пых схваток с противником выбили его из районных центров Елизаветградка (к северо-западу от Знаменки) и Новая Пра- га (к югу). Они подступили с севера к самому городу, а также перерезали желез- ную дорогу Знаменка- -Николаев, Знамен- ка-Кривой Рог.	vol-5663-page-02-seg-039-2958-1051-3620-1705.png
5663	2	2948	1715	3615	2311	88	0.93189	Начались бои на северной окраине го- рода. Гитлеровцы упорно сопротивлялись. Почти все дома в городе были превраще ны в доты. По нашим боевым порядкам вели сильный огонь немецкие танки, за- рытые в землю. Неприятель имел в Зна- менке много танков и предпринимал оже- сточенные контратаки в разных направ- лениях, одновременно вводя в бой до 80 бронированных машин. Эти контратаки до- рого обошлись немцам, но не смогли из- менить положение в районе города. После- довательно зангиая один за другим насе- ленные пункты, наши части охватывали Знаменку со всех сторон.	vol-5663-page-02-seg-040-2948-1715-3615-2311.png
5663	2	2947	2328	3607	2764	62	0.92847	Наконец, измотав силы противника в предыдущих боях, танкисты генерала Рот- мистрова и пехотинцы генерала Жадова приступили штурму города. Сначала главный удар был нанесен по его восточной части по Знаменке 1-й. Затем насту- пающие овладели лесным массивом, отде- ляющим Знаменку 1-ю от Знаменки 2-й, и всеми силами ударили по западной части города. В результате город бым пол- • ностью очищен от вражеских войск.	vol-5663-page-02-seg-041-2947-2328-3607-2764.png
5663	2	2943	2783	3605	2937	20	0.92384	Победа частей Красной Армии под Зна манкой является важным этапом в борьбе за освобождение юга нашей страны от немецко-фашистских захватчиков.	vol-5663-page-02-seg-042-2943-2783-3605-2937.png
5663	2	2971	2954	3559	3085	7	0.91500	Капитан Е. ГЕХМАН... ДЕЙСТВУЮЩАЯ АРМИЯ. (По телеграфу).	vol-5663-page-02-seg-043-2971-2954-3559-3085.png
5663	2	1842	3163	3332	3224	5	0.96905	Партизанские удары по тылам противника	vol-5663-page-02-seg-044-1842-3163-3332-3224.png
5663	2	1575	3252	2235	3550	42	0.94802	ДЕЙСТВУЮЩАЯ АРМИЯ, 10 декабря. (По телеграфу от наш. корр. ). В боях за железнодорожный узел и город Знаменку большую роль играли украинские парти- заны. Партизанские отряды, действующие в тылу противника, помогали нашим час- тям в наступлении на ряде участков в районе Знаменки.	vol-5663-page-02-seg-045-1575-3252-2235-3550.png
5663	2	1571	3559	2233	4041	73	0.94587	Особенно активно действовали партиза- ны в лесах севернее Знаменки. В этом районе у немцев имелось большое коли- чество опорных пунктов, расположенных главным образом при выходе из лесов. Когда наши части предприняли наступле- ние против этих опорных пунктов, не- приятель упорно сопротивлялся. То на одном, то на другом участке немцы пере- ходили в контратаки. Частям Красной Ар- мии приходилось с боем брать каждую вражескую позицию, каждый отдельный опорный пункт. И вот в самый ответст-	vol-5663-page-02-seg-046-1571-3559-2233-4041.png
5663	2	2254	3254	2914	3362	12	0.95259	венный и напряженный момент борьбы большую помощь оказали нашим войскам партизанские отряды.	vol-5663-page-02-seg-047-2254-3254-2914-3362.png
5663	2	2246	3370	2916	4041	104	0.95535	Находясь в глубине лесов, украинские партизаны сумели установить связь с на- ступающими частями Красной Армии. Были намечены одновременные удары с двух сторон по основным опорным пунк- там немцев. Наступающие войска атакова- ли противника с фронта, а партизанские отряды с тыла, из лесов. Такие сов- местные атаки, как правило, заканчива- лись серьезным успехом. Часто получалось так: немцы сосредоточивали силы для отражения атак с фронта, а в это время им с тыла напосили внезапный удар пар- тизаны. В подобной обстановке противник вынужден был метаться из стороны в сто- рону. Он стремился заполнить образовав- шиеся бреши и тогда оголял или же ос- лаблял другие участки. Этим обстоятель-	vol-5663-page-02-seg-048-2246-3370-2916-4041.png
5663	2	2933	3258	3597	4041	108	0.94739	ством умело пользовались как партизаны, так и части Красной Армии, и противник снова получал чувствительные удары. Так было разгромлено несколько немец- ких опорных пунктов. Преодолев осталь- ные позиции на подступах к лесам, наши части прорвали здесь вражескую оборону. вошли в леса, а затем совместно с парти- занами нанесли ряд сильных ударов по другим опорным пунктам противника. Кроме того, партизанские отряды всё время расстраивали немецкие тылы, раз- рушали дороги, по которым перебрасыва- лись резервы противника. Были случаи, когда партизаны, атаковав большую не- мецкую колонну, причиняли ей серьезный урон, а потом опять уходили в леса. Эти боевые действия украинских партизан также способствовали успеху наших на- ступающих войск в районе Знаменки.	vol-5663-page-02-seg-049-2933-3258-3597-4041.png
5663	2	423	4131	1326	4167	6	0.82996	Из опыта наступательных боев наших войск	vol-5663-page-02-seg-050-0423-4131-1326-4167.png
5663	2	269	4205	1470	4328	2	0.97208	Рейд танков	vol-5663-page-02-seg-051-0269-4205-1470-4328.png
5663	2	199	4358	863	5051	103	0.95787	Танковые войска, обладающие большой ударной силой и маневренностью, способ- ны воздействовать на объекты противника, отстоящие за десятки километров от пе- реднего края его обороны. Нередко даже действия небольшой танковой части, вне- запно вышедшей к основным коммупика- циям противника, значительно ускоряют его разгром. Это объясняется не только мо- ральным эффектом глубокого удара тан- ков. Главное заключается в том, что тан- ки отвлекают на себя много сил против- ника, ослабляя тем самым основную груп- пировку его войск. Особенности организа- ции и проведения такого рейда танков видны на примере действий N танковой бригады, перерезавший в свое время же- лезную дорогу Орел -Карачев в районе станции Хотынец.	vol-5663-page-02-seg-052-0199-4358-0863-5051.png
5663	2	185	5059	853	6083	149	0.95578	Сначала важно выяснить, каким спосо- бом выгоднее действовать рейдирующей танковой части. Здесь возможны два реше- ния. Например, танки могут сперва дви- гаться параллельно коммуникациям, а за- тем, изменив направление, перехватывать их. Подобные рейды, как показывает опыт, нередко заканчивались успехом. Однако они легче всего парируются противником. Ведь уже с того момента, как танки пе- ресекли линию фронта и двинулись парал- лельно важной коммуникации, противнику становится ясен замысел нашего командо- вания. В таких случаях немцы высылают подвижные заслоны из танков и самоход- ных орудий. Двигаясь вдоль коммуника- ции на уровне колонны наших танков, эти бронированные заслоны появляются всюду, где только рейдирующая часть приблизит- ся к коммуникации. Подчас они становят- ся непреодолимым препятствием. Второе решение основано на перпенди- кулярном ударе по коммуникациям врага. Поскольку основные дороги обычно идут к фронту, такой удар возможен только тог- да, когда фронт противника вклинился в наше расположение или же занимает уступное положение по отношению к нему.	vol-5663-page-02-seg-053-0185-5059-0853-6083.png
5663	2	884	4360	1544	4501	21	0.92769	В первом случае рецдирующие танки мо- гут наносить удар с любой стороны кли- на, а во втором лишь стороны уступа. :	vol-5663-page-02-seg-054-0884-4360-1544-4501.png
5663	2	872	4506	1542	5890	220	0.95655	Линия фронта пол Орлом в то время, котором идет речь, имела как раз форму уступа. На востоке наши части вели бон на подступах к городу, а на севере они вышли на параллель Болхова. Немецкая группировка, оборонявшаяся в так называе- мом «Орловском выступе», была связана с тылом железной и шоссейной дорогами, идущими на Орел через Карачев и Нарыш- кино. Лишить противника хотя бы на вре- мя этих питающих артерий значило ускорить темп наступления наших частей на Орел. Решение этой задачи и было по- ручено танковой бригаде, которую возгла- влиял полковник Волынец. План действий в общих чертах был та- ков. N соединение с утра приступает к прорыву обороны немцев. В это время танковая бригада на максимальной скоро- сти минует укрепления противника, с хо- ла форсирует реку Нугрь и стремительно двигается в общем направлении на Орел. Бригада с приданной артиллерией и мото- пехотой илет в колонне, имея справа и слева боковые заставы на удалении двух- трех километров от основного маршрута. Главная задача боковых застав - доно- сить об угрозе с флангов, а в случае столкновения немецкими танками сковать их боем на 20--30 минут. Этого времени было вполне достаточно, чтобы колонна проскочила в тыл противника Боковые заставы состоят из легких тан- ков. Поскольку основная тяжесть боев в тылу противника падала на долю средних и тяжелых машин, расходовать их на вспомогательные цели было нецелесооб- разно,	vol-5663-page-02-seg-055-0872-4506-1542-5890.png
5663	2	871	5897	1536	6078	27	0.94357	Для успеха рейда имел решающее зна- чение удачный выбор времени и района Формирования немецкой обороны. Танки прошли в стык немецких частей, который был нащупан разведкой вблизи одного	vol-5663-page-02-seg-056-0871-5897-1536-6078.png
