volume_number	page_number	x1	y1	x2	y2	tokens_count	mean_confidence	text	image
5744	2	2947	5515	3603	6103	101	0.94341	Подразделение офицера Латышева в два часа ночи вело бой за небольшой насе- ленный пункт. Кончились патроны, за- за- молчали станковые пулеметы. Боеприпасы находились в двух километрах отсюда, за ручьем, разлившимся на порядочную ши- рину. Брода не было, мостиков тоже не было, а патроны были нужны позарез. Тогда двое рядовых, Петров и Лукьянов, пошли перез ручей напрямик. Вода быма им по грудь, и ночь выдалась холодная но бойцы всё же перешли ручей и при- несли назад по ящику патронов. Так они проделали три раза, и это решило исход боя. Когда село было взято и немцы от- катились в степь, Петров и Лукьянов	vol-5744-page-02-seg-075-2947-5515-3603-6103.png
5744	2	3630	4566	4280	4638	6	0.93397	пошли сушить промокшие насквозь обман дирование.	vol-5744-page-02-seg-076-3630-4566-4280-4638.png
5744	2	3626	4640	4284	5611	137	0.95158	Некогда отдыхать, некогда спать. Тру- пы повешенных и расстрелянных в Херсо- не, истерзанные земли Украины, сожжен- ные сёла и сады мщению. II советские воины, делая суво- ровские переходы, все дальше идут вперед. На окраине хутора засело в густой гря- зи тяжелое орудие. Артиллеристы подхва- 1ывали его под колеса, но оно лишь по- качивалось, не трогаясь с места. Мимо шли бронебойщики лейтенанта Петрося- на. Командир только взглянул на своих бойцов, и те, положив оружие, дружно облепила стальную громадину. Запели старинную «Дубинушку», и орудие было вытащено на пригорок. - Ну, спасибо, ребята, сказал за всех артиллеристов наводчик Рябов. Свои люди - сочтемся, смеясь, отвечали бронебойщики. Немпы потрясены. Их пугает это неви- раннее весеннее наступление, опрокидыва- ющее все военные каноны. Дерзкие ма- невры наших воинов выводят немцев из равновесия, заставляют их покидать на населенные пункты, бросать технику и бе- жать	vol-5744-page-02-seg-077-3626-4640-4284-5611.png
5744	2	3622	5617	4280	6100	63	0.94634	И днем, и ночью, ни на минуту не за- тихая, развивается наступление войск 3-го Украинского фронта. Мощными рас- катами выстрелов гремят наши орудия. По липкой грязи движутся советские тан- ки, обтекают врага кавалерия и пехота, угрожая ему стальным охватом. Bpar or- огрызается, как затравленный волк, тщетно пытаясь задержать наступающих. Не уйти от расплаты немецким бандитам! Старший лейтенант В. КУРБАТОВ ДЕЙСТВУЮЩАЯ АРМИЯ. (По телеграфу).	vol-5744-page-02-seg-078-3622-5617-4280-6100.png
5744	3	380	226	1083	265	8	0.91211	16 марта 1944 г., четверг. № 64 (5744).	vol-5744-page-03-seg-001-0380-0226-1083-0265.png
5744	3	1261	225	4343	276	4	0.94020	красная в 3 д	vol-5744-page-03-seg-002-1261-0225-4343-0276.png
5744	3	521	344	1469	523	5	0.85667	Виднейший деятель : нашей партии	vol-5744-page-03-seg-003-0521-0344-1469-0523.png
5744	3	521	552	1477	592	8	0.89792	К 25-летию со дня смерти Я. М. Свердлова	vol-5744-page-03-seg-004-0521-0552-1477-0592.png
5744	3	330	611	986	794	24	0.94406	Двадцать пять лет тому назад оборва- лась замечательная жизнь Якова Михай- ловича Свердлова, одного из организато- ров нашей партии, боевого соратника Ленина и Сталина.	vol-5744-page-03-seg-005-0330-0611-0986-0794.png
5744	3	1000	607	1658	863	35	0.95410	шего органа власти милого созетскэго государства. В эти дни на долю Свердлова выпала особо трудная задача. Надо было сломать старый государственный аппарат, очи- стить советы от меньшевиков и эсеров, надо было огне борьбы с врагами	vol-5744-page-03-seg-006-1000-0607-1658-0863.png
5744	3	321	796	986	3476	298	0.95252	Титаническая организаторская сила большевистской партии, ее непревзойден умение сплачи- вать организовы- вать многомиллион- ные нассы трудя- щихся составляет один из основных источников всех на- ших великих истори- ческих побед, начи- ная Октябрьской социалистической ре- волюции до на- ших дней Отечест- вечной войны про- тив немецко-фашист- ских захватчиков. «Эта черта пролетар- ской революции, Говорил Ленин, и выдвинула в ходе борьбы таких Вож- дей, которые всего больше воплотили эту невиданную раньше в революции особенность - орга- низацию масс. Эта черта пролетарской революции выдвипу- ла такого чело- века, как Я. М. Свердлов, который прежде всего больше всего был организатором». Еще на заре своей юности приемышев к революционному движению, тов. Свердлов вскоре выдвинулся в первые ряды бордов за свержение самодержавия, за свободу счастье трудящихся. Уже в 1902 году он был одним из организаторов Сормовского Комитета РСДРП, пламенным проводин- ком «искровского» ленинского паправле- ния. С октября 1905 года, по поручению Центрального Комитета, Свердлов стано- вится во главе уральских большевиков, показав себя подлинным вожаком масс. В ату эпоху он представлял собой нап- белее отчеканенный тип профессионально- го революционера--человека, который цв- ликом и беззаветно отдался революция. Свердлов не знал иной жизни, как жизнь в борьбе во имя победы дела партии. Его ничто не могло сломить. --- мно- гочисленные аресты, ни заключения крепость, ни ссылки в самые отдаленные п суровые «каторжные» края. В нарте 1910 года Свердлова выслали в Нарым, а уже в июле того же года он совершает оттуда побег и, вернувшись в Петербург, сизова ведет руководящую пар- тийную работу. В 1911 году его опять ссылают, и снова - смелый побег. По полиция сумела арестовать его и вернула на место ссылки. А в конце 1912 года Свердлов вновь совершает побег, на этот раз успешно завершившийся. Пройдя трудный долгий путь неле- вольной борьбы, кропотливой работы в нассах, Свердлов стал одним из видней- ших деятелей нашей партии.	vol-5744-page-03-seg-007-0321-0796-0986-3476.png
5744	3	323	3483	983	4032	76	0.94874	Вскоре после февральской революции, на апрельской конференции большевист- ской партии Свердлов был избран секре- тарем Центрального Комитета. Он предсе- дательствовал на историческом заседании 16 октября 1917 года, когда решался вопрос о вооруженном восстании. Вместе c Лениным и Сталиным ол непримиримо боролся против подлых капитулянтов. Свердлов был в составе боевого руководя- шего органа октябрьского восстания, со- сданного под руководством товарища Сталина. 8 ноября после победы социа- листической революции Я. М. Свердлов был избран председателем ВЦИК - выс-	vol-5744-page-03-seg-008-0323-3483-0983-4032.png
5744	3	998	2046	1652	2558	65	0.95998	строить новый государственный аппарат. Повседневная работа совместно с Лениным и Сталиным, огромный личный партий- ный опыт, выдающийся организаторский талант позволяли Свердлову честью выполнять свой долг, находить правиль- ные решения самых сложных вопросов. В дни Брестского мира он вместе Лениным и Сталиным борется против предателей и изменников троцкистов и «левых» коммунистов. Известно, что эти презренные отщепенцы намечали Свердло- ва одной из первых жертв своего тер- рора.	vol-5744-page-03-seg-009-0998-2046-1652-2558.png
5744	3	998	2568	1650	3497	145	0.95628	Как указал свое время товарищ Сталин, Я. М. Свердлов был одним из первых, кто умело и безболезненно разре шал сложнейшую организационную зада- чу по строительству новой России, стояв- шую перед партией в 1917--1918 гг. Изумительная память и огромные органи- заторские способности сочетались в Сверд- лове с большим знанием людей, с глубо- кой теоретической подготовкой. Беспре- дельная преданность партии, неразрывная связь с массами и забота о людях, о кад- рах, создали ему огромный непререкаемый авторитет. «Если нам удалось в течение более чем года, - говорил Ленин в своей речи памяти Я. М. Свердлова на экстрен- ном заседании ВЦИК 18 марта 1919 года, вынести непомерные тяжести, которые падали на узкий круг беззаветных рево- люционеров, если руководящие группы могли так твердо, так быстро, так иди- подушно решать труднейшие вопросы, то это только потому, что выдающееся ме- сто среди них занимал такой исключи- тельный, талантливый организатор, как Яков Михайлович».	vol-5744-page-03-seg-010-0998-2568-1650-3497.png
5744	3	1000	3506	1652	3976	77	0.95835	Я. М. Свердлова давно уже нет в па- ших рядах. Но вдохновенный облик его живет и будет жить в сердцах всех со- ветских людей, как вечный символ без- заветного, самоотверженного служения советской Отчизне. Свердлов умер моло- дым, и вся его короткая по времени, пск- лючительно яркая жизнь была заполнена большими героическими делами, до по следнего дыхания отдана пароду. II бла- годарный народ никогда не забудет свое- го преданного сына, виднейшего деятеля нашей партии -- Я. М. Свердлова.	vol-5744-page-03-seg-011-1000-3506-1652-3976.png
5744	3	1383	3984	1612	4026	2	0.93534	М. АРКАДЬЕВ.	vol-5744-page-03-seg-012-1383-3984-1612-4026.png
5744	3	1725	334	2306	502	7	0.97419	ВОИНЫ КРАСНОЙ АРМИИ РАЗУЧИВАЮТ ГИМН СОВЕТСКОГО СОЮЗА	vol-5744-page-03-seg-013-1725-0334-2306-0502.png
5744	3	1671	521	2337	1090	87	0.96449	ДЕЙСТВУЮЩАЯ АРМИЯ, 15 марта. (По телеграфу от наш. корр. ). Политотде- лы, партийные и комсомольские организа- ции фронта провели большую работу войсках по разучиванию текста и музыки нового государственного гимна Советско- го Союза. В соединении, где начальником политотдела полковник Кистанов, гимн ис- полнялся ежедневно при построении на поверку. Сейчас все бойцы и офицеры твердо усвоили текст и музыку гимна. частях N соединения, где начальником по- литотдела тов. Сугробов, проведено 317 групповых спевок. Большую помощь в разучивание гимна оказали частям фронтовые армейские ДКА, а также ансамбли красноармейской самодеятельности.	vol-5744-page-03-seg-014-1671-0521-2337-1090.png
5744	3	1673	1144	2329	1363	32	0.94939	ДЕЙСТВУЮЩАЯ АРМИЯ. (От наш. корр. ). Вчера в части, где командиром капитан Коваленко, состоялось собрание бойцов офицеров, посвященное новому гимну. Советского Союза. Собрание заслу- шало доклад о значении гимна в жизни страны.	vol-5744-page-03-seg-015-1673-1144-2329-1363.png
5744	3	1673	1369	2329	1594	38	0.96348	В этой части уже весь личный состав разучил новый гимн. Большую работу про- вели партийные и комсомольские организа ции, агитаторы. По вечерам в ленинских комнатах проводились спевки в сопровож- дении оркестра. Новому гимну посвящались специальные номер стенных газет.	vol-5744-page-03-seg-016-1673-1369-2329-1594.png
5744	3	1671	1660	2329	2298	101	0.95772	ДЕЙСТВУЮЩАЯ АРМИЯ. (От наш. корр. ). Как только были опубликованы текст и музыка нового гимна Советского Союза, офицеры и вольнонаемный состав Н-ского соединения с увлечением стали его разучивать. В этом личному составу большую помощь оказывали работники клуба, где начальником т. Каневский. Си- стематически устраивались спевки, кото- рыми руководил заслуженный деятель искусств УзССР хормейстер А. Лебединец. Деятельное участие принимал также духо- вой оркестр, возглавляемый майором адми- нистративной службы Беззабава. Вскоре спевки показали, что офицеры хорошо разучили гимн. В день 26-й годов- щины Красной Армии новый гимн Совет- ского Союза был с большим успехом ис- полнен обединенным хором, насчитывав- шим свыше 1000 человек.	vol-5744-page-03-seg-017-1671-1660-2329-2298.png
5744	3	1733	2373	2291	2462	4	0.94951	БОЛЬШОЙ УСПЕХ ФИЛЬМА «КУТУЗОВ»	vol-5744-page-03-seg-018-1733-2373-2291-2462.png
5744	3	1669	2491	2329	3478	146	0.97041	B 13 кинотеатрах столицы с большим успехом демонстрируется новый художе- ственно-исторический фильм «Кутузов». За 3 дня картину просмотрели около 200.000 человек. многочисленных отзывах зрителей от- мечаются исключительные достоинства но- вого произведения советской кинематогра- фии. Офицер Н-ской части 1-го Украин- ского фронта лейтенант Акимьян пишет: «Кутузов» - это один из лучших исто- рических фильмов. Теперь, когда Красная Армия беспощадно гонит немецких окку- пантов с нашей земли, фильм «Кутузов» красноречиво напоминает о той участи, ко- торая постигнет всякого, кто мечтает за- воевать нашу свободную и независимую страну». Кандидат исторических наук майор C. Кляцкин записал: «Фильм представляет собой замечательный памятник героическо- му прошлому великого русского народа. Он станет в ряду лучших произведений советского киноискусства». На копировальных фабриках Комитета по делам кинематографии изготовляются копии фильма для отправки их в дейст- вующую армию, крупные промышленные центры страны и столицы союзных респуб- лик. Первые 500 копий выпускает Москов- ская копировальная фабрика. (TACC).	vol-5744-page-03-seg-019-1669-2491-2329-3478.png
5744	3	1677	3545	2321	3622	8	0.90878	ОТКРЫТИЕ МУЗЕЯ И. С. ТУРГЕНЕВА на родине писателя	vol-5744-page-03-seg-020-1677-3545-2321-3622.png
5744	3	1673	3641	2327	4030	66	0.95600	ОРЕЛ, 15 марта. (ТАСС). Государствен- ный музей И. С. Тургенева, в свое время эвакуированный в город Пензу, возвращен на родину писателя и открыт для посещения- ния. Следы варварского погрома, учинен- ного фашистскими бандитами в здании му- зея, ликвидированы. В литературном отделе экспонируются многочисленные произведе- ния Тургенева, иллюстрации к ним, авто- графы писателя, портреты. Показана под- линная обстановка, в которой жил и тво- рил И. С. Тургенев.	vol-5744-page-03-seg-021-1673-3641-2327-4030.png
5744	3	575	4120	2066	4226	3	0.95942	Зверства румынских разбойников	vol-5744-page-03-seg-022-0575-4120-2066-4226.png
5744	3	317	4243	983	4947	104	0.95420	Румыния не случайный сообщник Гитлера в советско-германской войне. Еще задолго до начала войны Румыния с го- ловой окунулась в омут гиглеровской по- литики, сделавшись покорным сателлитом Германии. Этой низкой роли для Румынии упорно и навязчиво добивались ее правя- щие круги во главе с Антонеску. 22 июня 1941 года Антонеску, выпол- няя волю Гитлера, бросил свои войска на советские границы. Но уже первые неде- войны показали незадачливым «завое- вателям», сколь сумасбродны их бредовые планы. Много черных дней пережила ру- мынская армия после 22 июня. Не раз Красная Армия громила румынские диви- зии. Только зимой 1942-43 г. румы- ны потеряли половину всех своих воору- женных сил.	vol-5744-page-03-seg-023-0317-4243-0983-4947.png
5744	3	317	4959	977	5465	70	0.95759	Румынские волки плохо справлялись мечом воина. Зато опи в совершенстве овладели жандармской ногайкой и ножом грабителя с большой дороги. Этим качест- Бом румынская армия неизменно отлича- лась на всем протяжении войны. Ee путь по нашей земле отмечен повальны- ме грабежамп, разрушениями, убийствами. насилиями и невероятными зверствами над мирными жителями временно захва- ченных советских территорий. В этих де- лах румынские солдаты и офицеры пока- зали себя достойными партнерами немен- ких людоедов,	vol-5744-page-03-seg-024-0317-4959-0977-5465.png
5744	3	315	5469	979	6027	91	0.94454	Сразу же после вступления в Бессара- бию румынские захватчики начали массо- вую расправу над служащими советских учреждений. Стараясь выжать из населе- пия все соки, оккупанты начали душить крестьян налогами. Хлеб они отбирали и увозили в Румынию и Германию. В Одес- се румыны хватали жителей без разбору и оросала их в тюрьмы и лагери. Ни в чем не повинных людей вывозили за город.1 там расстреливали целыми партиями. Румынский солдат Бану Пон, захвачен- ный в плен частями Красной Армии, рас- сказал: «С октября 1941 г. по февраль 1942 г. служил в румынской полиции	vol-5744-page-03-seg-025-0315-5469-0979-6027.png
