volume_number	page_number	x1	y1	x2	y2	tokens_count	mean_confidence	text	image
5663	3	3645	2309	4309	2818	79	0.95739	Значительно медленнее перестраиваются В этом отношении начальники политотде- лов дивизий. Самп они и даже их заме стители всё еще редкие гости на лекци- ях и докладах своих пропагандистов. Мно- гие из них и по сей день ограничиваются лишь распределением очередных тем меж ду пропагандистами, очень слабо вникают в содержание лекций и докладов, не сле- дят за культурой речи лекторов и доклад- чиков, не обращают внимания последних на неправильное построение фраз, на за- соренность их речи малопонятными иност- ранными словами.	vol-5663-page-03-seg-031-3645-2309-4309-2818.png
5663	3	3639	2829	4301	3229	67	0.94978	В заключение хочется сказать несколь- ко слов о «Блокноте агитатора Красной Армии" и журнало "Пропагандист и аги- татор Красной Армии". Издания эти поль- зуются у нас большой популярностью и немало помогают нам в практической ра- боте. Однако хотелось бы чаще видеть на их страницах рецензии на лекции и док- лады с обстоятельным разбором их содер- жания и методики. В таком чисто учеб- ном материале мы очень нуждаемся.	vol-5663-page-03-seg-032-3639-2829-4301-3229.png
5663	3	3721	3241	4264	3368	11	0.94070	Подполковник П. ТКАЧЕНКО. Начальник отделения пропаганды и агитации политотдела N армии	vol-5663-page-03-seg-033-3721-3241-4264-3368.png
5663	3	3021	3457	4224	3590	10	0.97496	ОРГАНИЗАЦИЯ ПИТАНИЯ ВОЕННОСЛУЖАЩИХ, СЛЕДУЮЩИХ по железным дорогам и водным путям	vol-5663-page-03-seg-034-3021-3457-4224-3590.png
5663	3	2952	3609	3609	3825	27	0.94576	Начальник тыла Красной Армии гене- рал армии А. Хрулев издал приказ об улучшении организации питания военно служащих, следующих по железным, во- енно-автомобильным, грунтовым дорогам и водным путям.	vol-5663-page-03-seg-035-2952-3609-3609-3825.png
5663	3	2952	3842	3611	4245	56	0.95169	Согласно этому приказу и приложенной нему инструкции с 1 февраля 1944 го- да вводится единая талонная система на получение военнослужащими питания пути. Командиры и начальники Войско вых частей и учреждений обязаны обес- печивать талонами военнослужащих, убы- вающих в командировки по выполнению заданий командования, направляющихся в лечебные заведения, следующих к месту назначения, в отпуск и т. д.	vol-5663-page-03-seg-036-2952-3842-3611-4245.png
5663	3	2952	4254	3607	4434	22	0.94798	По предъявлению талонов байды и офи- церы будут получать питание на военно- продовольственных пунктах, продовольст- венно-питательных пунктах и в железно- дорожных буфетах.	vol-5663-page-03-seg-037-2952-4254-3607-4434.png
5663	3	2950	4453	3605	4706	29	0.94504	Для обслуживания военнослужащих следующих пассажирскими поездами, на- чальники военно-продовольственный пунк тов организуют специальные отделения при вокзалах. Эти отделения обязаны обеспечить питанием бойцов и офицеров, проезжающих данную станцию или ожи-	vol-5663-page-03-seg-038-2950-4453-3605-4706.png
5663	3	3637	3611	4296	4009	54	0.95298	дающих поезда для дальнейшего следова- ния. Начальники отделений обязаны орга- низовать для военнослужащих питание полностью по установленным нормам, хо- рошего качества и без задержек. Для об- служивания раненых и больных, которые не в состоянии передвигаться без посто- ронней помощи, выделяются специальные подавальщицы, которые должны разно- сить пищу непосредственно в вагоны во время стоянки поездов.	vol-5663-page-03-seg-039-3637-3611-4296-4009.png
5663	3	3632	4013	4292	4561	75	0.95217	Обед на военно-продовольственных, про- довольственно-питательных пунктах дол- жен приготовляться из двух блюд. К обе ду выдается половина суточной дачи хле- ба и сахара. Военные коменданты стан- ций должны отвести во всех военно-про- довольственных пунктах, их отделениях и железнодорожных буфетах столы, а при возможности и специальные помещения отдельно для раненых, для офицерского состава, для генералов Красной Армии и Героев Советского Союза. Там, где невоз- можно обеспечить военнослужащих горя- чей пищей, отпускается полностью по нормам сухой паек.	vol-5663-page-03-seg-040-3632-4013-4292-4561.png
5663	3	3630	4567	4286	4708	16	0.95071	Отпуск обедов или сухого пайка на во- енно-продовольственных и продовольствен- по-питательных пунктах производится всем военнослужащим бесплатно.	vol-5663-page-03-seg-041-3630-4567-4286-4708.png
5663	3	3127	4801	4104	4844	5	0.95403	ЧЕТВЕРТЬ ВЕКА НА ЗАЩИТЕ РОДИНЫ	vol-5663-page-03-seg-042-3127-4801-4104-4844.png
5663	3	2945	4865	3605	5191	57	0.96283	ЛЕНИНГРАДСКИЙ ФРОНТ, 10 декаб- ря. (По телеграфу от наш. корр. ). Испол- нилось 25 лет со дня организации N гвар- дейского краснознаменного стрелкового полка. За четверть века полк прошел слав- ный путь. Созданный в грозные дни 1918 года из рабочих Путиловского завода и солдат второго батальона Карпатского пол- ка, полк громил немцев в 1918 году под Псковом	vol-5663-page-03-seg-043-2945-4865-3605-5191.png
5663	3	2943	5199	3601	5322	17	0.95569	За доблесть и мужество полк был на- гражден знаменем Московско-Нарвского совета города Петрограда, почетным зна- менем ВЦИК	vol-5663-page-03-seg-044-2943-5199-3601-5322.png
5663	3	2941	5328	3597	5516	31	0.97164	Полк отличился и в боях с белофинна- ми при прорыве линии Маннергейма. Сот- ни бойцов и командиров были награжде- ны орденами и медалями. Три отважных воина получили звание Героя Советского Союза.	vol-5663-page-03-seg-045-2941-5328-3597-5516.png
5663	3	2939	5524	3596	5647	23	0.96294	Отечественную войну личный состав полка встретил на защите дальних подсту- пов к Ленинграду. Верные своим традици- ям, бойцы части стойко сражались с вра-	vol-5663-page-03-seg-046-2939-5524-3596-5647.png
5663	3	3624	4876	4288	5269	65	0.97012	гом, рвавшимся к великому городу. С боль- шим искусством и умением сражались во- ины-ленинградцы в дни наступательных боев. Участвуя в прорыве блокады города Ленина, полк показал образцы героизма и воинского умения. Он стал гвардейским, удостоился высокой правительственной на- грады - ордена Красного Знамени. Далеко за пределами фронта прогремела слава о- воспитаннике полка Герое Советского Со- юза Дмитрии Молодиове, закрывшем сво- им телом вражескую огневую точку.	vol-5663-page-03-seg-047-3624-4876-4288-5269.png
5663	3	3620	5275	4283	5412	18	0.96976	С неменьшим мастерством гвардейцы ве- ли бои в болотах Синявина. Наступая, они отразили 26 яростных контратак против- ника.	vol-5663-page-03-seg-048-3620-5275-4283-5412.png
5663	3	3618	5425	4283	5651	35	0.97330	На юбилейный праздник в полк прибыла делегация Кировского завода. С большим подъемом прошел митинг. Перед лицом де- легации трудящихся Ленинграда гвардей- цы дали клятву с еще большим муже- ством, умением, мастерством громить не- мецких захватчиков,	vol-5663-page-03-seg-049-3618-5425-4283-5651.png
5663	3	3252	5736	3983	5776	3	0.95479	помощь семьям фронтовиков	vol-5663-page-03-seg-050-3252-5736-3983-5776.png
5663	3	2933	5799	3594	6062	41	0.97068	НИКОЛАЕВСК-на-АМУРЕ, 10 декабря (TACC). B Нижне-Амурской области ус- пешно проходит декадник помощи семьям военнослужащих. Во всех районах, на ры- бозаводах, в сельских советах созданы ко- миссии по проведению декадника, которые выявляют нужды семей фронтовиков. Уже заготовлены и перевезены на квартиры сот-	vol-5663-page-03-seg-051-2933-5799-3594-6062.png
5663	3	3611	5806	4277	6064	36	0.97726	ни кубометров дров, отремонтированы де- сетки жалишь. нуждающимся семьям ока- зана материальная и денежная помощь. Большую помощь семьям фронтовиков оказывает Нижне-Амурский госрыбтрест. Каждая семья фронтовика получила 10--15 килограммов рыбы. Организована пошивка. торбазов из шкур морского зверя.	vol-5663-page-03-seg-052-3611-5806-4277-6064.png
5663	4	309	212	4358	273	14	0.93765	красная 3 в 3 д а 11 декабря 1943 г., суббота. № 292 (5663).	vol-5663-page-04-seg-001-0309-0212-4358-0273.png
5663	4	495	322	1451	383	3	0.93215	события в югославии	vol-5663-page-04-seg-002-0495-0322-1451-0383.png
5663	4	292	404	958	1444	153	0.96859	ЛОНДОН, 8 декабря. (ТАСС). Как со- общило агентство Рейтер, в Лондоне стало известно, что на-днях на освобожденной территории Югославии состоялось собра- ние представителей всех районов страны, на котором было решено образовать На- циональный Комитет Освобождения, обле- ченный всеми правами и функциями вре- менного правительства Югославии, а так- же создать временный парламент. Собра- ние представителей приняло также в прин- цели федеральную конституцию Югосла- зии. Председателем парламента и главою освобожденных территорий был избран доктор Иван Рибар, который после прош- лой мировой войны был первым председа- телем югославского национального собра- ния в Белграде. Избраны также 3 заме- стителя председателя: Моша Пияде сербский журналист и писатель, хорват- ский скулытор Августинчич и словен Иосиф Рус. Собрание представителей присвоило ранг маршала главнокомандующему югославской народно-освободительной армии Иосифу Броз-Тито. Маршал Иосиф Броз-Тито на- значен главою Комитета национальной обо- роны. Его заместителями назначены быв- ший директор белградской газеты «Поли- тика» Владо Рибникар и хорватский жур- налист, член хорватской крестьянской партии Божидар Маговац.	vol-5663-page-04-seg-003-0292-0404-0958-1444.png
5663	4	288	1451	952	2066	92	0.97151	Собранием представителей избран Коми- нет Национального Освобождения в сле- дующем составе: руководитель департа- мента иностранных дел Иосиф Смодлака- хорватский дипломат, который в течение ряда лет был югославским посланником в Ватикане; внутренних дел -- серб Владо Зечевич; реконструкции -- Раде Прибиче- вич - депутат (серб); департамента горной промышленности и лесоводства Сулей- ман Пилипович, бывший недичевский офи- цер, несколько месяцев назад перешедший на сторону партизан. События в Югославии вызвали широкие отклики английской печати. Дипломатиче- ский обозреватель газеты «Ньюс кроникл» пишет, что решение партизан поставит в очень трудное положение югославское пра- вительство, состоящее почти исключитель-	vol-5663-page-04-seg-004-0288-1451-0952-2066.png
5663	4	977	413	1643	1151	130	0.97533	но из лиц, назначенных королем Петром перед отъездом правительства из Лондона Канр. Партизаны в своем решении не указывают на свою позицию по отношению K королю. «Это, - заявляет обозрева- тель, -- поставит английское правительство в столь же трудное положение. До сих пср Англия признавала правительство Петра как законное правительство Югосла- вии. В последние месяцы Англия стре- мится оказывать помощь как партизанам Тито, так и четникам Михайловича, одина- ково снабжая их оружием и снаряжением... Однако ясно, что, в то время как парти- занское движение быстро добилось успе- хов в партизанской войне против немцев и поддержки населения, силы Михайловича почти абсолютно бездействуют, и значи- тельное число его бывших сторонников оставило его. По последним данным, бое- вые силы партизан составляют свыше 200 тыс. , тогда как Михайлович располагает менее чем 15 тыс. человек».	vol-5663-page-04-seg-005-0977-0413-1643-1151.png
5663	4	973	1161	1635	1774	92	0.96976	Каирский корреспондент той же газеты отмечает, что решение партизан Югославии взять на себя полную ответственность за законодательное управление страной было неодобрительно встречено королем Петром и его правительством в Каире, назвавшим группу Тито «движением террористическо- го насилия». Касаясь политической про- граммы партизан, корреспондент пишет: «Стремление создать Федеративную Юго- славию на основе равноправия сербов, хорватов и словен находится в резком про- тиворечии с узкой политикой сербского господства, воплощаемой Михайловичем. Не следует также недооценивать отрица- тельного отношения партизан к Михайло- вичу, который, как они утверждают, был в союзе с итальянцами, а сейчас с нем- цами».	vol-5663-page-04-seg-006-0973-1161-1635-1774.png
5663	4	971	1783	1630	2068	38	0.95303	Дипломатические обозреватель газеты «Дейли телеграф энд Морнинг пост» пи- . шет: «Создание временного правительства в Югославия не отражается на признании Англией югославского правительства Пу рача в Каире, однако помощь будет по- прежнему оказываться всем организациям сопротивления з Югославииэ.	vol-5663-page-04-seg-007-0971-1783-1630-2068.png
5663	4	444	2159	1485	2258	13	0.96715	Заявление Joy в палате общин об отношении английского правительства к событиям в Югославии	vol-5663-page-04-seg-008-0444-2159-1485-2258.png
5663	4	288	2275	950	2761	80	0.96184	ЛОНДОН, 10 декабря. (ТАСС). Агент- ство Рейтер передает, что 8 декабря в палате общин была определена позиция английского правительства по отношению к событиям в Югославии. Заместитель ми- нистра иностранных дел Ричард Лоу, отвечая на вопрос лейбориста Бена Райли заявил, что он не может пока еще сказать, каковы будут отношения партизанских сил, находящихся под командованием Тито, и сил генерала Михайловича к королю Петру и его правительству, признанному английским правительством в качестве за- конного югославского правительства и на- ходящемуся сейчас в Каире.	vol-5663-page-04-seg-009-0288-2275-0950-2761.png
5663	4	286	2768	946	2962	33	0.95695	На вопрос консерватора капитана Гам- ман, продолжает ли Англия оказывать под держку Михайловичу, Лоу заявил: «Наша политика заключается в том, чтобы под- держивать все силы в Югославии, со- противляющиеся немцам. При данном поло-	vol-5663-page-04-seg-010-0286-2768-0946-2962.png
5663	4	971	2279	1630	2434	24	0.95449	жении мы поддерживаем партизан, оказы- вая им большую помощь, чем генералу Михайловичу, по той простой причине, что партизаны оказывают немцам значительно большее сопротивление». -	vol-5663-page-04-seg-011-0971-2279-1630-2434.png
5663	4	971	2446	1630	2960	80	0.97116	На предположение, что это является пер- вой возможностью осуществить на практи- ке провозглашенные Англией принципы признания правительств в освобожденных странах в том случае, если эти правитель- ства должным образом избраны освобож- данным народом, Лоу заявил, что по его мнению, ошибочно считать, будто такая воз- можность представляется сейчас. "Такая возможность разумеется появится, когда территория будет освобождена, и мы пол- ностью воспользуемся ею. Наша политика всегда заключалась в том, чтобы предо ставить народам освобожденных террито- рий возможность избрать собственную фор- му правления».	vol-5663-page-04-seg-012-0971-2446-1630-2960.png
5663	4	461	3049	1470	3140	6	0.98312	ЗАЯВЛЕНИЕ ХЭЛЛА О ПОМОЩИ ЮГОСЛАВСКИМ ПАРТИЗАНАМ	vol-5663-page-04-seg-013-0461-3049-1470-3140.png
5663	4	284	3163	946	3417	39	0.95977	ЛОНДОН, 10 декабря. (ТАСС). Как со общает вашингтонский корреспондент агентства Рейтер, государственный секре- тарь Хилл заявил 9 декабря, что США будут оказывать помощь на основе закона о передаче взаймы или в аренду вооруже- ния как партизанам, так и четникам	vol-5663-page-04-seg-014-0284-3163-0946-3417.png
5663	4	971	3159	1628	3413	46	0.95661	(прим. редакции: т. е. войскам ген. Ми- хайловича) в Югославии, поскольку амери- канская политика заключается в оказании такой помощи каждой или любой группе в Югославии, которая эффективно берет ся с немцами. Далее Хэлл заявил, что Англия заняла подобную же линию и США полностью с ней согласны.	vol-5663-page-04-seg-015-0971-3159-1628-3413.png
5663	4	497	3504	1430	3586	9	0.96339	ПРИНУДИТЕЛЬНАЯ РАБОТА В КУЛАЦКИХ ИМЕНИЯХ под предлогом «Военных нужд»	vol-5663-page-04-seg-016-0497-3504-1430-3586.png
5663	4	282	3601	946	3962	55	0.97385	СТОКГОЛЬМ, 10 декабря. (ТАСС). Фин- ские власти направили на принудительную работу в кулацких хозяйствах значитель- ное число женщин, мобилизованных под предлогом «военных нужд» для отбывания трудовой повинности, Эти мобилизованные попадают в такие ужасные условия, что даже некоторые финские газеты были вы- нуждены опубликовать жалобы «мобилизо- ванных». Так, газета «Суомен сосиалидемо- краатти» недавно напечатала письмо одной	vol-5663-page-04-seg-017-0282-3601-0946-3962.png
