volume_number	page_number	x1	y1	x2	y2	tokens_count	mean_confidence	text	image
5310	2	3654	3979	4372	5822	213	0.92627	ось батальону ь атаку X0, 1 произв Го топ. дется. учет автома! здесь только убитый свыше 100 Обо Оборотять занятый рубеж было в автах но стрелковой роте, которой с младший лейтенант Страхов. снабжения сразу после боя не проявлял antes катя Страхов отнесся к делу спустя чельна, не организовал систему огня, не в охранение и наблюдение. денног нытва граждения были забыты. Част имел только телефонную связь, ное от щие средства по были подготовлен иначе тимеристы заградительного огня at * ливо, мали. Словом, расчет был на то, что наобор дураки и будут спать. Но враг команд Он воспользовался всеми этим розами ниями. Ночью его артиллерия 1 расход ты произвели десятиминутный огне риалов, лет и нарушили связь. Около 200 стов подползли к нашему переднего, горюче и внезапно налетели на траншею. чальни дрались мужественно, но враг Чувств дра ленное превосходство в шей о состояние охладел траншеей. Командование отдало батальобу режны снова захватить траншею. Как жего п наступление велось двумя группами. Немцы стали подбрасывать траншею подкрепление. Минометы залами накрыли вражеский краб тем штурмовые группы, пот при от разрыва снарядов ворчит траншею. Учтя урок первого боя, командиры же расставаний огневые средства, противника оружие, по-настоящему организоват ну. Немцы кинулись в контрольную. ли отброшены с большими потеря! этот раз своевременно закрепленны! был для врага недоступен, Майор В. Достать! СЕВЕРО ЗАПАДНЫЙ ФРОНТ.	vol-5310-page-02-seg-048-3654-3979-4372-5822.png
5310	2	3193	5867	4087	5950	3	0.95877	Вражеская атака сорвалась	vol-5310-page-02-seg-049-3193-5867-4087-5950.png
5310	2	2911	5946	3625	6331	50	0.93124	БРЯНСКИЙ ФРОНТ, 17 октября (По телеграфу от наш. корр. ). За последние дни в ряде участков фронта происходили (10.iкновения с противником. Так, напри- мер, в одном районе группа немцев чис- ленностью 10 200 человек пыталась под прикрытием дымовой завесы проникнугь в расположение нашей обороны. Атака нем- цев сальным уннометным артиллерийским	vol-5310-page-02-seg-050-2911-5946-3625-6331.png
5310	2	3648	5969	4229	6348	33	0.91056	Наши артиллеристы под обстрел вражеских огневые Они подавили 75-ум. попку нем минометные батареи и два пулемета. новые подразделения N части дружным огнем вражескую 10 извода гитлеровцев. Атака ника сорвалась. и он вынужден был	vol-5310-page-02-seg-051-3648-5969-4229-6348.png
5310	3	456	574	1313	611	7	0.91647	13 октября 1942 г. воск- 246 (5310)...	vol-5310-page-03-seg-001-0456-0574-1313-0611.png
5310	3	2182	564	2772	602	11	0.92909	Р А С Н А Я В Е З Д А	vol-5310-page-03-seg-002-2182-0564-2772-0602.png
5310	3	763	691	1479	781	1	0.84509	КАЗА	vol-5310-page-03-seg-005-0763-0691-1479-0781.png
5310	3	430	807	1098	1130	61	0.95325	Один фриц мне сказал: «Против нас бы- страшные солдаты - их не мог остано- вить никакой огонь, они бежали прямо на нас. Потом мне сказали, что это - казахи. Я не знал прежде, что существует такой народ...» Фряцы многого не знали. Им гово- рили, что Россия - большая страна, но им не говорили, что в этой большой стране живут большие люди.	vol-5310-page-03-seg-006-0430-0807-1098-1130.png
5310	3	432	1132	1098	1841	120	0.95807	В степях востока, привыкшие к нестор- пимому знаю и к суровому холоду, издавна жили отважные люди. Певцы-акыны пели старины о героях Казахстана, о славных батырах. Нет ничего для батыра дороже че- сти. Против семи тысяч врагов пошел батыр Ер-Таргын, пошел с шестиаршинным чечом восклицая: "Только честь мне дорога". Разве не реял образ Таргына над двадцатью восемью героями, защищавшими Москву? Один из панфиловцев, девятнадцатилет- ний Султан Ходжиков, пишет своей люби- мой в Алма-Ата: "Нет, не отдам тебя, моя любовь, Эсфар, на поругание немцу! Умру, но не отойду. отправил на тот свет деся- ток бесчестных с ними их полковника. Это мое признание тебе в любви, Эфир. Твой Султан". Одиннадцать фрицев, а среди НИХ ПОЛКОЕНИЕ --- какая девушка не обра- дуется такому признанию?	vol-5310-page-03-seg-007-0432-1132-1098-1841.png
5310	3	428	1843	1096	2421	90	0.95928	Двадцать пять лет тому назад Амангель- ты, батыр большевик, сражался за счасть казахского народа. Амангельды говорил: "Зайцу стыдно встретиться с трусливым человеком". Когда Амангельды повели на расстрел, он плюнул в лицо палача, а по- том обнял своего друга, русского матроса. Ожил после Октябрьской революции Ка- захстан, расцвели его сады, всколосились доля. Есть казахам что защищать. Гвардеец Урамалиев девять лет был председателем цветущего колхоза "Таш башат". Недавно он встал в ряды бойцов. За три недели он застрелит двадцать четыре немца. Он гово- рит: «Это им только задаток, а платеж впе- реди».	vol-5310-page-03-seg-008-0428-1843-1096-2421.png
5310	3	426	2431	1094	2936	82	0.95967	Казах Амирбек Ильясов, тяжело ране- ный, нашел в себе силы, чтобы поджечь немецкий танк бутылкой с горючим. Ма- ленький казах с большим сердцем. Да, фри- цы теперь узнали, что такое казахи. Двад- цать девять немцев убил казах Увалиев. Двадцать девять раз кричали "ура" бойцы. Два казаха, пулеметчики Истаев и Бала. панов, отрезали немецкую пехоту от танков. Они подпустили немцев на полтораста, мет- ров, а потом начали работать. Трушы фрп- цев покрыли дорогу, Балапанов сказал Истаеву: «Правду говорят, что труп врага хорошо пахнет".	vol-5310-page-03-seg-009-0426-2431-1094-2936.png
5310	3	1122	807	1786	1267	70	0.95420	Боец Торунсабаев на берегах омраченно гоД она защищает родной Казахстан. тяжелый день: наши пошли в атаку, чтобы занять новый рубеж. но немецкая пуля сразила конандара. Настала минута заме- шательства. Тогда Тсруксабаев выбежал вперед и крикнул: "За родину". Потом он повторит эти слова по-казахски: "Отая ушин". Он повел извод на немцев. Враг дрогнул. А Торунсабаев, когда кончился бой, просто сказал: «Мое дело маленькое- бить немца. А мы все вместе большая сила».	vol-5310-page-03-seg-010-1122-0807-1786-1267.png
5310	3	1122	1269	1786	2083	142	0.95624	Казах Ирисоз павел бойцов. Они блоки- ровали четыре вражеских дзота. Ирисов, раненый, вынес с поля боя сраженного пу- лей командира. «Иди в санчасть, -сказаля Ирисову. Он ответил: «Нет. Илу воевать». Когда Ошим Коскабаев уезжал на фронт, его провожал весь кишлак. Отец Ошима, бо- родатый казах, говорил: "Помни, Ошим, ка- кая у нас земля. Добрая земля, всего мно- го - пшеница, хлопок, арбузы. Это, Ошим, твоя земля. Смотри, не отдай ее немпу». Ошим стал пулеметчиком. Был трудный день: немцы пошли в контратаку. Мин больше нет. Ошим крикнул: «Бей немца» побежал навстречу врагам с винтовкой в руке. За ним ринулись товарищи. Штыком пырнул Ошим немецкого офицера. Четыре раза в тот день ходил Ошим врукопашную. Он переколол много немцев. Ошима ранило, товарищи говорили: "Коскабаев, надо итоги в госпиталь». Ошим отвечал: «Не надо в госпиталь. Надо бить немца». И он остался в строю. Так воюют джигиты.	vol-5310-page-03-seg-011-1122-1269-1786-2083.png
5310	3	1120	2093	1784	2370	50	0.96703	Защитник Ленинграда казах Даган Коквалин шел в атаку. Осколком снаряда разбило винтовку. Эдган не смутился: он пошел на врага с гранатами. Казахи при- выкли носиться на коне по степи. Но если нужно, они ползут, они бегут, они карай- каются на горы, они вязнут в болотах: ни- что их не остановит.	vol-5310-page-03-seg-012-1120-2093-1784-2370.png
5310	3	1118	2384	1784	2882	88	0.95616	Верность проверяют огнем. Сгорает на огне солома и закаляется на огне сталь. Жалко "новая Европа" Гитлера, каторга, один раб ненавидит другого, где венгр душит румына и где пруссак измывается над швабом. Мы раздуем огонь. От их вер- ности не останется даже слова. Когда им придется отвечать за содеянное, немец от- ступится от немца, немец зарежет немца. Трижды сильной стала на огне войны на- ша родина, Советский Союз, Россия. Каза- хи сражаются рядом с руссками. Мы вме- сте горюсм, вместе деремся, вместе мы бу- дем радоваться первому утру победы.	vol-5310-page-03-seg-013-1118-2384-1784-2882.png
5310	3	1411	2892	1738	2926	2	0.94165	Илья ЭРЕНБУРГ	vol-5310-page-03-seg-014-1411-2892-1738-2926.png
5310	3	600	2990	1626	3051	4	0.95447	Партийная комиссия в роте	vol-5310-page-03-seg-015-0600-2990-1626-3051.png
5310	3	428	3065	1094	3663	96	0.95644	КАРЕЛЬСКИЙ ФРОНТ, 17 октября. (По телеграфу от наш. корр. ). Несколько дней назад здесь был жаркий бой. Рота лейтенанта Малахова внезапно атаковала высоту, занятую финнами. И как враг ни - упорствовал, высота была занята на- шими бойцами. Финны предприняли де- вять яростных контратак, но наши бойцы не отступили ни на шаг. Сегодня на этой высоте сравнительно спокойно. Изредка стреляет артиллерия, бьют минометы, «охотятся» снайперы. Сюда в роту, отличившуюся в боях за вы- соту, прибыла дивизионная партийная ко- миссия. Двадцать два бойца и младших командира роты перед тем как идти в бей подали заявления о своем желании	vol-5310-page-03-seg-016-0428-3065-1094-3663.png
5310	3	1114	3069	1780	3657	85	0.96334	стать коммунистами. Сегодня парткомис- сия принимает в ряды большевистской партии отличившихся в боях. Лейтенант Якимов заметно волнуется... Отвечает на вопросы коротко, взвешива я слово. Якимов - умелый и отваж- ный командир. В боях за высоту мино- метный B3B01 IIOI его командованием уничтожил четыре пулеметных гнезда про- тивника. Парткомиссия единодушно ре- шает принять тов. Якимова в партию. Затем парткомиссия также единоглас- но принимает в партию отличившихся бойцов Абрамова, Аверкина, Савечалова. Все они своими боевыми делами доказа- ли беззаветную преданность родине и пар- пик Ленина - Сталина.	vol-5310-page-03-seg-017-1114-3069-1780-3657.png
5310	3	717	3707	1491	3779	2	0.87691	Экономить горючее!	vol-5310-page-03-seg-018-0717-3707-1491-3779.png
5310	3	416	3803	1088	5242	206	0.96679	Обеспеченность частей жидким топли во многом зависит от того, насколь командиры и бойцы, имеющие нэп) средственное отношение к нему, бережно, экономно расходуют горючее. соединении, где начальником авто- технического снабжения тов. Рояк, хране- ние и выдача горючего поставлены пло- хо, в результате наблюдаются случаи не- производительного расхода ценного жидке- го топлива. Учет его совершенно не ве- льется. Приказы вопросам хранения и учета горючего не изучены. Грузовые автомашины систематически используются вместо легковых. Недочеты, отмеченные актах проверок, не устраняются. В соединении, где начальником отдела снабжения горючим тов. Горшунов, содер - жатся сверхштатные автомашины. Значе- тельная часть машин пиеет продег с гру- 30м немногим более 50 процентов прой- денного пути. Здесь грузовые автомаши- ны также используются вместо легковых. Части, где наблюдается пренебрежитель- наше отношение к столь ценному военному имуществу, каким является жидкое топ- ливо, ощущают много неудобств из-за не- достатка бензина и масел для машин. наоборот, в частях и соединениях, где командование повседневно занимается воп- росами бережного отношения и экономного расходования горючего и смазочных мате- риалов, недостатка в бензине не ощущается. Хорошие результаты в деле сбережения горючего имеют, части соединения, гле на- чальником тыла тов. Виноградов. Здесь чувствуется, что командиры всех степе- ней основательно занимаются вопросами состояния и эксплуатации техники, бе- режным и экономным расходованием горю- чего и смазочных материалов,	vol-5310-page-03-seg-019-0416-3803-1088-5242.png
5310	3	1114	3803	1774	4190	56	0.96593	По указанию командования тов. Вино- градов провел техническую конференцию и организовал выставку экспонатов авто- дорожных частей и органов снабжения го- рючин. Ва конференции и на выставк? были продемонстрированы простые и общ-- доступные мероприятия, с помощью кото - рых воинские части и органы снабжения горючим добились сокращения расхода бензина и смазочных материалов и отлич- ного содержания автотранспорта.	vol-5310-page-03-seg-020-1114-3803-1774-4190.png
5310	3	1116	4208	1770	4485	39	0.96251	Горючее, например, отпускается только по установленному лимиту, который дово- дится вплоть до каждой отдельной маши- ны. За перерасход бензина сверх лимита- рованного количества взыскивается стол- мость его с виновных лиц, а перерасхо- зованное горючее удерживается из очеред- ного лимита.	vol-5310-page-03-seg-021-1116-4208-1770-4485.png
5310	3	1112	4497	1768	4812	40	0.96486	Автомашины. требующие ремонта, эксплуатации не допускаются. В автома- стерских частей, а также средствами авто летучек производится регулировка жикле- рог, карбюраторов, системы зажигания тормозов, проверяется правильность поло- жения колес у автомашин, что в значи- тельной мере дает возможность сокращать расход горючего.	vol-5310-page-03-seg-022-1112-4497-1768-4812.png
5310	3	1108	4816	1760	4993	24	0.96613	Широко практикуется сбор отработан- ных масел, которые после регенерации по ступают на снабжение. Благодаря этому в течение этого года сэкономлены сотн: тонн пенных масел.	vol-5310-page-03-seg-023-1108-4816-1760-4993.png
5310	3	1106	5013	1762	5190	28	0.94906	Описанный опыт работы должен стать! достоянием всех частей Красной Армии Это даст возможность сэкономить не одну тысячу тонн весьма ценных для нужд вой- ны горючих и смазочных материалов	vol-5310-page-03-seg-024-1106-5013-1762-5190.png
5310	3	1369	5210	1714	5244	3	0.95197	Полковник А тюрин	vol-5310-page-03-seg-025-1369-5210-1714-5244.png
5310	3	1847	1664	2433	1730	8	0.93068	В ГОРАХ КАВКАЗА. Мичман Банк- кин в разведке.	vol-5310-page-03-seg-026-1847-1664-2433-1730.png
5310	3	1955	1736	2437	1798	6	0.95273	Снимок нашего спец. фотокорр O. Кнорринга	vol-5310-page-03-seg-027-1955-1736-2437-1798.png
5310	3	1913	1871	2394	2001	2	0.91811	Уральцы-героям Сталинграда	vol-5310-page-03-seg-028-1913-1871-2394-2001.png
5310	3	1810	2019	2471	2681	77	0.95742	УРАЛ, 17 октября. (По телеграфу от наш. корр. ). Коллектив рабочих, инженерно-технических работников служащих завода "Красная звезда" обра тился с призывом ко всем трудящимся Свердловской области ознаменовать пред- октябрьское социалистическое соревнова- ние выпуском сверхплановой продукции. «Из этой дополнительной продукции,- писали в своем обращении передовики, мы решили создать фонд усиления по- мощи уральцев героям-сталинградцам. Мы заведем у себя специальные лицевые сче- та завода, участков, бригад, каждого члена нашего коллектива. В эти боевые счета будем заносить только сверхплано- продукцию».	vol-5310-page-03-seg-029-1810-2019-2471-2681.png
5310	3	1808	2685	2469	3259	72	0.95334	Призыв передовиков встретил большук подержку. На заводе "Красная звезда" уже открыли счета многие рабочие. Как- дый стремится сделать побольше, чтобы помочь героическим бойцам грозного Сталияграда. Запишите в мой счет 30 дополни- тельных деталей, заявил после смены молодой рабочий Костя Бучков. Пять c половиной норм выработала сборщица Клевакина. Под лозунгом: «Чей счет бу- дет богаче, кто даст больше сверхплано- вой продукции в фонд помощи защитни- кам Сталинграда» развертывается сорев- нование на многих предприятиях.	vol-5310-page-03-seg-030-1808-2685-2469-3259.png
5310	3	1853	3305	2408	3448	4	0.98032	ПРАЗДНИЧНЫЕ ПОДАРКИ ЗАЩИТНИКАМ СТАЛИНГРАДА	vol-5310-page-03-seg-031-1853-3305-2408-3448.png
