volume_number	page_number	x1	y1	x2	y2	tokens_count	mean_confidence	text	image
5789	2	3591	3641	4247	3707	5	0.92522	Горячую речь произнес подполковник Белинский:	vol-5789-page-02-seg-096-3591-3641-4247-3707.png
5789	2	3589	3720	4249	4145	64	0.94908	Мы, артиллеристы, радостью встречаем выпуск нового займа. Это будет еще один мощный вклад в дело роста на- шей боевой техники и народного хозяй- ства. Силу нашей артиллерии не раз из- ведали гитлеровцы. Наша артиллерия сокрушает такие укрепления, которые немцы считают непреодолимыми. В наших : руках техника огромной мощи заем поможет сделать ее еще более сильной. Я подписываюсь на 2.500 рублей и вношу их наличными.	vol-5789-page-02-seg-097-3589-3720-4249-4145.png
5789	2	3589	4159	4247	4405	35	0.95007	Через час после митинга подпиской был охвачен весь личный состав части. Треть общей суммы подписчики внесли наличными. Успешно прошла подписка на заем среди всенно-инжеперных работни- ков, которые подписались на 135 проден- тов месячного фонда содержания.	vol-5789-page-02-seg-098-3589-4159-4247-4405.png
5789	2	3839	4422	4199	4455	3	0.94975	Капитан С. СЕМЕНОВ	vol-5789-page-02-seg-099-3839-4422-4199-4455.png
5789	2	2975	4547	4180	4603	6	0.96954	Огромный успех подписки на военный заем	vol-5789-page-02-seg-100-2975-4547-4180-4603.png
5789	2	2912	4626	3568	5126	76	0.94690	За три дня общая сумма подписки по Узбекской республике достигла 1.079.429 тысяч рублей, превысив сумму подписки в прошлом году на 180.454 тысячи руб- лей. Рабочие и служащие республики под- писались на 343.191 тысячу рублей, кол- хозники на 534.042 тысячи рублей, 80,2 процента этой суммы они внесли наличными. Намеченная к размещению сумма займа по республике перевыполне- на. Председатели 15 колхозов Самарканд- ской области подписались по 100 тысяч рублей каждый и тут же внесли всю сум- му наличными.	vol-5789-page-02-seg-101-2912-4626-3568-5126.png
5789	2	2912	5144	3566	5790	102	0.94092	За первые три дня сумма подоплеки по Хабаровскому краю составила 393.097 тысяч рублей, превысив наивысшую сум- му подписки прошлого года на 43.260 тысяч рублей. Рабочие и служащие под- : писываются, как правило, на суммы, пре- вышающие месячный заработок. В Карта- новическом районе главный бухгалтер Ясно-Полянской МТС т. Фролов подписал- ся на 40 тысяч рублей, забойщик при- иска имени Гастелло т. Тимошенко под- писался на 700 процентов заработка. За- бойщик т. Мартынов --- на 500 процен- тов. Оба они оплатили подписку налич- ными деньгами. Колхозники Хабаровского района т.т. Муругова, Макущенко и Те- рентьев М. А. дали взаймы государству по 100 тысяч рублей каждый.	vol-5789-page-02-seg-102-2912-5144-3566-5790.png
5789	2	2912	5796	3564	6078	43	0.95295	Во многих районах Камчатской области намеченная к размещению сумма перевы- полнена. Исключительно дружно прошла подписка на заем среди грузчиков Петро- павловского порта. Общая сумма их под- писки составила 208 процентов к месяч- ному фонду заработной платы. исходу дня 7 мая во всех районах	vol-5789-page-02-seg-103-2912-5796-3564-6078.png
5789	2	3578	4624	4249	4836	32	0.94022	Мурманской области подписка рабочих и служащих превысила намеченную сумму. В целом по области подписка составила 28.978 тысяч рублей. Это на 4.250 ты- сяч рублей больше суммы всей полниски на прошлогодний заем. (ТАСС)	vol-5789-page-02-seg-104-3578-4624-4249-4836.png
5789	2	3585	4888	4251	5711	107	0.95248	Киев. Трудящиеся Украины с радостью отдают свои сбережения на дело оконча- тельного разгрома врага и восстановление разрушенного немцами хозяйства. Уже к концу третьего дня подписки намеченная сумма по республике была превышена на 45 процентов. Впереди идут Сталинская, Ворошиловградская, Полтавская, Днепро- петровская области. Рабочие и служащие Харькова дали по займу 134.8 продента к месячному фонду зарплаты. Колхозники Харьковщины, пре- высив плановую сумму подписки, свыше 26 млн. рублей внесли наличными. Смоленск. Колхозники Смоленщины приобретают облигации военного зай- ма. В селах Козельского района под- писка превысила 5,6 миллиона рублей на 20 процентов больше намеченной суммы. Больше 4 миллионов рублей дали взаймы государству колхозники Сухинич- ского района. Вся подписка полностью оплачена.	vol-5789-page-02-seg-105-3585-4888-4251-5711.png
5789	2	3585	5719	4249	5859	17	0.95019	Сталинабад. Колхозники Таджикистана дали по подписке около 206 млн. рублей и внесли наличными 117. 500 тысяч рублей,	vol-5789-page-02-seg-106-3585-5719-4249-5859.png
5789	2	3581	5861	4249	6077	30	0.93839	Беломорск. большой активностью подписываются на военный заем трудя- щиеся карело-Финской ССР. Они уже да- ли взаймы государству почти на 6 мин. рублей больше, чем при подписке на Вто- рой Военный	vol-5789-page-02-seg-107-3581-5861-4249-6077.png
5789	3	253	213	886	242	8	0.90097	9 мая 1944 г., вторник. № 109 (5789)	vol-5789-page-03-seg-001-0253-0213-0886-0242.png
5789	3	255	325	1475	473	7	0.92627	одовщина создания польской дивизии им. Тадеуша Костюшко	vol-5789-page-03-seg-003-0255-0325-1475-0473.png
5789	3	192	505	856	938	61	0.94523	В связи с исполняющейся сегодня, мая, первой годовщиной создания поль- ской дивизии имени Тадеуша Костюшко, Всеславянский Комитет обратился к ко- мандующему польской армией в СССР re- нерал-лейтенанту Зигм. Берлипгу со сле- дующей приветственной телеграммой: "От всего сердца поздравляем со слав- ной годовщиной создания вооруженных польских сил на территории СССР. Герои- ческая борьба Первой польской дивизии имени Тадеуша Костюшко вместе с Крас-	vol-5789-page-03-seg-004-0192-0505-0856-0938.png
5789	3	873	505	1531	650	21	0.93918	ной Армией навсегда войдет в историю войны с гитлеризмом - извечным врагом славянских народов и будет примером для всей польской армии.	vol-5789-page-03-seg-005-0873-0505-1531-0650.png
5789	3	869	652	1533	938	42	0.95274	делаем всем дивизиям польской армии таких же славных боевых успехов в борьбе за свободную, независимую демо- кратическую Польшу, которая должна быть и будет равноправным членом в дружной семье славянских народов. Me- лаем боевых успехов всему командному рядовому составу польской армии в СССР.	vol-5789-page-03-seg-006-0869-0652-1533-0938.png
5789	3	569	961	1485	1034	6	0.94689	Председатель Всеславянского Комитета генерал-лейтенант Александр ГУНДОРОВ.	vol-5789-page-03-seg-007-0569-0961-1485-1034.png
5789	3	363	1054	1485	1121	8	0.96559	Ответственный секретарь Всеславянского Комитета гвардии полковник Валентин МОЧАЛОВ.	vol-5789-page-03-seg-008-0363-1054-1485-1121.png
5789	3	307	1200	1408	1304	3	0.93148	Предвидение в бою	vol-5789-page-03-seg-009-0307-1200-1408-1304.png
5789	3	194	1329	850	1850	81	0.95011	Организовать бой, управлять им и ус- пешно вести его от начала до конца не- возможно без известного предвидения, Пс- кусно проведенный бой прежде всего потому отличается от боя неумелого тем, что ос- нован на учете ряда таких факторов, ко- торые позволили предусмотрительному командиру сделать правильные выводы и здраво рассчитать свои действия. Такой командир редко попадает врасплох, с ка- кими бы неожиданностями он ни столкнул- ся. Что самое главное он подчиняет ход боя своей воле, а не плетется в хво- сте событий.	vol-5789-page-03-seg-010-0194-1329-0850-1850.png
5789	3	192	1858	854	2381	62	0.94698	Предвидение, помимо всего прочего, оз- начает умение так управлять боем, чтобы еще до окончания одного его этапа вскрыть характер назревающих событий в последующем этапе. Обладая подобной способностью предвидеть, командир сумеет соответственно построить управление обеспечить успех этого последующего эта- па боя. Отметим еще, что предвидение подразумевает умение выделять из общей суммы вопросов управления основные за- дачи, которые надлежит выполнить для успеха всего предприятия.	vol-5789-page-03-seg-011-0192-1858-0854-2381.png
5789	3	194	2393	854	2956	73	0.94569	Каковы же факторы, позволяющие де- лать те или иные выводы в бою и пре- дусмотреть ход событий. Самый важный из них, конечно, обстановка. Получать постоянную информацию об обстановке, добывать сведения о всех ее деталях первая предпосылка правильного предви- дения. Можно привести сотни случаев, когда, например, успех обеспечивался тем, что командиры глубоко оценивали усло- вия местности, учитывая, как она пов- лияет на ход боя. Существенным факто- ром является также изучение тактичес- ких приемов противника.	vol-5789-page-03-seg-012-0194-2393-0854-2956.png
5789	3	196	2968	854	3366	53	0.94976	Без всестороннего учета данных обста- новки и ясного представления о тактике противника управление сводится лишь к парированию ударов его. В таких случаях мероприятия командира запаздывают. А всё это влечет за собой потерю инициа- тивы. И наоборот - глубокое знание об- становки и грамотная оценка ее всегда помогают предвидению хода событий и захвату инициативы.	vol-5789-page-03-seg-013-0196-2968-0854-3366.png
5789	3	194	3374	857	3841	60	0.94773	В подтверждение сказанному сошлемся на такой пример. N дивизии предстояло прорвать оборонительную полосу немцев на реке Неручь. Хорошо изучив силы противника и самый характер его такти- ческих приемов, командование предвидело возможность более или менее крупных танковых контратак. Для отражения этих вероятных контратак в боевые по- рядки наступающих частей были выдви- нуты пушечные батареи. Двигаясь" пере- катами, поэшелонно и занимая огневые	vol-5789-page-03-seg-014-0194-3374-0857-3841.png
5789	3	867	1331	1529	1725	52	0.96207	позиции на танкоопасных направлениях, эти батареи оградили наступавшую пехоту от танковых контратак. Характерно, что в процессе борьбы с контратаками наша непрерывная разведка местоположения и самого состава вражеских танковых ча- стей позволяла предвидеть их вероятный маневр и наши батареи благодаря этому всегда оказывались там, где маневрирова- вшие танки противника пытались нанести свой удар.	vol-5789-page-03-seg-015-0867-1331-1529-1725.png
5789	3	869	1737	1535	2495	98	0.95335	Другой пример не менее Поучителен. полк прорвал оборонительную полосу противника, располагавшегося в лесу. Командир полка заранее предусмотрел, что немцы могут применить в лесу всякого рода засады и диверсионные группы. Что- бы предупредить врезанные нападения, не отвлекая основные силы от выполне- ния главной задачи, командир части соз- дал в боевых порядках специальные ист- ребительные группы. Это мероприятие де- ликом себя оправдало. Действительно, по мере углубления в лес стали встречаться мелкие вражеские группы, состоявшие преимущественно из автоматчиков. Истре- бительные группы полка быстро с ними расправились. He создай их командир заблаговременно - полк мог бы немало времени потерять в этом лесу.	vol-5789-page-03-seg-016-0869-1737-1535-2495.png
5789	3	873	2500	1535	3189	85	0.95857	В заключение укажем, что истинное предвидение не мирится c предвзя- тостью. Если предвидение толкает на предвзятые решения, командир либо упустит благоприятные возможности, либо будет бить по пустому месту. Известно, что немцы на ряде участ- ков используют танки, как основу подвижной обороны. Но значит ли это, что на каждом танкоопасное направлении надо, скажем, делать остановку для сос- редоточения необходимых средств, если они отстали. Разве не может быть так, что потребуется не остановка, а наоборот дерзкое движение вперед, даже при том условии, что часть противотанковых средств отстала.	vol-5789-page-03-seg-017-0873-2500-1535-3189.png
5789	3	873	3195	1535	3757	69	0.95223	Сплошь и рядом случается так, что риск и дерзость в подобной обстановке являются лучшим выражением предвиде- ния. От здравого предвидения до пред- взятости - один шаг. Искусство коман- дира и заключается в том, чтобы соблю- сти здесь меру, не делая этого ошибочного шага. Предвидя возможное развертывание событий, командир должен соответственно построить боевой порядок, выделить часть сил для парирования вероятных контрмер противника и одновременно настойчиво, непрерывно проверять правильность своих прогнозов.	vol-5789-page-03-seg-018-0873-3195-1535-3757.png
5789	3	907	3764	1496	3843	5	0.96303	Подполковник М. БАЛАКИН... ДЕЙСТВУЮЩАЯ АРМИЯ.	vol-5789-page-03-seg-019-0907-3764-1496-3843.png
5789	3	1583	1419	2181	1546	16	0.95455	2-й УКРАИНСКИЙ ФРОНТ. Радио- станция гвардии старшего сержанта Г. Дарбинян поддерживает связь с со- седними подразделениями.	vol-5789-page-03-seg-020-1583-1419-2181-1546.png
5789	3	1648	1563	2146	1635	7	0.94751	Снимок нашего спец. фотокорр. майора С. Лоскутова.	vol-5789-page-03-seg-021-1648-1563-2146-1635.png
5789	3	1644	1712	2106	1758	1	0.95059	ГЕРОЙ-ГВАРДЕЕЦ	vol-5789-page-03-seg-022-1644-1712-2106-1758.png
5789	3	1548	1777	2210	2529	109	0.95272	4-11 УКРАИНСКИЙ ФРОНТ, 8 мая. (От наш. норр.). Образец мужества и отваги в боях на подступах к Севастополю проя- вил командир отделения гвардии сержант Валпев. Действуя в штурмовой группе, он первым бросился на вражеские укрепления, а, умело преодолев зону вражеского охра- нения, храбред ворвался в траншею и противника и истребил 18 гитлеров- цев. Будучи ранен в левую руку, Валиев сменил винтовку на гранату и продолжал бой, увлекая за собой бойцов своего отде- ления. Вырвавшись снова вперед, Валиев течение четырех часов вел бой с боль- шой группой гитлеровцев. В этом бою гвардеец Валиев погиб смертью героя. Во- круг траншее, которую защищал славный патриот, наши бойцы насчитали 60 тру- пов немцев.	vol-5789-page-03-seg-023-1548-1777-2210-2529.png
5789	3	1637	2583	2112	2672	4	0.93100	КОННО-СПОРТИВНЫЕ СОСТЯЗАНИЯ В ЧАСТИ	vol-5789-page-03-seg-024-1637-2583-2112-2672.png
5789	3	1552	2681	2210	3354	83	0.95248	ГОРОД Н., 8 мая. (От наш. корр. ). Сол- нечное весеннее утро. На конном плацу собрался личный состав N кавалерийской части. Начинаются большие конно-спортив- ные состязания. Программа состязаний весьма разнооб- разна. Она началась фигурной ездой сфи- серов. Ведет смену майор Карлович. Всад- ники уверен управляют лошадьми. Затем состоялся конкур-иппик, рубка ло- зы. Искусно владеют клинком старший лейтенант Асеев, старшина Михайлов красноармеец Шода. С большим спортив- ным азартом прошли также конные игры. Состязания продемонстрировали рост ка- валерийского мастерства офицеров, сержан- тов и бойцов части.	vol-5789-page-03-seg-025-1552-2681-2210-3354.png
5789	3	1733	3422	2037	3456	2	0.81991	Памятник героям	vol-5789-page-03-seg-026-1733-3422-2037-3456.png
5789	3	1692	3476	2073	3506	2	0.94776	Отечественной войны	vol-5789-page-03-seg-027-1692-3476-2073-3506.png
5789	3	1552	3524	2210	3843	50	0.97475	НИЖНЕ-ДНЕПРОВСК, 8 мая. (TACC). В сквере, расположенном в центре города высоко над Днепром высится обелиск. На нем высечена надпись: «Вечная слава ге- роям, павшим в боях за свободу и неза- висимость нашей Родины». Этот памятник освободителям НижнеДнепровская построен трудящимися города во внеурочное время. На его открытии присутствовало 12 тысяч человек.	vol-5789-page-03-seg-028-1552-3524-2210-3843.png
5789	3	2446	325	4053	455	4	0.92341	- Бои под евастополем	vol-5789-page-03-seg-029-2446-0325-4053-0455.png
