volume_number	page_number	x1	y1	x2	y2	tokens_count	mean_confidence	text	image
4967	1	3663	5026	4345	6215	164	0.95185	7 сентября вышел первый номер газе- ты Военно-воздушных сил Красной армии "Сталинский сокол", орган Народного Ко миссариата Обороны СССР. Имея своей задачей "любовно, по кру- пицам, собирать накопленную В авиача- стях боевую практику и вооружать eic весь летно-технический состав», как гово- рится передовой статье газеты, «Сталинский сокол» уже в первом своем номере широко освещает славные боевые дела наших крылатых богатырей. Статьи пилотов и штурманов Угрюмова, Ковалева, Додонова, Хуртак и других рассказывают том, как советская авиация бомбит во- енные объекты Берлина, Кенигсберга, Ме- миля. В ряде других статей газета гово- рит о подвигах отважных истребителей, мастеров воздушного боя Фигичева, Кат- рича, которые огнем и тараном беспощад- но уничтожают фашистских стервятников Ряд командиров-летчиков выступил на страницах первого номера «Сталинского сокола» со статьями тактике врага, опыте бомбометания, ночной авиаразведки. Как всегда, сильно звучит голос писате- ля Ильи Эренбурга, выступившего в «Ста- линском соколе" интересной статьей «Земля ждет». Злободневны и остры фель- етоны, напечатанные газетой в специаль- ном отделе сатиры «Полный капот». Кроме того в «Сталинском соколе» опубликована	vol-4967-page-01-seg-067-3663-5026-4345-6215.png
4967	1	3663	6223	4345	6277	4	0.89741	го плана воздушного «блицкрига».	vol-4967-page-01-seg-068-3663-6223-4345-6277.png
4967	2	1971	424	2324	456	4	0.81948	А С Н А	vol-4967-page-02-seg-001-1971-0424-2324-0456.png
4967	2	2332	422	2590	458	3	0.80950	3 Е 3	vol-4967-page-02-seg-002-2332-0422-2590-0458.png
4967	2	3581	412	4317	452	8	0.92931	9 сентября 1941 г., вторник. № 212 (4967)	vol-4967-page-02-seg-003-3581-0412-4317-0452.png
4967	2	524	532	2081	638	2	0.95738	Советского Информбюро	vol-4967-page-02-seg-004-0524-0532-2081-0638.png
4967	2	366	662	872	698	5	0.91270	Окончание. Начало на 1 стр.	vol-4967-page-02-seg-005-0366-0662-0872-0698.png
4967	2	274	736	950	1517	115	0.95103	рваться за блиндажи и окопы первой ро- ты. Командиры первой и третьей рот т.т. Шереметьев и Зуев повели своих бойцов в атаку. Свыше 150 вражеских солдат в офицеров были убиты, 21 сдались в плен. Пытаясь создать видимость окружения, группа немецких автоматчиков проникла в тыл и открыла оттуда огонь. Старшина Шорников вместе с несколькими меткими стрелками быстро уничтожил фашистских автоматчиков. Ночью немцы трижды пред- принимали безуспешные атаки. В ночном бою взвод младшего лейтенанта Суркова дружной контратакой опрокинул целую роту немцев и взял в плен 12 солдат. Сокрушительные удары наносили но про- тивнику артиллеристы, минометчики и пу- леметчики. В бою с батальоном капитана Козуля немцы потеряли более 600 солдат и офицеров, 12 орудий, 7 минометов 11 пулеметов.	vol-4967-page-02-seg-006-0274-0736-0950-1517.png
4967	2	272	1557	942	2037	70	0.95152	Батареи лейтенанта Трушкина п млад- шего лейтенанта Шевченко разгромили не- мецкую автоколонну. После первого же валпа головные немецкие машины взлете- ли на воздух. Фашисты заметались по до- pore, пытаясь отвести уцелевшие машины в лес. Тогда младший лейтенант Шевчен- выкатил орудия своей батареи на от- крытую позицию и прямой наводкой стал бить по фашистской колонне. Артиллерий- ским огнем были уничтожены 30 грузо- вых машин, легковой автомобиль и 4 мо- тоцикла противника.	vol-4967-page-02-seg-007-0272-1557-0942-2037.png
4967	2	270	2061	943	2448	54	0.94075	За Захватив города и села Советской Эсто- нии, немецкие фашисты начали истреблять эстонский народ. Оккупация немцами ка- жилого города, местечка и населенного пун- повсюду сопровождалась грабежами, насилиями и массовыми убийствами. тель волости Равпла, Александр Хельгу- мяэ, бежавший из фашистского ада, рас- сказывает: «Я был в местечке Лихула, когда фашисты заняли его. В первый же	vol-4967-page-02-seg-008-0270-2061-0943-2448.png
4967	2	962	668	1633	716	7	0.91890	день палачи казнили десятки ни в чем	vol-4967-page-02-seg-009-0962-0668-1633-0716.png
4967	2	962	720	1633	1255	77	0.95176	было 13 юношей и девушек-подростков». Работник коммунального хозяйства горо- да Тарту тов. А. Янсен заявил: «В город- ском парке группа немецких штурмовиков остановила 11-летнего сына моего соседа Нарла Веске. Заметив на мальчике крас- ный галстук, фашисты схватили пионера п потащили к высокому каштановому ле- реву. Один из бандитов принес веревку. хладнокровием садистов они сделали петлю, надели ее на мальчиа и повесили его на дереве. Труп висел два дня в пар- ке. Родителям не разрешали похоронить их ребенка».	vol-4967-page-02-seg-010-0962-0720-1633-1255.png
4967	2	958	1257	1625	1775	74	0.94887	Немецкий солдат Франц Гофман, добро- вольно сдавшийся в плен, сообщил: «В одной маленькой эстонской деревушке я был свидетелем ужасной сцены. Группа пьяных солдат с фельдфебелем во главе ворвалась B дом крестьянина кясперт. Дома были семидесятилетний крестьянин в его жена с двумя маленькими внучатами. Фельдфебель потребовал поросенка и кур. Старик ответил, что поросенка у него нет. а кур солдаты уже забрали. Взбесившийся гитлеровец приказал приколоть старика. Солдаты затем прикончили всех -- стару- ху и детей».	vol-4967-page-02-seg-011-0958-1257-1625-1775.png
4967	2	962	1779	1617	1851	13	0.94335	Фашисты открыто хвастают, что они ис- коренят, сотрут с лица земли все эстонское	vol-4967-page-02-seg-012-0962-1779-1617-1851.png
4967	2	956	1855	1619	2442	77	0.94167	* Во всех крупных центрах Италии - Риме, Милане, Турине, Генуе и во многих деревнях из рук в руки переходят тыся- чи антифашистских листовок. В своих ли- стовках итальянские патриоты требуют немедленного прекращения военных дей- ствий, увода итальянских армий с Восточ- ного фронта, изгнания немецких войск из Италии и прекращения вывоза продоволь- ствия в Германию. Листовки разорасыва- ются по улицам, расклеиваются на стенах заборах. В Генуе были расстреляны нес- колько распространителей листовок. Норвежские патриоты взорвали в Гуль-	vol-4967-page-02-seg-013-0956-1855-1619-2442.png
4967	2	1651	664	2308	774	13	0.93578	хагене близ Драммена пороховой завод Уничтожены десятки тони взрывчатых ве- ществ. Завод разрушен.	vol-4967-page-02-seg-014-1651-0664-2308-0774.png
4967	2	1639	844	2306	2438	212	0.95035	Советский народ успешно готовит мощ- ные резервы для Красной Армии. В Ленинграде сержант ленинградской городской милиции В. Петров и милицио- нер тов. Издан организовали из населения на своих участках боевые отряды добро- вольцев, Каждое подразделение имеет стрелков, гранатометчиков, пулеметный расчет и санитаров. Тов. Издон уже под- готовил 52 бойца и сейчас обучает еще 68. Трудящиеся города Сталино занима- ются в группах истребителей танков, изу- чают парашютное дело. Несколько сот де- вушек обучается на курсах телеграфисток телефонисток. Свыше 300 осоавиахимов- цев Бауманского района гор. Казани при- ступили к военно-тактическим учениям на местности. Недавно близ деревни Троиц- кое было проведено учение на тему разгром воздушного десанта противника. На этом занятии осоавиахимовцы показа- умение искусно маскироваться, поль- зоваться стрелковым оружием и вести раз- ведку. Во всех районах Ярославля созда- ны группы стрелков-парашютистов, круж- ки снайперов, пулеметчиков, разнстов. гранатометчиков. Успешно овладевает во- енным делом колхозная молодежь. Еже- дневно юноши села Травянки каменского района Челябинской области учатся ходить в строю, владеть винтовкой, бросать гра- нату. Девушки занимаются в санитарной дружине. Молодые колхозники Регарского района Таджикской ССР организовали группу ворошиловских всадников и овла- девают техникой езды, учатся владеть клинком. В Ереване тысячи рабочих ком- бината имени Кирова, железнодорожного узла и Масложиркомбината изучают в подразделениях Осоавиахима винтовку, пулемет, гранату и приобретают практи- ческие навыки штыкового ббл и граната- метания.	vol-4967-page-02-seg-015-1639-0844-2306-2438.png
4967	2	846	2476	1733	2538	4	0.97633	Вечернее сообщение 8 сентября	vol-4967-page-02-seg-016-0846-2476-1733-2538.png
4967	2	270	2558	932	3002	63	0.94689	течение 8 сентября наши войска вели бои с противником на всем фронте. На Смоленском направлении двадцати- шестидневные бои за гор. Ельня под Смо- ленском закончились разгромом дивизии «СС», 15 пехотной дивизии, 17 мотодиви- зии, 10 танковой дивизии, 137 австрий- ской пехотной дивизии, 178, 292, 268 пе- хотных дивизий противника. Остатки диви- зий противника послушно отходят в за- западном направлении. Наши войска заняли r. Ельня.	vol-4967-page-02-seg-017-0270-2558-0932-3002.png
4967	2	266	3008	928	3371	53	0.94739	Наша авиация продолжала наносить уда рф по войскам противника на поле боя и уничтожала авиацию на его аэродромах. В ночь на 8 сентября наши самолеты бом- бардпровали Бухарест. Все самолеты вер- нулись на своп базы. За 6 сентября в воздушных боях и на аэродромах противника уничтожено 62 не- мецких самолета. Наши потери -----	vol-4967-page-02-seg-018-0266-3008-0928-3371.png
4967	2	260	3421	928	4147	113	0.95207	Командиру автобатальона старшему лей- тенанту Лаврову разведка донесла, что в соседнем селе находится крупный отряд немцев с артиллерией и танками. При под- держке артиллерийского дивизиона капита- на Южакова бойцы автобатальона подобра- лись к немецким позициям п атаковали фашистов. Немцы под прикрытием пуле- метного и артиллерийского огня отошли от села. Не давая врагу оправиться, наши бойцы вместе с подоспевшими к тому вре- мени пятью танками, с новой силой про- должали атаку и преследовали врага. Нем- цы потеряли в этом бою около двух рот. Захвачены 4 тяжелых 2 противотанко- вых немецких орудия, два танка, 40 мо- тоциклов, несколько автомашин и миноме- тов. В бою особенно отличился воентехник 1-го ранга тов. Стефановский и красно- армеец Кириченко.	vol-4967-page-02-seg-019-0260-3421-0928-4147.png
4967	2	260	4195	927	4486	44	0.94802	В Ленинградской области партизанские отряды, развернув интенсивные боевые опе- рации, беспощадно бьют гитлеровских ок- купантов. По неполным данным за вторую половину августа в Лужском районе пар- тизаны перебили более 800 фашистских солдат и офицеров, вывели из строя 14 танков 7 бронемашин, 17 орудий, 22	vol-4967-page-02-seg-020-0260-4195-0927-4486.png
4967	2	950	2556	1619	3755	181	0.94799	пулемета, уничтожили 47 грузовых авто- мобилей, 62 мотоцикла, сожил 18 авто- цистерн с горючим и захватили много бое- припасов, снаряжения, саперного инвента- ря и продовольствия. Партизаны наносят удары там, где их меньше всего ждут фашисты. Днем 29 ав- густа на шоссейной дороге близ Б. Торош- ковичи отряд землеустроителя тов. У. унич- тожил 30 немецких мотоциклистов. Парти- заны устроили засаду на поляне близ до- роги. Когда немецкие мотоциклисты прп- близились, партизаны выпустили на поляну несколько поросят и кур. Немецкие сол- даты, оставив мотоциклы, бросились за до- бычей. Партизаны, сделав несколько залпов, кинулись на фашистов и уничтожили их. Неподалеку от Толмачево партизанский отряд под командованием тов. Н. ночью подкрался к стоянке немецких танков. Бес- шумно сняв часовых, партизаны перебили спящих танкистов, взорвали 2 средних и 3 легких танка и угнали в лес одну лег- какую машину. Партизанский отряд под командованием ветеринарного врача тов. С. минировал мост через реку Ящера около Долговки. Вместе с мостом взлетела на воздух не- мецкая автомашина, груженая минами. Пе- ребив фашистов, сопровождавших другие машины автоколонны, партизаны уничто- жили 72 ящика со снарядами и захватили 114 ящиков с ручными гранатами.	vol-4967-page-02-seg-021-0950-2556-1619-3755.png
4967	2	938	3817	1609	4480	110	0.94454	итлеровская клика безуспешно стирает. ся скрыть от германского народа правду об огромных потерях немецко-фашистских войск на восточном фронте. Из показа- ний пленных и из писем, обнаруженных у них, видно, что широкие слои немецкого народа перестают верить болтовне фа- шистской печати и радио. Ефрейтор Ганс Бейер получил письмо из Гамбурга от ра- неного брата. Фриц Бейер пишет: «Л уже три недели лежу в военном лазарете. Со следующим транспортом я наверное поеду в другой лазарет. Здесь все переполнено и каждый день приходят все новые и новые транспорты с ранеными". Пленный ефрей- тор 9 роты 502 полка 290 немецкой пе- хотной дивизии Гоппи говорит: "Наша ро- та потеряла убитыми и ранеными 70 че-	vol-4967-page-02-seg-022-0938-3817-1609-4480.png
4967	2	1635	2556	2300	3252	113	0.94197	ловек, но она пострадала меньше, чем другие роты. В 6 п 8 ротах осталось по 15--20 солдат». Ефрейтор 5 роты 503 пехотного полка Петер Гартлиф на допро се показал: «Наша рота в первых же бо- ях потеряла 50 процентов своего состава, a 14 августа были уничтожены остатки роты. То же можно сказать о всем ба- тальоне». Ефрейтор Пауль Грету расска- зал: "В последних боях погибло много моих товарищей. В нашем артиллерийском полку осталось всего лишь 200 человек. Солдаты в отчаянии». Солдат 2 роты 46 полка Вильгельм Рихман заявил: «В моей роте из 143 солдат остался только 41. За последнее время командование полка лишь в редких случаях посылает семьям извещения об убитых солдатах». *	vol-4967-page-02-seg-023-1635-2556-2300-3252.png
4967	2	1633	3256	2294	3695	62	0.94324	В колхозах и совхозах широко развер- тывается уборка и заготовка овощей на зиму. Дальне-Константиновский район Горьковской области выполнил план заго- товки капусты на 119 процентов, цов - на 105 процентов, свеклы --- на 161 процент, по всем другим культурам план перевыполнен. Ростовский городской плодоовощеторг завез к 1 сентября 14 тысяч тонн овощей. Годовой план засолки капусты уже перевыполнен на 20 про- центов.	vol-4967-page-02-seg-024-1633-3256-2294-3695.png
4967	2	1627	3699	2290	4478	119	0.94219	Заготовительные и торговые организа- ции Харьковской области к 1 сентября за- готовили около 26 тысяч тонн овощей План заготовок ранних сортов капусты столовой свеклы, моркови и других ово- щей значительно перевыполнен. Торговые организации города засолили тысячи тонн огурцов и капусты. В трех районах обла- сти созданы новые засолочные заводы, на- чата подготовка к сушке овощей. Торгующие организации Сталинской об- ласти заготовили картофеля в пять раз больше, чем в прошлом году. Колхозы об- ласти выполнили план заготовлен капусты на 170 процентов, моркови на 140 процентов и свеклы - на 150 процентов. Горловке, Макеевке, Славянске, Арте- москве и в ряде других городов присту- пили к сушке картофеля, капусты, свеклы и моркови. В колхозах для этой цели ис- пользуют простые крестьянские печи.	vol-4967-page-02-seg-025-1627-3699-2290-4478.png
4967	2	272	4552	906	4666	9	0.91204	ОТВЕТ тов. М. И. КАЛИНИНА НА ПРИВЕТСТВИЕ СОВЕТСКОМУ НАРОДУ	vol-4967-page-02-seg-026-0272-4552-0906-4666.png
4967	2	254	4678	918	5158	58	0.94670	В ответ на полученное приветствие Со- ветскому народу Председатель Президиума Верховного Совета СССР тов. М. И. Кали- отправил следующую телеграмму: Монреаль, Канада. Председателю митинга украинцев Г-НУ Калач. Сердечно благодарю украинцев, участ- ников митинга в Монреале, за искреннюю солидарность с советским народом и его Красной Армией, сражающейся против фа- шистского агрессора за честь и независи- мость советского государства. (ТАСС).	vol-4967-page-02-seg-027-0254-4678-0918-5158.png
4967	2	282	5206	902	5318	4	0.98714	БОЛЬШОЙ УСПЕХ МОЛОДЕЖНОГО ВОСКРЕСНИКА	vol-4967-page-02-seg-028-0282-5206-0902-5318.png
