volume_number	page_number	x1	y1	x2	y2	tokens_count	mean_confidence	text	image
5310	2	501	192	4247	348	10	0.89813	красная 3 звезда 13 октября 1942 г., воскресенье. № 246	vol-5310-page-02-seg-001-0501-0192-4247-0348.png
5310	2	116	324	4372	631	17	0.98430	Объединенными усилиями всех родов войсковывать маневр врага. В каждом изматывать противника, уничтожать его живую силу и технику!	vol-5310-page-02-seg-004-0116-0324-4372-0631.png
5310	2	729	663	867	705	3	0.80347	* * *	vol-5310-page-02-seg-005-0729-0663-0867-0705.png
5310	2	165	750	1400	952	6	0.99019	ВНЕЗАПНЫЙ УДАР ПО ОПОРНОМУ ПУНКТУ ВРАГА	vol-5310-page-02-seg-006-0165-0750-1400-0952.png
5310	2	37	982	765	2560	219	0.95045	Этот населенный пункт помпы особенно сильно укрепили. С трех сторон селения они создали десятки дзотов, связанных между собой траншеями и ходами сообще- ния. Церковь с оградой, кладбище и кир- пичные постройки они использовали как основные оперные пункты. Подступы селонию враг менировал. К тому же мест- ность благоприятствовала обороне. С восто- ка пролегало болото, пересеченное ручьями. Все подступы свободно простреливались с нескольких безымянных высот и из леса. расположенного в 300 метрах северо- западнее селения. На юге также находи- лась господствующая высота, занятая противником. Из глубины обороны, с вы- сот, лежащих на западе, враг мог подлер- жать свои войска огнем двух батарей и минометами. Противник имел в этом на- селенном пункте 200 солдат. Кроме того он располагал резервом в соседних дерев- нях, составлявшим около 1.000 солдат. Таким образом взять этот пункт москино быть сильным и внезапным ударом. Идея бол за это селение заключалась в том, чтобы с двух сторон обойти и окру- жить его и прилегающего к нему высоты. Главный удар должен был нанести с се- веро-востока батальон под командованием майор Отрепьева. Усиленный подразделе- автоматчиков, пулеметчиков и са- пер, этот батальон имел задачу прорвать оборону овладеть безымянными высота- ми, а также северной окраиной селения. Удар с юга предстояло нанести силами бойцов соседней части. Им ставилась за- дача захватить южную высоту, часть населенного пункта и выйти та соедине- ние с батальоном Отрепьева.	vol-5310-page-02-seg-007-0037-0982-0765-2560.png
5310	2	16	2569	733	3914	167	0.94389	Большая роль отводилась артиллерии. Командование поставило перед ней задачу: внезапным налетом подавить врага, дез- организовать его систему огня и подавить укрепленные огневые точки. Особое внимание было улелено разведке местности и сил противника. Командиры подразделений лично вели наблюдение и выявляли минные по. ля и проволочные заграждения, расстановку огневых средств систему вражеского огня. Каждая огне- точка просматривалась c разных пунктов, изучались пути подхода к ней. B B итоге была составлена сравнительно полная схема огневых точек противника. Все командиры рот вышли на рокогно- сцировку и получили объекты атаки, маршрут и ориентиры. Такая реког- распиновка была проведена с командирами Взводсв. Артиллеристы получили по-ору- дино секторы обстрела и цели. Ночью бойцы пересекли нейтральную зону, беспумно подошли на 300 метров к окопами противника и залегла в кустарни- ке. Сюда же были подтянуты орудия для стрельбы прямой наводкой. Враг ничего но заметил. На рассвете загремела наша артиллерия. 16 орудий прямой наводкой разносили в щепы вражеские блиндажи и дзоты. Дальнобойные пушки обруши- лись на немецкие батареи, наблюдательные командные пункты. Этот налет продол- жался несколько минут.	vol-5310-page-02-seg-008-0016-2569-0733-3914.png
5310	2	13	3925	720	4257	52	0.94242	Передний край немецкой обороны был покрыт туманом, поднимающимся из .10- и густым облаком дыма. Наши бой- пы бросились вперед по проходам, зара- нее сделанным в мирных полях. На ле- вом фланге бойцы ворвались в траншее.и, но там, где наносился главный удар. враг открыл сильный пулеметный и ружейный огонь. Это несколько затормозило продай-	vol-5310-page-02-seg-009-0013-3925-0720-4257.png
5310	2	784	974	1480	1457	59	0.95049	жение ударной группы, которая несла потери. На помощь подошли автомат- чики. Стремительным броском они ворва- лись вражеские траншеи Завязался рукопашный бой. Рота под командо- ванием старшего лейтенанта Полосовского смяла врага и стала развивать наступле- ние в глубину обороны. Эта рота выплаты безымянным высотам на соединение с соседом, успевинм к тому времени овла- деть южной высотой и продвинувшимся на северо-запад.	vol-5310-page-02-seg-010-0784-0974-1480-1457.png
5310	2	761	1466	1474	2722	170	0.94734	Немцы, оправившись от первого удара, подтянули больше роты солдат из сосед- ней деревни и бросились в контратаку. Но они нарвались на прикрытие, отбившее контратаку. середине дня сидение было захвачено. Но враг не услокал- вался и стягивал резервы из окресг- ных деревень. It вечеру враг открыл огонь из шести минометных батарей арти.плерийских дивилионов. Огтяный вал отсек нашу пехоту от артиллерии. Облако дыма от разрывов снарядов встало с телегой на протяжении полутора километров. Это мешало вести наблюдение нашим артиллеристам. Они не могли оказать подержку своей пехоте, так как нарушилось управление и связь. В то же время более роты немецких сол- лат перешло в контратаку. Они устреми- лись на наше подразделение с севера- запада. Был момент, когда казалось, нем- цам удастся контратака. Но, улучив мгно- вение, гвардейцы-минометчики дали уложили на месте более сотни немцев. Вслед за этим быт брошен в атаку наш резерз. Он дебил и рассеял остатки немеп- кой роты. Этот удар окончательно решит исход бол в нашу пользу, Впоследствии меткие группы разбитых немецких рот несколько раз переходили в контратаки, но безуспешно.	vol-5310-page-02-seg-011-0761-1466-1474-2722.png
5310	2	748	2726	1457	3865	140	0.94619	Что обеспечит нам успех? Прежде всего елезапность удара. Подготовка боя проводилась скрытно, и враг был застиг- нут врасплох. Во-вторых, было обеспе- чено четкое взаимодействие пехоты и ар- тиллерии. В результате стрельбы прямой наводкой было уничтожено 15 блиндажей дзотов, подавители и уничтожено 20 огневых точек. Точная стрельба артилле- ростов помогла не только дезорганизовать огонь на переднем крае, по половить его батареи и тем самым лишить его пехоту огневой поддержки из глубины. Исключительную, если не решающую роль сыграло умело и быстрое закрепле- за собой занятых позиций. Как толь- ко захватывалась какая-либо позиция, на ней закреплялись специально выделенные для этого подразделения пулеметчаков. Группы закрепления следовать за ударны- Ми пручшами. Захватив вражеские окопы, бойцы проделывали в дзотах новые бойни- цы, расчищали поля обстрела. Командиры тут организовывали систему ружейно- пулеметного огня, а приданные подразде- ления сапер устраивали минные заграждо- ния и разбрасывали малозаметные препят- ствия.	vol-5310-page-02-seg-012-0748-2726-1457-3865.png
5310	2	746	3878	1449	4136	38	0.94019	Основной урок этого боя, как и третьих, один: для успеха надо тщательной под- готовен, глубокой разведки и внезапности действий. Надо еще владеть искусством прочно закрепиться на завоеванном рубе- же, закрепиться так, чтобы потеря его была для врата безвозвратна.	vol-5310-page-02-seg-013-0746-3878-1449-4136.png
5310	2	782	4159	1400	4251	5	0.94516	Подполковник С. ВДОВИН СЕВЕРО-ЗАПАДНЫЙ ФРОНТ,	vol-5310-page-02-seg-014-0782-4159-1400-4251.png
5310	2	1768	1640	2864	1712	12	0.93795	В СТАЛИНГРАДЕ. Штурмовой мостик через Волгу. Снимок нашего спец. фотокорр. Ф. Левишна	vol-5310-page-02-seg-015-1768-1640-2864-1712.png
5310	2	1602	1791	2830	1870	4	0.93940	Штурмовой мостик на Волне	vol-5310-page-02-seg-016-1602-1791-2830-1870.png
5310	2	1485	1896	2194	2575	97	0.94851	Сентябрьские и октябрьские дни под Ст. Сталинградом. Войска, защищающие город, нуждаются в регулярном снабжения продо- вольствием, боеприпасами, в подкреплении резервами. Между тем, за спиной у нас, полноводная Волга, а враг, не жалея сил, держит переправы под огнем минометов, артиллерии и бомбардировочной авиации. Бомандир нашей части поставил сане- рам задачу построить из подручного мате- риала штурмовой мостик. Наиболее подхо- дящими плавучими средствами оказатись бачки из-под горючего грузоподъемностью в 100 кг. каждый. Для большей надежно- сти мостик был спроектирован в виде эла- стичной плавучей сети, которую можно было бы легко восстановить даже при вы- выхода из строя нескольких звеньев.	vol-5310-page-02-seg-017-1485-1896-2194-2575.png
5310	2	1480	2584	2185	3474	140	0.95003	Мостик состоит из отдельных звеньев скрепленных не гвоздями, а вязкой 2-мил- лиметровой проволокой. Каждое звено вя- залось из двух бачков для горючего, двух поперечных жердей 4 метра двух продольных бревен длиною 6 метров. На расстоянии 40 метров выше от оси мо- стз было заброшено 45 якорей, а ниже моста --- 7 ветровых якорей, причем в ка- честве япорей пришлось использовать ко- леса и головок блоков моторов тракторов. Ог каждого якоря были протянуты по два тросика, расплетенные из проволочных на- налог. тросиков были привязаны коротынит, которые быстро заводились в звенья моста. Продольные бревна наводи- мого звена крепитесь к наведенной части 2-миллиметровой проволокой. Расстояние между бачками пол звеньями --- 1 игтр. Тросики от якорей крепились к различным звеньям моста. Поэтому вывод из строя любого якоря не разрушат ни одного кре- пления, а вывод из строя звена не лишал кости ни одного якоря.	vol-5310-page-02-seg-018-1480-2584-2185-3474.png
5310	2	1481	3488	2179	3671	29	0.93584	Командир части торопил своих сапер они во главе с иналитером Пичутиных в таблице справились со своей задачей: на- водка наплавной части мостика была про- изведены в течение трех дней.	vol-5310-page-02-seg-019-1481-3488-2179-3671.png
5310	2	2217	1891	2924	2411	79	0.94460	Тотчас же после вступления в строй для штурмового мостика началась стратная пора. Только за 25 суток, По ночам, через мостик было переправлено семь стрелковых батальонов с их вооружением, эвакуирова- ны все раненые, прошло около 28.000 жи- телей Сталинграда. Кроме того, здесь си- стематически перетравляются боеприпасы и продовольствие: После того, как ширина досчатой части мостика была доведена с 60 до 100 см., по нему стала возможной переправа лошадей. Телефонный кабель, проложенный вдоль перильных стоек, под- держивает связь между берегами реки.	vol-5310-page-02-seg-020-2217-1891-2924-2411.png
5310	2	2211	2428	2916	3058	95	0.94937	Надо ли говорить, что немцы предпри- нимали самые яростные усилия, чтобы уничтожить этот мостик. С 18 сентября по 10 октября немецкая авиация соверши- ла здесь 27 авианалетов. Число одновре- менно налетавших самолетов колебалось от 4 до 17. Было сброшено около 740 фу- гасных и несколько тысяч зажигательных авиабомбА в результат: только два прямых попадания. Эти попадания вывели из строя лишь три звена мостика, на вос- становление которых потребовалось 12 че- ловеко-часов. Помимо ударов с воздуха противник ежедневно выпускает по мости- бу сотни снарядов. Но только два снаряда угодили в мостик, причинив ему незнати- тельное повреждение.	vol-5310-page-02-seg-021-2211-2428-2916-3058.png
5310	2	2207	3077	2911	3629	86	0.95289	Необычайное состязание маленького, но гибкого и упрямого мостика с бешеным огнем фашистов продолжается. Сповз и снова кружатся стервятники, рвутся окрест бомбы, снаряды, мины, вздымая фонтаны воды. А мостик все так же, как ни в чем не бывало, колышется на волжских волнах и все так же струится по нему поток лю- дей, техники, боеприпасов. В живучести этого создания своих рук бойцы и коман- диры нашей части справениво видят сим- вол собственной стойкости, возной изобре- тательности и непреклонной воли устоять во что бы то ни стало. B. ГРЕКОВ.	vol-5310-page-02-seg-022-2207-3077-2911-3629.png
5310	2	2241	3627	2535	3661	2	0.89306	г. СТАЛИНГРАД	vol-5310-page-02-seg-023-2241-3627-2535-3661.png
5310	2	1630	3742	2754	3806	4	0.98102	Техническая конференция в авиачасти	vol-5310-page-02-seg-024-1630-3742-2754-3806.png
5310	2	1478	3833	2175	4100	36	0.94099	ДЕЙСТВУЮЩАЯ АРМИЯ, 17 октября (От наш. корр. ). В авиачасти прове- денз техническая конференция по обмену опытом эксплуатации самолетов, состол- щих на вооружении части. В работе коп- Ференции приняли участие молодые лет- чики и младшие авиаспециалисты.	vol-5310-page-02-seg-025-1478-3833-2175-4100.png
5310	2	1478	4108	2173	4257	19	0.92839	Кроме основных докладчиков на кон- ференции выступил ряд механиков. On' рассказали о практикуемых ими способах, позволяющих быстро находить поврежде-	vol-5310-page-02-seg-026-1478-4108-2173-4257.png
5310	2	2206	3833	2905	4136	40	0.94781	ния в самолете. Особый интерес присут- ствовавших вызвал метод, при помощи которого техник-лейтенант Александров обнаруживает трещину пятой нервюры, да снимая щелезого обтекателя. Интересно также было выступление старшины Шеф- цова, сообщившего о том, как можно бы- сгр снять и поставить стабилизатор.	vol-5310-page-02-seg-027-2206-3833-2905-4136.png
5310	2	2207	4144	2897	4255	15	0.94208	В скором времени состоится еще одна конференция по вопросу эксплуатации с1- полетов в зимних условиях.	vol-5310-page-02-seg-028-2207-4144-2897-4255.png
5310	2	1	4359	1404	4583	6	0.98523	Взаимодействие артиллерии с пехотой в предгорьях	vol-5310-page-02-seg-029-0001-4359-1404-4583.png
5310	2	5	4600	712	6299	222	0.94587	Действия B горно-лесистых районах предъявляют командиру-артиллеристу ряд специфических требований. Оборона строится здесь обычно в виде отдельных узлов сопротивления. Приходится считать ся с тем, что наличие укрытых от на- блюдения горных троп и лесных просек, a также непоражаемых пространств соз- дает постоянную угрозу обхода с флангов. Централизованное управление артиллери- ей затруднено. Эти обстоятельства выд- вешают на первый план инициативу и находчивость отцельных артиллерийских командиров. Рассмотрим, как наши артиллеристы учитывают на практике все эти особен- ности использования артиллерии в гор- но-лесистых районах. Противник значи- тельными силами мотолехоты и танков стал развивать наступление вдоль шос- сейной дороги, устремляясь на юго-за- пал. Он имел здесь большое численное превосходство и оказывал сильное давле- пво на наши части. Требовалось любой пилой задержать противника, чтобы вы- играть время для перегруппировки сил. Прежде всего было налажено самое тес- пое взаимодействие артиллерии с поддер- живаемой стрелковой частью. Командир этой части все время точно знал, где находятся то или иные орудия, куда и каким образом можно вызвать огонь ар- тиллерии, гле имению располагаются ар- таллерийские наблюдатели. Командир ар- артиллерийской группы и его штаб прини- мали активное участие организации обороны стрелковых подразделений и бы- ли точно информированы, какими сила- ми прикрывается то или иное направле- ние, где расположены огневые средства пехоты и ее передовые подразделения. Артиллерийский начальник и командир стрелковой части с наблюдательного пунк- та тщательно просмотрели впередилежащую местность. Поскольку противнее располагал боль-	vol-5310-page-02-seg-030-0005-4600-0712-6299.png
