volume_number	page_number	x1	y1	x2	y2	tokens_count	mean_confidence	text	image
5789	1	877	253	2085	313	3	0.91276	Смерть немецким оккупантам.	vol-5789-page-01-seg-001-0877-0253-2085-0313.png
5789	1	200	350	2131	698	9	0.93795	: . ЦЕНТРАЛЬНЫЙ ОРГАН НАРОДНОГО КОМИССАРИАТА ОБОРОНЫ СОЮЗА ССР	vol-5789-page-01-seg-002-0200-0350-2131-0698.png
5789	1	242	723	509	779	2	0.91375	109 (5789)	vol-5789-page-01-seg-003-0242-0723-0509-0779.png
5789	1	600	723	1402	777	5	0.95856	9 мая 1944 г., вторник	vol-5789-page-01-seg-004-0600-0723-1402-0777.png
5789	1	1850	723	2096	771	2	0.83824	ЦЕНА 20 КОП.	vol-5789-page-01-seg-005-1850-0723-2096-0771.png
5789	1	2256	352	3191	432	8	0.90442	Указ Президиума Верховного Совета СССР (1 стр. ).	vol-5789-page-01-seg-007-2256-0352-3191-0432.png
5789	1	2258	434	3191	519	13	0.93045	От Советского Информбюро. Оперативные сводки за 7 и 8 мая (1 стр. ).	vol-5789-page-01-seg-008-2258-0434-3191-0519.png
5789	1	2254	525	3195	750	22	0.91511	Письмо ленинградских партизан, партизанок и трудящихся освобожденных городов районов Ленинградской области великому вождю народов Маршалу Советского Союза товарищу Сталину (2 стр. ).	vol-5789-page-01-seg-009-2254-0525-3195-0750.png
5789	1	3289	348	4230	752	56	0.91566	Bo Во имя скорейшей победы над врагом, - С боль- шим подъемом продолжается подписка на Третий Государственный Военный Заем (2 стр. ). П. Слесарев, Б. Галин. Путь наступления (3 стр. ). Подполковник М. Балакин. -- Предвидение в бою (3 стр. ). Подполковник Н. Прокофьев. Бои под Сева- стополем (3 стр. ). Вас. Гроссман. «Сталинградцы» (4 стр.).	vol-5789-page-01-seg-010-3289-0348-4230-0752.png
5789	1	246	850	1508	925	3	0.89987	Сообщение Наркомфина СССР	vol-5789-page-01-seg-011-0246-0850-1508-0925.png
5789	1	209	942	1521	1177	34	0.95888	Выпущенный 5 мая 1944 года Третий Государствен- ный Военный Заем на сумму 25 миллиардов рублей раз- мещен к исходу 6 мая на 25 миллиардов 213 миллионов рублей. Таким образом, установленная сумма займа, пере- выполнена.	vol-5789-page-01-seg-012-0209-0942-1521-1177.png
5789	1	303	1183	1471	1286	8	0.95642	Подписка на заем продолжается. Наркомфин СССР А. ЗВЕРЕВ	vol-5789-page-01-seg-013-0303-1183-1471-1286.png
5789	1	257	1294	540	1333	4	0.93551	7 мая 1944 г.	vol-5789-page-01-seg-014-0257-1294-0540-1333.png
5789	1	280	1412	1446	1625	5	0.96315	Блестящий успех Третьего Военного Займа	vol-5789-page-01-seg-015-0280-1412-1446-1625.png
5789	1	201	1660	863	3739	311	0.95696	В ряду замечательных событий третьего года Отечественой войны почетное место займет блестящий успех Третьего Военно- го Займа. исходу 6 мая, за два дня, советский народ и его Красная Армия дали взаймы государству 25.213.000.000 рублей, превысив намеченную правитель- ством сумму на много десятков миллионов. Продолжающаяся повсеместно подписка всё увеличивает мощный поток средств на оборону страны. Никогда еще в истории советских внутренних государственных займов не были достигнуты в такой ко- роткий срок столь крупные результа- ты. Советские люди в тылу и на фронте с неслыханным единодушием и щедростью откликнулись на призыв правительства, партии. Внося свою лепту в общее дело, народ показывает свою сплоченность, волю борьбе, готовность отдать все силы и средства делу победы над врагом. Война принесла нашим людям немалые трудности и лишения. Немецко-фашист- ские захватчики разорили ограбили богатейшие области нашей страны. Без- возвратно погибло огромное количество ма- териальных ценностей. Но величие наше- го социалистического общества в том и состоит, что вопреки разрушительным сп- лам войны, вопреки вандализму и нена- сытному разбою врагов Советский Союз изо дня в день находит и мобилизует всё новые и новые средства для борьбы. бы- стро восстанавливает хозяйство в районах, пострадавших от немецкой оккупации, и бесперебойно питает всем необходимым ги- гантские боевые операции Красной Ар- мии. И то, что народы нашей страны именно в трудных условиях военного вре- мени особенно успешно реализуют внут- ренние займы, является одним из самых убедительных доказательств неисчерпае- мых сил советского государства. В прошлом году военный заем был объявлен на 12 миллиардов рублей, а размещен на 20 миллиардов 323 мил- лиона. Теперь сумма займа определена правительством в 25 миллиардов рублей. но уже в первые два дня эта сумма пе- ревыполнена. Нет никакого сомнения, что энтузиазм советских людей даст много миллиардов рублей сверх государственного плана. Много и нельзя было ожидать! Народ-герой, народ-воин, не щадящий своей крови в боях за честь и независи- мость Родины, c тем большей радостью отдает этому святому делу свои денежные обепежания.	vol-5789-page-01-seg-016-0201-1660-0863-3739.png
5789	1	207	3747	867	3962	34	0.93378	нашей стране, когда дело идет снабжении фронта, о воссоздании разру- шенных врагом заводов и фабрик, о кро- вавых битвах и веткой работе, деньги могучее, благородное оружие борьбы и труда. Еще Петр Первый говорил, что	vol-5789-page-01-seg-017-0207-3747-0867-3962.png
5789	1	879	1656	1533	2348	102	0.95569	"деньги -- суть артерия войны". Всегда в критические моменты, когда на полях сражений решалась судьба Отчизны, наш народ не думал о личном благе, но своим достоянием приходил на помощь rocky- дарству. В Отечественную войну с немец- кими захватчиками эта благородная черта проявилась с невиданным блеском. Со всех концов страны от таежных заимок до окопов передовых позиций идут вести об успехе займа. Рабочий, кол- хозник, интеллигент - каждый совет- ский человек считает своим гражданским долгом участвовать в великом всенародном вкладе на оборону. Многие вносят под- писные суммы наличными деньгами, стро- мазь поскорее видеть свой взнос, вопло щенным в образе танков, орудий, само- летоб.	vol-5789-page-01-seg-018-0879-1656-1533-2348.png
5789	1	879	2354	1538	3962	249	0.95696	Воины Красной Армии вместе с тылом горячо откликнулись на зов правитель- ства. Они хотят содействовать скорейшему разгрому врага не только боевым умением и ратными трудами, но и своими сбере- жениями. Идя в ногу со всем народом, Красная Армия буквально в течение счи- танных часов реализовала заем на огром- ные суммы. Во главе передовиков займа идут славные дивизии 1-го Украинского, 1-го Белорусского и Ленинградского фрон- тов. Естественно, что именно герои весны 1944 года, освободители Украины и Ле- нинграда не только в боях, но и в этом патриотическом подвиге народа идут первых рядах. C ними перекликаются боевые резервы фронта красноармейцы, сержанты и офицеры Московского и Ор- ловского военных округов, также пока- завшие высокие образцы организованного размещения займа. Продолжая подписку, фронты и округа должны добиться охвата всех военнослужащих до единого. Третий Военный Заем --- это только одна небольшая страница из истории ве- ликой Отечественной войны. По каким поистине богатырским духом веет от этих сухих цифр! Есть и существуют в мире единицы измерения, способные отразить красоту и величие нашего народа, сталь- ную крепость его несгибаемой воли и мужества, отвагу и самоотверженность его сынов и дочерей, то к их числу мож- но отнести итоги размещения займа за два дня. Мы справедливо гордимся эти- ми итогами, как ярким показателем на- шей мощи. Народный голос назвал Третий Воен- ный Заем "Займом Победы". Третий год войны принес исторические победы со- ветскому оружию. Новые усилия совет- ских людей, одним из выражений кото- рых является новый заем, помогут нам быстрее разгромить врага и приведут нас полной и окончательной победе.	vol-5789-page-01-seg-019-0879-2354-1538-3962.png
5789	1	382	4043	1377	4082	5	0.92940	УКАЗ ПРЕЗИДИУМА ВЕРХОВНОГО СОВЕТА СССР	vol-5789-page-01-seg-020-0382-4043-1377-4082.png
5789	1	363	4101	1398	4232	7	0.94241	награждении орденами и медалями партизан Украинской ССР	vol-5789-page-01-seg-021-0363-4101-1398-4232.png
5789	1	211	4239	865	4345	14	0.95677	За доблесть и м жество, проявленные в партизанской борьбе против немецко-фа- шистских захватчиков, наградить:	vol-5789-page-01-seg-022-0211-4239-0865-4345.png
5789	1	373	4362	706	4393	2	0.93529	ОРДЕНОМ ЛЕНИНА	vol-5789-page-01-seg-023-0373-4362-0706-4393.png
5789	1	240	4407	777	4593	24	0.95889	1. Акаева Сунгура Алихаджеевича... 2. Архипович Андрея Васильевича. 3. Астахова Романа Яковлевича. 4. Белова Алексея Михайловича, 5. Лебина Федора Ивановича. 6. Плюш Михаила Ивановича.	vol-5789-page-01-seg-024-0240-4407-0777-4593.png
5789	1	223	4624	854	6046	175	0.95906	ОРДЕНОМ КРАСНОГО ЗНАМЕНИ 1. Агеенко Михаила Фадеевича. 2. Адаменко Гавриила Вакуловича. 3. Андакулова Курбана Куланджума. 4. Анисимова Сергея Васильевича. 5. Багинского Мечеслава Мечиславовича... 6. Барытько Василия Николаевича. 7. Беляй Иосифа Никитича. 8. Богданова Владимира Борисовича. 9. Барканова Алексея Максимовича. 10. Борова Ивана Ильича. 11. Блащенко Ивана Ивановича. 12. Бугаева Федора Семеновича, 13. Войцеховского Виктора Васильевича. 14. Гавриченко Афанасия Степановича. 15. Гулянок Николая Ивановича. 16. Гончаренко Антона Александровича. 17. Грива Григория Иосифовича. 18. Грицуна Спиридона Егоровича. 19. Гришина Ивана Алексеевича. 20. Деменкова Ивана Афанасьевича, 21. Долбина Григория Егоровича. 22. Долбина Николая Ивановича. 23. Дриженог Петра Алексеевича. 24. Дудкина Матвея Павловича. 25. Дюбина Ивана Акимовича. 26. Егорова Петра Николаевича. 27. Егупова Петра Ивановича. 28. Егупова Михаила Федоровича. 29. Захаренко Анатолия Николаевича. 30. Зверева Аркадия Филипповича, 31. Зубашева Митрофана Дмитриевича. 32. Зубок Даниила Абрамовича. 33. Иванова Михаила Ивановича. 34. Ивашкина Григория Тихоновича. 35. Кабанова Василия Ивановича. 36. Капитонова Алексея Георгиевича. 37. Качалину Октябрину Самуиловну. 38. Кибец Степана Онуфриевича. 39. Кириенко Михаила Фомича. 40. Ковалева Михаила Михайловича. 41. Коваленко Григория Васильевича. 42. Колотило Ивана Филипповича. 43. Кокоринова Бориса Михайловича.	vol-5789-page-01-seg-025-0223-4624-0854-6046.png
5789	1	898	4249	1535	4932	81	0.95984	44. Коновалова Алексея Николаевича. 45. Кононенко Григория Филипповича. 46. Конопелько Александра Андреевича. 47. Конча Ивана Андреевича. 48. Конюхова Валентина Алексеевича. 49. Карпенко Филиппа Трофимовича. 50. Кременецкого Виктора Александровича 51. Кузовкова Игната Васильевича. 52. Кушкова Мархаба Махмудовича. 53. Лакудас Константина Григорьевича. 54. Левицкого Порфирия Павловича. 55. Лемешкина Виктора Васильевича. 56. Лепетова Алексея Тимофеевича. 57. Лещинец Ивана Исааковича. 58. Лищенко Филиппа Сергеевича. 59. Лысенко Федора Ильича. 60. Макарова Ефима Филипповича. 61. Маслакова Анатолия Васильевича. 62. Маслюкова Николая Николаевича. 63. Мирошникова Александра Максимо- вича	vol-5789-page-01-seg-026-0898-4249-1535-4932.png
5789	1	896	4943	1490	5996	129	0.95940	64. Набока Сергея Федоровича. 65. Нечаева Василия Степановича. 66. Новикова Ивана Павловича. 67. Осипова "Владимира Сергеевича. 68. Панина Григория Лукьяновича. 69. Панчук Дмитрия Павловича. 70. Пастухова Льва Николаевича. 71. Полякова Георгия Николаевича. 72. Попова Василия Павловича. 73. Попова Григория Елисеевича. 74. Потуржанского Ивана Федотовича 75. Прокофьева Василия Никитовича. 76. Прокопенко Павла Алексс хвича. 77. Рожкова Михаила Петровича. 78. Свиридова Ивана Николаевича. 79. Свиридову Марию Гавриловну. 80. Семенец Ивана Никитовича. 81. Сергиенко Василия Осиповича. 82. Серова Алексея Константиновича. 83. Сурож Михаила Тарасовича. 84. Склярова Андрея Аксеновича. 85. Сытник Павла Петровича. 86. Спица Сергея Константиновича. 87. Судим Ивана Сергеевича. 88. Сыроеда Алексея Яковлевича. 89. Терехова Василия Васильевича. 90. Терешина Василия Ильича. 91. Тихонова Сергея Петровича. 92. Терехина Сергея Александровича. 93. Федорова Федора Платоновича. 94. Фрыкова Сергея Мартемьяновича. 95. Хричева Якова Дмитриевича.	vol-5789-page-01-seg-027-0896-4943-1490-5996.png
5789	1	1033	6013	1398	6048	2	0.91987	(Продолжение следует).	vol-5789-page-01-seg-028-1033-6013-1398-6048.png
5789	1	1685	846	4089	1065	24	0.98148	Подписание между правительством союза советских социалистических республик правительством чехословацкой республики об отношениях между советским главнокомандующим чехословацкой администрацией после вступления советских войск на территорию чехословакии	vol-5789-page-01-seg-029-1685-0846-4089-1065.png
5789	1	1544	1086	2202	1233	20	0.95035	8 мая 1944 года в Лондоне подписано «Соглашение об отношениях между Совет- ским Главнокомандующим и Чехословац- кой Администрацией после вступления	vol-5789-page-01-seg-030-1544-1086-2202-1233.png
5789	1	2225	1088	2877	1152	6	0.93678	советских войск на территорию Чехосло- вакии».	vol-5789-page-01-seg-031-2225-1088-2877-1152.png
5789	1	2227	1160	2883	1229	9	0.94811	Соглашение подписано по уполномочию Правительства СССР послом СССР при	vol-5789-page-01-seg-032-2227-1160-2883-1229.png
5789	1	2895	1084	3556	1227	18	0.93373	Правительстве Чехословацкой Республики B. 3. Лебедевым и по уполномочию Пра- вительства Чехословацкой Республики ис- полняющим обязанности министра иност-	vol-5789-page-01-seg-033-2895-1084-3556-1227.png
5789	1	2520	1277	3266	1335	7	0.90912	с от л ше н и е	vol-5789-page-01-seg-034-2520-1277-3266-1335.png
5789	1	3576	1083	4232	1213	13	0.90753	ратных дел Чехословацкой Республики государственным министром г. Г. Рипка. Текст Соглашения публикуется ниже.	vol-5789-page-01-seg-035-3576-1083-4232-1213.png
5789	1	1792	1358	3989	1465	15	0.94915	об отношениях между Советским Главнокомандующим и Чехословацкой Администрацией после вступления советских войск на территорию Чехословакии	vol-5789-page-01-seg-036-1792-1358-3989-1465.png
5789	1	1548	1494	2206	1931	48	0.94022	Правительство Союза Советских Социа- листических Республик и Правительство Чехословацкой Республики, желая, чтобы отношения между Советским Главно- командующим и Чехословацкой Алмини- станцией на территории Чехословацкой Республики после вступления советских войск на территорию Чехословакии были решены в духе дружбы и союза, суще- ствующего между обеими странами, согла- сились на нижеследующем.	vol-5789-page-01-seg-037-1548-1494-2206-1931.png
5789	1	1552	1944	2208	2339	49	0.94765	1. После вступления в результате воен- ных операций советских (союзнических) войск на территорию Чехословакии, вер- ховная власть и ответственность во всех делах, относящихся к ведению войны будет находиться в зоне военных опера- ций на время, необходимое для осуще- ствления этих операций, в руках Главно- командующего советскими (союзнически- ми) войсками.	vol-5789-page-01-seg-038-1552-1944-2208-2339.png
5789	1	1556	2350	2208	2504	14	0.93891	2. Для освобожденной территории будет назначен чехословацкий правительствен- ный уполномоченный, обязанностью кото- рого будет:	vol-5789-page-01-seg-039-1556-2350-2208-2504.png
5789	1	1560	2514	2208	2629	14	0.93731	a) создать и руководить, согласно че- хословацких законов, администрацией на территории, очищенной от неприятеля;	vol-5789-page-01-seg-040-1560-2514-2208-2629.png
5789	1	2223	1494	2877	1567	5	0.92881	б) воссоздать чехословацкие военные силы;	vol-5789-page-01-seg-041-2223-1494-2877-1567.png
5789	1	2225	1571	2881	2079	54	0.94567	b) обеспечить активное содействие Че- хословацкой Администрации Советскому (союзному) Главнокомандующему, а имен- но: давать местным властям соответствую- щие указания, исходя из потребностей в желания Советского (союзного) Главно- командующего. 3. Чехословацкие воинские части, нахо- дящиеся в момент вступления советских (союзнических) армий на чехословацкую территорию в их составе, будут немедлен- но использованы на чехословацкой тер- ритории.	vol-5789-page-01-seg-042-2225-1571-2881-2079.png
5789	1	2227	2087	2879	2318	23	0.94806	4. Для обеспечения связи между Совет- ским (союзным) Главнокомандующим чехословацким правительственным упол- номоченным при Советском (союзном) Главнокомандующем будет назначена че- хословацкая военная миссия.	vol-5789-page-01-seg-043-2227-2087-2879-2318.png
