volume_number	page_number	x1	y1	x2	y2	tokens_count	mean_confidence	text	image
5832	1	884	284	2075	346	4	0.93063	Смерть неме жим охвупантам.	vol-5832-page-01-seg-001-0884-0284-2075-0346.png
5832	1	184	377	2137	725	7	0.99498	ЦЕНТРАЛЬНЫЙ ОРГАН НАРОДНОГО КОМИССАРИАТА ОБОРОНЫ СОЮЗА ССР	vol-5832-page-01-seg-002-0184-0377-2137-0725.png
5832	1	221	757	496	811	2	0.91809	152 (5832)	vol-5832-page-01-seg-003-0221-0757-0496-0811.png
5832	1	844	763	1373	811	5	0.92527	28 июня 1944 г., среда	vol-5832-page-01-seg-004-0844-0763-1373-0811.png
5832	1	1825	752	2085	807	2	0.88198	ЦЕНА 20 КОП.	vol-5832-page-01-seg-005-1825-0752-2085-0807.png
5832	1	2221	286	4261	763	33	0.95293	Войска 3-го Белорусского фронта, развивая наступление, овладели вчера городом и оперативно важным железнодорожным узлом Орша-мощным бастионом обороны немцев, прикрывающим Минское направление. - Слава доблестной Красной Армии, освобождающей родную советскую землю от фашистских захватчиков!	vol-5832-page-01-seg-006-2221-0286-4261-0763.png
5832	1	165	884	1184	2820	152	0.95002	----- Верховного Глав - Генералу армии Войска 3-го БЕЛОРУССКОГО фронта, развивая наступление, сегодня, 27 июня, в результате стремительного обходного ма- невра в сочетании с фронтальной атакой овладели городом и оперативно важным железнодорожным узлом ОРША -- мощ- ным бастионом обороны немцев, прикры- вающим Минское направление. В боях за овладение ОРШЕЙ отличились войска генерал-лейтенанта ГАЛИЦКОГО, генерал-лейтенанта ГЛАГОЛЕВА, генерал- майора ШАФРАНОВА, генерал-майора РФ- ЖИКОВА, генерал-майора ПЕТЕРС, гене- рал-лейтенанта КОШЕВОГО, генерал-майо- ра ПРОВАЛОВА, генерал-майора ОЛЕШЕ- ДВА, полковника КОВТУНОВА, полковника КОВАЛЕВСКОГО, полковника КЛИМАХИ- НА, генерал-майора БЕРЕСТОВА, полков- : : ника ПОЛЕВИК, генерал-майора СТРИ- ЖЕНКО, полковника ДЕМИНА, генерал- майора БОРОДКИНА; артиллеристы гене- рал-лейтенанта артиллерии СЕМЕНОВА, ге- нерал-майора артиллерии СЕМИНА, гене- рал-майора артиллерии ПОПОВА, гене- рал-майора артиллерии БЕЛЯКОВА, гене- рал-майора артиллерии САЗОНОВА, пол- ковника ПИЛИПЕНКО, полковника ФЕДО- ка ТОВА, полковника ХАСИНА, полковника КИЙ; танкисты генерал-майора танковых войск БУРДЕЙНОГО, генерал-майора тан- ковых войск НЕЦВЕТАЙЛО, полковника БУРЛЫГА, полковника БУКОВА, полковни- - - ка ЦИНЧЕНКО, полковника ЛУШПА, пол- ковника ДАГЕЛИСА; летчики генерал-лей-	vol-5832-page-01-seg-007-0165-0884-1184-2820.png
5832	1	234	884	2202	3068	175	0.95355	" - нокомандующего - "ЧЕРНЯХОВСКОМУ - тенанта авиации БЕЛЕЦКОГО, генерал-лей- тенанта авиации САВИЦКОГО, генерал-лей- тенанта авиации УШАКОВА, генерал-майо- ра авиации ГОРЛАЧЕНКО, генерал-лейте- нанта авиации БЛАГОВЕЩЕНСКОГО, гене- рал-майора авиации ЗАХАРОВА, полковни- :: ка ПРУТКОВА, полковника ЗИМИНА; сапе- . . . рф генерал-майора инженерных войск ЗВО РЕВА, полковника ЗАХАРОВА, подполков- ника ЦЕЛИЩЕВА, майора КРАВЧЕНКО, майора СЕМЕНОВА, полковника ПРОНЕ- ВИЧА, майора ТРОЯНОВА, майора МАСЕН- ЗОНА и связисты генерал-майора войск связи БУРОВА, полковника ДАВИДЕНКО, полковника БЕЛЫШЕВА. B ознаменование одержанной победы соединения и части, наиболее отличившиеся в боях за освобождение ОРШИ, предста- : вить к присвоению наименования «ОРШАН- СКИХ» и к награждению орденами. Сегодня, 27 июня, в 22 часа столица на- шей Родины МОСКВА от имени Родины салютует доблестный войскам 3-го Бело- русского фронта, овладевшим городом ОРША, - двадцатью артиллерийскими зал- пами из двухсот двадцати четырех орудий. За отличные боевые действия ОБ'ЯВЛЯЮ БЛАГОДАРНОСТЬ руководимым Вами вой- скам, участвовавшим в боях за освобожде- ние ОРШИ. Вечная слава героям, павшим в боях за свободу и независимость нашей Родины! Смерть немецким захватчикам! Верховный Главнокомандующий Маршал Советского Союза 27 июня 1944 года. и. сталин.	vol-5832-page-01-seg-008-0234-0884-2202-3068.png
5832	1	355	3137	2010	3241	3	0.90932	За освобождение белоруссии.	vol-5832-page-01-seg-009-0355-3137-2010-3241.png
5832	1	155	3268	827	3808	83	0.95680	С каждым днем наши доблестные вой- ска продвигаются всё дальше по терри- тории Белоруссии, решительно и быстро очищая ее от немецко-фашистских окку- пантов. Уже освобождены Витебск и Жло- бин, уже реет красное знамя над Оршей, идут бон на окраинах Могилева и Бобруй- ска, на Минском направлении. Только за последние два дня Красная Армия вызов- лила из гитлеровской неволи более 3.000 населенных пунктов. Плет массовое изгна- ние врага с белорусской земли, бьет час полного освобождения Белорусской Совет- ской Социалистической Республики от гне- та извергов-ненцев.	vol-5832-page-01-seg-010-0155-3268-0827-3808.png
5832	1	148	3810	823	5465	245	0.95844	Невиданное горе, безмерные страдания принес фашизм белорусскому народу. Воз- намерившись превратить этот. цветущий край, неотъемлемую часть Советского Со- юза, в колонию немецких империалистов, в сельскохозяйственную провинцию Гер- мании, гитлеровцы затопили белорусскую землю слезами и кровью народной, разо- рили и опоганили всё, что было создано здесь трудом многих поколений. Немцы разрушили крупнейшие города республики, высокомерно подчеркивая при этом, что «нет необходимости восстанавливать раз- рушенные города, так как город порт на белорутина, потому что он привязан земле». Они пытались стереть с лица зем- ли всякие следы государственной само- стоятельности Белоруссии, ее напиопаль- ной культуры, обрекая наших братьев- белоруссов на страшную участь рабов, не имеющих никаких прав, кроме права на смерть. Но Белоруссия не дрогнула, не пала ниц перед подлым и озверелым врагом. С первых дней войны она вместе со всеми народами Советского Союза поднялась на священную борьбу против немецких окку- пантов. На фронте, в рядах Красной Ар- мии, и во вражеском тылу, в огне пар- тизанского движения, всюду отважные сыны и дочери Белоруссии самоотвержен- но и геройски бились с врагом. Во мраке фашистской ночи мужествен- ный белорусский народ, народ советских патриотов, никогда не терял веры в свое грядущее освобождение. Он знал, что вся великая и дружная семья советских наро- дов болеет его болью, помнит о нем не щадя сил своих, подготавливает раз- гром кровавых поработителей Белоруссии. Он верил, что Красная Армия но оставит его в беде, придет к нему на помощь, очистит белорусскую землю от немецко- фашистской погани. Красная Армия оправдывает доверие и надежду белорус- ского народа!	vol-5832-page-01-seg-011-0148-3810-0823-5465.png
5832	1	842	3264	1508	3907	91	0.95578	Выполняя свою священную и благород- ную освободительную миссию, советские войска в минувших боях освободили уже около полутора миллионов квадратных ки- лометров оккупированной врагом террито- рпи. Мы вернули к жизни Дон и Кубань. земли Орловщины и Смоленска, Курска, по- для Украины и Крымские степи. Наши вой- ска вызволили из немецко-фашистской не- воли миллионы советских людей, лишился немцев источников промышленного сырья и продовольствия в оккупированных имп областях, уничтожили миллионы гитлеров- ских насильников, грабителей и убийц. А ныне советские воины беспощадно бьют врага и на земле Белоруссии, стальной метлой выметая отсюда немецко-фашист- ских захватчиков.	vol-5832-page-01-seg-012-0842-3264-1508-3907.png
5832	1	836	3918	1504	4882	145	0.96359	Через Белоруссию пролегает кратчай- ший путь на запад, к разбойничьему ло- гову фашистских агрессоров. Вот почему враг с особенным ожесточением и упорст- вом отстаивает здесь каждую пядь земли, каждую свою позицию. На всех участ- ках нынешнего наступления Красной Ар- немцы создали мощные оборони- тельные системы, которые они сов- сем недавно хвастливо называли «не- поколебимым бастионом». Предчувствуя Возможность наших ударов, немпы усилен- но готовились к тому, чтобы отразить их. Мы помним, как, например, в дни, пред- шествовавшие наступлению в районе Ви- тебска, оперативная сводка Совинформбю- ро почти ежедневно сообщала о том, что противник снова и снова значительных силами ведет здесь разведку боем. Гер- манское командование пыталось разгадать планы нашего командования и стягивало сюда резервы, чтобы помешать осущест- влению этих планов. Но что ни делала гитлеровцы, - стальной вал нашего на- ступления смел все преграды, подобно то- ху, как вешние воды дробят и сметают ле- ледяной покров.	vol-5832-page-01-seg-013-0836-3918-1504-4882.png
5832	1	834	4892	1504	5463	87	0.95624	Витебск, крупный областной центр Бе- лоруссии, был важным стратегическим уз- лом обороны немцев на западном направле- пии. Этот город принадлежал числу тех стратегических пунктов, за которые враг цеплялся особенно долго и настойчиво. И тем не менее, когда грянул час борьбы за Витебск, назначенный нашим Верховным Главнокомандованием, - город СЧИ- танные дни был очищен от немцев Преодолевая сопротивление врага, наши войска наносят ему тяжелейший, невос- полнимый урая в технике, в людях. Пять германских дивизий, предназначавшихся Гитлером для обороны Витебска, были за- хвачены в кольцо и пыне полиостью раз-	vol-5832-page-01-seg-014-0834-4892-1504-5463.png
5832	1	1527	3260	2191	3553	42	0.95405	гремлины. 20.000 трупов, 10.000 плен- пых что осталось от этих дивизий! Еще пять вражеских дивизий окружены нашими войсками в районе Бобруйска. В бушующем пламени наступления Красной Армии горит и плавится немецкая сталь, рушатся укрепленные рубежи немецкой бороны, тают и гибнут немецкие дивизии.	vol-5832-page-01-seg-015-1527-3260-2191-3553.png
5832	1	1525	3566	2189	4170	88	0.96426	Славная победа у стен Витебска, взя- тне млобина, освобождение Орши, успеш- ное продвижение наших войск на всех ос- тальных участках наступления еще раз наглядно свидетельствуют о непоборимой сила советского оружия, выкованного без- заветным патриотическим трудом всего со- ветского народа. Умелая стратегия наше- го Верховного Главнокомандования, проду- манная и решительная тактика советских генералов и офицеров, геройство и воин- ское мастерство бойнов, могучая наша техника всё это вместе взятое ведет Красную Армию от победы к победе в ее великой борьбе за освобождение родной зе- мли, за разгром немецко-фашистских за- хватчиков.	vol-5832-page-01-seg-016-1525-3566-2189-4170.png
5832	1	1525	4182	2189	4324	20	0.93108	Весь советский народ радуется и гор- дится доблестными делами освободителей Белоруссии, вся наша страна провозгла- шает славу героям победных битв!	vol-5832-page-01-seg-017-1525-4182-2189-4324.png
5832	1	1521	4332	2187	4797	70	0.95781	Выдающиеся успехи уже увенчали рат- пый труд войск 1-го Прибалтийского, 1-го 2-го и 3-го Белорусских фронтов. Опи на- несли врагу тяжелый укроп, богатырским уларом разрубили оковы, сковывавшие мно сотни тысяч наших братьев и сестер белоруссов. Но гнусные немецко-фашист- ские палачи еще топчут белорусскую зем- лю, еще льется на ней кровь невинных людей. Тела погибших зовут нас к мще- илю, стоны порабощенных призывают быстрейшему разгрому и изгнанию врага из пределов Белорусски.	vol-5832-page-01-seg-018-1521-4332-2187-4797.png
5832	1	1521	4811	2189	5242	68	0.95541	Воины-белоруссы в своем обращении 5 партизанам и партизанкам, ко всему бело- русскому народу писали: «Мы помним всё и за каждую каплю невинной крови возда- врагу сторипей! Ни одной слезы не простим, ни одной раны не забудем, ни одной обиды не пропустим, за всё рассчитаемся сполна и в грозной расплате своей не поскупимся...» В этих словах выражены мысли и чувства всех наших воинов, сражающихся теперь за освобок- лепие Белоруссии.	vol-5832-page-01-seg-019-1521-4811-2189-5242.png
5832	1	1521	5251	2185	5465	34	0.94128	Мщение и смерть немецко-фашистским захватчикам! Мщение и смерть поработи- телям Белоруссии! Во имя правого мездия, во имя спасения миллионов на- ших братьев и сестер, -- еще крепче уда- ры по врагу, еще быстрее вперед!	vol-5832-page-01-seg-020-1521-5251-2185-5465.png
5832	1	569	5544	1771	5601	3	0.93241	трудовой салют москвичей	vol-5832-page-01-seg-021-0569-5544-1771-5601.png
5832	1	146	5634	813	6073	59	0.95126	Новое победоносное наступление Крас- ной Армии вызвало на предприятиях сто- лицы большой патриотический подъем. Ра- бочие, инженеры и техники отвечают на боевые успехи наших доблестных войск новым напряжением сил для помощи фронту. Под победный гром артиллерийских зал- пов, которыми Москва от имени Родины салютовала наступающим дивизиям Лепип- градского фронта. сталевары 1-го марте- новского цеха завода "Серп и молот» ва	vol-5832-page-01-seg-022-0146-5634-0813-6073.png
5832	1	834	5628	1500	6063	60	0.94725	рили последние тонны стали для завер- шепия полугодовой программы. Вчера они закончили выполнение июньского плана. Сверх шестимесячного задания выдано 2 тысячи тони металла. : Не остаются в долгу перед фронтом стахановцы автомобильного завода имени Сталина. Коллектив термического цеха до- срочно выполнил июньскую программу. В честь Витебских Жлобинских диви- зий на стахановскую вахту стали рабочие завода «Динамо» пм. Нирова. Они досроч-	vol-5832-page-01-seg-023-0834-5628-1500-6063.png
5832	1	1521	5630	2181	5732	9	0.94581	по закончили полугодовую программу сейчас выпускают сверхилаповую продук цию,	vol-5832-page-01-seg-024-1521-5630-2181-5732.png
5832	1	1521	5740	2183	5913	21	0.95135	Горячо откликнулись на успехи Красной Армии ткани Трехгорной мануфактуры. Завершив шестимесячный план, опи те- перь выдают много продукции сверх про- граммы,	vol-5832-page-01-seg-025-1521-5740-2183-5913.png
5832	1	1521	5921	2181	6021	13	0.94458	Растет выпуск сверхплановой продук ции в эти дни и па других предприятиях Москвы	vol-5832-page-01-seg-026-1521-5921-2181-6021.png
5832	1	2023	6028	2137	6063	1	0.91443	(TACC)	vol-5832-page-01-seg-027-2023-6028-2137-6063.png
5832	1	2275	2308	4189	2435	45	0.93432	Вручение Послом США г-ном В. A. Гарриманом тов. И. В. Сталину почетных грамот Прези- дента Рузвельта для Ленинграда и Сталинграда. На снимке (слева направо): г-н Э. Пейдж, тов. В. Павлов, тов. В. М. Молотов, тов. И. В. Сталин, г-н В. А. Гарриман. Фото Н. Власика	vol-5832-page-01-seg-028-2275-2308-4189-2435.png
5832	1	2246	2504	4239	2752	20	0.89620	Вручение Послом США г-ном В. А. Гарриманом тов. И. В. Сталину почетных грамот Президента Рузвельта • для Сталинграда и Ленинграда	vol-5832-page-01-seg-029-2246-2504-4239-2752.png
5832	1	2218	2766	3218	3012	43	0.92454	26 июня в Кремле Чрезвычайный и Полномочный Посол Соединенных Штатов Америки г-н В. А. Гарри- ман вручил Председателю Совета Народных Комисса- ров СССР тов. И. В. Сталину почетные грамоты Рези- дента Рузвельта для передачи городу Сталинграду и городу Ленинграду в ознаменование героической обо-	vol-5832-page-01-seg-030-2218-2766-3218-3012.png
5832	1	3247	2760	4243	2864	13	0.93489	раны этих городов. Грамоты подписаны г-ном Рузвель том от имени народа Соединенных Штатов.	vol-5832-page-01-seg-031-3247-2760-4243-2864.png
5832	1	3249	2870	4245	3002	15	0.91757	При вручении почетных грамот присутствовал Народ- ный Комиссар Иностранных Дел СССР тов. В. М. Молотов.	vol-5832-page-01-seg-032-3249-2870-4245-3002.png
5832	1	2337	3074	4120	3216	13	0.95384	Письмо Президента США г-на Франклина Д. Рузвельта на имя тоб. И. B. Сталина	vol-5832-page-01-seg-033-2337-3074-4120-3216.png
5832	1	2214	3243	3212	3685	62	0.92952	Мой дорогой Маршал Сталин, Я посылаю Вам две грамоты для Сталинграда и Ленинграда - городов, которые завоевали искреннее восхищение американского народа. Героизм граждан этих двух городов и воинов, так умело их защищавших, не только воодушевил народ Соединенных Штатов, но помог еще сильнее скрепить дружбу наших двух наро- дов. Сталинград и Ленинград стали синонимами силы духа и стойкости, которые дали нам возможность со-	vol-5832-page-01-seg-034-2214-3243-3212-3685.png
