volume_number	page_number	x1	y1	x2	y2	tokens_count	mean_confidence	text	image
5832	2	1567	1554	2231	1939	64	0.95983	Когда наши войска перешли в наступле- нее на Оршу, они наносили врагу удары как на открытой местности, так и в ле- систо-болотистых районах. На участке ав- темагистрали и южнее немцы сопротивля- лись особенно яростно, подтянув сюда массу огневых средств. Они опасались прорыва наших войск в непосредствен- ной близости к городу и поэтому сосредо- точили на данном участке всё свое вни- знание и основные силы.	vol-5832-page-02-seg-022-1567-1554-2231-1939.png
5832	2	1567	1967	2231	2708	114	0.96533	В то время, как одна группа доступа- ющих войск методически прогрызала мощ- ную оборону немцев на подступах к Орше другие наши части, действовавшие север- нее, прорвали три линии укреплений про- тивника в лесисто-болотистой районе и стали стремительно продвигаться на запад. Это был трудный путь через леса, забо- лоченные поля и торфяники, где бойцам приходилось преодолевать множество вод- ных преград, а также лесных завалов, устроенных гитлеровцами. Тем не менее этот тяжелый участок местности быстро остался позади, причем его преодолела не только одна пехота. Наступающим удалось провезти здесь также многочисленную тех- нику. Когда немецкая оборона была прор- вана севернее Орши на всю тактическую глубину, в прорыв устремились наши подвижные группы: мощные танки, само- ходная артиллерия, мотопехота.	vol-5832-page-02-seg-023-1567-1967-2231-2708.png
5832	2	1567	2731	2233	2943	30	0.95361	Между тем южнее автомагистрали про- должались упорные бои на подступах Орше. Они стоили противнику серьезных потерь. Чтобы сдержать натиск наших войск, немцы вынуждены были подбра- сывать сюда резервы, которые перевалы-	vol-5832-page-02-seg-024-1567-2731-2233-2943.png
5832	2	2252	698	2912	836	20	0.94913	велись в ходе боев. Это ослабило огшан- скую группировку немцев и сыграло не- малую роль в дальнейшем развитии опера- ции.	vol-5832-page-02-seg-025-2252-0698-2912-0836.png
5832	2	2252	857	2914	1554	105	0.95942	Стремительный обходный маневр наших подвижных частей, вырвавшихся далеко на запад, развивался весьма успешно. Они обошли Оршу с севера, перерезали же- лезную дорогу Орша-Лепель, ряд боль- шагов, идущих из. Орши на северо-запад. и устремились к Толочниу. Заняв этот город, они перехватили железную дорогу и автостраду на Минск. Таким образом крупные силы наступающих оказались значительно западнее гарнизона, обороняв- чего Оршу, преградив ему пути отхода на запад. Одновременно другие наши части, тоже преодолевшие оборонительную линию противника на болотистом северном уча- стке, повернули на юг и стали подходить городу с северо-запада, Это вызвало за- мешательство в лагере немцев, над кото- рыми нависла серьезная угроза с фланга и с тыла.	vol-5832-page-02-seg-026-2252-0857-2914-1554.png
5832	2	2252	1581	2914	2387	128	0.95374	Неприятель попытался прикрыть свой фланг силами артиллерии, сосредоточив сильный огонь на северо-западных под- ступах к городу. Однако огневое сопро- : гивление немцев было вскоре сломлено нашими наступающими пастями, которые вооружены еще более мощными средства- ми полавления. С разных сторон подходи- ли войска 3-го Белорусского фронта окраинам Орши, угрожая немецкому гар- низону полным окружением. Наконеп, севера и северо-запада передовые части проникли в город и завязали уличные бои. В это время в результате фронтальной атаки ворвались в предместья Орши с во- стока другие группы наступающих, ко- горые тут же приступили к форсигова- яию Длепра. то решило исход борьбы за город. Сопротивление неприятеля в улич- пых боях всё больше слабело. Наконец. бросая оружие и другое боевое имущество, немцы в беспорядке бежали на юг, так как у них не осталось других дорог.	vol-5832-page-02-seg-027-2252-1581-2914-2387.png
5832	2	2252	2408	2910	2791	54	0.96197	потерей Орши противник лишился оперативно важного узла железных и шоссейных дорог, исключительного по зна- чению опорного пункта обороны. Наши войска громят отступающих немцев и за- хватывают богатые трофеи. В частности. на участке железной дороги Орша---Толо- чин немцы сставили чного эшелонов имуществом и боевой техникой. Неприя- тельские соллаты здесь в панике разбе- жались по лесам.	vol-5832-page-02-seg-028-2252-2408-2910-2791.png
5832	2	2389	2812	2868	2854	3	0.93156	Подполковник Н. ПРОКОФЬЕВ	vol-5832-page-02-seg-029-2389-2812-2868-2854.png
5832	2	2254	2858	2906	2943	7	0.89393	3-й БЕЛОРУССКИЙ ФРОНТ, 27 июня (По телеграфу).	vol-5832-page-02-seg-030-2254-2858-2906-2943.png
5832	2	1754	3026	2727	3204	4	0.90987	Ликвидация окруженной немецкой группировки	vol-5832-page-02-seg-031-1754-3026-2727-3204.png
5832	2	1815	3233	2648	3262	5	0.93733	(От специального корреспондента «Красной звезды»	vol-5832-page-02-seg-032-1815-3233-2648-3262.png
5832	2	1569	3287	2231	3576	42	0.95970	Дорога ведет в гору. Беспрерывный по- ток автомашин поднимает облака пыли, застилающей горизонт. Люди, их одежда, кашины и даже лошади, мирно шагаю- щие по обочинам, -- всё почернело в этой невообразимой пыли. Противник уже да- леко отсюда. Лишь изредка долосятся орудийные раскаты.	vol-5832-page-02-seg-033-1569-3287-2231-3576.png
5832	2	1569	3597	2237	4134	80	0.96387	Мы проезжаем мимо большой высоты, которая видна была еще издалека. Здесь недавно были передовые позиции. На этой высоте находился генерал, руководивший боем. Словно на ладони, раскрывается с нее земля, лежащая на западе. Узкой лен- точкой выотся едали рельсы на высокой насыпи. Это железная дорога Витебск Орша. Теперь она перерезана, через нее протянулись стальные советские клеща. славшие немцев в кольцо. Поле впереди устлано вражескими трупами. Всюду груды металла, едва напоминающие немец- кие пушки и танки, так они изуро- дованы и исковерканы.	vol-5832-page-02-seg-034-1569-3597-2237-4134.png
5832	2	1567	4157	2231	4657	70	0.95440	Судьба крупной немецкой группировки окруженной нашими войсками в районе Витебска, решилась в течение сорока ча- сов. 25 июля вечером войска 3-го Бело- русского фронта соединились с войсками i-ro Прибалтийского фронта, сомкнув таким образом кольцо окружения. 27 июня противник уже был частью раз- громлен и частично капитулировал, приняв пред явленные ему условия. Этот предель- но высокий темп ликвидации крупной группировки противника является блестя- шей демонстрацией высокого военного ма- стерства наших войск.	vol-5832-page-02-seg-035-1567-4157-2231-4657.png
5832	2	1565	4680	2235	5142	82	0.96594	Тотчас же после запятая нашими частя- ме Витебска начались яростные контр- атаки со стороны окруженных войск про- тивника в направлении на юго-запад. Они бросались в контратаки и днем и ночью пытаясь пробиться то в одном, то в дру- гом месте. За полтора дня немны предпри няли свыше двадцати контратак больше- ми силами пехоты при поддержке танков артиллерии. Во время одной контр- атаки противник бросил в бой до двух пе- хотных полков. В результате он потерял до 800 солдат и офицеров убитыми и	vol-5832-page-02-seg-036-1565-4680-2235-5142.png
5832	2	2250	3287	2912	3535	37	0.96200	418 пленными. Немцы, оказавшись подко- неп па площади всего в несколько кило- метров, метались из стороны в сторону... Временами их боевые порядки вытягива- лись, что давало. возможность нашим вой- скам расчленять вражескую группировку бить ее по частям.	vol-5832-page-02-seg-037-2250-3287-2912-3535.png
5832	2	2250	3556	2916	3876	42	0.96368	Положение противника ухудшалось каждым часом. Потери его от бесплодных контратак увеличивались под мощными ударами пашей авнапии и артиллерии. Полеты авиации на окруженную группе- были весьма интенсивными. Наряду с бомбами в стан врага сбрасывались листовки, в которых говорилось о бес- смысленности продолжать сопротивление.	vol-5832-page-02-seg-038-2250-3556-2916-3876.png
5832	2	2252	3889	2914	4068	28	0.95564	Однако противник продолжал упорство- вать и не прекращал своих контратак. В ноль на 27 июня он всё еще бросался на стальное кольцо окружения, вел силь- ный артиллерийский огонь.	vol-5832-page-02-seg-039-2252-3889-2914-4068.png
5832	2	2250	4084	2914	4472	52	0.94747	После того, как наши части захватили аэродром на окраине Витебска, немцы по- теряли надежду на появление транспорт ных самолетов. Лесистая и частично забо лоченная местность не давала возможно- сти вражеским машинам приземлиться Лишь один какой-то самолет связного типа приземлился в районе окруженных войск, но подняться в воздух сму уже по при- плось,	vol-5832-page-02-seg-040-2250-4084-2914-4472.png
5832	2	2248	4484	2914	4947	64	0.96296	На рассвете 27 июня противник пред- принял последнюю контратаку, тоже без- успешную. Затем действиями наших войск группировка немцев была расчленена. По- скольку противник отчаянно сопротивлял- сл. большая часть его окруженных войск _была перебита. Виаг потерял здесь боле 20.000 убитыми Оставшаяся часть враже- ских войск приняла ультиматум советского командования о капитуляции, прекратила сопротивление и сложила оружие. В плен сдалось свыше 10.000 немецких солдат и эфицеров.	vol-5832-page-02-seg-041-2248-4484-2914-4947.png
5832	2	2256	4959	2908	5026	8	0.95587	Длинные колонны пленных немцев по- тянулись по шоссе	vol-5832-page-02-seg-042-2256-4959-2908-5026.png
5832	2	2283	5036	2875	5142	9	0.93906	Майор Я. МИЛЕЦКИЙ ДЕЙСТВУЮЩАЯ АРМИЯ, 27 июня. (По телеграфу).	vol-5832-page-02-seg-043-2283-5036-2875-5142.png
5832	2	3064	438	4147	534	3	0.96453	Дорога на Могилев	vol-5832-page-02-seg-044-3064-0438-4147-0534.png
5832	2	3187	546	4026	580	5	0.92927	(От специального корреспондента «Красной звезды»)	vol-5832-page-02-seg-045-3187-0546-4026-0580.png
5832	2	2935	600	3597	1817	194	0.95209	Мы едем полосою прорыва. Впрочем она была полосою мало времени, потому что под штурхующими ударами наших войск авиации, артиллерии и пехо- ты --- эта полоса вскоре резко раздалась в ширину по фронту и превратилась бал полуовальной формы, катящийся впе- ред, на запад. Дымятся последние, ниж- ние венцы белорусских изб, сложенных врагом. Опалена огнем умершая, теперь коричневая трава, но еще чаще земля лишена всякой растительности. Огонь взрыл ее 10 глубины утробы, извел нару- жу бесплодную глину, и земля лишилась всего, что было на ней живым, лежит сейчас незнакомой и пустой. Вот наш первый новый мост через ре- ку Проню, по которой проходил огневой рубеж. Кто строил этот мост, чтобы жи- вая сила наших войск могла вплотную подойти к противнику для последнего уда ра и оттеснить его прочь? Здесь работал старший сержант Дергачев, помощник командира взвода второй роты саперного батальона. Оп работал почти на глазах противника, при его осветительных раке- тах, под огнем его артиллерии, и к нача- ту нашей артиллерийской подготовки мост был готов к приему атакующих войск и техники. Старший сержант Дергачев су- мел тут же, невдалеке от постройки мо- ста, наладить заготовку и разделку лес- ного материала в роще на нашей сто- роне.	vol-5832-page-02-seg-046-2935-0600-3597-1817.png
5832	2	2931	1823	3595	3470	268	0.95607	Дергачев давно был известен как уме- лый хозяйственник и мастер мостового строительства. Однако одного этого еще мало, чтобы саперы спокойно, искусно и быстро работали под огнем противника Тут требовалось, чтобы к Дергачеву его люди испытывали особо преданное дове- " рие, чтобы он обладал властью над их сердцами. Дергачев не первый день служит своем батальоне. Он яв- ляется парторгом роты и уже давно рас- положил к себе людей, заслужив образом своей жизни и работой их уважение, вос- питав в них солдатское терпение и стой- кость, потому что он и сам мог стоять и работать возле самой смерти, под оскол- ками мин и снарядов. Всеми саперными работами для перепра- вы наших наступающих войск через Про- ню руководил майор Алексеев - опыт- пый дивизионный инженер. Он сумел по- строить через водную преграду, являю- щуюся одновременно и огневым рубежом, три долговременных моста, двадцать один штурмовой мостик и паромную переправу. Этот офицер дал дорогу вперед нашим войскам, устремленным на прорыв есех линий обороны противника. Едем дальше. Справа от дороги, наехав на немецкий дот, стоит наш сгоревший танк. Сначала танк громил дот из пуш- ки, а потом наехал на него для оконча- тельного сокрушения, пожертвовав собой. Чей подвиг скрыт в этой гибели? Здесь на фронте, старший офицер-танкист рас- сказал нам историю танка. Этот танк последовательно раздавил восемь не менкиу пушек вместе с их расчетами, а на девятой пушке или на другом препят- ствии он погиб. Возможно, что к этому моменту боя танк израсходовал свой бое- вой комплект, и командир его решил за- валить телом машины уже полураздетый но еще не сдавшийся немецкий дот. По- тожение погибшего тапка, наехавшего на дот, где был подбит, ПОЗВОНОЧНИКА	vol-5832-page-02-seg-047-2931-1823-3595-3470.png
5832	2	3614	598	4289	3174	375	0.95479	ляло думать, что командир наши- принял именно такое решение. Мы перед собой последний наиболее возвышенный акт боевого подвига танкистов, коллективно, всем эко- пажем повторивших подвиг незабвенного Александра Матросова. Старший офицер- танкист еще не получил сведений о соста- экипажа танка, давнейшего последова тельно немецкие пушки. Немного позже имена героев станут известны. Дорога идет далее военная дорога поступления. По ней мчатся тысячи на- шин, создаются п расшиваются "пробки". Войска слешат в сторону заката солнца, чтобы спросить в пропасть вечного мрака безмолвного забвения злодеев чело- вечества. Войска воодушевтены своим нарастающим углехом победа есть луч- ший источник мужества солдата. Поэтому на военных дорогах, упирающихся прямо- боевые поля, чувствуется сейчас празд- ничное настроение окончательно побежда- и его паррота. "... Вот деревня Сусловка. Здесь недавно, пенного часов назад отважно воевал пу- теметчик сфрейтор Фролов. Он вел огонь из своего пулемета столь губительно для яспряятеля, что пробл. дорогу в деревню своей роты, и рота ворвалась в Сус- лавку во след точным пулеметным очередями Фролова. Опушка опаленного леса. Перед опушкой поляна, покрытая флолетовыми колокольчиками. Тут боялся ефрейтор Агкерков второго стрелкового баталь- опа одного нашего полка. Наступающих бойцов задерживал и беспокоил пулемет противапка. Ефрейтор Аскерков приказал рядовому Тлебко прикрывать его огнем : своего пулемета, а сам подобрался к не- меня ему пулеметчику и умножил его. Далее уходит дорога. Руты белорус- ской деревуютки, которой существует только на карте. На ее околице дрались, время двигаясь вперед. прорубая путь огнем через трупы врагов, пулеметчик Непоменко, пятой роты, и его в10- пой помер Помела. Теперь они уже не они на западе. Растут молодые березы. Их здесь целая паша, они упелели случайно и стоят дороге, с.товно кроткие дети. За березами пустое поле, в лагере сосновый лес. Па том пустом поле петавно окончился бой. В этом но уже не первый раз при- участи командир медико-санитар- пого взвода лейтенант медицинской служ- бы Лунтрионно. Оп вместе со своими са- пиратами в боевых порядках пехоты первым приходил на помощь упавшему, запомогателу от ранения красноармейпу. Лейтенант Дмитриенко месте, под с плотным огнем делать перевязки. чтобы не упустить одной минуты времени, потому что упущенной время может не- Жизнь красноармейца. Оказав первую помощь, лейтенант выходит бойпа из огня опять возвращался в бой снова село- тому. кому он был нужен. Класс- витя офицера, спасающего его, чувствовал облегчение. Он видел в этих офицере своего старшего брата, заместите- тя отпа...	vol-5832-page-02-seg-048-3614-0598-4289-3174.png
