volume_number	page_number	x1	y1	x2	y2	tokens_count	mean_confidence	text	image
5104	1	1193	368	2428	448	4	0.89993	См Смерть немецким оккупантам.	vol-5104-page-01-seg-002-1193-0368-2428-0448.png
5104	1	568	462	2508	792	7	0.98372	ЦЕНТРАЛЬНЫЙ ОРГАН НАРОДНОГО КОМИССАРИАТА ОБОРОНЫ СОЮЗА ССР	vol-5104-page-01-seg-003-0568-0462-2508-0792.png
5104	1	646	844	870	894	2	0.89486	40 (5104)	vol-5104-page-01-seg-004-0646-0844-0870-0894.png
5104	1	1307	846	1875	894	5	0.93460	18 февраля 1942 г., среда	vol-5104-page-01-seg-005-1307-0846-1875-0894.png
5104	1	2294	840	2534	890	2	0.84695	ЦЕНА 15 КОП	vol-5104-page-01-seg-006-2294-0840-2534-0890.png
5104	1	2674	390	4652	878	31	0.96743	Задача уничтожения вражеских опорных пунк- тов требует от наших пехотинцев, автоматчиков, гранатометчиков большой стремительности Не давать опомниться врачу. Смело врываться в опорные пункты, быстро и тщательно очищать их от немецких автоматчиков!	vol-5104-page-01-seg-007-2674-0390-4652-0878.png
5104	1	762	970	1707	1088	2	0.97068	Боевой актив	vol-5104-page-01-seg-008-0762-0970-1707-1088.png
5104	1	532	1127	1221	2942	269	0.95515	Боевой актив - стальной костяк наших частей, наш золотой фонд. Это те отраж- ные и умелые воины, которые всеми силами рвутся вперед, на разгром врага, презирают смерть во имя победы и свои- ми подвигами расчищают дорогу к успеху, примером своих героических действий воодушевляют всех остальных бойцов. Чем крепче, больше боевой актив подраз- деления, части, тем успешнее она дей- се- ствует. Воспитание боевого актива, повсе- дневная забота о его росте совершен- ствовании одна из насущных задач каждого командира и политработника. Не Не все сразу рождаются героями, но каждый может стать героем, если он попадет в твердые и искусные руки, если его будут воспитывать умело, заботливо. кропотливый труд начальников всех сте- пеней, политорганов, партийных и комсо- мольских организаций прокладывает каж- дому воину путь к доблести и славе. результате большевистского воинского воспитания красноармеец и командир, ни- чем не выделяющийся сегодня, становит- ся завтра боевым артиллеристом, летчиком, танкистом, а затем вырастает в героя. Армия и страна хоропю знают теперь героического воина Истрафуила Мамедова. Но Мамедов не сразу стал героем. Дело началось с того, что однажды, будучи в засаде, он проявил высокую храбрость. Командир тотчас же обратил на это вни- мание и, подводя в подразделении итоги бся, особо выделил Мамедова, рассказа. о его опыте. В следующем бою Мамедов действует еще лучше. Он отлично вы- полняет задачу, захватывает немецкий пулемет, уничтожив при этом фашист- ского офицера. Вокруг Мамедова создается боевой актив. Красноармейцы восприни- мают босвую споровку своего командира и во всем следуют его гримсру. Через месяц младший лейтенант Мамедов с этой же группой бойцов отражает натиск не- мецкого батальона, истребив сам в этом неравном десятичасовом бою 73-х немцев. Родина наградила его званием Героя Советского Союза.	vol-5104-page-01-seg-009-0532-1127-1221-2942.png
5104	1	518	2950	1193	3715	105	0.95488	Таков путь многих советских патриотов. огне жестоких битв закаляются их сглы, совершенствуются боевые навыки. По этот процесс общего подъема, харак- терный для всех наших войск, проходит далеко не одинаково для каждого воина. Одни быстро преодолевают трудности вой- легко побеждают страх и в самой труд- ной обстановке действуют решительно и целеустремленно, другие, си. ту ряда индивидуальных особенностей, несколько отстают и поэтому требуют постоянной помощи. Чтобы быстрее и лучше воспи- тать таких людей отважными бойцами, командир и политработник обязаны преж- де всего выявить передовиков и сколотить из них боевой актив. Боевой актив - это первейшая опора командира и полит- работника и в бою, и в воспитании дютей.	vol-5104-page-01-seg-010-0518-2950-1193-3715.png
5104	1	516	3721	1181	4261	67	0.94971	В части тов. Герасименко комсомольцы быстро подхватили призыв вождя об истребление немецких оккупантов. Крас- ноарнейцы, отлично влалевшие оружием, взял на себя обязательство обучить ис- кусству меткой стрельбы других бойцов. Вокоре рецы снайперов пополнитесь повы- мастерами огня, ставшими грозой для фашистов. Красноармейцы Востриков и Григорьев истребили уже свыше 100 фа пистов. За короткое время уничтожена около 1.000 солдат офицеров. Опыт боевого актива этого полка широко восприняли другие пол-	vol-5104-page-01-seg-011-0516-3721-1181-4261.png
5104	1	1221	1127	1899	2906	254	0.95774	ки и дивизии фронта. В итоге иного кратно увеличилось число снайперов, рез повыси.тось качество их боевой работы Сейчас снайперы не только самостоятельно охотятся за фашистами, но и научились действовать согласованно с артиллерией. Артиллеристы бьют прямой наводкой по вражеским огневым точкам, выкуривают немцев из укрытий, а снайперы добивают их винтовочной пулей. Боевой актив - это не только масте- ра меткого огня, но и бесстрашные свя- зисты, находчивые разведчики. храбрые танкисты, смелые саперы, мужественные автоматчики, все те, кто в огне боев уже продемонстрировал свою смекалку, воен- ную хитрость и высокое искусство побеж- дать врага. Многие из них уже удостоены правительственных наград. Эти люди должны быть на особом учете. Каждого из : них командир и политработник должны хо- рошо знать не по бумажным свеле- ниям, а по боевый делам. 11 когда речь идет 00 организации боя, командир и комиссар, не задумываясь, должны ука- зать, кто лучше других выполнит задачу разведки, кто пойдет направляющим в атаку, на кого возложить обход вражеско- го штанга. Знание людей поможет пра- вильно расставить силы боевого актива и наиболее эффективно использовать все подразделение в целом. Опираясь на боевой актив, командир вместе с политруком обязан всемерно по- пуляризировать и распространять его пе- редовой опыт. Подведение итогов каждого бакон. Командир соединения Бер- зарин после успешной атаки важного на- селенного пункта отмети.1 специальным приказом успешные боевые действия од- ной части. Это - хорошая мера воспи- тания. На примерах героических действий растет и воспитывается боевой актив. растут и воспитываются все бойцы. Бое- вой актив является неиссякаемым резер- вом выдвижения на командные посты за- каленных в боях кадров.	vol-5104-page-01-seg-012-1221-1127-1899-2906.png
5104	1	1203	2910	1881	4259	185	0.95867	Сражаясь с германским фашизмом - in самым лютьгм врагом человечества, мы имеем дело с еще сильной военной маши- ной. Поэтому выращивание боевого ак- тива и воспитание героизма в наших людях должно быть неразрывно связано совершенствованием военной выучки. Надо не только регистрировать подвиги своих подчиненных, но и анализировать обстановку, в какой были совершены эта подвигя, извлекать поучительный опыт и смело внедрять его в боевую практику. Это в равной мере относится и к военной печати, устной и наглядной агитации. Иные командиры и комиссары еще не развернули по-настоящему работу с бое- вых активом. Больше того некото- рые даже не знают о его существовании пропаганду боевого опыта строят на отвлеченных рассуждениях. Такой подход к делу заслуживает самого сурового осуж- дения. Недооценивая боевой актив, не ра- ботая с ним, командир и комиссар ослаб- ляют боевую силу своей части, тормозят развития ее успехов. Жестокая борьба врагом требует максимального напряжения всех наших сил. Чтобы одержать победу, нужны мужество и отвага, бесстрашие и герой- ство, умение и сноровка, нужна высокая военная культура. Командир и комиссар обязаны неутомимо совершенствовать эти боевые качества и через свой боевой ак- тав шире распространять их в массах грасноармейцев.	vol-5104-page-01-seg-013-1203-2910-1881-4259.png
5104	1	738	4339	1635	4476	6	0.92192	Накануне 24-й годовщине Кра Красной Армии	vol-5104-page-01-seg-014-0738-4339-1635-4476.png
5104	1	508	4500	1177	5246	112	0.95033	СИБИРСКИЙ ВОЕННЫЙ ОКРУГ, 17 фев- райя. (По телеграфу от наш. спец. корр. ). В частях округа развернулась деятельная подготовка к 24-й годовщине Красной Ар- мии. Читаются лекции и доклады для бой- дов и начальствующего состава об истории Красной Армии. Политическое управление округа издало в помощь докладчикам и аптаторам сборник «За честь родины», два блокнота агитатора, брошюры: «Сиби- ряки фронта», «Наступательные операции Красной Армии", "Богатыри отечественной войны" и ряд других. Проведены ян струк- гивные доклады для политработатков и агитаторов. В части выехала группа лек- торов политуправления. . . В Домах Красной Армии, клубах, ленин- ских комнатах организуются выставки и фотовитрины па темы: "Великая отече- ственная война советского народа против немецких оккупантов", "Героический путь	vol-5104-page-01-seg-015-0508-4500-1177-5246.png
5104	1	1189	4506	1859	5242	98	0.95658	Красной Армии", "Разгром немецких окку- пантов в 1918 году», «Ленин и Сталин вожди и организаторы побед Красной Ар мин». Проводятся просмотры оборонных и исторических кинофильмов, фронтовой ки- похроники. Рацио комитет Новосибирской области ор- гализует 23 февраля выступление по радио отличников боевой учебы, которые расскажут о том, как бойцы и командиры резервных частей готовятся к боям с не- навистными фашистскими захватчиками. В дни празднования годовщины в крас- ноармейских п.тубах и Домах Красной Ар- мпи выступят многочисленные бригады ар- тестов, агитбригада окружного Дома Крас- ной Армии. Готовятся специальные номера многотиражных газет в соединениях и бое- вые листки, посвященные славной годов-	vol-5104-page-01-seg-016-1189-4506-1859-5242.png
5104	1	762	5296	1595	5414	7	0.94343	тысяча вагонов с подарками : для фронтовиков	vol-5104-page-01-seg-017-0762-5296-1595-5414.png
5104	1	496	5440	1161	6111	94	0.95570	Трудящиеся Советского Союза. судя по неполным данным, уже собрали свыше тысячи вагонов с подарками для фронто- виков в честь 24-й годовщины Красной Армии. Ежедневно в Главное интендант- ское управление продолжают поступать сведения об отправке эшелонов с полар- камни в действующую армию. 14 февраля из "Челябинска отправлен специальный состав 68 вагонов с по- дарками для частей Северо-Западного фрон- та. Трудящиеся Архангельска собрали бойцов и командиров 6.000 килограммов мяса, 3.590 килограммов кондитерских изделий, 285 килограммов сливочного мас- ла, много вина, табаку, папирос, свыше тысячи индивидуальных посылок. Бойцам подшефной 8-й гвардейской стрелковой дивизии 12 вагонов с потап-	vol-5104-page-01-seg-018-0496-5440-1161-6111.png
5104	1	1185	5442	1845	5803	48	0.94873	ками везут трудящиеся Алма-Аты. Значи- тельное количество посылок будет напра- влено оттуда же в другую дивизию. Большое количество подарков предназ- начено. для бойцов Ленинградского фрон- та. 30 вагонов с продуктами и теплыми вещами отправлены из Иркутска. Труля- щиеся Иркутской области вместе с по- дарками послали Ленинградскому фронту поезд-баню.	vol-5104-page-01-seg-019-1185-5442-1845-5803.png
5104	1	1187	5817	1839	5959	18	0.95709	15 февраля специальная делегация Да- гестанской АСОР повезла 22 вагона с по- дарками бойцам и командирам Карельско- фронта.	vol-5104-page-01-seg-020-1187-5817-1839-5959.png
5104	1	1181	5971	1839	6109	20	0.95404	37 вагонов с сапогами, валенками, кон- дилерскими и колбасными изделиями ве- зет на Западный фронт делегация Мон- китайской Народной Республики	vol-5104-page-01-seg-021-1181-5971-1839-6109.png
5104	1	2402	968	4185	1068	3	0.95924	от советского информбюро	vol-5104-page-01-seg-022-2402-0968-4185-1068.png
5104	1	2063	1070	3144	1141	4	0.94649	Утреннее сообщение 17 февраля	vol-5104-page-01-seg-023-2063-1070-3144-1141.png
5104	1	1929	1161	2588	1269	15	0.95849	В течение почти на 17 февраля проис ходили наступательные бои наших войск против немецко-фашистских войск.	vol-5104-page-01-seg-024-1929-1161-2588-1269.png
5104	1	1921	1311	2586	1701	64	0.94852	Наши бойцы, действующие на одном из участков Западного фронта, уничтожили 6 6 вражеских танков, 84 лодводы с воин- ским имуществом, минометную батарею, : 22 пулемета и взорвали большие склады с боеприпасами. Немцы потеряли 557 сол- дат и офицеров убитыми и до 300 ране- ными. На другом участке фронта в бою 31 высоту Н. наша стрелковая часть уал- чтожила свыше 200 вражеских солдат и офицеров.	vol-5104-page-01-seg-026-1921-1311-2586-1701.png
5104	1	1915	1739	2578	2151	61	0.95682	Наши части, действующие на опель- ных участках Ленинградского фронта, за два дня боев противником разрушили 3 немецких Дзотах, 14 олнидажей, упич- тожили 6 гулеметов, несколько повозок боеприпасами и захватили 12 пулеме- тов, 2 миномета, много винтовок и авто- хатов, 620 мин, 500 ручных гранат, 34.000 винтовочных патронов, имущество связи и другие трофеи. Немцы потеряли убитыми до 1.500 солдат и офицеров. *	vol-5104-page-01-seg-027-1915-1739-2578-2151.png
5104	1	1911	2171	2572	2492	49	0.95202	Цаши части, действующие на одном из участков Южного фронта, за день боев противником уничтожили 7 немецких танков, 5 орудий и много другого воору жения. Противник потерял убитыми 300 солдат и офицеров. На другом участке рота немцев пыталась атаковать наши по- зиции у пункта Н., но была разгромлена и рассела.	vol-5104-page-01-seg-028-1911-2171-2572-2492.png
5104	1	1909	2530	2568	2700	21	0.95676	Одно советское подразделение, успешно отразив попытку врага контратаковать наши позиции, полностью разгромила 7 роту 1 полка 1 немецкой пехотной ди- визии.	vol-5104-page-01-seg-029-1909-2530-2568-2700.png
5104	1	1907	2740	2566	2918	30	0.94462	Крупный отряд партизан под командо валием тов. Р., действующий в одном из районов Смоленской области, оккупирован ных немцами, в течение нескольких часов вел бой с гитлеровцами в районе Д. Нем-	vol-5104-page-01-seg-030-1907-2740-2566-2918.png
5104	1	2610	1163	3273	1467	46	0.96098	цы потеряла убитыми около ста солдат офицеров. Храбро сражался с врагами 18-летний партизан С. Метким огнем ручного пулемета оп отбивал многочн- сленные атаки немцев и отошел только тогда, когда израсходовал все патроны. За время своей деятельности личный состав партизанского отряда вырос в три раза. * *	vol-5104-page-01-seg-031-2610-1163-3273-1467.png
5104	1	2604	1487	3266	1753	47	0.95343	Пленный ефрейтор 4 руты 461 полка 252 немецкой дивизии Рихард Мерцает рассказал: «В нашей роте было 35 поля- ков. Но желая воевать против России, они все, один за другим, добровольно сдались лен. Я последний из этих 35. Теперь в 4 роте не осталось ни одного поляка» *	vol-5104-page-01-seg-032-2604-1487-3266-1753.png
5104	1	2600	1771	3258	2105	57	0.94852	У убитого капрала финской армии най дено письмо жены из Хельсинки. Она пи- сала: «Будь очень осторожным... Почем вы не бросаете оружие и не уходите? Эта массовая бойня так ужасна? Ради чего топят финский народ на убой? Для чего нам «великая Финляндия»? Почему фин- ский народ так слеп и разрешает себя истреблять из-за гостол немцев?» * *	vol-5104-page-01-seg-033-2600-1771-3258-2105.png
5104	1	2596	2127	3254	2326	29	0.96028	Оставляя под ударами советских частей! село Ельцы Калининской области, гитле равны сожгли 285 домов. Немецкие бан- диты расстреляли и замучили многих жи- телей села, в том числе женщин и детей	vol-5104-page-01-seg-034-2596-2127-3254-2326.png
5104	1	2590	2348	3252	2732	55	0.95865	При занятии нашими войсками деревне Макарово Лотошинского района Москов- ской области найден изуродованный трут красноармейца Ночевного Григория Петро вича. У жертвы гитлеровских палачей отрезаны оба уха, нос, на лице несколько ножевых ран, пальцы левой руки вывер- нуты из суставов и раздроблены, на пра- вой ноге людрезаны все пальцы, живот распорот, левая сторона груди пр-колота штыком.	vol-5104-page-01-seg-035-2590-2348-3252-2732.png
5104	1	2590	2774	3248	2914	25	0.93457	Молодью токари завода имени Димитро- в (Баку) Ага Рагим Ахмедов и Бирюков ежедневно выполняют 6--7 по рм, токарь Сбродов дает за смену 9 трудовых норм.	vol-5104-page-01-seg-036-2590-2774-3248-2914.png
