volume_number	page_number	x1	y1	x2	y2	tokens_count	mean_confidence	text	image
5848	2	3635	3066	4311	3893	123	0.95688	Подытожим сказанное. Советские танки боях за столицу Белоруссии действова- ли чрезвычайно энергично и разнообраз- ными методами. Главная причина успе- ха высокий темп наступления, дости- гавiпий порой 40-50 километров в сут- ки. Пехота очень часто без боя заполняла образующиеся тактические пустоты. К мо- менту решительного штурма она шла пле- в плечо с танками после тяжелых фор- сированных маршей. Задачи танков и пе- хоты были всюду четко определены оба рода войск во-время приходили на помощь друг другу. Судьба Минска реша- лась сразу на нескольких (точнее, на трех) направлениях. Противник вынужден был метаться между ними, распыляя свои силы. В тот момент, когда создавалось неустойчивое равновесие на одном из этих направлений, центр тяжести танкового натиска тут же перемещался на соседние. Такое чередование танковых ударов вполне оправдало себя.	vol-5848-page-02-seg-055-3635-3066-4311-3893.png
5848	2	3628	3903	4299	4547	98	0.95831	Бой танков за город Минск подтвердил ту истину, что сопротивление противника в городе может быть сломлено не только непосредственным ударом танков и пехоты c разных сторон по его обороне. Такой вариант характерен для действий сравни- тельно небольших танковых групп. Karja же идет мощное наступление танков на широком фронте, судьба города может решаться в его тылу. Иногда возможно сочетание этих двух методов, что и наблю- далось в боях за Минск. Ясно, что при этом глубина танковых ударов может быть различной. Она каждый раз будет зависеть от характера местности и соот- ношения спл сражающихся сторон. Подполковник П. СЛЕСАРЕВ. действующая армия	vol-5848-page-02-seg-056-3628-3903-4299-4547.png
5848	2	3149	4628	4068	4661	4	0.82858	Итоги летнего профсоюзно-комсомольского кросса	vol-5848-page-02-seg-057-3149-4628-4068-4661.png
5848	2	2941	4688	3603	4934	42	0.96094	Центральный оргкомитет подвел итоги летнего профсоюзно-комсомольского крос- са. В соревнованиях с 28 мая по 11 июня в городах и районных центрах страны при- няли участие 7.658.656 человек, из них вы- держали нормы комплекса БГТО, ГТО первой и второй ступени 6.521.014 чело- век.	vol-5848-page-02-seg-058-2941-4688-3603-4934.png
5848	2	2970	4943	3595	4970	4	0.94556	Хороших результатов в соревнованиях	vol-5848-page-02-seg-059-2970-4943-3595-4970.png
5848	2	3620	4688	4291	4976	33	0.95959	добились Московская, Ленинградская, Ом- ская, Смоленская, Хабаровская, Тульская, Удмуртская, Красноярская, Азербайджан- ская, Ярославская, Кировская и другие организации. Из спортивных обществ лучшие показа- тели имеют "Локомотив Востока", «Крас- ное знамя», «Зенит», «Крылья Советов». (ТАСС)	vol-5848-page-02-seg-060-3620-4688-4291-4976.png
5848	2	290	5955	2341	5988	15	0.96379	БЕЛОРУССКИЙ ФРОНТ. Колонна пленных немецких солдат и офицеров, захваченных в нелавних боях, направляется в тыл	vol-5848-page-02-seg-061-0290-5955-2341-5988.png
5848	2	3306	5957	4172	5994	6	0.93719	Снимок нашего фотокорр. капитана A. Капустянского	vol-5848-page-02-seg-062-3306-5957-4172-5994.png
5848	3	296	252	1056	284	8	0.93795	16 июля 1944 г., воскресенье. № 168 (5848).	vol-5848-page-03-seg-001-0296-0252-1056-0284.png
5848	3	2335	248	2581	284	2	0.95267	3 ЕДА	vol-5848-page-03-seg-003-2335-0248-2581-0284.png
5848	3	388	363	2110	530	10	0.95729	ТОРЖЕСТВЕННОЕ СОБРАНИЕ БОЛЬШОМ ТЕАТРЕ, ПОСВЯЩЕННОЕ 40-летию ДНЯ СМЕРТИ А. П. ЧЕХОВА	vol-5848-page-03-seg-004-0388-0363-2110-0530.png
5848	3	223	552	886	1958	205	0.95436	15 июля в Большом театре состоялось торжественное собрание, посвященное 40-летию со дня смерти А. II. Чехова. В зале многочисленные представи тели существенности столицы писа- тели, артисты, ученые, стахановцы, бой- ды и офицеры Красной Армии. В сереб- пустой раме, увитой гирляндами живых цветов, портрет писателя, чье творчество любимо всем советским народом. Торжественное собрание открыл пред- седатель Всесоюзного комитета по прове- дению 40-летия со дня смерти Чехова тов. В. П. Потемкин. Он говорит о мечте писателя, устремлявшегося всеми силами к жизни, основанной на справедливости, правде и душевной красоте. ней, этой правде, он звал народ своими талантливыми произведениями, ее он предвидел чутьем подлинного худож- ника. Мечта писателя воплотилась в дей- ствительность лишь после Великой Ок- тябрьской социалистической революции, когда законом нашей жизни стал творче- ский и преобразующий мир труд, без ко- торого, по определению Чехова, немыслимо существование. Прошло 40 лет со дня смерти Че- хова, говорит тов. Потемкин. --- Родина наша вознеслась на вершину славы. ней устремлены взоры всего человечества. Народы и воины России несут миру оево- бождение и победу над злейшими врагами культуры, прогресса и цивилизации. Че- хов был бы счастлив, видя свершение своих идеалов. Он был бы горд созна- нием, что его родная Россия, построив- шая новый мир, увенчана неувядаемой славой побед в священной Отечественной войне.	vol-5848-page-03-seg-005-0223-0552-0886-1958.png
5848	3	221	1960	879	2389	61	0.94904	Слово для доклада о творчестве Чехова; о его влиянии на отечественную и миро вую литературу предоставляется предсе- дателю правления Союза советских писа- телей СССР тов. Н. Тихонову. Мы отмечаем, говорит он, 40-летие со дня смерти великого русского писателя Антона Павловича Чехова в об- становке Отечественной войны, в дни исторических побед Красной Армии, не- удержимо идущей на запад, логову не- мецкого фашизма.	vol-5848-page-03-seg-006-0221-1960-0879-2389.png
5848	3	217	2393	877	2822	58	0.93710	На фоне нашей смертельной борьбы человеконенавистническим фашизмом Че- ховский день особо знаменателен. Гитле- ровские захватчики, напавшие на нашу Родину, ставили своей целью, как ука- зывал товарищ Сталин, уничтожение ве- ликой русской нации, нации Плеханова и Ленина, Белинского и Чернышевского. Пушкина и Толстого, Глинки и Чайков- ского, Горького и Чехова, Сеченова и Павлова, Репина и Сурикова, Суворова и Кутузова.	vol-5848-page-03-seg-007-0217-2393-0877-2822.png
5848	3	205	2825	877	4037	182	0.95038	Имя Чехова заслуженно названо ве- ликим Сталиным среди имея, без кото- рых немыслимо представить себе наше прошлое и наше будущее. Чехов ве- ликий русский писатель. Его творчество целиком посвящено жизни русского на- рода, его знает каждый культурный че- ловек нашей страны, знает и любит на- род. Как никто, он передавал в своем творчестве жизнь народа, лучшие черты нашего национального характера. Глубо- ко и искренне изображал он русского человека своего времени в замечательных произведениях. Оп изображал их языком простым, точным, удивительным по чи- стоте, гибким и богатым, Читая книги Чехова, мы видны, что они написаны смелым жизнеутверждающим художником, который всю жизнь боролся с темными силами, угнетавшими человека, тормозив- шими его развитие, всю жизнь находил способы осмеяния и разоблачения пош- лых, никчемных, хищных, пустых, мрач- ных людей людей-хамелеонов, унтеров Пришибеевых, людей в футлярах. И не случайно Ленин и Сталин часто использовали чеховские образы, как ору- жие в борьбе с реакционерами, врагами народа. B. И. Ленин не раз, обличая кадетов, меньшевиков, сравнивал их с человеком в футляре, с затхлым и тупым учителем Беликовым. людях в футляре, их боязни - «как бы чего не вышло» го-	vol-5848-page-03-seg-008-0205-2825-0877-4037.png
5848	3	911	550	1571	717	23	0.94783	ворил и товарищ Сталин в своем докладе на 16 съезде ВКП(б), разоблачая бухарин скую контрреволюционную группу, став- шую впоследствии прямой агентурой фа- шизма.	vol-5848-page-03-seg-009-0911-0550-1571-0717.png
5848	3	907	727	1569	1363	99	0.95602	Книги Чехова, - говорит далее тов. Тихонов, полны бодрости и веры в человека. Чехов верил в богатырскую силу и талант русского народа. Он тяго- тел к людям обыкновенным, к людям тру- да, ценил и любил труд, разоблачал пош- лость в жизни, чванство богатствам лень, глупость. Своим духовным взором писа- тель видел преобразования, которые со- вершит на своей земле русский человек. И русские люди, восклицает докладчик, доказали правоту бисале- ля! В глухой провинции появляется Ми- чурин его чудесным перерождением природы, и Циолковский c его дерзкой звездной и межпланетной мечтой, и чудо- богатырь сталинского века Чкалов, и бо- гатырь труда Стаханов.	vol-5848-page-03-seg-010-0907-0727-1569-1363.png
5848	3	902	1373	1563	2083	110	0.95660	Правда - герой чеховского творчества Люди 80-х и 90-х годов как будто попа- ли в своеобразную энциклопедию так полно изображены они на страницах че- ховских произведений. Они живые пе ред нами сейчас. Вы можете смеяться над ними то 370, то легко, то грустно, вы можете находить иные типы Сохранив- шимися и встречающимися в наше время. От такого множественного изображения людей сумеречной предреволюционной эпо- хи писатель мог переполниться грустным сознанием безвыходности, печальным ощу- щением зря потраченных жизней, стать пессимистом, как Гоголь, или ядови- тым сатириком, как - Салтыков-Щедрин. По Чехов остался Чеховым, который, не- смотря на всё виденное им в жизни, го- ворит: "Боже мой, как богата Россия хорошими людьми! »	vol-5848-page-03-seg-011-0902-1373-1563-2083.png
5848	3	896	2085	1556	2985	129	0.95506	Анализируя произведения Чехова, Ти- хонов подчеркивает воинственный гума- низу писателя, его нетерпимость к прояв- лению пошлости, корысти, насилию на. свободным человеческим духом. Чеховский гуманизм есть предтеча нашего нового со- ветского гуманизма, огнем и мечом опол- чившегося теперь против врага свободы и цивилизации разбойничьего гитлеризма. Слава Чехова давно вышла за пределы Родины. На многочисленных примерах до- кладчик показывает огромное влияние вс- ликого русского писателя на мировую ли- тературу. Выдающиеся прозаики и драма- турги Запада Пристли, Бернард Шоу, Шервуд, Андерсон. Хемингуэй, Колдуэлл и другие свои лучшие произведения создают под обаянием чеховского творчества. Читая и изучая Чехова, -- указы- вает далее докладчик, - писатели и ис- следователи начинают понимать, что сила воздействия чеховского творчества потому так значительна, что этот великий худож- ник выразил в своих книгах лучшие чер- ты русского национального характера.	vol-5848-page-03-seg-012-0896-2085-1556-2985.png
5848	3	894	2989	1552	3383	66	0.95721	В заключение Н. Тихонов говорит: Немцы шли к нам, чтобы убить всё человеческое, чтобы раздавить и уничто- жить культуру. Но советский человек, его любовь к Родине и ненависть к пора- ботителям опрокинули вражьи орлы. Че- ловек нашей страны стал героем. Недаром в записной книжке Зои Космодемьянской были записаны чеховские слова: «В че- ловеке всё должно быть прекрасно: и ли- цо, и одежда, и чувства, и мысли».	vol-5848-page-03-seg-013-0894-2989-1552-3383.png
5848	3	894	3389	1550	3533	20	0.95177	Прекрасный человек нашей Родины гро- мит полчища захватчиков и гонит их безостановочно, всё ближе подходя к бер- тоге фашистского зверя.	vol-5848-page-03-seg-014-0894-3389-1550-3533.png
5848	3	894	3541	1548	3860	44	0.95952	Как бы радовался Чехов, глядя на советского человека, русского человека который преодолел все испытания и снова растит сады на месте разрушенных. создает всё новые и новые ценности ду- ховной и материальной культуры, восста- навливает героические города, идет спасать от ига фашизма порабощенные народы Европы!	vol-5848-page-03-seg-015-0894-3541-1548-3860.png
5848	3	890	3864	1550	4035	38	0.95531	Чехов безмерно дорог нам, советским людям. Мы любим, и ценим его за то, что всем подвигом своей творческой жиз- ни он был устремлен к нам, в наше бу- дущее. Он с нами в походе и в бою. В	vol-5848-page-03-seg-016-0890-3864-1550-4035.png
5848	3	1592	555	2252	1004	65	0.95127	сияющий победой день сталинского века он будет с нами, наш родной Чехов, бо- рец за правду и красоту на любимой на шей русской земле! Участники собрания встречают заклю- чительные слова докладчика продолжи- тельными аплодисментами. На трибуне народный артист СССР И. М. Москвин. Он говорит об огромной роли Чехова в истории и всей творческой жизни Художественного театра. Чехов духовный фундамент МХАТ, его творче- i. ская основа.	vol-5848-page-03-seg-017-1592-0555-2252-1004.png
5848	3	1590	1009	2252	1494	75	0.95700	Чехов был для нас больше чем близким драматургом, говорит Москвин. Своими произведениями, своим гума- низмом он учил нас видеть и познавать мир, видеть и любить Россию, верить в могучие силы народа и неразрывно свя- зывать с ним свое искусство. Чехов уча- ствовал в создании нашего мировоззрения и указал нам наш творческий путь на долгие, долгие годы. Вот почему белая чайка на спине Художественного театра символ глубочайшей, не умярающей нашей духовной связи с геннальным пи- сателем.	vol-5848-page-03-seg-018-1590-1009-2252-1494.png
5848	3	1581	1502	2246	2310	98	0.95424	Оратор подчеркивает, что чеховские уроки, сливаясь с неустанными искания- Станиславского, Немировича-Данченко. позволили MXAT вплотную подойти творчеству Льва Толстого, Достоевского, Островского и Тургенева. позволили сбли- зиться с рядом современных драматургов. Свою речь Москвин заключает проникно- верными словами: Вечно благодарным. верным неизменным другом и спутником Чехова ощущает себя Московский Художествен- ный театр. Мы счастливы сознанием, что нашу любовь к Чехову разделяет с нами вся страна, весь народ, которому мы посвящаем свое искусство. яркой речью выступил писатель Л. Леонов. Волна, которую в мировой лите- ратуре поднял Чехов, - говорит он. не улеглась лоныте. Все напольная любовь писателю лучшее признание его искусства.	vol-5848-page-03-seg-019-1581-1502-2246-2310.png
5848	3	1579	2321	2241	2675	50	0.94839	Писатель подробно останавливается на мотивах патриотизма в произведениях Чехова. Эти мотивы сливаются в гимн Родине, русскому народу, в силу которо- го Чехов всегда непоколебимо верил. Этим чеховским оптимизмом, как животворящей постой, обрызганы станины его книг. Верный сын России Чехов и нынче идет в ногу с нами, в великой Отечественной войне.	vol-5848-page-03-seg-020-1579-2321-2241-2675.png
5848	3	1579	2689	2235	2797	11	0.95090	Счастлива литература, имеющая та- ких предков! - говорит в заключение Леонов.	vol-5848-page-03-seg-021-1579-2689-2235-2797.png
5848	3	1575	2799	2237	3152	51	0.94969	Тепло встречают присутствующие появ- ление по трибуне народной артистки Со- юза ССР 0. Л. Книппер-Чеховой. Свою взволнованную речь она начинает упомн- нанием того дня, когда в грозный час немецкого наступления на Москву това- рищ Сталин назвал имя Чехова среди самых дорогих для русского сердца имен. символизирующих славу, силу и гордость нации.	vol-5848-page-03-seg-022-1575-2799-2237-3152.png
5848	3	1573	3160	2233	3764	87	0.95510	Чехов жил великой жаждой обпов- линия и счастья для родной страны, говорит жена покойного Писателя. -- этом он уверенно и страстно писал в сво- их книгах. В нашей стране мечты Чехова воплощены в жизнь, То, что наш народ; в суровую пору жестоких боев так шт- роко и любовно отмечает 40-летие со смерти Чехова, является высшей наградой писателю, которого пароль приз- нал своим национальным художником. За это хочется от всей души сказать наро- 1y, правительству, партии, Сталину большое, сердечное спасибо! Собрание закончено. Величественно звучит Государственный гимн Советского Союза	vol-5848-page-03-seg-023-1573-3160-2233-3764.png
5848	3	1571	3772	2229	3985	30	0.93955	В заключение состоялся большой коп- перт, па котором мастера Московского Художественного театра, лучшие артисти- ческие силы Москвы и Ленинграда испол- нили отрывки из произведений Чехова. Концерт прошел с большим успехом.	vol-5848-page-03-seg-024-1571-3772-2229-3985.png
