volume_number	page_number	x1	y1	x2	y2	tokens_count	mean_confidence	text	image
5446	3	2327	4577	3000	5937	217	0.95080	фила-была фабрика и оказалось, что нет сырья для ее основного производства. Добыли сырье, трудными путями добыли. Тогда стали оглядываться, чем еще могут пригодиться. Надо работать для фронта. Это такое, с чем никогда не сталкивались. Ну, что ж, превратились в металлистов, приготовили смену, и фронт стал получать свое. Посмотрели лаборатория мало занята, ввели и ее в действие. Стали по- лучать глюкозу. Нехватает сахару в ней- кс. Где его добудешь? Подумали, подумали и наладили производство натоки. Изобре- тательство - это такая область, которая, если ты серьезно заняться, заманивает все дальше. Чем еще можно фронту помочь? -Наладили производства разных медицин- ских средств и неплохо получилось. Уже не фабрика стала, а комбинат самых раз- ных производств. Мало витаминов, где их достанешь среди зимы? А на седь- мом этаже пустует огромный цех. Крыша у него стеклянная. Чем не парники? Отеп- лили, отправились добывать из-люд снега землю, тискали в мешках в цех, достали удобрений, засели за книги, справочники, руководства, разрыли гряды. Если бы вы прошлись туда на седьмой этаж при ярком свете луны, то оказались бы на огороде, где 28 гряд с луком и чесноком спокойно греются под луной. Фантастика, а сколько людей спаслось этим луком и чесноком в прошлую грозную зиму. Потом выросло большое хозяйство за городом. Свой совхоз. Сейчас в дороге коровы. Приедут будет свое молоко. Так учила жизнь самим нахо-	vol-5446-page-03-seg-053-2327-4577-3000-5937.png
5446	3	3017	4110	3692	5211	187	0.95577	дить выход из пруднешних испытаний. Вы- учились. Надо только иметь волю к жизни и к борые. Все можно сделать. Обноси- лись открыли собственную пошивочную мастерскую, где каждый может починить одежду или сшить новую. Открыли сапож- ную починочную. Не надо ходить далеко в баню --- работают души с горячей водой. Не просто все это далось. Не просто те- перь фабрика в чистоте и теплоте. Есть да- же детский уголок, ясли. Дети. Тут лицо директора кривится от болезненного вос- поминания. Весной вышли дети погулять, и надо же так, первый же снаряд врезал- ся в их группу, и когда- прибежали, вокруг лежали беспомощные, истекающие кровью малютки, разорванные тела, платьица в крови. Хоронили всех вместе в братской могиле. Этой весной поставят памятник общим любимцам. После этого страшного случая не надо было и митингов. Люли ра- ботали так, как могут только ленинград- цы, полные чувства ненависти к злобному врагу, второй год терзалощему их родной город. Так живут многие фабрики и заво- ды, и когда будет написана их история в незабываемые дна Отечественной войны, это будет такая героическая литература, на которой будут учиться и перед которой будут в удивлении останавливаться буду- шие поколения.	vol-5446-page-03-seg-054-3017-4110-3692-5211.png
5446	3	3019	5284	3688	5738	71	0.95023	По тому, как зорко осматривается этот высокий человек с широким лицом и тя- желыми движениями, по тому, как внима тально он слушает собеседника, видно, что он в Ленинграде впервые. Так оно и есть Он только что прибыл сюда в команди- ровку. Он защитник Сталинграда, даже климат ввергает его в недоумение. - Это что же, - говорит он, побазы- вая на лужи, ------ ряд морозы и снег будет, зима вернется, или как?	vol-5446-page-03-seg-055-3019-5284-3688-5738.png
5446	3	3017	5748	3692	5937	31	0.93715	Нет, говорят ему, --- это наша ленинградская весна, зима кончилась. Ведь у нас, как никак, а приморский город. нас климат особенный. Посмотрите на об- лака, таких облаков нигде нет они с	vol-5446-page-03-seg-056-3017-5748-3692-5937.png
5446	3	3707	4116	4375	4220	18	0.94785	моря, мягкие, большие, красивые, вряд ли есть сходство со Сталинградом у нашего города? Но сталинградец говорит - есть	vol-5446-page-03-seg-057-3707-4116-4375-4220.png
5446	3	3709	4235	4381	4846	102	0.94420	думал, по правде говоря, что ваши трудности преувеличены, но познакомился на деле, повстречался с народом, погово- рил: да, можете равняться со Сталингра- дом. Конечно, трудности другие, но труд- ностей хватает. Рассказать вам для анек- дота? Сбрасывают раз в Сталинграде нем- цы листовки, смотрим, что такое? Там написано, что мы в осаде и нам они, фри- цы, голодной смертью угрожают. Оказы- вается, они по ошибке листовки, предна- значенные для Ленинграда, нам сбросили, опростоволосились. Блокада Ленинграда прорвана, но не снята. Придет время, когда мы кончим с немцем под Ленингра- дом. Да, хорошо, чтобы и здесь было сход- ство со Сталинградом. Вот это будет дело!	vol-5446-page-03-seg-058-3709-4235-4381-4846.png
5446	3	3707	4863	4382	5895	157	0.94824	Сегодня весь город смотрит героиче- скую хронику Сталинграда. На 60.1%- скую твердыню идут бесконечные отряды гитлеровцев, но вот все меняется, и вче- рашние налетчики, мнившие сейя победи- телями Волги, вылезают из подвалов, по- смахивая грязными тряпками, сдаваясь в плен. II бредут, скосив глаза, как волки, их генералы во плаве с самым незадачливым фельдмаршалом Паулюсом, схваченные в стальное кольцо Красной Армией. И беско- ночной вереницей лежат трупы захватчиков, темнеют груды брошенных орудий, сожжен- ных самолетов, пленных танков. Тащится в плен фриц в соломенных эрзац-валенках под дружный смех всего зала, и у ленин- градцев где-то в тайниках сердца живет та надежда, что со временем станет явью: схватить фрицев под Ленинградом в такое же смертельное кольцо, зажать их крепко заставить вылезти их из дотов и дзотов с поднятыми вверх руками, с криком: «Гит- лер капут!" Перекличка этих двух городов была слишком родственна. Ленинградцы жаждут, чтоб и конец великого сражения Невы был похож на то, что случилось на берегах далекой Волги.	vol-5446-page-03-seg-059-3707-4863-4382-5895.png
5446	3	3741	5912	4237	5944	3	0.89719	ЛЕНИНГРАД. (По телеграфу)	vol-5446-page-03-seg-060-3741-5912-4237-5944.png
5446	4	3598	177	4265	211	8	0.88074	31 марта 1943 г., среда, № 75 (5446)	vol-5446-page-04-seg-002-3598-0177-4265-0211.png
5446	4	385	298	1346	376	4	0.91193	Он был в Бранденбурге	vol-5446-page-04-seg-003-0385-0298-1346-0376.png
5446	4	194	404	864	659	56	0.97069	Меня зовут Виктором. Родился я в 1926 году в городе Чугуеве. Я воспиты- вался у бабушки. Пять лет учился в сред- ней школе, а потом в Харькове, в ремес- ленном училище. Немцы к нам, в Чугу- ев, ворвались осенью 1941 года. Меня за- брали на работу в Германию 12 мая. 14-го мы уже были в Харькове.	vol-5446-page-04-seg-004-0194-0404-0864-0659.png
5446	4	194	667	864	1121	88	0.96910	четыре часа утра мы выехали и? Харькова. Больше двух тысяч человек по- грузили в большой эшелон, по шестьде- сят человек на один телячий вагон. В вагонах - было тесно, грязно, неуютно. Больше всего было молодежи и подрост- ков из Харькова и окрестностей. Попада- лись и семейные, с женами и ребятишкамн. Только Днепропетровске впервые дали горячую пищу. Такая это была бурда мутная и жидкая, что ее бы и собаки не стали есть. Пробрал нас голод, и мы еще на нашей земле стали с себя последнюю рубашку на еду менять.	vol-5446-page-04-seg-005-0194-0667-0864-1121.png
5446	4	194	1128	860	1378	42	0.95979	Проехали Польшу. Началась Восточная Пруссия. Как только эшелон пересек границу, все двери и люки наглухо закры- ли. Стражу усилили. Целые сутки взапер- ти держали. Даже по самым неотложным надобностям из вагонов не выпускали. Перед станцией Новый Бранденбург оста- новили поезд в поле.	vol-5446-page-04-seg-006-0194-1128-0860-1378.png
5446	4	194	1391	860	1609	38	0.97329	Пришли немецкие вахтманы из лагеря и строем повели через город. В лагере, где нам предстояло жить, было тысячи четыре разного народа - русских, французов, по- ляков военнопленных. Здесь опять мы обмывали тело холодной водой, а желудки теплой бурдой.	vol-5446-page-04-seg-007-0194-1391-0860-1609.png
5446	4	192	1616	858	2025	80	0.96229	На другое утро, в воскресенье, «паны»- хозяева понаехали. Начали нашего брата нарасхват отбирать. Чуть не до драки де- ло доходило. Спорили. Ругались. Друг у друга из-под носу рабочих уводили. По- пал и я в группу к одному толстому ста- рому немцу. Только он нас из лагеря вы- вел навстречу комендант, или, как его там называли, лагерфюрер Виккер. По- лопотали они немного, погорячились, рука- ми помахали, и ушел он, не солоно хле- бавши, а нас Виккер обратно повел за колючую проволоку.	vol-5446-page-04-seg-008-0192-1616-0858-2025.png
5446	4	190	2034	856	2251	44	0.95006	Стали мы в лагере жить. I оняют на работу. Дают утром по маленькому лом- тику макухи да чай из сухих листьев кра- пивы. Днем баланды противной по чашке на брата, а вечером ничего. От такой жизни все носы повесили. Видим --- пра- падать приходится.	vol-5446-page-04-seg-009-0190-2034-0856-2251.png
5446	4	192	2263	858	2512	47	0.96510	Задумали мы на третий день лагерной жизни убежать. Втроем выползли за про- волоку. Идем по выгону, где коров пасут, а навстречу нам лагерный жандарм. Попа- лись. Спрятаться было некуда, Привел нас жандарм обратно в лагерь, а там известное дело, шесть суток карцера на голодовке и весь расчет.	vol-5446-page-04-seg-010-0192-2263-0858-2512.png
5446	4	190	2520	858	3462	194	0.96816	Отсидел я свон шесть суток в карцере совсем стал тощий, как спичка. Пришел в барак, а там идет сортировка и отбор по профессиям для работы на заводах. свою профессию слесаря-лекальщика скрыл записался чернорабочим. хоте- лось идти на завод. Рассказывали лагер- ные, что там ребята у тисков по 15 -18 часов стоят, кормежка плохая, мрут, как мухи. Говорили, что с завода удрать труд- нее, чем из лагеря или с полевых работ. А удрать я решил твердо. Только случая удобного дожидался. Работать не было сил. Однажды упал я у тачки. Расправа со мной была короткая. Отправили в го- родскую тюрьму. Там в карцер втолкну- ли. Карцер вроде каменного шкафа в сте- не. Темно, тесно. Ни сесть, ни лечь. Сте- ны сырые, холодные. Пол цементный, а на полу вода. Пища - кусок хлеба да круж- ка воды. Трое суток я простоял в этом каменном шкафу. И спал стоя. На четвер- тые сутки услышал ночью звон железа и топот многих ног. Тюремщик отпер дверь моего ящика и приказал выходить. Приве- ли меня в общий коридор. Приказали свою одежду снять. Дали арестантские штаны и рубаху из грязной мешковины н тяжелые деревянные колодки. На руки и на ноги надели кандалы.	vol-5446-page-04-seg-011-0190-2520-0858-3462.png
5446	4	189	3481	854	3639	26	0.96771	Вывели нас, тридцать арестантов, на двор. Посадили в закрытый грузовик и повезли. Машина остановилась у ворот огромного, обнесенного высоким, в несколь- ко рядов, проволочным заграждением, конц-	vol-5446-page-04-seg-012-0189-3481-0854-3639.png
5446	4	884	404	1552	591	32	0.94578	лагеря для штрафных. Привели нас к большому сараю. Выстроили гуськом приказали: -- бегом марш! Два жандарма у дверей встали и каждому в спину ку- лаком и ногой поддают. Мы ввалились в барак.	vol-5446-page-04-seg-013-0884-0404-1552-0591.png
5446	4	881	599	1550	1039	90	0.96719	На следующее утро меня вместе с дру- гими погнали грузить цемент. Наваливали каждому на спину по два бумажных меш- ка с цементом по пятьдесят килограммов каждый. Взрослые еще носили, а мне пришлось трудно. На первой носке я кое- как дотащился до места. А когда вторую кладку взвалили, почувствовал, что у меня в спине что-то хрустнуло. В глазах пому- тилось, и упал я тут же около штабеля. При Пришел в себя весь мокрый. На меня ведро холодной воды вылили, чтобы при- вести в сознание. Надсмотрщик немец из- ругал меня и избил.	vol-5446-page-04-seg-014-0881-0599-1550-1039.png
5446	4	883	1051	1548	1300	45	0.95974	Проработал я на цементном складе три дня. В воскресенье в каретах, в бричках на автомашинах и велосипедах понаехали в лагерь «паны» немецкие помещики и кулаки. Стали отбирать людей на поле- вые работы. Меня никто брать не хотел. Совсем я отощал и стал щуплый, как воробей.	vol-5446-page-04-seg-015-0883-1051-1548-1300.png
5446	4	879	1308	1546	2123	148	0.97403	В эти дни у нас в лагере большое про- исшествие было. На ново-бранденбургском авиационном заводе работала группа во- еннопленных французов. Они дружили четырьмя пленными советскими летчиками Испытательный и учебный заводской аэро- дром был поблизости от того места, где заключенные на поле работали. И заду- мали летчики улететь из плена. Французы для них выведали все порядки на аэрс- дроме - когда там испытание и обучение идет, когда никого не бывает и какие ма- шины заправленные остаются на линейке. B условленный день летчики, работая вместе с другими на прополке картофеля, незаметно шмыгнули в высокую пшеницу, оттуда переползли к аэродрому. Ha аэродроме никого не было, на обед ушли. Бросились они к указанной французами двухмоторной машине, завели ее, и все четверо, как были в кандалах, улетели. Немцы тревогу объявили. Самолеты в догоню поднялись. Догнали ли они бегле- цов не знаю. У нас в лагере после этого случая большой шум и разговоры были.	vol-5446-page-04-seg-016-0879-1308-1546-2123.png
5446	4	877	2134	1541	2414	52	0.97247	Жестоко немцы расправились с остав- шимися заключенными за этот побег. На- чалось дознание. Ничего дознаться не могли. Тогда стали расправляться. Особен- но досталось французам. Их секли шпа- гами, плашмя, по спине. Давали по пять- десят ударов, и многие из наказанных уже больше не встали со скамейки и отпра- вились на тот свет.	vol-5446-page-04-seg-017-0877-2134-1541-2414.png
5446	4	877	2424	1541	3025	122	0.96259	От голодовки начались у меня чирьи- фурункулы. Пошел к лагерному врачу, русскому, из Киева. Осмотрел он меня, стал расспрашивать, кто я и откуда? Рас- сказал. Оказалось, что он моего дядю, военного врача, знает. Осмелел я и сказал что хочу домой убежать. Он обещал по- мочь. Осень уже началась. Холодно стало и дожди пошли. Велел мне врач просту. деться. Я три ночи под дождем на земле лежал и простудился. Стал у меня плев- рит. Извелся я от него! совсем. В голове много седых волос появилось. А все-таки врач свое слово сдержал. Залечил меня так, что и комиссию мы с ним обманули. Выписали мне постановление, что инвалид, к труду негоден. Дали документ на руки, что освобожден и могу с попутным эше- лоном следовать домой.	vol-5446-page-04-seg-018-0877-2424-1541-3025.png
5446	4	879	3029	1541	3121	13	0.98254	Простился я с врачом и переводчиком, которые мне помогали, и отправился в путь-дорогу.	vol-5446-page-04-seg-019-0879-3029-1541-3121.png
5446	4	877	3129	1539	3507	69	0.96286	Много городов немецких, польских и со- ветских проехал. В Любгке был, видел, как здорово англичане его бомбами отде- лали. Так им, немцам, и надо! И в Дан- циге был. Тоже, видать, что летчики пр- работали. Когда Варшаву проезжал, там на станцию партизаны напали, пути раз- рушили, запалили семь инстерн с горючим Говорили, что в суматохе из соседнего концлагеря 25 тысяч заключенных разбе- жались. Полуживой добрался я до Чу- гуева.	vol-5446-page-04-seg-020-0877-3129-1539-3507.png
5446	4	909	3524	1508	3636	12	0.94836	Со слов Виктора К. из города Чугуева записал А. Сурков ДЕЙСТВУЮЩАЯ АРМИЯ.	vol-5446-page-04-seg-021-0909-3524-1508-3636.png
5446	4	533	3717	1196	3768	3	0.93578	Волнения в Брюсселе	vol-5446-page-04-seg-022-0533-3717-1196-3768.png
