volume_number	page_number	x1	y1	x2	y2	tokens_count	mean_confidence	text	image
5476	2	3673	4628	4338	6040	151	0.95714	25. Капитана государственной безопас- ности Гребенюка Филиппа Корнеевича 26. Старшего лейтенанта Гринцева Алек- сея Семеновича. 27. Капитана государственной безопас- ности Губина Константина Антоновича. 28. Капитана государственной безопас- ности Гукова Ивана Михайловича. 29. Подполковника Дирина Венедикта Дмитриевича. 30. Капитана государственной безопас- ности Дмитриева Виктора Алексее- вича. 31. Капитана государственной безопас- ности Дмитриева Ивана Акимовича. 32. Капитана Данковского Василия Сер- геевича. 33. Капитана государственной безопас- ности Дудника Ивана Митрофановича. 34. Подполковника Дюняшева Камальдн- на. Сераздиновича. 35. Старшего лейтенанта Егорычева Кон- стантина Петровича. 36. Капитана Ерина Федора Ивановича. 37. Майора государственной безопас- ности Ермакова Никиту Петровича. 38. Старшего лейтенанта Ермакова Нико- лая Ивановича. 39. Капитана государственной безопас- ности Ефремова Тихона Лаврентье- вича. 40. Старшего лейтенанта государственной безопасности Жарикова Федора Пет- ровича. 41. Капитана Жеглова Константина Пет- ровича. 42. Старшего лейтенанта Жиляева Илью Даниловича. 43. Капитана государственной безопас- ности Журавлева Ивана Ивановича. 44. Старшего лейтенанта Заваркина Ни- колая Михайловича. 45. Подполковника Запорожца Ивана Кор- неевича.	vol-5476-page-02-seg-066-3673-4628-4338-6040.png
5476	3	370	286	1034	322	7	0.91275	мая 1943 г., четверг. № 105 (5476)	vol-5476-page-03-seg-001-0370-0286-1034-0322.png
5476	3	2064	297	2668	335	5	0.92783	красная 3 B E 3	vol-5476-page-03-seg-002-2064-0297-2668-0335.png
5476	3	717	406	1273	474	1	0.92984	Обращение	vol-5476-page-03-seg-003-0717-0406-1273-0474.png
5476	3	356	489	1624	641	15	0.97371	коллектива рабочих, инженеров, техников и служащих Южно-Уральского никелевого комбината ко всем работникам предприятий цветной металлургии	vol-5476-page-03-seg-004-0356-0489-1624-0641.png
5476	3	307	662	981	1540	104	0.95194	Дорогие товарищи! B первомайском приказе 1943 года товарищ Сталин поставил перед нашей доблестной Красной Армией, перед всеми трудящимися нашей страны новые боевые задачи быть готовыми к решающим бит- вам с ненавистным врагом. «...война против немецко-фашистских захватчиков требует, чтобы Красная Армия получала еще больше орудий, танков, самолетов, пулеметов, автома- тов, минометов, боеприпасов, снаряже- ния, продовольствия. Значит необходи- мо, чтобы рабочие, колхозники, вся со- ветская интеллигенция работали для фронта с удвоенной энергией». Для нас, работников цветной металлур- гии, выполнить приказ Верховного Глаз- нокомандующего --- Маршала Советского Союза товарища Сталина означает дать стране, фронту столько цветных металлов, сколько необходимо для полного разгрома и уничтожения немецко-фашистских окну- пантов.	vol-5476-page-03-seg-005-0307-0662-0981-1540.png
5476	3	301	1544	973	1869	39	0.95000	Коллектив Южно-Уральского никеле- вого комбината, неоднократно занимавший передовое место среди предприятий Нар- комцветнета в период Всесоюзного социа- листического соревнования, в феврале по- лучил почетнейшую награду переходя- щее Красное Знамя Государственного Ко- митета Обороны, сохранив это знамя и в марте.	vol-5476-page-03-seg-006-0301-1544-0973-1869.png
5476	3	303	1871	973	2343	65	0.94585	В апреле --- итоговая месяце предмай- ского соцсоревнования --- коллектив Комби ната упорным трудом также добился высо- ких показателей работы и дал в Особый фонд Главного Командования трехсуточную продукцию сверх плана вместо двухсу- точной в нарте, сэкономив значительное количество топлива, электроэнергии и хим- продуктов. За истекшие четыре месяца 1943 года мы увеличили выпуск мелалла по сравне- нию с соответствующими месяцами 1942 года в 2,2 раза.	vol-5476-page-03-seg-007-0303-1871-0973-2343.png
5476	3	305	2345	973	2669	46	0.94963	Наша воля и решимость направлены на то, чтобы еще больше увеличить выпуск цветных и редких метамов. Для этого мы должны более полно использовать все на- ши производственные резервы. Мы берем на себя следующее социалис- тическое обязательство: 1) выполнить план II квартала к 24-лу июня 1943 года;	vol-5476-page-03-seg-008-0305-2345-0973-2669.png
5476	3	1005	667	1671	808	19	0.94623	2) увеличить количество добываемой руды и флюсов по сравнению с первым кварталом не менее чем на 60 процен- тов;	vol-5476-page-03-seg-009-1005-0667-1671-0808.png
5476	3	1003	812	1668	954	20	0.94822	3) сэкономить во II квартале 1943 года не менее 3.000 тонн кокса, 350 тонн мазута, 1 миллион киловатт-часов электро- энергии;	vol-5476-page-03-seg-010-1003-0812-1668-0954.png
5476	3	1007	960	1668	1028	10	0.93876	4) увеличить извлечение металла не менее чем на 2 процента;	vol-5476-page-03-seg-011-1007-0960-1668-1028.png
5476	3	1003	1034	1669	1136	13	0.93663	5) снизить себестоимость продукции по сравнению с 1-м кварталом на 5 процен- тов;	vol-5476-page-03-seg-012-1003-1034-1669-1136.png
5476	3	1001	1140	1669	1392	36	0.95555	6) успешно закончить увеличенный по сравнению с 1942 годом план весенне посевной кампании в своем подсобном хо- зяйстве, провести все необходимые агро- технические мероприятия тем, чтобы полностью обеспечить потребности коллег гива Комбината в овощах и картофеле.	vol-5476-page-03-seg-013-1001-1140-1669-1392.png
5476	3	1000	1398	1668	1723	44	0.95876	Мы призываем всех рабочих, инженеров, техников и служащих предприятий цветной металлургии еще шире развернуть социа- листическое соревнование за дальнейший непрерывный рост добычи руды и выпуска цветных и редких металлов, взять на се- бя конкретные социалистические обяза- тельства, обеспечивающие досрочное вы- по.гнение плана II квартала.	vol-5476-page-03-seg-014-1000-1398-1668-1723.png
5476	3	998	1734	1668	2055	39	0.95702	Организуем соревнование на звание луч. шего бурильщика, забойщика, крепильщи- ка и машиниста экскаваторов; лучшего классификаторщика и флотаторщика обога- тительной фабрики; лучшего горнового плавильщика, электролизника и банщика; лучшего мастера ветер-жакетных, отража тельных печей и конверторов; лучшего ли- тейщика и вальцовщика.	vol-5476-page-03-seg-015-0998-1734-1668-2055.png
5476	3	1000	2066	1666	2138	5	0.93799	Дорогие товарищи, работники цветной металлургии.	vol-5476-page-03-seg-016-1000-2066-1666-2138.png
5476	3	1000	2146	1664	2328	27	0.92334	Приложим все свои силы, свою энер- гию к тому, чтобы дать стране, фронту больше никеля, меди, алюминия, свинца, олова, вольфрама, молибдена и других цветных и редких металлов.	vol-5476-page-03-seg-017-1000-2146-1664-2328.png
5476	3	1001	2336	1666	2408	8	0.94287	Напряжением всех наших поможем Красной Армии разгромить врага.	vol-5476-page-03-seg-018-1001-2336-1666-2408.png
5476	3	1000	2410	1666	2558	20	0.93555	Под знаменем Ленина, под водительством Сталина, вперед на разгром немецко-фаши- стских захватчиков и изгнание их из пре- делов нашей Родины!	vol-5476-page-03-seg-019-1000-2410-1666-2558.png
5476	3	998	2563	1664	2668	13	0.91355	Да здравствует наш любимый вождь Верховный Главнокомандующий Маршал шал Советского Союза товарищ Сталин!	vol-5476-page-03-seg-020-0998-2563-1664-2668.png
5476	3	417	2690	1631	2926	36	0.94142	по поручению первомайского митинга коллектива ЮЖНО-УРАЛЬСКОГО НИКЕЛЕВОГО КОМБИНАТА Директор комбината МАЛИНИН. Парторг ЦК ВКП(6) ПАСКЕВИЧ. Предзавкома КАМЕНЕВ Секретарь Комитета ВЛКСМ ГОРЕЛИК. Начальник Горно-Рудного управле- ния комбината СПИВАКОВ. Начальники цехов и стахановцы: ДРОЗДОВ, АБЛИХИН, ТУРЧАК, ТОМАСОВ, РУСАКОВ.	vol-5476-page-03-seg-021-0417-2690-1631-2926.png
5476	3	459	3009	1514	3053	3	0.94178	ВРУЧЕНИЕ НАГРАД КОННОГВАРДЕЙЦАМ	vol-5476-page-03-seg-022-0459-3009-1514-3053.png
5476	3	301	3070	981	3616	73	0.93721	ДЕЙСТВУЮЩАЯ АРМИЯ, 5 мая. (Спец- корр. ТАСС). На-днях большой группе гвардейцев-конников части, которой коман- дует генерал-майор Шарабурко, были вру- чены ордена и медали Советского Союза. Большинство награжденных прошло весь боевой путь своего гвардейского соединения. Одну из блестящих операций осущест- вил молодой командир разведывательного дивизиона гвардии капитан Бобровский. Узнав от партизан, что в одном селе рас- положились 2 полка румын, командир ди- визиона ночью внезапно атаковал в кон- ном строю во много раз превосходящего	vol-5476-page-03-seg-023-0301-3070-0981-3616.png
5476	3	994	3074	1664	3613	76	0.94051	противника и добился победы. Два враже ских полка были уничтожены почти пол- костью. Командование фронта наградило- Бобровского орденом Александра Невского. За время последних боев конники уни- чтожили до двадцати железнодорожных эшелонов с вооружением, 30 слайдов с во- енным имуществом, 25 танков, до 700 не- приятельских солдат и офицеров. Ордена вручал гвардии генерал-майор Шарабурко --- опытный и бесстрашный ка фалерист. Среди награжденных --- гвардии бандита Пучков, гвардии майор Иванов, гвардии старший лейтенант Гуляев, стар- ший сержант Черкашин.	vol-5476-page-03-seg-024-0994-3074-1664-3613.png
5476	3	1715	1649	3028	1709	17	0.94528	СЕВЕРО-ЗАПАДНЫЙ ФРОНТ. Зенитный расчет младшего сержанта Степанкина в недавних боях сбивший 4 немецких самолета, на огневой позиции.	vol-5476-page-03-seg-025-1715-1649-3028-1709.png
5476	3	2489	1730	3002	1759	4	0.91457	Снимок капитана П. Бернштейна.	vol-5476-page-03-seg-026-2489-1730-3002-1759.png
5476	3	2076	1850	2654	1924	3	0.88856	м а н	vol-5476-page-03-seg-027-2076-1850-2654-1924.png
5476	3	1857	1948	2738	2540	125	0.96933	Когда в кавказском кавполку я вижу казака На белоногой скакуне гнедого косяка, В черкеске с красною душой и в каске набекрень, Который хату до сих пор еще зовет «курень», Меня не надо просвещать. Его окликну я: - Здорово, конный человек, таманская земля! От Крымской от станицы до Чушки до косы Я обошел твои, Тамань, усатые овсы, Я знаю плавней боевых кровавое гнильцо, Я хату каждую твою могу узнать в лицо. Бывало с фронта привезешь от казака письмо Тебя усадят на тахту под саблею с тесьмой, И небольшой крестьянский зал в обоях из газет Портретами фельдфебелей начнет на вас глазеть. Три самовара закипят, три лампы зажужжат, Три девушки наперебой вам голову вскружат, Покуда мать не закричит и, взяв турецкий таз, Как золотистого коня, не выкупает вас.	vol-5476-page-03-seg-028-1857-1948-2738-2540.png
5476	3	1852	2548	2827	3577	222	0.97293	Тамань моя, Тамань моя, форпост моей страны! Я полюбил в тебе уклад батальной старины, Я полюбил твой ветерок военно-полевой, Твои железные ручьи и гордый говор твой. Кавалерийская земля! Тебя не смять никак! Что есть на свете ближе слов: «свобода» и «казак»? Чужое знамя над тобой, чужая речь в дому, Но знает враг, что никогда не сдашься ты ему. Ветхозаветные дедки с зеленой бородой, Идя заложниками в тыл степенной чередой, Наказывают передать джигитам молодым, Чтоб мол без дум о стариках громили немцев в дым. Девчата статные твои в пальто из полотна Встречают ночью партизан за клуней у плетня, Где и луна, и соловьи, и дикий виноград... Но говорят не о любви - о мести говорят. Тамань моя! Тамань моя! Весенней кутерьмой Не рвется гусь с такой тоской издалека домой, С какою тянутся к тебе через огонь и сны Твой станичные полки, кубанские сыны. Тамань, Тамань! От их лица тебе я говорю: Не быть владыкою твоим фашистскому зверью! Мы отстоим тебя, Тамань, за то, что ты века Стояла грудью боевой у русского древка; За то, что где бы ни дралось, развеяв чубовьё, Всегда мечтает о тебе казачество твое; За этот дом, за этот сад, за море во дворе, За этот парус вдалеке, за чаек в ноябре, За смех казачек молодых, за эти песни их, За то, что Лермонтов бродил на берегах твоих. Илья СЕЛЬВИНСКИЙ,	vol-5476-page-03-seg-029-1852-2548-2827-3577.png
5476	3	1823	3580	2354	3611	2	0.95188	СЕВЕРО-КАВКАЗСКИЙ ФРОНТ	vol-5476-page-03-seg-030-1823-3580-2354-3611.png
5476	3	3095	402	4415	550	15	0.97015	Налеты нашей авиации на железнодорожные узлы БРЕСТ, ГОМЕЛЬ, БРЯНСК И НА ПОРТЫ ЯЛТА И КОНСТАНЦА	vol-5476-page-03-seg-031-3095-0402-4415-0550.png
5476	3	3072	565	3742	779	32	0.93310	В ночь на 5 мая наша авиация дальне- го действия произвела массированные на- леты на железнодорожные узлы Брест, Го- мель, Брянск и военные склады в этих го- родах. В результате бомбардировки возни-	vol-5476-page-03-seg-032-3072-0565-3742-0779.png
5476	3	3761	565	4434	669	13	0.95875	кло много пожаров и наблюдались сильные взрывы складов боеприпасов и железнодо- рожных составов.	vol-5476-page-03-seg-033-3761-0565-4434-0669.png
5476	3	3766	671	4434	778	12	0.92696	Наша морская авиация бомбардировала порты и Констанца и находившиеся там суда противника.	vol-5476-page-03-seg-034-3766-0671-4434-0778.png
5476	3	3243	861	4256	929	2	0.93031	Нерадивые интенданть	vol-5476-page-03-seg-035-3243-0861-4256-0929.png
5476	3	3258	946	4237	981	5	0.92571	От специального корреспондента «Красной звезды»	vol-5476-page-03-seg-036-3258-0946-4237-0981.png
5476	3	3066	1009	3740	1614	94	0.97362	Повседневное внимание к быту фронто- виков первейшая обязанность работни- ков интендантской службы. Главное, что требуется от них, организовать дело так, чтобы бытовые нужды бойцов и командиров во-время удовлетворялись всем положенным и работа интендантской служ- бы была целиком подчинена выполнению боевых задач данной частью. Но, как видно, в управлении тыла N соединения (интендант подполковник интендантской службы Карцев) забывают об этих элементарных истинах. Здесь ин- тенданты чрезмерно увлекаются писанием всяческих директив и распоряжений и за канцелярскими хлопотами не видят жи- вого дела. Они сочиняют бумажки, напра- вляют их в подведомственные управления и считают, что всё сделано.	vol-5476-page-03-seg-037-3066-1009-3740-1614.png
5476	3	3064	1626	3736	2366	124	0.97299	Переход частей с зимнего обмундирова- ния на летнее требует большой поворот- левосин и организованности от интендан- тов, здесь же этого незаметно. N гвардей- ская дивизия в начале зимы сдала на ар- мейские склады кожаную обувь в хоро- шем состоянии, но там к. ремонту этой эбуви отнеслись халатно, обезличили ее и теперь выдали дивизии вместо хорошей обуви большой процент недоброкачествен- ной: плохо отремонтированной или малых размеров. Работа в армейских сапожных мастерских поставлена неудовлетворительно. Во время ремонта размеры обуви помечались кое- как, мелом. В результате и перепутали всю обувь. В дивизии, о которой шла речь выше, сейчас создалось такое поло- жение: обуви по количеству вполне доста- говно, а ботинок имеется даже солидный запас, но зато нехватает нужных разме- ров, большая партия обуви нуждается в повторном ремонте.	vol-5476-page-03-seg-038-3064-1626-3736-2366.png
5476	3	3064	2372	3739	2662	48	0.97424	Каждый день люди шлют письменные запросы в интендантство соединения, по- сылают туда нарочных, требуя починочно- го материала. Интендант тов. Карцев рав- кодушен к этим просьбам и требованиям, хотя он имеет приказ командования обес- печить части и учреждения починочным материалом. Чтобы отвязаться от назойли- бых запросов и переложить известную	vol-5476-page-03-seg-039-3064-2372-3739-2662.png
5476	3	3761	1009	4431	1296	49	0.97661	долю ответственности на других, тов. Кар- цев решил принять кое-какие меры. Че- рез два дня после получения пись- менного приказа он сочинил бумажку за № 0339/32, которая предписывала работни- кам тыла дивизии: «Использовать все воз- можности по выработке кожевенных мате риалов своими силами из сырья, изыскан- нога на месте".	vol-5476-page-03-seg-040-3761-1009-4431-1296.png
