volume_number	page_number	x1	y1	x2	y2	tokens_count	mean_confidence	text	image
5104	3	3985	1523	4654	2640	199	0.96251	Поступила чернорабочий, но работа ла всего 8 дней и сейчас же ее перевели на станок, рассказывал Иван Саввич... Пишет, что как только закончится война, то мы, мол, с тобой полем в Мо- себе и будем жить в своей столице... Вот так поговорили трое о самом близ- ком для них и как-то сразу подружились поправились друг другу. Все ясно было их простой трудовой жизни до войны, от на была у них радость - сделать свое дело хорошо, красиво, добротно. здесь, на полях отечественной войны, они встретились, как старые знакомые. Не слу- чайно вышло так, что в последнем для них бою эти трое бесстрашных оказались впе- реди всех. Не случайно, когда смерть на- висла над всем взводом, эти трое комму- нистов, не сговариваясь, без команды, по рисуясь одному велению сердца, бросились пряно к вражеским амбразурам, чтобы за- крыть их своими телами. Легка смерть, когда пуля поражает вне- запно, когда ее не видишь, не ждешь. Но какую силу нужно иметь, чтобы бежать навстречу своей неизбежной гибели? Чувствовать, что ты последний раз бе- жить по своей родной земле, что ты пос- ледний раз видишь бот это низкое зимнее небо и крыши русской деревни, завеян- ной снегом, в последний раз слышишь че- ловеческий голос...	vol-5104-page-03-seg-049-3985-1523-4654-2640.png
5104	3	3983	2644	4652	3271	100	0.96678	Все это чувствовали сознавали трое бесстрашных и все-таки бежали навст- речу пулеметным очередям. Победа на ненавистным врагом была для них дороже жизни. На фоне снежного поля их фигуры были отчетливо видны немецким пулемет- чикам. Стремительно надвитаясь, эти фи горы все увеличивались в размерах, заго раживая собой поле боя. Немецкие пуле- метчики стреляли в них, почти не целясь, от охватившей их оторопи никогда не приходилось видеть такой смелости и презрения к смерти. Вдруг что-то темное плотно закрыло амбразуры в одном дзоте, в другом, в третьем. II немецкие пуле- метчики поняли, что они побеждены мо гучей и неведомой им силой самопожертео- вания.	vol-5104-page-03-seg-050-3983-2644-4652-3271.png
5104	3	3981	3277	4648	3589	46	0.95998	В тишине зимнего дня перед разру. шенными дзотами, обнажив головы, стол- ли бойцы Красной Армии, потрясенные величием подвига трех коммунистов. они, припав к анбразурам. лежали в оди наковых позах, сжав застывшими навеки руками стволы пулеметов, и весь снег вокруг был алый, точно озаренный восхо дящим солнцен.	vol-5104-page-03-seg-051-3981-3277-4648-3589.png
5104	3	3991	3609	4606	3723	8	0.92044	Политрук Л. ВИЛКОМИР ВОЙСКА ГЕНЕРАЛА МЕРЕЦКОВА (По телеграфу).	vol-5104-page-03-seg-052-3991-3609-4606-3723.png
5104	3	3367	3795	4586	3871	4	0.98787	Четверо против тридцати одного	vol-5104-page-03-seg-053-3367-3795-4586-3871.png
5104	3	3295	3901	3957	4325	65	0.95545	КАЛИНИНСКИЙ ФРОНТ, 17 февраля (По телеграфу от каш. спец. норр.). Май- ср Клещев выслушал боевой приказ Ге- роя Советского Союза полковника Байду- коба и отправится на аэродром. Перед снежной равниной, которая служила взлетной и посадочной площадкой, в низ- 9 корослом кустарнике стояли истребители Они были тщательно замаскированы. Май- ор быстро нашел нужные машины, при- нял доклады об их готовности к взлету и сел в кабину.	vol-5104-page-03-seg-054-3295-3901-3957-4325.png
5104	3	3297	4333	3951	4504	26	0.95093	Несколько секунд спустя четверка от Важных оторвалась от земли и взмыла евысь. Они летели в сторону фронта, что- бы прикрыть наши войска от воздействия вражеской авиации.	vol-5104-page-03-seg-055-3297-4333-3951-4504.png
5104	3	3295	4514	3953	4858	49	0.95673	Командир этой группы майор Клещов летчики-истребители капитан Кобылок- ный, младшие лейтенанты Масляк и Мед- ведев, строго соблюдая строй, вниматель- но смотрели по сторонам, вверх, вниз Требовалось большое искусство, чтобы во время заметить на горизонте или в без- лонном нее маленькую серую точку самолет и быстро определить: свой или чужой.	vol-5104-page-03-seg-056-3295-4514-3953-4858.png
5104	3	3295	4868	3953	5176	50	0.95605	Прошло уже немало времени с того но- мента, как четверка покинула свой аэро ром. Уже приближалась пора возвраще- ния на свою базу половина горючего была израсходована. В этот момент дале- ко в небе появились какие-то маленькие силуэты. Их было много. К расположение наших войск летел тридцать один фаши- стский самолет	vol-5104-page-03-seg-057-3295-4868-3953-5176.png
5104	3	3291	5188	3951	5709	73	0.95252	Силуэты росли. Четверка неслась наперерез. Расстояние заметно сокраща- лось. Наши летчики теперь отчетливо ви- дели 18 «Юнкерсов», 4 «Хеншеля» и «Мессершмиттов». Соотношение сил было явно неравное но тов. Клещев решил дать бой врагу... Легким покачиванием крыльев своей ма шины и рывком вперед он передал это решение товарищам. Истребители с раз- ных сторон обрушились на фашистов. Немпы, сознавая свое численное пре- восходство, обратили мало биомания на горстку наших смельчаков. Бомбардиров шики строем лететь вперед	vol-5104-page-03-seg-058-3291-5188-3951-5709.png
5104	3	3987	3909	4638	4047	18	0.96387	"Мессершмитты" выдвинулись навстреч четверке, стремясь прекратить ей путь Белые полосы трассирующих пуль и сна- рядов скрестились наподобие сабель	vol-5104-page-03-seg-059-3987-3909-4638-4047.png
5104	3	3979	4057	4644	4434	57	0.96080	Четверка прорвалась сквозь вражески заслон и обрушилась на «Юнкерсов». По ка "Мессершмитты" делали разворот для новой атаки, един немецкий бомбардиров щик уже получил изрядную порцию детского свинца, загорелся и рухнул вниз Но вот вражеские истребители снова при- вели себя в порядок и насели на наших летчиков. Завязался бой между истреби- телями. Свои и чужие машины переме- шались	vol-5104-page-03-seg-060-3979-4057-4644-4434.png
5104	3	3981	4450	4642	4720	39	0.95408	Атмосфера разрядилась сразу после то- го, как один "Мессершмитт", об ятый пламенем, перешел в беспорядочное паде ние. Нервы фашистских летчиков не вы- держали. Оставшиеся восемь вражески истребителей вышли из боя и кинулись наутек, забыв о защите своих бомбарди- ровщиков	vol-5104-page-03-seg-061-3981-4450-4642-4720.png
5104	3	3975	4730	4644	5611	133	0.95339	Майор Клещов умело использовал это обстоятельство. Он быстро собрал свою четверку в кулак и повел ее на «Юнкер- сов» и «Хеншелей». Враг отчаянно со- противлялся. Два десятка его машин, сидя тесным строем, извергали ураганный сгонь. Чтобы избежать поражения. наша четверка рассыпалась и молниеносным ударом с разных сторон стремглав атако- вала немцев. Еще один "Юнкерс" свалил- сл на землю. Теперь немцы свернули с боевого курса и на максимальном газу стали умирать в сторону своих войск. Наши истребители преследовали их. Непрерывными атаками снизу и свер- справа и слева летчики Клещов, Ко- балочный, Масляк и Медведев растрепали строй немецких самолетов. "Юнкерсы" «Хеншели» бросились врассыпную, спаса- ясь бегством в одиночку. Четверка успела сбить еще два бомбардировщика. Этот замечательный бой длится ровно двадцать минут. Враг, потерявший четыре "Юнкерса" один "Мессершмитт", пос- пешно бежал, не сбросив ни одной бомбы	vol-5104-page-03-seg-062-3975-4730-4644-5611.png
5104	3	4099	5635	4598	5709	3	0.94330	Старший батальонный конисса	vol-5104-page-03-seg-063-4099-5635-4598-5709.png
5104	3	3491	5753	4418	5799	3	0.97449	ПЕСНИ ЗАЩИТНИКОВ СЕВАСТОПОЛЯ	vol-5104-page-03-seg-064-3491-5753-4418-5799.png
5104	3	3291	5809	3949	6099	35	0.95110	СЕВАСТОПОЛЬ, 17 февраля. (По теле- графу от наш, спец. корр. ). Политотде. армии выпустил сборник песен отважны: защитников Севастополя. Рожденные дни горячих боев с немецкими оккупан- тами, эти песни прославляют мужества наших пехотинцев, моряков, артиллерия-	vol-5104-page-03-seg-065-3291-5809-3949-6099.png
5104	3	3977	5809	4636	5973	18	0.93617	Поэт Гончаренко и композитор Матве- енко написали песню об артиллерийском полке, который недавно награжден орде- Ном Красного Знамени.	vol-5104-page-03-seg-066-3977-5809-4636-5973.png
5104	3	3975	5989	4630	6099	13	0.94597	Большой популярностью пользуются во шедшие в сборник фронтовые частушки также «Песня крымских партизан»	vol-5104-page-03-seg-067-3975-5989-4630-6099.png
5104	4	3847	446	4496	480	8	0.89274	18 февраля 1942 г., среда. Н: 40 (5104).	vol-5104-page-04-seg-002-3847-0446-4496-0480.png
5104	4	566	548	1000	718	3	0.87576	Черепа в тряпье	vol-5104-page-04-seg-003-0566-0548-1000-0718.png
5104	4	452	750	1109	922	25	0.96212	Фрицы не только убивают, они смакуют смерть. Они украшают свои рукава изо- бражениями черепа. Они разрывают моги- лы. Они любят трупы. Это --- жуки- могильщики.	vol-5104-page-04-seg-004-0452-0750-1109-0922.png
5104	4	450	932	1105	1109	24	0.94838	Одна из дивизий эс-эсовцев называется "Тотенкопф" "Мертвая голова" или «Череп». На знамени дивизии, на ее гру- зовиках, на документах, на рукавах солдат - черепа.	vol-5104-page-04-seg-005-0450-0932-1105-1109.png
5104	4	446	1117	1107	1361	36	0.95715	Этих рыцарей черепа наши бойцы позвательно потрелали. Имя дивизии «Мертвая голова» нам примелькалось: то дело «рыцарей» бьют. Любители черепа когут радоваться: на русской земле они достигли идеала - была у фрица голова, остаться от фрипа череп.	vol-5104-page-04-seg-006-0446-1117-1107-1361.png
5104	4	442	1371	1103	1629	30	0.96436	Зимой битую дивизию ждало новое испытание: «рыцари» малость продрогли. Командующий дивизией «Мертвая го- това» разослал приказ своего начальника, командующего 10 армейским корпусом. Этот приказ посвящен главным образом задним лапам фрицев:	vol-5104-page-04-seg-007-0442-1371-1103-1629.png
5104	4	440	1639	1099	1775	15	0.95870	«90 процентов обмороженных имеют гораженные ноги. Поэтому необходимо со всей беспощадностью приступить к сбору застенок".	vol-5104-page-04-seg-008-0440-1639-1099-1775.png
5104	4	438	1791	1093	1895	15	0.94597	Трудно понять, для чего командующий корпусом тратит бумагу: задолго до его приказа фрицы разули колхозниц.	vol-5104-page-04-seg-009-0438-1791-1093-1895.png
5104	4	436	1907	1093	2113	27	0.95255	командующий дивизией "Мертвая голо- ва», прочитав приказ начальника, заду- мался: что будет с ушами злосчастных "рыцарей"? Ведь кроме ног у франца имеются уши. И командующий дивизией приписал:	vol-5104-page-04-seg-010-0436-1907-1093-2113.png
5104	4	432	2127	1091	2310	18	0.94616	«Офицеры дивизии! На внешний вид солдат не приходится )обращать внимание. Если тряпки могут защитить уши, необходимо пользоваться гряпкани».	vol-5104-page-04-seg-011-0432-2127-1091-2310.png
5104	4	428	2328	1084	2572	37	0.95064	Хорошо сказано, с чувством. Где уж тут думать об облике отборной дивизии! Фрицы роются в грязном вшивом тряпье. На рукаве попрежному череп, но под СУКНОМ на голове «рыцаря» дамские рейтузы: фрица длинные уши, и эти уши мерзнут.	vol-5104-page-04-seg-012-0428-2328-1084-2572.png
5104	4	430	2578	1082	2718	18	0.95428	Назидательная картина: представитель первой в мире расы, солдат дивизион Мертвая голова", рыцарь черепа с голо- ой, обмотанной тряпьем.	vol-5104-page-04-seg-013-0430-2578-1082-2718.png
5104	4	424	2724	1082	3038	40	0.95145	Дама-Германия смотрит башенное конце. Что делает ее верный рыцарь? Потрясает мечом? Приложил длань боему питающему серицу? Командующий отвечает: «Нет, фрау Германия, достал тряпки. У него на голове рязные подштанники. Он не потрясает мечом не показывает на пылающее ердце: он чешется".	vol-5104-page-04-seg-014-0424-2724-1082-3038.png
5104	4	428	3048	1074	3116	8	0.94697	Летом они были мешочниками. Зимой ни стали тряпичниками.	vol-5104-page-04-seg-015-0428-3048-1074-3116.png
5104	4	764	3136	1034	3166	2	0.95701	илья эренбург	vol-5104-page-04-seg-016-0764-3136-1034-3166.png
5104	4	414	3234	1078	3781	57	0.95752	ИЗДЕВАТЕЛЬСТВА НАД СОВЕТСКИМИ ВОЕННОПЛЕННЫМИ В РУМЫНИИ НьЮ-ПОРК, 17 февраля. (ТАСС). Как сообщает анкарский корреспондент газеты "Нью-Йорк таймс", в осведомленных кру- гах заявляют, что германские и румынские власти резко сократили уже и без того мизерные нормы продовольствия для Детских военнопленных, находящихся в учынских концентрационных лагерях. Военнопленные голодают; среди них очень ного больных, Лечебная помощь военно. пленным не оказывается,	vol-5104-page-04-seg-017-0414-3234-1078-3781.png
5104	4	1289	546	2342	590	3	0.94924	ПРАВИТЕЛЬСТВО ВИШИ РАССТИЛАЕТСЯ...	vol-5104-page-04-seg-018-1289-0546-2342-0590.png
5104	4	1161	728	1415	754	3	0.94648	Рис. Бор. Ефимова.	vol-5104-page-04-seg-019-1161-0728-1415-0754.png
5104	4	1509	610	2426	736	23	0.96325	По сообщению Ассошиэйтед Пресс, правительство Виши согласилось предоставить в распоряжение немцев ту нисские порты, через которые будет идти снабжение итало-германских войск в Ливии.	vol-5104-page-04-seg-020-1509-0610-2426-0736.png
5104	4	1423	2087	2155	2123	4	0.88928	«Морские операции» адмирала Дарлана	vol-5104-page-04-seg-021-1423-2087-2155-2123.png
5104	4	1263	2204	2318	2336	6	0.95594	«Мы очень озабочены мыслями о будущем»	vol-5104-page-04-seg-022-1263-2204-2318-2336.png
5104	4	1407	2350	2182	2386	3	0.97707	ПРИЗНАНИЯ ГЕРМАНСКОЙ ГАЗЕТЫ	vol-5104-page-04-seg-023-1407-2350-2182-2386.png
5104	4	1109	2402	1773	2860	78	0.96333	стокгольм, 17 фе 17 февраля. (TACC). B германской газете «Гамбургер фремден- блатт» напечатана статья старшего лейте- нанта германской армии Блюда, в кото- рой он описывает один из боев на совет- ско-германском фронте: «Мы очень озабо- чены, --- лижет Блюд, --- мыслями о буду- щем. Наши потери велики. Все солдаты измучены. Наши части на передовых по- зициях сильно поредели. Утром начинает- ся ад, продолжающийся целый день. Co- ветские войска атакуют нас. В середине дня силы частей правого фланга приходят	vol-5104-page-04-seg-024-1109-2402-1773-2860.png
5104	4	1791	2408	2458	2856	76	0.96024	концу. Они понес. ти тяжелый урон от советских минометов, противотанковых и тяжелых орудий. Последние солдаты от- ступают штабу. Наша позиция обна- жается на протяжении 600 метров. Мы не можем направить туда резервную часть, так как не можем установить с ней связь. Наши посыльные, старающиеся пробрать- ся, задают на наших глазах один за дру- гим, скачиваемые советскими миномета- ми. На позиции остается небольшая часть. Связи с тылом у нас нет. Завтра утром опять начнется тот же ад».	vol-5104-page-04-seg-025-1791-2408-2458-2856.png
5104	4	1241	2920	2344	2978	3	0.98564	Немецкие оккупанты «разочарованы»	vol-5104-page-04-seg-026-1241-2920-2344-2978.png
5104	4	1107	2996	1767	3275	35	0.96078	СТОКГОЛЬМ. 17 февраля. (ТАСС). Газе- та "Кракауэр цейтунг" вынуждена при- знать, что украинский народ во временно оккупированных гитлеровцами районах Украинской ССР создает невозможные ус- товия существования гитлеровским кан- нибалам. «Повецение украинского народа, пишет газета, разочаровало.	vol-5104-page-04-seg-027-1107-2996-1767-3275.png
5104	4	1783	2996	2452	3273	34	0.96253	Украинцы не желают ничего делать без строгого приказа германских властей». Далее газета признает, что гитлеровцы не сумели за редкими исключениями найти желающих занять должности «бургомист- ров» и вынуждены привозить чиновников и полицейских из Германии.	vol-5104-page-04-seg-028-1783-2996-2452-3273.png
5104	4	1351	3339	2234	3381	3	0.93400	БОРЬБА ЮГОСЛАВСКИХ ПАРТИЗАН	vol-5104-page-04-seg-029-1351-3339-2234-3381.png
5104	4	1101	3401	1761	3783	52	0.95495	ЛОНДОН, 17 февраля, (ТАСС). Стам- бельский корреспондент газеты "Дейли телеграф энд морнинг пост" сообщает, что на-днях между югославскими партизанами и немецкими оккупантами в предместью города Лебано (в 30 милях к югу от Ниша) произошел 48-часовой бой, в ко- тором немцы потеряли 180 человек. Отмечается оживление партизанских действий в южной и юго-восточной части	vol-5104-page-04-seg-030-1101-3401-1761-3783.png
5104	4	1787	3401	2448	3783	45	0.95241	Несколько дней тому назад сильный партизанский отряд совершил нападение на германский воинский поезд близ Бела Палатка на железной дороге Белград Ниш. Поезд был серьезно поврежден. же- лезнодорожная линия была прервана, поезд мог продолжать путь лишь после того, как из Ниша были высланы спа- сательные отряды,	vol-5104-page-04-seg-031-1787-3401-2448-3783.png
5104	4	2678	562	3128	632	1	0.93955	Оборона	vol-5104-page-04-seg-032-2678-0562-3128-0632.png
5104	4	3130	558	3667	630	1	0.86714	Австралии	vol-5104-page-04-seg-033-3130-0558-3667-0630.png
