volume_number	page_number	x1	y1	x2	y2	tokens_count	mean_confidence	text	image
5476	1	962	301	2191	364	3	0.96189	Смерть немецким оккупантам.	vol-5476-page-01-seg-001-0962-0301-2191-0364.png
5476	1	261	379	2229	726	7	0.98148	ЦЕНТРАЛЬНЫЙ ОРГАН НАРОДНОГО КОМИССАРИАТА ОБОРОНЫ СОЮЗА ССР	vol-5476-page-01-seg-002-0261-0379-2229-0726.png
5476	1	303	753	578	810	3	0.91055	№ 105 (5476)	vol-5476-page-01-seg-003-0303-0753-0578-0810.png
5476	1	996	764	1533	815	5	0.93190	6 мая 1943 г., четверг	vol-5476-page-01-seg-004-0996-0764-1533-0815.png
5476	1	1964	768	2208	819	2	0.91824	ЦЕНА 20	vol-5476-page-01-seg-005-1964-0768-2208-0819.png
5476	1	2343	309	4381	728	51	0.97041	итлеровская Германия и ее армия потрясены и переживают кризис, но они еще не разбиты. Было бы наивно думать, что катастрофа придет сама, в порядке самотека. Нужны еще два-три таких мощных удара с запада и востока, какой был нанесен гитлеровской армии последние 5-6 месяцев, для того, чтобы катастрофа гитлеровской Германии стала фактом.	vol-5476-page-01-seg-006-2343-0309-4381-0728.png
5476	1	3909	743	4275	793	2	0.93365	H. Сталин.	vol-5476-page-01-seg-007-3909-0743-4275-0793.png
5476	1	275	882	1603	1132	8	0.97598	ИСКУСНО ОРГАНИЗОВЫВАТЬ ВЗАИМОДЕЙСТВИЕ, УМЕЛО УПРАВЛЯТЬ ВОЙСКАМИ В БОЮ	vol-5476-page-01-seg-008-0275-0882-1603-1132.png
5476	1	216	1163	926	4812	534	0.93942	Приказ Верховного Главнокомандующего Маршала Советского Союза товарища Сталина обязывает командиров всех родов войск и общевойсковых командиров «стать мастерами вождения войск, умело органи- зовать взаимодействие всех родов войск и управлять ими в бою». В этом требовании товарища Сталина, требовании Родины, вы- ражен один из основных законов победы на полях современной войны. Современный бой бой соединенных родов войск, в котором успех достигается согласованными усильным пехоты, танков, артиллерии, авиации и инженерных частей. Уметь искусно организовывать взаимодей- ствие во всех звеньях войскового меха- низма и между всеми родами оружия, на- учиться сохранять его на протяжении все- го боя означает, следовательно, на девять десятых обеспечить выполнение постов- ленной боевой задачи бак в обороне, так и в наступлении. Что значит унело организовать взаимо- действие? Это значит добиться дружных, согласованных действий всех родов войск и полного, наиболее эффективного исполь- зования возможностей каждого из них в ходе всего боя. II наша пехота, и танки, об- и артиллерия, и авиация сама по себе об- ладают достаточной боевой мощью. Но ког- да их удары тесно переплетаются, взаим- но дополняя друг друга, сила этих уда- ров многократно возрастает. Обеспечить именно такую органическую слитность уси- лий всех родов войск, бить по врагу не растопыренными пальцами, а одним, креп- ко сжатым кулаком --- вот долг команды- ра, организующего взаимодействие. - Чтобы достигнуть этого, нужно прежде всего тщательно, до мелочей, спланировать подготовить бой. Правильное использо- вание всех видов нынешней сложной воен- ной техники в интересах главного рода --- пехоты --- основной вопрос в зап- содействия. Успешное решение этого воп- роса возможно лишь в том случае, если пехотный командир и общевойсковые на- чальники знают, как должно, технику, на- стойчиво изучают ее. Но нельзя рассчиты- вать только на себя нужно вдумчиво прислушиваться и е голосу специалистов. Всесторонне наибольшей полнотой учитывая все тактические и технические свойства каждого вида оружия, командир, организующий взаимодействие, обязан пра- женять их именно так, именно в такое время, в таких условиях обстановки и ме- стности, когда это наиболее выгодно. Хорошая подготовка боя и всестороннее обеспечение его --- это верный залог успе- ха, но еще не саный услех. Чтобы пол- ностью постигнуть науку побеждать в сов- ременной войне, обеспечить отличное осу- ществление взаимодействия в ходе всего сражения, командир должен еще в совер- шенстве овладеть искусством управления войсками в динамике бол, научиться водить бойцов п технику по полян брани в усло- виях маневренных форм борьбы, как того требует товарищ Сталин. Самый образцовый план, самая тщатель- ная подготовка не иного стоят, если в первые же минуты подвижного боя коман- дир теряет связь с подразделениями и вы- пускает из своих рук управление ими. Современный бой прежде всего динамичен. Он требует от командира счета времени не часами и даже ве эннутажи, а секун- дами. Всякое промедление как с приня- тиен решения, так и с доведением его до исполнителей может повлечь за собой неу- дачу, а порой и привести поражению. Запоздают, например, танки, не перенесет артиллерия во-время огонь на вновь одна- - - ружившиеся огневые точки противника, - и первоначальный успех может свестись к нулю. Надо помнить также, что опередить противника это уже добрая половина победы. В то же время каждый промах в боевой работе командира, любая недлитель- ность в действиях могут быть использо- ваны неприятелем, вызвав новые труд- ности, потребовав дополнительных усилий, нарушив, в конечном счете, план бол, расстроив взаимодействие. Долг каждого	vol-5476-page-01-seg-009-0216-1163-0926-4812.png
5476	1	933	1172	1613	2318	171	0.95616	командира - научиться управлять своим- сками при быстро меняющейся обстановке, и, осуществляя сложный маневр, крепко держать в своих властных руках все звенья войск, все рода оружия. : Стойкость в обороне, смелый маневр, за- черпаемый окружением и уничтожением противника. в наступлении вот основ- ные тактические правила нашего команди- ра. Отвага и решительность во всех дей- ствиях вот железный закон его пове- дения на поле боя. Непреклонно осуще- ствляя этот закон, строжайше идержи- ваясь этих тактических правил, каждый командир окажется на высоте положения. Опираясь на свое командирское умение и на знание обстановки, он сумеет в крат- чайший срок правильно решить любую боевую задачу и найти верный выход из самого трудного положения. Воинское мастерство командира, решаю- щее успех взаимодействия, определяется не только его личными знаниями, но и его умением опираться во всех вопросах уп- равления войсками на своих ближайших помощников, специалистов и штабных командиров. Чем выше это умение, чем прочнее опирается командир на свой штаб. тем успешнее и быстрее решает он возни- кающие в бою задачи, тем гибче управ- ление войсками, устойчивее взаимодей- ствие.	vol-5476-page-01-seg-010-0933-1172-1613-2318.png
5476	1	899	2086	1597	4812	352	0.94359	Всякая попытка командира лично за- ныкаться всеми вопросами управления войсками, отгородиться в своей оператив- ной работе от специалистов, от паба или оставить в их ведении второстепенные функции неизбежно приводит к наруше- управления войсками. Именно те командиры, которые всё пытаются делать сами, не успевают за событиями. Они связаны грехом пополам справляются со своими обязанностями тогда, когда часть стоит на . . . месте, когда на фронте затишье. как только начинается бой и перед войсками возникает необходимость совершить на- невр, такие командиры подолгу не знают, где находятся и что делают под- чиненные им войска. Стремиться достичь бесперебойного управления боем помни штаба - значит не понимать всей слож- ности современной войны, значит переоце- нивать свои возможности и недооценивать всех трудностей, которые в бою сопут- ствуют войскам на шагу. Между командиров и его штабом должна быть полная согласованность в работе. Командир призван терпеливо и настойчиво учить личный состав своего штаба, доби- ваясь, чтобы люди понимали его с полу- слова, чтобы сни хорошо усвоили его воз- зрения и навыки. Командиры штаба, свою очередь, обязаны вникать во все не- лочи руководства боем, работать пнициа- тивно и не ждать по каждому вопросу от- дельных приказаний, всемерно похожая командиру в сложном и трудном деле уп- равления. В частности, штаб отвечает за все меры боевого обеспечения, за организа- цию разведен и свизь, он обязан доводить до подчиненных штабов и командиров волю своего начальника и постоянно контроли- ровать точное выполнение его приказов и распоряжений. Получив отправные указа- ния командира по организации взаимодей- ствия, начальник общевойскового штаба обязан сделать всё, чтобы добиться пре- дельной согласованности действий родов войск в процессе всего боя, Когда коман- дир учит свой штаб и во всей оператив- ной работе опирается на него, когда командиры штаба работают инициативно на деле помогают командиру быстро улав- швать пульс боя, видеть все изменения в обстановке и немедленно вносить нуж- ные поправки в действия своих войск, тогда части и соединения действуют согла- сованио, тогда они способны сохранить взаимодействие в любых условиях обста- новых и быстро маневрируют, успешно ре- шая все возникающие на поле боя задачи. Используя все силы, все средства, обес- печать образцовую организацию взаимодей- ствия родов войск, искусное управление войсками в бою!	vol-5476-page-01-seg-011-0899-2086-1597-4812.png
5476	1	423	4895	1364	4943	3	0.97440	День большевистской печати	vol-5476-page-01-seg-012-0423-4895-1364-4943.png
5476	1	210	4977	880	5155	25	0.94431	Вчера в Колонном зале Дома союзов состоялось общемосковское собрание, пос вященное Дню большевистской печати. С- докладом об очередных задачах советской печати выступил тов. Ем. Ярославский.	vol-5476-page-01-seg-013-0210-4977-0880-5155.png
5476	1	203	5159	880	6100	142	0.95444	Наша печать держит сейчас, в дни отечественной войны, серьезный экзамен, сказал тов. Ярославский. --- Это мо- гучее средство агитации, пропаганды и организации масс с первых дней войны заняло свое место в борьбе советского народа против немецких захватчиков. В блокированном городе Ленина люди с не- терпением ждали каждый номер «Ленин- градской правды», они знали, что в ней правда о положении на фронтах, о жизни Советского Союза; в самые тяжелые и напряженные дни боев за Сталинград «Сталинградская правда» выходила еже- дневно, призывая к стойкости и мужеству, укрепляя уверенность сталинградцев в том, что их славный город выстоит и победит. Тов. Ярославский приводит факты, по- казывающие, как советская печать помо- гост стране выполнять указание товарища Сталина о всемерной помощи фронту. В действующей армии, в тылу, в районах, освобожденных от немецко-фашистских захватчиков, громко звучит большевистское слово нашей печати, воодушевляя совет- сбой народ на борьбу за свою независи-	vol-5476-page-01-seg-014-0203-5159-0880-6100.png
5476	1	889	4977	1567	6099	155	0.95826	месть и свободу. Сейчас вся агитацион- ная, пропагандистская, организующая сила большевистской печати должна быть на- правлена на борьбу за быстрейшую реали- зацию первомайского приказа товарища Сталина - боевой программы действий Красной Армии и всего советского народа. Когда, заканчивая доклад, тов. Арос- лавский говорит о том, что в своей боте советский журналист должен учиться на замечательных образцах журналистской деятельности Ленина и Сталина --- наших великих учителей, --- в зале раздаются долго не смолкающие аплодисменты. С большим воодушевлением участники собрания приняли приветствие Верховному Главнокомандующему Маршалу Советского Союза товарищу Сталину. Клянемся Вам, дорогой Иосиф Виссарионович, --- говорится в привет- ствии, что работники большевистской печати, удвоив и утроив свою энергию, будут добиваться, чтобы самое острое орудие нашей партии --- печать действо- вала безотказно, чтобы каждое наше слово без промаха било по врагу и приближало час победы. Мы будем и впредь неустанно укреплять в миллионах советских людей любовь и преданность советской Родине, разжиталь их жгучую ненависть фаши- стским извергам. (TACC).	vol-5476-page-01-seg-015-0889-4977-1567-6099.png
5476	1	1753	895	3565	1161	17	0.92447	Ответы тов. И. D D. СТАЛИНА на вопросы корреспондента американской газеты «Нью-Йорк Таймс» и английской газеты «Таймс»	vol-5476-page-01-seg-016-1753-0895-3565-1161.png
5476	1	1633	1193	2639	1563	49	0.92926	Московский корреспондент американской газеты "Нью-Йорк Таймс" и английской газеты "Таймс" г. Паркер обратился к Председателю Совета Народ- ных Комиссаров СССР тов. И. В. Сталину с письмом, в котором он просил ответить на два вопроса, интере- сующие американскую и английскую общественность. Тов. И. В. Сталин ответил г-ну Паркеру следующим письмом:	vol-5476-page-01-seg-017-1633-1193-2639-1563.png
5476	1	1631	1580	2630	1831	22	0.93867	Господин Паркер! 3-го мая получил два Ваших вопроса относительно польско-советских отношений. Посылаю Вам мои ответы: 1. Вопрос: «Желает ли Правительство СССР видеть	vol-5476-page-01-seg-018-1631-1580-2630-1831.png
5476	1	2673	1195	3671	1279	9	0.90729	сильную и независимую Польшу после поражения гит леровской Германии"?	vol-5476-page-01-seg-019-2673-1195-3671-1279.png
5476	1	2713	1296	3208	1334	3	0.87940	Ответ. Безусловно, желает	vol-5476-page-01-seg-020-2713-1296-3208-1334.png
5476	1	2671	1341	3671	1485	19	0.92682	2. Вопрос: "На каких, с Вашей точки зрения, осно- вах должны базироваться отношения между Польшей и СССР после войны»?	vol-5476-page-01-seg-021-2671-1341-3671-1485.png
5476	1	2669	1493	3668	1719	32	0.93411	Ответ. На основе прочных добрососедских отноше ний и взаимного уважения, или, если этого пожелает польский народ, на основе союза по взаимной по мощи против немцев, как главных врагов Советского Союза и Польши.	vol-5476-page-01-seg-022-2669-1493-3668-1719.png
5476	1	2707	1791	2948	1821	3	0.87532	4 мая 1943	vol-5476-page-01-seg-023-2707-1791-2948-1821.png
5476	1	2983	1743	3487	1779	3	0.90269	уважением И. СТАЛИН	vol-5476-page-01-seg-024-2983-1743-3487-1779.png
5476	1	1742	1912	3546	2003	3	0.96491	от советского информбюро	vol-5476-page-01-seg-025-1742-1912-3546-2003.png
5476	1	2222	2026	3095	2060	4	0.95742	УТРЕННЕЕ СООБЩЕНИЕ 5 МАЯ	vol-5476-page-01-seg-026-2222-2026-3095-2060.png
5476	1	1622	2093	2290	2231	17	0.95343	В течение ночи на 5 мая продолжались бои северо-восточнее Новороссийска, На других фронтах существенных изменений не произошло.	vol-5476-page-01-seg-027-1622-2093-2290-2231.png
5476	1	1618	2275	2286	2561	46	0.94188	На кубани части Н-ского соединения ве- ли ожесточенные бои с противником. Co- ветские артиллеристы мощными огневыми налетами поддерживали действия стрелко- вых частей. Только на одном участке ар- иллирийские огнем уничтожены 4 немец- 55 ких танка, 21 орудие, 5 минометных ба- тарей и до батальона немецкой пехоты.	vol-5476-page-01-seg-028-1618-2275-2286-2561.png
5476	1	1616	2573	2280	2713	18	0.94668	Наша авиация дальнего действия бом- била аэродромы противника. В результате бомбардировки наблюдались многочислен- ные пожары и сильные взрывы.	vol-5476-page-01-seg-029-1616-2573-2280-2713.png
5476	1	1613	2768	2279	2948	24	0.93210	На Западном фронте наши части уни- чтожили до 150 немцев, разбили 2 ору- дия, подавили огонь минометной и 4 ар- тиллерийских батарей противника. *	vol-5476-page-01-seg-030-1613-2768-2279-2948.png
5476	1	1609	2969	2279	3243	39	0.91881	Западнее Ростова на Дону огнем нашей артиллерии и минометов уничтожены ар- типлерийская и минометная батарея, 10 ав- томашин, взорваны 2 склада боеприпасов, рассеяны и частью уничтожены до двух рот гитлеровцев. Орудийный расчет под ко- мандованием сержанта Ларина прямым по-	vol-5476-page-01-seg-031-1609-2969-2279-3243.png
5476	1	2309	2095	2979	2161	11	0.91908	падением разорил две вражеских бухни и уничтожил до 60 немецких солдат.	vol-5476-page-01-seg-032-2309-2095-2979-2161.png
