volume_number	page_number	x1	y1	x2	y2	tokens_count	mean_confidence	text	image
5763	3	3616	2302	4272	2521	30	0.95547	Эти будничные Примеры показывают, что не только в критические моменты боя, но и во всей так называемой обыч- ной, текущей работе политработник 00я- зан быстро ориентироваться, проявлять инициативу, и находчивость.	vol-5763-page-03-seg-048-3616-2302-4272-2521.png
5763	3	3616	2529	4270	3081	78	0.95246	"Победа крылата: упустишь - не пой- маешь». На этом суворовском правиле вос- питываем мы командиров. Но и политра- ботники, пропагандирующие этот завет, должны применять сго на деле. Их де- ВИЗ не упускай момента, используй все возможности для политического воз- действия на массы. То не надо сказать и о другом суворов- ском требовании: «Деятельность есть пер- достоинство воинское... Приучайся к неутомимой деятельности". Это требова- ние политработники также должны но только внушать другим, но и применять в своей собственной практике.	vol-5763-page-03-seg-049-3616-2529-4270-3081.png
5763	3	3614	3087	4266	3637	85	0.95649	Обязательным условием успеха полит работы является высокая требовательность к себе и к подчиненным. Встречаются еще самонадеянные люди, которых пы- таются всё сделать своими силами. Ком- сорг части тов. Сериков считает заслугой, что сам был во всех подразделениях, сам проводил там беседы и сам давал поруче- ния комсомольцам. В итоге тов. Сериков не руководил подчиненными, а подменял их. II пользы от этого --- ни на грош. Вывод ясен: политработа в 0010 должна вестись наиболее интенсивно. А достиг- нуть этого можно при условии умелого и инициативного руководства.	vol-5763-page-03-seg-050-3614-3087-4266-3637.png
5763	3	3647	3647	4214	3732	6	0.94675	Гвардии полковник С. ПШЕНИЧНЫЙ ДЕЙСТВУЮЩАЯ АРМИЯ.	vol-5763-page-03-seg-051-3647-3647-4214-3732.png
5763	3	3160	3799	4051	3903	4	0.94762	i. Фрицы с запада	vol-5763-page-03-seg-052-3160-3799-4051-3903.png
5763	3	2939	3924	3595	4461	78	0.95552	Гитлер пытается, как может, оправ- даться перед немцами. Он уверяет, что не бросил на Восточный фронт ни одного Нового фрица, Он клянется, что события в Анталии мешают ему остановить рус- стих на Иркуте. Газета "Националь цей- тунг" пишет: "Напрасно русские хотели нас взволновать гвойм наступлением. Мы не забрали из Италии и Франции ни одного солдата...». Итак, чтобы сохранить развалины бенедиктинского аббатства Монтекасино, Гитлер потерял всю Украи- ну с пшеницей, рудой марганцем. Здесь, наверно, и самые тупые фрицы усмехнутся.	vol-5763-page-03-seg-053-2939-3924-3595-4461.png
5763	3	2929	4463	3585	5242	124	0.94755	Передо мной пачка неотправленных пи- сем - немецкие почтовики побросали их в Уланове (Винницкая область). Булучи нескромным, я наполню сообщения Гит- лера некоторыми цитатами из немецких Унтер-офицер Карл Прейдель пишет фрейлин Михальке в Глейвиц: "Вот уже второй месяц, как я в России. Из Фран- ции я попал в Италию, затем на Балка- ны. А теперь я здесь в движении... Обер-фельдфебель Бруер пишет родить- тям своей невесты в Лорбах (Гарц): "Я был во Франции и в Пталии. Помимо 1вух «железных крестов» я имею теперь хст- ватекий знак отличия. Не знаю, что ждет меня в России...». Первое письмо датировано 3 марта 1944 г., второе --- 7 марта. Очевидно, Гитлер, говоря о Монтека- спно, думал о Виннице. Он слал своих фонцев на восток. Не по желанию фюрера	vol-5763-page-03-seg-054-2929-4463-3585-5242.png
5763	3	3601	3932	4261	5207	208	0.94458	фрицы поспешно проследовали на запад, побросав свои эпистолярные труды. 0 настроениях этих кочующих фрицев можно судить по следующим признаниям. Ефрейтор Кнель сообщает евсей отступ- ке в кельн: «Необходимо, чтобы война скоро кончилась, так как никто больше не может этого выдержать. во всяком случае не могу - ведь все погибнут! Гдз и теперь уже всё капут. Что же даль- :: ше?...». Когда фрицы, попав в плен, кричат «капут», им никто не верит. По вот, когда фриц пишет тетушке «калут», это куда интересней. Это значит, что скоро им действительно капут. Об р-фель фебель Брудер в России но- вичек. Он еще не успел осмотреться: Оп еще не протрезвел ст итальянских и дал- матинских вин. По сша спрашивает, что его ждет на Украине. Ефрейтор Карвинг всё знает. Он пишет 8 марта 1941 гола родителям во Франкфурт: «Мы ежедневно удара, так как русские уже прорва- люсь на соседнем участке. Тогда нам не сдобровать. Я сейчас надеюсь на одно выбраться из этого ужаса...». Вероятно, ефрейтор Варвгиг мачта ст проделать путь обер-фельдфебель Бруса или унтер-офицера Крейдель, но в обрат- ном направлении - оказать я в Трубил- ле, в Нише или хотя бы в Монтенгенео. Но у Красной Армии есть свои навыки: немцы, которые прибывают к нам, пе- рестают кочевать, они оседают павел и в могилах.	vol-5763-page-03-seg-055-3601-3932-4261-5207.png
5763	3	3951	5213	4207	5245	2	0.93805	Илья эренбург	vol-5763-page-03-seg-056-3951-5213-4207-5245.png
5763	3	2387	6121	3751	6163	7	0.95969	ОДЕССКОЕ НАПРАВЛЕНИЕ. Немецкие автомашины, уничтоженные нашими войсками	vol-5763-page-03-seg-057-2387-6121-3751-6163.png
5763	3	3903	6138	4187	6171	3	0.90333	Снимок О. Ландер	vol-5763-page-03-seg-058-3903-6138-4187-6171.png
5763	4	2006	344	2575	375	3	0.87840	е 3 д	vol-5763-page-04-seg-001-2006-0344-2575-0375.png
5763	4	3639	334	4289	369	8	0.90758	7 апреля 1944 г. пятница. № 83 (5763)	vol-5763-page-04-seg-002-3639-0334-4289-0369.png
5763	4	831	452	1140	484	2	0.96612	ОБЗОР ПЕЧАТИ	vol-5763-page-04-seg-003-0831-0452-1140-0484.png
5763	4	411	534	1554	706	6	0.97371	Конкретнее и глубже пропагандировать БОЕВОЙ ГВАРДЕЙЦЕВ	vol-5763-page-04-seg-004-0411-0534-1554-0706.png
5763	4	311	725	967	1011	32	0.94959	Красноармейская газета "Сын Родины" отводит немало места материалам, повест- вующим о боевых делах гвардейцев. Сло- "гвардеец" неоднократно склоняется редакцией почти каждом номере. В пе- редовой етатье "Воевать по-гвардейски" газета справедливо подчеркивает необхо-	vol-5763-page-04-seg-005-0311-0725-0967-1011.png
5763	4	338	1027	961	1183	22	0.97880	«постоянно пропагандировать подвига советских гвардейцев, их передовой опыт, добиваясь, чтобы все наши бойцы так сражались с врагом, как сражаются наши славные гвардейцы".	vol-5763-page-04-seg-006-0338-1027-0961-1183.png
5763	4	305	1198	961	1848	86	0.95837	Пропагандировать передовой опыт со советских гвардейцев --- это задача и самой газеты, задача первостепенная и нелегкая Многочисленное повторение «гвар- «гвардеец», к которому прибегает редакция, никак не может заменить серь зной и вдумчивой работы газеты над по- пуляризацией боевого опыта гвардейских подразделений. Сегодняшний читатель красноармейских газет воин, прошел- ший большую школу войны, ждет кон- кретного делового разбора пусть неболь- ших, но имеющих существенное значение Бопрусов босьой практики гвардейцев. A что предлагает читателю газета «Сын Ро- дины»? Обратимся к наиболее крупным солидным выступлениям газеты, посвя- щенным гвардейскому оныту.	vol-5763-page-04-seg-007-0305-1198-0961-1848.png
5763	4	300	1850	959	2496	89	0.96135	В № 51 редакция отвела целую поло- су боевой работе гвардейцев. «На этой странице, подчеркивает в своем вступ- лении редакция, гвардейцы наших подразделений рассказываюг о своем бое- опыте». Внимание читателя в первую очередь привлекает корреспонденция пол заголовком «Секрет успеха». Автор ее рассказывает о действиях одной роты N гвардейской части, Эта рота стромитель- ударом выбила противника из ук- репленных позиций, нанесла врагу нема- лые потери, захватила трофен и пленных. Автор обещает анализировать бой, но, к сожалению, обещанный анализ действий бойцов и сержантов ограничивается по- верхностным изложением боевых эпизо- ": дов.	vol-5763-page-04-seg-008-0300-1850-0959-2496.png
5763	4	330	2506	954	2764	38	0.95971	«Отделение гвардии сержанта Юдина, четко зная объект атаки, ринулось вперед одним из первых и после короткой схватки овладело немецким окопом. Бойцы Юдина проявили высокую настой- чивость и упорство, стремительно пре- одолели огневой заслон и предрешили успех всей роты».	vol-5763-page-04-seg-009-0330-2506-0954-2764.png
5763	4	296	2783	952	3354	83	0.95962	Далее перечисляются фамилии бойцов. которые «стремительно преодолели огневой заслон». Читатель вправе спросить редак- цию: в чем же заключались умелые инициативные действия подразделения! Неужели в бою достаточно лишь четко указать задачу, и всё дело пойдет глад- 1:0? Заметим кстати, что автор статьи, ка- саясь постановки задачи, тоже ограничился общими выражениями. Пз корреспониен- цни "Секрет успеха" не видно, как ис- пользовались пулеметы, минометы, как сочеталось движение с огнем, в чем проя- билось искусство маневра роты. Словом, показ передового опыта гвардейцев в статье по сути отсутствует.	vol-5763-page-04-seg-010-0296-2783-0952-3354.png
5763	4	292	3364	955	4059	99	0.96223	Мы остановились на этой статье пото- му, что она типична для подхода редак- нии к освещению большого разносторон- него опыта. накопленного гвардейскими подразделениями. Серьезный разбор и де- ловой анализ боя подменяются описанием боевых эпизодов п общими замечаниями. Этим пороком страдают и материалы, чинизванные пропагандировать индивиду- альный опыт гвардейцев. На той же по- лосе опубликована заметка героях- гвардейцах. В протокольной форме газета перечисляет фамилии отличившихся вои- поз и ничего конкретного не говорит об их боевом мастерстве. Газета, конечно, правильно делает, отмечая железную стой- кость гвардейцев, их неустрашимость в борьбе с врагом. Но ведь гвардейцы побеждают потому, что они сочетают в	vol-5763-page-04-seg-011-0292-3364-0955-4059.png
5763	4	992	725	1639	869	20	0.93943	себе дух самоотверженности и героизма с : отличными военными знаниями, боевым умением. А вот военного мастерства га- зета не раскрывает.	vol-5763-page-04-seg-012-0992-0725-1639-0869.png
5763	4	986	879	1637	1202	41	0.95458	гвардейцев-стрелков, артиллеристов, минометчиков, разведчиков опыт уме- лых, инициативных действий люистине неисчерпаем! В части неоднократно от- личался искусным ведением разведки офи- цер-гвардеец Румянцев. Газета решила рассказать о боевых делах опытного раз- ведтика. Что же узнает читатель из ста- тьи, опубликованной в газете?	vol-5763-page-04-seg-013-0986-0879-1637-1202.png
5763	4	1013	1210	1633	1471	38	0.96325	«Часть вела наступательные бон. Противник яростно сопротивлялся: Ру- мянцев получил приказание пробраться в немецкий* тыл для разведки сил противника. В тылу врага Румянцев обнаружил батарею, обстреливавшую наши позиции. С горсткой бойцов он напал на батарею и уничтожил ее».	vol-5763-page-04-seg-014-1013-1210-1633-1471.png
5763	4	983	1477	1633	1954	69	0.96167	У воспного читателя, естественно, воз- никает вопрос: как всё это произошло? Если противник яростно сопротивлялся, то Румянцев, видимо, применил какую-то хитрость в движении, умело отыскал стык в боевых порядках противника, су- мел точно выйти огневым позициям батареи. Но об этом можно только дога- дываться, ибо сама газета не говорит ни -слова. Уничтожение вражеской батареи выглядит в газете очень простым делом. Не показав методов атаки немецкой бата- реи, газета лишет:	vol-5763-page-04-seg-015-0983-1477-1633-1954.png
5763	4	1008	1962	1627	2191	36	0.96684	«Немцы решили, что в их тылу дей- ствуют партизаны. Гитлеровцы устроили облаву. Румянцев разгадал замысел противника и умелым маневром вывел свой небольшой отряд из-под удара, а затем зачет немцам в тыл и нанес им большой урон».	vol-5763-page-04-seg-016-1008-1962-1627-2191.png
5763	4	977	2196	1629	2672	70	0.95644	Как был разгадан замысел противника, в чем заключался смелый маневр, вот что будет интересовать читателя красноар- мейской газеты. Но редакция и на это ответа не дает. Не попытавшись даже проанализиро- вать эти эпизоды, газета переходит к другим. Она рассказывает, что Румянцев проник однажды в глубину боевых по- рялков противника на 35 километров, об- наружил автоколонну из 50 машин, до 16 самоходных пушек. В середине колонны пла штабная машина. II опять	vol-5763-page-04-seg-017-0977-2196-1629-2672.png
5763	4	1004	2679	1625	2874	29	0.96884	«Румянцев с бойцами подобрался к штабной машине и атаковал ее. Машина врага была уничтожена, а находившиеся в ней фрицы убиты. Захватив докумен- ты, Румянцев вернулся в расположение своего подразделения».	vol-5763-page-04-seg-018-1004-2679-1625-2874.png
5763	4	963	2879	1625	4055	173	0.96125	Так трудную и опасную работу от- важных разведчиков газета рисует про- стой и легкой. Всё происходит по прин- --- пришел, увидел, победил. Не яс- но ли, что, следуя такому методу, никак нельзя раскрыть сложные и многообраз- ные явления боевой практики. II сколь- ко бы раз газета не склоняла слова «гвардейское умение», самого умения она так и не показывает и ничего поучитель- ного не сообщает. Учить войска бить врага, как бьют его наши славные гвардейцы, важ- нейшая обязанность красноармейской га- зеты. Чтобы успешно решить эту задачу, требуется в первую очередь заботиться о качестве, глубине содержания каждой статьи, претендулощей на показ гвардей- ского опыта. Редакция должна устано- вить тесную связь с гвардейцами--творца- этого опыта, а также с офицерами, которые занимаются обобщением боевого опыта. Систематический показ на страни- цах газеты наиболее поучительных так- тических действий бойцов и мелких под- разделений - вот чего в первую очередь нехватает газете "Сын Родины". Особое внимание при показе опыта гвардейцев газета должна уделять таким важным вопросам, нак сочетание огня и движе- ния, техника атаки, бой в глубине оборо- ны противника.	vol-5763-page-04-seg-019-0963-2879-1625-4055.png
5763	4	596	4132	1340	4168	4	0.96795	БЕЛЬГИЙСКИЕ ПАТРИОТЫ В БОРЬБЕ	vol-5763-page-04-seg-020-0596-4132-1340-4168.png
5763	4	290	4186	944	4476	49	0.96573	ЛОНДОН, 6 апреля. (ТАСС). Как сооб- поет бельгийское независимое агентство, Бельгийские патриоты за время с конца октября 1943 года по середину января этого года совершили 67 крупных актов саботажа на транспортных и промышлен- ных сбектах, используемых гитлеровцами для своих нужд в Бельгии. Бельгийское агентство отмечает, что за последние три	vol-5763-page-04-seg-021-0290-4186-0944-4476.png
5763	4	961	4191	1614	4476	38	0.97684	месяца акты саботажа в Бельгии значи- тельно участились совершение их, осо- бенно на железных дорогах, приняло пла- номерный характер. По признанию самих гитлеровцев, повреждения на железных до- рогах стали настолько частыми, что даже местное железнодорожное сообщение резко нарушено.	vol-5763-page-04-seg-022-0961-4191-1614-4476.png
5763	4	1815	457	2810	517	3	0.95560	Действия авиации союзников	vol-5763-page-04-seg-023-1815-0457-2810-0517.png
5763	4	1723	546	2902	657	29	0.94944	Бомбардировка военных объектов в Тулузе и в районе Па-де-Кале. * Налет на аэродромы в районе Берлина и Мюнхена. Подробности налетов на Плоешти к Штейр. Обстановка в Софии после бомбардировок.	vol-5763-page-04-seg-024-1723-0546-2902-0657.png
5763	4	1654	680	2312	1250	89	0.96587	ЛОНДОН, 6 апреля. (ТАСС). Как пере дает агентство Рейтер, в ночь на 6 апреля самолеты английской авиации «Ланкастер» совершили налет на самолеторемонтный завод в Тулузе, выполнявший заказы нем- цев. Один английский самолет не вернулся на базу. ЛОНДОН, 6 апреля. (ТАСС). Командо- вание американскими вооруженными силами на европейском театре операций сообщило, что 6 апреля самолеты «Либерейтор» в со- провождении истребителей "Тандерболт" подвергли бомбардировке германские воен- ные объекты в районе Па:де-Кале. Герман- ская авиация не оказала сопротивления. Огонь вражеской зенитной артиллерии был слабым. Все американские самолеты верну- лись на свои базы.	vol-5763-page-04-seg-025-1654-0680-2312-1250.png
