volume_number	page_number	x1	y1	x2	y2	tokens_count	mean_confidence	text	image
5744	1	3014	4918	3676	6078	160	0.93959	Пленум принял постановление о по полнении состава президиума. Членами Президиума ВЦСПС единоглас- но избраны т.т. Кузнецов В. В., предсе- датель ЦК профсоюза рабочих черной ме- таллургии Центра, Тарасов М. П., предсе- датель ЦК профсоюза рабочих железных дорог Центра, Сидоренко Е. Я., председа- тель ЦК профсоюза рабочих алектростан- ций, Соловьев Л. Н., заведующий оргот- делом ФПС, Агаджанов К. А., предсе- датель ЦК профсоюза рабочих вооружения СССР, Борисов П. А., председатель профсоюза рабочих автомобильной про- мышленности, Важенин Е. В., председа- тель ЦК профсоюза рабочих промыгилен- ности боеприпасов СССР, Вешников А. А. председатель ЦК про*союза рабочих чер- ной металлургии , Гайсенок Н. А., председатель профсоюза рабочих судо- строительной промышленности, Казаков П. ф., ВЦСПС, Марков Л. В., председатель профсоюза рабочих леса сплава Центра и Юга, Савков Е. М., председатель ЦК профсоюза рабочих угольной промыш- ленности Донбасса, Цветнова В. С., пред- содатель ЦК профсоюза рабочих хлопчато- бумажной промышленности Ивановской области, Шульга Е. Г., председатель ЦК профсоюза рабочих коксохимической про- мышленности. Пленум ВЦСПС принял постановление в	vol-5744-page-01-seg-071-3014-4918-3676-6078.png
5744	1	3699	4784	4357	5151	42	0.94142	связи с избранием тов. Шверника Нико- лая Михайловича Первым Заместителем Председателя Президиума Верховного Со- вета СССР и Председателем Президиума Верховного Совета РСФСР освободить его от работы в ВЦСПС. Пленум единогласно избрал Председате- лем Всесоюзного Центрального Совета Профессиональных Союзов тов. Кузнецова Василия Васильевича.	vol-5744-page-01-seg-072-3699-4784-4357-5151.png
5744	1	3685	5153	4353	5894	106	0.94731	Пленум пополнил состав Секретариата, избрав Секретарями ВЦСПС т.т. М. П. Та- расова, Е. Я. Сидоренко, Л. Н. Соловьева. Пленум удовлетворил просьбу тов. П. Г. Москалева об освобождении его в связи c переходом на другую работу от обязан- ностей Секретаря ВЦСПС. На заседании рассмотрены и единоглас- но приняты резолюции по докладам: тов. B. В. Кузнецова «0 работе профсоюз- ных организаций по дальнейшему развер- тыванию Всесоюзного социалистического соревнования», тов. К. И. Николаевой - «0 мерах по дальнейшему развертыванию и улучшению индивидуального и коллск- тивного огородничества в 1944 году», тов. М. П. Тарасова «Об усилении об- щественного контроля профсоюзных орга- низаций над работой столовых, и газинов и подсобных хозяйств»	vol-5744-page-01-seg-073-3685-5153-4353-5894.png
5744	1	3681	5900	4339	6080	21	0.94111	Пленум с огромным воодушевлением под бурные, долго не смолкающие овации обратился с приветствием к Верховному Главнокомандующему Маршалу Советского Союза товарищу Сталину.	vol-5744-page-01-seg-074-3681-5900-4339-6080.png
5744	2	2031	284	2604	315	3	0.85376	3 Е Д	vol-5744-page-02-seg-001-2031-0284-2604-0315.png
5744	2	3549	282	4237	313	8	0.89274	16 марта 1944 г. четверг. № 64 (5744).	vol-5744-page-02-seg-002-3549-0282-4237-0313.png
5744	2	355	390	1431	600	16	0.96020	МОСКВА, КРЕМЛЬ ВЕРХОВНОМУ ГЛАВНОКОМАНДУЮЩЕМУ МАРШАЛУ СОВЕТСКОГО СОЮЗА :: ТОВАРИЩУ С Т А Л И Н У	vol-5744-page-02-seg-003-0355-0390-1431-0600.png
5744	2	252	625	915	882	25	0.93281	Дорогой Иосиф Виссарионович! Воодушевленные героическими победами Красной Армии над немецко-фашистскими бандами, бойцы и офицеры войсковой части, полевая почта 33458, досрочно погасили подписку на второй Государ-	vol-5744-page-02-seg-004-0252-0625-0915-0882.png
5744	2	934	625	1592	767	17	0.93589	стбенный Военный Заем и причитающиеся к получению облигации на сумму 97.085 рублей внесли на постройку зенитных пушек.	vol-5744-page-02-seg-005-0934-0625-1592-0767.png
5744	2	936	771	1590	875	12	0.93976	Пусть наш скромный вклад на оборону Родины ускорит разгром немецко-фашист- ских полчищ.	vol-5744-page-02-seg-006-0936-0771-1590-0875.png
5744	2	992	882	1544	917	3	0.92050	Командир части СКУРАТОВСКИЙ.	vol-5744-page-02-seg-007-0992-0882-1544-0917.png
5744	2	340	942	1406	1031	7	0.96932	ПОЛЕВАЯ ПОЧТА 33458 КОМАНДИРУ ЧАСТИ товарищу СКУРАТОВСКОМУ	vol-5744-page-02-seg-008-0340-0942-1406-1031.png
5744	2	259	1036	1577	1198	24	0.90726	Передайте бойцам и офицерам части, внесшим 97.085 рублей обли- i. нациями госзайма на постройку зенитных пушек, мой боевой привет и благодарность Красной Армии. СТАЛИН.	vol-5744-page-02-seg-009-0259-1036-1577-1198.png
5744	2	352	1271	1479	1319	4	0.91470	МОСКВА, КРЕМЛЬ ТОВАРИЩУ СТАЛИНУ	vol-5744-page-02-seg-010-0352-1271-1479-1319.png
5744	2	252	1335	917	1562	17	0.93513	Личный состав госпиталя 2478. воодушевленный славными победами Крас- ной Армии на фронтах Отечественной вой- Зам. Начальника госпиталя	vol-5744-page-02-seg-011-0252-1335-0917-1562.png
5744	2	925	1335	1587	1562	31	0.94969	ны и желая ускорить час полного разгро ма ненавистного врага, внес 50.000 руб- лей в фонд обороны для построения са- молета «Медицинский работник». нальник госпиталя военврач СОВЕТОВ. по политчасти капитан КОМПАНИЕЦ.	vol-5744-page-02-seg-012-0925-1335-1587-1562.png
5744	2	319	1577	1515	1764	14	0.97279	кувшиново НАЧАЛЬНИКУ ГОСПИТАЛЯ № 2478 ВОЕНВРАЧУ СОВЕТОВУ ЗАМ. НАЧАЛЬНИКА ГОСПИТАЛЯ ПО ПОЛИТЧАСТИ КАПИТАНУ КОМПАНИЕЦ	vol-5744-page-02-seg-013-0319-1577-1515-1764.png
5744	2	259	1771	1575	1935	25	0.93111	Передайте личному составу госпиталя № 2478, собравшему 50.000 рублей на строительство самолета «Медицинский работник», -- мой бое- вой привет и благодарность Красной Армии. и. сталин.	vol-5744-page-02-seg-014-0259-1771-1575-1935.png
5744	2	353	2012	1431	2218	16	0.94779	МОСКВА, КРЕМЛЬ ВЕРХОВНОМУ ГЛАВНОКОМАНДУЮЩЕМУ МАРШАЛУ СОВЕТСКОГО СОЮЗА i. ТОВАРИЩУ С Т А Л И Н У	vol-5744-page-02-seg-015-0353-2012-1431-2218.png
5744	2	252	2243	915	2677	46	0.94940	B ознаменование героических побед Красной Армии, желая ускорить час окон- чательного разгрома ненавистного врага и полного освобождения нашей родной зем- ли от немецко-фашистских извергов, офи- церы, сержанты, курсанты, красноармей- пы и вольнонаемный состав воинской ча- сти 30150 вносят в фонд Главного Коман- Командир части Начальник Нача	vol-5744-page-02-seg-016-0252-2243-0915-2677.png
5744	2	340	2710	584	2745	2	0.96995	ЧАСТЬ 30150	vol-5744-page-02-seg-017-0340-2710-0584-2745.png
5744	2	923	2241	1590	2677	60	0.94651	дования облигации 2-го Военного займа 1943 года в сумме 1.347.000 рублей. Заверяем Вас, дорогой товарищ Сталин что и впредь мы не пожалеем ничего, чтобы еще больше крепить силу и мощь Красной Армии. Дадим фронту обученные и стойкие кадры бойцов, способных выполнить любое Ваше задание во имя победы над врагом! сти 30150 подполковник ХАРИТОНОВ. политотдела подполковник МАРУСЕВ. ьник штаба подполковник КОВТУНОВ.	vol-5744-page-02-seg-018-0923-2241-1590-2677.png
5744	2	280	2754	1550	2893	12	0.97642	КОМАНДИРУ ЧАСТИ ПОДПОЛКОВНИКУ ХАРИТОНОВУ НАЧАЛЬНИКУ ПОЛИТОТДЕЛА ПОДПОЛКОВНИКУ МАРУСЕВУ НАЧАЛЬНИКУ ШТАБА ПОДПОЛКОВНИКУ КОВТУНОВУ	vol-5744-page-02-seg-019-0280-2754-1550-2893.png
5744	2	257	2899	1571	3097	30	0.93638	Передайте офицерам, сержантам, курсантам, красноармейцам и воль нонаемному составу части, внесшим 1.347.000 рублей облигациями гос- займа в фонд Главного Командования, мой боевой привет и благо дарность Красной Армии. и сталин	vol-5744-page-02-seg-020-0257-2899-1571-3097.png
5744	2	350	3168	1421	3374	9	0.97107	МОСКВА, КРЕМЛЬ ВЕРХОВНОМУ ГЛАВНОКОМАНДУЮЩЕМУ МАРШАЛУ СОВЕТСКОГО СОЮЗА ТОВАРИЩУ СТАЛИНУ	vol-5744-page-02-seg-021-0350-3168-1421-3374.png
5744	2	252	3397	917	3732	35	0.94921	Дорогой Иосиф Виссарионович! Воодушевленная победами руководимой Вами героической Красной Армии, желая ускорить разгром немецких захватчиков злейших врагов человечества, я внесла в Госбанк на строительство танковой колон- ны свои золотые часы и двухмесячный Библио Город Короп,	vol-5744-page-02-seg-022-0252-3397-0917-3732.png
5744	2	925	3397	1581	3732	33	0.92687	оклад зарплаты- Примите, дорогой вождь, этот мой вклад. Слава героической Красной Армии! Слава Вам, любимый вождь и наш учи- тель, товарищ Сталин! Смерть немецким оккупантам. екарь ДОЦЕНКО Варвара Васильевна. Черниговской области, Средняя школа.	vol-5744-page-02-seg-023-0925-3397-1581-3732.png
5744	2	255	3747	1563	4035	30	0.94321	ГОРОД КОРОП, ЧЕРНИГОВСКОЙ ОБЛАСТИ СРЕДНЯЯ ШКОЛА БИБЛИОТЕКАРЮ ВАРВАРЕ ВАСИЛЬЕВНЕ ДОЦЕНКО Примите мой привет и благодарность Красной Армии, Варвара Ва- сильевна, за Вашу заботу о бронетанковых силах Красной Армии. И. сталин.	vol-5744-page-02-seg-024-0255-3747-1563-4035.png
5744	2	1727	394	2799	604	9	0.96013	МОСКВА, КРЕМЛЬ ВЕРХОВНОМУ ГЛАВНОКОМАНДУЮЩЕМУ МАРШАЛУ СОВЕТСКОГО СОЮЗА ТОВАРИЩУ. СТАЛИНУ	vol-5744-page-02-seg-025-1727-0394-2799-0604.png
5744	2	1614	621	2275	988	41	0.94895	Раненые офицеры и рядовой состав. находящиеся на излечении в авакогоспи- тале № 5911, а также личный состав госпиталя, воодушевленные исторически- ми победами героической Красной Армии, изгоняющий под Вашим водительством фашистских мерзавцев с нашей земли, Начальник эвакогоспиталя Заместитель начальника госпиталя № 59	vol-5744-page-02-seg-026-1614-0621-2275-0988.png
5744	2	2283	621	2943	988	51	0.94829	собрали 15.000 рублей на создание мот- ной танковой колонны. Пусть враг чувст- вует всю силу русского человека и его любовь к своему отечеству. Заверяем Вас, дорогой товарищ Сталин, что персонал госпиталя отдаст все силы и знания, чтобы быстрее излечить наших защитников Родины. 5911 майор медслужбы ТЕРНОВСКИЙ. по политчасти ст. лейтенант КУЛИКОВ.	vol-5744-page-02-seg-027-2283-0621-2943-0988.png
5744	2	1652	1025	2924	1254	16	0.98690	ЭВАКОГОСПИТАЛЬ № 5911 НАЧАЛЬНИКУ ЭВАКОГОСПИТАЛЯ МАЙОРУ МЕДСЛУЖБЫ ТЕРНОВСКОМУ ЗАМЕСТИТЕЛЮ НАЧАЛЬНИКА ГОСПИТАЛЯ по политчасти СТАРШЕМУ ЛЕЙТЕНАНТУ КУЛИКОВУ	vol-5744-page-02-seg-028-1652-1025-2924-1254.png
5744	2	1631	1275	2941	1392	26	0.90491	Передайте раненым офицерам и бойцам госпиталя № 5911, собравшим 15.000 рублей колонны, мой боевой привет и благодарность и личному составу эвако- на строительство танковой Красной Армии.	vol-5744-page-02-seg-029-1631-1275-2941-1392.png
5744	2	2554	1402	2841	1440	2	0.95426	И. СТАЛИН	vol-5744-page-02-seg-030-2554-1402-2841-1440.png
5744	2	1723	1515	2795	1665	6	0.96979	МОСКВА, КРЕМЛЬ ВЕРХОВНОМУ ГЛАВНОКОМАНДУЮЩЕМУ ТОВАРИЩУ СТАЛИНУ	vol-5744-page-02-seg-031-1723-1515-2795-1665.png
5744	2	1608	1687	2264	1910	25	0.93886	Дорогой Иосиф Виссарионович! Вооду- шевленный боевыми успехами Красной Армии и разгромом немцев под Ленингра- дом, личный состав заставы части 2069 внес наличными на восстановление Ленин-	vol-5744-page-02-seg-032-1608-1687-2264-1910.png
5744	2	2283	1687	2933	1987	40	0.94059	града 4.200 руб. , а ефрейтор Каржаспаев • внес наличными 1. 000 руб. Шлем Вам, любимый товарищ Сталин сердечный привет. Желаем Вам долгих лет жизни и здоровья на радость советско- му народу и на страх врагам. Младший лейтенант ШЕРСТЮК. Ефрейтор КАРЖАСПАЕВ.	vol-5744-page-02-seg-033-2283-1687-2933-1987.png
5744	2	1706	2012	2766	2146	10	0.95987	КАМЧАТКА ЧАСТЬ 2069 МЛАДШЕМУ ЛЕЙТЕНАНТУ товарищу ШЕРСТЮК ЕФРЕЙТОРУ товарищу КАРЖАСПАЕВУ	vol-5744-page-02-seg-034-1706-2012-2766-2146.png
5744	2	1629	2160	2937	2281	21	0.94256	Передайте личному составу заставы части 2069, собравшему сред- ства на восстановление города Ленинграда, мой боевой привет и благо- дарность правительства СССР.	vol-5744-page-02-seg-035-1629-2160-2937-2281.png
5744	2	2566	2283	2841	2323	2	0.92607	И. СТАЛИН...	vol-5744-page-02-seg-036-2566-2283-2841-2323.png
5744	2	1715	2391	2841	2439	10	0.91714	МОСКВА, КРЕМЛЬ ТОВАРИЩУ С Т А Л И Н У	vol-5744-page-02-seg-037-1715-2391-2841-2439.png
5744	2	1608	2456	2264	2754	36	0.93368	благодарность Вам, любимый това- рищ Сталии, и руководимой Вами Брачной Армии за освобождение украинского на- рода от немецких грабителей я вношу 50 тысяч рублей своих сбережений на строи- тельство авиаэскадрильи. Пусть она уни- чтожает фашистских бандитов.	vol-5744-page-02-seg-038-1608-2456-2264-2754.png
5744	2	2285	2456	2935	2758	40	0.95195	Несмотря на мой преклонный возраст буду еще сильнее работать и приложу все усилия для того, чтобы скорее залечит раны, которые нанес нам враг. Примите мои наилучшие пожелания в здоровье и силе. Живите долгие годы на благо и радость нашему народу.	vol-5744-page-02-seg-039-2285-2456-2935-2758.png
5744	2	1962	2762	2902	2835	9	0.93214	Колхозник села Малая Салтановка, Васильковского района БЫШОВЕЦ Петр Яковлевич	vol-5744-page-02-seg-040-1962-2762-2902-2835.png
5744	2	1627	2870	2931	3112	30	0.93529	КИЕВСКАЯ ОБЛАСТЬ, ВАСИЛЬКОВСКИЙ РАЙОН, СЕЛО МАЛАЯ САЛТАНОВКА КОЛХОЗНИКУ товарищу БЫШОВЕЦ ПЕТРУ ЯКОВЛЕВИЧУ Примите мой привет и благодарность Красной Армии, Петр Яковле вич, за Вашу заботу о воздушных силах Красной Армии.	vol-5744-page-02-seg-041-1627-2870-2931-3112.png
5744	2	2558	3114	2835	3162	2	0.94160	И. СТАЛИН.	vol-5744-page-02-seg-042-2558-3114-2835-3162.png
5744	2	1729	3237	2827	3285	10	0.90413	МОСКВА, КРЕМЛЬ ТОВАРИЩУ С Т А Л И Н У	vol-5744-page-02-seg-043-1729-3237-2827-3285.png
5744	2	1608	3304	2265	3643	39	0.95132	Дорогой Иосиф Виссарионович! Мы, ученики Нежинской школы № 1, сердечно благодарим Вас, дорогой Иосиф Виссарионович, за то, что Красная Армия освободила нас, детей, от немецких окку- пантов и возвратила нам счастливое дет- ство. Чтобы помочь доблестной армии, мы Ди	vol-5744-page-02-seg-044-1608-3304-2265-3643.png
5744	2	1706	3672	1867	3708	1	0.97752	НЕЖИН	vol-5744-page-02-seg-045-1706-3672-1867-3708.png
5744	2	2273	3304	2935	3643	38	0.95448	внесли из своих средств на строительство танковой колонны «Колгоспник Чернигов- ский 10.844 рубля. Сбор средств про- должается. Пусть грозные боевые маши- ны, построенные на наши деньги, несут смерть немецким оккупантам. вектор средней школы № 1 КОЛОДИЙ. Пионервожатый ЧУВАКОВА.	vol-5744-page-02-seg-046-2273-3304-2935-3643.png
5744	2	1706	3720	2852	3812	10	0.94522	ДИРЕКТОРУ СРЕДНЕЙ ШКОЛЫ № 1 товарищу КОЛОДЕЙ ПИОНЕРВОЖАТОМУ товарищу ЧУВАКОВОЙ	vol-5744-page-02-seg-047-1706-3720-2852-3812.png
5744	2	1623	3828	2933	4035	33	0.93473	Прошу передать ученикам Нежинской школы № 1, собравшим 10.844 рубля на строительство танковой колонны «Колгоспник Черни- говский», благодарность Красной Армии и мои пожелания им здоровья и успехов в учебе и общественной работе. сталин.	vol-5744-page-02-seg-048-1623-3828-2933-4035.png
5744	2	332	4147	1508	4251	3	0.96496	В глубокой разведке	vol-5744-page-02-seg-049-0332-4147-1508-4251.png
5744	2	238	4274	904	6121	250	0.94828	Разведку глубины обороны противника необходимо проводить не только бронетан- ковым, а всем родам войск, развивающим наступление или закрепившимся на вре- менных оборонительных рубежах. Каждый командир, в частности командир обще- войскового соединения, должен всегда иметь под руками данные и о полосе со- противления арьергардов противника, и группировке вражеских частей на про- межуточном рубеже обороны, и о районах сосредоточения ближайших резервов не- приятеля и, главным образом, его танко- вых частей. А все эти сведения может дать только хорошо организованная глубо- кая разведка. Для глубокой разведки высылаются мелкие партии разведчиков (4--6 чело- век) на расстояние до 30 км. В манев- ренных условиях боя разведывательная партия всегда сумеет найти проходы меж- ду боевыми порядками подразделений не- приятеля, прикрывающих отход его глав- . . . ных сил, или боевыми порядками его войск на промежуточном рубеже обороны. Соверiпая вылазки в определенные насе- лепные пункты, разведчики выявляют здесь скопление живой силы противника. контролируют его дороги, перехватывают документы у немецких солдат и одиноч- ные автомашины, берут пленных. Бойцы передвигаются только Ночью, соблюдая тщательную маскировку при движении и расположении на отдых. Разведывательным партиям придаются радиостанции. Передача и прием данных производятся по разработанному простой- шему коду или таблице обусловленных сигналов. Сроки действия группы 3--5 суток. Группу возглавляет опытный, сме- лый, инициативный офицер-разведчик. На таких началах была организована глубокая разведка на одном из участков фронта. Группа в 7 человек, под руковод- твои офицера, в течение 4 суток на- блюдала за большим районом расположе- ния немцев в глубину до 30 км. В ре- зультате работы разведчиков была преду- преждена готовившаяся контратака про-	vol-5744-page-02-seg-050-0238-4274-0904-6121.png
