volume_number	page_number	x1	y1	x2	y2	tokens_count	mean_confidence	text	image
5118	1	3182	4558	3853	5589	157	0.95879	КАЛИНИНСКИЙ ФРОНТ, 5 марта. (По телеграфу от наш. спец. корр. ). Части соединения не дают противнику ни минуты передышки, методически взламывают erc оборону. Вчера ночью на этом участке фронта ему был снова нанесен чувствитель- ный удар. Наши бойцы заняли три сильно укрепленных населенных пункта. Нанесение удара именно по этим пунк- там не случайно. Два из них расположены на шоссе, идущем параллельно линии фрон- та. Немцам легко было здесь манебриро- вать. Именно отсюда они предпринимали контратаки против наших частей. Отсюда же они усиляли опорные пункты, выдви- нутые вперед. В результате успешного взаимодействия пехоты, артиллерии и танков ати неприя- тельские позиции были захвачены. Артил- леристы работали быстро, слаженно и чет- го. Образны сноровки и отваги показали и танкисты. Танк лейтенанта Козулина во время атаки разрушил 20 неприятель- ских блиндажей, уничтожил два противо- танковых орудия, разбил пять автомашин. Быстрое преодоление передовых опорных пунктов врага во многом решило успех по- следующего наступления. Финал разыграл- ся, как уже сказано выше, ночью, Пот-	vol-5118-page-01-seg-072-3182-4558-3853-5589.png
5118	1	3875	4572	4544	5276	104	0.96079	разделения, которыми командует тов. Ку- ценко, действуя с разных направлений заставляли противника рассредоточивать свои силы. Они наступали под гром артил- лерийской музыки. Наши батареи непре- рывно били по блиндажам, замеченным за- ранее. Отдельные орудия продвигались все сте с пехотными подразделениями и сме тали все, что преграждало им путь. Яр- ний свет ракет, пламя горевших укрепле- ний в стане фашистов и, наконец, ровный свет луны, все это помогало артиллерп- стам быстро отыскивать цели. Когда артиллеристы наполовину сломн- ли огневое сопротивление противника и разбили возведенные им ледяные валы, подразделения с криком "ура" бросились в штыки. Не пожелавшие сдаться в плен фашисты были уничтожены в уличных боях,	vol-5118-page-01-seg-073-3875-4572-4544-5276.png
5118	1	3869	5282	4540	5593	41	0.95233	Только одними убитыми немцы потеряли свыше 500 солдат и офицеров. Уничтоже- но 18 орудий и несколько десятков пуле метных точек врага. По неполным дан- ным, захвачены 3 орудия, 16 пулеметов 36 автомашин. Трофейные команды уточ- няют количество захваченного вооружения и имущества,	vol-5118-page-01-seg-074-3869-5282-4540-5593.png
5118	1	3439	5635	4269	5703	4	0.92469	Наши части развивают успех	vol-5118-page-01-seg-075-3439-5635-4269-5703.png
5118	1	3174	5701	3849	6109	57	0.95343	ДЕЙСТВУЮЩАЯ АРМИЯ. 5 марта. (По телеграфу от наш. спец. корр. ). Части N соединения преодолевают наступательные действия на отдельных участках, сковыза я противника B других районах огнем активной работой боевой разведки. Немцы упорно сборсняются, пытаясь огнем и ча- стными контратаками задержать пройденное ние налиих наступающих частей. К исходу дня частями соединения были достигнуты немалые успехи, Огнем одного	vol-5118-page-01-seg-076-3174-5701-3849-6109.png
5118	1	3861	5717	4538	6111	55	0.96127	артиллерийского - подразделения уничтоже- ны два станковых пулемета, истреблено до 25 человек вражеской пехоты. Одна наша часть, отбросив сотротивляешихся немцев оседлала важную дорогу. Дрг Другая стрелкизая часть успешно блоки рует противника. обороняющегося в насе- тенном пункте. Чтобы разомкнуть кольцо, смыкающееся вокруг этого пункта, немцы предприняли контратаку, которая была от- бита с большими потерями для врага	vol-5118-page-01-seg-077-3861-5717-4538-6111.png
5118	2	3753	390	4069	418	3	0.86383	марта 1942 г.	vol-5118-page-02-seg-002-3753-0390-4069-0418.png
5118	2	4119	386	4478	416	4	0.87402	чица. № 54 (5118)	vol-5118-page-02-seg-003-4119-0386-4478-0416.png
5118	2	444	502	1757	676	5	0.95672	УДАРЫ ПО ШЕСТНАДЦАТОЕ НЕМЕЦКОЙ АРМИИ	vol-5118-page-02-seg-004-0444-0502-1757-0676.png
5118	2	430	696	1088	1020	48	0.95575	СЕВЕРО-ЗАПАДНЫЙ ФРОНТ, 5 марта. (По телеграфу от наш. спец. корр. ). За последние два дня части нашего N соеди- нения нанесли новые мощные удары не- которым окруженным частям 16-ii не- мецкой армии. Взаимодействуя между со- бой, наши войска продолжают теснить нежцев, сжимая все туже вокруг них кольцо окружения.	vol-5118-page-02-seg-005-0430-0696-1088-1020.png
5118	2	428	1024	1091	1551	79	0.96256	На одном участке немцы попытались отбить потерянные позиции. С этой целью они подтянули остатки артиллерии и ми- наметив, вызвали около двух десятков са- молетов и при этой поддержке перешли в кубтратаку. Завязался ожесточенный бой. Наши подразделения к началу схват- ки с врагом успели достаточно прочно закрепиться в отбитом населенном пункте. Они Встретили организованных огнем контратакующих немцев, и те, понеся большие лютери, вынуждены были отка- титься назад. Преследуя врага, N часть заняла еще один важный в тактической отношении населенный пункт.	vol-5118-page-02-seg-006-0428-1024-1091-1551.png
5118	2	426	1563	1082	1697	17	0.95054	На соседнем участке фашисты пред- приняли четыре контратаки. Но все они также были успешно отбиты советскими бойскам	vol-5118-page-02-seg-007-0426-1563-1082-1697.png
5118	2	422	1713	1088	2310	86	0.96399	этих боях попрежнему отважно умело действуют наши артиллеристы. Искусно сочетая огонь прямой наводкой с огнем батарей, стреляющих с закрытых позиций, они наносят врагу тяжелый урэн. Фашисты теперь уже не находят спасения в укрепленных зданиях и в блиндажах. Видимо, поэтому немецкое командование начинает вносить корректи- вы в тактику своих действий. В одном приказе немецкого штаба, за- храченном вместе с другими документами, мы читаем следующее: "Передней край не оборонять по принципу опорных пунктов использованием селений, а строить вре- менные позиции, используя все имеющиеся наличии средства. Оборону строить с	vol-5118-page-02-seg-008-0422-1713-1088-2310.png
5118	2	1113	702	1775	1607	142	0.96720	учетом методоз сорьбы противника п мест- ности. Огневых позиций в домах не де- лать. Чтобы противостоять стремлению про- тибника уничтожать пулеметы на огне- вых позициях, пулеметы должны молчать, и только тогда, когда пехота противника подойдет слишком близко, они могут всту- пать в действие. Артиллерия должна часто менять позиции». Читая этот приказ, наши артиллеристы с гордостью заявляют: «Отучили мы нем- цев от обороны в населенных пунктах, не найдут они опоры ни в лесу, ни на бо- тото. Всюду достанет их меткий снаряд». Чтобы хоть немного улучшить тяжелос положение своих частей, немецкое коман- дование бросает в бой большое количество самолетов. Транспортная авиация фаши- стов пытается снабдить окруженные части боеприпасами и продовольствием. Героиче- ски дерутся наши летчики, срывая наме- рения врага. Вчера летная погода в этом районе была всего лишь несколько часов. Несмотря на это, летчики одной нашей части уничтожили в воздухе 8 вражеских самолетов.	vol-5118-page-02-seg-009-1113-0702-1775-1607.png
5118	2	1107	1609	1771	2274	100	0.95728	Отличные образцы борьбы с воздушным противником показывают и артиллеристы. Следует особо отметить подразделение старшего лейтенанта Вялкина. При первом же налете один вражеский бомбардиров- щик был сбит орудийным расчетом сер- жанта Пенькова. Через час орудийный рас- чет под командой сержанта Лиходевского продырявил транспортный самолет «10-52». Немецкая машина тут же рухнула на зем- лю. Мы видели 14 трупов, валявшихся среди обломков машины, и трех живых немцев. После краткого опроса пленных выяснилось, что эти люди были посланы из глубокого тыла для усиления осажден- ных гарнизонов. Так фашисты, только что вылетевшие из центра Германии, сразу нашли себе могилу на болоте в районе Старой Руссы.	vol-5118-page-02-seg-010-1107-1609-1771-2274.png
5118	2	1365	2278	1729	2312	3	0.86898	Полковник В. ДЕРМАН	vol-5118-page-02-seg-011-1365-2278-1729-2312.png
5118	2	546	2348	1645	2482	7	0.96439	Правда о немецкой парашютной дивизии под Ленинградом	vol-5118-page-02-seg-012-0546-2348-1645-2482.png
5118	2	422	2500	1084	3008	75	0.95066	ЛЕНИНГРАДСКИЙ ФРОНТ, 5 марта. (По телеграфу от наш. спец. корр. ). Советское Информбюро сообщито 3 марта о новой несусветной брехно гитлеровцев. Оказы- вается, гитлеровские брехуны имели нат- пость оттубликовать сообщение о вымыш- ленных ими победах немецких парашюти- стов на Ленинградском Фронте, разбивших якойы «двенадцать болышевистских диви- зий». В связи с этим бредовым измышле- нием учестно вопомнить вкратце историю том, как появилась немецкая парашют- ная дивизия под Ленинградом и как она нашла здесь свой бесславный конец.	vol-5118-page-02-seg-013-0422-2500-1084-3008.png
5118	2	424	3018	1084	3335	48	0.96112	В октябре прошлого года на Ленинград- ский фрукт прибыла 7-я немецкая авиа- десантная дивизия под командованием генера.т-майора Майнделя, состоявшая из четырех ПОЛКОВ: одного парашютно- истребительного, одного штурмового и двух парашютных. Она была переброшена сюда из Бельгии и Голландии, а до этого уча- ствовала в операциях на острове Крит.	vol-5118-page-02-seg-014-0424-3018-1084-3335.png
5118	2	420	3341	1090	4360	156	0.96043	Эта дивизия состояла из отборных гит- сербских головорезов в возрасте до 27 лет, преимущественно добровольцев. Перед броском на Ленинградский фронт солдатам было объявлено, Что дивизия предназначается для захвата Ленинграда и ее части будут участвовать в воздуш- ных десантах. Пол Ленинград дивизия была доставлена из кенигсберга на самолетах. Но это был ее последний воздушный рейс. Как известно, в октябре еще раз потер- пети брак планы Гитлера захвату Ленинграда, и фашистским молодчиком из 7-й авиадесантной дивизии никула пры- гать не пришлось. Неся нод Ленингра- дом огромный урон, немцы вынуждены были использовать своих десантников как обыкновенную пехоту. Одетью в летнюю темносерую Форму с ярко желтыми пет- лицами, штлеровские парашютисты к ве- своему удивлению очутились в холодных, сырых окопах и вскоре были брошены в бой. Только здесь эти отъявленные бандиты, безнаказанно грабитник города Бельгии и Голландии, узнали, что такое настоящая война. В первых же боях батальоны пара- пютистов понесли огромные потери. Ефрей- гор Гуто Дрефс и ефрейтор Лиль Актон из	vol-5118-page-02-seg-015-0420-3341-1090-4360.png
5118	2	1107	2508	1773	4309	277	0.96546	девятой роты 1-го парашютно-истребитель- ного потока, тогда же захваченные в плен, показали, что их рота при первой контр- атаке советских войск потеряли почти всех офицеров и много солдат. Еще один пленный, старший ефрейтор 3-го полка Вольфганг Пароль, по убежде- ниям ярый фашист, вынужден был приз- нать, что с города в первом же бою по- теряла 70 человек убитыми и ранеными. В том числе был убит командир его взвода Бить и еще три офицера. Прошло две не- дети боев под Ленинградом, командова- ние 7-й авиадесантной дивизии было вы- нуждено из-за больших потерь соединить 2-й и 3-й полки, поручив командование сводным полком полковнику Гейтриху. Уже в ноябре наши части, действующие на Ленинградском фронте, настолько осно- вательно тогрепати авиадесантную диви- зию, что потери не превысят половину всего личного состава. Грязные и замши- вевшие парашютисты, мечтавшие когда-то спрыгнуть на улицы Ленинграда. глубоко залезли в землю, но это не спасло их на от холода, ни от огня советский аргилле- рип. Одетые в летние комбинезоны. они жестоко мерзли, вигивели и пачками выбы- вали из строя. Чтобы поднять окончательно упавшей воинский дух парашютистов, германское командование обещало им скорую отправ- ку на родину. Однако мало кому удалось воспользоваться этим обещанием. В конце декабря остатки дивизии были посланы на выручку разгромленного Тихвином корпуса генерала Шмидта и здесь окон- чательно перемолоты нашими войсками. Фактически дивизия перестала существо- вать, потеряв в общей сложности больше 85 процентов своего состава. Теперь пост Ленинградом остались только одни воепе- минания о фашистских парашютных вой- сках, жуткие их фтатки вовсе уведены с Ленинградского фронта. Таков конеп 7-й немецкой авиадесант- ной дивизии. Яспо после этого, какова не- на лживому утверждению германского ни- формационного бюро о мифических поре- дах немецких парашютистов на- Ленин- градском фронте.	vol-5118-page-02-seg-016-1107-2508-1773-4309.png
5118	2	1147	4321	1731	4358	4	0.94072	Батальонный комиссар В. ХЕЙСТВЕР	vol-5118-page-02-seg-017-1147-4321-1731-4358.png
5118	2	576	4410	1623	4490	7	0.94701	КРАСНОАРМЕЕЦ ПОТАКЕВИЧ СБИЛ ИЗ ВИНТОВКИ ВРАЖЕСКИЙ САМОЛЕТ	vol-5118-page-02-seg-018-0576-4410-1623-4490.png
5118	2	418	4512	1089	4904	53	0.95982	ЮГО-ЗАПАДНЫЙ ФРОНТ, 5 марта. (Спецкорр. ТАСС). Неожиданно над одним селений появился "Мессершмитт-109". Он летит бреющим полетом и строчные 113 пулемета. Воздушный разбойник был уве- рен в своей безнаказанности, так как но- ё.близости не было нашей авиации, ни Случайно оказавшийся в селе красиво- армеец Алексей Станкевич спрятался под лавесси разбитого сарая и наблюдал 33	vol-5118-page-02-seg-019-0418-4512-1089-4904.png
5118	2	1095	4512	1771	4904	55	0.95778	немецким воздушным бандитом. Когда фа- шистский самолет опустился еще ниже сделал третий круг, Потакевич открыл по нему огонь из самозарядной винтовки. Он выпустил 50 пуль. Но самолет оставался невредимым. Потакевич заложил шестай магазин и стал еще более тщательно це- литься. Несколькими меткими выстрелами он пробил мотор. Вражеский самолет ри- нулся вниз и врезался в землю.	vol-5118-page-02-seg-020-1095-4512-1771-4904.png
5118	2	1945	514	2310	646	4	0.92406	Упорные бои с немцами	vol-5118-page-02-seg-021-1945-0514-2310-0646.png
5118	2	1801	680	2464	1105	68	0.95375	Южный фронт, 5 марта. (По теле- графу от наш. спец. корр. ). На участке фронта, занимаемом частями N соедине- ния, грсисходят окесточенные бон. Про- Тивник упорно сопротивляется нашим на- ступающим войскам и нередко переходит в контратаки, теория при этом немалый урон. Отдельные наши части, сломив вра- жеско сопротивление, продвинулись впе- ред. Занят важный в тактическом отно- шении населенный пункт и ведутся бои на подступах к двум другим пунктам.	vol-5118-page-02-seg-022-1801-0680-2464-1105.png
5118	2	1799	1113	2462	1565	74	0.96143	В последних столкновениях с противни- FCM проявил исключительную отвагу командир тов. Олейник. С грушной смель- чаков он врезался в село, метким огнем уложил фашистского пулеметчика, а затем и орудийный расчет, который вел огонь по нашей наступающей пехоте. Тов. Олей- нек и его бойцы повернули захваченное орудие в сторону врага и сделали 60 вы- стрелов по отступающим фашистам, Этим дерзким налетом тов. Олейник открыл путь своей пехоте, которая, поднявшись в ата ку, полностью овладела селом.	vol-5118-page-02-seg-023-1799-1113-2462-1565.png
5118	2	1797	1571	2462	1989	65	0.96508	Заслуживает быть отмеченной отличная боевая работа разведчиков сержанта Рыба кова и красноармейца Дригало. Пробрав- шись в расположение врага, они закона- лись в снег и в течение целого дня на- блюдали за действиями фашистов. выявля- ли их огневые точки, места скопления хоты, Благодаря отважным и умелым дей- ствиям двух разведчиков, наши артилле- ристы получили точные данные о против- нико и, открыв огонь, нанесли фашистам большие потери.	vol-5118-page-02-seg-024-1797-1571-2462-1989.png
5118	2	1813	2031	2444	2163	5	0.96421	Ожесточенная борьба в населенных пунктах	vol-5118-page-02-seg-025-1813-2031-2444-2163.png
