volume_number	page_number	x1	y1	x2	y2	tokens_count	mean_confidence	text	image
5104	1	3927	5352	4594	5975	74	0.94143	5. Конькова Алексея Дмитриевича рабочего завода «Акрихин». 6. Лебедева Павла Александровича слесаря завода «Бомега» НКТМ. 7. Лебедева Сергея Петровича --- брига дира-слесаря завода "Комега" НКТМ. 8. Миненкозу Наталью Федоровну ра- ботницу Центрального склада НКО № 136 9. Сидорова Сергея Григорьевича- тоба- ря завода «Комега» НКТМ. 10. Хапаеву Екатерину Никитичну бригадира завода "Новый мыловар". 11. Шеванова Дмитрия Афанасьевич механика Центрального склада НКО № 276 12. Яшину Марию Дмитриевну --- ап- паратчицу завода № 754 НКХП	vol-5104-page-01-seg-088-3927-5352-4594-5975.png
5104	1	3339	5983	4504	6103	20	0.92167	Председатель Президиума Верховного Совета СССР М. КАЛИНИН Секретарь Президиума Верховного Совета СССР А. ГОРКИН. Москва, Кремль, 17 февраля 1942 года	vol-5104-page-01-seg-089-3339-5983-4504-6103.png
5104	2	2155	432	2742	466	5	0.83053	А н а я Е	vol-5104-page-02-seg-001-2155-0432-2742-0466.png
5104	2	3841	422	4492	458	8	0.91720	18 февраля 1942 г., среда. № 40 (5104)	vol-5104-page-02-seg-002-3841-0422-4492-0458.png
5104	2	666	544	4305	802	10	0.97125	мело и тщательно организовать каждое совместное наступление пехоты и артиллерии!	vol-5104-page-02-seg-003-0666-0544-4305-0802.png
5104	2	550	914	1681	992	3	0.91893	Мощный огонь проложил	vol-5104-page-02-seg-005-0550-0914-1681-0992.png
5104	2	856	1024	1363	1078	2	0.87361	нуть пехоте	vol-5104-page-02-seg-006-0856-1024-1363-1078.png
5104	2	430	1103	1101	2188	158	0.96204	ЮГО-ЗАПАДНЫЙ ФРОНТ, 17 февраля. (По телеграфу от наш. спец. корр. ). Не- сколько дней назад наша N часть, вкли- говшись в оборонительный район против- ника, стремительным ударом опрокинула немцев и заняла одно большое село. Не давая врагу опомниться, наши войны буквально на его плечах ворвались и в соседние населенные пункты. Здесь, ол- нако. наступающие натолкнулись на упорное, организованное сопротивление. Немды заранее подготовили вторую линию обороны, устроили дзоты и проволочные заграждения, установили минные поля. Тарнизоны второй линии, заняешие своп места, встретили наши части сильным ог- нем из автоматов, минометов п орудий. На этот раз, чтобы помешать наступа- ющим просочиться в промежутки между селами, немцы оборонялись не только в населенных пунктах, но и в поле. Боль- шинство расположенных здесь укреплений представляли собой блиндажи с двойным тройным деревянным перекрытием, с несколькими амбразурами для станко- вых и ручных пулеметов. Попадались и дерево-земляные укрепления, в которых находилось по одному-два миномета. Ар- тиллерию противник держал непосрет- ственно в селах и оттуда вел заградп- тельный огонь.	vol-5104-page-02-seg-007-0430-1103-1101-2188.png
5104	2	428	2192	1093	2748	82	0.96181	наша разведка определила, что в этом районе нет удобных промежутков для обхода противника, командование ре- шоло прорывать оборону немцев на всю ее глубину. В наступление вместе с пе- хотой и танками пошла артиллерия. Храбрые артиллеристы части, которой командует тов. Тарасов, пол жестоким об- стрелом выкатывали орудия на открытые позиции и разрушали вражеские укреп- ления. течение дня они подарили 36 немецких дзотов, 5 минометных бата- рей, 11 станковых пулеметов и 15 ору- дий разных калибров. Двигавшаяся впе- реди артиллеристов пехота занимала эти позиции.	vol-5104-page-02-seg-008-0428-2192-1093-2748.png
5104	2	428	2752	1091	2960	31	0.95198	Но одного артиллерийского огня было недостаточно, чтобы полностью подавить сопротивление врага. В бой были введены также все огневые средства пехоты. На- ряду с артиллеристами за уничтожение вражеских дзотов принялись стрелки. Не-	vol-5104-page-02-seg-009-0428-2752-1091-2960.png
5104	2	1115	1107	1785	2920	262	0.95775	большие группы, выделенные для блоки- ревки неприятельских укреплений, дей- ствовати согласованно. Бойцы веля орга- наигранный огонь по команде начальников блокировочных групп. Это, конечно, не исключало самостоятельной стрельбы каж- дого пехотинца в отдельности, когда он обидел в стороне от дзота какую-либо цель. Блокировочная группа комплектовалась следующим образом. В нее входило не- сколько автоматчиков, несколько стрел- ков, пулеметчик. Стрелки и автоматчики пиели гранаты и бутылки с горючей жилюстью Действия групп подпержива- лись минометами или отдельными ору- днями. Под прикрытием их огня бойцы приближались к вражескому укреплению, продвигаясь тогда, когда возле противни- ка рвались мины и снаряды. Немцы в это время умолкали, что позволяло блокпро- вочной группе ползком или перебежками, в зависимости от местности, продвинуться еще на несколько метров вперед. Когда группы приблизились дзотам примерно на 150 метров, они открыли огонь из винтовок, автоматов и пулеметов. Сотни пуль ложились возле пулеметных точек противника, ослепляли их, нет- цы не могли вести прицельный огонь. Этим пользовались гранатометчики, кото- рые еще ближе подползали к блиндажам и бросали зажигательные бутылки в ам- бразуры. Дзоты окутались пламенем, тула полетели гранаты. Оставшиеся в живых немцы выбегали из укреплений и палати под пулями наших бойцов. Стрелковое оружие оказалось способным не только уничтожать живую силу врага, но и вести борьбу c такими укреплениями, как дзоты. : Большую роль в этом бою сыграло чет- кое взаимодействие между блокировочны- группами и внутри их. Опыт показал, что при атаке укреплений лучше всего вести огонь из автоматов и винтовок ор- ганизованно, по определенной целя и по команде, сочетая этот огонь с движением вперед атакующих. В результате умелых действий пехоты " был уничтожен еще ряд вражеских д30- тов.	vol-5104-page-02-seg-010-1115-1107-1785-2920.png
5104	2	1379	2922	1725	2958	3	0.93298	Капитан П. СЛЕНДЕР	vol-5104-page-02-seg-011-1379-2922-1725-2958.png
5104	2	750	3004	1455	3134	4	0.94078	Массированный удар советских орудий	vol-5104-page-02-seg-012-0750-3004-1455-3134.png
5104	2	424	3156	1091	4003	125	0.96050	СЕВЕРО-ЗАПАДНЫЙ ФРОНТ, 17 февра- ля. (По телеграфу от наш. спец. корр. ). На одном участке фронта наши части, обо- шедшие с флангов оборонительные позиции немцев, взяли врага в железные клещи, от- резав ему пути отступления. Сейчас ус- пешно ликвидируются последние опорные пункты фашистов. В этих ожесточенных боях отлично по- казали себя славные советские аргиллери- сты. Выкатывая орудия из-за укрытий, они прямой наводкой разрушают враже- ские укрепленные точки. Так, у одного поселка одновременно стреляло прямой на- водкой 21 орудие разных калибров. В ре- зультате массированного огневого удара немцы были разгромлены и путь нашей пехоте расчищен. Артиллеристы подразделений, возглавля- емых тов. Семеновым, получили задание выбить фашистов из двух укрепленных се- лений. Под покровом ночи они выдвинули вперед свои орудия и установили их на 250--300 метров от объектов	vol-5104-page-02-seg-013-0424-3156-1091-4003.png
5104	2	1113	3162	1777	3997	132	0.96318	атаки. Точно в установленное время артил- леристы открыли огонь. Орудия под коман- дой старшего лейтенанта Кучерова прямой наводкой уничтожали пулеметные гнезда. После 25-минутного огневого налета нем- цы разбежались, побросав оружие. Продвигаясь вперед в боевых порядках походы, артиллеристы этой части без про- медления приходят на помощь пехотинца м в нужный момент. В одном месте против- ник попробовал перейти в контратаку, пы- таясь задержать продвижение пехоты. Ору- дийные расчеты быстро выкатили свои орудия вперед и в упор ударили по нем- пам. Те начали в панике отступать. Па- ша пехота, поддержанная артиллерией, не дала врагу опомниться и закрепиться на новом рубеже. В результате противник оставил на поле боя 15 орудий, более 3.000 снарядов, 50 лошадей. За последние дни уничтожено несколько вражеских опорных пунктов. Пехота пол гром артил- торийского огня уверенно устремляется вперед, уничтожая немецких оккупантов.	vol-5104-page-02-seg-014-1113-3162-1777-3997.png
5104	2	1999	922	2962	978	3	0.96848	Сила артиллерийских залпов	vol-5104-page-02-seg-016-1999-0922-2962-0978.png
5104	2	1809	992	2472	1305	42	0.95826	ЛЕНИНГРАДСКИЙ ФРОНТ, 17 февраля. (По телеграфу от наш. спец. корр. ). Ap тиллеристы части, которой командует май- ор Седаш, действуют на одном из участков Ленинградского Фронта. Артиллеристы этой части активпо по- могали своей пехоте продвигаться вперед и охладевать вражескими опорными пунк- тами.	vol-5104-page-02-seg-017-1809-0992-2472-1305.png
5104	2	1811	1311	2470	1509	30	0.94569	Бы Быстрое и широкое использование слова жизшейся конкретной обстановки, и нина- тева и настойчивость в выполнении бое вой задачи, вот что прежде всего от личает боевую работу артиллерийской ча- сти.	vol-5104-page-02-seg-018-1811-1311-2470-1509.png
5104	2	1805	1523	2470	2149	98	0.96049	Как-то артиллеристы меняли огневые позиции в лесистой местности. Немцы ста- ли бить из минометов, ориентируясь по шуму тракторов, тянувших орудия. Враг предполагал, что движется колонна тан- ков. Обстрел был безрезультатен, но командиры запомнили этот случай и слова лали для себя кое-какие выводы. С тех пор тракторы стали время от времени вы- езжать на двухкилометровую прогулку вдоль фронта, вызывая огонь противника. Немецкие минометчики не заставляли со- бя долго ждать. Они сразу то посылали мины сериями по 50-60 штук, а наши наблюдатели засекали расположение ми- нометных батарей и по окончании трак- торной прогулки обрушивали на пих гу- битольный артиллерийский огонь.	vol-5104-page-02-seg-019-1805-1523-2470-2149.png
5104	2	2498	986	3158	1379	60	0.95955	Майор Седаш вместе с капитаном Ро- новым и радистами как-то пропилки за линию фронта. Они углубились на кило- метр в расположение противника и отту- да стали по радио корректировать стрель- бу. Эта вылазка в стан врага позволила уничтожить вражеский узел сопротивле- нкя, имевший две минометные батареи и шесть станковых пулеметов. Была также разбита казарма, в которой погибло нема- ло фашистов.	vol-5104-page-02-seg-020-2498-0986-3158-1379.png
5104	2	2496	1385	3156	1663	38	0.96307	Когда стрелковые подразделения про- двигаются вперед, в их боевых порядках находятся передовые артиллерийские на- блюдатели. Это позволяет артиллерки бы- стро реагировать на каждое изменение об становки и уничтожать точным огнем пре пятствия, неожиданно возникающие на пу ти похоты.	vol-5104-page-02-seg-021-2496-1385-3156-1663.png
5104	2	2492	1669	3154	1993	45	0.95575	Старший лейтенант Дузь продвигался вместе с пехотой в районе одной деревни... Вдали показалась колонна вражеских тан- ков, идущая навстречу. Немедленно по- следовала команда по радио. Батареи свое временно открыли огонь по мчавшимся танкам, и колонна была расселена, Напта похота продолжала двигаться вперед без всякой задержки.	vol-5104-page-02-seg-022-2492-1669-3154-1993.png
5104	2	2486	1999	3150	2149	25	0.94742	Так сражаются отважные и умелые ар- тиллеристы этой части. Они беспощалн истребляют живую силу врага и его техни ку, пробивая своей пехоте путь к победам...	vol-5104-page-02-seg-023-2486-1999-3150-2149.png
5104	2	1925	2188	3050	2250	5	0.95303	Наши воины нещадно истребляют врага	vol-5104-page-02-seg-024-1925-2188-3050-2250.png
5104	2	1801	2278	2466	2912	104	0.96222	калининский фронт, 17 февраля (По телеграфу от наш, спец. корр. ). На отдельных участках фронта идет упорная борьба на ли их частей вокруг опорных путятов немецкой обороны. Против литье яростно сопротивляется, цепляясь за как- дое строение, и ударами наших войск несет большие потери. В одном районе немецкий отряд при под- держке четырех танков попытался перейти в контратаку. Его встретили губительным огнем артиллеристы N части. Со второго жо снаряда один немецкий танк был под- бит. Через несколько минут та же участь постигла два других танка, a последний m повернул обратно. Тогда наши артиллери- сты перенесли огонь на вражескую пехоту, уничтожив более 150 солдат и офицеров	vol-5104-page-02-seg-025-1801-2278-2466-2912.png
5104	2	2488	2282	3154	2910	84	0.95900	Отлично действовали в этом бою командир орудия сержант Кости, наводчик младшей сержант Рысетко, младший политрук Bo- локомотив, красноармейцы Токарев и Не- репеткин. Беспоцално истробляют врата наш отважные танкисты. Танковый экипаж составе младшего лейтенанта Нечитайло. водителя Панфилова и башенного стрелка Шенько уничтожил в бою вражеский дзот. два станювых путемета, минеметную ба- тарею, тротивотачновоо оружие и до 30 немцев. Экипаж, возглавляемый младшим лейтенантом Селиным, шесть раз ходил в атаку и вывел из строя три дзота, против- танковую пушку, три станковых пулемета рассели до роты фашистских солдат.	vol-5104-page-02-seg-026-2488-2282-3154-2910.png
5104	2	1835	3901	3084	3985	18	0.95467	ЮЖНЫЙ ФРОНТ. На снимке: летчики-истребители старший лейтенан C. Авдеевич (слева) и капитан Н. Мамаев возвращаются с очередното полета.	vol-5104-page-02-seg-027-1835-3901-3084-3985.png
5104	2	544	4085	1655	4163	2	0.96252	ПАРТИЗАНЫ ПОДМОСКОВЬЯ	vol-5104-page-02-seg-028-0544-4085-1655-4163.png
5104	2	418	4183	1093	6143	278	0.95968	Немецкие фашисты рвались к Москве. Они занимали один район за другим. II x - путь обозначался виселицами, пожарами, потоками крови. Они об явили московскую землю собственностью немецкой армии. Они посадили в деревнях своих холопов-стар- шин. Но настоящим хозяином московской зем- ли попрежнему оставался на ролл С при- ближением немцев стали создаваться пар- тизанские отряды для беспощадной борь- бы с оккупантами. Коммунисты и комсо- мольцы, беспартийные честные патрио- ты -мужчины, женщины, подростки брали в руки оружие и уходили в леса. Во главе партизанских отрядов стали руководители советских и партийных ор- ганизаций - секретари райкомов партия, председатели райсполкомов, директора МТС, совх0303, председатели колхозов, луч- шие люди Московской области. Секретарь Можайского горкома партии тов. Скачков возглавил партизанский отряд. Отряд Скачкова уничтожил вражеский самолет, 2 средних танка, 24 автомашины с во- енным снаряжением и солдатами, взорвал 4 склада с горючим и боеприпасами и уничтожил 134 фашиста. Председатель Верейского райисполкома тов. Евтеев, командуя партизанский отря- дом, вывел из окружения 1.300 бойцов и 200 командиров Красной Армии, а также мотострелковый батальон с материальной частью. Партизаны перерезали дороги, по кото- рым вражеские войска снабжались горю- чим и боеприпасами, взрывали цистерны с бензином и автомашины со снарядами. Но не всегда партизанских сил было достаточно, чтобы справиться с врагом. То- гда партизаны, собрав о противнике важ- ные сведения, передавали их ближайшей части Красной Армии, которая поносила немцам сокрушительный удар. Рядовые советские люди мужественно выполняли опасную роль разведчиков, са- ми предлагали свои услуги партизанским отрядам. Шестнадцатилетний школьник Анатолий Шумов отправился в разведку в районный центр Осташево. Предатель, став- ший старшиной у фашистов, опознал Ана- толия и выдал немцам. В течение десяти дней немцы держали Анатолия без пищи, непрерывно избивали его, стараясь узнать от него что-нибудь о партизанском отряде.	vol-5104-page-02-seg-029-0418-4183-1093-6143.png
