volume_number	page_number	x1	y1	x2	y2	tokens_count	mean_confidence	text	image
5155	3	3080	4157	3749	5056	127	0.95365	В непрерывных боях летом и осенью 1941 года полковой транспорт в известной мере псекносился. Большая часть повозок потребовала капитальной переделки. Иног- да приходилось из двух-трех новозок сози- рать одну, переделывая буквалыю все за- ново. Несмотря на эти трудности, к на- чалу апреля ремонтники сумели привести немало лювозок в полную готовность. Этот транспорт уже распределен по подразде- дениям и может быть в экстыноа- тапию любую минуту. По инициативе хозяйственной части еще зимой были организованы бригады для сбора оставленного в тылу транспор- та. Весь февраль и март поубирали оми но только сохранившиеся повозки, но отдельные части: колеса, хода, ящики, пирожки и т. д. Обшарив всю прилегаю- щую местность, они собрали до двух де- сятков повозок и отдельных ча- стей. Все это пригодилось в ходе ремон- та полковых транспортных средств.	vol-5155-page-03-seg-068-3080-4157-3749-5056.png
5155	3	3078	5068	3731	5206	19	0.96287	Местность, на которой застигает весна эту часть, преимущественно болотистая. что тоже учтено. Для автомашин сделать степиальные каты-дорожки и помо-	vol-5155-page-03-seg-069-3078-5068-3731-5206.png
5155	3	3779	3441	4444	3507	8	0.94450	сты, предназначенные на случай проезда по топким местам.	vol-5155-page-03-seg-070-3779-3441-4444-3507.png
5155	3	3777	3517	4442	3727	33	0.95326	Однако не везде так хорошо обстой дело с подготовкой колесного транспорта весне. Есть части, пде только еще на ченают думать о ремонте, рассуждают в составляют планы, а делу до сих пор но прислушили.	vol-5155-page-03-seg-071-3777-3517-4442-3727.png
5155	3	3759	3737	4440	5162	212	0.95918	В соединении, где интендантон тов. По- жалостин, считают в наличии много по козок, но фактически в частях нет половины этого налития. Остальные на холятся в тылу, причем в трех пунктах отстоящих довольно далеко от соединения Переброска этого транспорта в части по ка не организована. Многим повозкам ну- жен капитальный ремонт, и об этом лю ди тоже мало заботятся. Например, на обменном пункте имеется 14 повозок, требующих ремонта. Привести их в при- годное состояние никто не удосужился по сей день. 0 безответственности интендантской службы этого соединения свидетельствует и такой факт. В переправы частей через озеро весь колесный транспорт были оставлен в лесу. Это было еще осенью. Всю зиму этот транспорт, никому не пе- редаконый, находился без надзора, валял- ся в снегу, под открытым небом. Там он находится и сейчас, ржавеет, портится. Важность своевременного ремонта ко- лесного транспортз созершенно очевидна. По за горами то время, когда он потре- буется для подвоза на передовые позиции боеприпасов, продуктов питания, оружия, снаряжения и другого необходимого для боя имущества. Находятся люди, которые, порндимому, не понимают этого и не при- лагают всех усилий, чтобы во-время обе- спечить подразделения исправным колес- ным транспортом. Ясно, что подобная без- ответственность недолгустина. Надо торо- питься с приведением в порядок войсково- го хозяйства к лету. Ни минуты не мед- лить с ремонтом колесного транспорта,	vol-5155-page-03-seg-072-3759-3737-4440-5162.png
5155	3	4027	5180	4349	5216	2	0.90540	Капитан ДРАПОВ	vol-5155-page-03-seg-073-4027-5180-4349-5216.png
5155	3	3309	5280	4179	5410	6	0.96149	Делегация фронтовиков едет в Молотовскую область	vol-5155-page-03-seg-074-3309-5280-4179-5410.png
5155	3	3058	5426	3717	6165	95	0.95330	СЕВЕРО-ЗАПАДНЫЙ ФРОНТ, 17 реля. (По телеграфу от наш. корр. ). Молотовскую область выехала делегаци фронтовиков из N соединения. Эта поездк является ответом на посещение фронт делегацией трудящихся Молотовской обла сти в феврале с. г. Молотовцы привезл тогда фронтовикам много подарков от пру дящихся области и вручили красное мя передовой части фронта, которой коман дует тов. Ниссан. Делегация фронтовика в свою очередь вручит красное знамя Во енного Совета передовому предприяти! Молотовской области. B составе делегации, возглавляемо старшим батальонным комиссаром Гуджино вым, 16 фронтовиков. Это лучшие бойще и командиры, отличиваниеся в боях про немецких оккупантов. Только нагану-	vol-5155-page-03-seg-075-3058-5426-3717-6165.png
5155	3	3753	5442	4414	5695	36	0.95538	делегации лейтенанту Федорову. Бомантуя батареей, тов. Федоров разгромный со свои- ми бойцами десятки укрепленных огневых точек противника. В этом бою его бата- рея отразила сильную танковую контр- атаку немцев и этим способствовала ус- пеху крупной операции.	vol-5155-page-03-seg-076-3753-5442-4414-5695.png
5155	3	3739	5709	4414	6163	60	0.95056	В гости к молотовцам едут также майор Близнюк, командир бомбардировочной авиа части, награжденный орденом Ленина. старший лейтенант Майский, награжден- ный орденом красного Знамени. Член де- легацин младший лейтенант Шепелев, на- гражденный медалью "За боевые заслуги". сам является молотовдем. До армии он работал на шахте в городе Кизеле. Сейчас он посетит свои родные края и шахтеров, труд которых он самоотверженно защи-	vol-5155-page-03-seg-077-3739-5709-4414-6163.png
5155	4	438	384	4454	470	7	0.93533	18 апреля 1942 г., суббота. 91 (5155)	vol-5155-page-04-seg-001-0438-0384-4454-0470.png
5155	4	622	530	2254	694	6	0.93443	Целкушении» на Папина в ангарском суде	vol-5155-page-04-seg-003-0622-0530-2254-0694.png
5155	4	414	728	1086	3150	389	0.96078	16 апреля. (ТАСС). Вчера в ангарском суде возобновилось слушанием дело о «покушении» на гитлеровского пос- c- на Палена. Советские граждане т.т. Павлов Боронилов, которые привлечены в каче- обвиняемых по этому делу, высту- пили на суде с заявлением, в котором, ссылаясь на турецкие законы, попросил суд изменить меру пресечения и освобо- дить их из-под стражи на время судеб- ного разбирательства под подписку о не- выезде или под поручительство. Тов. Мав- лов, в частности, указат, что в этой просьбе по турецкому закону можно было ны отказать, если бы выелось подозрение f) том, что обвиняемых советские граждане собираются скрыться от суда. В этом из нельзя заподозрить хотя бы потому, что, например, он, Павлов, лично явился в по- по требованию турецких властей. I. т. Павлов и Корнилов указали далее пуду, что по отношению ним нарушен процессуальных норм как на предва- рительном следствии, так и во время про- #сходящего судебного следствия. Так, на- пример, несмотря на требование турецког уголовно-процессуального кодекса о том, тто арестованному пенедленно должно быть сообщено, в чем он обвиняется, Корнило- ну, арестованному 6 марта, было сказано "отыко 17 марта, в чем он обвиняется, Павлову через неделю после ареста: "обвиняемым не были разъяснены туреп- ние законы по вопросу о защите; из про допроса им был локазан только одна; Павлову во время предварительно- го следствия было провокационно заявле- то, будто "Корнетов признал все факты" что он, Павлов, напрасно упорствует т. д. Павлов требует от суда, чтобы этот факт применения на следствии провока- ионных методов был запесеп в прото- ход суда. Не опровергая этих фактов, председатель суда уклончиво заявляет том, что подсудимые говорят-де о том, «что уже минуло». Неоднократно нарушая пра за подсудимых советских граждан на свою защиту, которую они осуществляют сами, председатель суда часто прерывает их, за- являет, что "суду некогда", но в то же время вынужден признать, что процессу- альные нормы в отношении обвиняемых советских граждан нарушались. Председа- голь суда пытается затушевать этот факт обращаясь к обвиняемым советским гра- кланам, говорит: "Зачем вы все это вспо ничаете, посколыгу эти нарушения были прошлом. на предварительном следствии. Ведь это уже пройденный этап». Т.т. Павлов п Корнилов просят суд разрешить им пользоваться юридической помощью находящегося в Анкаре советско- го юрисконсульта. Не без труда Павлов добивается от суда Возможности дать, наконец, показания по существу пред явленного обвинения. так называемому покушению, --- запвляет Павлов, я не имел и не имею никакого отношения, Все это дело является какой-то	vol-5155-page-04-seg-004-0414-0728-1086-3150.png
5155	4	1097	724	1771	3148	391	0.95591	трагикомедией, к которой я отношусь чувством глубокого негодования. Провока- торы по заранее разработанному плану делали и продолжают делать все, чтобы придать политическую окраску этому чис- то уголовному делу, имя которому шан- так и клевета. В этих целях была пронз- ведена инсценировка покушения на Да- нена. Провокаторы злейшие враги Co- ветского Союза, враги демократических стран следовательно, враги Турции. Настоящим организаторам этой промокание пока удалось скрыться от суда. Цель про- вокации свалить так называемое «110- кушение» на Папена --- на "коммуне- - стов», лкобы связанных с советскими 10- гражданами, чтобы дискредитировать по- следних в глазах общественного мнения и турецких властей и добиться ухудшения советско-турецких отношений». Павлов указывает, что провокаторы Абдурахман, Сулейман и их сообщники либо вовсе не турки, либо «турки на час», турецкое гражданство для пре- ступных целей. Это люди, не имеющие по- нятия о родине, принципах и чести. Пав- лов указывает, что провокатор Сулейман якобы заявил на предварительном следст- вин 6 марта, что «покушение является пот пыткой расстроить отношения между Тур- и Германией», а на первом судебном заседания 1 апреля, на вопрос председа- теля сула о целях «покушения», тот же Сулейман ответил: «Л не имею своего мне- ния по этому вопросу и вообще об этом ничего не знаю". Павлов просит суд запи- тересоваться вопросом, "кто же высказы- вался за Сулеймана на предварительном следствии». Касаясь следственных материа- лов об обстоятельствах так называемого "покушения", Павлов обращает внимание суда на то, что ни в одном документе по- чсму-то не зафиксировано расстояние от неста взрыва бомбы до проходившего по бульвару Папена. После взрыва Папен и его жена прошли к автомобилю, стоявшему в 100 метрах от места взрыва, силы в на- шину и уехали в германское посольство еще до прибытия полиции на место про- исшествая. Цитируя ряд материалов след- - ствия, Павлов заявляет, что они «ПОЗВО- ляют сделать тот вывод, что мы имеем дето не с покушением, а с инсценировкой покушения и что место взрыва было выб- рано организаторами этой инсценировки исключительно точно. Эта бомба бросалась не в Палена, з в советских граждан, и провокаторы достигли цели. как она по- пала в нас, я буду показывать дальше». Суд откладывает продолжение показаний Павлова. АНКАРА, 16 апреля. (ТАСС). Не во- зобновтяя допроса Павлова и не об являя, когда он сможет продолжить свои показа- ния, анкарский суд вчера и сегодня до- прашивал ряд свидетелей обвинения, по- казания половых обратились. однако, про- --- тв обвинителей. Легко раненая взрывом бомбы Игут Тор-	vol-5155-page-04-seg-005-1097-0724-1771-3148.png
5155	4	1791	724	2452	1657	165	0.96210	гуз показала, что бомба взорвалась на расстоянии 15 -16 метров от Папена, между тем, как последний в своем заяв- лении турецким властям от 25 февраля с прозрачной целью заявил, будто бомба взорвалась в 6-7 метрах от него. До- прошенный шофер такси Фахри, находив шийся, якобы. в 200 метрах от места взрыва, заявил, будто за несколько минут до взрыва и недалеко от места врыва он вышел автомобиль, в котором, якобы, си- дел Корнилов. На вопрос судьи. кому, по мнению свидетеля, принадлежит этот ав- томобиль, шсфер дает наглый ответ: «Со- ветскому посольству». Корнилов без труда разоблачает эту провокационную ложь. Па- вопрос Корнилова о цвете машины Фахри заявляет, что она была вишневого цвета. Корнилов обращает внимание суда, что автомобиля этого цвета в советском по- сольстве нет. и констатирует, что Факри на предварительном следствии но говорит ни об этом мифическом автомобиле, ни о том, что он видел в нем Корнилова. Судья спрашивает Фахри, почему он не сказал этого раньше. Факри мнется и не может ясно ответить на этот вопрос.	vol-5155-page-04-seg-006-1791-0724-2452-1657.png
5155	4	1789	1675	2446	1805	21	0.95735	Павлов обращает внимание суда на то что Фахри допрашивался дважды и не го- ворил ничто из того, что придумал се- годня.	vol-5155-page-04-seg-007-1789-1675-2446-1805.png
5155	4	1787	1827	2446	2210	54	0.95373	Суд допросил также польского инжене ра Романовского, который, по провокаци- одному утверждению Сулеймана, якобы "связал" его с советским посольством. Романовский прям) назвал Сулеймана тайным полицейским агентом и разобла- чил его ложь. Отвечая на вопросы Кор- нилова, провокаторы Абдурахман и Сулей- ман вынуждены признать, что не знако- мили Корнилова с Омером, убитым при взрыве бомбы.	vol-5155-page-04-seg-008-1787-1827-2446-2210.png
5155	4	1785	2224	2442	2604	66	0.95562	В связи с заявлениями Павлова и hop- нилова на вчерашнем заседании суд вы посит определение, разъясняющее Павлову и Корнилову, что, как не имеющие адво- катов, они приобретают права защитни- ков и могут поэтому получать от суда документы по слушаемому делу. В это же определении суд сохраняет в сило ме- ру пресечения. Суд заявляет, что «не мо- жет запретить» Павлову и Корнилову об- щаться с советским юрисконсультом.	vol-5155-page-04-seg-009-1785-2224-2442-2604.png
5155	4	1783	2622	2442	3138	76	0.96199	Очередное заседание суда неожиданно откладывается до 29 апреля. Это решение суд мотивирует тем, что из Стамбула дол жны быть вызваны свидетели. В журна - листеких кругах, следящих за этим стран- процессом, высказывают предположе- ние, что новая отсрочка вызвана обстоя- тельствами иного рода. Присутствовавшие на суде журналисты указывают, что с наличным совинительным материалом про- курору не удается построить свое обвине- ние против советских граждан и что ис- кусственность пред'явленных Павлову и Корнилову обвинений стала слишком оче- видной	vol-5155-page-04-seg-010-1783-2622-2442-3138.png
5155	4	592	3234	1569	3281	3	0.96385	ВОЕННЫЕ МЕРОПРИЯТИЯ США	vol-5155-page-04-seg-011-0592-3234-1569-3281.png
5155	4	408	3313	1066	4151	112	0.96192	ВАШИНГТОН. 17 апреля. (ТАСС). Пре- зидент США Рузвельт издал распоряже- значительно расширяющие обязан- ности и полномочия "Управления эконо- нической войны», возглавляемого вице- президентом Уоллесом. Управлению по- ручено руководить закупкой стратегичес- ких материалов. До последнего времени какие закупки проводились под руковод- ством министра торговли Джонса. Одно- временно Управлению предоставляется право принимать меры, "которые оно счи- гает необходимыми для увеличения воен- ных усилий и укрепления международ- ных экономических связей США». Управлению поручено обеспечить полу- чение Соединенными Штатами взаимной помощи и выгод от правительства любой страны, оборона которой по определению президента является существенно важной для обороны США в соответствии с зако- от 11 марта 1941 года. Управление будет представлять правительство США взаимоотношениях с органами эконо-	vol-5155-page-04-seg-012-0408-3313-1066-4151.png
