volume_number	page_number	x1	y1	x2	y2	tokens_count	mean_confidence	text	image
5768	2	2279	4249	2935	5145	134	0.96632	Сразу же после короткой, но мощной артиллерийской подготовки по огневым точкам врага, мешающим продвижению пехоты, и сильного удара авиации пехота должна энергично продвигаться, сопровож- даемая минометным огнем и отдельными орудиями, ведущими огонь прямой навод- кой. Автоматчики идут впереди и первы- ми врываются с флангов в траншее, за- брасывая остатки противника ручными гранатами и расстреливая короткими оче- редями из автоматов. В горах много мерт- вых пространств, и пехота не должна бо- яться прижиматься к полосе разрывов своих снарядов. В противном случае при переносе артиллерийского огня в глубину пехота неизбежно попадет под огонь ожи- вающих минометов и автоматов противни- ка и будет вынуждена на время залечь. песя излишние потери. Ожившие, нелобп- тые огневые точки противника и выведен- ные из укрытий огневые его средства уничтожаются мощными огневыми нале- тами минометов, вслед за которыми пехота бросается на штурм.	vol-5768-page-02-seg-052-2279-4249-2935-5145.png
5768	2	2279	5161	2929	5734	84	0.95814	Описанные действия приковывают к се- бс силы противника. Пользуясь этим, повременно группы автоматчиков прони- кают в глубь расположения врага, лей ствуя самостоятельно и скрытно, проса- чиваясь в незанятью промежутки или входя в прорыв. Двигаются они без троп, по труднопроходимым участкам, через лесные заросли и скалы. Этим группам придаются саперы для расчистки зарос- лей и завалов на пути следования. По- лезно придавать саперам надежных преданных местных проводников, в кото- рых недостатка не будет и которые с го- точностью будут помогать нам против не мецких захватчиков.	vol-5768-page-02-seg-053-2279-5161-2929-5734.png
5768	2	2277	5744	2927	6136	57	0.96096	Основной задачей отдельных групп проникающих глубоко B тыл, является выход на основной, на данном участке путь подвоза и эвакуации полка или ли- визии противника. Заняв нависающие на дорогой пли тропой командные высоты снизу труднодоступные, перехватие ущелья и теснины, группы своим огнем от- резают пути подвоза и эвакуации, оста ваясь сами мало уязвимыми. Группы закрепляются на выгодных го-	vol-5768-page-02-seg-054-2277-5744-2927-6136.png
5768	2	2952	4139	3612	4811	102	0.95909	сподствующих высотах и выделяют часть автоматчиков, которые кочуют по греб- ням и вершинам гор и то там, то тут открывают внезапный короткий шкваль- ный огонь, создавая видимость значи- тельных сил, проникших в тыл врага. Такими действиями группы наводят в ты- лу врага панику, создают в узких местах из подбитых автомашин и обоза пробки и вынуждают противника либо пользоваться плохими обходными дорогами, либо вре- менно прекратить на этом участке подвоз и эвакуацию. Группы всё время должны усиливаться новыми, прибывающими под- разделениями; таким путем происходит накапливание наших сил в тылу, уве- личивается численность бойцов от нес- кольких групп до роты, батальона и даже палка.	vol-5768-page-02-seg-055-2952-4139-3612-4811.png
5768	2	2950	4828	3606	5505	97	0.95891	Когда подвоз противника временно прекращается, когда он начинает испыты- вать серьезный недостаток в боеприпасах вследствие этого и огонь его ослабева- ет, как раз в этот критический момент наши части, действующие с фронта, и усиливают удары во фланги врага. При этом часто одна только угроза окружения уже заставляет противника оставлять важные для него опорные пункты. Вот здесь-то особенно выгодную роль могут сыграть находящиеся в тылу немцев на- подразделения. Они нападают и ист- ребляют отступающие группы врага. Если последний будет продолжать обороняться. то он уничтожается с разных сторон ре- шительными действиями наших частей гри полержее всех нмеюшихся огневых средств.	vol-5768-page-02-seg-056-2950-4828-3606-5505.png
5768	2	2952	5515	3603	5796	33	0.96267	Особенности горно-лесистой местности вынуждают выделять наступлении и частные резервы, несомненно, более силь- ные, чем на равнине. Назначение резер- БОВ противодействие обходам, париро- вание контратак и уничтожение групп противника, проникающих на наши ты- лы.	vol-5768-page-02-seg-057-2952-5515-3603-5796.png
5768	2	2952	5809	3597	5880	8	0.94053	В каком боевом порядке двигаются на- ступающие подразделения?	vol-5768-page-02-seg-058-2952-5809-3597-5880.png
5768	2	2947	5886	3601	6138	32	0.94474	Примерный боевой порядок наших на ступающих подразделений следующий стрелковое отделение наступает цепью с интервалами между бойцами в 3-4 мет- ра; ручной пулемет средине цепи; командир ведет свое отделение, имея при себе связного	vol-5768-page-02-seg-059-2947-5886-3601-6138.png
5768	2	3630	4141	4293	4892	123	0.95674	Стрелковый взво1 наступает, имея три отделения в одной линии или уступом (вправо, влево), сзади, в 30-40 метрах, за серединой следует резервное отделение, a под его прикрытием неотступно про- 1 двигаются приланные минометы. Командир в 2 вода со связным находятся между пер- сой линией отделений и резервным отле- лением. Роте и даже иногда взволу по- лезно придавать отдельные малокалибер ные орудия при условии их проходимости по данной местности. Впереди пепи взво- да движется боевой дозор из 3 -- 4 ав- тематчиков с сапером, на удалении 100 150 150 метров. Задача этого позора пре- 1остерегать взвол от неожиданного напа- дения из засады, обнаруживать препятст- бия, захватывать складки и выступы ме- стпости, обрушиваясь с них огнем на про- тивника в содействуя выдвижению своего и соседнего взводов.	vol-5768-page-02-seg-060-3630-4141-4293-4892.png
5768	2	3624	4909	4287	5553	89	0.96045	Каждая захваченная высота или уча- сток местности немедленно должны за- крепляться. К ним быстро подтягиваются огневые средства для того, чтобы, опи- раясь на ипх. продолжать дальнейшее продвижение. В случае контратак за- хваченный приспособленный пункт служит надежной опорой для их отраже- ная. Его следует усилить противопехот- ными противотанковыми (где возможна угроза танков) минами и препятствиями. Особенно важно закрепляться на опорных пунктах, расположенных на флангах и на стыках наших наступающих частей. Что- бы контратака не были неожиданными, в бою непрерывно ведется разведка, осу- ществляется круговое наблюдение и не- посредственное боевое охранение	vol-5768-page-02-seg-061-3624-4909-4287-5553.png
5768	2	3622	5571	4287	6038	74	0.95966	После выполнения поставленной зала- чи в лесистых горах на организовать подтягивание отставших бойцов, а также и всех потерявших в лесу и горном као- се ориентировку. Для этого в укрытом ме- сте, сзади, в стороне от позиций, назна- чается сборный пункт c расторопным младшим командиром, который при помо- щи ракет, дыма, костров, выставленных маяков и других средств обозначает место сбора людей. По прибытии их на сбор- ный пункт он немедленно направляет бойцов по своим частям	vol-5768-page-02-seg-062-3622-5571-4287-6038.png
5768	2	3655	6065	4236	6146	4	0.94915	Генерал-майор Н. действующая армия.	vol-5768-page-02-seg-063-3655-6065-4236-6146.png
5768	3	317	307	1052	342	8	0.87738	13 апреля 1944 г., четверг. № 88 (5768)	vol-5768-page-03-seg-001-0317-0307-1052-0342.png
5768	3	1985	309	2556	342	5	0.83394	A C H 3 Е	vol-5768-page-03-seg-002-1985-0309-2556-0342.png
5768	3	444	425	2096	563	3	0.97284	На крымской земле	vol-5768-page-03-seg-003-0444-0425-2096-0563.png
5768	3	261	577	930	1792	178	0.95616	В час рассвета над мертвыми водами Сиваша клубились туманы. Когда же вста вало из тумана багровое солнце и рассе- явилась мгла, то снизу поднимались тучи дыма, застилавшие Сиваш па несколько километров. В просветах на горизонте был виден ряд черных точек. Казалось, что это идет кильватерным строем аскад- ра военных кораблей. Но черные точки- это были наши саперы, которые работали на сивашских переправах. Невольно вспомнилась укутанная ды- мовой завесой переправа через Волгу к Сталинграду. Кстати, многие из этих са- пер те же самые, неутомимые в тру- де, пожилые, обкуренными усами и корявыми, неразгибающимися руками, что были на Волге в то дни. Дождавшись, когда пройдут машины и подводы с того берега, мы съехали на бе- рег. Водные преграды позади. Впереди простерлась голая, желто-бурая почва при- сивашской низменности. На двадцать кило- метров в глубину нет ни одного деревца. Даже указатели на дорогах приклеены не к деревянным, а к земляным столбикам. Развалины саманных хат близ дороги и земляной столбик с надписью названия воинственные признаки разрушенного нем- цами маленького селения. Сколько еще таких разрушенных врагом сёл встретят наши бойцы на исстрадавшейся крымской вемле!	vol-5768-page-03-seg-004-0261-0577-0930-1792.png
5768	3	255	1800	919	2787	151	0.95729	Оставив машину за курганом, идем по вспаханному полю. Ясное апрельское солн- пе. Здесь ему особенно рады. Наконец-то просветлело после бесконечных дождей и туманов. Вкопаны в землю покрытые мас- кировочными сетками танки. Танкисты за- нимаются пока мирным делом: кто, при- строившись на башне, бреется, это, раз- девшись до пояса, с наслаждением пле- щется в холодной весенней воде. Может быть, осталось всего несколько часов до атаки. Как же не привести себя в поря- док под этим теплым вешним солнцем. Танковый офицер подходит к батарее, ведущей огонь, и, улыбаясь, вручает ее командиру букет только что сорванных пежноголубых подснежников. За отличную стрельбу! - говорит бн, и все вокруг весело смеются. На не- которых орудиях можно видеть надпись: «Защитник Сталинграда». Здесь немало батарей и дивизионов, что били немцев у Волги. Среди нынешних героев Шерекоп- ского перешейка и Сиваша много ветера- нов Сталинграда. Недаром популярен здесь стихотворный лозунг, который можно не раз прочитать по дороге к фронту:	vol-5768-page-03-seg-005-0255-1800-0919-2787.png
5768	3	332	2804	717	2947	9	0.92298	Гвардейским ударом Врага сокрушим. На Крым, сталинградцы! На Крым!	vol-5768-page-03-seg-006-0332-2804-0717-2947.png
5768	3	255	2950	909	3060	17	0.93851	Наблюдательный пункт командира пол- ка. Впередн, ожидая атаки, лежат в око- нах бойцы. Возвышается над окопом за	vol-5768-page-03-seg-007-0255-2950-0909-3060.png
5768	3	1027	629	1533	696	5	0.94385	(От специального корреспондента «Красной звезды»)	vol-5768-page-03-seg-008-1027-0629-1533-0696.png
5768	3	946	775	1602	1059	47	0.95963	вернутое в чехол полковое знамя. Сейчас, в ожидании боя, оно напоминает и офице- рам и бойдам об их долге перед Родиной, о славе и чести. Начинается артиллерий- ская подготовка. Потом генерал, командир дивизии, воевавший этих местах еще под знаменами Фрунзе, отдает приказ под- нять полки в атаку.	vol-5768-page-03-seg-009-0946-0775-1602-1059.png
5768	3	938	1065	1600	1969	128	0.96259	Справа сверкает на солнце широкая гладь топкого озера. За высотой слева тоже вола. Полоса наступления три Еплометра узкого дефиле между озер. Ночью два полка перешли вброд болото, что справа, и окопались на рубеже ата- ки перед высотами, которые держат нем- цы. Нужно взять одну за другой эти три высоты на узком межозерном пере- шейке, и тогда ворота в глубь Крыма бу- дут открыты. В бинокль хорошо видно, как поднялась попла за танками во весь рост наша пехота. Она идет вслед за разрывами сво- их снарядов, и артиллерийский офицер восхищенно говорит: Молодцы! Немцы встречают наступающих огнем артиллерии. Вот задымился подбитый тапк, падает несколько пехотинцев, но цень не редеет. В этот миг над немецки- ми позициями появляются шестерки на- ших штурмовиков. Прицельным бомбомета- шлем и огнем они подавляют вражеские оружия.	vol-5768-page-03-seg-010-0938-1065-1600-1969.png
5768	3	936	1973	1592	2370	57	0.95917	Теперал стоит в окопе, на возвышении. Изредка поглядывая в стереотрубу, он отдает приказания танковому, артиллерий- скому, саперному командиру. Он управля- ет боем, как опытный дирижер. Верные его воле танки и цепи пехоты обходят высоту справа, врываются во вторую ли- нию немецких траншей. Вот они снова идут вперед, и минометы, расположенные низине у озера, окаймляют их огневым щитом.	vol-5768-page-03-seg-011-0936-1973-1592-2370.png
5768	3	936	2375	1588	2802	55	0.96906	Танки повернуть чуть вправо, низине, говорит генерал. низине минные поля, докла бывает начальник штаба. -- Выбросить вперед сапер. Танки несколько задерживаются. Тап- новый командир, надвинув шапку, садит- ся в свою серую машину, и опа ползет перед средн разрывов. Проходят еще дол- гие полчаса боя, п пехота выдвигается вместе с танками к скатам второй высо- ты.	vol-5768-page-03-seg-012-0936-2375-1588-2802.png
5768	3	933	2806	1588	3054	34	0.96354	Бой достигает высшего напряжения Бойцы резервного полка, высунувшись из окопа, горящими глазами смотрят туда. где дерется с врагом их дивизия. Они с трудом сдерживают свое желание немел- ленно броситься вперед, ими овладела каждая боя,	vol-5768-page-03-seg-013-0933-2806-1588-3054.png
5768	3	1619	584	2279	1925	193	0.96102	Цепи пехоты всё ближе подходят к гребню второй высоты. Передвинуть дивизионную артилле: рию, приказывает генерал. --- Мино- метам немедленно дать огонь по обратным скатам высоты. Он чувствует, что сейчас оттуда про- тивник перейлет в контратаку. Резервный полк поднимается и по-взводно переходит эброд топкое озеро. Немцы замечают дви- жение резерва, открывают огонь, но пе- хотинцы, словно не замечая разрывов, на- стойчиво идут через поле. Только хорошо натренированное и от- важное войско, управляемее командиром. умеющим четко организовать взаимодейст- рие всех родов оружия, способно за не- сколько часов прорвать оборону противни- ка на этом узком перешейке, где нельзя двинуться ни вправо, ни влево, где мож- по бить только в лоб. Боевое мастерство низших стрелков проявилось особенно ярко, когда разгорелись схватки в немецких траншеях. Ожившие пулеметы немцев преграждали путь наступающей пехоте. Дым, окутавший поле боя, передко мешал артиллерийским наблюдателям во-время обнаружить действующие огневые точки, быстро и точно передать нужные команды на батарею. К тому же в бою связь с ро- тами и батальонамп часто прерывается. Тогда наши пехотинцы истребляли враже- ских пулеметчиков и автоматчиков грана томи, бронебойщики били по нем из про тивотанковых ружей. Борьба пехоты с не- мецкими пулеметчиками во многом реши- та успех ее продвижения.	vol-5768-page-03-seg-014-1619-0584-2279-1925.png
5768	3	1614	1931	2269	2189	29	0.93993	Приводят партию пленных. Их обсту поют наши бойцы. Ишь от слизи-то на крымских хар чах, говорит один. Крым - курорт, Брым санато- рий? А? --- насмешливо спрашивает дру- гой.	vol-5768-page-03-seg-015-1614-1931-2269-2189.png
5768	3	1614	2196	2269	2423	26	0.93914	Пихт курорт, нихт санаторий. Дас ист копмар, - лепечет черноволосый и Следный немецкий ефрейтор. Красноармейцы смеются. Не то еще будет, когда прижмем вашего брата к морю.	vol-5768-page-03-seg-016-1614-2196-2269-2423.png
5768	3	1614	2433	2269	2683	34	0.96285	третьей, самой важной высоты вводится в действие резервный полк дпс- визпи, и это наращивание удара решает исход боя. Враг смят отброшен, путь в глубину крымской земли открыт. Теперь можно двинуть вперед основную массу тапков.	vol-5768-page-03-seg-017-1614-2433-2269-2683.png
5768	3	1614	2695	2262	2800	14	0.94962	По брустверу идет к наблюдательном) пункту старший начальник. Командир дн- визии вытягивается перед ним.	vol-5768-page-03-seg-018-1614-2695-2262-2800.png
5768	3	1612	2812	2260	2958	17	0.94346	Товарищ генерал, --- докладывает ближайшая задача выполнена. Бой продолжался. Наши танковые ча сти устремились в глубь Крыма.	vol-5768-page-03-seg-019-1612-2812-2260-2958.png
5768	3	1635	2968	2223	3056	6	0.91495	Май, Майор В. КРЫМ. (По телеграфу).	vol-5768-page-03-seg-020-1635-2968-2223-3056.png
5768	3	677	3120	1862	3201	3	0.91275	Взятие города Тирасполь	vol-5768-page-03-seg-021-0677-3120-1862-3201.png
