volume_number	page_number	x1	y1	x2	y2	tokens_count	mean_confidence	text	image
5768	1	3630	4572	4297	5392	126	0.95316	двигаться вперед, отбрасывал остатки раз- битых вражеских войск на юг и юго-за- над. На этом участке фронта также занят ряд населенных пунктов, в том числе Ишунь, Воронцовка и другие. Гитлеровцы повсюду несут огромный потери в живой силе и в технике. Харак- терен следующий пример. С выходом на- ших войск к Джанкою очутились в крп- тическом положении вражеские части, за- нимавшие оборону на Чонгарском и дру- гих полуостровах. Юго-западнее Чонгара наши танкисты и мотопехота мастерским маневром настигли группу войск против- ника численностью свыше 2.000 солдат и офицеров. Это были остатки пехотной дивизии. Бросив всю артиллерию и обозы, они побежали с полуострова, пытаясь выбраться к югу. Наступающие воспре- a- пятствовали этой попытке. Ударами на- ших войск часть вражеской группы была уничтожена, а другая ее часть сдалась в плен.	vol-5768-page-01-seg-078-3630-4572-4297-5392.png
5768	1	3628	5397	4282	5648	36	0.95949	Наступающие берут много пленных, в числе п нема. офицеров. Небезынтерес- но отметить, что вчера в расположение наших частей прибыли на своих легко- вых машинах и сдались в плен два ру- мынских полковника. Захвачены также большие трофеи.	vol-5768-page-01-seg-079-3628-5397-4282-5648.png
5768	1	3620	5649	4278	6042	63	0.95281	Нанося стремительные удары отсту- поющему врагу, войска 4-го Украинского фронта с каждым часом всё дальше про- двигаются в глубь Крымского полуостро- ва. Они теснят кемпев и румын к бере- гам Черного моря. А над Черным морем наши морские летчики ежедневно высле- живают караваны вражеских судов и то- пят их. На-днях летчики мережкой авиа- ции атаковали караван неприятельских судов и нанесли ему большой урон.	vol-5768-page-01-seg-080-3620-5649-4278-6042.png
5768	1	3897	6052	4224	6088	3	0.90916	Майор В. ИГНАТЬЕВ	vol-5768-page-01-seg-081-3897-6052-4224-6088.png
5768	2	2031	338	2600	375	7	0.86712	A C H A 3 3 /	vol-5768-page-02-seg-001-2031-0338-2600-0375.png
5768	2	3514	332	4241	375	8	0.89682	13 апреля 1944 г., четверг. № 88 (5768)	vol-5768-page-02-seg-002-3514-0332-4241-0375.png
5768	2	377	444	1406	700	17	0.97225	Москва, кремль ПРЕДСЕДАТЕЛЮ ГОСУДАРСТВЕННОГО КОМИТЕТА ОБОРОНЫ МАРШАЛУ СОВЕТСКОГО СОЮЗА ТОВАРИЩУ С Т А Л И Н У	vol-5768-page-02-seg-003-0377-0444-1406-0700.png
5768	2	271	723	927	1290	82	0.95618	Дорогой Иосиф Виссарионович! Немецко-фашистские разбойники, веро- ломно напавшие на нашу Родину, разру- шили наш древний город Чернигов, столе- тиями красовавшийся на берегах полно- водной реки Десны. Гитлеровцы разорили и сложили многие другие города области, сотни колхозов и сёл, убили, замучили и угнали в немецкое рабство сотни тысяч советских людей. Движимые чувством агучей ненависти к подлому врагу, ты- сячи черниговцев упали в партизанские отряды, чтобы мстить проклятым захват- чикам и вместе с Красной Армией гро- мить их и изгонять с нашей советской Родины.	vol-5768-page-02-seg-004-0271-0723-0927-1290.png
5768	2	269	1296	930	1881	75	0.95907	Стремительные темпы наступления Красной Армии и борьба черниговских партизан в немецком тылу пе дали воз- можности фашистам завершить свои зло- детские планы поголовного разграбления народного добра и увезти весь урожай 1943 года. Стремясь всемерно помочь родной Красной Армии, колхозы и кол- хозники нашей области сдали в фонд Красной Армии и продали государству 11,5 миллиона пудов зерна, 17 мил- лионов пудов картофеля, 500 тысяч пудов мяса, 900 тысяч литров молока, 500 ты- Секретарь Чернигов Председате деп	vol-5768-page-02-seg-005-0269-1296-0930-1881.png
5768	2	935	729	1600	1881	153	0.95610	сто пудов овощей и много других про- дуктов. Трудящиеся приобрели облигации второго военного займа на 29. миллионов рублей и билеты денежно-вещевой лотереи на 10,5 миллиона рублей. B порядке братской взаимопомощи колхозы и кол- хозники нашей области собрали для дру- гих наиболее пострадавших от немецких оккупантов областей 184 тысячи пудов семян для весеннего сева. Воодушевленные победами доблестной Красной Армии, трудящиеся нашей обла- сти с огромным патриотическим подъемом собрали из своих трудовых сбережений и внесли в Госбанк на строительство тан- ковой колонны "Колхозник Черниговки- на" 52 миллиона рублей. Сбор средств продолжается. Пусть танцы, построенные на средства трудящихся Черниговщины, ускорят раз- гром и изгнание немецких фашистов из священных пределов нашей любимой Ро- дины. Рабочие, колхозники и интеллигенция Чел Черниговщины желают Вам, Носиф Вис- сарпонович, здоровья и сил на многие годы на радость трудящимся и на страх всем врагам нашей Родины. Смерть немецким захватчикам! ского обкома КП(б)У М. КУЗНЕЦОВ. ль исполкома Черниговского облсовета утатов трудящихся С. КОСТЮЧЕНКО.	vol-5768-page-02-seg-006-0935-0729-1600-1881.png
5768	2	275	1902	1573	2079	15	0.96182	ЧЕРНИГОВ СЕКРЕТАРЮ ЧЕРНИГОВСКОГО ОБКОМА КП(6)Ф тов. КУЗНЕЦОВУ ПРЕДСЕДАТЕЛЬ ИСПОЛКОМА ЧЕРНИГОВСкого облсовета ДЕПУТАТОВ ТРУДЯЩИХСЯ тов. КОСТЮЧЕНКО	vol-5768-page-02-seg-007-0275-1902-1573-2079.png
5768	2	267	2093	1575	2214	22	0.94346	Передайте трудящимся Черниговской области, собравшим 52.000.000 рублей на строительство танковой колонны «Колхозник Чернигов- шины", -- мой братский привет и благодарность Красной Армии.	vol-5768-page-02-seg-008-0267-2093-1575-2214.png
5768	2	1192	2225	1475	2268	2	0.93283	и. сталин	vol-5768-page-02-seg-009-1192-2225-1475-2268.png
5768	2	402	2339	1425	2545	15	0.96614	МОСКВА, КРЕМЛЬ ВЕРХОВНОМУ ГЛАВНОКОМАНДУЮЩЕМУ МАРШАЛУ СОВЕТСКОГО СОЮЗА ТОВАРИЩУ С Т А Л И Н У	vol-5768-page-02-seg-010-0402-2339-1425-2545.png
5768	2	255	2572	917	3085	71	0.94835	Выполняя Ваши указания о накси- мальной помощи фронту и повседневном укреплении обороноспособности нашей лю- бимой социалистической Родины, трудя- щиеся Дагестанской АССР своим самоот- вложенным трудом день ото дня усилива- ют помощь героической Красной Армии. Для нужд фронта и страны колхозники Дагестана сдали в счет поставок 1944 года 90.800 пудов хлеба, 230.000 пулов мяса, 5.480 пудов пiерсти, 1.311.000 литров молока, 131.600 штук кожсырья. Рабочие, колхозники и интеллигенция рес- публики, неодушевленные славными побе-	vol-5768-page-02-seg-011-0255-2572-0917-3085.png
5768	2	929	2570	1590	3077	67	0.94753	доме Красной Армии, освобождающей род- ную землю от немецко-фашистской нечи- сти, с большим патриотическим подъемом развернули сбор средств сталинский фонд псбелы. За короткий срок внесено в Госбанк 25.700.000 рублей. Горцы Даге- стана, продолжая сбор средств па строи- тельство грозных боевых машин для Крас- ной Армии, заверяют Вас, дорогой Иосиф Виссарионович, что они и впредь неустан- но будут оказывать всё возрастающую помощь фронту до окончательной победы над врагом.	vol-5768-page-02-seg-012-0929-2570-1590-3077.png
5768	2	336	3093	1538	3212	17	0.94360	Секретарь Дагестанского обкома ВКП(б) АЛИЕВ Председатель Совнаркома Дагестанской АССР ДАНИЯЛОВ Председатель Президиума Верховного Совета Дагестанской АССР ТАХТАРОВ	vol-5768-page-02-seg-013-0336-3093-1538-3212.png
5768	2	307	3256	1529	3476	17	0.97524	МАХАЧ-КАЛА СЕКРЕТАРЬ ДАГЕСТАНСКОГО ОБКОМА ВКП(б) тов. АЛИЕВУ ПРЕДСЕДАТЕЛЮ СОВНАРКОМА тов. ДАНИЯЛОВУ ПРЕДСЕДАТЕЛЮ ПРЕЗИДИУМА ВЕРХОВНОГО СОВЕТА тов. ТАХТАРОВУ	vol-5768-page-02-seg-014-0307-3256-1529-3476.png
5768	2	263	3495	1571	3668	28	0.92958	Передайте трудящимся Дагестанской Автономной Советской Социа- листической Республики, собравшим 25,700.000 рублей на строительство боевых машин для Красной Армии, - мой братский привет и благодар- ность Красной Армии, сталин	vol-5768-page-02-seg-015-0263-3495-1571-3668.png
5768	2	565	3735	1285	3774	4	0.97250	БОИ В ТРАНШЕЯХ ПРОТИВНИКА	vol-5768-page-02-seg-016-0565-3735-1285-3774.png
5768	2	257	3793	911	4055	46	0.95871	2-й УКРАИНСКИЙ ФРОНТ, 12 апреля. (От наш. корр. ). В одном из боев подраз- деление под командованием кавалера пяти орденов офицера-гвардейца Сыпенко штур мом ворвалось в траншеи противника и в рукопашной схватке уничтожило пятьдесят немецких солдат и офицеров. При этом наши бойцы захватили у противника трн	vol-5768-page-02-seg-017-0257-3793-0911-4055.png
5768	2	931	3797	1587	4051	44	0.97096	миномета, четыре станковых пулемета три автомашины с боеприпасами. Вскоре немцы предприняли контратаку, в которой участвовало шесть танков и до ста человек пехоты. Дружным и точным огнем контратака врага была отбита. Офи- цер Сыпенко в этом бою лично из проти- вотанкового ружья подбил немецкий танк.	vol-5768-page-02-seg-018-0931-3797-1587-4051.png
5768	2	1698	446	2866	707	20	0.97771	УКАЗ ПРЕЗИДИУМА ВЕРХОВНОГО СОВЕТА СССР о награждении орденами и медалями ГЕНЕРАЛОВ, ОФИЦЕРСКОГО, СЕРЖАНТСКОГО рядового состава частей трофейной СЛУЖБЫ КРАСНОЙ АРМИИ	vol-5768-page-02-seg-019-1698-0446-2866-0707.png
5768	2	1677	721	2875	759	13	0.90821	(Продолжение. Начало в № 61, 75, 79, 81, 82 и 84 «Красной звезды»	vol-5768-page-02-seg-020-1677-0721-2875-0759.png
5768	2	1856	773	2046	809	1	0.84771	МЕДАЛЬЮ	vol-5768-page-02-seg-021-1856-0773-2046-0809.png
5768	2	1742	821	2152	854	3	0.93264	«ЗА БОЕВЫЕ ЗАСЛУГИ»	vol-5768-page-02-seg-022-1742-0821-2152-0854.png
5768	2	1610	869	2269	2629	187	0.96171	113. Рядового Кутафина Ивана Петровича 114. Младшего техника лейтенанта Лап- тева Евгения Семеновича. 115. Инженер-капитана Левицкого Григо- рия Александровича. 116. Старшего лейтенанта интендантской службы Левковича Льва Соломона- вича. 117. Старшего лейтенанта Леонова Алексея Ивановича. 118. Старшего лейтенанта Лозовика Ми- хаила Ивановича. 119. Ефрейтора Локтева Павла Константи- новича. 120. Старшего лейтенанта Лужбина Якова Никифоровича. 121. Техника лейтенанта Любарского Бори- са Наумовича. 122. Старшего техника лейтенанта Майда- нова Владимира Георгиевича. 123. Младшего техника лейтенанта Мали- кова Вахита Маликовича. 124. Рядового Мальханова Александра Андреевича. 125. Старшего лейтенанта Марченко Ивана Сергеевича. 126. Рядового Медведева Алексея Савва- теевича. 127. Старшего лейтенанта административ- ной службы Михайловского Георгия Алексеезича. 128. Старшего лейтенанта Монадиришвили Элизбара Иосифовича. 129. Лейтенанта интендантской службы Моргунова Григория Никаноровича. 130. Старшего техника лейтенанта Моро- зова Василия Федоровича. 131. Рядового Мосина Матвея Петровича. 132. Старшего техника лейтенанта Мутов- кино Анатолия Петровича. 133. Рядовую Невлер Фриду Ароновну. 134. Рядового Насонова Ивана Афанасье- вича. 135. Майора Нечай Максима Андреевича. 136. Младшего сержанта Никитина Павла Николаевича. 137. Сержанта Николаева Николая Геор- огневич. 138. Младшего лейтенанта Новожилова Петра Ивановича. 139. Сержанта Обухова Константина Ильича. 140. Рядового Ожиганова Ивана Михайло- вича. 141. Рядовую Олейник Анастасию Василь- евну.	vol-5768-page-02-seg-023-1610-0869-2269-2629.png
5768	2	2285	781	2943	1989	133	0.95656	142. Рядового Павлова Ивана Павловича. i43. Рядового Панова Сергея Михайловича 144. Рядового Пантелеева Алексея Ники- товича. 145. Рядового Перехода Сергея Игнатье- вича. 146. Младшего лейтенанта Петрова Васи- лия Антоновича. 147. Капитана административной службы Петрова Василия Арсеньевича. 148. Сержанта Петрова Сергея Федоровича. 149. Ефрейтора Петрова Николая Кузь- мича. 150. Сержанта Питерина Ивана Василье- вича. 151. Старшего сержанта Пичугина Василия Федоровича. 152. Лейтенанта интендантской Повх Александра Лукича. службы 153. Рядового Полковникова Филиппа Дми- триевича. 154. Старшего техника лейтенанта Про- нина Александра Константиновича. 155. Капитана административной службы Пуцикина Петра Ивановича. 156. Рядового Пьянзина Дмитрия Дмитрие вича. 157. Капитана административной службы Ракицкого Владимира Федоровича. 158. Старшего лейтенанта Решетникова Георгия Моисеевича. 159. Капитана административной службы Рожкова Сергея Арсеньевича. 160. Техника интенданта 2 ранга Рома- ненко Виктора Григорьевича. 161. Рядового Ромашко Антона Ивановича. 162. Капитана Рязанцева Федора Петро- вича.	vol-5768-page-02-seg-024-2285-0781-2943-1989.png
5768	2	2283	1994	2933	2570	61	0.95678	163. Лейтенанта административной службы Ряскова Кузьму Федоровича. 164. Старшего лейтенанта административ- ной службы Савельева Антона Михай- ловича. 165. Сержанта Савенкова Андрея Фроло- рича. 166. Младшего лейтенанта Савельева Дмитрия Кирилловича. 167. Рядового Савина Михаила Алексан- дровича. 168. 3. Старшего лейтенанта Савченко Влади- мира Александровича. 169. Младшего воентехника Савчука Ивана Трофимовича. 170. Младшего лейтенанта Сафитова Гри- горня Тимофеевича. 171. Рядового Сидякина Сергея Ивановича	vol-5768-page-02-seg-025-2283-1994-2933-2570.png
5768	2	2418	2600	2789	2633	2	0.94977	(Продолжение следует).	vol-5768-page-02-seg-026-2418-2600-2789-2633.png
5768	2	1723	2718	2827	2791	4	0.90958	Митинг в освобожденной Виннице	vol-5768-page-02-seg-027-1723-2718-2827-2791.png
5768	2	1602	2804	2266	4053	170	0.95525	ВИННИЦА, 12 апреля. (ТАОС). Свыше 10.000 жителей Винницы приняли на ощегородской митинг, посвященный осво- бождению городов и сёл области от не- мецко-фашистских захватчиков. Председа- тель областного Совета депутатов трудя- щихся тов. Годов, открывая митинг, пе- редал ст имени трудящихся области го- рячий привет и благодарность героям- воинам Красной Армии, -освободившии Винницкую область от немецких порабо- тителей. приветствовал народных мстителей - партизан и партизанок, на- носивших тяжелые удары немецким ок- купантам. Секретарь обкома КП(б)У тов. Мищен- ко от имени трудящихся области обра- щает слова благодарности к дому, под чьим руководством освобождаются всё но- выз и новые города и сёла нашей Ро- дины Верховному Главнокомандую- щему великому Сталину. На трибуну поднялся комиссар парти- занского отряда секретарь Винницкого об- кома партии тов. Бурченко. Он рассказал славных советских партизанах и пар- тизанках, действовавших на территории Винницкой области. Они уничтожили свыше 10.000 немецких солдат и офице- ров, отбили у гитлеровцев более 6 мил- лионов пудов хлеба, 90.000 пудов саха- ру и клого других продуктов, приготов- ленных к отправке в Германию, и роз- дали их населению.	vol-5768-page-02-seg-028-1602-2804-2266-4053.png
5768	2	2275	2812	2935	3431	85	0.95602	Слово предоставляется профессору Ко- ноненко, выступающему от лина интелли- гении города. Страшные ден, - говорит он, пережили мы во время немецкого пга. Тысячи близких нам людей не встанут уже из могил. Гитлеровские бандиты ра- зорили наш город. Они сожгли педагоги- ческий институт, оперный театр, област- ную библиотеку, краеведческий музей и другие культурные очаги. В доме, где родился и творил славный сын украин- ского народа М. М. Коцюбинский, немцы устроили солдатскую казарму, a позже мастерскую по ремонту автомашин. Сво- 001V и счастье принесли нам красные воины.	vol-5768-page-02-seg-029-2275-2812-2935-3431.png
5768	2	2279	3435	2933	4053	73	0.95791	Слава народньем богатырям! Ольга Слободянюк, рассказавшая борьбе украинских партизанок, призвала всех трудящихся Винницы, не жалея сил, работать над восстановлением родного го- рода, повседневно помогать Красной Ар- в окончательном разгроме полчищ немецко-фашистских убийц. С большим подъемом под долго не смол- каршиев аплодисменты участники митинга приняли приветственные письма вождю народов Советского Союза великому Сталину, председателю Совнаркома Укра- инской ССР тов. Хрущеву и героическим воинам Красной Армии, освободившим Винницу и всю область от немецкого па- шествия.	vol-5768-page-02-seg-030-2279-3435-2933-4053.png
5768	2	3016	463	4234	557	2	0.98333	Противозенитный маневр	vol-5768-page-02-seg-031-3016-0463-4234-0557.png
5768	2	2964	584	3614	869	36	0.95084	Одной из особенностей нынешней всз- душной обстановки является насыщение поля боя и ближнего немецкого тыла зенитной артиллерией и зенитными пуле- метами. Это обстоятельство заставляет летчиков и командиров групп, переле- тающих линию фронта, применять проти- возенитный маневр.	vol-5768-page-02-seg-032-2964-0584-3614-0869.png
