volume_number	page_number	x1	y1	x2	y2	tokens_count	mean_confidence	text	image
5155	2	416	1387	1084	2364	148	0.96167	темную безлунную ночь подразделе- ния N части, скрытно сосредоточившись н1 исходных рубежах. нанесли внезапный удар по вражеской обороне и проникли в глубину. В образовавшуюся брешь хлы- нули конники и через два дня они нахо- днись уже далеко в тылу немцев. Тщательно продуманный выбор настав- удара сыграл решающую роль в дальнейших действиях. Все здесь благо- приятствовало конникам: и густая сеть населенных пунктов, расположенных на перекрестках лесных дорог, и густые мас- леса, подходившего вплотную к ма- гистрали, и обилие полян, к которым ве- неизвестные врагу извилистые тропы. horna одно подразделение неожиданной атакой из леса занято деревню, прилега- 2011 к магистрали, немцы всполошились. было уже поздно. Развивая успех на гог. подразделение через несколько часов вы ало противника из другого села. что ту сторону дороги. и прочно оседлала магистраль. На следующий день другое ка- валерийское подразделение овладело перев- ней, расположенной в непосредственной близости от трассы, на высоте. господ- ствующей над окружающей местностью.	vol-5155-page-02-seg-008-0416-1387-1084-2364.png
5155	2	418	2374	1074	2788	57	0.96223	течение шести дней кавалеристы про но удемьивали магистраль. Они пара- мизозали всякое движение и успешно от- ражали атаки противника, который неод- кократно пытался отбросить наши части на север. Немцы вынуждены были ввести бой крупные наземные силы. артилле- минометы. танки. С воздуха их ата- поддерживались авиацией. Но все по- пытки брага вернуть утерянные позиции сбивались большими потерями для	vol-5155-page-02-seg-009-0418-2374-1074-2788.png
5155	2	412	2804	1074	3427	91	0.96092	Десятки опытных разведчиков следили каждым шагом ненцев. Поэтому всегда было известно, откуда и в каком колп- честве появится противник. Это намотало наиболее целесообразно построить план предстоящего боя. Особенно большие по- тори несли немцы всякий раз, когда пы- тались выбить спешившихся конников из леса. примыкающего к дороге. Сильный минометный и артиллерийский обстрел, не- однократные бомбардировки с воздуха не тавали эффекта. Прочные блиндажи на- дежно укрывали наших бойцов. Как толь- ко фашистская пехота пробовала двинуть- в атаку, не встречал шквальный пуле- метный огонь, а танки, попущенные на близкое расстояние. расстреливались упор из пушек.	vol-5155-page-02-seg-010-0412-2804-1074-3427.png
5155	2	1101	1115	1771	2854	281	0.96229	в задачу канбеков, лействую щих во вражеском тылу. не входит ввя- зываться в длительные и кровопролитные бои. Когда противник стянул сюда во мно- го раз превосходящие силы, кавалерийские подразделения скрытно снялись с занима- емых позиций, совершили ночной марш и через несколько вышли на ту же трассу. по в другом месте. Все началось сначала. Вот один из последних боев на той же магистрала. Эскатрон втянулся в рошу. что в 200 метрах от трассы, и внезал- ными налетами тула непрерывно тре- вожил врага. Саперы. возглав.тяемые командиром Андриановым. по пояс тающем снегу с огромным трудом проби- рались к дороге и упчировали ее нескольких местах. Три дня стягивал силы противник к этому участку дороги. Обойдя прошу с двух сторон. немцы сжимали кольпо. Эскалрон принял бой. Несколько тысяч снарядов и мин израсходовал противник вхолостую. Когда разведка донесла, что немцы перебрасывают юла резервный полк, эс- калроп вешил нанести ответный удар. Ос- тавив пебольшие заслоны, аск атрон про- сочился через лес на север, обошел левую группу противника и ударил по ней с ты- ла Немцы решили, что это прибыла наша свежая часть, и в панике бежали, оста- вив 70 трупов. Вслед за тем отряд авто- матчиков расправился с правой группой противника. А На другой лень аскапрон уже действовал в соседнем районе. За сравнительно небольшой срок N ка- валерийская часть нанесла врагу огром- ный урон. Тысячи убитых и раненых. сот- автомашин с пенными грузами, десят- ки орудий и минометов. сотни автоматов и винтовое потеряли фашисты в своем ты- лу. Нашим бойцам лосталось много тонн продовольствия и фуража. Характерен та- кой случай. Красноармеец Киселев прогие на мельницу. расположенную в зоне про- пикника убил двух немцев, охранявших заготовленную для помола рожь, и на двух номепких полволах вывез с мельнины все зерно.	vol-5155-page-02-seg-011-1101-1115-1771-2854.png
5155	2	1101	2858	1759	3236	63	0.96762	Ряз свежих повереплений нентриятеля по дошел до линии фронта. Они вынужде- ны были вступить в бой с конниками на магистрали и были изрядно побиты. Мно- го дней полях фашистам приходилось пользоваться засыпатными снегом прозе- лесными дорогами и доставлять боеприпа- сы далеким кружным путем. Все это, на- зумеется, сказалось на ходе боев немеп- ких передовых частей и оказало нашим на ступающим войскам серьезную помощь.	vol-5155-page-02-seg-012-1101-2858-1759-3236.png
5155	2	1099	3246	1757	3411	19	0.95821	Чем большо размывает наступившая вес- на снежные сугробы. тем энергичней и стремительней будут разрушать советские конники вражеский тыл. дедов.	vol-5155-page-02-seg-013-1099-3246-1757-3411.png
5155	2	712	3479	1455	3605	5	0.97105	Последнее пике четырех немецких самолетов	vol-5155-page-02-seg-014-0712-3479-1455-3605.png
5155	2	410	3639	1062	3889	34	0.95668	ДЕЙСТВУЮЩАЯ АРМИЯ, 17 апреля. (По телеграфу). Вчера у зенитчиков бата- рей, которой командует капитан Шлычков. был радостный день. Меткие артиллери- сты за несколько минут боя с фашист- ской авиацией сбили четыре вражеских са- полета.	vol-5155-page-02-seg-015-0410-3639-1062-3889.png
5155	2	410	3893	1062	4067	24	0.95297	Ранним утром группа немецких само- Кетов пыталась пикировать на первую забросать ее бомбами. Зенитчики пол ру- нозолством капитана Шлычкова умело от- пазили нападение фашистов.	vol-5155-page-02-seg-016-0410-3893-1062-4067.png
5155	2	1088	3637	1751	4055	56	0.93937	На На первом заходе девять самолетов на- чали ожесточенный пулеметный обстрел стремясь половить зенитные орудия. Ба- тарея открыла ответный огонь, и три фа- шистских летчика сразу повернули обрат- но. Остальные шесть машин пошли на второй заход, готовясь пикировать на ле- ревню. Однако после нескольких очередей наших орудий четыре немецких самолета. об ятые пламенем, врезались в землю.	vol-5155-page-02-seg-017-1088-3637-1751-4055.png
5155	2	1841	1657	3072	1719	12	0.95740	ЗАПАДНЫЙ ФРОНТ. Трофейные танки, восстановленные советскими тан кистами, направляются к линии фронта.	vol-5155-page-02-seg-018-1841-1657-3072-1719.png
5155	2	2406	1731	3078	1759	4	0.95328	Снимок нашего спец. ил	vol-5155-page-02-seg-019-2406-1731-3078-1759.png
5155	2	2029	1829	2874	1917	3	0.91583	Артиллерия в боевых	vol-5155-page-02-seg-020-2029-1829-2874-1917.png
5155	2	2133	1937	2790	1991	2	0.80523	порядках пехоты	vol-5155-page-02-seg-021-2133-1937-2790-1991.png
5155	2	1789	2023	2450	2824	111	0.95265	стрелковому соединению было при- казано овладеть опорным пунктом немцев, укрепившихся одном селе. Система вражеской обороны здесь была обычной, неплохо развитой. Ее огневые средства усилены несколькими танками, которые использовались как неподвижные огневые точки. Перед противотанковыми и проти- вопехотными препятствиями имелись расчи- щенные для лучшего обстрела полосы глу- биною до 500 метров. На артиллерийскую часть, которой командует тов. Струев, возлагалась зада- ча обеспечить действия наступающей пехоты. При разработке плана тов. Струев старался предусмотреть все детали пред- стоящего боя, наметить различные ва- рпанты действий артиллерии в зависимо- сти от могущих возникнуть изменений обстановки, Особое внимание он обратил на то, чтобы весь личный состав части знал свои задачи и ясно представлял, как их надо выполнять.	vol-5155-page-02-seg-022-1789-2023-2450-2824.png
5155	2	1779	2834	2446	4051	176	0.95888	Вся подготовительная работа проводи- лась на местности, причем основной упор был сделан на организацию тесного взаимодействия c пехотой. Командиры артиллерийских подразделений заранее договорились с пехотными командирами о местах наблюдательных пунктов, по- рядке движения, целеуказания, вызова огня. Распределяя артиллерийские сред- ства, тов. Струев выделил одну четверть своих подразделений для стрельбы с от- крытых позиций. Дальнейшео подтвер- дило ценность этого мероприятия. Пехота сопровождалась огнем на всю глубину тактической обороны противника. Расскажем, как протекал бой. После предварительной артиллерийской обработ- ки вражеской обороны пехота перешла в атаку. Подход к переднему краю был рас- чищен. Однако противник быстро под- бросил дополнительные огневые средства по траншеям из глубины, и они встрети- ли углем нашу пехоту. Тогда ветупило в бой молчавшее до тех пор артиллерийское подразделение под командой лейтенанта Шалункина. Сопровождая стрелков коле- сами, артиллеристы начали уничтожать прямой наводкой одну за другой враже- ские огневые точки. За три часа был бы- ли уничтожены 6 пулеметов и 4 мино- мета, сожжены три сарая, где находи- тись автоматчики, подорван склад с бое- припасами, выведено из строя 10 200 вражеских солдат и офицеров. Наблюдатели противника обнаружили	vol-5155-page-02-seg-023-1779-2834-2446-4051.png
5155	2	2464	2025	3134	4039	287	0.95809	орудия лейтенанта Шалункина. Чтобы уничтожить их, немцы выделили две ар- тиллерийские и несколько минометных батарей. Кроме того с воздуха бомбил с огневые позиции звено вражеских самоле- тов. Все же подразделение, выполняя поставленную задачу, не прекращало огня ни на одну минуту. Когда пехота прорвала передний край немецкой обороны, на улице селения по- явились два вражеских орудия, открыв- шие огонь прямой наводкой. Наши артил- леристы быстро расправились и с этими орудиями, обеспечив продвижение пехоты вперед. рассвету под беспрерывный пушечный грохот пехота полностью овла- лела опорным пунктом. Враг бежал, и наши части перешли к преследованию. При перемене позиций артиллеристы начали было двигаться по одной дороге с пехотой и обозами. Автомашины и повоз- ки тормозили их марш-бросок. Командир части быстро исправил эту ошибку и по- вел своих артиллеристов отдельной ко- лонной. В результате, когда наша пехота подошла другому опорному пункту нем- цев, артиллерия своевременно открыла меткий огонь. Сразу же было занято не- сколько кварталов селения. Подразделение, которым командует майор Кучеренко, вело огонь прямой на- водкой по сильно укрепившемусл неприя- телю. Немцы заметили наши орудия и взяли их под жестокий обстрел миноме- тов и артиллерии. Артиллерийская дуэль длилась долго. Вражеские снаряды проби- щиты орудий, по отважные бойцы не отступили ни на шаг победила, уничтожив 7 немецких пулеметов, 2 ору- дия, 6 минометов. Наконец, остатки разбитых немцев от- катились. Наша пехота продолжала про- двигаться вперед. Действия артиллеристов-гвардейцев были успешны прежде всего благодаря хорошей организации боя. Командиры и их штабы управляли подразделениями, не связывая инициативы подчиненных. Они не ожида- ли заявок пехоты, а сами находили пели и уничтожали их. Тщательное, непрерыв- ное наблюдение, бесперебойная связь во всех звеньях все это давало возмож- пость быстро обрушивать огонь на от- дельные цели, а также сосредоточивать его на глазных очагах сопротивления противника. Майор К. ЕФИМОВ калининский фронт	vol-5155-page-02-seg-024-2464-2025-3134-4039.png
5155	2	3240	802	4430	994	6	0.97459	всю мощь огня против НЕМЕЦКИХ ТАНКОВ	vol-5155-page-02-seg-025-3240-0802-4430-0994.png
5155	2	3160	1026	3825	1695	96	0.96158	B последние дни на нашем участке фронта немцы бросают в бой тапки, пы- таясь с их помощью проложить путь своей контратакующей пехоте. В течение неде ли танки противника не раз появлялись перед нашими позициями группами от пяти до двадцати машин, сопровождаемые пехотными подразделениями и десантами. поделю боевых действий наше соединение вместе поддерживающими танкани отразило атаки 75 немецких бро- нированных машин. Ни одна из них не достигла позиций наших стрелковых пол- разделений. Уничтожено за это время 16 немецких танков: из них на долго тан- кистов приходится четыре, артиллеристь подбили девять, минометчики один расчеты противотанковых ружей --- танка.	vol-5155-page-02-seg-026-3160-1026-3825-1695.png
5155	2	3152	1699	3817	3515	267	0.96306	Этого нам удалось достигнуть в резуль- тате длительной тренировки и большой воспитательной работы среди личного со става, направленной на преодоление из вестной "танкобоязни". на укрепление веры в свое оружие. Вспоминаются первые дни, когда к нам привезли противотанковые ружья. Много к ним относились скептически, препебре- жительно: калибр. дескать, наловат, где такому патрону пробить броню танка. приказал снять разбитого немецкого танка бронированные плиты и привезти их в подразделения. Стреляя из противо танковых ружей на тренировке, наши бой мы видели на практике, что эти совет- ские ружья способны пробить броню вра- жеских танков. Наши пехотинцы наглял по убедились, что противотанковое ружье надежное средство борьбы с брониро- ванным врагом. Пи одно наше подразделение не друг- пула перед натиском вражеских танков, и им не пришлось вклиниться в боевые порядки пехоты. Этот факт весьма пока зателеп. Он говорит о том, что нам удалось лось воспитать у людей уверенность в своих силах, в мощи советского оружия. Во время боя важно правильно исполь- зовать все противотанковые огневые вред ства и умело маневрировать ими. В по- следних боях, наряду с достижениями, у нас выявились также и недостатки в ис пользовании этих средств. Некоторые командиры, руководствуясь благими намерениями, стремятся обес печать противотанковыми средствами все направления и участки занимаемых ими позиций. Главная причина здесь та- кая: командир и его штаб плохо органи- зовали разведку и не знают, какие на- правления являются наиболее танкоопас- пыми. В результате они распыляют имею- щиеся силы и средства. Особенно это за- метно в отношении приданных противо танковых ружей. Некоторые командиры пытаются распределить их чуть ли не ме- всеми стрелковыми взводами. Конец- по, это неправильно: противотанковы ружья нужно использовать компактно. прикрывая ими танкоопасные паправле:	vol-5155-page-02-seg-027-3152-1699-3817-3515.png
5155	2	3148	3521	3809	3729	33	0.95483	В отдельных подразделениях противо- танковые ружья постоянно находятся на линии огня, независимо от того, есть ли в данный момент угроза танкового напа дения или нет. Порою командиры даже ставят огневые задачи расчетам противо-	vol-5155-page-02-seg-028-3148-3521-3809-3729.png
5155	2	3845	1026	4508	1619	88	0.96129	танковых ружей, заставляя их поражать или уничтожать такие цели, с которыми вполне может справиться обычный стре или пулеметчик. Подобные необдуман ные действия только раскрывают врагу расположение наших противотанковых средств. За редким исключением противо танковые ружья должны быть использо ваны только по прямому назначению. От- крывать из них огонь нужно лишь по бронированным и иным целям, которые не в силах поразить другие виды оружия Пока нет прямой угрозы нападения тан- ков, противотанковые ружья следует дер жать в укрытии у огневых позиций, обе регая их от бомбежки и артиллерийского обстрела.	vol-5155-page-02-seg-029-3845-1026-4508-1619.png
