volume_number	page_number	x1	y1	x2	y2	tokens_count	mean_confidence	text	image
5732	1	981	207	2168	269	4	0.88202	См Смерть немецким оккупантам.	vol-5732-page-01-seg-001-0981-0207-2168-0269.png
5732	1	294	294	2218	638	8	0.93827	ЦЕНТРАЛЬНЫЙ ОРГАН НАРОДНОГО КОМИССАРИАТА ОБОРОНЫ СОЮЗА ССР :	vol-5732-page-01-seg-002-0294-0294-2218-0638.png
5732	1	352	679	604	731	2	0.83904	52 (5732)	vol-5732-page-01-seg-003-0352-0679-0604-0731.png
5732	1	1013	679	1548	721	5	0.93458	2 марта 1944 г., четверг	vol-5732-page-01-seg-004-1013-0679-1548-0721.png
5732	1	1964	679	2204	725	2	0.89625	ЦЕНА 20 коп.	vol-5732-page-01-seg-005-1964-0679-2204-0725.png
5732	1	2308	196	4324	707	51	0.94652	Вчера в Кремле открылась V сессия Верховного Совета РСФСР. Верховный Совет заслушал доклад Народного комиссара финансов РСФСР тов. А. А. Посконова содоклад Председателя Бюджетной комиссии Верховного Совета РСФСР депутата И. А. Власова о Государственном бюджете РСФСР на 1944 год и исполне- нии Государственного бюджета РСФСР за 1940, 1941 и 1942 годы.	vol-5732-page-01-seg-006-2308-0196-4324-0707.png
5732	1	369	2243	4220	2385	104	0.93380	V СЕССИЯ ВЕРХОВНОГО СОВЕТА РСФСР 1-го СОЗЫВА. Заседание 1 марта 1944 г. На снимке: Народный комиссар финансов РСФСР тов. А. А. Посконов выступает с докладом о Государственном бюджете РСФСР на 1944 г. За столом Председателя (слева направо): заместитель Председателя Верховного Совета РСФСР депутат М. В. Сарычева, Председатель Верховного Совета РСФСР депутат А. А. Жданов, заместитель Председателя Верховного Совета РСФСР депутат A. X. Тынчеров. В ложах: товарищи B. М. Молотов, М. И. Калинин, К. Е. Ворошилов, Л. М. Каганович, А. А. Андреев, А. И. Микоян, Г. М. Маленков, Н, М. Шверник, Н. А. Вознесенский, члены Президиума Верховного Совета РСФСР, народные комиссары РСФСР. Фото М. Калашникова.	vol-5732-page-01-seg-007-0369-2243-4220-2385.png
5732	1	390	2441	1533	2591	8	0.97173	БИТЬ ВРАГА ПО ВСЕМ ПРАВИЛАМ СОВРЕМЕННОЙ ВОЕННОЙ НАУКИ!	vol-5732-page-01-seg-008-0390-2441-1533-2591.png
5732	1	292	2633	948	3493	134	0.95999	Никогда еще роль военной науки в хо- де сражений не была столь значительна, как теперь. Чтобы искусно использовать все разнообразные технические средства борьбы, которыми пыне в изобилии на- сыщены войска, чтобы с честью решать все сложные и трудные задачи современ- ной обороны и наступления, надо быть во всеоружии опыта и знаний, обладать высокой военной культурой. В наши дни больше, чем когда-либо, храбрость и му- жество должны неизменно сочетаться с умением воевать по-современному, в стро- гом соответствии с требованиями совре- менной военной науки. Только такой сплав дает силу, ведет к победам. Вот по- чему необходимо, как указывает товарищ Стали, "чтобы боевой опыт и достиже- ния передовых частей и соединений Крас- ной Армии стали достоянием ВСЕХ наших войск, чтобы ВСЯ Красная Армия, ВСЕ бойцы и офицеры научились бить вра- га по всем правилам современной военной науки».	vol-5732-page-01-seg-009-0292-2633-0948-3493.png
5732	1	284	3495	942	4107	86	0.95804	Военное мастерство Красной Армии зиждется и развивается на мощном фун- даменте сталинской воепной науки. Это наука передовая и дерзающая, ведущая от победы к победе. Это современная наука побеждать. осуществление принципов ко- торой уже создало множество непревзой- данных образцов военного искусства. Именно потому, что Красная Армия воюет по-сталински и ее кадры настойчиво, ус- пешно овладевают современной военной наукой, создаваемой товарищем Сталиным, именно поэтому наша армия так бле- стяще выдержала суровые испытания вой- пы, прошла столь славный боевой путь, прочно утвердив за собой гордое имя побе- доносной армии.	vol-5732-page-01-seg-010-0284-3495-0942-4107.png
5732	1	284	4118	936	4795	101	0.96070	Чему же учит сталинская военная на- ука, чего требует она от командиров? Она требует, прежде всего, трезво учи- тывать слабые и сильные стороны про- тивника. Знать врага, его силы, систему его обороны, его тактику - это, как учит опыт войны, необходимая предпосылка победы. Командир, умеющий воевать по- современному, неослабно и тщательно изу- чает противника, улучшает разведку - глаза и уши армии, помня, что без этого нельзя- действовать наверняка. Командир, умеющий воевать по-современному, всегда некусно и во-время разгалывает ковар- ные уловки противника, противопостав ляет его тактике свою более совершенную тактику, поражает неприятеля внезапно- стью и бьет его наверняка, по самым уязвимым местом,	vol-5732-page-01-seg-011-0284-4118-0936-4795.png
5732	1	269	4803	933	6000	166	0.95655	Душой нашего военного искусства яв- ляется смелый и гибкий маневр. Тактика маневрирования, созданная Красной Ар- мне по указаниям товарища Сталина, наиболее прогрессивная и самая дей- ственная тактика. Она обеспечивает эф- фективнейшее использование всей блевой техники, высокие темпы наступательных действий, гибкое применение огня и жи- вой силы и, на конец, решительный харак- тер боевых столкновений. В умелом при- менении тактики маневрирования заклю- чается одно из основных, непреложных требований современной военной науки какому военачальнику, кажюму коман- диру. Боевая практика снова и снова свиде- тельствует, что прямая линия --- далеко не всегда кратчайшее расстояние к пели. Как правило, применение обхода и охвата позволяет быстрее решить задачу. Огонь обороны с фронта в большинстве случаев сильнее. Следовательно. выгоднее атаковать наименее обстреливаемые на- правления фланги, тыл, можно лишь с помощью маневра. Слабые места в обороне врага чаще всего обнару- живаются уже в ходе боя. Это обязывает командира решительно осуществлять пере- группировки в процессе борьбы, менять направление ударов. Ни при каких об- стоятельствах не допускать шаблона, а каждый бой решать по-новому, в соответ-	vol-5732-page-01-seg-012-0269-4803-0933-6000.png
5732	1	969	2625	1615	2804	26	0.95409	ствии с данной конкретной обстановкой; бить врага смелым, стремительным и гиб- ним маневром --- таково одно из основных правил современной военной науки, золо- тое правило победы.	vol-5732-page-01-seg-013-0969-2625-1615-2804.png
5732	1	965	2810	1614	3418	82	0.95627	Умелое применение тактики маневри- рования означает правильное использова- ние всей мощи и подвижности нашей многочисленной и разнообразной боевой техники. Осуществление тесного, нераз- рывного взаимодействия всех родов войск на полях сражений является основным тактическим принципом советской военной доктрины. Но, разумеется, нельзя пони- мать это взаимодействие как механическое сложение усилий различных видов ору- дня. Задача состоит в том, чтобы всегда и везде применять боевую технику в строгом соответствии с ее возможностями и особенностями, обеспечивая предельное использование каждого рода войск для наилучшего решения общей задачи.	vol-5732-page-01-seg-014-0965-2810-1614-3418.png
5732	1	956	3426	1610	4218	105	0.95770	Организаторские способности начальст- вующего состава армии представляют со бой, как учит товарищ Сталин, один из постоянно действующих факторов, реша ющих судьбу войны. Эти организаторские способности проявляются прежде всего в умении наладить четкую, слаженную и безотказную деятельность всех звеньев войск, всех органов управления в любых условиях обстановки. Современная воен- ная наука требует высокой культуры штабной работы. Строжайше учитывая все условия, определяющие победу, штабы обязаны помогать командиру всесторонне обеспечивать каждый бой, искусно, неос- лабно управлять войсками в динамике боя. Современная военная наука требует также высокой культуры работы войско- вых тылов. Нельзя забывать, что от пол- ного и своевременного снабжения частей боеприпасами, снаряжением, продовольст- зависит исход боевых действий.	vol-5732-page-01-seg-015-0956-3426-1610-4218.png
5732	1	958	4228	1610	4770	77	0.95605	Мастерство побед развивается отта- чивается в горниле сражений, Современная военная наука, охватывающая все стороны жизни и боевой деятельности войск, это не какая-то тайна за семью печатя- ми. Ее принципы четко п ясно сформу- лированы в приказах товарища Столица, в мудрой сталинской книге «0 великой Отечественной войне Советского Союза». основные положения тщательно разра ботаны в наших уставах. Ее пламенный дух живет во всех ратных делах наших передовых частей и соединений, порождая новые и новые образцы искусства побель дать	vol-5732-page-01-seg-016-0958-4228-1610-4770.png
5732	1	952	4784	1606	5582	112	0.96135	Боевая практика передовых гвардейских частей и соединений Красной Армии наглядное воплощение сталинской военной науки. Опыт этих частей и соединений учит умению мастерским сочетанием огня и маневра взламывать вражескую оборону на всю ее глубину, не давать врагу не редышки, своевременно ликвидировать вра- жеские попытки контратаками задержать наше наступление. искусно организовы- вать преследование врага, не давать сму увозить технику, смелым маневром охва- тывать фланги вражеских войск, проры- ваться в их тылы, окружать вражеские войска, дробить их и уничтожать, если они отказываются сложить оружие. Опыт гвардейцев учит умению бить врага по всем правилам современной военной нау- ки. Необходимо, как указывает товарищ Сталин, «смелее и шире внедрять в боз- вую практику опыт передовых гвардей- ских частей».	vol-5732-page-01-seg-017-0952-4784-1606-5582.png
5732	1	952	5594	1598	5844	28	0.96157	Неустанно двигая вперед свое военное искусство, неутомимо совершепствуясь умении воевать по-современному, Красная Армия еще более повысит свою боевую мощь, приблизив лень полной победы, пол- кого разгрома немецко-фашистских захват-	vol-5732-page-01-seg-018-0952-5594-1598-5844.png
5732	1	952	5850	1598	5990	19	0.95076	Равняясь по передовым гвардейским со- единениям и частям, каждом бою бить врага по всем правилам современной воен- ной науки!	vol-5732-page-01-seg-019-0952-5850-1598-5990.png
5732	1	1708	2437	2912	2597	14	0.87817	ОТ СОВЕТСКОГО ИНФОРМБЮРО . . . . . . Оперативная сводка за 1 марта	vol-5732-page-01-seg-020-1708-2437-2912-2597.png
5732	1	1644	2606	2949	3435	199	0.95225	Несколько дней назад войска ЛЕНИНГРАДСКОГО фронта с бсем форсировали реку НАРВА южнее г. НАРВА и, прорвав сильно укрепленную оборону противника, захватили на западном берегу реки плацдарм протяжением по фронту 35 километров и в глубину 15 километров. Наши войска овладели населенными пунктами ВЯЗКА, МУСТАЙЫЗ, СУРЕСОРУ, КЯРЕКОННА, СЕБЕРГИ, АУВЕРЕ, ХАВАКИНГУ, МЕТСНЮ- ЛА, УХЕКОННА и перерезали железную дорогу НАРВА --- ТАЛЛИН в районе желез- нодорожной станции АУВЕРЕ в 15 километрах западнее гор. НАРВА. В течение 1 марта на ПСКОВСКОМ направлении наши войска продолжали вести наступательные бои, в ходе которых заняли более 70 населенных пунктов, в том числе НЕВАДИЦЫ, БОЛЬШАЯ ЖАДУНКА, РЯБОВА, ЛАНЕВА ГОРА, ОРЕХОВО- чи, олисово, пересветово, болотово, сосницы, васюткино, кашино и железнодорожную станцию РУСАКИ. Нашими войсками перерезана железная дорога ПСКОВ -- ИДРИЦА. Северо-западнее НОВОСОКОЛЬНИКИ наши войска с боями заняли несколько населенных пунктов и среди них ДУПЛИ, ЛЕТОВО, ПУНДРОВКА, КУЯЛЫ, ЗАБОРЬЕ, ЛУНЕВКА. На ВИТЕБСКОМ направлении наши войска вели наступательные бои, в ходе которых заняли более 30 населенных пунктов и среди них БАТАЛИ, ПЕКАРИ, СКУЛОВИЧИ, ОБУХОВО, ТИШКОВА, ВОРОНЫ, СЕЛЮТЫ. На других участках фронта - поиски разведчиков. В течение 29 февраля наши войска на всех фронтах подбили и уничтожили 16 немецких танков. В воздушных боях и огнем зенитной артиллерии сбито 9 са- молетов противника.	vol-5732-page-01-seg-021-1644-2606-2949-3435.png
5732	1	1629	3480	2279	4403	137	0.95335	Несколько дней назад войска Ленин- градского фронта с боем переправились через реку Нарва, южнее города Нарва. Противник, опираясь на мощные оборони- тельные рубежи, оказывал упорное сопро- тивление и любой ценой стремился удер- жаться на занятых позициях. Советские пехотинцы при поддержке артиллеристов сломили сопротивление немцев и захвати- ти плацдарм на западном берегу реки Нарвы протяжением по фронту в 35 кн- лометров и в глубину на 15 километров. Наши войска перерезали железную дорогу Нарва-Таллин в районе станции Аувере, находящейся в 15 километрах западнее города Нарва. На одном участке бойцы Н-ской части в ожесточенных боях раз- громили два полка вражеской пехоты. Отступая, гитлеровцы бросили 25 орудий. 40 минометов, много снарядов и мин. На другом участке советские части за два дня боев истребили 1.200 гитлеровцев захватили 3 исправных танка, 4 самоход- ных и 16 полевых орудий, 90 пулеметов и другие трофеи.	vol-5732-page-01-seg-023-1629-3480-2279-4403.png
5732	1	1627	4426	2277	5353	138	0.95344	На Псковском направлении наши вой- ска продолжали наступление и засияли бо- лее 70 населенных пунктов. Советские бойцы выбили немцев из нескольких силь- но укрепленных опорных пунктов, при- крывающих подступы к городу Пскову. Овладев железнодорожной станцией Ру- саки, наши войска перерезали железную дорогу Псков--Идрица. В ходе боев про- тивник несет тяжелые потери в живой силе и технике. Бойпы и-ской части уни- чтожили более 600 немецких солдат и офицеров. Артиллеристы этой же части огнем с открытых позиций уничтожили 7 немецких танков и 18 орудий. Большие потери наносят немцам наши разведчики. одном районе 17 красноармейцев про- брались в тыл противника и оседлали шоссейную дорогу. Большая колонна пем- цев, отступавшая по этой дороге, была встречена пулеметным огнем. Немцы не- сколько раз бросались в атаку против горстки наших бойцов. Уничтожив до 300 гитлеровцев, разведчики ночью оторвались от противника и вернулись в свою часть.	vol-5732-page-01-seg-024-1627-4426-2277-5353.png
5732	1	1625	5372	2273	5807	60	0.94856	Северо-западнее города Новосокольники наши войска вели наступательные бои Части Н-ского соединения заняли не- сколько населенных пунктов, уничтожив при этом до 400 немецких солдат и офи- деров. Захвачено 11 орудий, 5 тяжелых минометов, 34 пулемета и 3 склада бое- припасов. Части другого соединения, про- двигаясь вдоль шоссе Новоржев--Пушкин- ские Горы, уничтожили до батальона не- мецкой пехоты и захватили значительное число плоппых	vol-5732-page-01-seg-025-1625-5372-2273-5807.png
5732	1	1623	5850	2273	5992	23	0.94580	Партизанский отряд, действующий в ном из районов Львовской области, в ночь на 14 февраля атаковал немецкий гарни- в одном населенном пункте. В ожесто-	vol-5732-page-01-seg-026-1623-5850-2273-5992.png
5732	1	2298	3481	2947	3870	59	0.95317	черном бою советские патриоты истребили до роты гитлеровцев. Захвачено у немцев более 100 винтовок и автоматов, 57 ав- томашин, 30 тонн бензина, 200 лошадей склад зерна. Освобождены из фашист ского застенка советские граждане, аре- стованные немцами. Другой отряд львов- ских партизан прямой наводкой из орудий обстрелял несколько немецких воинских эшелонов. Разбиты 5 паровозов, 48 плат- форм и 16 вагонов.	vol-5732-page-01-seg-027-2298-3481-2947-3870.png
