volume_number	page_number	x1	y1	x2	y2	tokens_count	mean_confidence	text	image
5104	2	3855	3751	4524	4606	134	0.95410	Осталось покончить со взводом, засев- шим на вы:оте, который продолжал сопро- тевляться. К высоте направилась группа автоматчиков, возглавлял ее сержант Ба- кай. На южном скате высоты находилось дерево-земляное укрытие с двумя амбра- сурами. Немцы отсюда начали бить из пу- леметов. Но сержант Бакай с-) своими бой- цами успел достигнуть мертвого простран- ства и продолжал ползти. Вскоре амбразуры полетели гранаты, по двери за- строчил ручной пулемет. Вражеская огне- бая точка замолкла. Бойцы ворвались дзот. Все десять находившихся там нем пев оказались убитыми. Бой за деревню длился с 19 до 23 ча- сов. За эти четыре часа немцы потеряли только убитыми около ста человек. Ба- тальону в качестве трофеев достались 3 миномета, 5 ручных и 2 станковых пуле- мета, 17 ящиков патронов, 1.500 мин. Батальон сумел разгромить усиленную немецкую роту и охладить деревней, имел небольшие потери	vol-5104-page-02-seg-047-3855-3751-4524-4606.png
5104	2	3855	4618	4520	5082	69	0.95446	Успех наступления батальона прежде всего об ясняется тем. что оно было хо- рошо подготовлено. Комбат очень тща- тельн) провел разведку, точно выявив огневые средства врага. их расположение раскрыв тактику действий песенкой роты в обороне. Кроме того непосредственно на поле боя тов. Рудаков гибко рубовотил действиями подразделений. Следует еще отметить, что артиллеристы. умело на- нервируя огнем, наступали вместе с пехо- той. Они во-время расчищали ей путь, тавляя огневые точки немцев.	vol-5104-page-02-seg-048-3855-4618-4520-5082.png
5104	2	3903	5096	4468	5172	5	0.92555	Капитан В. Яковлев действующая армия	vol-5104-page-02-seg-049-3903-5096-4468-5172.png
5104	2	3198	5242	4484	5300	6	0.94005	Сержант Шахов подоил три немецких танка	vol-5104-page-02-seg-050-3198-5242-4484-5300.png
5104	2	3164	5318	3825	5819	77	0.95414	Южный фронт, 17 февраля. (По та легра:ру от наш. спец. корр. ). Франтова газета "Во славу родины" от 16 февраля) 1942 гола сообщает: "В боях за одно село враг оказывал серьезное сопротивление. Любой ценой фа- шисты пытались удержать свой опорный пункт. Вскоре сопротивление немцев на переднем крае было сломлено. Бойцы во- рвались на улицы села. Тогда немцы бро сили в контратаку танки и резервное под- разделение. Получив значительный пере- вес в силах, враг стал теснить наши. бойцов,	vol-5104-page-02-seg-051-3164-5318-3825-5819.png
5104	2	3162	5823	3827	6143	55	0.95630	Сержант Шахов с группой красноармей- цев, засев в каменном здании, смело упорно отражал контратаку немцев. Пря- мо на них шли четыре фашистских тан- ка. Здание уже было пробито в несколь- ких местах. Но Шахов героически продол- жал свой поединок с вражескими маши- нами. Он открыл по ним огонь из про- тивотанкового ружья. Первые же меткие	vol-5104-page-02-seg-052-3162-5823-3827-6143.png
5104	2	3849	5330	4516	6137	115	0.95838	выстрелы Шахова повредили оптику го- ловного немецкого танка. Его пушка, оче видео, заклинилась. Немецкая машина прекратила огонь и поспешно отошла назал. Борьба продолжалась. Отважный сер- жант из противотанкового ружья нанес повреждение еще двум танкам, Они тоже вышли из строя и откатились обратно Прикрываясь броней танков, немецкие пе- хотинцы открыли огонь по лому, гле ук- рытся Шахов с бойцами. Сержант и цы взялись за винтовки и в упор рас- стреливали фашистских автоматчиков. Ко- гда некоторые из них попытались прибли- зиться, наши войны стали метать гра- наты. Понеся большие потери, помпы выну- ждены были отказаться от попытки вы- бить группу советских бойцов из здания... Победила в этом неравном бою отважная группа стрелков во главе со смельм сер-	vol-5104-page-02-seg-053-3849-5330-4516-6137.png
5104	3	610	340	1261	374	8	0.90872	18 февраля 1942 г., среда. № 49 (5104)	vol-5104-page-03-seg-001-0610-0340-1261-0374.png
5104	3	884	460	2284	576	1	0.90495	ламенный	vol-5104-page-03-seg-003-0884-0460-2284-0576.png
5104	3	988	614	2163	680	3	0.94293	Памяти Серго Орджоникидзе	vol-5104-page-03-seg-004-0988-0614-2163-0680.png
5104	3	558	706	1227	1689	151	0.95515	Сегодня потолятичь пять лет со дня смерти Серго Орлаковикидзе. 18 февраля 1937 года, в 5 часов 30 минут вечера, замолкло пламенное сердце верного сына большевистской шарли и, незабываемого, такого родного всем нам, Сарго. Серго Григо ий Константиновка Орджо- - родился в 1886 a 1903 году 17-летним юношей ветушил партию большевиков. Его первых и учите- лями были товарищи Сталин и Ладо Кен- хавели. Ознакомившись с учением Леняна, молодой Серго на вс10 жизнь стал пла- менным бойцом за торжество этого вели- кого учения. 19 19 лет Серго становится профессио- нальным революци нером. Идет бурный 1905 год По всей Рос- сий перекатывается из края в край рево- лудильная ванна. Горит об'ятый восста- нием Казказ. Молотой Серго работает В Абхазии. Его горячее СТО-20 Доходит до г.тубины серица горцев Кавказа. Он зовет их на борьбу против ненавистного париз- ма, против расти экоплсататоров. го- товит массы к восстанию против царской монархии, он заготовляет оружие для вас- статья.	vol-5104-page-03-seg-005-0558-0706-1227-1689.png
5104	3	556	1693	1217	1939	34	0.95844	Тбилиси на митинге товарищ Сталин выдвигает перед большевекамн Грузин за- дачу вооружения масс. «Накая револю- ция, - говорит товарищ Сталин, мо- жет победить без оружия и кто тот рево- тюционер, который говорит: 10.той сру-	vol-5104-page-03-seg-006-0556-1693-1217-1939.png
5104	3	558	1943	1213	2115	25	0.95616	Что нужно нам, чтобы действительно побелить? Для этого нужны три вещи: первое - вооружение, второе воору- жение, третье - еще и еще раз взору- жение».	vol-5104-page-03-seg-007-0558-1943-1213-2115.png
5104	3	552	2119	1219	3110	150	0.95458	Серго помогает вооружать народ. Врага схватывают его в когда Серго в Гудаутах разгружает баркасы контрабандным оружием, чтобы перепра- веть его в горы. Но скелю смотрит, в лицо брату молодой реватоции, Его не страшит тюрьма- Он знает, что борется за справедливое дело, которое победит, не- смотря на что. В 1906 году первая встреча Серго товарищем Сталиным. Серто работает чистом Бакинского комитета. руководят партийной работой в Балахонах. Дважды жандармы арестовывают его --- де- монстрации 1 мая и в ноябре 1907 года. Его ссылают в далекую Сибирь, село Потоскуй, Пинчугской волости. Но Сергей но из тех, кто может долго жить в ссыл- ке. Он бежит из ссылки, когда револю- года уже на убыль, когда наступн- та в России стольнимеская реакция- Страстная натура бойца приводит его в ряды иранских революционеров. 1909 год. Реште и Энзели Серго помогает иран- ским революционерам и приобретает много друзей среди передовых общественных деятелей Ирана. Он приобретает новый боевой опыт.	vol-5104-page-03-seg-008-0552-2119-1219-3110.png
5104	3	548	3114	1217	3637	76	0.95983	то время, как меньшевики хоронят революцию и ликвидируют партию, Серго вместе с товарищем Сталиным продолжает кипучую деятельность. Он становится од- ним из организаторов Пражской конферен- ции большевиков, сыгравшей такую огром- ную роль в жизни большевистской партии- На этой конференции он дает отчет о ра- боте партийных большевистових организа- пей в России. Ему всего 26 лет, но он пользуется большим уважением более ста- рых товарищей, И Пражская котферетисия большевиков выбирает его членом Цен- трального Комитета большевистской пар-	vol-5104-page-03-seg-009-0548-3114-1217-3637.png
5104	3	550	3641	1213	3921	46	0.96232	Вскоре пусто Пражской конференции Серго был арестован. За побег из ссылки получил каторачный приговор. Он от- бывает каторгу в Шлиссельбурге. Напрас- но тюремщики пытаются сломить его бур- ный темперамент: он и в тюрьме боец за достоинство партийца; он и в тюрьме не- сет высоко знамя большевика.	vol-5104-page-03-seg-010-0550-3641-1213-3921.png
5104	3	548	3931	1211	4596	104	0.96025	Царское правительство бросает его в да- лекий Якутский край. Якутская беднота, заброшенная, эксплуатируемая тойонами, царскими чиновниками, шаманами, ин- стан5тивно тянется к Серго, который ле- чит эту бедноту, тлубоко переживая стра- дания якутского народа. Кто из якутских ссыльных не вспомни- наст с особенной теплотой приезды Серго в Якутск, когда вместе с ним врызались наше жилье какая-то особенная жизне- радостность, буйная порывистость, бод- гость, уверенность в нашей победе! Кто помнит страстных ночей Серго о наших будущих боях за коммунизм! Кто может забыть его рассказы о жизни партин за эти голы, когда мы были оторваны гола- ми тюрьмы и каторги от того, что проис- хотило на воле!	vol-5104-page-03-seg-011-0548-3931-1211-4596.png
5104	3	548	4600	1207	5198	82	0.95227	При ппа революция 1917 года. Царизм был свергнут. Серго рвется окунуться R бурные волны революции, от свержения царизма к своей высшей точке социалистическому перевороту. Сер- в Петрограде верный помощник Ленина и Сталина. И когда подлые враги правительства Керенского создают гнус- ные обеинения протез Ленина и ищут его, чтобы растерзать, Серго является тем до- веренным лицом, через которое партия сносится с Лениным, скрытым в падса- ном убежище, в шалаше у Разлива. Серго ведет летом 1917 г. борьбу про- тив грузинских меньшевиков, предающих теволюцию.	vol-5104-page-03-seg-012-0548-4600-1207-5198.png
5104	3	546	5208	1207	5633	57	0.94417	7 ноября Серго один из активнейших организаторов Октябрьской революции в Петрограде. Когда Керенский, скрывшись в женском платье из царского рода, про- добраться в Пулково, чтобы вместе с гене- ралом Красновым вести наступление на Петроград, Центральный Комитет поручает Серго операцию против Керенского Крас- нова. Серго лично руководит операцией, добивается перехода части войск Краснова на сторону революции, арестовывает ге-	vol-5104-page-03-seg-013-0546-5208-1207-5633.png
5104	3	1245	708	1911	1415	98	0.94766	нерзла праснова. Планы Керенского раз- биты. Керенский вынужден бежать. В начале апреля 1918 года Совнарком за надписями Ленина и Сталина издал де- крет об образовании Чрезвычайного Комис- сариата 10га России. В декрете сказано: "Чрезвычайному Комиссару Совета Пароль- ных Комиссаров тов. С. Орджоникидзе, по- ручается организовать под своим предсе- дательством временный Чрезвычайный Ко- миссариат Южного района, обединяющий деятельность Брэма, Донской Области, Тверской Области, Черноморской губернии, Черноморского флота и всего Северного Кавказа до Баку. Цель Комиссариата: неуклонное про- ведение директив Центральной Совет- ской Власти на суше и на море, концеп- трированная борьба с буржуазной контрре- волюцией, упрочение Советской Власти в	vol-5104-page-03-seg-014-1245-0708-1911-1415.png
5104	3	1225	3200	1899	5635	363	0.94960	районе своей деятельности, поддерживал- или прямой связи областей с Советом lla- народных Комиссаров". В это время к Дону подступали окку- панты немцы. контрреволюция подними- голову, опираясь на германских и дру- гих интервентов. Немцы пытались сыграть на пастноеннях реакционной части каза- чества. В ответ на это партия сплотила трудовое казачество Дона, Кубани и Те- река. 9 апреля 1918 года в. Ростове-на- Дону созван был первый съезд Советов ра- бочих, крестьянских и казачьих депутатов Донской республики. Серго выступил на с езде с привотстви- см. Он говорил: «Л думаю, не будет Преувеличением сказать, что сегодняшний день есть день торжества советской вла- сти. Здесь собралось трудовое казачество. А известно, что когда на севере бурака- зня была разбита, то он бежать по Доп : и здесь хотела достигнуть свой троп. По Совет Народных Комиссаров верил, что трудовое казачество по пойдет против зла- Советов, и в этом Совет Народных Компрессоров и вся трудовая Россия не об- мапулись. Подтверждением этого настоя- щий съезд, на котором почетным членом избран быт товарищ Ленин". Серго выполнил огромную работу по организации Красной Армии, по борьбе с германскими хищниками, оккупантами, которые наводнили Украину, прорвались на Дон, рвались к Северному Кавказу. Все знают, какую легендарную смелость, храбрость проявлял Сорго в этой - борьбе. Никакая опасность не страшила его. проявил большой талант организатора. Oil быстро умел сплачивать вокруг себя лю- дей. С Серго можно было поспорить, ввн- ду сго горячего темперамента, но нельзя было не любить этого пламенного, безза- устно преданного партии "Ленина--Сталина большевика. Когда летом 1918 года на Тереке велы- XRVE Контрреволюционный мятеж под ру- козодством "меньшевика Теоргия Бичерахо- ва, Серго сумел объединить революционные Мироновичем Кировый они выполнили ко- лоссальную работу по обединению горских народов Чечни, Шигушетни, Осетин Ra- баландино-Бактерии. Борьба кончилась побе- дой. 17 ноября войсками Красной Армии и партизанами взят был центр бичерахов- ского контрреволюционного мятежа--Мос- -- - - Iok. If народов Терека 28 ноября 1918 года сплотит еще теснее народы Северного Кавказа вокруг партия денянс Сталина. Павестно, какую роль выполнил Серго 11-й армии вместе с Сергеем Мироновым- чем Кировым под руководством товарище Сталина. 1913 г. Ленип писать об Орлжонп- «По отзывам... Сталина, Серго на- дежнейшяй в о е н н ы й работник. Что вернейший и дельнейший революционер. его силу больше 10 лет".	vol-5104-page-03-seg-015-1225-3200-1899-5635.png
5104	3	1925	702	2594	3625	301	0.94552	Летом 1919 года Серго назначен быт членой Ревпосисовета 16-й армии Запад- по го фронта. Около трех месяцев пробыл Серго на Западном фронте, руководил боя- за Борисов. Взятие Борисова задержа- ло дальнейшее наступление белополяков и закрепило фронт вдоль Березины. на Западном фронте Серго был вернейшим помощником товарища Сталина. Серго был поручен ответственнейший участок по выполнению сталинского пла- на разгрома "Деникина. Как член Реввоен- совета 14-ii армии и руководитель ударной группы, ОП неп средственно возглавлял войска, освободившие Оргл. Ему припад- лежит выдающаяся роль в освобождении Ларькова, Донбассз, Ростова. 11 декабря 1919 года враг был выбит из Харькова. Это событие имело огромное значение. Выполняя сталин- ский план разгрома Деникина, Латышская дивизия п Кубанский кавалерийский полк. находившиеся командой Серго, жутся вместе с Пер- вой Конной архиве 113 Ростов. 8 яп- варя 1920 года Пер- вая Конная армия очищает Ростов-на- Дону от белогвардей- ской контрреволюции Зпая, каким влия- нием пользуется Сер- Северного Павказа, Центральный Комп- тет партии пазна- чает Серго председа- to телем Северо-Кавказ- ского Бюро по вос- становлению совет- ской власти; заме- стителем назпа- частся С. М. Киров. Серго входит в Рев- военсовет вновь об- разованного Кавказ- ского фринта. Билет полный разгром Де- никита. Вместе Кировым, которого так любил Cepro, главе 14-ii армии Сорго проходит по Северному Кавказу и Север- ный Кавказ от бе- догвардейцев. Им по- могают партизанские отряды. Огромную роль иг- рала в освобождении Кавказа 11-я армия. 30 апреля во главе 11-й арми в Баку вступили тт. Орджо- Миколо. 1 мая 1320 года Серго и Ми- коян принимали парад Красной Ap- в Баку, и Серго вручал героя Азербайджана органа Красного Знамени. 30 ноября 1920 года советская власть восторжествовала в Армении, а 25 февраля 1921 года - Грузии. 19 1921 года ВЦПК пагади. това- рища Орджоникидзе: орденом боевого Крас- пого Знамени за (боевые отличия "на от- ветственных поста: Красной Армии с на- чала гражданской войны».	vol-5104-page-03-seg-016-1925-0702-2594-3625.png
