volume_number	page_number	x1	y1	x2	y2	tokens_count	mean_confidence	text	image
5628	4	273	2977	945	3421	57	0.95715	Стремясь всячески противодействовать поступлению наших войск, немецкое командование до последних дней бросало почти всю свою авиацию на поле боя. Однако наше наступление на широком фронте с прорывом обороны на большую глубину заставило немцев прибегнуть к известному распылению сил. Последние дни примечательны большими воздушны- ми боями над днепровскими переправами. Ежедневно перед наступлением сумерек в районе переправ появляются группы	vol-5628-page-04-seg-017-0273-2977-0945-3421.png
5628	4	971	1924	1633	2070	16	0.93075	"Хейнкелей" и "Юлкерсов". Специально выделенные наши истребители надежно обороняют переправы, не позволяя немцам производить разрушения. :	vol-5628-page-04-seg-018-0971-1924-1633-2070.png
5628	4	965	2079	1633	2632	81	0.94809	Несмотря на ввод новых спл и упорст- во врага, паши летчики продолжают ока- зывать серьезную поддержку своим назем- ным войскам. Действия нашей авиации на Криворожском направлении как бы разде- ляются на два этапа: массированные целеустремленные удары на поле боя и сопровождение подвижных групп. Над по- лем боя всё время появляются наши са- молеты. Бомбардировщики подвергают свое- му воздействию всю глубину расположе- ния огневых позиций врага. Вслед за бом- бардировщиками приходят штурмовики, на- носящие удары, главным образом, по пе- : родному краю.	vol-5628-page-04-seg-019-0965-2079-1633-2632.png
5628	4	962	2641	1634	3413	110	0.95429	Боевая работа нашей авиации, сопро- вождающей подвижные группы, носит не- сколько иной характер. Штурмовики по- прежнему наносят удары по огневым средствам противника. Зато бомбарди- ровщики, находясь в готовности для действий над полем боя и в случае не- обходимости появляясь там, поправляют удары, в основном, на тактические резервы, железнодорожные станции и скоп- ления вражеских войск. Эти действия от- личаются большой эффективностью. Па- днях группа пикировщиков N части за один вылет нанесла удары по двум же- лезнодорожным станциям, где скопилось до десятка эшелонов, причем было уничтоже- но большое количество техники и живой силы врага. Как свидетельствуют фото- снимки, атаки пикировщиков вызвали сильные пожары на обеих станциях. Воздушные бои, число которых в иной	vol-5628-page-04-seg-020-0962-2641-1634-3413.png
5628	4	1652	1931	2318	2626	103	0.95224	день доходит до двух-трех десятков, при- посят нашим летчикам серьезные успехи Чаще всего они одерживают победы при минимальных своих потерях. Нередки слу чаи, когда подразделения наших истреби- телей систематически выигрывают воз- душные бои, вовсе не имея потерь. Так, например, подразделение гвардии капитана Прошенкова за десять дней боев сбило 15 немецких самолетов, не потеряв ни одного своего. Больших успехов добилась часть гвардии майора Жуйкова. Она за послед- нее время сбила 53 немецких самолета. В этой части есть молодые летчики, имею- пие по нескольку побед. Особенно хоро- ших результатов достигли младшие лейте- нанты Фалалеев и Алексеев. Первый одер- жал шесть, а второй пять воздушных побед.	vol-5628-page-04-seg-021-1652-1931-2318-2626.png
5628	4	1645	2654	2309	3307	95	0.95066	Активную борьбу против немецких са- молетов ведут и наши штурмовики. Как правило, атаковав наземные цели, они вы ходят в районы истребления и вместе потребителями сопрово:ждения производят псиски воздушного противника. Этот спо- соб противодействия вражеским бомбарди- ровщикам оказался достаточно эффектив- ным. Известен ряд успешных воздушных боев с участием штурмовиков. Один из них особенно интересен. Речь идет о группе самолетов "Ильюшин-2", которую вел ка- нитан Нестеренко. Встретив до 80 номер- ких самолетов, 8 штурмовиков врезались в гущу этой армады, разбили ее строй и подожгли 8 «Юнкерсов». Сам капитан Не- стеренко при этом сбил два немецких са- молета.	vol-5628-page-04-seg-022-1645-2654-2309-3307.png
5628	4	1922	3320	2269	3356	3	0.92685	Майор В. ЗЕМЛЯНОЙ.	vol-5628-page-04-seg-023-1922-3320-2269-3356.png
5628	4	1669	3372	2252	3408	2	0.89780	КРИВОРОЖСКОЕ НАПРАВЛЕНИЕ.	vol-5628-page-04-seg-024-1669-3372-2252-3408.png
5628	4	442	3501	2138	3550	8	0.94660	Передача танков, построенных на средства лауреатов Сталинской премии	vol-5628-page-04-seg-025-0442-3501-2138-3550.png
5628	4	267	3577	933	3933	60	0.93357	В части, где заместителем командира по политической части майор Попов, двой- ное торжество: передача танков, построен- ных на средства лауреатов Сталинской пре- мии тт. А. Е. Корнейчука, А. Н. Толсто- го, Г. Ф. Александрова, П. Н. Поспелова, М. Б. Митина, И. И. Минца, Ем. Ярослав- ского, П. Ф. Юдина, И. П. Товстухи, М. А. Дынника, Б. Е. Веденеева и др.	vol-5628-page-04-seg-026-0267-3577-0933-3933.png
5628	4	265	3956	929	4131	22	0.95402	У машин выстраиваются ровные шеренги танкистов. На импровизированную трибуну поднимаются академики, лауреаты Сталин- ской премии товарищи Корнейчук, Толстой, Юдин, Минц, генерал-лейтенант Бирюков,	vol-5628-page-04-seg-027-0265-3956-0929-4131.png
5628	4	958	3571	1616	3671	10	0.95861	командующий Омским танковым соединени- ем гвардии генерал-майор танковых войск Хасин.	vol-5628-page-04-seg-028-0958-3571-1616-3671.png
5628	4	956	3681	1616	3787	16	0.94771	С краткими яркими речами выступили академики А. Корнейчук, A. Толстой, М. Митин, И. Минц, П. Юдин.	vol-5628-page-04-seg-029-0956-3681-1616-3787.png
5628	4	956	3799	1616	4127	53	0.96582	От имени танкистов выступил механик- водитель старший сержант Воронин и ка- валер ордена Ленина старший лейтенант Беляев. Они благодарят представителей со- ветской интеллигенции за грозные боевые машины, обещают от имени экипажей тан- ков «За радянську Украину», «Грозный», «За передовую науку", от имени всех тан- кистов части беспощадно громить врага. машинам подходят академики, пред-	vol-5628-page-04-seg-030-0956-3799-1616-4127.png
5628	4	1643	3571	2303	3783	28	0.96682	ставители командования. Первым вручает формуляр экипажа машины «За радянську Украину» тов. Корнейчук. Крепко обняв и расцеловав танкистов, он желает им бое- вых успехов, просит поддерживать с ним переписку.	vol-5628-page-04-seg-031-1643-3571-2303-3783.png
5628	4	1641	3802	2299	3981	24	0.95360	Формуляр танка "Грозный" вручает эки- пажу академик А. Толстой. Формуляры ма- шины "За передовую науку" передаюг эки- пажу тт. Митин и Минц. Короткая команда:	vol-5628-page-04-seg-032-1641-3802-2299-3981.png
5628	4	1671	3985	1918	4019	2	0.92623	По машинам!	vol-5628-page-04-seg-033-1671-3985-1918-4019.png
5628	4	1641	4024	2298	4127	18	0.97594	Сигнал флажком, и машины одна за дру гой с ревом срываются с места. Колонна танков уходит на фронт.	vol-5628-page-04-seg-034-1641-4024-2298-4127.png
5628	4	2603	444	3459	514	2	0.94692	Заявление Рузвельта	vol-5628-page-04-seg-035-2603-0444-3459-0514.png
5628	4	2345	535	3017	1639	184	0.96382	ЛОНДОН, 29 октября. (ТАСС). Как пе- 9. редеет вашингтонский корреспондент агентство Рейтер, президент Рузвельт за- : явил представителям печати, что на Мос- ковской конференции достигнуто соглаше- ние и остается только поставить подписи. Как указал Рузвельт, результаты конфе- решили подтвердили его уверенность в том, что Россия будет сотрудничать после войны. По словам Рузвельта, результаты конференции представляют огромный успех не только в смысле достижения соглаше- ния по повестке дня, но и в отношении атмосферы, господствовавшей на самой кон- ференции. Эта атмосфера была удивитель- но хорошей. Большая заслуга, отметил Руз- вельт, принадлежит государственному се- кретарю США Хэллу, однако в равной сте- пени эта заслуга принадлежит России и Англии. На вопрос, каковы были цели конферен- ции, Рузвельт ответил, что конечными це- лями являлись мир и прекращение агрес- сне во всем мире. Рузвельт указал, что достигнуто соглашение по конкретным во- пресам так же, как и в отношении общей политики, однако участники конференции не могли «поставить точки над и». Рузвельт высказался в пользу деклара- ции сената о том, что США должны со- трудничать с другими странами, чтобы из- бежать войны в будущем. Он не пожелал сказать, что резолюция Коннэли, которая	vol-5628-page-04-seg-036-2345-0535-3017-1639.png
5628	4	3034	538	3702	1639	186	0.96689	сейчас обсуждается в сенате, является удо- влетворительной. Отвечая на другой вопрос, Рузвельт за- явил, что все участники конференции ра- ботают с целью добиться единодушия в ходе войны и в переходный период. Ос- новная цель заключалась в том, чтобы до- стигнуть дружественного соглашения по вопросу о том, что должно быть предпри- нято. На предложение высказаться о внешней политике США Рузвельт ответил, что он одобряет резолюцию общего характера, по- добную той, которая обсуждается в сенате. Президенту был задан каверзный вопрос: «Если США, Англия и Россия были свя- заны скорее конкретной, чем общей поли- тикой до начала Московской конференции, то какой смысл в самой конференции». Рузвельт ответил, что обе стороны многое выяснили, ознакомились с хорошими идея- ми и познакомились друг с другом за сто- лом конференции, когда вырабатывали со- глашения и обменивались мнениями. Руз- вельт не сообщил, какие конкретные доку- менты были разработаны или какие согла- шения были достигнуты. Они, сказал Раз- вельт, будут оглашены в соответствующее время и, вероятно, в Москве. Однако он добавил, что члены конференции обсужда- ли вопросы в спокойной атмосфере. Что касается личных отношений, то, как вы- разился президент, сни были "почти на 10G процентов».	vol-5628-page-04-seg-037-3034-0538-3702-1639.png
5628	4	2677	1700	3343	1757	2	0.95959	Выступление Бенеша	vol-5628-page-04-seg-038-2677-1700-3343-1757.png
5628	4	2341	1774	3003	1998	35	0.96613	ЛОНДОН, 28 октября. (ТАСС). Как пе- редает агентство Рейтер, на состоявшемся в одном из районов Англии параде по слу- чаю 25-летия со дня основания Чехосло- вацкой республики президент республики Бенеш зачитал приказ чехословацким вой- скам.	vol-5628-page-04-seg-039-2341-1774-3003-1998.png
5628	4	2337	2003	3002	2294	49	0.96351	Бенеш сообщил, что в Англию с Ближ- него Востока прибыли чешские войска для соединения с частями, находящимися в Англии, с целью реорганизации и подго- товки к окончательной борьбе. Эти войска принимали участие в обороне Тобрука. Кроме того, некоторые чехословацкие ча- сти сражались в России, во время битвы за Харьков.	vol-5628-page-04-seg-040-2337-2003-3002-2294.png
5628	4	2339	2298	2998	2459	33	0.96603	Бенеш напомнил, что чехословацкая ар мия была одной из лучших армий довоен- ной Европы, и далее заявил: «То, что слу- чилось с нами в 1938 году, никогда не должно повториться. Остальные страны ми-	vol-5628-page-04-seg-041-2339-2298-2998-2459.png
5628	4	3024	1778	3689	2459	108	0.96752	ра в будущем дважды подумают, прежде чем разрешат Германии уничтожить нашу военную мощь и, таким образом, подгото- вить собственное порабощение. После то- го, как будет восстановлена наша неза- висиместь, армия республики будет не только частью нашей национальной жизни, но также частью оборонительных сил все- го мира. Она будет столпом мира и по- рядка в свободной и сильной Чехослова- кни, в свободной демократической Европе... Вместе с армиями Великобритании и Со- ветского Союза она будет являться одним из стражей мирного сотрудничества наций». Президента Бенеша сопровождал премь- ер-министр Чехословакии Шрамек, члены чехословацкого правительства, высшие офи- церы чешской и английской армий, а так- же члены дипломатического корпуса. Все они присутствовали на параде.	vol-5628-page-04-seg-042-3024-1778-3689-2459.png
5628	4	2516	2525	3503	2582	4	0.94971	Военные действия в Италии	vol-5628-page-04-seg-043-2516-2525-3503-2582.png
5628	4	2332	2611	2996	3034	77	0.96949	ЛОНДОН, 29 октября. (ТАСС). Штаб войск союзников в Северной Африке пе- редает, что в ночь на 28 октября амери- канские крейсеры и эсминцы, оперирующие заливе Гаэта, подвергли обстрелу бере- говые позиции противника в Минтурно, на- ходящемся в 8 милях от порта Гаэта, на дороге, ведущей в Рим. На фронте американской 5-й армии вой- ска союзников вновь продвинулись вперед и заняли еще одну важную высоту. На фронте английской 8-й армии продолжают- ся бон. Английские и канадские войска не-	vol-5628-page-04-seg-044-2332-2611-2996-3034.png
5628	4	2379	3104	2937	3136	4	0.96649	Итальянские офицеры не выполняют	vol-5628-page-04-seg-045-2379-3104-2937-3136.png
5628	4	2400	3144	2918	3184	3	0.98258	приказа гитлеровских оккупантов	vol-5628-page-04-seg-046-2400-3144-2918-3184.png
5628	4	2480	3197	2840	3229	3	0.94948	явке на регистрацию	vol-5628-page-04-seg-047-2480-3197-2840-3229.png
5628	4	3019	2614	3681	2931	47	0.96501	сколько продвинулись вперед. Занят Мон- тефальконе. 28 октября истребители-бом- бардировщики и истребители, входящие в состав военно-воздушных сил Северо-Запад- ной Африки, атаковали узлы дорог, поезда, мосты и позиции противника в районе боев. Истребители-бомбардировщики атаковали посадочные площадки вблизи Орвьето (в 60 милях к северу от Рима), Литторио и Фолинко.	vol-5628-page-04-seg-048-3019-2614-3681-2931.png
5628	4	3019	2939	3679	3034	14	0.96674	Во время этих операций было сбито два вражеских самолета. Авиация союзников потерь не имела.	vol-5628-page-04-seg-049-3019-2939-3679-3034.png
5628	4	2326	3254	2988	3578	45	0.96410	ЛОНДОН, 29 октября. (ТАСС). Лондон- ское радио сообщает, что гитлеровские оккупационные власти в Риме опубликова- ли приказ, в котором вторично предлагают всем итальянским офицерам явиться для регистрации в немецкие военные органы. В приказе указывается, что все офицеры, уклоняющиеся от явки, будут предаваться германскому военному суду.	vol-5628-page-04-seg-050-2326-3254-2988-3578.png
5628	4	3098	3096	3584	3191	8	0.96632	Провал об явленной Муссолини перерегистрации членов фашистской партии	vol-5628-page-04-seg-051-3098-3096-3584-3191.png
5628	4	3013	3193	3675	3584	62	0.95748	ЛОНДОН, 29 октября. (ТАСС). Об"яв- ленная Муссолини перерегистрация всех лиц, являвшихся (до отставки Муссоли- ни) членами фашистской партии и находя щихся ныне на итальянских территориях, оккупированных гитлеровцами, провали- лась, По сообщению агентства АФИ, в Милане на перерегистрацию явилось 200 человек, в Риме, Болонье, Венеции в Фло- ренции в среднем всего по 100, а в дру- гих городах только по нескольку десятков человек.	vol-5628-page-04-seg-052-3013-3193-3675-3584.png
5628	4	2440	3656	3531	3747	5	0.98386	НАСЕЛЕНИЕ ЭЛЬЗАСА ОКАЗЫВАЕТ ОЖЕСТОЧЕННОЕ СОПРОТИВЛЕНИЕ	vol-5628-page-04-seg-053-2440-3656-3531-3747.png
5628	4	2324	3766	2988	4125	61	0.97771	ЖЕНЕВА, 29 октября. (ТАСС). О нена- висти населения Эльзаса к немецко-фаши- стским оккупантам свидетельствует статья гитлеровской газеты "Мюльгаузер таг- блатт», в которой говорится: «И на пятом году войны все эльзасцы еще не поняли- и не хотят понять, почему ведется эта война. Эльзасцы предпочли бы войну про- Германии... Их подрывная работа ста- новится особенно сильной тогда, когда Германия попадает в неприятное положе-	vol-5628-page-04-seg-054-2324-3766-2988-4125.png
5628	4	3011	3770	3673	4127	61	0.97312	ние. Никогда еще они не были так актив- ны, как в течение минувших месяцев, ко- гда наши противники нанесли нам пораже- ния». В связи с этим, указывает газета, германские власти сочли необходимым «прибегнуть к самым жестким мерам». Газета отмечает, что эльзасцы, стремясь уклониться от призыва на военную службу в германскую армию и от отбывания тру- довой повинности, массами убегают из страны.	vol-5628-page-04-seg-055-3011-3770-3673-4127.png
5628	4	3816	436	4296	542	4	0.96018	ВОЙНА НА ТИХОМ OKEAHE	vol-5628-page-04-seg-056-3816-0436-4296-0542.png
5628	4	3863	574	4264	639	6	0.91523	Высадка войск союзников на острове Моно	vol-5628-page-04-seg-057-3863-0574-4264-0639.png
