volume_number	page_number	x1	y1	x2	y2	tokens_count	mean_confidence	text	image
5832	3	2225	3795	2895	6050	364	0.95230	ные и самоуверенные пемпы. Искусство наших генералов, и офицеров, сказываю- щееся в новом наступлении, п.под трех лет - войны плот не только поет, но и пора- жений. Мне приходилось встречаться некоторыми генералами, которые теперь наступают в Белоруссии. Это пе таланты- самородки, это таланты-виртуозы. II. страсть облечена в строгую форму. их операции дерзкий, но шательно протума- ны. Я сравнил бы эти операции с ямба- Путеппа. с набережными Лепанграла, математическими Формулами, со всеми темп проявлениями человеческого гения. которых пикуль коптролирует фанта- вдохновение оживляет якобы без- законы, Скромно начали войну реферат Рокоссоветлй, или гептрал Багра- пли генерал Черняховский. А теперь... не говорю о звездах на погонах или па грудп. Я говорю о той "звезде", которую люди относят к судьбе, к фатуму. к случаю и которая является звездой та- лапта. Она ведет наши полки на запад. В огромной битве важна роль каждого. пей нет статистов. Порой от поведе- - нея любого бойца зависит судьба баталь- полка. Сотни тысяч героев сейчас освобождают Белоруссию. Но есть во всех битвах, разворачивающихся на пашей зем- ле от обороны Москвы до Сталинграда от Сталинграда до теперешнего наступ- ления- печать одного гения, одного режис- сера и вдохновителя. Военные теоретики Великобритания и США уже пятут труль о стратегии Сталина. Мы пе чожен взгля- путь на нашего Главнокомандующего гла- сторонних наблюдателей пли исто- рп: он для нас почто близкие, свое; нынешнее в нем воплощение нашего народа. II всё же мы различаем в военных опера- цвях его почерк, ого голос, в огромном размахе и в будиочной, хозяйской, дело- вой разработке каждой детали; в том, что страна, которая равно славилась сроки богатством и своей хаотичностью, создала армию, которая лупит немецких педантов, в том, что страна, изображаемая еще пе- давно на картах зеленым пятном, страна богатырей без доспехов и брусиловских --- полков без спалядов. приводит в трепет эейтевер с его Эссеном, с его Сеп-Этьенон и Пильзеном; в том, что талаятливый па- род, бывший прежде наролом самоучек, вы- двинул генералов, которые дают одновре- дневные сеансы игры прославленным после- дователям фон лиффена. Всё, что соз- дает каждый наш фронтовик- его подвигу и победы, связало со Сталиным, и Сталин воюет за всех, вкладывая в общее свой индивидуальный талант, свое творчество. свое умение. Мяс привелось слышать та- кой разговор: один сержант сказал: "Так,	vol-5832-page-03-seg-051-2225-3795-2895-6050.png
5832	3	2910	3801	3578	5461	267	0.95187	пожалуй, скоро и до границы дойтем", на что его приятель ответил: «Со Сталиным ны и дальше протолкнемся"... Я лучаю, что когда в Тегеране главы трех государств обсуждали перспективы лета, - Сталин в свою очередь мог сказать: "С Красной Армией мы пройдем и дальше»... Оторвемся по минуту от тех кротов карты, к которым прикованы наши глаза. Посмотрим на Европу. Никогда Германия еще не чувствовала такой угрозы. Союз ники в Шербур -это захват ворот: для крупных битв нужен крупный порт. Те- перь открыт путь в глубь Франции. К английским сплам, сковывавшим армию Роммеля, прибавятся американские войска и те силы, которые ждали в Англии за- воевания крупного порта. По сообщениям американской прессы, французская армия внутреннего фронта равна десяти пара- : путиным дивизиям. Как только французы получат оружие, к этим десяти дивизия партизан прибавится много десятков регу- лярных французских дивизий. Генерал Бес- сельринг тщетно молит Гитлера полбросить в Италию подкрепление. В это необычай- ное лето поредели певцы и на берегах Средиземного моря, и в норвежских фьор- тат. и в Голландии и в Дании. Что полу- чили финны от Гитлера? Мало самолетов и много угроз. Дело явно идет к компу. На что надеется средний немец, не очень умный и не очень глупый? Майо: Рудольф Зепкель недавно опубликовал статью под заглавием "Свойства русского характера". Он пишет: "В военном дел русские хитры и зачастую своевремени обнаруживают ловушку. Но вне боя оне чрезвычайно доверчивы. Пх характер по- тобен ланшафту, где высокие горы сме- няются долинами и где вечные снега пре- бывают поблизости от петров. Русский за- бывчив и отходчив, как ребенок". Расчет i. ясен: не сумев победить, они надеятся перехитрить. Они полагаются на нашу отходчивость.	vol-5832-page-03-seg-052-2910-3801-3578-5461.png
5832	3	2908	5469	3573	6053	96	0.94646	Немцы не понимают, как изменился наш народ. Они не видят, что в глазах каждого из нас отражены пожарища Бе- лоруссии. Они не учитывают, что кроме стратегии и политики есть совесть порода. Не следует думать, что фрицы измени- лись. Танкист Генц Большой из дивизии "Мертвая голова" рассказывает: "Указы- вая на горящий дом, гауптшарфюрер Лют- це кричал: «Этот замечательно горит! Так должно быть всеми ломами». Мы тап- цовали и пели вокруг горящих домов". А лейтенант Герл Шенк, адъютант 2-го ба- тальона 449 пишет в дневнике: «Мы подожгли все деревни. а жителей, способ- ных носить оружие, частично забрали с	vol-5832-page-03-seg-053-2908-5469-3573-6053.png
5832	3	3597	3805	4262	4876	180	0.95047	собой, частично расстреляли. Скот и про- довольствие уничтожили. Bpar налет сплошную огромную пустыню. Сегодня мой день рождения. Свой двадцать пер- вый год я начал в качестве капитального Полкигателя. Ведь русские сёла горят так легко и очаровательно! Я сделал паскаль- ко очень милых снимков. В 19.00 дви- немся дальше на запад...". Вот почему Красная Армия наступает. Разве мало героев погибло за эти дни? Как ни бьет артиллерия или авиация, всегда остаются ::: огневые точки, и неизменна жертва пе- хотинца, который выбегает вперед. Что велет нашу армию? Гнев, возмущение, та- кая ненависть, что это уж не наука и даже не чувство, а странная сила, сме- тающая всё. Родное наше гнездо, милые деревни Белоруссии, кресты у околип и журавли, вы только потешные огни для немцев! Безумцы, они не знают, какой огонь они зажгли. Этот огонь не только в побег Белоруссии, он и в сердце каждого. Мы холесем его до Германии. Они будут каяться взводами и плакать оптом. Не в три, а в триста три ручья, но никакие слезы не погасят этого огня. Он ширится, растет, и его отсвет уже озаряет : ночь Германии.	vol-5832-page-03-seg-054-3597-3805-4262-4876.png
5832	3	3593	4888	4259	5838	165	0.95130	Заграничные обозреватели обсуждают пель нашего наступления: Минск? Брест? Латвия? Нет, каждый фронтовик знает: теперь мы наступаем на Берлин. За три года наша страна создала сильнейшую технику. Мы научились наступать. Мы в рука об руку с нашими союзника- ми. Значит, мы можем покончить с нем- цами. Нужно ли говорить о том, как мы хотим с ними покончить? Каждый солдат измучился и за себя и за своих. Не за- дорные такты боевого марша, а слезы де- тей ведут нашу армию на запад. Мы по- любили военное дело только потому, что мы страстно любим мир и за мир мы ле- ремся. Путь домой идет через Берлин для сибиряка, и для москвича, и для армянина, и для литовпа. Мы так стре- в немецкую столицу. будто там увидим нечто прекрасное. Мы увидим там низость - она на лицах немцев п на фасадах берлинских домов; но мы увы- в Берлине воистину нечто прекрас- ное: победу. Это она приведет человека в родной дом, к его жене, к его лампе, к его дереву.	vol-5832-page-03-seg-055-3593-4888-4259-5838.png
5832	3	3589	5842	4251	6061	42	0.95068	Я не знаю, когда кончится начавшееся поступление, но я знаю, чем оно кончит- ся, и я знаю, что июнь 1944 года, на- порно с июнем 1941, войдет в историю. Мы двинулись в тот путь, о котором меч- тали три года. мы дойдем.	vol-5832-page-03-seg-056-3589-5842-4251-6061.png
5832	4	3578	334	4232	373	8	0.89824	28 июня 1944 г., среда. № 152 (5832)...	vol-5832-page-04-seg-001-3578-0334-4232-0373.png
5832	4	1787	348	4214	401	3	0.91737	красная 3 вед	vol-5832-page-04-seg-002-1787-0348-4214-0401.png
5832	4	323	459	1442	542	3	0.88295	Поиск огромной силы"	vol-5832-page-04-seg-003-0323-0459-1442-0542.png
5832	4	407	561	1377	598	8	0.84692	: Отклики за границей на наступление Красной Армии	vol-5832-page-04-seg-004-0407-0561-1377-0598.png
5832	4	207	623	873	1356	136	0.97038	Нью-йорк, 27 июня. (ТАСС). Сообще- ния о наступлении Красной Армии зани- мают видное место на страницах амери- канских газет. Газета "Нью-Йорк таймс" характеризует наступление Красной Армии в районе Витебска и достигнутые ею бое- вые успехи как начало новой фазы войны на советско-германском фронте и как на- тиск огромной силы. Газета отмечает, что в течение трех дней Красная Армия смяла фронт противника на огромном протяже- нии и прорвала его на значительную глу- бину. Немцы, очевидно, не ожидали такой монцной атаки в районе Витебска, кото- рый является, по мнению газеты, «воро- тами к великой исторической дороге, ве- дущей через Минск, Брест-Литовск и Вар- шаву в Берлин». Газета отмечает в заклю- чение, что «битва за Витебск тесно свя- зана с битвой за Нормандию и с пресле- дованием союзниками немецких войск в Италии, поскольку направлением всех этих операций является Берлин».	vol-5832-page-04-seg-005-0207-0623-0873-1356.png
5832	4	209	1371	871	1485	15	0.95557	ЛОНДОН, 27 июня. (ТАСС). Английский радиокомментатор Патрик Лейси в своем выступлении по лондонскому радио отме-	vol-5832-page-04-seg-006-0209-1371-0871-1485.png
5832	4	890	623	1554	1481	142	0.97049	чает, что наступление Красной Армии на- растает по своей силе и по масштабам. Овладение Витебском и Жлобином знаме- нует собой огромную победу и дает пред- ставление о протяженности фронта, на ко- тором русские развивают свое наступление. Значение успеха, достигнутого Красной Армией, заявляет Патрик Лейси, невоз- можно преувеличить, ибо как Витебск, так Жлобин представляли собой сильно укрепленные узлы сопротивления против- ника. Обозреватель напоминает, что, когда 1941 году гитлеровцы захватили Ви- тебск, они хвастливо кричали о том, что ими сломлена последняя линия обороны русских и что-же перед германской армией нет больше никаких искусственных или естественных препятствий на пути в Мо- скву. До последнего времени немцы при- давали большое значение Витебску, но уже как мощной крепости своей обороны. Они называли Витебск краеугольным кам- нем германской обороны. Красная Армия, развивая достигнутый ею успех, сломила сопротивление немецкой армии в Витебске, превращенном немцами в крепость их обо- роны.	vol-5832-page-04-seg-007-0890-0623-1554-1481.png
5832	4	225	1556	1535	1664	11	0.95354	митинг в лондоне по случаю третьей годовщины ОТЕЧЕСТВЕННОЙ ВОЙНЫ СОВЕТСКОГО СОЮЗА	vol-5832-page-04-seg-008-0225-1556-1535-1664.png
5832	4	207	1683	873	2162	69	0.96229	ЛОНДОН, 27 июня. (ТАСС). По случаю третьей годовщины Отечественной войны Советского Союза 25 июня в Лондоне в театре «Столл» состоялся митинг, органи- зованный Национальным советом антло- советского единства. Председательствовал на митинге член парламента Притт. С ре- чами выступили председатель Националь- ного совета англо-советского единства Уотерхаус, писатель Стронг, председатель- ница лондонского кооперативного общест- ва Генли, секретарь национального союза моряков Джармэн и профессор Леви. Ораторы отметили в своих речах ту ог-	vol-5832-page-04-seg-009-0207-1683-0873-2162.png
5832	4	883	1685	1550	1875	35	0.95949	ромную роль, которую играет СССР в борь- бе против фашистских варваров, и призы- вали к укреплению дружбы между рус- ским и английским народами не только . в период войны, но также и в мирный период.	vol-5832-page-04-seg-010-0883-1685-1550-1875.png
5832	4	890	1877	1552	2160	42	0.98315	После митинга оркестр исполнил ряд произведений советских композиторов, в том числе произведения Мясковского и Глиэра. C приветствиями, обращенными молодежи и народу Советского Союза, выступили представители английской моло- дежи и молодежи других союзных стран. Детский хор исполнил на английском языке популярные советские песни.	vol-5832-page-04-seg-011-0890-1877-1552-2160.png
5832	4	269	2231	1494	2271	6	0.96576	ЦЕННЫЕ БУМАГИ ХЕЛЬСИНКИ ПЕРЕВЕЗЕНЫ В СТОКГОЛЬМ	vol-5832-page-04-seg-012-0269-2231-1494-2271.png
5832	4	209	2294	873	2487	32	0.95732	СТОКГОЛЬМ, 27 июня. (ТАСС). Газета «Вестманландс ленс тидниг" пишет: "24 июня городское управление Хельсинки эвакуировало свои ценные бумаги в Сток- гольм. Эти бумаги будут депонированы в Швеции. Сообщают, что немцы и руково-	vol-5832-page-04-seg-013-0209-2294-0873-2487.png
5832	4	890	2296	1552	2487	27	0.96845	дящие финские фашисты уже составили план эвакуации большого числа финских граждан в Германию. Эта эвакуация будет проведена в случае возникновения ката- строфического положения в результате русского наступления».	vol-5832-page-04-seg-014-0890-2296-1552-2487.png
5832	4	440	2564	1340	2598	5	0.97786	ТРУПЫ ГИТЛЕРОВЦЕВ У БЕРЕГОВ БОСФОРА	vol-5832-page-04-seg-015-0440-2564-1340-2598.png
5832	4	211	2618	873	2772	23	0.93666	СТАМБУЛ, 27 июня. (ТАСС). За по- следнее время к берегам: Босфора тече- нием прибило (и прибывает каждый день) Десятки трупов «эвакуированных» из Се-	vol-5832-page-04-seg-016-0211-2618-0873-2772.png
5832	4	894	2627	1552	2779	24	0.95788	вастополя немецких солдат и офицеров Сотни трупов немцев валяются у черно- морского побережья Турции в районе Зон- гулдак-Синоп и даже в районе Трапе- зунда.	vol-5832-page-04-seg-017-0894-2627-1552-2779.png
5832	4	282	2858	1469	2899	3	0.94738	ДЕКЛАРАЦИЯ ИТАЛЬЯНСКОГО ПРАВИТЕЛЬСТВ	vol-5832-page-04-seg-018-0282-2858-1469-2899.png
5832	4	209	2920	875	3014	16	0.94238	АЛЖИР, 27 июня. (ТАСС). 24 июня в Италии опубликована декларация прави- тельства Бономи, датированная 23 июня.	vol-5832-page-04-seg-019-0209-2920-0875-3014.png
5832	4	207	3033	873	3318	52	0.97099	Констатировал в этой декларации, что «один лишь фашизм повинен в том, что Италия примкнула к тройственному пакту и вступила в войну», совет министров за- являет, что он «отрекается от посяга- тельств фашизма на честь и целостность других наций и порицает агрессию, осу- ществленную фашизмом по отношению к Франции, Греции, Югославии и России».	vol-5832-page-04-seg-020-0207-3033-0873-3318.png
5832	4	209	3337	867	3393	9	0.98583	Совет министров, говорится в деклара ции, ставит себе целью:	vol-5832-page-04-seg-021-0209-3337-0867-3393.png
5832	4	205	3414	871	3630	32	0.97430	«1. Продолжать до окончательного по- ражения гитлеровской Германии войну плечом к плечу с Объединенными нациями, которые вызывают в итальянском народе чувство благодарности за кровь, пролитую ими во время победоносной кампании в Италии.	vol-5832-page-04-seg-022-0205-3414-0871-3630.png
5832	4	207	3649	871	3743	18	0.95626	2. Сделать участие Италии в борьбе и победе более интенсивным, а, следова- тельно, стремиться к более полному, не-	vol-5832-page-04-seg-023-0207-3649-0871-3743.png
