volume_number	page_number	x1	y1	x2	y2	tokens_count	mean_confidence	text	image
5094	3	2560	5192	3136	5438	23	0.95490	Снега не обелят их в долгую зиму Не скрасит их зелень лугов И люди не скажут, что сраму не имут, Презренные трупы врагов.	vol-5094-page-03-seg-028-2560-5192-3136-5438.png
5094	3	2165	5539	2834	5581	4	0.94740	ЦЕННАЯ НАХОДКА НА ФРОНТЕ	vol-5094-page-03-seg-029-2165-5539-2834-5581.png
5094	3	1823	5593	2486	5969	53	0.95916	ЛЕНИНГРАДСКИЙ ФРОНТ, 5 февраля (По телеграфу). После очищения от про тивника одного населенного пункта часть где комиссаром тов. Уваров, приступила в оборонительным работам, чтобы закрепить собой занятый рубеж. Отрывая оконы в районе командного пункта. танкисты этой части лейтенант Крюков. младший сержант Гусарев и старшина Гурьев на- шли много ценностей в склепе давно по-	vol-5094-page-03-seg-030-1823-5593-2486-5969.png
5094	3	2512	5597	3172	5917	43	0.95434	хороненного морского офицера Николая Мироновича. B числе ценностей имеются золотые монеты царской чеканки на 1070 руб- лей, серебряные монеты на 235 рублей золотые браслеты и брошки с драгоцен- ными камнями, обломки серебряной посу- ды. Свою находку танкисты слали в фон строительства танковой колонны.	vol-5094-page-03-seg-032-2512-5597-3172-5917.png
5094	3	2660	5935	3122	5969	3	0.94668	Старший политрук стома	vol-5094-page-03-seg-033-2660-5935-3122-5969.png
5094	3	3607	2316	4185	2412	2	0.93022	В снегах	vol-5094-page-03-seg-034-3607-2316-4185-2412.png
5094	3	3230	2450	3891	2660	34	0.95743	Снега, снега... Они устилают поля бес крайней пеленой, ослепительно белой при свете солица, дынной и голубой в ночном сиянии звезд. Лес тоже в снегу: огромные бугры под соснами, свесившими свои тя- желые, обледенелые лапы.	vol-5094-page-03-seg-035-3230-2450-3891-2660.png
5094	3	3226	2670	3889	2842	28	0.95443	Юлии снежный бугор на опушке покры бойными ветвями. Подобно другим, он ка- жется застывшим, безжизненным. На пс ночам из его глубины, из его глинистых темных недр вьется дымок.	vol-5094-page-03-seg-036-3226-2670-3889-2842.png
5094	3	3228	2850	3887	3242	55	0.95148	Это землянка. Она очень мала. Крохот ные сосновые полати едва умещаются ней. Печка стоит в углу, неподалеку от табурета, на котором находится ящик по- ходного телефона. День и ночь возле те лефона сидит кто-нибудь из обитателей землянки. Через строго определенный про- межуток времени раздаются негромкие слова условных позывных сигналов: «Глобус!» «Глобус!» Говорит «Ко- ра»... Проверка.	vol-5094-page-03-seg-037-3228-2850-3887-3242.png
5094	3	3220	3250	3881	3603	50	0.95937	Это промежуточная контрольная станция связистов. Она размещена между двумя командными пунктами, в зоне обстрела где часты повреждения проводов. Вместе с настунаюшими частями обитатели ее по- степенно перемещаются на запад. Они именуются линейными надсмотрщиками Это их белые балахоны висят на сучке вбитом в глинистую стену землянки, их лыжи стоят в углу.	vol-5094-page-03-seg-038-3220-3250-3881-3603.png
5094	3	3216	3611	3879	4504	131	0.95553	Работа надсмотрщиков трудна. Днем ночью проверяют они исправность линии если линия повреждена, спешат снова наладить ее --- пусть это будет в снеж- ный буран, когда за два шага не вплн ни зги, пусть под ураганным огнем Надсмотрщиков 1вое. Олин --- молотой высокий, весельчак, говорун. Он москвич любит рассказывать о Москве, об улицах, троллейбусах, катках, парках Другой сибиряк, коренастый, низк9 рослый. с пушистыми усами. делающими его старше и солиднее, чем он есть на самом деле. Эти снега, скованные ледяных дыханием зимы, эти ясные, солнечные холодные дни, эти белые поля без доро- ги ему по Пройдя километров на лыжах по жестокому морозу, ок только похлопывает рукавицами: 0х, добрый морозец! Он любит петь и иногда по вечерам. мастеря что-нибудь, тихонько напевает. Поет он старинные сибирские песни, гроз- ные своей мощью, исполненные мужест- венной силы.	vol-5094-page-03-seg-039-3216-3611-3879-4504.png
5094	3	3208	4514	3871	5086	79	0.95534	"Эх, да разлилась, растеклась сестр. наша Ангара. Раскидалася ключевой водой..." Фамилия его Сазонов. Неделю назад случилось с Сазоновых приключение. Вот как это произошло. Связь была нарушена. Сазонов поше. ее исправлять. Была вьюжная. бурная почь. Выйдя из землянки, Сазонов остано- вплся: удар ветра едва не сбил его с пог. Темнота. Молодая луна иногда просачива лась сквозь тучи. бросая быстрый, мгли- стый свет, и опять исчезала. Сазонов на лыжах вперед в темноту, держа в руках конец провода служивший ему путеводной нитью.	vol-5094-page-03-seg-040-3208-4514-3871-5086.png
5094	3	3204	5096	3867	5304	35	0.96405	Так он прошел лес и спустился в овраг Это был голый овраг, на дне которого вил ся санный путь накатанная тверла горога. Ветер. вздымая тучи спега, полу ват оврат насквозь, словно дтинный тем- ный коридор,	vol-5094-page-03-seg-041-3204-5096-3867-5304.png
5094	3	3913	2448	4580	2976	82	0.96326	Здесь-то и обнаружил Сазонов добрые провода. Наклонившись, стал чинить B это время на него сзади набросились двое немцев. Это была засада: немецкие разведчики перерезали провод и засели в овраге, вы житая, когда подойдет для починки свя зист. Они хотели взять в плен связиста в качестве «языка». Сазонова сразу прижали к земле. Вин товка, выбитая из рук, печезла в снегу- Оба немца сидели на Сазопове, ссыпая его ударами, стараясь разбить ему лицо. левую руку они скручивали за спину и шарили в темноте правую.	vol-5094-page-03-seg-042-3913-2448-4580-2976.png
5094	3	3911	2984	4576	3194	35	0.95170	Но Сазонов не давался, обороняя пра- вую руку - следственное свое оружие Ему удалось, наконец, изо всей силы ударит бить локтем в переносицу одного немца который, разгорячась, наклонился если шком низко. Немец обмяк и свалился.	vol-5094-page-03-seg-043-3911-2984-4576-3194.png
5094	3	3907	3204	4578	3449	38	0.95791	Тогда, пользуясь секундным замеша- тельством, Сазонов сбросил с себя второго немца и встал. Немен вскинул автомат но Сазонов выбил оружие из его рук. Он сцепились в рукопашную, обхватив друг друга, задыхающиеся от морозного ветра от свистящих снежных вихрей.	vol-5094-page-03-seg-044-3907-3204-4578-3449.png
5094	3	3905	3459	4574	3735	50	0.95836	Некоторое время они топтались на одном месте, потом в пылу борьбы сошли с до- роги и провалились по плечи в снег. Луна зашла, стало совсем черно. Снег залепил. им глаза, уши, носы, они беспомощно ба- рахтались в этом снежном месиве. В конце концов они потеряли друг друга в тем- ноте	vol-5094-page-03-seg-045-3905-3459-4574-3735.png
5094	3	3909	3749	4570	3959	36	0.96053	Когда Сазонов выбрался на дорогу, то ослепленный ветром и снегом, в первое время он ничего не видел. Он увидел снегу, падал, вставал, опять увязал. Все же в конце концов выбрался. Нашел одну лыжу, потом лыжную палку.	vol-5094-page-03-seg-046-3909-3749-4570-3959.png
5094	3	3897	3969	4568	4742	132	0.96417	Поползав еще с полчаса по дороге, Сазо- пов нашел, наконец, и винтовку, по вто руб лыжу так не сыскал. Тогда он решил вернуться к себе в землянку не лыжной, а кружной проезжей 1орогой II еще решил захватить «языка». Взва лив на плечи первого немца, который все недвижно лежал с окровавленным ли- цом после нанесенного vipa, связист отправился в путь. Пройдя немного, он вспомнил, что не починил провода все было как бы в полусне, в полубреду после этой чудовищной схватки. Сазонов возвра тился. положил немца на снег и стал искать прово1. Но никак не мог найти: зги не видать, позёмка. черная ночь. шарил по юроге, слепо тычась в снегу: в пылу борьбы он потерял даже фонарик. Наконец. нашел место обрыва, починил провол и сообщил в штаб о пропешелшем. Отгула выслали отряд, который забрал	vol-5094-page-03-seg-047-3897-3969-4568-4742.png
5094	3	3897	4758	4560	5004	38	0.96405	Все это рассказывает нам теперь песня сам Сазонов, а его напарник. веселый мос- квич Темкин. Мы сидим возле печки. Сазо- нов пюолаль чинит аппаратуру развинчи- влет, подкручивает. Спокойный, широко плечий. он мурлычет песню в свои густые русые усы:	vol-5094-page-03-seg-048-3897-4758-4560-5004.png
5094	3	3899	5012	4546	5266	25	0.93505	"Эх, ла велика Ангара. а еще больше Объ, р- А еще больше, да краше Anvp- река...». Великие реки, необозримые земли. могу чай, непобедимый народ! Габрилович	vol-5094-page-03-seg-049-3899-5012-4546-5266.png
5094	3	3923	5270	4253	5304	2	0.91745	ЗАПАДНЫЙ ФРОНТ	vol-5094-page-03-seg-050-3923-5270-4253-5304.png
5094	3	3507	5366	4237	5416	5	0.90945	НОВЫЙ НОМЕР - "ФРОНТ ИЛЛЮСТРИРТЕ"	vol-5094-page-03-seg-051-3507-5366-4237-5416.png
5094	3	3200	5426	3863	5981	64	0.94381	Вышел третий номер «Фронт иллюст- рирте» пллюстрированной газеты, пз даваемой для немецких солдат. На первой странице --- удачно выпал- непный Фотомонтат, посвященный пе ожиданной "эпидемии" гитлеровской генеральном штабе. Гиммлер рапортует Гитлеру: «О "Осмелюсь доложить: генера. Рейхенау умер от удара. Браухич пол- версия опера пип. Гудернан болен воспа- лением легких. Лист также лечится. 0с- тальные находятся под моим наблюде- энем". Тут же изображено, как гестапов-	vol-5094-page-03-seg-052-3200-5426-3863-5981.png
5094	3	3893	5436	4554	5513	6	0.93033	пы расправляются с немецкими генера- лами.	vol-5094-page-03-seg-053-3893-5436-4554-5513.png
5094	3	3887	5519	4558	5985	56	0.94740	В номере опубликована карта. показы- бающая планомерное продвижение Крас ной Армии на запад. На карте обозначе ны важнейшие города и железнодорожные пентры на ближних и дальних подступах 5 Москве, очищенные от врага. В номере содержится фото, а также ряд остроумных карикатура, посвященных сбору теплых вещей и другим кампаниям, проведенных за последнее время в фа- шистской Германии	vol-5094-page-03-seg-054-3887-5519-4558-5985.png
5094	4	2111	348	2696	384	9	0.90880	Р А С Н А Я 3 В ДА	vol-5094-page-04-seg-001-2111-0348-2696-0384.png
5094	4	3651	348	4382	382	8	0.90293	февраля 1942 г., пя ница. № 30 (5094)	vol-5094-page-04-seg-002-3651-0348-4382-0382.png
5094	4	472	446	1577	614	10	0.94151	Иранская печать о союзном договоре между CCGP, Великобританией и Ираном	vol-5094-page-04-seg-003-0472-0446-1577-0614.png
5094	4	348	632	1014	1753	147	0.95960	ТЕГЕРАН, 5 февраля. (ТАСС). Газета "Пран" поместила передовую статью, по- священную подписанию союзного догово- между СССР, Великобританией и Ира- "Подписание этого договора, --- гово- рется в статье, открывает новую гла- ву во взаимоотношениях между Раком и соседями --- СССР Англией. Договор репляет связь Ирана с этими странами большей степени, чем раньше". Представители СССР и Англии прояви- период ведения переговоров за- учении договора, добрые намерения. Это показателем того, что и правительства, мужественно борющие- за обеспечение свободы п упрочение стов демократии в мире, воодушевлены галими же намерениями. Газета «Эттелаат» в передовой статье, священной заключению союзного догово- указывает, что «дружественные речи, произнесенные на приеме в министерстве иностранных дел советским послом и бри- греческим посланником, получили благо- ятный отклик у иранского обществен- мнения, так как эти речи не только твердили положения первой статьи до- обора относительно территориальной це- тности, политической независимости и суверенитета Ирана, но показали также намерения, которые питают к	vol-5094-page-04-seg-004-0348-0632-1014-1753.png
5094	4	1034	640	1697	1367	112	0.96402	иранскому народу правительства двух дру жественных держав". «Посол Советского Союза, продолжает газета, - процитировал следующую фра- зу из последней речи руководителя совет- ского правительства: «У нас нет и не может быть таких полей войны, как за- хват чужих территорий, покорение чужих народов, все равно, поет ли речь о наро- дах и территориях Европы ими о народах и территориях Азии. в том числе Прана». Совершенно очевидно, что эти слова яв- ляются историческим и официальным ак- том, который блестяще раскрывает суще- ство внешней политики соседнего и дру- жественного Прану государства, актом, ко- торый подтверждает, что руководители этой державы не ставят себе никаких це- лей, могущих нанести ущерб нашей тер- риториальной целостности и независимо- сти».	vol-5094-page-04-seg-005-1034-0640-1697-1367.png
5094	4	1028	1373	1689	1753	57	0.96756	Газета отмечает, что английский пос- ланник также заявил, что «намерения со- юзников ясно изложены в договоре и ни- что, выходящее за рамки этого договора, в намерения союзников не входит». Таким образом, заявляет в заключение газета, все недоразумения, которые могли возникнуть между нами, повезли навсегда. Теперь отношения между тремя держава- ми базируются на принципах дружбы и взаимного уважения.	vol-5094-page-04-seg-006-1028-1373-1689-1753.png
5094	4	554	1821	1477	1881	4	0.94102	Уныние в фашистской Германии	vol-5094-page-04-seg-007-0554-1821-1477-1881.png
5094	4	336	1901	998	2364	66	0.95413	Нью-порк, 5. февраля. (ТАСС). Коррес- дент американской радиовещательной компании Нейшенал Дрейер, покинувший берлин за несколько дней до японского на падения на Перл Харбор, сообщает о да ьнейшем ухудшении морального состоя- населения Германии в связи с огром- потерями на советско-германском онте и понижением жизненного уровня населения. Дрейер заявляет, что в Гериа- нет почти ни одной семьи, которая потеряла бы на фронте кого-либо. Германская пропаганда не в состоянии	vol-5094-page-04-seg-008-0336-1901-0998-2364.png
5094	4	1020	1909	1685	2360	64	0.96655	скрыть огромных потерь армии. Раненые солдаты, возвращающиеся с фронта, рас- сказывают о действительном положении дел. Террор гитлеровцев свирепствует со все возрастающей силой. Дрейер сообщает, что концентрационные лагери в Германии переполнены. В Берлине ежедневно просто- ходит много самоубийств. Продовольствен- ное положение в Германии также все более ухудшается. Все это порождает среди насе- ления настроения пессимизма и уныния православная усиливает враждебное отношение к гитле- ровским насильникам.	vol-5094-page-04-seg-009-1020-1909-1685-2360.png
5094	4	616	2424	1431	2458	5	0.97281	эпидемия сыпного тифа в германии	vol-5094-page-04-seg-010-0616-2424-1431-2458.png
5094	4	354	2478	994	2622	18	0.95274	Нью-йорк, 5 Февраля. (ТАСС). Как общает бернский корреспондент агентства ассошиэйтед Пресс, германский "руководи- ль здравоохранения» Конти заявил, что	vol-5094-page-04-seg-011-0354-2478-0994-2622.png
5094	4	1016	2482	1679	2620	20	0.95735	в Германии зарегистратрованы сотест слу- чаев заболевания сыпным тифом. Сыпно- тифозная эпидемия свирепствует также в оккупированной Польше и в Прибалтике.	vol-5094-page-04-seg-012-1016-2482-1679-2620.png
5094	4	570	2678	1439	2742	4	0.96201	Гитлеровский террор в Польше	vol-5094-page-04-seg-013-0570-2678-1439-2742.png
5094	4	326	2760	992	3419	90	0.95883	НЬЮ-ЙОРК, 5 февраля. (ТАСС). Как сообщает лондонский корреспондент агент- ства Оверсиз Ньюс, тестало об авито, что января были казнены 22 польских железнодорожника в Жакова Воля за "сп- автоматическую преднамеренную порчу уничтожение германских военных грузов". Одна поляк был расстрелян за антигерман- саботаж на железной дороге во время затемнения. Сообщают, что на станции Роспржа было организовано столкновение германских поездов, в результате которого было разбито 27 вагонов. В Рад- доме сожжены оружейный завод и пред- назначавшийся для германских чиновников отель «Лодзь». В Тарнове была взорвана фабрика, в Познани сожжен германский военный склад одежды.	vol-5094-page-04-seg-014-0326-2760-0992-3419.png
5094	4	330	3425	988	3577	22	0.93997	Оккупационные Власти расклеим По всей Польше об явления с предупрежде- ином, что все лица не немецкого пропс- рождения будут расстреливаться, если не	vol-5094-page-04-seg-015-0330-3425-0988-3577.png
