volume_number	page_number	x1	y1	x2	y2	tokens_count	mean_confidence	text	image
5094	1	1088	170	2328	370	3	0.91809	Смерть немецки оккупантам.	vol-5094-page-01-seg-001-1088-0170-2328-0370.png
5094	1	468	390	2422	706	7	0.97869	ЦЕНТРАЛЬНЫЙ ОРГАН НАРОДНОГО КОМИССАРИАТА ОБОРОНЫ СОЮЗА ССР	vol-5094-page-01-seg-002-0468-0390-2422-0706.png
5094	1	466	762	2503	828	9	0.91659	30 (5094) 6 февраля 1942 г., пятница ЦЕНА 15 КОП.	vol-5094-page-01-seg-003-0466-0762-2503-0828.png
5094	1	2600	308	4522	780	26	0.96170	Красная Армия и весь наш многомиллионный народ полны огненной ненависти и жаждут беспощадного отмщения за кровь и запусленные жизни советских граждан. Немецко-фашистские бандиты недут от возмездия!	vol-5094-page-01-seg-005-2600-0308-4522-0780.png
5094	1	480	890	1767	1177	5	0.97366	Трагедия в деревне Дуб дубовцы	vol-5094-page-01-seg-007-0480-0890-1767-1177.png
5094	1	448	1189	1117	2252	141	0.95098	Нам сообщают с Северо-Западного фрон- та: уходя из деревни Дубовцы, немцы на- сильно увели за собой все население. Когда фронт приблизился к деревне, не- мецкий комендант приказал согнать к таблице всех детей и об'явил: "Тот, кто останется в деревне после восьми ча- сов, будет расстрелян. Идти на Запад. пути беспрекословно подчиняться не- мецким солдатам, которые будут сопро- вождать население». По снежной, завьюженной дороге петя- Нулась вереница страдальцев. Теплую одежду давно забрали оббупанты, - все шли одетые в легкое платье. У большин- ства женщин на руках были дети. Когда добрели до ближайшего села, уже наступила ночь, Несмотря на это, людей погнали дальше, не дав ни отдохнуть, ни обогреться. Многие стали падать один за другим. Угрожая оружием, немцы гнали остальных вперед. Целью семьи замерзали в пути. У одной деревни остались в сне- гу трупы крестьянина Василия Яковлеви- ча Загустого, его жены и ребенка.	vol-5094-page-01-seg-008-0448-1189-1117-2252.png
5094	1	446	2254	1109	2714	56	0.94900	От села к селу, от деревни к деревне двигалась страшная процессия. На место павших сгоняли жителей новых селений, попадавшихся на пути. Всех, кто уцелел от этого смертного похода. поставили на тяжелые работы. Им прочитали приказ: "Германское командование предупреждает, что отказ работать будет караться смерт- ной казнью через повешение». Пленников спасло лишь стремительное продвижение частей Красной Армии.	vol-5094-page-01-seg-009-0446-2254-1109-2714.png
5094	1	442	2722	1113	3010	29	0.95795	Чудовищные зверства немцев на совет- ской земле вызвали негодование всего ци- вилизованного мира. Казалось, предел преступления достигнут, мера изуверства превзойдена. Но чтопстине гнусной изоб- ретательности гитлеровских мерзавцев нет гранит,	vol-5094-page-01-seg-010-0442-2722-1113-3010.png
5094	1	442	3020	1111	3643	74	0.95658	Отступая под натиском Красной Армии, немцы насильно уводят за собой населе- ние. Надо представить себе, с каким зата- енным и радостным трепетом ожидают ос- вобождения от немедкого ига советские люди. Ограбленные, измученные без- мерными издевательствами, поминутной угрозой смерти, они прислушиваются приближающимся раскатам орудий- ного грома. Светлая надежда озаряет ис- страдавшиеся души. Близость избавления согревает застывшие сердца. И когда уже вот-вот приходит желанная свобода, грубый немецкий приклад выталкивает женщин, детей и стариков из родных изб	vol-5094-page-01-seg-011-0442-3020-1111-3643.png
5094	1	1149	1191	1789	1273	12	0.94531	на мороз. Солдаты гонят население в не мецкий тыл, в мрак рабства.	vol-5094-page-01-seg-012-1149-1191-1789-1273.png
5094	1	1133	1283	1797	2646	168	0.95641	этом неслыханном надругательстве над населением явственнее, чем когда бы то ни было, проявился отвратительный са- дизу гитлеровцев. Они упиваются страда- ниями невинных жертв. Чувствуя свою гидель, немцы тянут за собой в могилу мирных советских людей. Они угоняют, словно скот, тысячи жителей из остав- ляемых фашистскими войсками деревень. В древние времена, междоусобных распрях диких племен, победители угоня- ли в рабство пленных, уводили женщин. Но тогда человечество стояло еще на низ- кой ступени развития. Оно не знало меж- дународного права, узаконенных норм войны. Рабство было тогда обычным и распространенным явлением. Гитлеровцы превзошли своей жестокостью древних варваров. В двадцатом веке, в цивилизо- ванной Европе они возродили и стократ умножили ужасы военно-рабовладельче- ского строя. Даже не на правах победи- телей, какие уж немцы победители после поражений под Ростовом, Калинином, Москвой! просто пользуясь беспо- мощностью женщин, стариков и детей, бандиты угоняют в глубь своего тыла со- ветское население. Они подвергают мучи- тельной казни советских патриотов. Пуб- ликуемые сегодня в "Красной звезде" фо- тодокументы --- это еще один обвинитель- ный акт против гитлеровских зверей.	vol-5094-page-01-seg-013-1133-1283-1797-2646.png
5094	1	1139	2662	1793	2998	42	0.95002	Трусливые шакалы, лязгая зубами от страха и холода, пьют кровь наших людей. На мирном населении гитле- ровцы срывают свою злобу, свою боязнь погибнуть в русских снегах. Они хотят оставить за собой пустыню. на костях на ших людей построить свои оборонитель- ные рубежи.	vol-5094-page-01-seg-014-1139-2662-1793-2998.png
5094	1	1133	3010	1795	3427	50	0.95443	Быстрее вперед, блины Красной Ар- мии! Пусть священное пламя мести зажжет ваши сердца. Немецко-фашист- ские бандиты не уйдут от возмездия. Вырвем из рук гитлеровцев наших отцов натерей, братья и сестер. На салоне оккупированных немцами районов ждет нас, своих освободителей. Спасем от фа- шистского рабства и смерти тысячи совет- ских граждан!	vol-5094-page-01-seg-015-1133-3010-1795-3427.png
5094	1	1137	3443	1789	3637	25	0.94955	На наших знаменах горят сталинские слова: «Смерть немецким оккупантам!» Кровавые фашистские собаки ответят го- ловой за все злодейства, за кровь и стра- тания советских людей	vol-5094-page-01-seg-016-1137-3443-1789-3637.png
5094	1	652	3713	1603	3839	7	0.92987	Собрание партийного актива частей московской истребительной авиации	vol-5094-page-01-seg-017-0652-3713-1603-3839.png
5094	1	444	3857	1105	3995	13	0.96499	Вчера состоялось собрание партийного актива соединения московской истреби- тельной авиации противовоздушной обо- роны.	vol-5094-page-01-seg-018-0444-3857-1105-3995.png
5094	1	438	3997	1105	5184	170	0.96342	С докладом об итогах боевой и полити- ческой работы частей ва период войны и дальнейших задачах партийной органи- запии выступил комиссар соединения бригадный комиссар Чернышев. Докладчик подробно рассказал активу роли московской истребительной авиа- ции в отражении фашистских налетев на столицу и ее боевой деятельности по на- земным войскам противника во время на- ступления немцев, а затем при их отходе и преследовании. Переходя освещению деятельности отдельных частей, докладчик подробно остановился на работе части, где комис- саром тов. Маренков. По инициативе пар- тийного бюро здесь хорошо организован обмен боевым опытом, проведены техниче- ские конференции по вопросам эксплуа- тации и ухода за материальной частью. Летчики этой части, основном ком- мунисты и комсомольцы, сбили под Мо- сквой 72 фашистских самолета, потеряв при этом лишь семь своих машин и че- тырех летчиков. 68 фашистских стервятников уничто- жено воздушными бойцами части. где ко- миссаром тов. Недритайлов. Партийная ор- ганизация этой части проделала большую работу по выращиванию боевого актива восстановлению самолетов, поврежден- ных в схватках с противником. В обеих этих частях хорошо налаже- на партийно-политическая работа. Комму-	vol-5094-page-01-seg-019-0438-3997-1105-5184.png
5094	1	1127	3855	1787	5182	193	0.96242	нисты являются здесь подлинными вожа- бами масс. Иначе обстоит дело в части, где ко- миссаром тов. Басович. Секретарь партий ной организации тов. Васильев мало бы- вает на старте и в подразделениях. Пар- тийные поручения коммунистам он рас- сылает с помощью записок и пр. В ре- зультате такого стиля работы партийного бюро боевые итоги в этой части значи- тельно ниже, чем в других. Партийные организации частей значи- тельно выросли за счет лучших летчи- ков и авиационных техников. Однако, в организациях имеется еще немало канди- датов с просроченным стажем. Активно прошло обсуждение доклада тов. Чернышева. Первым выступил секре тарь партийной организации N части по литрук Зима. Он рассказал о том, что только за время войны парторганизация этой части выросла больше чем на 60 человек за счет летчиков и техников, от- личившихся в боях с немецкими окну пан- тами. Старший политрук Пушкарский в сво- ем выступлении указал на медлительность отдела кадров штаба соединения в пред- ставлении командиров к очередным во- енным званшям. В работе партийного актива приняли участие член Военного Совета Московско- го военного округа дивизионный комис- cap Телегин, бригадный комиссар Орлов, генерал-майор авиации Климов и другие. Партийный актив принял приветствие Народному комиссару обороны товарищу Статину,	vol-5094-page-01-seg-020-1127-3855-1787-5182.png
5094	1	654	5228	1529	5340	9	0.97062	ВРУЧЕНИЕ ОРДЕНОВ И МЕДАЛЕЙ партизанам в тылу у немцев	vol-5094-page-01-seg-021-0654-5228-1529-5340.png
5094	1	434	5360	1099	6037	83	0.94930	На-днях на территории, временно оккупированной немцами, в тылу герман- ской армии, состоялось вручение орденов медалей партизанам, награжденных приказом Военного Совета Северо-Запад- ного фронта. Старший батальонный комиссар Тужи- ков, прибывший в расположение парти- занских отрядов на самолете, по пору- чению Военного Совета вручил высокие награды родины народным мотителям, отличившимся в борьбе с фашистскими захватчиками. Орден Красного Знамени был вручен партизану тоб. Р. - смелому и отваж- ному советскому патриоту, взорвавшему на важных коммуникациях германской армии большое количество мостов. Орден Красной Звезды постучит старый рабочий	vol-5094-page-01-seg-022-0434-5360-1099-6037.png
5094	1	1119	5358	1779	6035	98	0.96275	тов. И., истребивший бремя набегов партизанского отряда на немецкие гарни- зоны десятки фашистских бандитов. За- тем ордена медали были вручены дру- гим народным мстителям, награжденным за доблесть и мужество, проявленные в с немецкими оккупантами. C ответным словом от имени награж- денных выступил тов. П. Устами старо- го рабочего партизаны поклялись перед родиной бить врагов до тех пор, по- на не будет истреблен последний акку- пант, вступивший на нашу землю. Воодушевленные заботой и вниманием родины, партизаны на второй день после вручения орденов приступили к выпол яению важной боевой операции и у од- ного из городов уничтожили 475 фа- шистов	vol-5094-page-01-seg-023-1119-5358-1779-6035.png
5094	1	1955	878	3725	970	3	0.97089	от советского информбюро	vol-5094-page-01-seg-024-1955-0878-3725-0970.png
5094	1	2328	978	3369	1052	5	0.89560	Уто Утреннее сообщение 5 февраля	vol-5094-page-01-seg-025-2328-0978-3369-1052.png
5094	1	1825	1066	2484	1201	16	0.95442	B течение ночи на 5 февраля наши войска продолжали вести активные боевые действия против немецко-фашистских Войск.	vol-5094-page-01-seg-026-1825-1066-2484-1201.png
5094	1	1825	1203	2482	1403	31	0.93955	Наши корабли в Баренцевом море по топили три транспорта противника общим водоизмещением не 8.800 тонн, как об этом было указано в сообщении Информ- бюро 2 февраля, а 14.800 тонн. * *	vol-5094-page-01-seg-027-1825-1203-2482-1403.png
5094	1	1821	1421	2482	1907	72	0.95448	Наши бойцы под командованием т. Се- лезнева (Западный фронт), преодолев обо- ронительные рубежи противника, заняли 6 населенных пунктов. Только в бою за деревню Д. враг потерял 70 соллат офицеров и бросил 4 орудия. На другом участко немцы пытались контратаковать одну нашу стрелковую часть. Командир артиллерийского подразделения Александр Васильевич Чапаев сын знаменитого полководца - открыл по врагу ураганный артиллерийский огонь. Противник поте- рял около 100 солдат и офицеров и об- ратился в бегство.	vol-5094-page-01-seg-028-1821-1421-2482-1907.png
5094	1	1819	1947	2480	2216	45	0.95296	Наши части, действующие на отдель- ных участках Калининского фронта, в те чение одного дня освободили 5 населен- ных пунктов и уничтожили 27 немецких танков, 5 орудий и 8 пулеметов. Немцы потеряли во время этих операций убиты- ми и ранеными 5.200 солдат и офицеров. * *	vol-5094-page-01-seg-029-1819-1947-2480-2216.png
5094	1	1821	2236	2480	2498	36	0.95544	Наша часть, действующая на одном из участков Ленинградского фронта, за один день разрушила 27 дерево-земляных огне- вых точек, уничтожила 6 пулеметов 3 миномета противника. На поле боя осталось свыше 400 убитых немецких солдат и офицеров. *	vol-5094-page-01-seg-030-1821-2236-2480-2498.png
5094	1	1861	2522	2480	2552	6	0.92292	Отвагу мужество в бою с немецкими	vol-5094-page-01-seg-031-1861-2522-2480-2552.png
5094	1	2506	1062	3162	1307	35	0.95693	оккупантами проявил летчик лейтенант Бочаров. Самолет тов. Бочарова атаковали три немецких истребителя. В воздушном бою отважный летчик сбил два немецких самолета, а третью машину повредил. Са- молет тов. Бочарова благополучно вернул ся на свою базу.	vol-5094-page-01-seg-032-2506-1062-3162-1307.png
5094	1	2504	1355	3162	1875	71	0.95128	Отважно действует в тылу немецких отряд орловских партизан по командованием тов. М. Вот краткие запи- си о боевых действиях этого отряда: «Гру "Группа подрывников во главе с тов 4. взорвала мосты на дороге, по которой неуцы подвозили к фронту боеприпасы уничтожила связь между крупными населенными пунктами, оккупированными гитлеровцами. Группа партизан под командованием тов. В. напала на фашистский обоз, пере била охрану и захватила 13 подвод различными вещами, награбленными у местного населения.	vol-5094-page-01-seg-033-2504-1355-3162-1875.png
5094	1	2504	1881	3160	2085	28	0.96167	В 1вухлневном бою отряд захватил немцев два населенных пункта. Попытки гитлеровцев отбить селения у партизан не увенчались успехом. Фашисты потеря- ли много своих солдат убитыми и ране ными».	vol-5094-page-01-seg-034-2504-1881-3160-2085.png
5094	1	2504	2091	3170	2552	72	0.96030	За короткое время боевых действий отряд тов. М. перебил 149 немецких сол- дат и офицеров, уничтожил 5 автомашин 3 цистерны с бензином, взорвал 19 мостов. Захвачено у врага 31 винтовка, 2 пулемета, 16.000 патронов, один ми- номет, 4 автомата, 2 радиоприемника, 13 повозок и другое военное снаряжение. * Солдат 2 роты 6 мотопехотного баталь- она 6 немецкой танковой дивизии Виль- гельм Маассен 19 декабря был послан на советско-германский фронт. Его взяли в	vol-5094-page-01-seg-035-2504-2091-3170-2552.png
5094	1	3186	1062	3847	1535	71	0.95726	плен в одном населенной пункте, куда он прибыл вместе со своим подразделение на подкрепление немецкого гарнизона Маассен сообщил: «6 танковая дивизия лишилась всех своих танков и теперь действует как пехотное соединение. Сол- даты очень устали, они осуждают бойну и уже утратили уверенность в благопри- ятном исходе войны для Германии. В Гер- мании никто не осмеливается открыть выступать против Гитлера, но, пока тай- ком, люди выражают свое возмущение его разбойничьей политикой». *	vol-5094-page-01-seg-036-3186-1062-3847-1535.png
5094	1	3186	1559	3843	1769	34	0.94616	B неотправленном письме к своему брату лейтенанту Вальтеру Трой немец- кий ефрейтор Трой писал: "Морозы дохо дет здесь до 30 градусов. Больше поло вены солдат обморозили ноги. В ши дово дят нас до исступления».	vol-5094-page-01-seg-037-3186-1559-3843-1769.png
5094	1	3186	1815	3845	2125	45	0.95122	Гитлеровские бандиты сожгли селе Кшень Советского района Курской об. та- сти. Всего сгорело 114 домов. Немецкие солдаты не разрешали зрителям тушите пожар, расстреливая всех, кто попадался им на глаза. Бандиты тяжело ранили 2-летнего ребенка Атановой А. 3. когда она спасала своего сына из горящего дома.	vol-5094-page-01-seg-038-3186-1815-3845-2125.png
