volume_number	page_number	x1	y1	x2	y2	tokens_count	mean_confidence	text	image
5628	1	688	91	876	148	2	0.72960	4. 3.	vol-5628-page-01-seg-001-0688-0091-0876-0148.png
5628	1	988	203	2178	265	3	0.96351	Смерть немецким оккупантам.	vol-5628-page-01-seg-002-0988-0203-2178-0265.png
5628	1	278	292	2229	646	7	0.95948	ЦЕНТРАЛЬНЫЙ ОРГАН НАРОДНОГО КОМИССАРИАТА ОБОРОНЫ СОЮЗА ССР	vol-5628-page-01-seg-003-0278-0292-2229-0646.png
5628	1	286	664	2334	737	10	0.94931	№ 257 (5628) 30 октября 1943 г., суббота ЦЕНА 20 КОП.	vol-5628-page-01-seg-005-0286-0664-2334-0737.png
5628	1	2457	5926	2554	5951	1	0.91922	Пред	vol-5628-page-01-seg-006-2457-5926-2554-5951.png
5628	1	2305	203	4353	685	40	0.94355	Доблестные воины Красной Армии!ждут, как освободителей, миллионы советских людей, изнывающих под немецко-фашистским игом. Крепче бейте врага, истре- бляйте немецких захватчиков. Вперед на Запад, за пол- ное освобождение Советской земли! (Из призывов ЦК ВКП(б) к 26-й годовщине Великой Октябрьской Социалистической Революции).	vol-5628-page-01-seg-007-2305-0203-4353-0685.png
5628	1	723	795	4081	1214	13	0.94769	11 призывы к в к (б) 26-й годовщине Великой Октябрьской - Социалистической Революции	vol-5628-page-01-seg-009-0723-0795-4081-1214.png
5628	1	271	1235	1597	2043	94	0.95419	1. Да здравствует 26-я годовщина Великой Октябрь- ской Социалистической Революции, свергнувшей власть империалистов в нашей стране и провозгласившей мир между народами всего мира! 2. Смерть немецко-фашистским захватчикам, крова- вым поработителям народов Европы, заклятым врагам свободолюбивых народов всего мира! : 3. Товарищи красноармейцы, краснофлотцы и коман- диры, партизаны и партизанки! Защищайте свободу, честь и независимость нашей Родины! Беспощадно уничтожай- те гитлеровских разбойников, очищайте родную землю от ненавистного врага! 4. Привет народам Европы, борющимся против гит- леровского империализма! Патриоты европейских стран, поднимайтесь на вооруженную борьбу за свое освобожде- ние от фашистского ига! Свергайте гитлеровскую тира- нию!	vol-5628-page-01-seg-010-0271-1235-1597-2043.png
5628	1	271	2053	1594	2284	27	0.95782	5. Братья угнетенные славяне! Шире раздувайте пла- мя народной войны против немцев-угнетателей - смер- тельных врагов славянства! Да здравствует вооруженная борьба славянских народов против гитлеровских империя- листов!	vol-5628-page-01-seg-011-0271-2053-1594-2284.png
5628	1	267	2296	1594	2810	56	0.97499	6. Да здравствует победа англо-советско-американ- ского боевого союза над злейшими врагами человече ства - немецко-фашистскими поработителями! Все силы и боевую мощь свободолюбивых народов на быстрейший разгром гитлеровской Германии! 7. Да здравствуют доблестные англо-американские войска, ведущие борьбу против немецких фашистов на территории Италии! 8. Привет летчикам англо-американской авиации, на- носящим удары по жизненным центрам фашистской Гер- мании!	vol-5628-page-01-seg-012-0267-2296-1594-2810.png
5628	1	256	2819	1590	4013	172	0.95202	9. За советскую отчизну идут в бой сыны всех наро- дов Советского Союза. Да здравствует Красная Армия армия братства и дружбы народов СССР! - 10. Доблестные воины Красной Армии! Вас ждут, как - освободителей, миллионы советских людей, изнывающих под немецко-фашистским игом. Крепче бейте врага, истре- бляйте немецких захватчиков. Вперед на Запад, за пол- ное освобождение Советской земли! 11. Отомстим немецко-фашистским извергам за разгра- бление и разрушение наших городов и сел, за насилия над женщинами и детьми, за убийство и увод в немецкое раб- ство советских людей. Смерть немецким мерзавцам! 12. Пехотинцы Красной Армии! Неотступно преследуй- те и истребляйте вражеские войска. Не давайте им закре- пляться на оборонительных рубежах! Окружайте и берите в плен немецких захватчиков, а если откажутся сдаться в плен, уничтожайте их! ------- Да здравствуют советские пехотинцы! 13. Советские летчики-соколы нашей Родины! Беспо- щадно громите врага в воздухе, на земле, на море! Да здравствуют советские летчики! . . . . 14. Танкисты Красной Армии! Крушите и неотступно преследуйте врага! Смелым маневром отрезайте пути от- хода противнику, беспощадно уничтожайте немецких за- хватчиков!	vol-5628-page-01-seg-013-0256-2819-1590-4013.png
5628	1	256	4034	1576	4423	39	0.96374	Да здравствуют советские танкисты! 15. Артиллеристы и минометчики Красной Армии! Мощными огневыми ударами сокрушайте укрепления, узлы и опорные пункты сопротивления врага! Расчищайте путь нашим наступающим войскам, уничтожайте живую силу и технику противника! Да здравствуют советские артиллеристы и миномет- чики!	vol-5628-page-01-seg-014-0256-4034-1576-4423.png
5628	1	256	4429	1575	4609	21	0.96164	16. Краснофлотцы и командиры Военно-Морского Фло- та! Сильнее удары по врагу! Уничтожайте корабли и транс- порты противника, беспощадно истребляйте гитлеровских захватчиков!	vol-5628-page-01-seg-015-0256-4429-1575-4609.png
5628	1	244	4628	1569	5117	63	0.96812	Да здравствуют советские моряки! 17. Кавалеристы Красной Армии! Неустанно преследуй- те вражеские войска, смело и решительно врубайтесь в ря- ды противника, громите его тылы и фланги, беспощадно уничтожайте немецко-фашистских гадов! Да здравствуют советские конники! 18. Разведчики Красной Армии! Смело действуйте в ты- лу у немцев! Обнаруживайте расположение и силы против- ника, разгадывайте его намерения и замыслы! Помогайте нашим наступающим войскам бить врага наверняка!	vol-5628-page-01-seg-016-0244-4628-1569-5117.png
5628	1	1635	1233	2952	1709	52	0.96187	Да здравствуют бесстрашные советские разведчики! 19. Связисты Красной Армии! Помните, что хорошая связь является важным условием победы над врагом! Все- мерно улучшайте дело связи в Красной Армии! Да здравствуют советские связисты! 20. Бойцы и командиры инженерно-саперных войск Всеми средствами помогайте наступающим войскам гро- мить ненавистного врага! Да здравствуют инженерно-саперные части Красной Армии!	vol-5628-page-01-seg-017-1635-1233-2952-1709.png
5628	1	1631	1715	2954	2102	43	0.96501	21. Да здравствуют наши славные пограничники, вер- ные защитники советских границ! 22. Медицинские работники Красной Армии! Врачи, медсестры, санитары! Помните, что от вашей самоотвер- женной работы зависит жизнь и возвращение в строй ра- неных советских воинов! Да здравствуют медицинские работники Красной Ар- мии!	vol-5628-page-01-seg-018-1631-1715-2954-2102.png
5628	1	1626	2115	2950	2869	93	0.95908	23. Работники войскового тыла! Своевременно и четко снабжайте части Действующей Красной Армии вооруже- нием, боеприпасами и продовольствием! Всеми силами со- действуйте наступательным операциям Красной Армии! Да здравствуют работники войскового тыла! 24. Гвардейцы Красной Армии! С честью несите слав- ные гвардейские знамена! Будьте примером доблести и от- ваги в борьбе с врагом! Да здравствует Советская Гвардия! : 25. Братья и сестры! Русские, украинцы, белоруссы, молдаване, литовцы, латыши, эстонцы, карелы, временно подпавшие под ярмо немецко-фашистских мерзавцев! Близится час вашего освобождения! Раздувайте пламя всенародного партизанского движения! Истребляйте не- мецких мерзавцев! Всеми силами помогайте Красной Ар- мии!	vol-5628-page-01-seg-019-1626-2115-2950-2869.png
5628	1	1609	2880	2945	4783	257	0.97012	26. Советские партизаны и партизанки! Помогайте на- ступающей Красной Армии сокрушать врага! Усиливайте удары по немецким тылам, разрушайте железные дороги, мосты и средства связи, истребляйте живую силу против- ника! Не давайте немцам сжигать наши села и города! Спасайте советских людей от угона в немецкое рабство и истребления их гитлеровскими палачами! Мщение и смерть немецким людоедам! Да здравствуют наши славные партизаны и партизанки! 27. Да здравствует нерушимая дружба народов нашей страны! 28. Да здравствует братский союз рабочих, колхозни- ков и интеллигенции нашей страны! 29. Слава Героям Советского Союза и Героям Социали- стического труда-лучшим сынам нашей Родины! 30. Трудящиеся Советского Союза! Забота о семьях фронтовиков является неразрывной частью нашей заботы о Красной Армии. Окружен всеобщим вниманием и забо- той семьи защитников Родины! 31. Рабочие и работницы, инженеры и техники пред- приятий, изготовляющих вооружение боеприпасы для фронта! Увеличивайте выпуск винтовок, автоматов, пуле- метов, минометов, орудий, снарядов, патронов и мин! Со- вершенствуйте и улучшайте качество боевой продукции! Все для фронта, все для победы! 32. Рабочие и работницы, инженеры и техники танко- вых заводов! Давайте Красной Армии больше боевых ма- шин! Чем больше хороших танков --- тем ближе час побе- ды над врагом! 33. Рабочие и работницы, инженеры и техники авиаци- :: онных заводов! Давайте больше истребителей, штурмови- ков, бомбардировщиков для Красной Армии! 34. Рабочие и работницы, инженеры и техники нефтя- ной промышленности! Увеличивайте добычу нефти! Дадим фронту и стране больше горючего! 35. Рабочие и работницы, инженеры и техники уголь- ной промышленности! От вас зависит бесперебойная рабо- та транспорта и промышленности! Увеличивайте - добычу угля, обеспечивайте топливом все потребности фронта и тыла!	vol-5628-page-01-seg-020-1609-2880-2945-4783.png
5628	1	1609	4785	2928	4931	19	0.98753	36. Рабочие и работницы, инженеры и техники метал лургических заводов! Больше металла для танков, само- летов, орудий, пулеметов, снарядов!	vol-5628-page-01-seg-021-1609-4785-2928-4931.png
5628	1	3009	1235	4328	1668	55	0.94268	37. Рабочие и работницы, инженеры и техники моторо- строительной промышленности! Современная война есть война моторов. Увеличивайте производство моторов для самолетов, танков, автомобилей, кораблей! : 38. Рабочие и работницы, инженеры и техники строи тели! Стройте скоростными методами новые домны, мар- тены, шахты, электростанции и заводы! Быстрее восста- навливайте разрушенные немецкими захватчиками города, промышленные предприятия и жилища!	vol-5628-page-01-seg-022-3009-1235-4328-1668.png
5628	1	3003	1685	4326	2227	72	0.97523	39. Рабочие и работницы, инженеры и техники легкой и текстильной промышленности! Изо дня в день увеличи- вайте производство обмундирования для Красной Армии и товаров широкого потребления для населения! 40. Рабочие и работницы, инженеры и техники пище- вой промышленности! Увеличивайте производство про- дуктов питания для фронта и для населения! 41. Рабочие и работницы, инженеры и техники местной промышленности! Больше инициативы в использовании местных ресурсов, увеличивайте выпуск товаров для насе- ления и Красной Армии!	vol-5628-page-01-seg-023-3003-1685-4326-2227.png
5628	1	3000	2235	4320	2521	30	0.96404	42. Работники железнодорожного транспорта! Органи- зуйте быстрое продвижение транспортов с войсками, военными и народнохозяйственными грузами! Неустанно крепите воинскую дисциплину на железных дорогах! Вос- станавливайте разрушенные немцами железноворожные пути и постройки!	vol-5628-page-01-seg-024-3000-2235-4320-2521.png
5628	1	2998	2540	4319	2683	21	0.97226	43. Работники морского и речного транспорта! Обес- почивайте бесперебойную, четкую работу флота, портов и пристаней! Быстрее доставляйте грузы фронту и тылу!	vol-5628-page-01-seg-025-2998-2540-4319-2683.png
5628	1	3000	2702	4320	2939	38	0.94853	44. Колхозники и колхозницы, рабочие и работницы совхозов! Давайте фронту и стране больше продовольст вия и сырья для промышленности. Добивайтесь дальней- шего роста поголовья скота и повышения его продуктив- ности! Все силы на поддержку фронта, на разгром врага!	vol-5628-page-01-seg-026-3000-2702-4320-2939.png
5628	1	2996	2954	4319	3188	28	0.96421	45. Советская интеллигенция! Работники советских уч- реждений, инженеры, учителя, агрономы, врачи, работни- ки науки, искусства и литературы! Отдадим все силы и знания делу борьбы с немецко-фашистскими поработите- лями!	vol-5628-page-01-seg-027-2996-2954-4319-3188.png
5628	1	2998	3201	4319	3394	21	0.94767	46. Трудящиеся освобожденных от врага районов. Бы- стрее восстанавливайте города и села, промышленность, транспорт и сельское хозяйство, разрушенные гитлеров- скими разбойниками!	vol-5628-page-01-seg-028-2998-3201-4319-3394.png
5628	1	2988	3410	4309	3692	37	0.96103	47. Трудящиеся Советского Союза! Доблестная Крас- ная Армия освободила от немецких захватчиков сотни го- родов и тысячи населенных пунктов! Всеми силами помо- жем нашим братьям и сестрам, освобожденным из фа- шистской неволи, восстановить разрушенное немцами хо- зяйство!	vol-5628-page-01-seg-029-2988-3410-4309-3692.png
5628	1	2990	3706	4319	3945	31	0.95766	48. Советские женщины! В совершенстве овладевайте производственными специальностями, непрестанно повы- шайте производительность труда! Изучайте дело противо- воздушной и противохимической обороны, санитарное де- ло, связь! Все силы на борьбу с немецкими захватчиками!	vol-5628-page-01-seg-030-2990-3706-4319-3945.png
5628	1	2986	3958	4307	4152	23	0.96053	49. Советские юноши и девушки! Самоотверженно тру дитесь на помощь фронту, овладевайтехникой произ водства, показывайте образцы трудовой дисциплины, не устанно изучайте военное дело!	vol-5628-page-01-seg-031-2986-3958-4307-4152.png
5628	1	2985	4169	4307	4770	70	0.96511	Да здравствует советская молодежь! 50. Коммунисты и комсомольцы! Будьте в первых ря дух бойцов против немецко-фашистских захватчиков! 51. Да здравствует Ленинский Комсомол - верный -о- мощник большевистской партии в борьбе за свободу и не- зависимость нашей Родины! 1 52. Да здравствует свобода и независимость нашей славной Советской Родины! 53. Да здравствует Всесоюзная Коммунистическая Пар- тия большевиков, партия Ленина-Сталина - вдохнови- тель и организатор борьбы за победу над немецко-фа- шистскими захватчиками!	vol-5628-page-01-seg-032-2985-4169-4307-4770.png
5628	1	2986	4791	4303	4931	22	0.95338	54. Под знаменем Ленина, под водительством Сталина - вперед, за полный разгром немецких оккупантов и из- гнание их из пределов нашей Родины!	vol-5628-page-01-seg-033-2986-4791-4303-4931.png
5628	1	2131	4952	4203	5117	6	0.94160	Центральный Комитет Всесоюзной Коммунистической Партии (большевиков	vol-5628-page-01-seg-034-2131-4952-4203-5117.png
5628	1	371	5209	770	5302	5	0.92256	указ Президиума Верховного Совета СССР	vol-5628-page-01-seg-035-0371-5209-0770-5302.png
5628	1	271	5313	861	5459	9	0.97420	награждении орденом Ленина генералов и офицерского состава Красной Армии	vol-5628-page-01-seg-036-0271-5313-0861-5459.png
5628	1	237	5465	891	5594	22	0.95464	За успешное форсирование реки Днепр прочное закрепление плацдарма на запад ном берегу реки Днепр и проявленные при этом доблесть в мужество наградить:	vol-5628-page-01-seg-037-0237-5465-0891-5594.png
5628	1	394	5611	740	5647	2	0.99251	ОРДЕНОМ ЛЕНИНА	vol-5628-page-01-seg-038-0394-5611-0740-5647.png
5628	1	267	5656	888	5856	18	0.95711	1. Генерал-майора артиллерии Лихачева Владимира Матвеевича. 2. Полковника Олейник Захара Федоро вича. 3. Генерал-майора Пилипенко Антона Пе тровича.	vol-5628-page-01-seg-039-0267-5656-0888-5856.png
5628	1	269	5865	895	6049	20	0.91190	Председатель Президиума Верховного Совета СССР М. КАЛИНИН. Секретарь Президиума Верховного Совета СССР А. ГОРКИН. Москва, Кремль. 29 октября 1943 года.	vol-5628-page-01-seg-040-0269-5865-0895-6049.png
5628	1	916	5214	1586	6042	76	0.95392	присвоении во Совет Народных Комиссаров Союза ССР постановляет: Присвоить нижепоименованным лицам во- инские звания, установленные Указом Пре- зидиума Верховного Совета СССР от 7 мая 1940 года и Постановлением Государствен- ного Комитета Обороны от 4 февраля 1943 года: Звание ГЕНЕРАЛ-ПОЛКОВНИКА Аполлонову Аркадию Николаевичу. Звание ГЕНЕРАЛ-ЛЕЙТЕНАНТА Иванову Петру Алексеевичу. Колганову Константину Степановичу. Плиеву Исса Александровичу. Саввушкину Михаилу Сергеевичу. Стаханову Николаю Павловичу. Чернышеву Виктору Николаевичу. Шафалович Федору Платоновичу. Звание ГЕНЕРАЛ-ЛЕЙТЕНАНТА ВОЙСК СВЯЗИ Максименко Петру Яковлевичу. Мирошникову Павлу Дмитриевичу. чу.	vol-5628-page-01-seg-041-0916-5214-1586-6042.png
