volume_number	page_number	x1	y1	x2	y2	tokens_count	mean_confidence	text	image
6084	3	3775	3599	4436	4071	62	0.93768	С этого времени Красную Армию и Польское Войско связывает кровная бое- вая дружба. Уже в конце 1944 года си- лы Польского Войска значительно приум- нажились, а его генералы, офицеры и сол- даты приобрели большой боевой опыт в ведении современных операций. В сраже- ниях 1945 года Польское Войско показа- ло образцы боевой деятельности и полу- чало благодарность в приказах Верховного Главнокомандующего товарища Сталина.	vol-6084-page-03-seg-061-3775-3599-4436-4071.png
6084	3	3779	4086	4434	4380	44	0.95116	Сегодня Красная Армия и Польское Войско штурмуют логово фашистского зверя --- Берлин, закрепляя навечно свое боевое содружество на благо и процвета- ние наших народов. Теперь немецкому им- периализму противостоит единый фронт от Балтики до Карпат и ему отрезаны па Востоке все пути к агрессии.	vol-6084-page-03-seg-062-3779-4086-4434-4380.png
6084	3	3783	4388	4434	4604	31	0.95519	Советский народ и его Красная Армия с нетерпением ждали этого Договора, яв- ляющегося ценным вкладом в дело мира и всеобщей безопасности. Да здравствует дружба между народами Советской страны и Польской Республики!	vol-6084-page-03-seg-063-3783-4388-4434-4604.png
6084	3	3823	4618	4380	4654	4	0.91151	Генерал-лейтенант А. В. СУХОМЛИН	vol-6084-page-03-seg-064-3823-4618-4380-4654.png
6084	3	550	6071	1132	6100	5	0.95608	Советские танки врезаются в Берлин	vol-6084-page-03-seg-065-0550-6071-1132-6100.png
6084	3	2287	6065	4308	6109	15	0.94190	Снимок наших спец. фотокосочснондентов О. Кнорринга н С. Лоскутова. (Доставлен на самилете летчиком лейтенантом Найденко)	vol-6084-page-03-seg-066-2287-6065-4308-6109.png
6084	4	2415	359	2658	388	3	0.85315	В 3 Д	vol-6084-page-04-seg-002-2415-0359-2658-0388.png
6084	4	3653	363	4384	399	7	0.92846	24 апреля 1945 г., вторник. 96 (6084)	vol-6084-page-04-seg-003-3653-0363-4384-0399.png
6084	4	647	465	2162	639	6	0.87968	Пресс-конференция в Польском посольстве в Москве	vol-6084-page-04-seg-004-0647-0465-2162-0639.png
6084	4	403	678	1058	904	32	0.96109	Вчера, 23 апреля, в Польском посоль- стве в Москве состоялась пресс-конферен- ция, на которой присутствовали предста- вители советской и иностранной печати. Открывая пресс-конференцию, Президент Крайовой Рады Народовой Польши г. Бе- рут заявил:	vol-6084-page-04-seg-005-0403-0678-1058-0904.png
6084	4	394	912	1056	1559	104	0.96876	«Мы позволили себе пригласить вас, господа, в связи c подписанием пакта, имеющего исключительно важное значение как для международного, так и для вну- треннего положения Польши. Прежде все- го это - пакт дружбы. Он особенно ва- жен именно теперь, когда Красная Армия так много сделала для освобождения Польши. Нельзя забывать, что Польша граничит с Советским Союзом на значи- тельном протяжении. Этот факт недооце- нивался прежними правительствами Поль- ши. На протяжении нескольких сот лет между Польшей и народами, населяющими территорию СССР, происходили конфликты. Заключенный договор кладет нм конец. Он знаменует собой исторический перелом сторону создания отношений прочной, непоколебимой и нерушимой дружбы ме- жду двумя братскими народами.	vol-6084-page-04-seg-006-0394-0912-1056-1559.png
6084	4	384	1561	1045	2142	104	0.96857	Для Польши он имеет значение еще с другой стороны. Польша понесла огром- ные, неслыханные потери. Восстановление страны должно было бы длиться чрезвы- чайно долго, если бы Польша опиралась исключительно на свои силы. Это не только договор о дружбе, но и о взаим- ной помощи, не только на время войны, но и на период восстановления. Это бу- дет всесторонняя соседская помощь. Польша уже пользуется этой помощью и очень многим ей обязана. Города Поль- Варшава, Гданьск и другие, а так- же многие сёла -- разрушены. Фабрики н заводы сравнены с землей. Мы бы хо- тели, чтобы взаимная соседская помощь оказывалась постоянно. Мы это выразили в договоре.	vol-6084-page-04-seg-007-0384-1561-1045-2142.png
6084	4	374	2150	1033	2730	88	0.96939	Этот договор имеет также значение и для безопасности Польши, равно как и других народов. Гитлеровцы не оставили мысль о реванше. Угроза новой агрессии будет. еще существовать определенное время. Прежде всего ей подвергается Польша. Договор имеет целью безопас- ность против немецкой агрессии. Он имеет значение для мира в Европе, а, учитывая географическое положение, прежде всего для Польши. Значение этого договора для обеспечения мира в Европе огромно». Отвечая на вопросы корреспондентов, премьер-министр Временного польского правительства г. Осубка-Моравский ука- зал, что договор с СССР был заключен ввиду единодушного желания польского народа.	vol-6084-page-04-seg-008-0374-2150-1033-2730.png
6084	4	367	2741	1027	3323	85	0.97307	Заключенный между Советским Союзом Югославией договор вызвал среди поль- ского народа живейший интерес. Польские рабочие, крестьяне и интеллигенция требо- вали от правительства немедленного за- ключения аналогичного договора. Настоя- щий договор поэтому отражает непреклон- ную волю польского народа. Г. Осубка-Моравский утвердительно от- ветил на вопросы, предполагается ли за- ключение аналогичных договоров с други- ми государствами и присоединение к со- ветско-чехословацкому договору, как это предусматривается последним. Он указал, что при переговорах среди других вопро- сов обсуждался и вопрос о репатриации поляков, проживающих в СССР, на ро- дину.	vol-6084-page-04-seg-009-0367-2741-1027-3323.png
6084	4	367	3325	1022	3547	31	0.97012	На вопрос одного из корреспондентов, обсуждались ли какие-либо вопросы ме- жду Временным Польским Правительством и эмигрантским правительством в Лондоне, Осубка-Моравский заявил, что никаких вопросов с лондонским «правительством» Временное Правительство не обсуждало.	vol-6084-page-04-seg-010-0367-3325-1022-3547.png
6084	4	363	3555	1018	3713	23	0.96302	Премьер-министр был спрошен, предпо- лагается ли заключение экономического соглашения с правительством СССР. На это он ответил: "Мы планируем и гото- вим такое соглашение».	vol-6084-page-04-seg-011-0363-3555-1018-3713.png
6084	4	347	3723	1012	4859	185	0.97407	На вопрос о том, будет ли включена во Временное Польское Правительство нацио- нального единства оппозиция, г. Осубка- Моравский указал, что задача заключает- ся в том, чтобы сформировать такое поль- ское правительство, которое было бы спо- собным выполнить возложенные на него задачи, было бы работоспособным. Един- ственным условием, которому должна от- вечать оппозиция, является согласие с ре- шениями Крымской Конференции. Если включить лиц, несогласных с решениями этой конференции, то, очевидно, такое правительство не будет работоспособным. На вопрос о том, предполагает ли Вре- менное Польское Правительство заклю- чить союз с Францией, г. Осубка-Морев- ский заявил, что такой союз после того, как заключен договор между СССР и Францией, имел бы большое значение. Премьер-министру был задан вопрос о том, заключено ли соглашение с СССР по вопросам военной помощи. На это премьер-министр ответил, что текст дого- вора опубликован и что, кроме того, что там есть, никаких других статей не имеется. Один из корреспондентов задал вопрос об отношении Временного Польского Пра- вительства католической церкви. Г. Осубка-Моравский ответил, что Вре- менное Польское Правительство не только не чинит каких-либо ограничений католи- ческой религии, но, напротив, приняло все меры к тому, чтобы католическая церковь	vol-6084-page-04-seg-012-0347-3723-1012-4859.png
6084	4	1078	676	1735	867	26	0.97101	в Польше была поставлена в надлежащие условия. Отвечая на дальнейшие вопросы, r. Осубка-Моравский указал, что во всех освобожденных районах Польши создана и действует правительственная администра- ция.	vol-6084-page-04-seg-013-1078-0676-1735-0867.png
6084	4	1066	879	1731	1661	120	0.97174	Касаясь вопроса о сроках, в которые намечается проведение всеобщих выборов Польше, г. Осубка-Моравский указал, что в настоящее время Польское Прави- тельство занято разрешением основных вопросов восстановления и организации администрации, являющихся неотложными. Вопрос о всеобщих выборах еще не стоит в повестке дня. Несомненно, однако, что в проведении этих выборов будет участ- вовать блок основных трех партий, кото- рый и решит вопрос о сроках, желатель- ных для проведения выборов. Характеризуя в ответ на вопрос одного из корреспондентов значение проводимой в Польше аграрной реформы, г. Осубка-Мо- равский отметил, что эта реформа имеет историческое значение, ибо она обеспечи- вает хлеб и работу для безземельных малоземельных крестьян польской деревни, хозяйственное устройство и благосостояние польского крестьянства. Это, заявил г. Осубка-Моравский, -- основная реформа, проводимая в Польше.	vol-6084-page-04-seg-014-1066-0879-1731-1661.png
6084	4	1064	1667	1717	1992	53	0.98121	Г. Осубка-Моравский, характеризуя гит- леровский террор в Польше, отметил, что в настоящее время точной цифры нельзя установить, потому что каждым днем открываются новые и новые лагери и мо- гилы. То, что установлено до настоящего бремени, может быть выражено цифрой в 5-7 млн. человек. Несомненно, число жертв гитлеровского террора после уточ- нения значительно возрастет.	vol-6084-page-04-seg-015-1064-1667-1717-1992.png
6084	4	1045	1994	1715	3302	212	0.97413	ответ на вопрос корреспондентов г. Осубка-Моравский указал, что Совет- ский Союз оказывает Польше значитель- ную помощь, предоставляя ей скот, помо- гая восстанавливать железнодорожный транспорт, активно участвуя в восстанов- лении Варшавы и оказывая содействие в сбщем восстановлении страны. B част- ности, Советский Союз помог Польше про- довольствием, медикаментами и др. необ- ходимыми материалами. Эта помощь, го- ворит г. Осубка-Моравский, позволила приступить к организации нормальных ус- ловий жизни в Польше, без чего эта нор- мализация была бы невозможной. Г. Осубка-Моравский, отвечая на соот- ветствующий вопрос корреспондента, ука- зал, что по вопросу о том, будет ли пред- ставлена Польша на конференции в Сан- Франциско, следует адресоваться к орга- низаторам этой конференции. Затем на пресс-конференции был постав- лен ряд вопросов президенту Крайовой Рады Народовой г. Беруту, который в своих ответах указал, что он не связан с какой-либо политической партией и забо- тится о том, чтобы любая, поддерживаю- щая польское правительство, политическая партия могла бы иметь возможность для развития своей деятельности. На вопрос об отношении г. Берута к включению оп- позиции в состав польского правительст- за национального единства, он заявил: "Мы согласны включить в невое прави- тельство самые широкие круги оппози- ции, которые полностью разделяют реше- ния Крымской конференции, но с против- никами этих решений, с противниками на- шей внешней и внутренней политики, ко- нечно, сотрудничество невозможно.	vol-6084-page-04-seg-016-1045-1994-1715-3302.png
6084	4	1029	3309	1698	4645	225	0.97153	Касаясь вопроса о возможности вклю- чения в состав нового правительства Ми- колайчика, г. Берут указал, что этот воп- рос подлежит разрешению созданной на Крымской конференции комиссии в соста- ве народного комиссара иностранных дел СССР В. М. Молотова и английского и американского послов в Москве. Сейчас вопрос о том, будет ли Миколайчик уча- ствовать в этом правительстве или нет, не играет никакой роли. Обстоятельства изменились, Раньше Миколайчик был главой лондонского правительства, руко- водителем партии «Стронництво людове», теперь он никого не представляет, даже свою партию. В Польше он не имеет ни- какого авторитета. Мы предлагали, гово- рит Берут, Миколайчику вступить в пра- вительство и сотрудничать с нами, но он дважды отклонил это предложение. Его позиция характеризуется непостоянством. Одно иностранное лицо, лосе гившее Польшу, заявляет г. Берут, которое на- ходится сейчас в зале, в беседе задало вопрос: «Зачем вам нужен Миколайчик?». Оно характеризовало Миколайчика, как потерявшего всякий авторитет в Поль- ше. Мы его приглашали, он отверг наше приглашение, и больше мы к этому воп- росу не возвращаемся. На вопрос о том, какие препятствия имеются для формиро- вания нового правительства, г. Берут указал, что таких препятствий не было бы, если бы все решения Крымской кон- ференции были точно выполнены. Мы, за- явил он, во всяком случае считаем, что решения Крымской конференции справед- ливы и должны быть выполнены целиком полностью. Мы не видим никаких пре- 1ЯТСТВИЙ для реорганизации польского правительства...	vol-6084-page-04-seg-017-1029-3309-1698-4645.png
6084	4	1029	4654	1675	4848	29	0.96700	Затем с ответами на вопросы выступил главнокомандующий Польского Войска ге- черал-полковник Роля-Жимерский. Харак- теризуя боевое и моральное состояние солдат и офицеров Польского Войска, r. Роля- Жимерский отметил, что бон	vol-6084-page-04-seg-018-1029-4654-1675-4848.png
6084	4	1754	680	2407	973	45	0.95828	которые ведут польские части, нелегки. Немцы, отчаянно сопротивляясь, укрепи- ли каждую пядь земли. 1-я польская армия за месяц боев при форсировании Одера и 2-я армия, форсировавшая Ней- се, потеряли немало людей убитыми ранеными. Бойцы Польского Войска про- являют беззаветную храбрость в борьбе против гитлеровских захватчиков.	vol-6084-page-04-seg-019-1754-0680-2407-0973.png
6084	4	1750	977	2405	1263	45	0.96833	Касаясь вопроса формировании но- вых частей, ген. Роля-Жимерский отме- тил, что польское правительство могло бы мобилизовать сейчас до 500 тыс. но- вых бойцов, однако в Польше недостает оружия и снаряжения, а также необходи- мо сколотить офицерские и унтер-офицер- ские кадры для вновь формируемых ча- тей.	vol-6084-page-04-seg-020-1750-0977-2405-1263.png
6084	4	1742	1277	2399	1853	94	0.97600	Мы принимаем все меры к тому, чтобы пустить в ход нашу военную промышлен- ность, заявил ген. Роля-Жимерский. С мо- мента освобождения Лодзи уже изготовле- но предприятиями этого города свыше 100 тыс. комплектов обмундирования для солдат и значительное количество обуви. Однако потребности Польского Войска еще далеко неудовлетворены. Мы готовим также и унтер-офицерские кадры: мы соз- дали ряд офицерских пехотных, артилле- рийских, авиационных, танковых и авто- мобильных, связи, саперных школ и школу офицеров по политическому воспитанию. Контингент офицеров, проходящих подго- товку в этих школах, позволит укомплек- товать офицерский корпус Польского Вой- ска и создать новые части.	vol-6084-page-04-seg-021-1742-1277-2399-1853.png
6084	4	1735	1860	2396	2403	94	0.97498	Отвечая на вопрос корреспондентов, ген. Роля-Жимерский подчеркнул, что польское правительство рассматривает солдат поль- ских частей, сражающихся в рядах союз- ных войск на западе, как поляков, граж- дан Польши. Польское правительство, за- явил он, не видит никаких препятствий к их возвращению на родину. Солдаты вы- полняют свой долг, и нет никаких основа- ний препятствовать их возвращению на родину. Что касается офицеров, то они также будут свободно допущены на роди- ну, за исключением тех высших военных чинов, которые проявили себя, как фаши- сты и антидемократы. Их возвращение является нежелательным. Мы не хотим фашистов, заявил ген. Роля-Жимерский.	vol-6084-page-04-seg-022-1735-1860-2396-2403.png
