volume_number	page_number	x1	y1	x2	y2	tokens_count	mean_confidence	text	image
5628	2	907	3522	1582	4694	174	0.95030	Тепло встреченный участниками тор жественного собрания тов. Михайлов ярко- обрисовал трудный, но славный путь, пройденный Ленинским комсомолом в ус- ловиях Отечественной войны. Героические дела на фронтах и в тылу врага, добле- стный труд, неиссякаемая патриотическая инициатива на заводах и фабриках, шах- тах и нефтепромыслах, в колхозах и сов- хозах вся жизнь советской молодежи безраздельно посвящена великому делу защиты Родины, ее независимости, свобо- ды и чести, делу Отечественной войны против немецких захватчиков, Свое буду- щее, свое счастье, свою жизнь вот что отстаивает и защищает молодое поколение страны Советов в этой священной всена- родной войне, и яркие, волнующие факты, которые тов. Михайлов привел в своем докладе, свидетельствуют о том, что у мо- лодого человека нашей Родины нет сейчас другой цели и других помыслов, как раз- бить врага, очистить советскую землю от гитлеровских насильников. Когда тов. Ми- хайлов говорит о безграничной преданности комсомола и всей советской молодежи большевистской партии, товарищу Сталину, дружно гремят аплодисменты; это именно то, что чувствует всем своим сердцем и сознанием каждый молодой патриот, это то, что он каждодневно доказывает своей борьбой и трудом.	vol-5628-page-02-seg-021-0907-3522-1582-4694.png
5628	2	908	4702	1571	4920	32	0.94114	Докладчик подчеркивает, что задача комсомола, всей советской молодежи ни на минуту не успокаиваться, с удвоенной энергией бороться с врагом до тех пор, пока вся наша земля не будет очищена от немецких захватчиков.	vol-5628-page-02-seg-022-0908-4702-1571-4920.png
5628	2	907	4931	1569	5294	39	0.94424	Заключительные слова докладчика провозглашенная им здравица доблестным байрам, офицерам и генералам Красной Армии, славным советским партизанам, большевистской партии - вдохновителю и организатору борьбы за победу над не- мецко-фашистскими захватчиками, совет- скому правительству, великому Сталину, вновь вызывают овацию огромной силы.	vol-5628-page-02-seg-023-0907-4931-1569-5294.png
5628	2	905	5300	1567	5444	15	0.93029	Поступает предложение послать привет- ствие Красной Армии и Военно-Морскому Флоту. Это приветствие принимается непередаваемым воодушевлением.	vol-5628-page-02-seg-024-0905-5300-1567-5444.png
5628	2	905	5451	1565	6231	108	0.95249	Председательствующий сообщает о том, что только что прибыл боевой рапорт от молодых партизан Барановичской области Белорусской ССР. Этот рапорт, подписан ный 6 тысячами юных партизан, звучит прекрасной и убедительной иллюстрацией только что заслушанному докладу тов. Михайлова: юные народные мстители пу- стили под откос 394 немецких эшелона, 6) уничтожили 353 паровоза, свыше двух тысяч вагонов, 660 автомашин, разгроми- ли 100 немецких гарнизонов и волостных управ, уничтожили свыше 30 тысяч гит- леровцев. Такие же рапорты поступили адрес торжественного собрания от ряда других областей Белоруссии и Украины. Незабываемое впечатление произвело на всех присутствовавших выступление де- легации московских пноперов. Они по сиг- налу горнистов заполняют проходы, вы- страиваются вдоль сцены. По-детски пе-	vol-5628-page-02-seg-025-0905-5451-1565-6231.png
5628	2	1609	3417	2269	3556	18	0.96170	посредственно и в то же время исключи- тельно сильно звучат слова стихотворпо- го рапорта пионеров своему вожатому комсомолу:	vol-5628-page-02-seg-026-1609-3417-2269-3556.png
5628	2	1723	3567	2146	3711	11	0.93420	Сталин! - в этом имени Величие побед. Сталину любимому Пламенный привет!	vol-5628-page-02-seg-027-1723-3567-2146-3711.png
5628	2	1611	3721	2262	3789	6	0.91140	стихает гром аплодисментов, де- ти продолжают:	vol-5628-page-02-seg-028-1611-3721-2262-3789.png
5628	2	1719	3799	2220	3945	19	0.90294	Нас мужеству учат герои - Матросов, Олег Кошевой. Мы помним о подвиге Зон, кой!... Мы славим ваш путь боевой!...	vol-5628-page-02-seg-029-1719-3799-2220-3945.png
5628	2	1597	3954	2263	4577	89	0.95189	Пионеры рассказывают о том, как они собирают металлолом, из которого сделают танки, снаряды и пушки, как помогали убирать урожай в колхозах и собирать лекарственные травы на полях, как по- могают семьям фронтовиков, ухаживают в госпиталях за ранеными и развлекают их. Две крохотных девочки тут же показы- вают, как они это делают: строй на сцене расступается, и девочки пляшут. Раненые говорят, что они от этого скорее поправляются... Заключительные слова рапорта звучат клятвой советских детей еще лучше больше помогать своим отцам, матерям. старшим братьям и сестрам, помогать Ро- дине, Красной Армии:	vol-5628-page-02-seg-030-1597-3954-2263-4577.png
5628	2	1709	4584	2218	4840	18	0.92619	Пусть скорее сталинское войско До конца фашистов разобьет! За великую отвагу, За геройство, За Родину, За Сталина Вперед!	vol-5628-page-02-seg-031-1709-4584-2218-4840.png
5628	2	1592	4842	2254	5607	98	0.95051	Комсомольский актив тепло провожает детей. Вслед им несутся громкие аплодис- менты и дружеские приветливые улыбки. Председательствующий об'являет: Поступило предложение послать приветствие организатору комсомола, вож- дю, любимому другу и учителю советской молодежи товарищу Сталину. С новой могучей силой вспыхивает ова- ция. Все встают. Чувства, преисполняющие каждое моло- дое сердце, достигают наивысшего накала. напряженной тишине отчеканивается каждое слово приветствия - торжествен- ного клятвенного обещания молодых пат- риотов: все силы, а если потребует Роди- на жизнь, отдать делу борьбы врагом, не по дням, а по часам множить и усиливать помощь Красной Армии, из- гоняющей немецких захватчиков с род- ной советской земли.	vol-5628-page-02-seg-032-1592-4842-2254-5607.png
5628	2	1592	5611	2248	5721	14	0.94642	Под знаком этого клятвенного обещания Ленинский комсомол вступает в 26-й го, своей славной истории.	vol-5628-page-02-seg-033-1592-5611-2248-5721.png
5628	2	1588	5757	2248	6233	64	0.95548	После окончания торжественного соб- рания состоялся большой концерт, в кото- ром приняли участие коллективы и от- дельные исполнители художественной са- модеятельности ремесленных и железнодо- рожных училищ и школ Ф30, пионеры- участники кружков художественной само- деятельности г. Москвы. Во втором отде- лении концерта выступили лучшие масте- ра искусств столицы и Краснознаменный ансамбль красноармейской песни и пляс- ки под руководством народного артиста СССР профессора Александрова. (TACC).	vol-5628-page-02-seg-034-1588-5757-2248-6233.png
5628	2	2592	440	4081	554	4	0.92728	:::: Товарищу Сталину М.	vol-5628-page-02-seg-035-2592-0440-4081-0554.png
5628	2	2322	578	3318	872	58	0.94105	Дорогой наш отец, друг и учитель! В день 25-летия Все- союзного Ленинского Коммунистического Союза Молодежи шлем Вам горячий комсомольский привет и пожелания доброго здо- ровья на многие и многие годы. Свой юбилей мы проводим в обстановке Великой Отечествен- пой войны против немецких захватчиков, посягнувших на сво- боду и независимость нашего народа, на честь и счастье на- шей молодежи.	vol-5628-page-02-seg-036-2322-0578-3318-0872.png
5628	2	2320	876	3317	1019	25	0.93720	Советская молодежь, воспитанная большевистской партией, Вами, товарищ Сталин, в духе ленинизма, в духе беззаветного служения своему народу, отдает все силы, всю эпергию защите любимой Родины.	vol-5628-page-02-seg-037-2320-0876-3317-1019.png
5628	2	2320	1026	3315	1387	65	0.94188	Для каждого молодого патриота активное участие в оощена- родной войне против гитлеровской армии составляет сейчас главную цель, главный смысл жизни. Мы заверяем большевистскую партию, народ, Вас, товарищ Сталил, что ни сил своих, ни самой жизни не пожалеем для достижения полной победы над врагом. Молодые фронтовики будут еще настойчивей овладевать военным делом, еще беспощадней бить немецких захватчиков, до полного освобождения нашей земли от гитлеровских мерзав- цев.	vol-5628-page-02-seg-038-2320-1026-3315-1387.png
5628	2	2358	1392	3307	1427	10	0.88818	Не покладая рук, будем мы трудитьсяна заводах и в кол-	vol-5628-page-02-seg-039-2358-1392-3307-1427.png
5628	2	3356	574	4355	833	43	0.94485	казах, чтобы обеспечить красную Армию вооружением, боепри носами, спаряжением, продовольствием. Комсомольцы и молодежь еще горячее возьмутся за возрож линия жизни на освобожденной от немцев советской земле. Сражаясь и работая, мы будем еще настойчивее учиться, чтобы овладеть знаниями, необходимыми борпу и строителю новой жизни.	vol-5628-page-02-seg-040-3356-0574-4355-0833.png
5628	2	3355	834	4355	1058	42	0.94025	Заверяем Вас, товарищ Сталин, что комсомол и впредь будет неустанно помогать большевистской партии воспитывать моло- дое поколение в духе беззаветной преданности Родине, вели- кому делу Ленина -- Сталина. Комсомол всегда был, есть и будет верным помощником и боевым резервом партии Ленина Сталина.	vol-5628-page-02-seg-041-3355-0834-4355-1058.png
5628	2	3355	1062	4351	1244	22	0.92510	Да здравствует наша любимая советская Родина! Да здравствует наша героическая Красная Армия и Красный Флот! Да здравствует партия большевиков, центральный ::: Бонитет!	vol-5628-page-02-seg-042-3355-1062-4351-1244.png
5628	2	3355	1248	4349	1417	18	0.93115	Да здравствует наш вождь, полководец, любимый друг учитель советской молодежи товарищ Сталин! Торжественное собрание комсомольского актива г. Москвы.	vol-5628-page-02-seg-043-3355-1248-4349-1417.png
5628	2	2504	1487	4150	1599	5	0.94536	Красной Армии и Красному Флоту	vol-5628-page-02-seg-044-2504-1487-4150-1599.png
5628	2	2313	1622	3311	1766	25	0.93478	Товарищи бойцы и офицеры, генералы и адмиралы доблест- ной Красной Армии и Красного Флота! В день 25-летия Ленинско-Сталинского Комсомола советская молодежь шлет вам боевой привет!	vol-5628-page-02-seg-045-2313-1622-3311-1766.png
5628	2	2315	1770	3307	1912	30	0.93393	Советский народ вручил свою судьбу красной Арми и не ошибся в ней. Под водительством Верховного Главнокомандую- чего товарища Сталина Красная Армия и Красный Флот го нят врага с нашей земли.	vol-5628-page-02-seg-046-2315-1770-3307-1912.png
5628	2	2313	1926	3305	2222	53	0.94485	Слава героям великих битв! Слава войскам, на знаменах которых будут вечно сиять имена освобожденных городов Слава чудо-богатырям советского народа, форсировавшим Днепр Мы горды заветно щадно уничтожают цам за сожженные советских людей. нашими братьями и сверстниками, которые без- сражаются на фронтах Отечественной врага, мстят немецко-фашистским мерзав- родные города и сёла, за смерть и муки	vol-5628-page-02-seg-047-2313-1926-3305-2222.png
5628	2	2313	2227	3305	2336	23	0.94451	Вдохновляемая героизмом h красной Армии многомиллионная армия молодежи на фабриках и заводах, на колхозных полях самоотверженно трудится для фронта, для победы. От лица	vol-5628-page-02-seg-048-2313-2227-3305-2336.png
5628	2	3349	1618	4341	1835	43	0.95698	всей советской молодежи обещаем вам, защитники нашего оте- чества, что мы отдадим все молодые силы, знания, всю свою кипучую энергию делу помощи фронту. Мы не забываем о ваших близких и родных, о ваших де- тях, товарищи фронтовики. Еще теплее будет наша забота о	vol-5628-page-02-seg-049-3349-1618-4341-1835.png
5628	2	3349	1840	4339	2134	47	0.94010	Мудрая партия большевиков, великий полководец товарищ Сталин ведут нас новые победам. Вперед, дорогие товарищи, на запад! Сильнее натиск, крепче удар по врагу! Вашего прихода с радостью и надеждой ждут миллионы исстрадавшихся советских людей. Смерть немецким захватчикам! Да здравствует наша героическая Красная Армия и доблест ный Красный Флот!	vol-5628-page-02-seg-050-3349-1840-4339-2134.png
5628	2	3347	2136	4338	2248	17	0.92711	Да здравствует великий организатор наших побед, гениаль ный полководец, Верховный Главнокомандующий, Маршал Со- ветского Союза товарищ Сталин!	vol-5628-page-02-seg-051-3347-2136-4338-2248.png
5628	2	3546	2254	4296	2320	6	0.93249	Торжественное собрание комсомольского актива г, Москвы	vol-5628-page-02-seg-052-3546-2254-4296-2320.png
5628	2	2332	2421	4311	2620	19	0.96275	УКАЗ ПРЕЗИДИУМА ВЕРХОВНОГО СОВЕТА СССР 0 присвоении звания Героя Советского Союза генералам, офидерскому, сержантскому и рядовому составу Красной Армии	vol-5628-page-02-seg-053-2332-2421-4311-2620.png
5628	2	2307	2637	3305	2766	33	0.96698	За успешное форсирование реки Днепр, прочное закрепление плацдарма на западном берегу реки Днепр и проявленные при этом отвагу и геройство присвоить звание Героя Советского Союза с вручением ордена Ленина и медали «Золотая Звезда»:	vol-5628-page-02-seg-054-2307-2637-3305-2766.png
5628	2	2305	2781	3294	4734	324	0.95687	1. Генерал-майору Авдеенко Петру Петровичу. 2. Старшему сержанту Акржихитову Азис Харьясовичу. 3. Старшему сержанту Андрееву Кириллу Дементьевичу. 4. Сержанту Аннкину Николаю Андреевичу. 5. Старшему сержанту Антонову Василию Дмитриевичу. 6. Капитану Бажен Петру Яковлевичу. 7. Старшему сержанту Байбаренко Григорию Николаевичу. 8. Старшему лейтенанту Балукову Николаю Михайловичу. 9. Красноармейцу Сахарозу Василию Никифоровичу. 10. Красноармейцу Белопольскому Ивану Павловичу. 11. Капитану Бобрикову Ивану Андреевичу. 12. Подполковнику Бронницкому Юлиану Марьянскичу. 13. Майору Бруй Федору Филипповичу. 14. Младшему лейтенанту Буздалину Александру Григорьевичу 15. Старшему лейтенанту -Бурка Николаю Лукьяновичу. 16. Капитану Буянкову Ивану Ивановичу. 17. Капитану Ванину Федору Варламовичу. 18. Младшему лейтенанту Васильеву Федору Андреевичу. 19. Старшему лейтенанту Васину Василию Ивановичу. 20. Лейтенанту Власову Митрофану Ефремовичу. 21. Красноармейцу Внукову Михаилу Николаевичу. 22. Капитану Воробьеву Николаю Николаевичу. 23. Лейтенанту Воронцову Михаилу Егоровичу. 24. Красноармейцу Воротынцеву Ивану Моисеевичу. 25. Старшему лейтенанту Вощенко Василию Ивановичу. 26. Сержанту. Гаврилову Ивану Самсоновичу. 27. Старшему краснофлотцу Головкину Алексею Ивановичу. 28. Красноардзейшу Горшкову Ивану Дмитрлезичу. 29. Старшему лейтенанту Гробову Анатолию Александровичу. 30. Сержанту Давидовичу Николаю Петровичу. 31. Старшему сержанту Дикалову Ивану Степановичу, 32. Красноармейцу Дьяченко Ивану Дмитриевичу. 33. Младшему сержанту Елесину Михаилу Васильевичу. 34. Майору Емелину Владимиру Николаевичу. 35. Старшему сержанту Жбанову Михаилу Евлампиевичу. " 35. Лейтенанту Захарову Василию Ивановичу. 37. Старшему сержанту Земкину Федору Михайловичу. 38. Майору Зима Ивану Павловичу. 39. Лейтенанту Иванову Анатолию Александровичу. 40. Сержанту Ивашурова Сергею Тимофеевичу. 41. Младшему сержанту Караеву Ивану Романовичу. 42. Сержанту Каширину Александру Ивановичу. 43. Капитану Кидько Степану. Степановичу. 44. Старшему лейтенанту Клюшникову Евгению Александровичу. 45. Младшему сержанту Козлову Дмитрию Марковичу. 46. Младшему лейтенанту Котельникову Михаилу Федоровичу. 47. Лейтенанту Крапивину Якову Прохоровичу. 48. Генерал-майору инженерных войск Кирсанову Николаю Ва- сильевичу. 49. Старшине Кудимову Павлу Васильевичу. 50. Младшему лейтенанту Кузину Алексею Николаевичу. 51. Красноармейцу Куцый Петру: Антоновичу. 52. Гвардии младшему сержанту Ларину Андрею Васильевичу. 53. Старшему лейтенанту Лещенко Петру Лукьяновичу. 54 Сержанту Лиманскому Кузьие Арлиповичу. 55. Красноармейцу Лихобаба Марку Кононовичу. 56. Старшему краснофлотцу Лишакопу Григорию Ивановичу. 57. Лейтенанту Маракасову Анатолию Владимировичу. 58. Лейтенанту Маринину Николаю Сергеевичу. 59. Майору Марковину Михаилу Васильевичу.	vol-5628-page-02-seg-055-2305-2781-3294-4734.png
