volume_number	page_number	x1	y1	x2	y2	tokens_count	mean_confidence	text	image
5476	4	1538	476	2216	2821	429	0.97508	до войны была кавалерийской, было пе- реброшено в район Меджез-эль-Баба. Ос- тальная часть дивизии была направлена в район Тебессы, где заняла участок фронта от Сбибы до Гафсы. 34-я и 9-я американ- ские пехотные дивизии были направлены в район Кассерина. Эти пехотные и танковые соединения 2-го американского корпуса с самого начала попали в труднейшие усло вия боевой обстановки. Им пришлось боль шую часть времени вести бои на широком фронте отдельными подразделениями, раз- бросанными на десятки километров. Наиболее тяжелыми месяцами оказались январь, февраль и часть марта. Противник. желая обеспечить правый фланг войск Ром- меля и его тыл пехотой и танками, пере- шел в наступление на центральном участке Тунисского фронта, захватил Гафсу, Сбейт- лу, Тозер и ряд других пунктов. В боях за эти пункты американские части, поне- ся потери в людях и технике, накопили ценный боевой опыт. В марте они перешли в наступление и отвлекли на себя часть сил Роммеля, чем облегчили 8-й англий- ской армии выполнение ее задач. После того, как 8-я армия прорвала линию Вади- Акарит, части 2-го американского корпуса оглядели Гафсой н, повёли наступление на Кайруан. Продвижение американцев в районе Фундука и наступление вместе с 1-й английской армией на Кайруан, выну дили войска Роммеля поспешно отступить па север. Во второй половине апреля 2-й амери- канский корпус получил ответственную за- дачу наступать на Матер и Бизерту. Гори- стый и лесистый характер местности и не достаток дорог стесняли маневр и ограни- чивали применение техники. Вся тяжесть боев легла на американскую пехоту, 23 ап реля 2-й американский корпус перешел в - наступление, уже к исходу 26 апреля отдельные его части вели бон за горный кряж Мефтах, находящийся примерно в 20 км. к югу от Матера. Немцы отступали настолько поспешно, что даже не успеваль : убирать раненых. В течение 27 апреля аме- риканцы продолжали осуществлять натиск На правом участке фронта противник отхо- дил на север от дороги Сиди--Нсир-Те бурба. Для обеспечения отхода сильная арьергардная группа немцев, подкрепленная минометами и мобильной артиллерией, ор- ганизовала круговую оборону на одной нз высот в районе Сиди- Нсира, господствую- щей над дорогой, ведущей в Тебурбу и в Матер. Весь день в этом районе шли бои, нередко переходившие в рукопашные схват- ки К исходу дня было взято в плен 300 немцев во главе с командиром батальона В результате боев горный кряж Мефтах был занят американцами. Пленные показывают, что на передовой линии фронта очень мало офицерского и унтер-офицерского состава. Среди солдат противника идут разговоры, что причиной этому являются не столько потери, сколь- ко желание германского командования эва- куировать эту категорию военнослужащих. В связи с тем, что офицерский состав от- водится в тыл, среди немецких и итальян- ских солдат растет недовольство.	vol-5476-page-04-seg-019-1538-0476-2216-2821.png
5476	4	1550	2835	2220	3188	56	0.98024	Американские части обнаружили в боях прекрасную техническую подготовленность. Они до предела насыщены техникой. Поч- ти на всех легковых и грузовых машинах установлены пулеметы, в большинстве своем крупнокалиберные. Боевой дух американ- ских войск высок, в них поддерживается крепкая дисциплина. Рядовой и офицерский состав проявляет огромный интерес к операциям на советско-германском фронте и изучает боевой опыт Красной Армии.	vol-5476-page-04-seg-020-1550-2835-2220-3188.png
5476	4	912	3267	2170	3303	4	0.98372	ВЫСТУПЛЕНИЕ НАСТОЯТЕЛЯ КЕНТЕРБЕРИЙСКОГО СОБОРА	vol-5476-page-04-seg-021-0912-3267-2170-3303.png
5476	4	861	3320	1531	3580	42	0.96181	ЛОНДОН, 5 мая. (ТАСС). Агентство Рейтер передает, что выступивший на ми- тинге по случаю первой годовщины соз- дания объединенного комитета по оказанию помощи Советскому Союзу настоятель Кентерберийского собора Хьюлетт Джон- сон заявил: «Благодарение Богу - у нас имеется возможность в скором времени	vol-5476-page-04-seg-022-0861-3320-1531-3580.png
5476	4	1552	3326	2222	3582	50	0.97210	нанести сокрушительные удары по Герма- нии с другой стороны Европы, такие же удары, какие наносят русские с Востока Пусть скорее наступит этот день. Я хо- тел бы сказать, что это должно произойти интересах справедливости и человеч- ности. Чем скорее мы нанесем этот удар тем меньше жертв он нам будет стоить»	vol-5476-page-04-seg-023-1552-3326-2222-3582.png
5476	4	2256	387	2880	504	7	0.94646	ПЕЧАТЬ АНГЛИИ И США ЗАНЯТИИ АМЕРИКАНЦАМИ МАТЕРА	vol-5476-page-04-seg-024-2256-0387-2880-0504.png
5476	4	2235	518	2905	1389	132	0.97435	лондон, 5 мая. (ТАСС). Английские газеты отмечают большое значение заня- тия американскими войсками Матера для дальнейшего развития операций союзных войск в Тунисе. Военный обозреватель газеты «Дейли экспресс" пишет, что занятие Матера аме- риканскими войсками даст возможность части войск союзников наступлением в сторону Джедейды выйти в тыл войскам противника, препятствующим продвижению 1-й английской армии к Тебурбе. Военный обозреватель «Таймс» называет занятие Матера американскими войсками замеча- тельным боевым подвигом. Теперь, пишет газета, единственная надежда, оставшаяся у противника, заключается в попытках це- пляться за горы. Однако, когда войска союзников проникнут на тунисскую рав- нину, противник лишится и этой надежды и вынужден будет занять оборонительную позицию у Бизерты, а, возможно, и даль- ше, на мысе Бон. Газета «Ивнинг стан- дард" пишет, что занятие американскимн войсками Матера является одним из самых значительных успехов в африканской кам- пании.	vol-5476-page-04-seg-025-2235-0518-2905-1389.png
5476	4	2235	1390	2909	2298	141	0.97099	НьЮ-ПОРК, 5 мая. (ТАСС). Характери- зуя значение занятия Матера американ- скими войсками, военный обозреватель га- зеты "Нью-Йорк таймс" Болдуин заявляет, что это является началом нового продви- жения, которое может привести к тому, что войска противника в Бизерте будут изолированы от неприятельских сил в го- роде Тунисе. Газета "Ныо-Йорк геральд трибюн" в пе- редовой статье подчеркивает, что американ- ские войска, захватив важные внутренние железнодорожные коммуникации и узлы до- por, достигли сердца германской системы обороны в Тунисе. Полученные в резуль- тате занятия Матера преимущества будут повидимому, быстро использованы. Газета высказывает предположение, что в бли- жайшем будущем произойдет полное унич- тожение войск противника в Северной Африке и что союзники намерены осуше- ствить в течение ближайших месяцев вторжение на континент Европы. По мне- нию газеты, Тунис поглотил лишь часть мощи, сосредоточенной англичанами американцами на европейском театре воен- ных действий с целью подготовки к на- ступлению.	vol-5476-page-04-seg-026-2235-1390-2909-2298.png
5476	4	2322	2345	2825	2449	5	0.93736	ТУРЕЦКАЯ ГАЗЕТА «НЕПРЕОДОЛИМОСТИ» ГЕРМАНСКИХ УКРЕПЛЕНИЙ	vol-5476-page-04-seg-027-2322-2345-2825-2449.png
5476	4	2239	2455	2909	2745	43	0.97523	СТАМБУЛ, 5 мая. (ТАСС). Турецкая газета «Ени Сабах» пишет в передовой статье, что немецкая пропаганда, стремясь подбодрить немцев и рассеять их тревогу за судьбу Германии, старательно убеждает их в том, будто Германия окружила себя цепью «непреодолимых» укреплений поэтому-де находится в безопасном поло жении.	vol-5476-page-04-seg-028-2239-2455-2909-2745.png
5476	4	2243	2755	2914	3235	86	0.97090	I азета подчеркивает, что никакие укре- пления не смогут устоять перед челове- ческой решимостью, не говоря уже о том, что они не могут спасти Германию от всё усиливающихся ударов авиации союзни- ков. В свое время, напоминает газета, са- же немцы писали о том, что Франция была разгромлена именно вследствие того, что она переоценила значение линии Ма- жино (линия французских укреплений на франко-германской границе). «Немцы, пишет газета, - забыли урок недавнего прошлого и полностью усвоили взгляды, которые приведут их к гибели. Мы не будем жалеть об этом».	vol-5476-page-04-seg-029-2243-2755-2914-3235.png
5476	4	2243	3288	2912	3590	44	0.95619	ГИБЕЛЬ ГЕНЕРАЛА ЭНДРЮСА ЛОНДОН, 5 мая. (ТАСС). Как передает агентство Рейтер, штаб вооруженных сил США на европейском театре операций со- общил, что главнокомандующий американ- скими вооруженными силами на европей- ском театре операций генерал-лейтенант Эндрюс погиб вечером 3 мая во время авиационной катастрофы в Исландии.	vol-5476-page-04-seg-030-2243-3288-2912-3590.png
5476	4	2962	383	4241	445	7	0.94647	Ответ Черчилля на запрос о химической войне	vol-5476-page-04-seg-031-2962-0383-4241-0445.png
5476	4	2922	459	3594	878	68	0.96500	ЛОНДОН, 4 мая. (ТАСС). Как передает агентство Рейтер, английскому премьер- министру Черчиллю был задан сегодня в палате общин следующий вопрос: намере- но ли правительство, прежде чем начать вести химическую войну, принять меры для того, чтобы с несомненностью убе- диться в том, что немцы действительно применили отравляющие вещества, и обра тится ли Англия к нейтральной комиссии c просьбой установить факт применения отравляющих веществ против русских. Черчилль ответил: "Репрессивные дейст-	vol-5476-page-04-seg-032-2922-0459-3594-0878.png
5476	4	3615	459	4281	643	32	0.97270	не будут предприняты до тех пор, по- ка правительство не будет убеждено в том, что противник применяет отравляю шие вещества. Мы не намерены пригла- шать нейтралов для помощи в этой обла- сти».	vol-5476-page-04-seg-033-3615-0459-4281-0643.png
5476	4	3616	647	4283	872	41	0.96790	В ответ на указание, что могут понадо- биться меры предосторожности, поскольку время прошлой войны были допущены ошибки, Черчилль ответил, что это ему известно, но, сказал он, «я вполне уверен в том, что мы получим правильную инфор- мацию от наших русских союзников».	vol-5476-page-04-seg-034-3616-0647-4283-0872.png
5476	4	3064	926	4148	971	5	0.92908	РОСТ ВОЕННОГО ПРОИЗВОДСТВА В США	vol-5476-page-04-seg-035-3064-0926-4148-0971.png
5476	4	2928	982	3601	1666	128	0.96596	НьЮ-ЙОРК, 5 мая. (ТАСС). Руководи- тель Управления по делам военного произ- водства США Нельсон объявил, что в мар- те в США было произведено вооружения на 11 проц. больше, чем в феврале. В марте было выпущено 6.200 самолетов (в том числе 500 тяжелых бомбардиров- щенков). Продукция авиационной промыш- ленности в марте возросла на 11 проп. по сравнению с февралем. За указанный пе риод выпуск орудий для армии увеличил ся на 7 проц., в частности было произ- бедено большое количество самоходных орудий. В первом квартале этого года в США было произведено около 18 тыс. артиллерийских орудий, в том числе свы- ше 7 тыс. зенитных и свыше 8 тыс. про- тивотанковых, а также 235 тыс. пулеме- тов и свыше 1 млн. винтовок и автоматов марте было поставлено около 3 тыс. танков.	vol-5476-page-04-seg-036-2928-0982-3601-1666.png
5476	4	2929	1673	3605	1920	46	0.95479	Касаясь судостроения, Нельсон отметил, что в марте было выпущено военных ко- раблей на 14 проц. и торговых судов на 7 проц: больше, чем в феврале. По сло- вам Нельсона, судоверфи выпускают те- перь в среднем по 5 торговых судов в день. Из 134 крупных судов, поставлен-	vol-5476-page-04-seg-037-2929-1673-3605-1920.png
5476	4	3622	981	4296	1912	159	0.97006	ных в марте, 103 составляют пароходы типа «Либерти». Общий тоннаж выпущен- ных в марте торговых судов составляет 1 млн. 488 тыс. тонн. Нельсон заявил, что следует ожидать вступления в строй боль- шего, чем до сих пор, количества круп- ных военных кораблей. По словам Нельсона, военная промыш- ленность в США ощущает нехватку ква- лифицированных рабочих. Производство стали скоро достигнет предельного уров- ня, в связи с чем, сказал Нельсон, необ- ходимо заменять сталь менее дефицитны- ми материалами, в частности, пластмас- сой. ВАШИНГТОН, 5 мая. (ТАСС). Морской министр США Нокс в беседе с предста- вителями печати заявил, что в апреле бы- ло выпущено свыше 1.000 морских боевых самолетов. За первые 4 месяца 1943 года численность и мощь американского флота, также вспомогательных судов увеличи- лись приблизительно на 25 проц. Касаясь потерь США на море, Нокс заявил, что в апреле они были меньше чем в марте. Эскортные эсминцы и само- леты принимают все более широкое уча- стие в борьбе с подводными лодками про- тивника.	vol-5476-page-04-seg-038-3622-0981-4296-1912.png
5476	4	3021	1973	4191	2020	7	0.91358	К конфликту в угольной промышленности в США	vol-5476-page-04-seg-039-3021-1973-4191-2020.png
5476	4	2931	2024	3605	2673	111	0.97308	ВАШИНГТОН, 4 мая. (ТАСС). Прави- тельственный уполномоченный по вопросам топлива министр внутренних дел Икес, на которого Рузвельт возложил контроль над всеми угольными шахтами США, отдал приказ о введении работы на шахтах в лечение 6 дней в неделю вместо существо- вавшей на ряде шахт системы, при кото- рой они работали только 5 дней в неде- лю. В своем приказе, адресованном шахта- владельцам, Икес напоминает им, что уп- равление по вопросам цен недавно повы село максимальные цены на уголь с целью обеспечения шестидневной рабочей неделе на угольных шахтах. Поэтому предприниматели должны пре- доставить горнякам возможность работать шесть дней в неделю, построив на этой основе производственный процесс на шах- тах и выплачивая горнякам повышенную	vol-5476-page-04-seg-040-2931-2024-3605-2673.png
5476	4	3624	2028	4298	2675	101	0.96894	зарплату за шестой день работы, как это было обусловлено договором, одобренным правительственной комиссией по трудовым конфликтам. B беседе с представителями печати Икес заявил, что, несмотря на возобновле- ние работы на шахтах, конфликт между профсоюзом горняков и предпринимателя- ми еще не ликвидирован. За последнее время, сказал Икес, некоторые владельцы шахт обманывали правительство, так как поддерживали работу в шахтах всего 5 дней в неделю, чтобы не выплачивать рабочим повышенную зарплату за шестой день работы. В то же время они полу- чали повышенную цену за уголь, предус- мотренную правительством для шахт, ра- ботающих шесть дней в неделю. Новый приказ, сказал Икес, ликвидирует такую практику.	vol-5476-page-04-seg-041-3624-2028-4298-2675.png
5476	4	3176	2732	4032	2768	4	0.98280	ПОЛОЖЕНИЕ НА ОСТРОВЕ МАРТИНИКА	vol-5476-page-04-seg-042-3176-2732-4032-2768.png
5476	4	2929	2780	3605	3590	135	0.96738	ВАШИНГТОН, 5 мая. (ТАСС). Государ- ственный секретарь США Хэлл в беседе представителями печати сообщил, что он получил от верховного комиссара острова Мартиника (французское владение в Ка- раибском море) Робера ноту протеста про- тив разрыва Соединенными Штатами отно- шений с нынешними властями острова Мар- тиника. Хэлл заявил, что Робер продол- жает подчиняться "правительству" Виши, которое полностью находится под контро- лем Гитлера. США же, - указал Хэлл, стремятся к тому, чтобы освободить Фран- цию и французский народ от гитлеровско- го рабства. Хэлл сообщил, что американ- ские военные корабли патрулируют воды в районе острова Мартиника. НьЮ-ЙОРК, 5 мая. (ТАСС). Корреспон- дент газеты "Нью-Йорк Таймс" сообщает из Вашингтона, что туда прибыли с остро- ва Мартиника для присоединения к Сра- жающейся Франции 15 французских матро- сов из команды французского крейсера «Эмиль Бертэн». По словам матросов большая часть населения острова, включая	vol-5476-page-04-seg-043-2929-2780-3605-3590.png
