volume_number	page_number	x1	y1	x2	y2	tokens_count	mean_confidence	text	image
5732	3	2243	4212	2906	5707	247	0.94710	детей Никулиной, восьмилетний Валюша и шестилетняя Таня, тоже прыгнули, они приросли в мертвому телу матери. Немец застрелил и детей. Потом немцы стали лечь другие дома. Сожгли семью Золота- ревых. Все были в сборе: и старики, и двухлетняя В соседнем доме дели две старухи- Пименова и Митрофа- нова. Они прижимали к себе внучат: Геню семи лет, Болодю четырех лет, Алешу двух лет. «За что?" крикнула Ана- стасья Пименова, пытаясь собой заслонить Алену. Немец усмехнулся: «Русс. Гут». И расстрелял всех из автомата. Алеша вы- жил, по пуля раздробила ему кость, и у Олени нет руки. Ему два года, но он уже узнал. В городе Красном, Смоленской области, как и в других городах, немцы убили всех евреев. Я расскажу и судьба семьи Глушкина. 8 августа 1941 года немцы взяли Бориса Глушкина. Они его раздели привязали к хвосту лошади, долго му- чили, полом убили. В ту же ночь пришли за его тупой Евгенией. Она прижала к себе детей. Немцы ее выволокли на двор, изнасиловали. 8 апреля 1942 года немцы пригнали всех евреев города на площадь, приказали раздеться, потом начали уби- мать. Отец Бориса Глушкина, старик се- мидесяти четырех лет, шел первым. Оп псс на руках двухлетнего внука. Евге- Глушкина взяла собой двух детей, третьего, годовалого, она оставила в люльке. Она думала, что судьба поща- дит младенца. Закончив казнь, пемцы стали обходить дома. Они увидели в люль- ке крохотного Алека. Немец выволок ре- бенка на улицу и ударил головой об лед. Начальник отряда приказал разрубить те- ло младенца и дать его собакам.	vol-5732-page-03-seg-069-2243-4212-2906-5707.png
5732	3	2239	5717	2899	6005	57	0.93591	Я вижу эту женщину. Зачем ей была жизнь? Мужа замучили, со изнасиловали, детей вели с ней вместе на казнь. Мать думала об одном: спасти ребенка. Может быть, немцы его не заметят?... Сколько я буду жить, не забуду я муки Евгении Глушкиной и младенца в люльке. Это не мой сын по мой внук, но я его не за-	vol-5732-page-03-seg-070-2239-5717-2899-6005.png
5732	3	2924	4224	3585	5596	249	0.94169	буду. не забуду детей Триполья и за- мошья, детей Красного, Ведь это наши до- ти, наша надежда, то, ради чего мы про- жили жизнь. Их убили. Их убили немцы Может быть, нельзя писать об этом три года подряд. Но и всей жизни нехватит, чтобы изжить такую ненависть. Вот что пишет не старшина Заречен ский: «8 сентября 1941 г. я был ранен под Ленинградом. Вернулся в свою часть. Тогда у нас впервые появились снайперы После ранения я плохо владел правой ру- кой, я научился стрелять левой и стал снайпером. Потом правая рука зажила, по сентября 1912 г. я был вторично ра- нен. Когда 22 января 1944 г. зачитали заключение "не годен к военной службе» это для меня прозвучало, как смертный приговор. Мне дали справку об инвалидно- сти III группы. Но я твердо решил бер- путься в свою часть. понимал, трудно будет без левой руки, но я могу в любое время заменить здорового. Притом я не теряю надежды увеличить счет унич- тоженных мной немцев. Левый глаз, прав- да, почти не видит, по снайперу достаточ- но и правого. Одна мысль меня мучила :: госпитале: примет ли командир инвалида? . . . . . . . Я пе писатель и по могу описать того волнения, которое овладело мной, когда я пашет полнолковиику Апашкину. Он посмотрел документы и спросил: «Куда думаете ехать?» Набравшись духу, я от- ветил: «Думаю остаться в части». Он понял и одобрил. Что же меня заставило вернуться в часть? Ужасная ненависть к немцам, только это. Я из Донбасса. Вы меня поймете».	vol-5732-page-03-seg-071-2924-4224-3585-5596.png
5732	3	2918	5603	3578	6005	68	0.94516	Кто не поймет Зареченского? Это пе профессиональный солдат. До войны была него мирная работа, семья, неч- ты, книги. Теперь он живет одной неот- вязной страстью: уничтожить немцев Когда у него по сгибалась правая рука, оп научился стрелять левой. Теперь он потерял левую руку и левый глаз, но он молит об одном: остаться в строю. Он из Донбасса. Другие с Украины, из Белорус- сип. Но все они поймут Зареченского	vol-5732-page-03-seg-072-2918-5603-3578-6005.png
5732	3	3610	4234	4270	4484	44	0.94275	и ленинградцы, и москвичи, и сибиряки, армянин, и узбек. Кто, глядя на трупы детей, начнет считать: это русский, это украинец, а это еврей? Все они дети на- шей Рошны, и все они наши лети. Всех убил тот железными крестами, железным сердцем, злой и темный.	vol-5732-page-03-seg-073-3610-4234-4270-4484.png
5732	3	3599	4497	4270	6002	245	0.95511	Были в истории энохи, залитые кровью. Пылали костры инквизиции. Стала леген- дой Варфоломеевская ночь. Пылали в сру- бах староверы. Но как бы ни были страш- отвратительны эти преступления, да- же их освещала некая вера, неистовство фанатиков. Во имя чего солдаты Гитлера убили миллионы невинных? Во имя чего они растерзали детей Марин Билык, Ана- стасып Пименовой, Евгений Глушкиной и других в Минске и в Ессентуках, в Новгороде и в Одессе? Если спросить об этом немца, он ухмыльнется или трусливо заплачет; он ничего не сможет ответить: у него нет ни идей, ни веры. Он убивал, потому что ему сказали, что Россия это добыча. Он убивал, потому что в этом было его назначение, оправдание всей его жизни. Вот самое страшное в злодеяниях немцев: они убили миллионы прекрасных людей ни за что, от жадности, от тупо- сти, от прирожденной свирепости. Им ска- зали: "Когда ты перейдешь границы рой- ха, всё позволено. Там недочеловеки, а ты сверхчеловек". и жалкий идиот, невежда, ничтожество начал аккуратно вешать, ду- шить, закапывать живьем, жечь. Он весь «сверхчеловек». И не нашлось среди мил- лионов немцев кучки совестливых, кото- рые закричали бы: «Остановитесь!». Сро- этих "сверхчеловеков" не было челове- Ка, и только детский плач да стоны уми- рающих вмешивались в треск автоматов. Бывает, что гнев помутит рассудок; в беспамятство человек может совершить и недоброе. Но нет у немцев даже этого оп- равдапия: они убивают холодно, спокойно, как будто играют в когли или грызут орешки. Они внесли в зверства немецкую педаггичность. Они усовершенствовали Окончание на 4 стр,	vol-5732-page-03-seg-074-3599-4497-4270-6002.png
5732	4	1998	240	2568	271	6	0.84757	с н я в е д	vol-5732-page-04-seg-001-1998-0240-2568-0271.png
5732	4	3618	238	4261	273	8	0.91788	2 марта 1944 г., четверг. № 52 (5732)	vol-5732-page-04-seg-002-3618-0238-4261-0273.png
5732	4	417	357	1537	455	2	0.96722	Партизаны Псковщины	vol-5732-page-04-seg-003-0417-0357-1537-0455.png
5732	4	317	486	967	729	33	0.95298	От безымянного озера, куда приземлил- ся наш самолет, мы выехали на большую дорогу. Партизаны уже несколько дней стали хозяевами этого большака, окрест- ных сёл и деревень. Древняя земля, ис- конные русские исторические места.	vol-5732-page-04-seg-004-0317-0486-0967-0729.png
5732	4	317	734	965	1181	56	0.94728	В'езжаем в большое село. село, п большак запружены людьми и повозками Идут партизанские отряды. Впереди на добрых конях лихо скачут разведчики. шагает партизанская пехота. На первый взгляд кажется, что идет толпа. Пестрые одежды - на одних шубы, другие одеты зеленые шинели и куртки, захваченные у немцев. Разных мастей копи, разные на них седла местные, прусские, ГОЛ- ландские.	vol-5732-page-04-seg-005-0317-0734-0965-1181.png
5732	4	317	1196	963	1664	70	0.95055	На лихом гнедом коне скачет шпроко- плечий парень. Этого разведчика мы уже визали в жаркие дни июля 1942 года где-то в Шелони, в знаменитом в те дни Партизанском крае. Шагает с медицин- ской сумкой партизанская сестра Припка, хотя она давно уже пе медсестра, а ком- сомольский вожак большой группы отря- дов. Илет армия народных мстителей, за два с половиной года с боями исходившая вдоль и поперек обширные земли родной Псковщины.	vol-5732-page-04-seg-006-0317-1196-0963-1664.png
5732	4	319	1677	963	2075	47	0.94519	У большака, в погонах полковника сто- ит высокий человек, с обветренным, по- грубевшим липом. Николай Александрович когда-то был неистовым поборником вы- соких урожаев псковского льна-долгунца. Теперь он и его люди заняты другими рекордамп: кто больше пабьет немцев? Число фашистов, истребленных отрядами Николая Александровича, исчисляется де- сятками тысяч.	vol-5732-page-04-seg-007-0319-1677-0963-2075.png
5732	4	317	2085	963	2360	44	0.94612	Партизанские отряды шагают в новый район. Плут люди, бравшие вместе с бой- пами Сланцы и Осьмино и около тысячи больших и малых сёл. Они пришли сюда только для них одних знакомыми доро- гами, снова в тыл врага, чтобы на новом месте снова бить немцев.	vol-5732-page-04-seg-008-0317-2085-0963-2360.png
5732	4	315	2371	963	2899	64	0.94429	Партизанский штаб, куда мы приехали, разместился в небольшой хате. У карть: нового района действий партизан сидят трое - Сергей Иванович, Виктор Павло- вич в политический руководитель парти- зан секретарь местного райкома ВКП(б). Все трое опытные партизанские вожаки. Мы знали по Партизанскому краю... Сергей Иванович в летние дни 1942 го- да был командиром подрывников, Внетор Павлович командовал ротой, прославив- шейся дерзкими набегамп на немецкие гарнизоны.	vol-5732-page-04-seg-009-0315-2371-0963-2899.png
5732	4	315	2912	963	3351	56	0.94032	Большая коломна пемцев, просочившись проселками, вышла на большак п дви- жется в район дислокации партизанских отрядов. Захваченные пленные показыва- ют, что, остаткам одной из разбитых Красной Армией дивизий немцев поручено захватить большак п обеспечить движе- ние по нему. Один из батальонов против- ника уже занял ключевую деревню. Вто- рой батальон расположился в двух сосед- них селах.	vol-5732-page-04-seg-010-0315-2912-0963-3351.png
5732	4	317	3362	965	3695	48	0.94217	Сергей Иванович п -Виктор Павлович оценивают обстановку и припимают pe- шепие: окружить п упичтожить пемеп- кие батальоны. Партизанские отряды поднимаются по тревоге и идут навстре- чу врагу. Злой февральский ветер дует с севера. Ледяной дождь хлещет в лицо. Мы стоим на высокой горе. Внизу, вдоль большака раскинулась деревня.	vol-5732-page-04-seg-011-0317-3362-0965-3695.png
5732	4	315	3705	958	3810	15	0.94765	В штаб прискакал на лихом коне раз- ведчик с донесением от командира сосед- них отрядов:	vol-5732-page-04-seg-012-0315-3705-0958-3810.png
5732	4	317	3820	959	4047	26	0.94790	"Немецкая головная числепностью, примерно, в составе полка движется про- селком прямо На большак. Вражеский дозор уже обстреливает большую дорогу». Командир просит ускорить разгром авангардного батальона немцев.	vol-5732-page-04-seg-013-0317-3820-0959-4047.png
5732	4	984	484	1635	1812	180	0.94393	Сигнальная ракета взвивается в небо. Сковывающая группа партизан под коман- дованием Федора Ивановича открыла ура- ганный огонь по деревне. Счельчаки, во- оруженные гранатами и автоматами, по- пластунски ползут домам. Фашисты приняли это за главный удар и обруши- ли весь свой огонь на окраину деревни. За пологой высотой послышалась команда: "Вперед!" Отряды товарищей Ф. Г. спустились с высоты и стреми- тельно, ведя на ходу автоматный огонь, ворвались в деревню. В огневые точки, дома, подвалы, Где сидели фрицы, полете- : ли гранаты. Внезапный налет ошеломил немцев. Отстреливаясь, они панически белали. Большая группа фашистов по придорожным канавам подалась к лесу, но и там ее встретил шквал огня. Через сорок пять минут партизаны уже подсчитывали трофеи, собрали и склады- вали посреди деревни пулеметы, винтовки и другое вражеское вооружение. Пулемет- чики Петя и Вася возятся около немец- кого пулемета, гранатометчик Владимир нацепил на себя около десятка немецких гранат. Полный груз пулеметных лент на- весел на себя астурийский шахтер тов. 3., насильно мобилизованный франкиста- ми в немецкую армию чи лавно перешел- ший к партизанам. Попанеп дрался, как лев, в одном этом бою прикончил во- семь фринев.	vol-5732-page-04-seg-014-0984-0484-1635-1812.png
5732	4	986	1821	1629	1898	8	0.93003	Около маленького домика валяется мас- са немецких трупов.	vol-5732-page-04-seg-015-0986-1821-1629-1898.png
5732	4	984	1908	1633	2229	45	0.93611	Некоторым Компам всё же удалось удрать в соседнюю деревню. Но и пришлось недолго жить. Через час дерев- ня была окружена, а засевшие там нем- пы потреблены. Партизанам достались солидные трофеи -- 32 пулемета, исп- равпая пушка, 3 миномета, 2 рации обоз со всем имуществом батальона.	vol-5732-page-04-seg-016-0984-1908-1633-2229.png
5732	4	984	2237	1631	2712	56	0.95321	Немецкий батальон пытался уйти на новый рубеж обороны, но был педиком истреблен партизанами. Большак снова стал полностью партизанским. Но упря- мый фашистский генерал, командовавший дивизией, в которую входил упичтожен- ный батальон, с немецкой тупостью гнал своих солдат по большаку. С инм завязы- вали бон партизаны Виктора Павловича. Колонна немцев, растянувшись на несколько километров, продолжала дви- гаться,	vol-5732-page-04-seg-017-0984-2237-1631-2712.png
5732	4	983	2725	1631	3158	62	0.94342	Генерал и не заметил, как партизаны провели его за пос. В действительности небольшая группа партизан, прикрывав- шая дорогу, до поры до времени отстре- ливалась, а затем скрылась в противо- подо: кном лесу. Немцы продолжала без- остановочно идти вперед. головной от- ряд уже подошел к следующему селу. По здесь их снова встретили огнем. Немел- кая колонна остановилась на дороге меж- ду двух сёл.	vol-5732-page-04-seg-018-0983-2725-1631-3158.png
5732	4	986	3168	1631	3445	35	0.94631	Густые хвойные леса тянулись вдоль большака. Кругом лежал глубокий нетро- нутый снег. Немецким офицерам и солда- там казалось, что тихий лес, тщательно прочесанный огнем подвижных минометов, не предвещает никакой опасности. Но это было но так.	vol-5732-page-04-seg-019-0986-3168-1631-3445.png
5732	4	984	3451	1629	3768	40	0.96136	Внезапно из лесу началась стрельба. Стреляли из автоматов, пулеметов, винто- вок, стреляли из-за деревьев, снежных сугробов. На немцев обрушился дождь свинца, рвались гранаты. Огненные язы- ки ползли по бикфордовым шнуром к мо- стикам через ручьи и канавы. Взрывы сотрясали воздух.	vol-5732-page-04-seg-020-0984-3451-1629-3768.png
5732	4	981	3780	1627	3997	28	0.95914	Дорога, которую немцы пытались было пробить для жизни, стала для них доро- гой смерти. Над лесом спустились сумер- кл. Большак почернел от вражеских тру- пов. Майор А. МИХАЙЛОВ.	vol-5732-page-04-seg-021-0981-3780-1627-3997.png
5732	4	1011	4009	1346	4039	2	0.92263	тыл противника.	vol-5732-page-04-seg-022-1011-4009-1346-4039.png
5732	4	492	4126	1452	4226	2	0.95946	Дыхание ребенка	vol-5732-page-04-seg-023-0492-4126-1452-4226.png
5732	4	744	4247	963	4274	2	0.95807	Окончание. На	vol-5732-page-04-seg-024-0744-4247-0963-4274.png
