volume_number	page_number	x1	y1	x2	y2	tokens_count	mean_confidence	text	image
6232	3	2879	4508	3529	4705	25	0.96100	Младший сержант Михаил Малинин впервые обратил на себя всеобщее вни- мание тем, что за один день силами отде- ления выполнил три четверти батальон пого плана	vol-6232-page-03-seg-054-2879-4508-3529-4705.png
6232	3	2873	4719	3531	5370	106	0.96508	Николай Царев мал ростом и невзрачен на вид. Скромность его граничит с за- степчивостью. По сколько силы воли похудеть находчивости, сколько уменья и выдержки этом человеке! Царев один из искусней- ших водителей автополка, и авторитет его среди однополчан заслуженно велик. Нико- лай Царев свято и мужественно выполнял свой солдатский долг в годы войны, из правно доставлял фронту снаряды и па- троны, снаряжение и продовольствие. Так же свято н мужественно трудится теперь на хлебном фронте, помогая колхо- зам. Его машина не знает простоев. Он уже сделал на ней больше двухсот тысяч тоннокилометров, не меняя резины, не обновляя ходовой части. Он уже близок к выполнению своего годового задания.	vol-6232-page-03-seg-055-2873-4719-3531-5370.png
6232	3	2860	5386	3519	5960	84	0.95639	Воспользовавшись коротким интервалов между двумя несущимися по направлению к элеватору «Студебеккерами», наш «Вил- лис» быстро вырулил на профилированную дорогу. До элеватора всего два километра Весь путь запружен гружеными машина- ми. Вот и элеватор. Непрерывный гул ав- томобильных моторов стоит повсюду. Шоферы в пилотках, грузчики и груз- чицы все вместе хлопочут у хлебных бунтов. Новые десятки тонн зерна поми- нутно стекают с откинутых бортов автома- шин на элеваторные площадки. И всё го- ворит здесь о напряженном труде воинов- автомобилистов, выполняющих свой долг! на хлебном фронте.	vol-6232-page-03-seg-056-2860-5386-3519-5960.png
6232	3	3320	5972	3469	6007	2	0.97184	Дм. руль	vol-6232-page-03-seg-057-3320-5972-3469-6007.png
6232	3	3599	1645	4237	1729	5	0.96443	В чавы матча в Берлине	vol-6232-page-03-seg-058-3599-1645-4237-1729.png
6232	3	3581	1730	4239	1980	38	0.94709	0 футбольном матче на кубок СССР между командами ЦДКА и московского «Динамо» здесь знали за несколько дней. В субботу и особенно в воскресенье ут- ром в частях гарнизона шли оживлен- ные споры, кто будет победителем. Мне- ния разделялись.	vol-6232-page-03-seg-059-3581-1730-4239-1980.png
6232	3	3572	1982	4233	3166	173	0.95847	14.00 по московскому времени. По бер- линским панелям и мостовым хлещет дождь, но ничего, армейские спортсмены и любители наседают на репродукторы, будто на ворота противника. Волнение и спортивный азарт, отчетливо слышанные нами с трибун московского стадиона, ле- редавались за две тысячи километров и сюда. Блестящий радиорепортаж диктора Синявского давал возможность хорошо представлять ход игры. B 14.09 шум на трибунах известил нас, что у ворот ЦДКА произошла какая- то неприятность, и через секунду-другую диктор Синявский подтвердил, что первый гол забит в ворота ЦДКА. Как известно, второй тайм принес победу армейским футболистам. Богда по- лузащитник команды ЦДКА Виноградов забил гол, то и здесь, в Берлине, гремели аплодисменты, раздавались восторженные крики, и мы уже не. замечали, что измок- ли до нитки, что мокнуть от усиливше- гося дождя придется еще 25 минут. Всё внимание на Москву. Полтора часа советские люди в Берлине были мыслями на стадионе «Динамо» Москве. Победа команды ЦДКА здесь встре- чена с неописуемым восторгом. Мы не ошибемся, если передадим от всех воинов Красной Армии, находящихся здесь, горя- чий привет армейской команде. Заслужен- ная победа!	vol-6232-page-03-seg-060-3572-1982-4233-3166.png
6232	3	3576	3173	4218	3316	12	0.92953	Подполковник Л. ВЫСОКООСТРОВСКИЙ. БЕРЛИН, 15 октября. (По телеграфу от наш. корр. ).	vol-6232-page-03-seg-061-3576-3173-4218-3316.png
6232	3	3583	3369	4214	3434	3	0.91598	На стадионе Вены	vol-6232-page-03-seg-062-3583-3369-4214-3434.png
6232	3	3659	3458	4127	3529	5	0.96444	АРМЕЙСКИЕ ФУТБОЛИСТЫ выиграли у англичан	vol-6232-page-03-seg-063-3659-3458-4127-3529.png
6232	3	3562	3550	4214	3908	47	0.96390	Во второй половине воскресного дня сотни легковых машин советского, американского канского, английского, французского гар- низолов Вены непрерывным потоком шли в район Пратер, к стадиону венского ат- летического клуба. Здесь должен был со- стояться самый интереснейший этом севоне футбольный матч между командами русского английского гарнизонов столи- цы Австрии.	vol-6232-page-03-seg-064-3562-3550-4214-3908.png
6232	3	3554	3918	4210	4167	37	0.94679	На зеленое поле выбегают в красных майках советские армейские футболисты, в белых - англичане. Капитаны команд преподносят друг другу большие букеты живых цветов, крепко, дружески пожима- ют руки. И вот, наконец, судья-француз дает свисток. Мяч в игре.	vol-6232-page-03-seg-065-3554-3918-4210-4167.png
6232	3	3556	4177	4210	4759	88	0.96120	Несмотря на усилия противников, пер- вая половина матча не дала результатов. Во втором тайме сразу же после свист- ка судьи игра развертывается у ворот англичан. Напор армейских футболистов с каждой минутой всё более возрастал. За игру рукой судья назначает 11-метровый удар в ворота англичан. Мяч в сетке, счет открыт. Это еще больше оживило игру. Атаки советской команды усилива- ются. Через несколько минут в результа- те красивой комбинации Голованова и дентра Форварда красноармейца Ярового счет увеличивается. Англичане принимают все меры, чтобы отквитаться, и им удает- ся забить один гол.	vol-6232-page-03-seg-066-3556-4177-4210-4759.png
6232	3	3554	4771	4200	4910	22	0.94228	Советские футболисты вынуждены на- чать игру с центра. Они прорываются к воротам англичан, красноармеец Яровой сильно бьет. Гол! Счет 3 : 1	vol-6232-page-03-seg-067-3554-4771-4200-4910.png
6232	3	3552	4922	4202	5146	34	0.95725	В дальнейшем советская команда не вы пустила инщиативы из своих рук, забив в ворота англичан еще два мяча. Матч закончился блестящей победой советских армейских футболистов со счетом 5 : 1. Гвардии майор И. АНУФРИЕВ.	vol-6232-page-03-seg-068-3552-4922-4202-5146.png
6232	3	3603	5196	4150	5270	5	0.90690	ПЕРВЕНСТВО КРАСНОЙ АРМИИ по футболу	vol-6232-page-03-seg-069-3603-5196-4150-5270.png
6232	3	3539	5289	4200	5879	96	0.96546	Семь лучших армейских команд примут участие в финальных играх на первенство Красной Армии по футболу. Пять участ- ников финальных встреч определились в результате кустовых соревнований. Это команды Киевского, Бакинского, Ураль- ского, Приволжского и Минского военных скругов. Без предварительной игры допу- щены к розыгрышу мастера второй группы футболисты Московского военного ок- руга и Тбилисского дома офицеров. Вчера в ЦДКА собрались представители команд - участников розыгрыша. Состоя- лась жеребьевка, определившая порядок игр. Ежедневно с 16 октября на стадионе парка культуры и отдыха МВО в Лефор- тове будут происходить три матча. Выход- ные дни 18, 21 и 24 октября.	vol-6232-page-03-seg-070-3539-5289-4200-5879.png
6232	3	3535	5885	4187	6012	19	0.95811	Сегодня встречаются команды Москов ского военного округа и Приволжского военного округа. Начало матча в 10 час. 30 мин. утра	vol-6232-page-03-seg-071-3535-5885-4187-6012.png
6232	4	1974	199	2266	232	5	0.85231	P A C H A	vol-6232-page-04-seg-001-1974-0199-2266-0232.png
6232	4	3543	189	4274	226	8	0.89175	16 октября 1945 г., вторчик № 244 (6232).	vol-6232-page-04-seg-003-3543-0189-4274-0226.png
6232	4	315	321	1618	384	4	0.97394	Посещение Праги маршалом Коневым	vol-6232-page-04-seg-004-0315-0321-1618-0384.png
6232	4	311	413	959	510	13	0.95319	ПРАГА, 13 октября. (ТАСС). (Задержана доставкой). Вчера Прагу посетил маршал Советского Союза Конев.	vol-6232-page-04-seg-005-0311-0413-0959-0510.png
6232	4	309	514	959	1026	80	0.97374	На аэродроме его встретили министр на- циональной обороны генерал Свобода, ми- нистр иностранных дел Ян Масарик, на- чальник генерального штаба чехословацкой армни генерал Бочек, представители армии и чехословацких властей, посол Советского- Союза т. Зорин, генерал-полковник Жадов, советник посольства Чичаев и др. Маршал Конев принял парад почетного караула. Оркестр исполнил советский и чехословацкий гимны. Население устроило маршалу восторженный прием. Днем маршала Конева принял и дал обед в его честь премьер-министр Зденек Фирлингер. На обеде присутствовали вице- премьер министр Готвальд, министры Сво-	vol-6232-page-04-seg-006-0309-0514-0959-1026.png
6232	4	984	411	1632	506	14	0.94868	года, Масарик и Странский, статс-секре- тари Клементис и Ферьенчик, посол СССР Зорин и др.	vol-6232-page-04-seg-007-0984-0411-1632-0506.png
6232	4	982	508	1634	733	29	0.96350	Позднее маршал Конев был принят пре- зидентом Чехословацкой республики д-ром Бенешем. приеме присутствовали премьер-министр Фирлингер и посол СССР Зорин. B тот же день маршал Советского Союза Конев покинул Прагу.	vol-6232-page-04-seg-008-0982-0508-1634-0733.png
6232	4	982	769	1634	1023	33	0.96460	Пражские газеты поместили подробные сообщения о посещении Праги маршалом Советского Союза Коневым. связи этим событием газеты подчеркивают зна- чение чехословацко-советской дружбы и особо отмечают заслуги маршала Конева освобождении Праги от немецких за- хватчиков.	vol-6232-page-04-seg-009-0982-0769-1634-1023.png
6232	4	367	1096	1582	1222	7	0.97201	Результаты выборов во временное Национальное собрание Чехословакии	vol-6232-page-04-seg-010-0367-1096-1582-1222.png
6232	4	307	1241	957	1435	28	0.96997	ПРАГА, 15 октября. (ТАСС). Вчера со- стоялись выборы депутатов в чехословац- кое временное Национальное собрание и выборы областных национальных комитетов на областных с'ездах делегатов в Праге и Брно.	vol-6232-page-04-seg-011-0307-1241-0957-1435.png
6232	4	309	1438	955	1562	22	0.97443	B Праге от имени правительства высту пил министр внутренних дел Вацлав Но- сек, в Брно - министр почт и телеграфа Франтишек Гала.	vol-6232-page-04-seg-012-0309-1438-0955-1562.png
6232	4	305	1566	959	2817	203	0.96819	После заявления представителей всех четырех политических партий Националь- ного фронта (компартия, социал-демократы- ческая партия, народные социалисты и народная партия) о том, что партии Нацио- нального фронта согласились на составле- ние общего списка кандидатов, были из- браны члены областных национальных ко- митетов Чехии и Моравии, а также 200 депутатов и столько же кандидатов в де- путаты во временное Национальное собра- ние Чехословакии от областей Чехии и Моравии. 100 депутатов в Национальное собрание от Словакии и словацкий Нацио- нальный совет, представляющий областной национальный комитет Словакии, были из- браны на съезде в Банской Бистрице 29 августа 1945 года. На основании межпартийного соглашения в Национальное собрание были избраны по 40 депутатов от чехословацкой компартии, от социал-демократической партии, от пар- тии народных социалистов и от народной партии; от Центрального совета профсою- зов избрано 10 депутатов, от Союза чеш- ских земледельцев - 8, от Центрального союза торговли -- 2, от Центрального со- юза ремесленников -- 2, от Центрального совета кооперации 4, от Центрального комитета национальной физкультуры -- 3, от союза чешской молодежи -- 3 депутата. Кроме того, были избраны 8 депутатов выдающихся деятелей общественной жиз- ни: министр профессор Неедлы, профессор Белеградек, писатель Галас, журналист Фердинанд Пероутка, профессор Владимир Клецанда, профессора Вацлав Китил и Владимир Четверка и адвокат Ярослав Сжегулка.	vol-6232-page-04-seg-013-0305-1566-0959-2817.png
6232	4	980	1243	1630	1661	66	0.97103	Из членов правительства, кроме упомя- нутого уже министра Неедлы, были избра- ны премьер-министр Зденек Фирлингер, вице-премьеры: Клемент Готвальд, Иосиф Давид, Ян Шрамек, министр внутренних дел Вацлав Носек, министр информации Вацлав Копецкий, министр внешней торгов- ли д-р Губерт Репка, министр юстиции д-р Ярослав Странский, министр промыш- ленности Богумил Лаушман, министр снаб- жения Вацлав Майер, министр почт и те- леграфа Франтишек Гала, министр здраво- охранения д-р Адольф Прохазка.	vol-6232-page-04-seg-014-0980-1243-1630-1661.png
6232	4	980	1674	1626	1804	18	0.95925	Избраны также приматор города Праги д-р Петр Зенкл, председатель Централь- ного совета профсоюзов Антонин Запотоц кий и др.	vol-6232-page-04-seg-015-0980-1674-1626-1804.png
6232	4	980	1821	1630	2079	42	0.96905	Среди избранных депутатов 30 земле- дельцев, 26 рабочих, 67 общественных и частных служащих, 7 адвокатов, 10 торгов- цев и предпринимателей, 9 профессоров университета, 13 журналистов, 3 писателя 10 учителей, 3 солдата, 1 судья и пред- ставители других профессий. Женщин из- брано 15.	vol-6232-page-04-seg-016-0980-1821-1630-2079.png
6232	4	982	2094	1630	2255	22	0.96946	составе избранных ранее словацких депутатов Национального собрания --- 40 коммунистов, 40 демократов и 20 депута- тов от общенациональных и профессиональ- ных организаций.	vol-6232-page-04-seg-017-0982-2094-1630-2255.png
6232	4	978	2268	1632	2815	89	0.96006	Выступая на областном съезде в Праге, министр внутренних дел Носик заявил, что первое заседание временного Национально- го собрания будет созвано 28 октября этого года. В областной национальный ко- митет Чехии избраны: 24 коммуниста, 24 социал-демократа, 24 народных социалиста, 24 представителя народной партии, от Центрального совета профсоюзов-5 пред- ставителей, от Союза чешских земледель- цев - 3, от Центрального союза торгов- ли 1, Центрального союза ремесленни- КОВ 1, Центрального совета коопера- ции 2, Центрального комитета нацио- нальной физкультуры - 2, Союза чешской молодежи 2 и 7 представителей дру- гих общественных организаций.	vol-6232-page-04-seg-018-0978-2268-1632-2815.png
6232	4	357	2883	1587	2986	7	0.96041	Предвыборное обращение Национального комитета болгарского Отечественного фронта	vol-6232-page-04-seg-019-0357-2883-1587-2986.png
6232	4	305	2995	959	3957	137	0.97885	СОФИЯ, 15 октября. (ТАСС). В связи c предвыборной кампанией вчера было опубликовано обращение Национального комитета Отечественного фронта к мест- ным комитетам Отечественного фронта и всем избирательным комитетам страны. «18 ноября, - говорится в обращении, будут проведены первые свободные выборы депутатов в Народное собрание. Этими выборами болгарский народ оконча- тельно утвердит свой демократический путь развития, укрепит экономическое по- ложение страны, обеспечит свою нацио- нальную независимость и государственный суверенитет и сможет получить справедли- вый и длительный мир. Выборы 18 ноября являются первыми свободными демократи- ческими выборами. Они будут проведены на основе действительно демократического закона, в них будут участвовать все слои народа, массовые и культурные организа- нии. Обеспечено участие в выборах всем болгарским гражданам, достигшим 19-лет- него возраста, без различия пола, вероиспо- ведания, имущественного ценза и полити- ческой принадлежности. Впервые предоста- вляется возможность массового участия в выборах женщинам и молодежи.	vol-6232-page-04-seg-020-0305-2995-0959-3957.png
