volume_number	page_number	x1	y1	x2	y2	tokens_count	mean_confidence	text	image
5823	2	200	1281	863	2777	214	0.95035	Ненавистный враг вторгся в наш род- ной край и со звериной злобой уничтожал советских людей, залил кровью и слезами наши города и села, стремясь превратить нас в безмолвных рабов. За два года вре- менной оккупации гитлеровские разбой- ники расстреляли, повесили и сожгли живыми, замучили в душегубках только в одном городе Чернигове 60 тысяч ни в чем неповинных советских людей. Де- сятки тысяч угнали они на каторгу фашистскую Германию. Наши чудесные старинные города и многочисленные сёла превращены подлыми грабителями в пе- пелища и руины. Чернигов порность украинского народа разрушен немецкими мерзавцами. Уничтожены исторические памятники старинного города-красавпа: Пятницкая церковь, построенная в 12-м столетни, гостиница «Царьград», где оста- навливались Пушкин, Гоголь и Шевчен- ко, исторический музей с его непревзой- ценными экспонатами далеких времен. В Чернигове бандиты разграбили рукописи и картины величайшей ценности. В Козель- де немецкие звери сожгли собор. по- строенный знаменитым зодчим Растрелли. Немецкие варвары уничтожили культур- пые ценности Черниговщины, где учился и начал свой славный литературный путь великий русский писатель Н. В. Гоголь. классик украинской литературы М. М. Коцюбинский, чудесный баснописец Л. Глебов, знаменитый педагог К. Д. Ушинский, которые прославили на весь мир нашу Родину. На Черниговщине тво- рили композитор Глинка - основополож- НИК русской музыки и выдающийся художник-баталист Самокиш. В живопис- ном Седневе великий кобзарь украинского народа Т. Г. Шевченко писал свои стихи поэмы	vol-5823-page-02-seg-006-0200-1281-0863-2777.png
5823	2	201	2804	863	4055	191	0.95213	Подлые враги разрушили Прилуки, Новгород-Северск, Бахмач, Любеч, стерли с лица земли районный центр Корюковку, села Елино, Лосевка, Тополевку, Биброви- ду, Яцево, Вазари, Клубовка и 543 дру- гих населенных пункта, где насчитыва- лось 8.000 колхозных построек. Чудовищ- ны злодеяния немецких людоедов. Рабочий поселок Корюковку немцы окружили вой- сками с пулеметами, автоматами и мино- метами, врывались в каждую хату и без- жалостно расстреливали мирных жителей от стариков до младенцев. Немецкие па- лачи согнали церковь верующих и их. За несколько часов стало Порядовки и около 5.5 тыс. ее жителей. том числе около 1,5 тысячи детей. Фашистские кровожадные псы системати- чески осуществляли свои сумасбродные планы уничтожения украинского народа. Они разрушали всё, что создавалось тру- дом нашего народа на протяжении столе- тий: Немцы грабили и истребляли всё. В скирдах и копнах они сожгли при от- ступлении урожай зерновых на площади около 100 тысяч гектаров, не осталось пилой ни одной МТС и МТМ. Произволи- тельный скот бандиты угнали в Герма- нию. За годы фашистской оккупации в колхозах области уменьшилось поголовье лошадей на 174 тысячи голов, крупного рогатого скота на 204 тысячи голов. свиней на 163 тысячи голов, овец на 172 тысячи голов. С давних времен Черниговщина слави-	vol-5823-page-02-seg-007-0201-2804-0863-4055.png
5823	2	884	742	1542	1454	103	0.95233	лась своей любовью родному краю смертельной ненавистью к врагам нашего народа. Отсюда, с земли Черниговской, ве ликий князь Игорь Северский водил своп полки против диких орд захватчиков, ко- торые хотели пленить придеснянский край. Храбрые черниговцы покрыли себя славой в борьбе со шведами B начале 18-го столетия. До сих пор стоят на го- родском валу пушки, которые подарил городу-крепости Петр Великий после Пол- тавской битвы. Верные сыны Чернигов- шины сражались в рядах народного опол- чения во время Отечественной войны 1812 года. Украинский Чапаев, Николай Александрович Щорс наш славный земляк сформировал на Черниговщине свои прославленные полки, которые в 1918 году громили проклятых кайзе- ровско-немецких захватчиков.	vol-5823-page-02-seg-008-0884-0742-1542-1454.png
5823	2	884	1471	1540	2764	193	0.95241	Немецкие мерзавцы хотели превратить в рабов вольнолюбивых черниговцев. Но ато ы не удалось, как не удавалось это- го сделать никому и никогда. Растерзан ная, залитая кровью, ограбленная, но не сломленная и непокорившаяся Чернигов- шина поднялась на смертный бой с вра- гами советского народа пемепкими за- хватчиками. В рядах Красной Армии и в отрядах народных мстителей истили вра- гу сотни тысяч черниговцев. В рядах черниговских партизан выросли и закали- лись десятки Героев Советского Союза. Сотни партизан награждены медалями орденами. Небольшие вначале отряды пре- вратились в грозные партизанские соеди- нения, они вихрем налетали на немецкие штабы и гарнизоны, сеяли страх и пани- ку в стане врага. За два года беспример- ной борьбы соединения партизанских отря- дов Черниговщины уничтожили более 43 тысяч немецких солдат и офицеров, разгро- мили 44 вражеских гарнизона. 138 поли- пейских участков, в десятках районных городских центров полностью ликвидиро- вали бандитские гнезда немелких захват- чиков, пустили под откос 884 вражеских эшелона, нарушали коммуникации врага уничтожили множество вражеской техни- ки и захватили богатые трофеи. Па Ваш призыв, дорогой Поснф Виссарионович, с Вашим именем в сердце и на устах шли партизаны Черниговщины в бой против ситлеровских банлитских орд, отстанвая честь, свободу и независимость нашей Родины.	vol-5823-page-02-seg-009-0884-1471-1540-2764.png
5823	2	884	2783	1542	3724	140	0.95995	За годы советской власти Черниговский край распвел ярким цветом богатства п счастья. Всего у нас было вдоволь. Хоро- шая слава ходила о колхозах Чернигов- шины. Земля, закрепленная за колхозами на вечное пользование, вознаграждала че- стный труд колхозников и колхозниц сто- половыми урожаями зерна, буйными всхо- дами конопли, шелкового льна, ароматной мяты, картофеля, первосортных табаков, сочной сахарной свеклы. Колхозники вы- ращивали породистых лошадей. высоко- удойных коров, тонкорунных овец, поро- дистых свиней, упитанную типу, медо- носных пчел. А в наших многочисленных реках и озерах водилось множество всякой рыбы. Наши города и села утопали в зе- лени роскошных садов. С каждым годом богатели наши колхозы, становились мил- лионерами. С каждым днем наша жизнь становилась зажиточнее и культурнее. Молодежь училась в школах, техникумах и университетах. Театры. кино. парки, дома отдыха были к услугам трудящихся. В детских яслях и садах росли паши счаст- ливые дети.	vol-5823-page-02-seg-010-0884-2783-1542-3724.png
5823	2	888	3743	1540	3887	17	0.94627	Вырастали на Черниговщине фабрики и заводы. На убогом в прошлом Полесье бес- прерывно развивалась промышленность и транспорт.	vol-5823-page-02-seg-011-0888-3743-1540-3887.png
5823	2	890	3905	1537	3976	9	0.94042	Страшные следы оставил немец за со- бой на Черниговщине.	vol-5823-page-02-seg-012-0890-3905-1537-3976.png
5823	2	882	3980	1538	4047	11	0.92105	Но непоколебима наша воля к возрож- дению, к возвращению славы, осуществле-	vol-5823-page-02-seg-013-0882-3980-1538-4047.png
5823	2	1563	727	2225	1692	136	0.95975	нию Вашего наказа, наш родной отец и учитель, о восстановлении разрушенного немецкими захватчиками народного хозяй- ства. С большой радостью сообщаем Вам, дорогой Иосиф Виссарионович, что осво- божденная Черниговщина поднимается из руин и пепла, строит заново свою жизнь и достигла уже немалых успехов. В нашей области уже восстановлены все 1902 кол- хоза, восстановлено 3448 животноводче- ских Ферм, возобновили работу 57 МТС. Из разбитых пездами и разбросанных ма- шин собрано и отремонтировано 1022 трактора. Возрождено колхозное хозяйство основа зажиточной и культурной жиз- ни. Уже работают два сахарных завода, много спиртных, крахмальных заводов, кирпичных заводов, кондитерские фабри- ки, мотороремонтный завод "Мовтневий мо- лот» и другие предприятия местной про- мышленности. Возобновили работу более ста промартелей. Работают школы. клубы. кино, театры, библиотеки, музеи, избы- читальни, детские дома и сады. Снова готовит педагогические кадры Нежинский педагогический институт имени Н. В. Го- голя,	vol-5823-page-02-seg-014-1563-0727-2225-1692.png
5823	2	1563	1708	2219	1777	8	0.90701	Справедливо писал наш знамениты земляк Павло Григорьевич Тычина;	vol-5823-page-02-seg-015-1563-1708-2219-1777.png
5823	2	1602	1794	2143	1962	21	0.94801	"Я есть народ, якого правда сила Нiким звойована ще не була. Яка бiда мене, яка чума косила A сила знову розцвiла».	vol-5823-page-02-seg-016-1602-1794-2143-1962.png
5823	2	1563	1975	2223	2266	37	0.94392	Первых успехов в восстановлении па- родного хозяйства области мы добились под руководством партии Ленина-Стали- на, с помощью братского русского народа и всех народов СССР. Большую помощь оказывает нашей области правительство Советской Украины во главе Никитой Сергеевичем Хрущевым.	vol-5823-page-02-seg-017-1563-1975-2223-2266.png
5823	2	1563	2283	2223	3699	207	0.95301	Сила нашего народа и воля его к побе- 10 несокрушимы. Правда народная освещает путь ярким лучом всем народам, об'ели- нившимся для окончательного разгрома немецко-фашистского зверья в его собст- венной берлоге. Ратные подвиги воинов Красной Армии, прошедших с боями от Волги до Серета, от предгорьев Кавказа до Карпат, наполняют наши сердца гор- достью и желанием всемерно помогать фронту, нашим воинам-богатырям при- близить час победы над врагом. Со време- ни своего освобождения трудящиеся Чер- ниговщины сдали в фонд Красной Армии и продали государству 11,5 миллиона пу- дов зерна, 17 миллионов пудов картофеля, более 500 тысяч пудов мяса и много других продуктов. Воодушевленные побе- дами Красной Армии не дали 60 миллио- нов рублей на строительство танковой ко- лонны "Колгоспник Чернiгiвщiни". Гроз- ные машины уже построены на наши сбе- режения и на фронтах Отечественной вой- ны давят фашистскую гадину. За не- сколько дней рабочие, колхозники и ви- теллигенция нашей области подписались на Третий Государственный Военный Заем на сумму 126 миллионов рублей, значи- тельно превысив бюджетные предположе- ния. Советские патриоты досрочно вносят наличными взаймы государству. Закончив посев ранних яровых, сахарной свеклы. колхозники и колхозницы нашей области самоотверженно трудятся над завершени- ем посева поздних культур - гречихи, огородных культур, развернули обработку сахарной свеклы. прополке посевов, бо- рясь за высокий военный урожай урожай победы!	vol-5823-page-02-seg-018-1563-2283-2223-3699.png
5823	2	1565	3722	2221	3914	24	0.95366	Дорогой Иосиф Виссарионович! В первомайском приказе Вы заявили. что советский народ способен творить чу- деса и выходить победителем из самых тяжелых испытаний, преисполнен пеши-	vol-5823-page-02-seg-019-1565-3722-2221-3914.png
5823	2	2246	736	2900	873	17	0.92363	мостью ускорить разгром врага, полностью восстановить разрушенное фашистами хо- зяйство и сделать нашу страну еще более могучей.	vol-5823-page-02-seg-020-2246-0736-2900-0873.png
5823	2	2246	892	2900	1100	33	0.93768	Мы убеждены, что в скором времени будет очищена от фашистских захватчи- ков вся наша земля и будут восстановле- ны государственные границы Советского Союза по всей линии от Черного до Ба- - ренцова моря.	vol-5823-page-02-seg-021-2246-0892-2900-1100.png
5823	2	2243	1115	2902	1577	71	0.95292	Клянемся Вам, родной наш отец, что во имя победы, во славу нашей отчизны мы не пожалеем ни сил своих, ни самой жизни. Мы хорошо понимаем, что впереди предстоят еще большие трудности, но упорным трудом мы их преодолеем. Мы обязуемся как можно скорее и полностью восстановить разрушенные города и села. фабрики и заводы, промышленные арте- ли, культурные и социально-бытовые уч- реждения, перевыполнять государственные обязательства и производственные пла- ны, всемерно усиливать помощь фронту.	vol-5823-page-02-seg-022-2243-1115-2902-1577.png
5823	2	2244	1592	2902	2668	176	0.95223	Даем Вам, товарищ Сталин, наше кол- хозное слово: образного провести все сельскохозяйственные работы и добиться в среднем по области такой урожайности: по зерновым культурам 60 пулов с гек- тара, сахарной свеклы 720 пудов, табака 60 пудов. махорки 110 пудов, картофеля 660 пудов, льноволокна 24 пуда, льносе- мян 18 пулов, овощей 720 пулов. Священ- ная обязанность каждого из нас не только выполнять, но и перевыполнять государ- ственные планы и обязательства, давать государству и фронту больше продукции сверх плана. Мы обязуемся увеличить ло конца гола поголовье рогатого скота в области на 65 тысяч голов овен на 23 тысячи голов, свиней на 28 тысяч голов, птицы на 170 тысяч голов и обеспечить всё поголовье кормами на зимний период. Получим такой приплод по животноводству: 90 телят от каждых 100 коров, 110 ягнят от каждых 100 овцематок и 12 деловых поросят на каж- лую взрослую свиноматку. Доведем удой молока на каждую фуражную корову до 1200 литров. Ва протяжении опгани- хуем не менее как в 1/2 колхозов Черни- гов шины колхозные пасеки. Восстановим рыбное хозяйство колхозов и заведем ры- бу в водоемах.	vol-5823-page-02-seg-023-2244-1592-2902-2668.png
5823	2	2243	2683	2902	3785	163	0.94979	Чтобы обеспечить высокий урожай, мы организуем хоротпий уход за посевами. прополку всех зерновых культур два па- за, а технических три раза за лето. Убор- ку урожая зерновых проведем за 10 ра- бочих дней. обеспечив обязательное вя- зание снопов и скирдование всех хлебов. Мы обязуемся досрочно полностью Все государство польза обяза- тельства по сдаче зерна и других сель- сельскохозяйственных продуктов. Трактористы МТС бороться за обработку каждым трак- торой не менее 550 гектаров и за эки- номию не менее 5 процентов горючего. В железной поступи героической Крас- ной Армии на запад, в огне и дыму гигантской борьбы всходит заря нашей победы. Счастливый день близок. Клянем- ся Рам. озарит Сталин, что трудящие- ся Черниговщины с честью выполнят свое обязательство перед отчизной. перед Красной Армией. Векторе наступит тень, когта на советской снова рас- цветет мирный творческий труд миллио- нов трудящихся на благо нашей великий социалистической Родины. Порукой эти- стальная воля нашего народа. мутность и генпаткиость патего вечного божия, отпа напотного. Мартала Совет- ского Союза, любимого товарища Сталина.	vol-5823-page-02-seg-024-2243-2683-2902-3785.png
5823	2	2283	3793	2835	3910	10	0.90422	Слава нашей великой Родине! Слава героической Красной Армии Слава Сталину!	vol-5823-page-02-seg-025-2283-3793-2835-3910.png
5823	2	1669	3930	2866	4043	20	0.96004	Письмо обсудили на собраниях и подписали 345.412 колхозников, кол- хозниц, специалистов сельского хозяйства, рабочих МТЗ н совхозов Чер- кировской области.	vol-5823-page-02-seg-026-1669-3930-2866-4043.png
5823	2	3135	390	4049	565	3	0.84544	Управление танкового полка	vol-5823-page-02-seg-027-3135-0390-4049-0565.png
