volume_number	page_number	x1	y1	x2	y2	tokens_count	mean_confidence	text	image
5016	3	3769	2528	4447	3421	130	0.95460	Польская армия будет сражаться вместе Красной армией, бок-о-бок с ней. Это ее обязывает изучать уставы Красной армии. Их переводят на по ский язык, внима- тельно штудируют. Некоторые уставы при- няты в польской армии целиком. Наш солдат смелый, отважный, говорит генерал Андерс. В предстоящих боях с врагом мы будем драться до по следней капли крови. Нам некуда отсту- пать. Но мы победим, сражаясь вместе с мужественной Красной армией, при под- держке Великобритании, оказывающей на- шей армии огромную помощь, при содейст вии Соединенных Штатов Америки. Такой союз непобедим. На стрельбищах польской армии весь день трещат выстрелы. Командир пулемет ной роты поручик Сенкевич проверяй только что полученные станковые пулеме- ты. Песчаный откос за мишенями весь просверлен пулеметными очередями. Коман- дир пулеметного расчета, капрал метко поражает цель. Он имеет диплом за стрельбу из пулемета.	vol-5016-page-03-seg-062-3769-2528-4447-3421.png
5016	3	3769	3427	4445	3781	52	0.95682	В каждом взводе есть отделение истре- бителей танков из солдат-добровольцев... Вот один из них -Бреян Кирилл, смелый житель Карпатских гор, маленького роста живыми веселыми глазами. В число истребителей танков отбирают людей реши тельных, любящих риск. Вооруженные гра нотами и бутылками с горючей жидкостью они смело вступят в единоборство с немец- кими танками.	vol-5016-page-03-seg-063-3769-3427-4445-3781.png
5016	3	3767	3785	4445	4211	68	0.95313	Здесь выходит стенная дивизионная га зета "В походе". В комнате культофицера дивизии Пассека эту газету переписывают от руки в 16 экземплярах. Художники шестнадцать раз, но так же тщательно как и в первый, воспроизводят один и тот же рисунок, одну и ту же карикатуру, поистине в это дело они вкладывают всю свою душу. С любовью исполнен плакат на котором изображены советский, англии ский и польский бойцы, идущие нога в	vol-5016-page-03-seg-064-3767-3785-4445-4211.png
5016	3	3765	4213	4443	4676	78	0.95483	Лагерь польской дивизии живет напря- женной жизнью. Ровно в полдень над ла- герем раздается протяжный звук трубы Этот сигнал несколько веков подряд изо дня в день ровно в двенадцать часов зву- чал с древней башни одного из храмов Кракове. Теперь в Кракове хозяйничает извечный враг, Смолкла труба. Но снова зазвучала она над палатками польских солдат в русской степи, призывая их мщению. И как бы в ответ на этот при- зыв доносится грозный орудийный заил и рокот станковых пулеметов,	vol-5016-page-03-seg-065-3765-4213-4443-4676.png
5016	3	4169	4692	4391	4728	1	0.91432	ИЛЬЕНКОВ	vol-5016-page-03-seg-066-4169-4692-4391-4728.png
5016	3	3324	4814	4185	4868	3	0.95952	Заявление польского солдата	vol-5016-page-03-seg-067-3324-4814-4185-4868.png
5016	3	3070	4892	3741	5506	95	0.95544	ЗАПАДНЫЙ ФРОНТ, 4 ноября. (Спецкорр ТАСС). В первом же бою с нашими частя- ми поляки, насильно мобилизованные в немецко-фашистскую армию и зачисленные в состав 478 пехотного полка, бросили оружие и сдались в плен. Поляк Юзеф Вовжик при сдаче в плен сделал следующее заявление: Я добровольно сдаюсь в плен. Я был свидетелем неслыханного террора, который начался с первых же дней вступления гитлеровских на территорию Польши В течение всего времени с момента ок- купации польской территории, немцы бес- прерывно вывозят тысячи ни в чем непо винных людей в тюрьмы и концентрацион- ные лагери. У крестьян отопрается весь	vol-5016-page-03-seg-068-3070-4892-3741-5506.png
5016	3	3765	4896	4445	5398	75	0.96065	хлеб. К польскому населению фашист относятся, как к рабам. Польские солдаты в гитлеровской армии содержатся отвратительно. Они влачат там полуголодное существование. Еще находясь в 12 территориальном батальные, поляки договорились между собой о том, что как только часть попадет на фронт при пер вой возможности сдаться русским в плен Этот замысел теперь удалось осуществить Все мы хотим попасть в польскую армию формируемую на территории СССР, чтобы вместе с вами --- русскими - бить прок- лятых немцев.	vol-5016-page-03-seg-069-3765-4896-4445-5398.png
5016	3	3771	5400	4443	5506	8	0.95239	Подобные заявления сделали и многие другие пленные поляки.	vol-5016-page-03-seg-070-3771-5400-4443-5506.png
5016	3	3405	5574	4099	5619	4	0.94992	НОВЫЕ КНИГИ И ПЛАКАТЬ	vol-5016-page-03-seg-071-3405-5574-4099-5619.png
5016	3	3066	5647	3745	6253	86	0.94675	Куйбышевское областное отделение ОГИЗ'а уделяет значительное внимание выпуску оборонной литературы. Вышла в свет брошюра полковника Глазатова "Винтовка и ев применение". Пе Печатаются две другие книги того же ав- тора; «Ручной пулемет и его применение» и «Станковый пулемет и его применение». Издана утвержденная народным комис- саром обороны Союза ССР И. Сталиным «Инструкция по применению зажигатель- ных бутылок». В книге под названием «Будь готов к ПВХО" рассказывается о методах защиты: от фугасных, осколочных и зажигатель- ных бомб, от действия отравляющих ве- ществ и раз ясняются обязанности и пра-	vol-5016-page-03-seg-072-3066-5647-3745-6253.png
5016	3	3757	5653	4437	5717	5	0.94803	вила поведения населения по сигналам	vol-5016-page-03-seg-073-3757-5653-4437-5717.png
5016	3	3755	5727	4437	6257	68	0.94842	Этой же теме посвящены и выпуш- ные плакаты: «1ушение зажигате. авиабомб", "Первая помощь пострадавшим от боевых отравляющих веществ", «Про тивогаз БН", «Средства и способы дега- зации». Издательство выпустило также несколь- ко книг по материалам, опубликованным в центральной печати. В сборнике «Бесстрашные сыны роди- ны», который открывается стальей Ем. Ярославского - "Бесстрашие и героизм советских патриотов», напечатаны статьи очерки Алексея Толстого, В. Каверина, Я. Макаренко, Леонида Соболева и др.	vol-5016-page-03-seg-074-3755-5727-4437-6257.png
5016	4	2083	5396	2964	5426	7	0.96105	Мы двигались гуськом за командиром саперного взвода	vol-5016-page-04-seg-002-2083-5396-2964-5426.png
5016	4	2360	5478	3032	6131	78	0.94664	вспоминали о ней в походе! Белая, рас- рассыпчатая. Корка похрустывала на зубах Мы прикончили ее единым махом. Коман- дир крикнул: Васильич, давай пузана! Явился пузан в виде солидного нике- лированного самовара. Попили чайку. Командир поднялся. Пора! Мы вышли из хаты. Была ненастная грозовая ночь. После тепла нас сразу прохватил холодный, порывистый ветер... Впереди шел командир-сапер, который должен был провести нас по минным по лям: обз берега реки были минированы нашими войсками. Кроме того командир охоты выделил стрелковое подразделение.	vol-5016-page-04-seg-003-2360-5478-3032-6131.png
5016	4	3747	492	4417	528	8	0.94560	5 ноября 1941 г., среда № 261 (5016)	vol-5016-page-04-seg-004-3747-0492-4417-0528.png
5016	4	342	614	1615	754	5	0.95986	НА ОЧЕРЕДНОЙ ПРЕСС-КОНФЕРЕНЦИИ ИНОСТРАННЫХ КОРРЕСПОНДЕНТОВ	vol-5016-page-04-seg-005-0342-0614-1615-0754.png
5016	4	286	768	966	2826	284	0.96001	На состоявшейся 4 ноября пресс-конфе- франции анностранных корреспондентов за- неститель начальника Советского Информ- вапионного бюро т. С. А. Лозовский, от- зечая на письменный запрос чехословац- кого корреспондента «Ньюйоркские листы" г-на Вашека относительно сообщения Гер- чанского информационного бюро от 25 ок- гября "Об англо-советском давлении на Афганистан с целью добиться высылки немцев и итальянцев», заявил следующее: 11 октября посол СССР в Афганистано Михайлов, по поручению Советского Правительства, сделал премьер-министру Афганистана представление, в котором Со- ветское Правительство, руководствуясь чув- ством дружбы к афганскому народу и ува- жения независимости Афганистана, выра- зпло свою готовность оказать всемерное содействие дальнейшему процветанию аф- ганского государства, а также укреплять развивать экономические отношения ме- жду СССР и Афганистаном. По поручению Советского Правительства, посол еще раз подтвердил, что Советский Союз не питает никаких агрессивных намерений в одно- нении политической и территориальной неприкосновенности Афганистана и пеиз- менно стремится осуществлять политику дружбы и сотрудничества с Афганистаном интересах обеих стран. Однако наличие Афганистане немцев и итальянцев, рабо- тающих в афганских учреждениях и в не- которых министерствах Афганистана и ве- дущих враждебную интересам Советского союза деятельность, порождает тревогу Со- детского Правительства и опасения в от- тушении успешного развития дружествен- ных и добрососедских отношений Советским Союзом и Афганистаном. Врач- судебная Советскому Союзу и самому Аф- 'анистану деятельность немецких и италь- тайских фашистских групп на территории Афганистана приобрела особенно вызываю- пий характер с момента нападения гитле- дообской Германии на Советский Союз. Ра- ботающие в военном министерстве и в ми- акстерстве общественных работ Афганиста- ча агенты гитлеровской Германии, вроде Щенка, Фишера, Венгера, Кнерлейн и др., также агенты, выступающие в роли ком- мерсантов, вродо Гильхаммера, Спауде, Пауфеберга, за последнее время особенно усилили свою подрывную работу по орга- пизации террористических и диверсионных банг. Эти банды нападали на советские пограничные посты, пытались перебрасы-	vol-5016-page-04-seg-006-0286-0768-0966-2826.png
5016	4	990	778	1665	1555	100	0.95850	вать гитлеровских агентов в советские рес- публики Туркменистана, Узбекистана и Татжикистана. Наряду с немцами подрывной деятель- пастью Афганистане занимались также и итальянцы. От имени Советского Правительства по- сол СССР заявил, что преступная дея- тельность германской и итальянской агентуры, сожалению, не встречает должного отпора со стороны афганского правительства. Посол напомнил, что под- писанный 24 июня 1931 г. договор мо- жду СССР и Афганистаном о нейтралите- те и взаимном ненападении предусматри- вас, что "договаривающиеся стороны по допустят будут препятствовать па своей территории организации и деятель- пости группировок, а также будут пре- пятствовать деятельности отдельных лип, которые вредили бы другой договариваю- щейся стороне».	vol-5016-page-04-seg-007-0990-0778-1665-1555.png
5016	4	986	1561	1663	2486	133	0.96033	Исходя из сказанного. Соретское Прави- тельство сочло необходимым рекомендо- вать афганскому правительству, чтобы в ближайшее время все члены песенкой п итальянской колоний побинули Афтечи- стан и чтобы деятельность германской и итальянской миссий в Афганистане была взята под соответствующее наблюдение с тем, чтобы устранить возможность про- явления каких-либо вражеских действий как по отношению к Афганистану, так и по отношению к Советскому Союзу. Сделанное послом СССР заявление было рассмотрено правительством и парламент- ской комиссией Афганистана. 16 октября министр иностранных дел Афганистана со- общил послу СССР в Кабуле, что прави- тельство Афганистана, "исходя из друже- ственных отношений, существующих ме- жду Афганистаном и СССР, и желая еще раз показать Советскому Правительству, что дружба Афганистана к его соседям и, в частности, к СССР является искренней, решило принять совет правительства СССР и удалить из Афганистана немцев и италь- янцев».	vol-5016-page-04-seg-008-0986-1561-1663-2486.png
5016	4	982	2494	1655	2752	35	0.95150	Одновременно по этому же вопросу по- сланник Великобритании в Кабуле сделал афганскому правительству соответствующее заявление от имени своего правительства. По полученным нами сведениям, 29 и 30 октября начался отъезд немцев и италь- янцев из Афганистана.	vol-5016-page-04-seg-009-0982-2494-1655-2752.png
5016	4	984	2760	1647	2826	6	0.93300	Таково существо вопроса советско- афганских отношениях.	vol-5016-page-04-seg-010-0984-2760-1647-2826.png
5016	4	504	2884	1409	2984	7	0.96338	Сообщение американских журналистов о покушении на Муссолини	vol-5016-page-04-seg-011-0504-2884-1409-2984.png
5016	4	286	2994	954	3162	24	0.93112	ВАШИНГТОН, 4 ноября. (ТАСС). По со- общению газеты "Таймс геральд", извест- ные журналисты Пирсон и Аллен, высту- пая по радио, заявили, что недавно было	vol-5016-page-04-seg-012-0286-2994-0954-3162.png
5016	4	982	3000	1651	3174	23	0.95179	произведено покушение на Муссолини, По кушавшиеся произвели в Муссолини звали выстрела. Муссолини получил легкое ра- нение. Гесталю организовало усиленную охрану главаря итальянских фашистов.	vol-5016-page-04-seg-013-0982-3000-1651-3174.png
5016	4	452	3232	1465	3322	9	0.95536	успех пятиминутной забастовки во франции по призыву де голля	vol-5016-page-04-seg-014-0452-3232-1465-3322.png
5016	4	280	3330	952	3721	61	0.95651	лондон, 4 ноября. (ТАСС). Коррес- поинт газеты "Таймс", находящийся у французской границы, передает, что, не- смотря на жесткую цензуру, из Франции уже поступили многие сообщения о том, что 5-минутная забастовка, которой призывал генерал де Голль в знак проте- ста против массовых казней заложников, была проведена по всей Франции. В боль- шинстве городов и деревень французы в установленное время стояли молча на	vol-5016-page-04-seg-015-0280-3330-0952-3721.png
5016	4	980	3342	1649	3407	9	0.93729	одном месте или же собирались группами памятников жертвам войны.	vol-5016-page-04-seg-016-0980-3342-1649-3407.png
5016	4	1165	3435	1473	3467	2	0.92031	Протест Уругвая	vol-5016-page-04-seg-017-1165-3435-1473-3467.png
5016	4	974	3475	1651	3719	30	0.95177	ЛОНДОН, 4 ноября. (ТАСС). Как сооб- щает корреспондент агентства АФИ из Монтевидео, палата представителей Уруг- вая единодушно утвердила резолюцию протеста против расстрела заложников во Франции и других оккупированных стра- на	vol-5016-page-04-seg-018-0974-3475-1651-3719.png
5016	4	592	3779	1341	3825	5	0.92324	Мун Муниципальные выборы в США	vol-5016-page-04-seg-019-0592-3779-1341-3825.png
5016	4	278	3831	948	4083	32	0.94009	Нью-йорк, 4 ноября. (ТАСС). Сегодня Нью-Йорке и многих других городах происходят муниципальные выборы. B качестве кандидата республиканской партии и американской рабочей партии на пост мэра Нью-Йорка выставлен Ла Гар- Кандидатом демократической партии	vol-5016-page-04-seg-020-0278-3831-0948-4083.png
5016	4	976	3847	1649	4077	29	0.92750	на этот пост является 0'Дауэр, которого поддерживают наиболее реакционные круги Нью-Йорка. Недавно, выступая на пресс- конференции, Рузвельт указал, что он яв- ляется сторонником переизбрания Ла Гар- диа мэром Нью-Йорка.	vol-5016-page-04-seg-021-0976-3847-1649-4077.png
5016	4	1821	614	2240	742	5	0.98125	РОСТ НЕДОВОЛЬСТВА ВОЙНОЙ В РУМЫНИИ	vol-5016-page-04-seg-022-1821-0614-2240-0742.png
5016	4	1683	768	2362	1769	160	0.96628	СТАМБУЛ, 4 ноября. (ТАСС). Стамоуль- ский корреспондент газеты «Дейли мейл», ссылаясь на сведения, полученные от не- посредственных свидетелей и представите- лей осведомленных дипломатических кругов, передает, что по меро того, как в румын- ские семьи проникают известия о том, что их отцы, сыновья и мужья, которых они ожидают, никогда не вернутся пим, страну охватывает жестокое разочарование. B В течение трех дней в Бухаресте было запрещено появляться на улице с 11 ча- сов вечера и до рассвета, причем за нару- шение этого распоряжения была установ- лена смертная казнь. Это мероприятие бы- ло проведено для того, чтобы население не могло видеть бесконечные процессии сани- тарных машин, которые работают до рас- света, разгружая длинные эшелоны, доста- вившие раненых. Эти эшелоны задержива- ются на определенном расстоянии от сто- лица до наступления часа, когда никто не может появиться на улице, после чего са- нитарные поезда сразу подходят ко всем вокзалам. Однако, несмотря на все ухищ- репия румынских властей, население быст- ро разгадала причину введения "осадного положения».	vol-5016-page-04-seg-023-1683-0768-2362-1769.png
