volume_number	page_number	x1	y1	x2	y2	tokens_count	mean_confidence	text	image
5446	2	3637	4190	4316	5012	126	0.95989	лубина танкового удара B каж- дом случае определяется целью данной операции. Но эта глубина не может быть беспредельной. В ходе боев танки несут потери, и может наступить момент, когда мощь снизится настолько, что они будут нуждаться в отдыхе п восстановлении по- терь. Это обстоятельство всегда нужно принимать во внимание. Опыт показывает, что затухание крупного танкового насту- пления обычно совпадает с затуханием на- ступательной операции в целом, если она не будет развита своими силами. Когда таких сил нет, то старший войсковой на- чальник, исчерпав ударную мощь подвиж- ных частей (танковые и механизированные соединения), должен прочно закрепиться на рубежах. достигнутых в результате на- ступления, и обеспечить их удержание си- лами пехоты и артиллерии. Танковый со- единениям надо дать возможность полно- стью восстановить свою мощь для новых глубоких удалов.	vol-5446-page-02-seg-065-3637-4190-4316-5012.png
5446	2	327	5937	2125	5969	12	0.95636	ДЕЙСТВУЮЩАЯ АРМИЯ. Части Красной Армии переправляются по мосту, наведенному в верховьях Днепра	vol-5446-page-02-seg-066-0327-5937-2125-5969.png
5446	2	3329	5933	4176	5961	7	0.94899	Снимок нашего спец. фотокорр. майора С. Лоскутова	vol-5446-page-02-seg-067-3329-5933-4176-5961.png
5446	3	313	147	981	183	7	0.87738	марта 1943 г., среда. № 75 (5446)	vol-5446-page-03-seg-001-0313-0147-0981-0183.png
5446	3	529	262	1357	355	2	0.91657	Воздушная разведка	vol-5446-page-03-seg-003-0529-0262-1357-0355.png
5446	3	684	368	1194	442	1	0.87668	истребителей	vol-5446-page-03-seg-004-0684-0368-1194-0442.png
5446	3	253	468	937	2737	324	0.94697	Ближняя воздушная разведка C по- Мощью самолетов-истиебит:лей все белее авиачастей. Выгоды ее неоспорнику, скольку она имеет в отдельных случаях воздушной разведен. Истиногтель более ма- новые и обладает большей скоростью 110 с другими разведывательными самолетами. кому же он способен дей- ствовать в опасных районах. 1.главное преимущество. этого вида воздуш- ной разведы в том, что при хорошей сро организации готовые данные о противнике могут быть получены от лет- миков через 30 --10 минут. Большой опыт в этой отношении нако- летчики истребительной части, кото- рой командует майор Семенко.- Они ведут разведку почти систематически, работая «на себя»; так и на наземные войска. Обычно разведывательный полет выпол- нястся парами, в строю псленга. этом ведущий разведывает, а ведомый прикры- знает его. Таким образом, основной развет- час, не отвлекаясь, смотрит только за зом- тей, а следующий с ним в паланге налар- не следит за воздухом, предупреждая ** появлении вражеских истребителей. Ди- - - станция и интервал между самолетами 100 -150 метров. Это позволяет истреби- гелям свободно маневрировать при обстре- с земли, резко разворачиваться, a случае необходимости быстро принимать боевой порядок для отражения атаки. Высота, на которой ходят разведчики, невелика. Она не превышает 2000 метров, потому что на больших высотах резко ухудшается видимость наземных роботов. Наиболее приемлемая высота полета 300-600 метров, а в отдельных случаях самолеты снижаются до 50 метров. От Опыт показывает, что разведчикам не сталкер давать определенный маршрут : аншь связывает их действия. Обыч- но старший пары, получив задание, вы- бирает путь по своему усмотрению и чаще. всего следует по ломанову маршруту. Та- 1: кой прием сбивает с толку противника сильно затрудняет перехват самоле- тов. производящих разведку. В части, о которой здесь идет речь, одних тех же летчиков посылают посто- : в определенные районы. Это во многом облегчает разведку Летчики, хорошо изу- чисшие порученный район, свободно уверенно выполняют задания п в плохую погоду. Полчас они настолько привыкают местности, что даже малейшие пзиене- ния в этом районе, те иные новые тесты, самые незначительные перегруп- инровки ройс протвеннка не ускользают от внимания.	vol-5446-page-03-seg-005-0253-0468-0937-2737.png
5446	3	253	2741	932	3076	45	0.94818	Строителям, ведущим разведку, до- ступны почти все ближние объекты (же- лезнодорожные углы, войска противника. дороги) даже многие из тех, которые расположены в районах, где противник имеет сильное прикрытие с воздуха. На- сколько действенна подобная разведка, под- тветадают следующие примеры. Недавно на одном участке фронта коман-	vol-5446-page-03-seg-006-0253-2741-0932-3076.png
5446	3	253	3084	932	3384	42	0.94354	дованию нужно было срочно узнать, пере- двигаются ли немецкие войска по дороге между двумя крупными населенными пунк- тами. Требовалось также установить, рабо- тает ли железнодорожная станция в дан- ном районе. Погода стояла плохая. На разведку были иссланы летчики-истребите- ли Отлесный и Цыганов.	vol-5446-page-03-seg-007-0253-3084-0932-3384.png
5446	3	259	3390	934	4004	89	0.94771	Перелетев линию фронта на высоте 1.500 метров, летчики постепенно снижа- нись и вышли в указанный район на вы- соте 150 метров. Без особого труда обна- рузиля они движение пехоты противника и направились к железнодорожной станции, где заметили четыре немецких эшелона с войсками и техникой. Отличный тотчас же передал на земле короткую радиограмму этих эшелонах. Получив донесение по радио, командир штурмовой части немед- ленно выслал группу штурмовиков, кото- рые нанесли удар, пока вражеские эшело- ны еще не рассредоточились. Все эти дей- ствля, включая и разведку, заняли всего только пятьдесят минут.	vol-5446-page-03-seg-008-0259-3390-0934-4004.png
5446	3	938	468	1626	3172	383	0.95037	Босая правила тасти, гозглавляемой майором Семенко, много показала, что летчики-ист сибсобны достаточно точно и последовательно контролировать подвижные части противника. иведел наиболее характерный пример, На одной дороге неожидании печенла по- r немецкая танковая колонна, которую продол- жительное время подстедатели наше штур- Вражеские танки слеено провали- лист, и обнаружить их снова никто не смог. Тогда на попеки была направлена лара истребителей. Не найдя. ничего на дороге, отдельных малии и повозод, летчики, хорошо знаете сообрази- в чем дело. Они свернули в сторону 11 обнаружили танковую группу в укром- сонной лощине. Танки противника находились на заправке, готовые вступить в Таз- сразу же сообщили по радио, где находится колонна, а через несколько ин- пут по ударили наши штурмовики пикирующие бомбардировщики. Спустя не- которое после атаки другая пара --- разводит о в проверила результаты налет послала радиограмму: "Танки горят". Астчини-истребители не раз помогали своей разведкой командованию внести яс- ность в наземную обстановку особенно тогда, когда части постоянно находились в движении и поэтому... не всегда вилась точная информация. В этом отношении по- казательна разведка, производстная лет- чикази Усевичем и Антоновым. : Однажды во время наступления созда- лась весьма сложная и неясная обстанов- ка. Наземному командованию требовалось выявить положение на флангах друг ча- стей, которые в годе бол должны были сосдишиться. От результатов воздушной разведки зависел дальнейший маневр этих частей. Аотя видимость была плохая, дет- Усевич и Антонов, идя бреющим по- летом, точно установили, что фланги ча- стей близки к соединению, Через корот- кий промежуток времени общевойсковой командир принял. соответствующее меше- еие, которое ускорило дальнейший ход операции. В практике потребителей были и такие случае, когда им приходилось выполнять весьма щекотливые разведывательные за- - дания. Так, на одном участке фронта не- родвигавингеся немецкие части света в за- б.туждемие наши штурмовые экимажи, по- : давая ту сигналы с земли. Посланные на разведку истребители помогли раскрыть эту вражескую уювку. Они спизитись до бреющего полета, в два-три захода опоз- нат немецкие части по одежде солдат тепу автоматич навели на них штурмо- вую авиацию. которая разгромкта вражес- кую колонну. Переулка, чтобы добыть точ- ные сведения, летчикам приходится вызы- вать на себя с земли огонь противника. разведывательных полетах летчики- истребители приобрели хорошую хватку, выработали своеобразные приемы действий. Находясь на разведываемым объектом зи- нинальное время, они узнают все, что пи нужно. Обычно они появляются и уходят обратно в разных направлениях, тактный раз меняют методы своей ответственной боевой работы.	vol-5446-page-03-seg-009-0938-0468-1626-3172.png
5446	3	951	3178	1618	3914	96	0.94760	Должен ли истребитель, находящиеся в разведке, вести воздушный бой? Вопрос чрезвычайно острый, поскольку летчику всегда хочется пойти в боевое соприкос- новение с противником. жизнь дает на этот вопрос следующий ответ. Если лет- чики производят разведку, им не нужно самим завязывать воздушный бой, фото- что основная их цель --- разведка. Но когда воздушный бой неизбежен, когда навязан противников, естественно, что истребители будут драться! Разведка истребителей является весьма эффективной и нужной. Она полностью себя оправдала. Поэтому командиры авиа- ционных частей должны уделять ей еще большее внимание и соответственно поощ- рять летный состав, выполняющий эту важную и необходимую работу.	vol-5446-page-03-seg-010-0951-3178-1618-3914.png
5446	3	983	3934	1573	4010	5	0.95556	Майор С. ЧУХНОВ ДЕЙСТВУЮЩАЯ АРМИЯ.	vol-5446-page-03-seg-011-0983-3934-1573-4010.png
5446	3	1677	1213	2955	1372	42	0.96566	ЗАПАДНЫЙ ФРОНТ. Минеры подразделения старшего лейтенанта Ф. Скрип- никова на-днях обнаружили на магистрали Москва-Минск четыре огромных фугаса, заложенных немцами при отступлении. Фугасы были снабжены часовыми взрывателями замедленного действия, до 21 суток. На снимке: старший сержант B. Юченкоб передает взрыватель, извлеченный из мины.	vol-5446-page-03-seg-012-1677-1213-2955-1372.png
5446	3	2096	1393	2953	1423	7	0.93004	Снимок нашего спец. фотокорр. майора С. Лоскутова.	vol-5446-page-03-seg-013-2096-1393-2953-1423.png
5446	3	1881	1512	2737	1639	6	0.96842	В районе среднего течения Северного Донца	vol-5446-page-03-seg-014-1881-1512-2737-1639.png
5446	3	1635	1656	2312	3065	198	0.95174	действующая армия, 30 марта. (По телеграфу от наш. керр.). В районе сред- него течения Северного Донца сегодня в течение дня происходили упорные бон. :: последние дни немецко-фашистские командование усиленно сосредоточивала на одном участке танковые и пехотные час- ти. Сегодня противник силами танковой дивизии перешел здесь в наступление. Немцы наносили удар на узком участке. Они, видныхо, намеревались быстро прор- вать налиу оборону, чтобы потом продол- жить наступление. С этой целью в первые алаки немцы бросили значительное ко- личество танков, артиллерии и пехоты. Несмотря на то, что атаки противника были ожесточенными и в них уЧаствова- большие силы, этп атаки успеха не имели. Наши части встретили немцев сидь- ным артиллерийским и минометным огнем. Потеряв несколько бронированных машин артиллерийских орудий, противник пре- кратил свои атаки. Однако спустя некоторое время немцы слова предприняли наступление. Оно вс- лось несколькими эшелонами. Сперва в атаку пошла группа танков, поддержанная артиллерией и пехотой, a когда наши части нанесли этой группе урон и. отбор- сняли ее, в бой вступил второй вражеский эшелон. Бой длился, таким образом, весь день. Хотя неприятель вел наступление на узком участке крупными силами, ему не удалось прорвать нашу оборону. Части соединения, упорно обороняя занимае- мые позиции, отбили все атаки немцев всюду удерживают свои оборонительные	vol-5446-page-03-seg-015-1635-1656-2312-3065.png
5446	3	2325	1662	2996	1837	22	0.95513	рубежи. Немецко-фашистские войска понес- огромные потери. На поле боя они оставили значительное количество танков и артиллерийских орудий, много трупов солдат и офицеров.	vol-5446-page-03-seg-016-2325-1662-2996-1837.png
5446	3	2312	1841	2995	3065	173	0.95430	Особенно большой урон неприятель по- терпел на тех участках, где нани части предпринимали смелые и решительные контратаки. В районе одного населенного пушка нежцы несколько раз атаковали наши позиции. Они не сумели сломить согротныление N части, оборонявшей этот участок, были основательно потрепаны и обескровлены. богда вражеские атаки ста- ли выдыхаться, N часть неожиданно для противника перешла в контратаку. Немцы попытались оказать сопротивление, приня- ли боевой порядок для обороны, начали закрепляться. Но контратака N части бы- ла настолько стремительной, что против- ние не успел подготовиться к обороне. Неся большие потери, немцы отступили. На соседнем направлении вражеская группа танков пыталась вклиниться в бое- вые порядки N части. как только не- сколько неприятельских танков и авто матчики атаковали наши позиции и начали проникать в расположение части, ее под- разделения перешли в контратаку одно- временно с двух направлений. После ко- роткого боя немецкие танки и автоматчи- ки были отрезаны от своих войск. Чтобы не дать противнику опомниться, наши подразделения немедленно атаковали ок- руженного противника, Ни одному гитле- ровцу уйти отсюда не удалось. 22 танка было подбито и сожжено.	vol-5446-page-03-seg-017-2312-1841-2995-3065.png
5446	3	1996	3123	2633	3182	3	0.97000	На Западном фронте	vol-5446-page-03-seg-018-1996-3123-2633-3182.png
5446	3	1635	3197	2308	4012	108	0.94858	ЗАПАДНЫЙ ФРОНТ, 30 марта. (По те- лефону от наш. корр. ). Несмотря на тяже- лые условия погоды. --- разлившиеся реки, бурное таяние снега, непрерывный дождь, части Западного фронта продолжают вести бси с противником. N соединению удалось выбить противника из двух опор- ных пунктов. Немцы продолжают сосредоточивать на своих оборонительных рубежах миномет- ные и артимерийские батареи, стремясь массированным огнем воспрепятствовать активным действиям над их частей. В ря- де мест противник переходы в контрата- ки. В одной контратаке немцы применили для поддержки пехоты небольшую группу танков и массированный огонь артилле- рип. Сосредоточив превосходящие силы, неприятель пытался сбить наши подраз- деления с отвоеванного ими рубежа. Контр- атака немцев была встречена организован-	vol-5446-page-03-seg-019-1635-3197-2308-4012.png
5446	3	2327	3199	2993	3350	16	0.94902	ным огнем пехоты, а также артиллерии, стрелявшей с открытых позиций. Понеся большие потери, неприятель откатился обратно.	vol-5446-page-03-seg-020-2327-3199-2993-3350.png
5446	3	2325	3358	2996	4014	89	0.94995	Продолжают поступать сведения о звер- ствах немецко-фашистских захватчиков в прифронтовых районах Смоленщины. Осу- ществ,тяя свою программу поголовного уничтожения местных жителей, при отходе немцы дотла сжигают деревни и расстре- ливалот население. В деревне Иванисово, имевшей 75 жилых домов, сохранилась только одна баня. Вступив в эту деревню, наши бойцы обнаружили до тысячи тру- пов расстрелянных мирных жителей. Фаши- стские изверги перед отступлением строи- ли стариков, женщин и детей по 10--12 в ряд и беспощадно расстреливали их из ав- томатов. Чтобы скрыть следы преступле- ния, фашистские разбойники сжигают тру- пы замученных людей.	vol-5446-page-03-seg-021-2325-3358-2996-4014.png
5446	3	3159	270	4243	370	2	0.97099	Партийное поручение	vol-5446-page-03-seg-022-3159-0270-4243-0370.png
