volume_number	page_number	x1	y1	x2	y2	tokens_count	mean_confidence	text	image
5789	2	394	382	2054	698	20	0.95723	Письмо ленинградских партизан, партизанок и трудящихся освобожденных городов и районов Ленинградской области Великому вождю народов Маршалу Советского Союза товарищу СТАЛИНУ	vol-5789-page-02-seg-003-0394-0382-2054-0698.png
5789	2	217	721	873	969	31	0.95782	Дорогой Иосиф Виссарионович! Наша героическая Красная Армия одержала еще одну историческую победу. Великий город Ленина освобожден от вра- жеской блокады. Десятки городов и тысячи деревень нашей области вновь стали со- ветскими.	vol-5789-page-02-seg-004-0217-0721-0873-0969.png
5789	2	215	977	871	1152	29	0.94016	Ликует народ, прославляя свою освобо- жительницу - Красную Армию. Свободно значит родная русская речь, и у всех на устах, у всех в сердце Ваше имя, великий -вождь и полководец.	vol-5789-page-02-seg-005-0215-0977-0871-1152.png
5789	2	215	1156	871	1363	29	0.95843	Дорогой наш отец! Сейчас, когда гитле- ревекие разбойничьи полчища разгромлены вышвырнуты из наших районов, мы чувствуем с особой силой, каким кошма- ром были для нас дни немецкой оккупа -	vol-5789-page-02-seg-006-0215-1156-0871-1363.png
5789	2	211	1373	871	1879	79	0.95271	Два с половиной года назад враг во- рвался в пределы древних русских зе- мель Псковщины Новгородчины. Сердце сжимается от боли, когда вспом- нишь, что натворили в своей звериной злобе фашистские изверги. Огню и разрушению предали они всё, что было нажито нашим честным трудом. Слезами и кровью залили фашисты наш родимый край, тяжелым сапогом придавили нашу жизнь. Много тысяч советских патриотов замучили, по- весили и расстреляли эти палачи. Десятки тысяч наших братьев и сестер угнали на фашистскую каторгу в Германию.	vol-5789-page-02-seg-007-0211-1373-0871-1879.png
5789	2	217	1889	871	2104	31	0.95132	Дикин произволом, насилиями и убий- ствами германские империалисты думали покорить русских людей, превратить их в безмолвных рабов. Они думали, что ленин- градская земля станет навечно собствен- ностью немецких князей и баронов.	vol-5789-page-02-seg-008-0217-1889-0871-2104.png
5789	2	217	2116	867	2216	15	0.92525	Но не было еще никогда в нашей исто- рын, чтобы русский народ стоял на коле	vol-5789-page-02-seg-009-0217-2116-0867-2216.png
5789	2	213	2227	871	2733	82	0.94340	Родной Иосиф Виссарионович! Ни пыт- кл, ни расстрелы, ни виселицы и прово- кации, ни лживая фашистская пропаган- да ничто не могло сломить нашего духа. Сквозь все испытания и трудности мы свято пронесли свою верность Родине, свою нерушимую веру в победу. Все наши мысли и чувства были с Вами. В наших сердцах горела твердая уверенность, что все планы людоеда Гитлера рухнут, что epar будет разбит и уничтожен. И мы го- ворили: "Будем биться не на жизнь, а на- смерть с немецко-фашистскими захватчи- камп».	vol-5789-page-02-seg-010-0213-2227-0871-2733.png
5789	2	213	2735	869	3166	57	0.95409	Тысячи советских патриотов-псковичи лужане, новгородцы, порховчапе, гдовичи поднялись по Вашему зову, товарищ Сталин, на священную всенародную нар- тизанскую войну против ненавистных гит- леровских палачей и разбойбиков. Полные ярости и гнева, мы взялись за оружие. чтобы отстоять честь, свободу и независи мость нашей Родины, помогать Красной Армии истреблять фашистскую нечисть, растить немецким мерзавцам за все их зло- деяния.	vol-5789-page-02-seg-011-0213-2735-0869-3166.png
5789	2	213	3170	869	3680	72	0.95741	И мы метили, беспощадно уничтожая гитлеровских злодеев и их подлых при- служников предателей Родины. Партийные организации возглавили все- народную борьбу против немецких захват- чиков. Секретари райкомов, председатели райисполкомов и другие партийные и со- ветские работники составили боевое ядро партизанского движения. Верные сыны Родины, партии Ленина--Сталина, - они остались с нами в тылу врага и своим личным примером сплачивали наши ряды. Многие из них пали смертью храбрых в борьбе за наше правое дело.	vol-5789-page-02-seg-012-0213-3170-0869-3680.png
5789	2	213	3689	869	4049	50	0.95729	Гитлеровцы не раз угрожали уничтожить партизан. Они предпринимали множеств карательных экспедиций, поддерживаемых танками, артиллерией и авиацией. Но тщетны были все их попытки погасить пламя народной войны. Фашистские звер- ства поднимали в наших сердцах еще боль- шую ярость. На каждое злодейство немцев партизаны и партизанки отвечали усиле нием ударов по врагу.	vol-5789-page-02-seg-013-0213-3689-0869-4049.png
5789	2	211	4057	869	4524	73	0.95651	Ни на один день не затихала за всё это время партизанская война в тылу немецких захватчиков, Все трудящиеся от мала до велика помогали партизанам. Самоотвер- женно боролись советские люди против немцев, не выполняя их приказов сдаче хлеба и других продуктов, не выходили на строительство укреплений. Крестьяне прятали от фашистских грабителей свое добро, зарывали в землю зерно, овощи. картофель. Женщины с детьми и старики целыми деревнями укрывались в лесах. брали под свою защиту партизаны.	vol-5789-page-02-seg-014-0211-4057-0869-4524.png
5789	2	892	723	1552	1481	106	0.96159	Особенно широкий размах приняло все- народное партизанское движение осенью 1943 года, когда немецкое командование, чуя, что приходит конец фашистскому хо- зяйничалью на ленинградской земле, отда- ло приказ об угоне всего населения в про- клятую неметчину, о массовом сжигании сел и деревень. Чаша народного терпения переполнилась. Во многих районах вспыхнуло народное восстание. Развернулась ожесточенная борьба за спасение населения от угона в немецкое рабство. Народ поднялся на за- щиту своих семей, своих домашних очагов. своих деревень. Повсюду пронесся боевой клич: «Не дадим угонять себя в немец- кое рабство. Не дадим немцам сжигать наши дома и хозяйственные постройки! Превратим каждую деревню в крепость всенародной борьбы против гитлеровских захватчиков! »	vol-5789-page-02-seg-015-0892-0723-1552-1481.png
5789	2	890	1494	1546	1815	44	0.94791	Сотни тысяч людей- мужчин, женщин юношей и девушек - были избавлены благодаря своим защитникам-партизанам от участи рабов, от неминуемой гибели на германской каторге. Партизаны выходили на железные дороги и силой отбивали це- лые эшелоны советских граждан, насильно 01 гравляемых фашистскими рабовладель- нами в Германию.	vol-5789-page-02-seg-016-0890-1494-1546-1815.png
5789	2	890	1827	1546	2293	62	0.95827	Всюду, где восставал народ, разгона- лись немецкие органы управления, а вместе них создавались органы народной власти. каждой деревне были организованы созданы вооруженные отряды. И когда пришло время победоносного наступления войск Ленинградского и Волховского Фрон- тов, когда пробил час освобождения вели- кого города Ленина от вражеской блока- ды, армия ленинградских партизан, зака- ленная в предыдущих боях, была подго- товлена решению новых заданий Командования.	vol-5789-page-02-seg-017-0890-1827-1546-2293.png
5789	2	892	2302	1544	2627	47	0.94692	Мы счастливы рапортовать Вам, товарищ Сталин, что, взаимодействуя с на- ступающими частями Красной Армии, вы- полип ли с честью свой долг перед Роди- ной, перед героическим Ленинградом. Мы горды сознанием, что и наши усилия по- служили делу победы великого города. которому каждый из нас присягал на верность.	vol-5789-page-02-seg-018-0892-2302-1544-2627.png
5789	2	890	2639	1544	3797	158	0.96327	Когда немцы, напрягая все свои силы. пытались остановить успешное продвиже- ние наших войск, бросая на фронт люд- ские резервы и технику, наши отряды вместе с населением оккупированных рай- онов раздули во-всю пламя всенародной борьбы на вражеских коммуникациях. Пачалась не утихающая ни на один час партизанская война на железных и шос- сейных дорогах. Главные усилия были направлены к выводу из строя Варшав- ской, Балтийской и Витебской железных дорог решающих для врага магистра лей. От скрытых диверсий народные мстители перешли к открытым боям с немцами за овладение важнейшими участ- ками путн, станциями, железнодорожны ми узлами. Крестьяне устраивали завалы на шоссейных п проселочных дорогах, разбирали и сжигали мосты. Движение немецких поездов и автоколонн было. таким образом, полностью или на дли- тельный срок парализовано. Последний этап борьбы ленинградские партизаны ознаменовали захватом ряда населенных пунктов. Народные мстители вместе с частями Красной Армии брали штурмом города, преодолевали вражеские узлы сопротивления, захватывали собст венными силами населенные пункты и удерживали их до подхода регулярных воинских частей.	vol-5789-page-02-seg-019-0890-2639-1544-3797.png
5789	2	890	3807	1544	4428	80	0.94905	В боях за Родину, за Ленинград вы- росли и закалились тысячи отважных в мужественных бойцов, удостоенных высо: кой правительственной награды. Из среды партизан Ленинградской области вышли Герои Советского Союза Харченко, Шет- рова, Никитин, Васильев, Герман, Вино- куров, Голиков, Зиновьев, Егоров, Кариц- кий, Никифоров, Сергунин, Соколов, Плохой, Тараканов, Григорьев Александр. ригорьев Григорий, совершившие без: смертные подвиги во славу отчизны. Мы черпали вдохновение в стойкости и непоколебимости славных ленинградцев Нас вел в бой Ваш верный соратник. руководитель ленинградских большевиков Андрей Александрович Жданов.	vol-5789-page-02-seg-020-0890-3807-1544-4428.png
5789	2	1569	725	2225	1084	52	0.94630	Образ великого города Лепина--города- воина, города-героя- всегда стоял перед нами. Он поднимал наш дух, нашу волю борьбе и победе. Каждый из нас мыс- ленно говорил себе: Родной Ленинград! Тебе мы дали свою партизанскую клятву. Пока сердце бьется в груди нашей, мы будем биться врагом за тебя, за свободу и счастье нашего народа.	vol-5789-page-02-seg-021-1569-0725-2225-1084.png
5789	2	1567	1086	2223	1660	90	0.96157	Дорогой Иосиф Виссарионович! Борьба против немецко-фашистских за- хватчиков не окончена. Десятки и сотни тысяч паших братьев и сестер еще стонут под игом гитлеровских мерзавцев. Даем Вам свое нерушимое слово, товарищ Сталин, что не сложим оружия до тех пор, пока не будет одержана полная победа над всей гитлеровской Германией и ее со- общниками по разбою. Десятки тысяч наших братьев и отцов уже вступили в ряды Красной Армии, чтобы отдать весь накопленный в боях опыт, всё свое воин свое умение и мастерство борьбе за осу- ществление наших благородных и возвы шинных целей.	vol-5789-page-02-seg-022-1567-1086-2223-1660.png
5789	2	1567	1665	2221	1946	35	0.92868	m Теперь, товарищ Сталин, перед трудя- щимися Ленинградской области встают но- : вые грандиозные задачи. Нам предстоит восстановить разрушенное немецкими из- вергами сельское хозяйство, промышлен- ность, культурные учреждения, воздвиг- нуть вместо сожженных новые города села.	vol-5789-page-02-seg-023-1567-1665-2221-1946.png
5789	2	1567	1954	2221	2310	54	0.96533	Мы отдаем себе полный отчет, насколь- ко серьезны и сложны эти задачи. Но не в натуре большевиков и воспитанных имп советских людей пугаться трудностей, впадать в уныние. Велико наше горе. Велики разрушения, причиненные нашему хозяйству и культуре немецкими варвара- ми, но ничто не помешает нам в корот- кий срок ликвидировать последствия хозй- ничания немцев.	vol-5789-page-02-seg-024-1567-1954-2221-2310.png
5789	2	1565	2323	2219	2681	52	0.95981	Горя желанием как можно быстрее вос- становить наши города и села, мы взя- лись, засучив рукава, за работу. Близится весенний сев, мы готовимся встретить этот первый сев после освобождения от немец: кой неволи по-большевистски. Нами вос созданы колхозы, проведена засыпка се менного фонда. Мы уже засыпали зерна 86.775 центнеров, картофеля 137.807 центнеров.	vol-5789-page-02-seg-025-1565-2323-2219-2681.png
5789	2	1567	2685	2221	2970	42	0.95295	Каждый из нас стремится сделать всё для ускорения разгрома гитлеровских ар- мий. Мы собрали и передали в фонд обо- рэны 3.650.000 рублей деньгами и 1,5 миллиона рублей облигациями. Кроме тигго, нами внесено в фонд Красной Армии зерна 15.295 пулов, картофеля 12.873 пудов.	vol-5789-page-02-seg-026-1567-2685-2221-2970.png
5789	2	1565	2972	2218	3185	31	0.94241	Дорогой Послф Виссарионович! Мы уве- рены в своих силах. Нет таких трудно- стей, которые не мог бы одолеть наш народ, руководимый испытанной и зака- ленной в боях великой партней Ленина- Сталина.	vol-5789-page-02-seg-027-1565-2972-2218-3185.png
5789	2	1565	3195	2218	3406	30	0.95820	хныкать, не сидеть, скрестивши предаваясь горестным воспомина- ниям, а работать изо всех --- BOT что требуется сейчас от каждого из нас. Так учит партия большевиков, так учите Вы, товарищ Сталин.	vol-5789-page-02-seg-028-1565-3195-2218-3406.png
5789	2	1565	3408	2219	3949	79	0.96448	Пройдет немного времени, и там, где теперь громоздятся обуглившиеся развали- пы, поднимутся из пепелац города села. Вновь заколосятся вытоптанные фа- шистскими ордами поля. Вновь расцветет свободная и счастливая жизнь. Родной наш товарищ Сталин! Клянемся Вам и в Вашем лице большевистской пар- тии и всему советскому народу, что трудя- щиеся Ленинградской области всегда будут в передовых рядах борцов за честь, свобо- и независимость нашей Родины, что они отдадут все свои силы на ускорение нашей полной и окончательной победы над фашизмом.	vol-5789-page-02-seg-029-1565-3408-2219-3949.png
5789	2	1567	3957	2218	4209	35	0.95864	Примите, товарищ Сталин, наш пламен- тый привет и сердечное пожелание доброго здоровья и сил на многие, многие годы. Мы провозглашаем здравицу Вам, доро- гой Иосиф Виссарионович. Мы провозгла- чаем здравину героическим воинам Крас- пой Армии.	vol-5789-page-02-seg-030-1567-3957-2218-4209.png
5789	2	1562	4211	2216	4424	21	0.95001	Слава Вам, великому Маршалу Совет- ского Союза, гениальному вождю и пол- коволцу! Слава отчизне нашей нерушимому Союзу Советских Социалистических Рес- публик!	vol-5789-page-02-seg-031-1562-4211-2216-4424.png
5789	2	907	4441	2183	4516	19	0.95985	Письмо обсудили и подписали партизаны, партизанки и трудящиеся освобож- денных городов и районов Ленинградской области в количестве 365.892 человека...	vol-5789-page-02-seg-032-0907-4441-2183-4516.png
5789	2	400	4599	2029	4736	9	0.93262	Москва, Кремль Верховному Главнокомандующему Маршалу Советского Союза товарищу СТАЛИНУ	vol-5789-page-02-seg-033-0400-4599-2029-4736.png
5789	2	207	4755	867	5342	70	0.94074	Дорогой Иосиф Виссарионович! Личный состав Эстонской воинской ча- сти красной Армии, граждане первых осво- божденных волостей Эстонской ССР, вместе с гражданами Эстонской ССР, работающими в советском тылу, вдохновленные великими историческими победами Красной Армии и близкой перспективой освобождения от не- мецких оккупантов нашей родной Советской Эстонии, с большим патриотическим под'е- мом в короткий срок собрали на постройку танковой колонны "Лембиту" и эскадрилья самолетов «Тазуя» 9.060.000 рублей. Пусть танковая колонна «Лембиту», нося-	vol-5789-page-02-seg-034-0207-4755-0867-5342.png
5789	2	886	4749	1548	5190	55	0.93891	щая храброго полководца древних эстонцев в их боях против немецких псов- рыцарей, и эскадрилья самолетов «Тазуя», носящая имя легендарного руководителя восстания эстонского народа против не- мелких рыцарей-помещиков 23 апреля 1343 года, обрушивают всю силу ярости и ненависти эстонского народа против своих вековых врагов немецких за- хватчиков. Вместе с другими братскими народами СССР эстонский народ отдает	vol-5789-page-02-seg-035-0886-4749-1548-5190.png
