volume_number	page_number	x1	y1	x2	y2	tokens_count	mean_confidence	text	image
5663	3	2032	3548	2882	3949	78	0.95582	преодолеть озверелый враг, впавший в неистовую зло- бу. Пусть же эта кровь падет на его голову! Немец- кие и финские злодеи хотят разрушить Ленинград. Потеряв надежду взять город, они хотят перебить его жителей, зверски обстреливая улицы и дома. Пусть же обрушится на них беспощадная месть! Кровь ле- нинградцев на улицах и в домах нашего родного го- рода должна быть отомщена. Мы знаем, мы верим: час расплаты недалек. Никакой пощады подлым убийцам. Смерть немецким и финским людоедам! Николай ТИХОНОВ.	vol-5663-page-03-seg-009-2032-3548-2882-3949.png
5663	3	766	4041	1038	4074	2	0.93673	A. АВДЕЕНКО	vol-5663-page-03-seg-010-0766-4041-1038-4074.png
5663	3	392	4100	1398	4235	2	0.95203	Полесской пуще	vol-5663-page-03-seg-011-0392-4100-1398-4235.png
5663	3	212	4264	882	4926	104	0.95031	В тяжелые дни осени тысяча девятьсот сорок первого года, в дни разлуки с Красивыми ной Армией десятки, сотни деревень По- лесья - Черная Рудня, Зеленая Рудня, Мокрая Рудня, Сухая, Белая, Горная, Ве- селая Рудня, Старая Рудня снялись с веками насиженных мест, ушли в пущу под защиту болот, вечных сумерек, ушли в глухие дебри, в неприступные звериные гнезда, в объятия сумрачной природы, уш- ли, но не покорились врагу. Появились в дремучей пуще люди, и зазвенели их голо- са, закипел дружный колхозный труд, гиблые эти места стали неузнаваемыми. Все поляны неподалеку от табора, откры- тые небу, обогреваемые солнцем, были распаханы, засеяны рожью, картофелем и пшеницей колхоза.	vol-5663-page-03-seg-012-0212-4264-0882-4926.png
5663	3	206	4931	874	6070	182	0.94023	Одиннадцать лет со дня рождения кол- хоза «Заря» был его председателем Андрей Бородуля. Он привел людей к тому, что они перед войной на тощей земле Полесья получали по пяти килограммов зерна на трудодень. Осенью 1941 года Андрей Бо- робуля увел «Зарю» в неприступную пу- щу. Зимой ушел оп в партизаны, весной был убит в перестрелке. Привезли его до- мой в «Зарю», положили в землю, и мерт- вый он продолжал жить среди живых. Мы стоим у могилы Андрея Боробули с его братом и преемником Степаном Боро- булей. Простой земляной холмик, обложен- ный вечно живым зеленым мшистым по- кровом, дубовая доска с выжженными бук- вами: «Здесь покоится прах борца за люд- ское наше счастье Андрея Егоровича Барабули"... Пдем по табору. Морщинистая женщина сидит у костра, плетет лапоть, это бабушка Гарпина, мать Воробули. Двухлетний полуодетый мальчик бросает в огонь сухие ветки и смеется. Никогда глаза ребенка не видели немца, но он с молоком матери впитал в свое сердце пе- нависть к немцу. Посредине табора в яме с покатыми краями, накрытой железными листами, стоит у горна, посылает песок на кале- тый тобела лемех плуга Иван Карась	vol-5663-page-03-seg-013-0206-4931-0874-6070.png
5663	3	905	4258	1561	4326	8	0.90808	кузнец, не отдавший в немецкую неволю свой огонь.	vol-5663-page-03-seg-014-0905-4258-1561-4326.png
5663	3	901	4334	1561	4586	33	0.94816	Поляна с вытоптанной до земли сердце виной, травянистая, по краям схваченная декабрьской бесснежной изморозью. Двой ной ряд распущенных снопов расстелен на току. Аннушка, Махора, Аксюта, Наташа, Феня, Василиса девушки-невесты мо- лотят цепами клей.	vol-5663-page-03-seg-015-0901-4334-1561-4586.png
5663	3	897	4590	1561	5102	79	0.94992	Молча работает золотистоголовая, розо роковая, тихая, словно воскресшая из сказок Феня. Как, наверное, будет счаст- лив тот человек, на кого поднимет она глаза, кому доверчиво улыбнется, с кем за- говорит. Глаза немца не видели сказочной красоты Фени, не видели девичьего ру- мянца Аннушки, кудрявой головы Махоры, чистоглазой Наташи, не слыхали но го- монной песенницы Аксюты. В зеленую тьму леса, в дебри Полесской пущи унес- ли они свою красоту и радость молодости, смех, песни, девичьи ласки, любовь и на- одежды.	vol-5663-page-03-seg-016-0897-4590-1561-5102.png
5663	3	893	5108	1556	5579	77	0.95162	Переговариваются гробовые, крепче камня, молотильные цепы в руках тру- жепиц. Шуршат, осыпаются снопы, 30- лотятся под солнцем россии благородной, взлелеянной на бедной, худосочной почве Пол Полесья, пшеницы. Не видели тебя, кор- милица, немцы, не пекли из тебя ни хле- ба, ни пирогов, ни один колос твой, ни одно зерно не побывали в немецкой нево- ле. Наша ты, первозданная, чистая. Где-то гулко загремели колеса по за- сохшей дороге, из темной чащи леса на поляну выехала телега, полная снопов.	vol-5663-page-03-seg-017-0893-5108-1556-5579.png
5663	3	891	5584	1559	6064	65	0.94006	Нак дело, девоньки? ласково про- говорил возница, вытирая запотевшую ло- шаль пучком соломы и накрывая ее де- рюгой. - Кончаем, дедушка Харитон! -- про- пела Аксюта. У Харитона чистая, волосок к волос- ку, белоснежная борода. глазах ero плещется пеусмное, лукавое, щедрое ве- селье. Немцы не видели, не осквернили своим взглядом чудесную русскую бороду Харитона, не надругались над его тихой, веселой старостью, Доброта и ласка, как	vol-5663-page-03-seg-018-0891-5584-1559-6064.png
5663	3	1580	4041	2244	4988	152	0.94846	сок, выступают из его ульючивых губ из морщин, из взгляда, словом, из всего, что он делает. - Притомились, девоньки, ну-ка, Ма хора, отстранись, хлебни отдыху! Дед Харитон в жватил у девушки тем- ный, отполированный в работе двухгра- бовый цеп, крякнул, охнул, замахнул- и замелькало в ловких руках до- потопное крестьянское орудие. В глубине лесного табора в нежилых шалашах хранятся сотни сосновых двер- ных и оконных рам, наличников, дубовых плах, березовых брусьев, всё это дело рук старика. Два года прошло с тех пор, как в Полесье ворвались немцы, но тру- дится старик, копит свои изделия. В бу- дущей деревне Веселая Рудня все люди, потерявшие свой старый кров, будут смот- реть в окна, входить в двери и обедать за столами, сидеть на лавке, спать на кроватях, которые сделаны собственными его руками. Старик тщеславен безмер- но, ему б хотелось и всю деревню от фун- дамента до труб построить собственными руками, жаль, на всё нехватает рук.	vol-5663-page-03-seg-019-1580-4041-2244-4988.png
5663	3	1578	4996	2241	5797	125	0.95428	Может быть, никогда еще душа полис- ских людей но раскрывалась с такой пол- нотой, как теперь, в эти суровые дни борьбы с немцами. Не на болотах, не в трясине, не в темной глуши живут поле- шапе, а на светлых вершинах человече- ского достоинства, доблести, героизма. Декабрьский вечер. Затих табор, по- гасли большие костры, сочатся соком, ду- шисто потрескивают березовые полешки в домашнем очаге Барабули. Спокойное личико Миколы прильнуло к смуглому лицу матери оба слят. Серебряные серьги его матери Катерины отражают ве- селую, буйную пляску пламени в очаге. Глубокой ночью послышался топот ко- пыт бешено скачущей лошади. То ехал гонец, о котором мечтали два года: вчера Красной Армией освобождены родные ме- ста. Взбудоражился табор: вяжутся узлы, наполняются зерном и мукой мешки, уга- сают ненужные теперь костры.	vol-5663-page-03-seg-020-1578-4996-2241-5797.png
5663	3	1573	5810	2240	6062	41	0.94329	Утром по морозцу обоз трогается, Весе- лое, говорливое шествие растягивается по черному лесному ущелью, кипит и пере- ливается смехом, а иногда песней и гар- мошкой. Дед Харитон, обутый в новень- кие, много лет береженые поярковые ва- ленки, с непокрытой головой, выпростав	vol-5663-page-03-seg-021-1573-5810-2240-6062.png
5663	3	2260	4043	2929	5653	256	0.95363	белую бороду поверх полушубка, стано- вится в голову обоза. Черные его руки ве- кового труженика сжимают дубовую рам- ку, куда вправлен акт на вечное пользо вание землей. Далеко идти через леса болота, через луга и речушки, но дед Ха- ритон держит дубовую рамку, как знамя высоко над непокрытой головой. Аннушка несет годовалого ребенка оба они, и мать и сын, раскраснелись, лохмотья их растрепались на декабрьском ветру, а темные глаза полны солнечного света. Старуха Гарпина сутулая, в меш- ковине вместо платка, в лыковых лаптях, .опираясь на палку, кропит дорогу радост- ными слезами, идет за обозом. Несколько раз пытались усадить на телегу-кивает головой, грозится палкой, бормочет что-то своим беззубым ртом. Собственными но- гами хочет она пройти весь великий путь возвращения, испить по капле свое дол- гожданное счастье. Красная с белой звездой на лбу корова осторожно цокотит копытами по сухо- льдистой дороге. Ее никто не ведет, она покорно, доверчиво идет за людьми, кото- рые ее всю жизнь кормили, поили, лас- кали. То забегая вперед обоза, то возвра- щаясь с визгом и лаем, носится Волчок, он тоже чувствует дом. Только детвора сидит на телегах: поверх подушек, каст- рюль, ведер; боченков с соленьем. За те- легами по обочине дороги идут люди. Скрипит новенькое, обделанное сереб- ром седло мадьярского генерала пол груз- ным телом Степана Боробули. Рыжая по- лукровка танцует на своих ногах по хрустальным лужам дорог. Партизанский батько мягко покачивается в седле, и цветет его скуластое лицо под черной ку- банкой, идут люди, переглядываются с Барабулей, друг с другом, с солнцем, дубами и соснами, с небом и землей - тоже цветут.	vol-5663-page-03-seg-022-2260-4043-2929-5653.png
5663	3	2247	5662	2916	6061	59	0.95000	Встретился на перекрестке прохожий, ничего он не спросил: всё понятно, кто такие люди, куда и откуда они идут, с какие грузом. Люди несли на руках, на плечах, в глазах самое великое, самое светлое свое знамя выстраданное, омы- тое кровью, выплаканное, вымечтанное счастье, радость возвращения на родную землю, очищенную от врага. ПОЛЕСЬЕ, 10 декабря. (По телеграфу от наш. корр. ).	vol-5663-page-03-seg-023-2247-5662-2916-6061.png
5663	3	3112	301	4193	383	2	0.92793	Учеба пропагандистов	vol-5663-page-03-seg-024-3112-0301-4193-0383.png
5663	3	2956	413	3637	3188	380	0.94973	Велика и почетна роль пропагандистов в Красной Армии. Марксистско-ленинское образование офицерского состава никак не мыслится без самого широкого привлече- ния к этому делу всех лекторских кадров, имеющихся в распоряжении политотделов армий и дивизий. Лекции, доклады, ква- лифицированные консультации для сфи- церов --- всё это должно занимать подо- бающее место в практической деятельно- сти политорганов. Главное, что требуется сейчас сделать области устной пропаганды, это под- нять ее качество. Практика показала, что даже в перерывах между жарким и боями офицеров не удовлетворяет простой перес- каз газетных сообщений, их надо инте- рисуют случайные доклады. Офицеры слу шают с удовольствием только тех пропа- гандистов, выступления которых глубоко идейны, хорошо продуманы, содержат ка- кле-то серьезные обобщения и помогают слушателю правильно ориентироваться в сложных вопросах нынешней войны международной политики. Например, к ча- стях пашей армии наибольшей попу- лярностью пользуются выступления гене- рал-майора Русских, подполковника Миро- нова, подполковника Чекалова, майора Ма- заева, майора Афанасьева, майора Букарп- на, майора Сурова, капитана Бычатина. II : это вполне понятно. Каждый из названных товарищей очень много работает над подго- товкой своих лекций п докладов, над сво- собственным идейно-теоретическим ро- стом и совершенствованием. Возросшие запросы офицерской ауди- тории настойчиво требуют от политорга- нов постоянной заботы повышении культуры самих лекторов. Опыт под- сказал пам ряд проверенных во фрон- товой обстановке форм учебы лекторских кадров. На первый план здесь выдвигает- ся, конечно, самостоятельное чтение про- пагандистами первоисточников нарксп- стско-ленинской теории. специальной во- епной и художественной литературы. За- тем следуют семинары пропагандистов, консультации для них по прочитанному, товарищеское обсуждение разработанных ими лекций и докладов. На семинарах пропагандистов у нас спетематически вы- ступают член Военного Совета, и на- чальник политотдела армии, и руководя- щие работники армейского штаба. Это, конечно, дает свои плоды. Семинары ста- ли значительно содержательней. Теорети- ческие вопросы, обсуждаемые на них, стали лучше увязываться с жизнью войск, конкретными боевыми задачами армии. " Хуже обстоит дело с самостоятельной работой пропагандистов над книгою. И объясняется это двумя причинами. Во-первых, очень часто еще начальни- политорганов продолжают смотреть на пропагандиста, взявшегося за книгу, как на человека, не умеющего найти себе иной, более «полезной» в боевой обста- новке работы. Стоит только пропагандисту присесть, как ему уже подсовывают ка- кое-нибудь задание, чаще всего абсолютно не связанное с пропагандой. Многим, как видно, просто не вдомёк, что старым теоре- титеским багажом пропагандист жить не может, что этот багаж всё время должен пополняться.	vol-5663-page-03-seg-025-2956-0413-3637-3188.png
5663	3	2956	3193	3613	3368	22	0.94154	Во-вторых, плохо еще с литературой. Пропагандисты, особенно в дивизиях, не всегда имеют под руками даже военные работы Лепина, "Вопросы ленинизма" : Сталина.	vol-5663-page-03-seg-026-2956-3193-3613-3368.png
5663	3	3660	411	4324	926	70	0.94735	Стремясь устранить эти пробелы, мы нащупали недавно очень удачную, как нам кажется, Форму работы с пропаган- дистами. На базе библиотеки Дома Красной Армии у нас оборудован передвижной ар- мейский кабинет пропагандиста. Здесь есть все произведения классиков марксиз- ма-ленинизма, все сталинские доклады и приказы, справочная литература, reorpa- фические карты, газеты и журналы, но ришки художественной литературы, тези- сы лекций и докладов лучших пропаган- дистов армии, материалы политико- моральном состоянии частей противника.	vol-5663-page-03-seg-027-3660-0411-4324-0926.png
5663	3	3658	935	4319	1260	49	0.94732	Кабинет курсирует обычно недалеко от передовых позиций, и пропагандисты яв- ляются сюда по вызову политотдела ар- мин или по командировке политотдела своей дивизии сроком на три-пять дней. Работа кабинета построена с таким расче- том, чтобы все пропагандисты дивизий и агитаторы полков бывали в нем не реже раза в месяц.	vol-5663-page-03-seg-028-3658-0935-4319-1260.png
5663	3	3656	1269	4315	1705	58	0.95406	В кабинете постоянно дежурят консоль- танцы из наиболее подготовленных армей ских лекторов и агитаторов. Индивидуальный ные консультации даются в любое время, групповые проводятся по заблаговременно рассылаемому в войска расписанию. Здесь же очень часто практикуются товарище- ские обсуждения тезисов наиболее акту- альной темы, разработанной кем-либо из пропагандистов; проводится обмен опытом Среди пропагандистов этот кабинет поль- зуется очень хорошей репутацией.	vol-5663-page-03-seg-029-3656-1269-4315-1705.png
5663	3	3649	1715	4315	2299	83	0.95443	Сделано кое-что и для усиления конт- роля за качеством практической работы пропагандистов. Последнее время политот дел армии стал широко практиковать по- сылку наиболее подготовленных, наиболее квалифицированных своих работников на лекции и доклады, читаемые пропаганди- стами политотделов дивизий и полковыми агитаторами перед офицерской аудитори- ей. Посланец политотдела армии присутст- вует на лекции от начала до конца, а по- том садится вместе с лектором на 2--3 часа и делает подробный разбор его вы- ступления, отмечает достоинства и недо- статки, разъясняет ошибки, если они были допущены.	vol-5663-page-03-seg-030-3649-1715-4315-2299.png
