volume_number	page_number	x1	y1	x2	y2	tokens_count	mean_confidence	text	image
5763	1	3591	5407	4255	5726	47	0.94904	певяовании выдающихся успехов добились литейщики. Бригада Колтунова изгото- вила 4-местный кокиль за 3 часа вместо 60 часов по норме. Стахановцы пьеха, где начальником тов. Косых, на нять дней раньше срока соорудевали 15 ртан- ксв, цех, которым руководит тов. Калу- пенко, выпускает ежедневно сверх плана по одному агрегату.	vol-5763-page-01-seg-060-3591-5407-4255-5726.png
5763	1	3039	5798	4139	5846	4	0.94887	ТУРБОГЕНЕРАТОР СДАН В ЭКСПЛУАТАЦИЮ	vol-5763-page-01-seg-061-3039-5798-4139-5846.png
5763	1	2927	5859	3580	6150	29	0.93442	СТАЛИНГРАД, 6 апреля. (ТАСС). Кол- лектив «Тракторостроя» восстановил сдал в промышленную эксплуатацию тур- богенератор мощностью в 15.000 кило- ватт. Больших успехов в соревновании до- стигли металлурги завода «Красный Ок-	vol-5763-page-01-seg-062-2927-5859-3580-6150.png
5763	1	3587	5867	4247	6150	41	0.95180	тябрь», мартеновский цех которого в пер- вые дни апреля дал 107 процентов пла- на. Комсомольско-молодежная смена ТСВ. Марченковского выполнила задание по выплавке стали на 140 процентов, про- катчики сортового цеха за 4 дня апреля выпустили продукции вдвое больше, чем предусмотрено заданием	vol-5763-page-01-seg-063-3587-5867-4247-6150.png
5763	2	2056	346	2379	380	3	0.80397	A C H	vol-5763-page-02-seg-001-2056-0346-2379-0380.png
5763	2	3608	352	4262	388	8	0.93048	7 апреля 1944 г., пятница. № 83 (5763)	vol-5763-page-02-seg-003-3608-0352-4262-0388.png
5763	2	388	450	1456	659	10	0.94246	МОСКВА, КРЕМЛЬ ВЕРХОВНОМУ ГЛАВНОКОМАНДУЮЩЕМУ - МАРШАЛУ СОВЕТСКОГО СОЮЗА ТОВАРИЩУ СТАЛИНУ	vol-5763-page-02-seg-004-0388-0450-1456-0659.png
5763	2	288	679	946	1069	52	0.94843	Воодушевленные героическими победами наших воинов на фронтах Отечественной войны, колхозники и колхозницы, рабочие и служащие совхозов и МТС Мамадышеко- 10 района, Татарской АССР, трудящиеся города, Мамадыш, желая всеми силами по- мочь фронту быстрее разгромить немецких захватчиков, собрали из личных сбереже- ний в фонд победы Красной Армии 2.000.000 рублей. Сбор средств продол- кается.	vol-5763-page-02-seg-005-0288-0679-0946-1069.png
5763	2	288	1071	946	1142	10	0.91690	Просим на собранные средства по- строить звено боевых самолетов «Мама-	vol-5763-page-02-seg-006-0288-1071-0946-1142.png
5763	2	965	686	1617	819	18	0.96100	дышский колхозник» и передать их в гвардейскую часть. Пусть эти боевые ма- шины несут смерть фашистским захватчи- кам.	vol-5763-page-02-seg-007-0965-0686-1617-0819.png
5763	2	961	829	1617	1146	44	0.95027	Трудящиеся Мамадышского района заве- ряют Вас, товарищ Сталин, что они и впредь окажут любую помощь фронту в разгроме ненавистного врага. Желаем Вам, дорогой Иосиф Виссарно- нович, многих, многих лет жизни и здо- ровья на благо нашей великой Родины. Слава наступающей героической Крас- ной Армии!	vol-5763-page-02-seg-008-0961-0829-1617-1146.png
5763	2	759	1152	1565	1219	9	0.95015	Секретарь Мамадышского райкома ВКП(б) ЯМКОВ. Председатель исполкома райсовета АДАМЧУК.	vol-5763-page-02-seg-009-0759-1152-1565-1219.png
5763	2	352	1258	1538	1394	13	0.97563	МАМАДЫШ, ТАТАРСКОЙ АССР СЕКРЕТАРЮ РАЙКОМА ВКП(б) тов. ЯМКОВУ ПРЕДСЕДАТЕЛЮ ИСПОЛКОМА РАЙСОВЕТА тов, АДАМЧУК	vol-5763-page-02-seg-010-0352-1258-1538-1394.png
5763	2	286	1408	1594	1523	20	0.92367	Передайте трудящимся Мамадышского района, собравшим 2.000.000 рублей на строительство боевых самолетов «Мамадышский колхозник», мой братский привет и благодарность Красной Армии.	vol-5763-page-02-seg-011-0286-1408-1594-1523.png
5763	2	1208	1540	1496	1583	2	0.92082	И. СТАЛИН.	vol-5763-page-02-seg-012-1208-1540-1496-1583.png
5763	2	388	1650	1487	1802	14	0.96849	МОСКВА, КРЕМЛЬ ПРЕДСЕДАТЕЛЮ ГОСУДАРСТВЕННОГО КОМИТЕТА ОБОРОНЫ ИОСИФУ. ВИССАРИОНОВИЧУ, С Т А ЛИ Н У	vol-5763-page-02-seg-013-0388-1650-1487-1802.png
5763	2	280	1821	940	2112	28	0.93113	Дорогой Иосиф Виссарионович! 1. Мы, колхозники Меловатского сельсо- вега, Кременского района, Ворошиловград- ской области, от души благодарны нашу родную доблестную Красную Армию, осво- бодившую нас от немецко-фашистских Председатель	vol-5763-page-02-seg-014-0280-1821-0940-2112.png
5763	2	948	1821	1604	2112	26	0.94301	грабителей. Для быстрейшей победы над немецко-фашистскими бандитами внесли из своих личных сбережений 100.000 рублей на построение танковой колонны «Советская Украина». Меловатского сельисполкома БУГАЕВ. Секретарь парторганизации СИВЕРХ.	vol-5763-page-02-seg-015-0948-1821-1604-2112.png
5763	2	284	2144	1588	2518	41	0.94251	МЕЛОВАТСКИЙ СЕЛЬИСПОЛКОМ, КРЕМЕНСКОГО РАЙОНА, ВОРОШИЛОВГРАДСКОЙ ОБЛАСТИ ПРЕДСЕДАТЕЛЮ СЕЛЬИСПОЛКОМА тов, БУГАЕВУ СЕКРЕТАРЮ ПАРТОРГАНИЗАЦИИ тов. СИВЕРХ Прошу передать колхозникам и колхозницам Меловатского сельсо- вета, собравшим 100.000 рублей на постройку танковой колонны «Совет- ская Украина», - мой братский привет благодарность Красной Армии. И. СТАЛИН.	vol-5763-page-02-seg-016-0284-2144-1588-2518.png
5763	2	377	2585	1496	2637	4	0.92136	МОСКВА, КРЕМЛЬ ТОВАРИЩУ СТАЛИНУ	vol-5763-page-02-seg-017-0377-2585-1496-2637.png
5763	2	278	2654	933	2837	24	0.93261	Славная Красная Армия под Вашим мудрым водительством освободила нас от немецко-фашистских извергов. милая от- благодарить Красную Армию, я, рабочий завода 110 Баранчук Василий Дави-	vol-5763-page-02-seg-018-0278-2654-0933-2837.png
5763	2	956	2654	1602	2868	31	0.95709	дович, вношу из личных сбережений 10.000 рублей в фонд обороны Родины. Желаю Вам, дорогой По сиф Виссарио- нович, жить долгие годы на страх врагам, на счастье и радость нашему народу. БАРАНЧУК.	vol-5763-page-02-seg-019-0956-2654-1602-2868.png
5763	2	561	2899	1311	2979	6	0.97287	ЗАВОД № 110 ВАСИЛИЮ ДАВИДОВИЧУ БАРАНЧУК	vol-5763-page-02-seg-020-0561-2899-1311-2979.png
5763	2	280	2995	1585	3116	16	0.91002	Примите мой привет и благодарность Красной Армии, Василий Давидович, за Вашу заботу о Красной Армии. сталин,	vol-5763-page-02-seg-021-0280-2995-1585-3116.png
5763	2	375	3189	1440	3397	15	0.96835	МОСКВА, КРЕМЛЬ ВЕРХОВНОМУ ГЛАВНОКОМАНДУЮЩЕМУ МАРШАЛУ СОВЕТСКОГО СОЮЗА ТОВАРИЩУ С Т А Л И Н У	vol-5763-page-02-seg-022-0375-3189-1440-3397.png
5763	2	271	3418	930	3672	24	0.94911	Дорогой Иосиф Виссарионович! Рабочие, инженеры, техники и служа- железнодорожного узла Пологи, Ста- линской дороги, горя желанием помочь теронческой Красной Армии быстрее раз- Секре Председа	vol-5763-page-02-seg-023-0271-3418-0930-3672.png
5763	2	937	3418	1596	3672	26	0.94569	громить немецко-фашистских захватчиков внесли в Госбанк на строительство тан- ков и самолетов 214.805 рублей. Поступ- ление средств продолжается. тарь узлового парткома ГЕРАСИМОВ. ель райкома профсоюза КАЗНАЧЕЕВ.	vol-5763-page-02-seg-024-0937-3418-1596-3672.png
5763	2	315	3705	1538	3843	15	0.94657	Ст. ПОЛОГИ, СТАЛИНСКОЙ ЖЕЛЕЗНОЙ ДОРОГИ СЕКРЕТАРЮ УЗЛОВОГО ПАРТКОМА тов. ГЕРАСИМОВУ ПРЕДСЕДАТЕЛЮ РАЙКОМА ПРОФСОЮЗА тов. КАЗНАЧЕЕВУ	vol-5763-page-02-seg-025-0315-3705-1538-3843.png
5763	2	275	3855	1581	4053	31	0.94846	Прошу передать рабочим, работницам, инженерам, техникам и слу- жащим железнодорожного узла Пологи, собравшим 214.805 рублей на строительство танков и самолетов, -- мой братский привет и благодар- ность Красной Армии. И. СТАЛИН.	vol-5763-page-02-seg-026-0275-3855-1581-4053.png
5763	2	1752	453	2833	557	5	0.96636	МОСКВА, КРЕМЛЬ ИОСИФУ ВИССАРИОНОВИЧУ СТАЛИНУ	vol-5763-page-02-seg-027-1752-0453-2833-0557.png
5763	2	1639	573	2298	1048	50	0.95463	Дорогой Иосиф Виссарионович! Воодушевленные героической борьбой Красной Армии с фашистскими захватчи- ками, изгнанием их из-под Ленинграда, освобождением нашей родной Украины, мы, рабочие, инженерно-технические ра- ботники и служащие девятой дистанции пути станции Королеве, Московско-Киев- ской ж. д., в короткий срок восстановили разрушенный участок железной дороги, Начальник девятой дистанции пути с Секретар	vol-5763-page-02-seg-028-1639-0573-2298-1048.png
5763	2	2306	573	2964	1048	47	0.94584	открыли бесперебойное движение поездов на запад. Желая помочь Красной Армии ускорить окончательный разгром ненавистных ф: пистских захватчиков, мы внесли в фон 1 обороны свой заработок в сумме 186.000 рублей на постройку самолетов «Советская Украина». По поручению общего собрания т. Кролевец, Московско-Киевской ж. д. НАКОНЕЧНЫЙ. парторганизации станции МАКАРОВ.	vol-5763-page-02-seg-029-2306-0573-2964-1048.png
5763	2	1650	1069	2950	1206	15	0.97026	КРОЛЕВЕЦ, МОСКОВСКО-КИЕВСКОЙ ж. д. НАЧАЛЬНИКУ ДЕВЯТОЙ ДИСТАНЦИИ ПУТИ тов. НАКОНЕЧНОМУ СЕКРЕТАРЬ ПАРТОРГАНИЗАЦИИ СТАНЦИИ тов. МАКАРОВУ	vol-5763-page-02-seg-030-1650-1069-2950-1206.png
5763	2	1644	1215	2952	1373	30	0.92084	Прошу передать рабочим, работницам, инженерно-техническим ра- ботникам и служащим 9-й дистанции пути ст. Кролевец, собравшим 186.000 рублей на строительство самолетов «Советская Украина», - мой братский привет и благодарность Красной Армии.	vol-5763-page-02-seg-031-1644-1215-2952-1373.png
5763	2	2566	1377	2849	1419	2	0.92454	И. СТАЛИН	vol-5763-page-02-seg-032-2566-1377-2849-1419.png
5763	2	1731	1485	2852	1529	10	0.92975	МОСКВА, КРЕМЛЬ ТОВАРИЩУ С Т А Л И Н У	vol-5763-page-02-seg-033-1731-1485-2852-1529.png
5763	2	1627	1548	2281	1796	35	0.95520	Желая помочь нашей героической Крас- ной Армии быстрее разгромить и изгнать нашей священной земли ненавистного врага, мы, рабочие, инженерно-техниче- ские работники и служащие Артемовского горместпрома, Сталинской области, внесли в фонд обороны страны из своих личных	vol-5763-page-02-seg-034-1627-1548-2281-1796.png
5763	2	2300	1552	2952	1800	25	0.94786	сбережений 102.273 рубля. Сбор средств продолжается. Желаем Вам, Иосиф Виссарионович много сил и здоровья. Да здравствует Верховный Главнокоман- дующий Маршал Советского Союза вели- кий Сталин!	vol-5763-page-02-seg-035-2300-1552-2952-1800.png
5763	2	2331	1810	2912	1877	5	0.93496	Директор горместпрома ХАРЧЕНКО Профуполномоченный УДОВЕНКО.	vol-5763-page-02-seg-036-2331-1810-2912-1877.png
5763	2	1837	1900	2750	2029	10	0.96061	АРТЕМОВСК, СТАЛИНСКОЙ ОБЛАСТИ ДИРЕКТОРУ ГОРМЕСТПРОМА тов. ХАРЧЕНКО ПРОФУПОЛНОМОЧЕННОМУ тов. УДОВЕНКО	vol-5763-page-02-seg-037-1837-1900-2750-2029.png
5763	2	1639	2048	2945	2200	27	0.93552	Прошу передать рабочим, работницам, инженерам, техникам и слу- жащим Артемовского горместпрома, собравшим 102.273 рубля в фонд обороны Союза ССР, - мой братский привет и благодарность Красной Армии.	vol-5763-page-02-seg-038-1639-2048-2945-2200.png
5763	2	2554	2206	2841	2246	2	0.90819	и. сталин	vol-5763-page-02-seg-039-2554-2206-2841-2246.png
5763	2	1725	2314	2845	2360	10	0.93761	МОСКВА, КРЕМЛЬ ТОВАРИЩУ С Т А Л И Н У	vol-5763-page-02-seg-040-1725-2314-2845-2360.png
5763	2	1625	2379	2283	2673	24	0.94859	Мы, рабочие и служащие табачной фаб- рики Октябрьского района, города Киева, вносим из своих сбережений на построй- ку танковой колонны «Киев» 83.552 руб- Секретарь	vol-5763-page-02-seg-041-1625-2379-2283-2673.png
5763	2	1715	2677	1819	2708	1	0.95187	КИЕВ	vol-5763-page-02-seg-042-1715-2677-1819-2708.png
5763	2	2289	2383	2949	2673	29	0.94496	ля. Пусть этот небольшой вклад в обо- рону страны ускорит разгром немецких захватчиков. По поручению коллектива фабрики: Директор фабрики ДОЛОТОВ. комсомольской организации БОНДАРЬ. Председатель фабкома МИХАИЛОВ. Стахановцы: РЕЗНИЧЕНКО, КИСЛЫЙ.	vol-5763-page-02-seg-043-2289-2383-2949-2673.png
5763	2	1637	2720	2941	3127	47	0.94433	ТАБАЧНАЯ ФАБРИКА ОКТЯБРЬСКОГО РАЙОНА ДИРЕКТОРУ ФАБРИКИ тов. ДОЛОТОВУ СЕКРЕТАРЮ КОМСОМОЛЬСКОЙ ОРГАНИЗАЦИИ том. БОНДАРЬ ПРЕДСЕДАТЕЛЮ ФАБКОМА тов. МИХАЙЛОВУ СТАХАНОВЦАМ т.т. РЕЗНИЧЕНКО, КИСЛОМУ Прошу передать рабочим, работницам и служащим табачной фаб- рики, собравшим 83.552 рубля на строительство танков «Киев», - мой братский привет и благодарность Красной Армии. И. СТАЛИН	vol-5763-page-02-seg-044-1637-2720-2941-3127.png
5763	2	1685	3187	2879	3343	14	0.96478	МОСКВА, КРЕМЛЬ ПРЕДСЕДАТЕЛЮ ГОСУДАРСТВЕННОГО КОМИТЕТА ОБОРОНЫ ТОВАРИЩУ С Т А Л И Н У	vol-5763-page-02-seg-045-1685-3187-2879-3343.png
5763	2	1617	3356	2277	3689	39	0.95996	Дорогой Иосиф Виссарионович! Наш небольшой коллектив рабочих, ра- ботниц, жен военнослужащих Иловайско- го совхоза Орса, Донецкой железной до- роги Харцызского района, Сталинской об- ласти, желая приблизить час окончатель- ного разгрома немецко-фашистских пора- ботителей, полностью восстановил тракто- Директор Иловайского со	vol-5763-page-02-seg-046-1617-3356-2277-3689.png
5763	2	2283	3356	2943	3689	39	0.94803	ры, сельскохозяйственный инвентарь и заготовил посевной материал к весеннему севу. Из своих личных сбережений вно- чем 56.000 рублей на постройку самоле- тов «Освобожденный Донбасс». Усть наш скромный вклад послужи ускорению разгрома ненавистного врага. хоза УРС'а Донецкой ж. д. КОРШЕВ.	vol-5763-page-02-seg-047-2283-3356-2943-3689.png
5763	2	1748	3718	2816	3853	13	0.96230	ИЛОВАЙСКИЙ СОВХОЗ ДОРОЖНОГО УРС'а, ХАРЦЫЗСКОГО РАЙОНА, СТАЛИНСКОЙ ОБЛ. ДИРЕКТОРУ ИЛОВАЙСКОГО СОВХОЗА тов, КОРШЕВО	vol-5763-page-02-seg-048-1748-3718-2816-3853.png
5763	2	1627	3862	2931	4059	28	0.95151	Прошу передать рабочим, работницам, женам военнослужащих Иловайского совхоза, собравшим 56.000 рублей иа строительство само- летов "Освобожденный Донбасс", - мой братский привет и благодар- ность Красной Армии. И. СТАЛИН.	vol-5763-page-02-seg-049-1627-3862-2931-4059.png
5763	2	311	4155	1554	4326	5	0.87420	Управление артиллерийским огнем из танка	vol-5763-page-02-seg-050-0311-4155-1554-4326.png
5763	2	259	4366	921	5686	187	0.95856	Огневое сопровождение подвижных групп на поле боя может быть непрерыв- при том условии, если они имеют тесную связь с дальнобойной артиллерией и достигнуто четкое управление артил- . лерийским огнем. Наиболее широко рас- пространен в подвижных формах боя спо- управления огнем из танка, снабжен- шого радиостанцией. Количество таких тан- ков, выделяемых для артиллерийских ча- стей, бызаст различным. Иногда один танк предназначается для управления ог- нем батареи, а то и белого полка. как показывает опыт, целесообразнее всего назначать одну машину, снабженную ра- цией, на дивизион. Тогда артиллерня смо- жет дать массированный огонь по опреде- ленным участкам, для которых педостаточ- на плотность огня батареи. качестве наблюдателей-корректировщиков назнача- ются хорошо подготовленные артиллерий- ские офицеры, умеющие ориентироваться на любой местности и отлично владеющие основными методами стрельбы. Ралийный танк обычно следует за пер- вым эшелоном танков перекатами от ру- бежа к рубежу. маскируясь местными предметами. Чтобы не попасть на мины, наблюдатель приказывает вести машину по следам своих танков. Наблюдение ве- дется либо непосредственно из танка, ли- бо с наземного пункта, занимаемого нако- ротке. В последнем случае артиллерист оставляет на время танк в укрытии, а сам наблюдает за противником с места, допускающего хороший обзор.	vol-5763-page-02-seg-051-0259-4366-0921-5686.png
5763	2	259	5694	919	6144	69	0.95452	Танк наблюдателя держит связь по ра- дно со старшим начальником из полдер- живаемой части и со своем командиром дивизиона. Целеуказание ведется по ко- дпровзнной карте масштаба 1 : 50.000 с разбивкой квадратов на четверги (а, б, г) от условной линии или при помо- щи специального целеуказателя. Чтобы удобнее было сриентироваться на мест- ности и определять расположение целей, заранее намечается на карте, по маршру- ту подвижного соединения, ряд точек, лег-	vol-5763-page-02-seg-052-0259-5694-0919-6144.png
5763	2	938	4359	1594	4686	52	0.95805	ко находимых на местности. Это чаще всего перекрестки дорог, курганы, отдель ные строения и т. п. Кроме ориентиров, наблюдатель поносит на карту огневые позиции своего дивизиона, а также те ме- ста, куда должен быть дан огонь по, пла- ну. Такие же карты находятся у коман- дира подвижной части и командира диви- зиона.	vol-5763-page-02-seg-053-0938-4359-1594-4686.png
