volume_number	page_number	x1	y1	x2	y2	tokens_count	mean_confidence	text	image
6232	2	2930	4245	3595	5417	174	0.96377	это время с бойцами продолжают зани- маться инструкторы. Наконец, командир отделения либо личным показом реализу- ет указания командира взвода, либо со- бирает инструкторов. И здесь отделение обязательно продолжает заниматься по: руководством назначенного командиром отделения более опытного бойца. Перерыва в занятии не должно быть. Всё это, при хорошей организации де- ла, осуществляется очень быстро и не влечет потери учебного времени. Вместе с тем командир отделения почувствует се- бя увереннее, будет работать смелее энергичнее. Он знает, что его не «отчи- тают» при подчиненных, а B случае надобности отзовут в сторону и дадут короткие, деловые указания качест- ве руководства, а не «нотации». Разумеется, никто не запрещает коман- диру роты или взвода в ходе занятия вызвать к себе наиболее отстающих бой- цов и лично обучать их. Отнюдь не за- прещается и проверить полностью какое- либо отделение. Но всё это надо делать умело, так, чтобы не подменять ниже- стоящего начальника, не подрывать егс авторитета в глазах подчиненных. Конеч- но, все указания надо давать спокойно, без грубости. Ровная, постоянная требо- вательность офицера лучшее средство добиться успешного обучения своих под- чиненных.	vol-6232-page-02-seg-056-2930-4245-3595-5417.png
6232	2	2922	5424	3577	5989	82	0.96306	B конце занятия командир роты про- веряет, как усвоено содержание урока дает оценки взводам, указывает, какие недостатки обнаружены, как, когда, где и с кем надо еще поработать по тому или иному приему. Тут же он говорит какие параграфы устава надлежит изу- чить в часы самоподготовки. Наиболее слабых следует взять на особый учет свести их в отдельную группу, которая будет тренироваться под руководством опытного командира. Кроме того, на ос- нове обнаруженных недочетов командир роты на мечает план и содержание очеред- ного инструкторско-методического заня-	vol-6232-page-02-seg-057-2922-5424-3577-5989.png
6232	2	3599	4245	4276	5951	249	0.96462	Порою ссылаются на то, что времени, отведенного на строевую подготовку, но достаточно для четкой отработки каждого приема. Подобные ссылки неосновательны. В течение суток рота делает в среднем 10 -15 различных построений и перед- вижений. Разве этого мало для тренировки отделений и взводов в строевом отноше- нии! То же самое следует сказать и о караульной службе. Ведь и здесь каждый военнослужащий в течение суток несколь- ко раз выполняет различные приемы строевой подготовки. Больше того: имен- но тут каждый прием должен выполнять- ся особенно четко, скажем даже - тор- жественно. Строевую подготовку следует проводить непрерывно, пользуясь для этого каждым Удобным случаем. Ограничиваться только строевыми занятиями, указанными в рас- писании, значит допустить серьезную оплошность. Надо терпеливо, не спеша, делая всё от души, изо дня в день со- вершенствовать строевую подготовку под- чиненных. Тогда дело пойдет хорошо, п времени окажется более, чем достаточно. Очень полезно при всякой возможности со- вершать передвижения под походную пес- ню. Песня подтягивает строй, шаг ста- новится более четким. Она приучает хо- дить без подсчета. Выше говорилось о том, что на строе- вых занятиях надо как можно меньше держать людей в положении «вольно». Если же такая команда подана, необходп- мо следить, чтобы выполнение ее соответ- вовало требованиям устава. В некоторых подразделениях после команды «вольно» бойцы начинают поворачивать головы, переминаться с ноги на ногу, кое-где ла- же разговаривают. А ведь по уставу мож- но лишь стать свободно, не ослабляя при этом внимания. Во всем строевом обучении должны чувствоваться жизнерадостность, задор, молодцеватость, лихость. Тогда каждое занятие будет давать хорошие результа- ты	vol-6232-page-02-seg-058-3599-4245-4276-5951.png
6232	2	3750	5960	4212	6001	3	0.93723	Подполковник П. СЕЛИВАНОВ	vol-6232-page-02-seg-059-3750-5960-4212-6001.png
6232	3	293	226	1025	263	8	0.89894	16 октября 1945 г., вторник № 244 (6232)	vol-6232-page-03-seg-001-0293-0226-1025-0263.png
6232	3	1939	235	2531	276	3	0.87702	3 В Е	vol-6232-page-03-seg-002-1939-0235-2531-0276.png
6232	3	321	340	1469	564	3	0.98277	Дон встречает Казаков-победителей	vol-6232-page-03-seg-003-0321-0340-1469-0564.png
6232	3	506	584	895	613	3	0.95487	От специального корресп	vol-6232-page-03-seg-004-0506-0584-0895-0613.png
6232	3	234	628	885	845	27	0.95189	В воскресенье с утра улицы Ростова на-Дону были переполнены народом. Го род празднично принарядился. На осеннем ветру развевались государственные флаги огромные красные полотнища со словами привета воинам-победителям.	vol-6232-page-03-seg-005-0234-0628-0885-0845.png
6232	3	197	852	879	3811	447	0.95996	- Казаки вернулись с фронта! i Эта радостная весть у всех на устах Баллоны рабочих, служащих, ученых, школьников с красными знаменами, под звуки оркестров направлялись к Театраль- ной площади. Скоро ее заполнили тысячи ростовчан. Все взоры были устремлены к центру площади, где стройными рядами вастыли лихие эскадроны Н-ского квар донского казачьего Краснознаменного Бу- дапештского соединения. Казаков плотным кольцом окружила молодежь. Оттуда зву чала знакомая мелодия «Песни былых походов». Девушки подносили цветы ге- роям. Под взрывы аплодисментов казаки, сверкая орденами и медалями, наклонялись с седел, принимали драгоценный знак любви и восхищения. В 13 часов на трибуну подымаются Маршал Советского Союза С. М. Буден- Te- ный, командующий войсками округа Ге- рой Советского Союза генерал-полковник Белов, секретарь крайкома тов. Пастушенко, руководители советских общественных организаций области и го- рода, представители войсковых соедине" ний. Председатель Ростовского городского совета депутатов трудящихся тов. Гар- кущенко открывает митинг, посвященный встрече казаков-победителей. Первое слово" предоставляется заместителю председа- теля исполкома Совета тов. Андрианову. От От имени трудящихся Ростовской области тов. Андрианов горячо приветствует ка зачье войско. Начальник цеха завода "Ростсельмаш" тов. Днанов передает пламенный привет казакам. Он рассказывает им о трудовом подвиге советского Дона: Четыре года подряд ваши сабли блестели на полях сражений. Вы громп гитлеровские орды не только на совет- ской земле, но п очищали от них терри- торин соседних государств. В эти годы мы были далеко от вас, но все паши ду мы направлялись к вам, мы заботились о том, чтобы вы не испытывали никакой нужды ни в боеприпасах, ни в вооруже- нии, ни в снаряжении. По неделям мы не выходили из цехов, изготовляли для вас надежное оружие. Этим оружием вы, донские казаки, уничтожили гитлеровские орды и теперь с победой вернулись в род- ные станицы. Сейчас вы приступаете боевой учебе, 8 мы занимаемся мирным трудом. Давайте же работать так, чтобы наше социалистическое отечество из ме- сяца в месяц, изо дня в день приумножа- ло свою экономическую и военную мощь. Эти слова вызывают бурю аплодисментов тов в казачьих эскадронах. Гвардейцы, не знавшие устали в боях с врагом, готовы тому, чтобы с таким же упорством взяться за дальнейшее совершенствование военного мастерства. Начальника цеха сменяет на трибуне старый колхозник из станицы Старочер- касской. Дмитрий Михайлович Матекин послан колхозниками в Ростов, чтобы от пмени обнять дорогих земляков, вер- нувшихся на берега тихого Дона. Ему 71 год, но он еще бодр и продолжает по- стахановски работать в колхозе. Вчера, говорит Дмитрий Михай- лович, когда станичники посылали меня сюда, я еще раз сходил к собору. Там лежат ворота Азовской крепости, лушки и весы азовские. Их привезли сю- да в 1643 году наши деды, донские каза- кл. С того времени турецкое насилие над жителями станиц Дона и Кубани прекра- тплось. Эти трофен три века напоминают нам о былой славе наших предков. Вы.	vol-6232-page-03-seg-006-0197-0852-0879-3811.png
6232	3	903	584	1305	613	3	0.96525	Эндента «Красной звезды»)	vol-6232-page-03-seg-007-0903-0584-1305-0613.png
6232	3	897	634	1558	1475	139	0.96236	казаки-гвардейцы, не посрамили ее. Тер- манец повержен впрах. Японы побежде- ны. Мы, старые люди, понимаем это так, что сила нашего государства неодолима... Никто не может спорить с нами, с нашей большой и богатой страной. Мы всегда стремились оказать самую большую по- мощь фронту. Пока острой шашкой рубин- ли вы неприятеля, мы в станице заботи- лись вашем провианте. Наш КОЛХ03 имени С. М. Кирова всегда во-время полностью выполнял план. в нынешнем году мы тоже раньше всех закончили по- ставки хлеба государству. Немец разорил наши гнезда. За это вы отомстили ему. Спасибо вам, сынки! Мы же всё сделаем для того, чтобы в ближайшее время вос- становить свое хозяйство. 11 я так ду- маю, что пройдет годик-два и наш колх03 будет лучше прежнего. После речи секретаря горкома ВКП(б) тов. Ищенко с ответным словом от имени донских казаков выступил гвардии пол- ковник Привалов.	vol-6232-page-03-seg-008-0897-0634-1558-1475.png
6232	3	885	1477	1547	2759	180	0.96442	Горячими аплодисментами встретили участники митинга выступление маршала Буденного. От лица всей конницы Брачной Армии он поздравил казаков с историчес- кой победой советского народа над немец- кими и японскими захватчиками, с воз- вращением доблестного донского казачест- ва в родные станицы, а также приветст- вовал трудящихся Ростова. В заключение под гром рукоплесканий и возгласы «ура» маршал провозгласил здравицу в честь советских войск, в честь партии Ленина Сталина, в честь великого полководца нашей эпохи Верховного Главнокомандую- щего Генералиссимуса товарища Сталина. Митинг окончен. На площади раздается команда к торжественному маршу. Начи- нается парад казаков-победителей. Еще издали слышится нарастающий покот ко- пыт. На гнедых лошадях, с обнаженными клепками проносятся мимо трибуны каза- ки-гвардейцы. Мимо ростовчан скачут славные сыны донского казачества. Замечателен боевой путь гвардейского соединения. Девять ты- сяч километров прошло оно по военным до- рогам. Оно участвовало в битвах за осво- бождение Северного Кавказа, Донбасса, Тав- рии, Правобережной Украины, Бессара- бии; громило врага в Румынии, Венгрии, Югославии и Австрии. От казачьих уда- ров враг нес невосполнимые потери. Гвардейцы громили танковые дивизии СС «Викинг» и «Мертвая голова». Восемь раз товарищ Сталин благодарил казаков за боевые успехи.	vol-6232-page-03-seg-009-0885-1477-1547-2759.png
6232	3	870	2761	1531	3659	131	0.95390	Суровые, закаленные воины, ветераны многих войн и сражений вернулись к родному Дону. Капитану Парамону Сам- соновичу Куркину шестьдесят шесть лет. Он бил немцев еще в первую мировую войну, оборонял Царицын, служил в Пер- вой Конной армии. В начале Отечествен- ной войны Парамон Самсонович ушел до- бровольцем на фронт. Вместе с ним со- крушали немецких захватчиков три его сына-офицера, десять племянников и зять. На груди капитана Куркина четыре ордена и две медали. Добровольцем в ка- зачье ополчение вступил и 54-летний ка- зак Константин Недорубов. Вместе с сем- надцатилетним сыном комсомольцем Ни- колаем геройски сражался он на фронте. Старому казаку правительство присвоило звание Героя Советского Союза. Величественной и незабываемой была встреча казаков-гвардейцев с трудящими- ся Дона. Она с новой силой продемонстри- ровала глубокую любовь советских людей Красной Армии, бессмертие боевых.тра- диций советского казачества.	vol-6232-page-03-seg-010-0870-2761-1531-3659.png
6232	3	899	3666	1477	3808	9	0.93110	Старший лейтенант B. ФОМЕНКО РОСТОВ-на-ДОНУ, 15 октября. (По телеграфу).	vol-6232-page-03-seg-011-0899-3666-1477-3808.png
6232	3	361	3848	854	3929	4	0.93066	ТРЕТЬЯ МАРТЕНОВСКАЯ павку зпатоус	vol-6232-page-03-seg-012-0361-3848-0854-3929.png
6232	3	862	3848	1369	3929	5	0.92768	ПЕЧЬ ВЫДАЛА ПЕРВУЮ говского завода	vol-6232-page-03-seg-013-0862-3848-1369-3929.png
6232	3	193	3953	845	4078	14	0.93311	ЧЕЛЯБИНСК, 15 октября. (ТАСС). На Златоустовском металлургическом заво- де имени Сталина вступила в эксплоата-	vol-6232-page-03-seg-014-0193-3953-0845-4078.png
6232	3	868	3955	1514	4030	11	0.94854	цию третья мартеновская печь. Новый мартен выдал первые сотни тонн стали.	vol-6232-page-03-seg-015-0868-3955-1514-4030.png
6232	3	1616	1384	4183	1564	91	0.95312	ФИНАЛЬНЫЙ МАТЧ НА "КУБОК СССР» МЕЖДУ КОМАНДАМИ ЦСКА И "ДИНАМО". 1. Момент игры у ворот "Динамо". 2. Команда Центрального Дома Красной Армии - обладатель «Кубка СССР» по футболу 1945 г. Слева направо: капитан Г. Федотов, младший лейтенант В. Никаноров, лейтенант А. Про- хоров, старший лейтенант А. Виноградов, младший техник-лейтенант В. Бобров, младший лейтенант Г. Тучков, младший лейтенант И. Кочетков, старший лейтенант B. Николаев, старший лейтенант А. Гринин, младший лейтенант Б. Афанасьев и лейтенант В. Демин. 3. Второй гол забот! «Болельщики» восторженно отмечают победу команды ЦДКА. Фото А. Капустянского и О. Кнорринга.	vol-6232-page-03-seg-016-1616-1384-4183-1564.png
6232	3	1647	1612	3490	1738	4	0.97192	Команда ЦСКА завоевала кубок	vol-6232-page-03-seg-017-1647-1612-3490-1738.png
6232	3	1558	1744	2218	2425	104	0.96367	Бурным событиям большого спортивно- го дня предшествовали события ночные. Опаленные зноем, омытые ливнями, зака- ленные стужей, московские болельщики плохо спали эту ночь. Даже неожиданно выпавший снег нисколько не охладил го- рячие сердца любителей футбола. B квартирах звонили телефоны. Болельщи- ки обменивались прогнозами. Или «Ди- намо» или ЦДКА? Но кто? Кто победит в завтрашней встрече? Даже сами футболисты, участники гря- дущей битвы за кубок, не смогли бы от- ветить на этот вопрос. Футболисты отды- хали перед игрой. Динамовский вратарь Алексей Хомич всю ночь видел во сне Всеволода Боброва. Армейскому вратарю Владимиру Никанорову грезилась злове- щая улыбка Сергея Соловьева... Итак, проходила ночь, полная волнений и надежд.	vol-6232-page-03-seg-018-1558-1744-2218-2425.png
6232	3	1547	2431	2208	3489	152	0.95615	C самого утра у ворот стадиона «Ди- намо» началось оживление. Те, кому не удалось раздобыть билеты на матч, тол- пились у касс, стараясь не смотреть на аншлаг, начертанный чьей-то жестокой рукой «Все билеты проданы». После полудня по Ленинградскому шоссе по- тянулась нескончаемая вереница машич. Из вестибюлей метро начали густо при- бывать болельщики. Знатоки и поклон- ники футбола заполнили стадион задол- го до начала игры. И здесь вспыхнули жаркие споры. «Динамо» выиграет кубок. Это точ- но! говорили одни. ЦДКА уже держится за него! утверждали другие. Малолетний приверженец ЦДКА убеж- денно говорил соседу в роговых очках: Конец вашей «Динаме»! Провезут зашу "Динамо"!... «Динамо» не склоняется! - яростно возражал собеседник, имея в виду грам- матику. Это смотря перед кем! Перед ЦДКА и «Динамо» склоняется! пари- ровал малолетний оппонент, имея в виду футбол. A кубок, сверкающий кубок победы, уже стоял на столике перед Северной трибуной. Кто же все-таки унесет сего- дня с поля этот почетный приз?...	vol-6232-page-03-seg-019-1547-2431-2208-3489.png
