volume_number	page_number	x1	y1	x2	y2	tokens_count	mean_confidence	text	image
5763	2	2954	4943	3616	6038	144	0.94540	ДЕЙСТВУЮЩАЯ АРМИЯ, 6 апреля. (По телеграфу от наш. корр. ). В течение последних суток наши войска нанесли немцам, окруженным в районе западнее Скала, новые серьезные удары и овладе- ли рядом опорных пунктов обороны про- тивника Скала, Борщов, Мельница- Подольская и др. В ожесточенных боях противник понес большие потери. Немцы не раз пытались прорваться из окруже- ния, но все эти попытки ничего не при- несли им, кроме нового урона в живой силе и в технике. Одновременно с этим крупные силы пехоты и танков неприятеля сегодня пы- тались прорваться к своей окруженной группировке. Немцы сосредоточили к юго- западу от Тарнополя много танковых и пехотных частей. Эти части брошены в бой на узком участке фронта. Атаки кон- центрировались преимущественно на одном и том же направлении. Гитлеровское командование, видимо, надеялось одним ударом пробить наши боевые порядки и разорвать кольцо окружения, чтобы вы- вести свою группировку, оказавшуюся в «котле».	vol-5763-page-02-seg-075-2954-4943-3616-6038.png
5763	2	2954	6046	3601	6123	12	0.92336	Уже первые немецкие атаки очень ско- ро переросли в жаркие, напряженные бол	vol-5763-page-02-seg-076-2954-6046-3601-6123.png
5763	2	3622	4951	4286	6086	150	0.94585	Сначала немцы пустили в ход свои тан- ки, но наши артиллеристы и бронебой- щики преградили им путь. Затем атаки были предприняты силами тапков и пе- хоты. В этих атаках участвовало также значительное количество самоходных сру- дий. -Разыгрались еще более упорные бон. Неприятель, невзирая на большие потери, рвался вперед. В районе одного населен- ного пункта наши истребительные под- разделения в течение нескольких часов отбили четыре яростных атаки противни- ка. Немцы оставили здесь много танков и самоходных орудий. Не прошло и получаса, как не жаркая борьба разгорелась в районе со- седней деревни. Здесь немцы снова дви- нули вперед свои танки. Олпу группу вражеских машин наши артиллеристы пропустили, а потом, отрезав от нее пе- хоту, взяли под перекрестный огонь: двух десятков танков удалось уйти обрат- но всего лишь нескольким. Когда же ста- ла отступать отрезанная от своих танков неприятельская пехота, два подразделения наших автоматчиков смсло контратака- вали противника и истребили большое число гитлеровцев.	vol-5763-page-02-seg-077-3622-4951-4286-6086.png
5763	2	3905	6096	4230	6136	3	0.88840	Капитан А. БЕЛЯЕВ	vol-5763-page-02-seg-078-3905-6096-4230-6136.png
5763	3	342	402	988	432	7	0.90010	апреля 1944 г. пятница. № 83 (5763	vol-5763-page-03-seg-001-0342-0402-0988-0432.png
5763	3	1979	396	2545	428	6	0.90658	A C H A 3 Е	vol-5763-page-03-seg-002-1979-0396-2545-0428.png
5763	3	648	500	1946	646	3	0.79013	н и е	vol-5763-page-03-seg-003-0648-0500-1946-0646.png
5763	3	275	663	936	1440	112	0.95362	Для последних наступательных опера- ций Красной Армии особенно характерным является охватывающий маневр, веду- щий к окружению противника. Факты ус- пешно проведенных нами боев на кружке- я не теперь столь часты, что их можно рассматривать как вiклне определившую- ся тенденцию и принцип в действиях на- них войск, и это, конечно, не случайно. Pe Речь идет о коренных свойствах насту- пательной тактики Красной Армии. Они ярко проявились сразу же после того, как советские войска Перешли к широким на- ступательным действиям, берущим свое начало от Сталинграда, явивш ося котом для немецко-фашистской армии. Решающая фаза борьбы за Сталинград явилась как бы увертюрой, определившей содержание и характер советской насту- пательной тактики, рассчитанной на пол- ный разгром противника.	vol-5763-page-03-seg-004-0275-0663-0936-1440.png
5763	3	273	1452	929	2148	100	0.95632	Смотреть на уничтожение неприятель- ских сил, как на самое главное не только во всей войне, но и в каждом отдельном бою таков основной принцип военного искусства. Этот принцип является руко- сидящим в операциях, осуществляемых Красной Армией и тогда, когда она вела оборонительные бои, и в особенности m наступательных операциях. Традиции небывалой в истории по масштабам и ре- зультатам операции под Сталинградом послужили той прочной основой, на кото- рой окончательно оформилась тактика маневрирования Красной Армии, отводя- щая первостепенное значение охватыва- ющему маневру. Эффективность этой так- тики со всей силой Проявилась в по- следних операциях наших войск, в осо- бенности Украинских фронтов.	vol-5763-page-03-seg-005-0273-1452-0929-2148.png
5763	3	265	2164	923	3051	121	0.95864	новому «Сталинграду» следует прежде всего отнести знаменитую Кор- корсунь-Шевченковскую операцию, осущест- вленную главным образом войсками 2-го Украинского фронта. Здесь прежде всего бросается в глаза смелая идея решения. Как известно, в этом районе оборона про- тивника «подпиралась» довольно крупной танковой группировкой, располагавшей относительно широкими возможностями для дза неврирования, что крайне затрудняло обходный маневр наших войск. Немцы это, конечно, понимали, поэтому не торопились отводить свои пехотные дивизии, сосредо- точенные в районе Корсунь-Шевченков- ский, несмотря на то, что над ними на- висла угроза флангового удара. Пиея под рукой мощный танковый резерв, фашист- ское командование было спокойно за по- ложение на данном участке фронта. II всё же катастрофа разразилась. Как развива- лись события - хорошо известно. Отме- тим "лишь наиболее характерные черты этой поучительной операции.	vol-5763-page-03-seg-006-0265-2164-0923-3051.png
5763	3	261	3070	915	3395	43	0.96021	Прежде всего обращают на себя внима- ние смелость и внешняя простота манев- ра наших частей, сумевших решить весь- ма сложную задачу. известно, удар наносился из двух противоположных на- правлений по кратчайшим линиям, иду- почти параллельно фронту, что, по- видимому, явилось неожиданностью для немцез.	vol-5763-page-03-seg-007-0261-3070-0915-3395.png
5763	3	263	3408	921	4055	78	0.95080	Мы уже отмечали то обстоятельство, что на данном участке противник распо- лагал значительными Подвижными резер- вамп. В этих условиях первостепенное значение приобретали стремительность и внезапность действий. Клинья должны были сомкнуться прежде, чем придет в движение окружаемая группировка про- тивника, если бы опа попыталась выйти из-под угрозы окружения. С другой сто- роны, важно было упредить подвижные резервы противника, не дать им возмож- ности установить тактический контакт с окружаемыми частями. Всё это удалось осуществить опять-таки путем смелого II стремительного удара.	vol-5763-page-03-seg-008-0263-3408-0921-4055.png
5763	3	255	4060	915	5544	213	0.95968	Одна из особенностей всякой операции на окружение при стабильном положении фронта состоит в том, что ее приходится начинать с прорыва неприятельской 000- гоны, чтобы таким образом получить возможность для обходного маневра. Tar: было под Сталинградом, так обстояло дело и в данной операции. II в том и в другом случае были приняты все меры к тому, чтобы достичь максимальной экономии времени при прорыве обороны противни- ка. Это обстоятельство весьма важно, ибо опыт дает немало примеров, когда затяж- ка боев при прорыве фронта противника служила причиной неудачи задуманной операции на окружение. Прорыв должен быть быстрым, а вклинение подвижных частей стремительным. Элемент внезап- пости доминирует над всем остальным. Ут- раченную внезапность будет уже трудно чем-нибудь компенсировать. Только путем стремительных действий, не оставляющих у врага ни времени. ни места для контр- маневра, можно в современных условиях осуществить окружение. Вспомним Ста- линград. В каком быстром темпе там нашими войсками были осуществлены прорыв обороны противника и двусторон- ний охват его основной группировки! На всё это ушли считанные дни. Примерно такая же картина имела место в районе Звенигородка-Шпола. Здесь также прорыв неприятельского фронта и выход подвиж- ных частей слились воедино, были совер- шены в исключительно высоком темпе. Это было достигнуто путем сосредоточения на избранном направлении достаточно мощных ударных кулаков, способных про- ломить неприятельскую сторону н развить маневр на нужную глубину.	vol-5763-page-03-seg-009-0255-4060-0915-5544.png
5763	3	259	5551	913	5780	33	0.94277	Еще более высокие темпы окружения продемонстрировали наши войска в райо- не Снегиревка Березнеговатое. Самый разгром 6-й немецкой армии, окруженной в этом районе, занял всего лишь 3 дня. Из практики известно, как важно до-	vol-5763-page-03-seg-010-0259-5551-0913-5780.png
5763	3	979	713	1588	750	3	0.91761	Подполковник П. КОЛОМЕЙЦЕВ	vol-5763-page-03-seg-011-0979-0713-1588-0750.png
5763	3	934	829	1600	3416	366	0.95737	биться соответствия между задачей и си- лами, выделяемыми для се выполнения, чтобы между средствамн и целью не бы- до диспропорции. Это несоответствие обычно сказывается лишь разгар опе- рации, когда уже трудно поправить Замахивайся на длину севе- тует жизненный опыт. Соразмеряй глу- бину удара своими силами и сред- ствами, выделяй для погуще"давления за- думашюго маневра потребные силы ганов совет военного оныта. Идея окруже- ния превращается в фикцию, она не проводится в жизнь со всей энергией в средствами, ни в каких других условиях противник не сопротивляется так отчаянно. как при повисшей угрозе окружения. Сломить это сопротивление можно лишь путем решительных дейст- вий, Это как раз и характерно для войск Iro 2-го Украинских фронтов, кото- рые, сосредоточив свои усилия в решаю- щем пункте, сумели там быстро достичь превосходства над противником, в част- новости в отношения подвижности. Корсунь-Шевченковская операция. как Сталинградская Слегиревско-Берез- неговат'кая, полностью выявила роль место танков и конины в боях на ружение. Метод использования танков характер их маневра в пайоно Звени- Городка --- Шпола во. многом голодные тем, что пмело место под Сталингра- дом. В обоих случаях танки действовали массированно по двум сходящимся на- правлениям, т. е. неприятельская группи- ровка охватывалась сильными танковыми клещами. Мы подчеркиваем глобо силь- рыми. III и рокая операция на окружение в современных условиях но может быть успешно осуществлена без участия под- виденных войск, среди которых танки за- нимают основное место. Это утверждение вряд ли можно оспаривать, не рискуя власть в серьезную ошибку. Танковые и механизированные части при содейст- ВИН КОННИЦЫ ЯВЛЯЮТСЯ главными но- сителями маневра на окружение и в этой роли они пода незаменимы. бесспорно, как бесспорно и то, что глубокий обход крупной вражеской группировки 110 плечу лишь танковым и механизирован- соединениям. В этом смысле опыт Звенигородки заслуживает пристальног Внимания. Танковая группа, совершающая глубокий обход, должна обладать достаточ- ной мощью, чтобы смять заслоны и, выйдя к намеченным пунктам в тылу противника, прочно удержать их. контратаки неприятельских ре- зервов, они подошли разыщет на- них основных сил пехоты и артиллерии. Но лучше этого не допускать п приня- мать все меры для упреждения потвля- ных резервную противника, чтобы к их подходу наша артиллерия и пехота за- крепилась на рубенах, куда раньше вы- танковые части. Чем быстрее это будет сделано, тем крепче и надежнее станет кольцо окружения.	vol-5763-page-03-seg-012-0934-0829-1600-3416.png
5763	3	936	3433	1587	3874	65	0.96571	Таким образом всякая современная крупная операция на окружение носит комбинированный характер, где участ- вуют все рода войск, но роль их и место на тех или иных этапах операции раз- лична. Собственно окружению кладут обычно начало подвижные танковые и ме- ханизировалные части и конница. Пехота и артиллерия развивают и закрепляют ус- пех, достигнутый танками. Такова прин- ципиальная схема, в которую обстановка вносит то или иные поправки.	vol-5763-page-03-seg-013-0936-3433-1587-3874.png
5763	3	929	3882	1585	4872	137	0.96155	Как показывает опыт, завершение опе- радии, т. е. ликвидация окруженных пе- приятельских сил, ложится в основном на плечи пехоты и в особенности артил- лерии. Действия их носят концентричес- кий характер. Интересно, что и под Сталинградом, и районе Корсунь- Шевченковский сжимание кольца происхо- дило неравномерно, что объясняется стрем- лением поступающих расчленить окру- женную группировку и уничтожить ее по частям. Эта тактика правильна, так как она дает возможность не допустить уплот- нения группировки противника, ибо от этого сопротивляемость его увеличивается. Расчлененный противник лишается вы- год маневрирования по внутренним лини- ям этого важного и, пожалуй, эдип- ственного преимущества над окружающими войсками. Практика знает отнюдь не еди- ничные примеры, когда наметившееся и наполовину осуществленное окружение всё же не удавалось, так как окружаю- щая сторона. разбросав свои силы по кольцу окружения, не могла преодолеть сопротивления уплотнившейся группиров- ки противника, находящейся в кольце.	vol-5763-page-03-seg-014-0929-3882-1585-4872.png
5763	3	929	4882	1581	5615	108	0.95093	Кольцо окружения должно быть спло- шным, по наносить удары надо силь- ными кулаками на решающих направ- лениях, стремясь разъединить селы про- тивника и добить их порознь. Правда, окружение в . кольце окружения приво- дит" также к дроблению сил наступаю- ших, но при умелом обеспечении флан- гов это не опасно. Опыт показал, что с началом расчленения окруженных войск сила сопротивления их сразу резко сни- кается и они начинают быстро терять свою боеспос бногть. Это интересное яв- ление может служить предметом специ- ального исследования. Мы сейчас сбра- щаем на него внимание с чисто практи- ческой целью, чтобы выявить основы тактики завершающего этапа операции на окружение ликвидации окружен- ных войск противника.	vol-5763-page-03-seg-015-0929-4882-1581-5615.png
5763	3	933	5624	1583	5771	20	0.92689	Важным вопросом операции на окруже- ние является согласованность усилий • частей, действующих на внутреннем и внешнем кольце окружения. По опыту	vol-5763-page-03-seg-016-0933-5624-1583-5771.png
5763	3	1617	657	2273	1210	74	0.95640	Корсунь-Шевченковской операции можно судить тактике резервов противника, брошенных на помощь окруженным. В атом отношении немцы действуют 110 установившемуся шаблопу, пытаясь про- рвать кольцо окружения извне, главным образом путем массированных контратак (контрударов) танков. Контратаки нем- нев носят упорный и настойчивый харак- тер даже тогда, когда очевидна их бес- юлезность. Так, в районе Звенигородки немцы отказались от контратак лишь по- сле того, когда их танковая группа по- негла огромные потери и почти полностью потеряла свою боеспособность.	vol-5763-page-03-seg-017-1617-0657-2273-1210.png
5763	3	1612	1227	2266	1704	62	0.95807	Действия наших частей на внешнем кольце окружения имеют решающее зна- чение для успеха всей операции. Необхо димо, чтобы эти части обладали высокой противотанковой устойчивостью. Важную роль здесь играют истребительные артил- лерийские части, используемые масиро- ванной на решающем направлении. В Кор- сунь-Шевченковегой операции противо- танковая истребительная артиллерия яви- лась тем барьером, о который разбились все попытки танков противника пробиться к своим окруженным дивизиям.	vol-5763-page-03-seg-018-1612-1227-2266-1704.png
