volume_number	page_number	x1	y1	x2	y2	tokens_count	mean_confidence	text	image
5016	2	244	2131	916	3202	156	0.95736	Упорные и кровопролитные бои идут на правом крыле фронта. Одна из действующих здесь частей, предприняв смелую контратаку, выбила противника его позиций, уничтожив 2 минометные батареи, 4 орудия полевой артиллерии и значительную часть живой силы неприя- теля. Другая наша часть, ведущая бои в этом "же районе, овладела господствующей над местностью высотой. Немцы оставили здесь 200 трупов своих солдат и офице- ров. Потери с нашей стороны: 6 убитых 23 раненых. В районе Калинина в течение послед- двух дней бои шли с переменным ус- пехом. Противник еще больше усилил свое нулевое сопротивление, продолжая одно- ременно наносить массированные удары воздуха по нашей наступающей пехоте. На северной окраине города под давле- нем немецкой пехоты и танков одна из таших стрелковых частей вынуждена была несколько отойти и оставить отби- гую днем раньше улицу. Зато другая на- ца часть, ведущая бои на подступах к городу северо-востока, продвинулась вперед. Немцы усиленно укрепляют подвалы домов, минируют дороги, днем и ночью роют окопы. Видимо, враг рассчитывает	vol-5016-page-02-seg-008-0244-2131-0916-3202.png
5016	2	940	1227	1617	2512	192	0.96024	прикрыться с северо-западной стороны, чтобы развязать себе руки для движения к столице. Наши части держат врага в полуколь- це, отбивая все попытки фашистов рас- ширить образовавшийся клип. Сегодня, как и вчера, немцы пытались перейти в наступление, по метким огнем танкистов все атаки врага были отбиты. Вскоре часть, где начальником штаба тов. Крас- ное, перешла в контрнаступление и пане- сла врагу тяжелый урон. Уничтожено 10 орудий, 15 танков, 10 броневиков и не- сколько минометных батарей. На поле боя осталось 500 немецких трупов. Противник старается на этом участке выравнять линию фронта и занять более выгодные позиции. Немцы продолжают подбрасывать новые силы и повторять атаки, но безуспешно. Наша авиация сосредоточенными уда- рами воздействует на вражескую пехоту, танки и машины до их подхода к полю боя. Особенно эффективно действуют лет- чики тов. Кадичева, Лейтенант Погорелов получил задачу разведать аэродромы про- тивника. Наступали сумерки, вести раз- ведку в это время было трудно. Но Погаре- лов выследил вражеское логовище, а на сле- дующий день, едва только рассвело, повел самолеты к цели. Это шли истребители, бомбардировщики и штурмовики. B В результате удачной атаки аэродрома было уничтожено 18 фашистских самоле- тов. Наши самолеты без потерь возврати- лись на свои базы.	vol-5016-page-02-seg-009-0940-1227-1617-2512.png
5016	2	940	2518	1611	3012	73	0.95018	Успешными были и действия летчиков Самохина. На земле и в воздухе они уничтожили 10 вражеских самолетов. В этом бою отличился младший лейтенант Емельянов. Искусно маневрируя, он пер вой же очередью сбил фашистский само- лет "Дорнье-17". 7 немецких самолетов сбила наша зенитная артиллерия. Летчики тов. Буцевалова только за по- следние дни боев на калининском поправ- линии уничтожили до 8 рот пехоты, 7 цистерн с горючим, 6 орудий, 311 ма- шин. Разгромлено два железнодорожных моста.	vol-5016-page-02-seg-010-0940-2518-1611-3012.png
5016	2	940	3016	1607	3196	24	0.94707	На участке действий бойцов тов. Хо- менко артиллерия снова совершила огне- вой налет на ближайший фашистский -аэ- роддом. Уничтожено 6 немецких самолетов... Батальонный комиссар	vol-5016-page-02-seg-011-0940-3016-1607-3196.png
5016	2	440	3284	1417	3445	5	0.86340	бессмертный подвиг трех славных соколов	vol-5016-page-02-seg-012-0440-3284-1417-3445.png
5016	2	240	3473	912	4492	147	0.95072	КРЫМ, 4 ноября. (По телеграфу от наш, 1ец. корр. ). Летчик Горшков, штурман По- зарич и стрелок-радист Шаронов получили задание штурмовать вражескую мотоколон- ну. Уже через четверть часа краснозвезд- тый самолет быт над целью. По степи длинной вереницей двигались грузовики с немецкой пехотой, танки, мо- гудиклисты, Вынырнув из-за облаков, три алинских сокола стремительно атаковали лонну. Первые же бомбы вызвали боль- ной пожар. До пятнадцати грузовиков ока- ались разбитыми. Обезумевшие от ужаса немцы стали раз- ебаться. Тогда Горшков и его, боевые рузья, снизившись до ста метров, приня- тись расстреливать фашистов пулеметным нем. Меткие пули настигали бегущих гитлеровцев повсюду: в придорожных ка- навах, у соломенных скирдов, на пашне. После второго захода по самолету был . . открыт сильный огонь с танков, Затем немцы откуда-то подтянули зенитную ус- тановку. Снаряды рвались почти у самой машины. Тем не менее, мужественный экипаль продолжал выполнять задание. еще десять грузовиков превратились в груду развалин.	vol-5016-page-02-seg-013-0240-3473-0912-4492.png
5016	2	936	3473	1611	4193	103	0.95206	Неожиданно самолет Горшкова резко под- бросило вверх и в ту же секунду вспыхну- ло пламя. Вражеский снаряд угодил в плен- гральный бензобак. Самолет загорелся. Лет- чик пытался сбить пламя, проделывал на горящей машине сложнейшие эволюции, но потушить пожар не удалось. Сталинские соколы могли выброситься на парашюте, однако, внизу были немцы. Спасти жизнь можно было лишь ценой плена. Старший лейтенант Горшков, стар- ший лейтенант Поварич и младший лейте- нан Шаронов предпочли смерть фашистско- му плену. Твердой рукой Горшков направил горя- щий самолет прямо на вражескую колонну. Раздался взрыв оглушительной силы. Под обломками самолета были погребены десят- ки грузовиков с немецкой пехотой и три танка.	vol-5016-page-02-seg-014-0936-3473-1611-4193.png
5016	2	938	4195	1611	4478	42	0.95511	Летевшие вместе с Горшковым на дру- гих машинах младший лейтенант Плаксин и младший лейтенант Старков были оче- видцами этого героического подвига. На их глазах три отважных воздушных бойца по- жертвовали своей жизнью во имя родины, во имя газпрома ненавистного врага. Л. ИШ.	vol-5016-page-02-seg-015-0938-4195-1611-4478.png
5016	2	2534	898	3018	998	5	0.92833	(Из лозунгов ЦК ВКП(б) к	vol-5016-page-02-seg-017-2534-0898-3018-0998.png
5016	2	1719	1034	2936	1213	6	0.88165	Контрудары по фашистским отдам в Донбассе	vol-5016-page-02-seg-018-1719-1034-2936-1213.png
5016	2	1645	1233	2316	1413	29	0.94857	южный фронт, 4 ноября. (По теле- графу от наш. спец. корр. ). Первые дни ноября ознаменовались ожесточенными боями с фашистами на некоторых участ- ках фронта. Бои за Донбасс усиливаются.	vol-5016-page-02-seg-019-1645-1233-2316-1413.png
5016	2	1641	1429	2314	1751	47	0.95776	В течение 2 ноября наши части вели бои главным образом в районе Горловки и севернее ес, удерживая на остальных участках занятые рубежи. Три дня про- должались здесь упорные бои. Три дня подразделение, которым командует капитан Богуславец, дралось с численно превосходя- щим противником, Только получив приказ, оно отошло.	vol-5016-page-02-seg-020-1641-1429-2314-1751.png
5016	2	1643	1767	2310	1955	36	0.95550	В этот же день на правом фланге фрон- та немцы пытались ударить в стык двух соединений, но этот маневр им не удался... В ночь на 3 ноября наши части укреп- ляли занятые рубежи и вели разведку.	vol-5016-page-02-seg-021-1643-1767-2310-1955.png
5016	2	1639	1969	2314	2217	29	0.95968	Утром следующего дня артиллерийское подразделение капитана Зайцева обстреляло о1ну колонну немцев, вытягивающуюся к передовым позициям. Потери, нанесенные колонне, столь велики, что намечавшееся здесь наступление на нашу оборону сор- валось.	vol-5016-page-02-seg-022-1639-1969-2314-2217.png
5016	2	1637	2235	2310	2630	63	0.95774	Ожесточенные бои идут в другом районе Часть, которой командует тов. Петра- ковский, продвинулась вперед. Немцы отходят, оставляя горы трупов и ору- жия. Действующая здесь 4-я горно-стрел- ковая дивизия, несмотря на грозные при- казы командира 49-го номелкого армей- ского корпуса генерала кюблера, снова по- казала нашим бойцам свою спину. 13-й егерский полк этой дивизии бежал, оста- вив на поле боя 250 убитых и раненых.	vol-5016-page-02-seg-023-1637-2235-2310-2630.png
5016	2	1637	2640	2308	2820	29	0.95444	На соседнем участке одно из подразделе- ний N стрелковой части отбросило насе- давших немцев. ночь на 4 ноября наши войска удерживали занятые рубежи... Противник активности не проявлял. На не-	vol-5016-page-02-seg-024-1637-2640-2308-2820.png
5016	2	2334	1245	3008	2248	155	0.95589	которых направлениях продолжается сосре- доточение крупных вражеских сил. Потери немцев всюду весьма велики Танкисты части тов. Кузнецова только за 1 ноября подбили 15 танков (в том чис- ло 2 тяжелых), 20 противотанковых ору- дий, 3 миномета, 3 станковых пулемета уничтожили 450 вражеских пехотинцев. За первые 2 дня ноября летчики тов. Вершинина уничтожили более 260 авто- машин, 14 танков, 1 бронемашину, до 60 ПоБ030К с лошадьми, 16 мотоциклов, 10 зенитных орудий, 6 полевых орудий, 2 цистерны с горючим, 5 зарядных ящиков со снарядами и до 1.500 солдат и офи- церов. 3 ноября летчики тов. Вершинина снова совершили ряд удачных налетов на живую силу и технику врага. Здесь имел место интересный случай Еще раз пришлось убедиться в трогатель ной «дружбе» Гитлера со своими союзника- ми. Группа итальянских солдат невдалеке от Сталино 3 ноября гнала реквизированный у крестьян скот. Как показывают пленные итальянцы, положение с продовольствием в итальянских дивизиях напряженное. Вот почему на упомянутый скот возлагались большие надежды!	vol-5016-page-02-seg-025-2334-1245-3008-2248.png
5016	2	2334	2254	3006	2720	76	0.96055	Можно представить разочарование италь янских громил, когда они узнали, что Сталина их гурт задержан германскими вла стями. Итальянцы спешно запросили свое командование: "Какие на этот счет суще ствуют приказы и как в таком случае обеспечить солдат мясом". Можно не сом- неваться в ответе. Скот останется у нем- цев, а итальянцам предоставят право на ряду с немцами снабжаться за счет ограб- ления квартир местного населения, что они собственно сейчас и делают со свойственной им ловкостью мелких воришек.	vol-5016-page-02-seg-026-2334-2254-3006-2720.png
5016	2	2534	2736	2954	2808	3	0.91953	Батальонный комиссар лильин	vol-5016-page-02-seg-027-2534-2736-2954-2808.png
5016	2	1805	2892	2826	2956	4	0.95913	Бои под Тулой продолжаются	vol-5016-page-02-seg-028-1805-2892-2826-2956.png
5016	2	1635	2966	2312	3292	55	0.95690	ТУЛЬСКОЕ НАПРАВЛЕНИЕ, 4 ноября. (По телефону от наш. спец. корр. ). Бои под Тулой продолжаются. Но сейчас у вра- га уже нет того пыла, с каким он начал наступление на город. Видимо, удары, на- несенные нашими частями фашистам, дают себя знать. Огромнейшие потери в живой спле и технике заставили немцев почти полностью прекратить атаки, Предприня-	vol-5016-page-02-seg-029-1635-2966-2312-3292.png
5016	2	2334	2968	2992	3044	10	0.93531	тые сегодня наскоки на нашу оборону бы ди успешно отбиты.	vol-5016-page-02-seg-030-2334-2968-2992-3044.png
5016	2	2338	3054	3000	3208	16	0.94370	Это, конечно, не значит, что враг от казался от дальнейшего наступления. подтягивает резервы, ведет усиленную раз-	vol-5016-page-02-seg-031-2338-3054-3000-3208.png
5016	2	2332	3216	2998	3288	12	0.92433	Защитники Тулы должны во что бы тс ни стало отбить готовящийся удар.	vol-5016-page-02-seg-032-2332-3216-2998-3288.png
5016	2	1689	4375	2942	4478	21	0.95283	Можайское направление. На снимке: орудийный расчет младшего сержанта Бори- сова ведет огонь по противнику. Снимок специального фотокорреспондента «Красной звезды» Г. Белянина	vol-5016-page-02-seg-034-1689-4375-2942-4478.png
5016	2	278	4584	1581	4776	3	0.98053	Отряд истребителей танков	vol-5016-page-02-seg-035-0278-4584-1581-4776.png
5016	2	242	4800	908	5088	40	0.95318	Во многих наших частях созданы спе- циальные отряды истребителей танков. тог работы истребительного отряда, ко- орым командует старший лейтенант Са- затеев, говорит о том, что пехота может только отбивать атаки танков, но и ничтожать их, в каком бы количестве появились.	vol-5016-page-02-seg-036-0242-4800-0908-5088.png
5016	2	244	5106	908	5709	84	0.95620	Впервые отряд истребителей встретил ражеские тапки, обороняя шоссейную орогу. Оконы отряда располагались непо- алеку от шоссе. Для истребителей были вырыты щели полного профиля возле са- ой дороги. На правом фланге - от шоссе железной дороги - командир приказал становить мины. Как только рассвело, послышался шум моторов, и перед обороняющимися появи- ись 10 танков противника. Два из них, юпытавшись зайти в тыл обходом право- фланга, наткнулись на минное поле и зорвались. Остальные танки, не доходя до ереднего края нашей обороны, останови- ись и открыли огонь,	vol-5016-page-02-seg-037-0244-5106-0908-5709.png
5016	2	234	5725	912	6343	88	0.95573	Истребители под командованием полит- ука Фомкина вылезли из щелей и по- ползли навстречу танкам. Найдя укрытие, истребители залегли и стали забрасывать немецкие танки бутылками с горючей жидкостью. Результат: сержант Подгорный поджег 2 танка, политрук Фомкин два, красноармеец Евтушенко -- 1 танк. В тороне, неизвестно кем подожженный, за- выпал еще один танк. Итого восемь тап- :овраг бы. уничтожены за пять ми- гут боя. Видя горящие танки, немцы бросили на выручку автоматчиков. Их встретили пе- перекрестным пулеметным огнем. Неся боль- ние потери, автоматчики отхлынули об- После этого немцы через каждые	vol-5016-page-02-seg-038-0234-5725-0912-6343.png
5016	2	934	4794	1605	5300	82	0.95379	3 часа повторяли свои атаки, но уже без танков. Этот бой длился трое суток. Немцы решили предпринять психиче- скую атаку. На полной скорости к месту обороны помчались 30 немецких автома- шин с пехотой. Не доезжая пятидесяти метров до наших позиций, немецкие ма- шины остановились. Из них выскочили солдаты. Они разомкнулись в цепь и по- шли в атаку. Не растерявшиеся пулемет- чики стали бить по фашистам косопри- цельным огнем. Первая атака была отби- та, за ней последовала вторая. Это дорого обошлось атаковавшим немцам.	vol-5016-page-02-seg-039-0934-4794-1605-5300.png
5016	2	934	5306	1603	5556	40	0.95176	Но враг все же не отказался от своих намерений. Неожиданно в глубину оборо на ворвался немецкий броневик с прице пом, Пулеметчики обрушили на неждан- ных гостей шквальный огонь. Соскочив с прицепа, немецкие солдаты залегли, Бро- невик развернулся и ушел обратно.	vol-5016-page-02-seg-040-0934-5306-1603-5556.png
5016	2	934	5564	1605	5883	47	0.94546	Вслед за пулеметчиками на врага, вклинившегося в нашу оборону, обрушил- ся огонь наших стрелков. На поле боя остались сотни фашистских трупов. В ру- ки истребителей попали 6 пулеметов, мно- го автоматов, карты и различные докумен- ты, по которым установили, что эту психическую атаку предпринял 86-й полк «СС»	vol-5016-page-02-seg-041-0934-5564-1605-5883.png
5016	2	936	5903	1603	6081	27	0.95581	Через несколько дней после этого боя разведчики донесли, что на шоссе стоят 18 танков противника. В этот район вы- шел взвод истребителей под командовани- ем сержанта Коновалова.	vol-5016-page-02-seg-042-0936-5903-1603-6081.png
5016	2	934	6083	1609	6335	43	0.94614	Ночью, подойдя к шоссе, Коновалов оставил людей в лесу, а сам пополз к до- роге. Лежа в придорожной канаве, он раз- глядел, что за каждым танком стоит ав- томашина с пехотой. Сержант распределил между своими бойцами объекты нападения. Вползая в придорожную канаву, бойды	vol-5016-page-02-seg-043-0934-6083-1609-6335.png
5016	2	1627	4572	2300	4672	13	0.93326	ложились друг от друга на расстоянии 4-5 метров. Сигнал был заранее узлов- лен.	vol-5016-page-02-seg-044-1627-4572-2300-4672.png
