volume_number	page_number	x1	y1	x2	y2	tokens_count	mean_confidence	text	image
5118	2	3166	3609	3839	6135	352	0.95663	Следует отметить еще существен- ную ошибку. допускаемую кое-где за пос - летнее время. Некоторые командиры по предлогом отказа от артиллерийской под- готовки вообще не считают нужным про- изводить предварительную обработку це начала пехотной атаки. Подобным "новаторам" необходимо твердо уяснить что аргиллернйское поступление пачн- нается с момента открытия огня перед началом атаки пехоты и заканчивается тогда, когда пехотные части выполня! задачу дня. Если на переднем крае и б.ближайшей глубине обороны противника имеются огневые точки, прикрыты прочными инженерных сооружениям! (13:ты, блиндажи и т. п.), то ясно, что еще до начала атаки эти огневые точка должны быть разрушны, так же, как проволочные заграждения и т. п. Надо понять, что речь идет об отказе от такой артиллерийской подготовки, ког- снаряды разбрасываются по площади... a по сосредоточиваются на конкретных точно установленных целях, когда належ но уничтожение наиболее врелящих пе лей полменяется так называемым по ловле целей, когда наступление артиллерий. огнем органически не связано с па- ступлением пехоты. Несвязанность двух решающих моментов наступления превра- щает огонь артиллерии в расточительную роскошь, оправдываемую никаким ссылками на условия». хота должна наступать под грохот споря- 105, под звуки артиллерийской музыки. Это означает, что нужен твердый план ар. тиллегийского диступления, разработанный на основе плана общевойскового боя и вы- Полняемый четко, разумно, инициативно. Попытки набросать на все слу- чай боевой жизни схему организации артиллерийского наступления явно обре- чены на неудачу. Опи неизбежно приве- бы к вредному шаблону. распределении артиллерийских средств надо уделять серьезное внима- придаче пехотным подразделениям орудий, взводов. В текущей войне па ОДНОМ участке прорыва фронта одновре- менно работало с открытых позиций 70 орудий из общего количества в 375 сру- дий. Успех прорыва был обеспечен. Этот опыт надо признать удачным. Следует только указать, что необходим тщательный. выбор позиций для этих орудий. пребыва- ине на открытых огневых позициях 10.1- быть кратковременным я часть на- шей артиллерии должна воздействовать в этот период на артиллерийские и мино- метные батареи противника, приводя их молчанию. По мере продвижения в глубину обо- роны управление артиллерией постепен- децентрализуется и в: с теспее стано- непосредственное взаимодействие мелких пехотных и артиллерийских пол- разделений. Непрерывность огня , артил- дерии достигается также перемещением ее боевых порядков за продвигающейся пе- хотой. Есть командиры, которые утвержиа	vol-5118-page-02-seg-051-3166-3609-3839-6135.png
5118	2	3861	622	4524	786	27	0.94557	ют, что артиллерия, двигаясь вперед все сто с пехотой, должна немедленно снимать- ся с позиций и дентаться вперед в боевых порядках рот, батальонов. Это явное за- блуждение.	vol-5118-page-02-seg-052-3861-0622-4524-0786.png
5118	2	3865	792	4528	1109	51	0.95258	Артиллерия наступает вместе с пехо той. Но что это означает? То, что артил- лерийский огонь должен вести за собою пехоту в атаку от одного объекта обороны к другому, пока система обороны не бу- дет взломана на всю глубину. Именно огонь артиллерии, маневр этим огнем определяет артиллерийское наступление, a не движение колесами.	vol-5118-page-02-seg-053-3865-0792-4528-1109.png
5118	2	3867	1119	4526	1607	68	0.95327	Движение материальной части (сопро вождение колесами) стучит в прямой за- висимости от эффективности огня, а са- мая возможность передвижения - от со стояния дорог, средств тяги и закрепле ния пехотой впередилежащий местности Дальнобойность оружия определяет предел дальности стрельбы, после которого эф фективность огня резко снижается и стрельба превращается в бессмысленный расход боеприпасов. Значит, и ходя из дальнобойности орудия и следует произ- водить перемещение боевого порядка ар тимерин висред.	vol-5118-page-02-seg-054-3867-1119-4526-1607.png
5118	2	3871	1617	4524	2250	98	0.95568	Разновременность перемещения должна соблюдаться и в пределах артиллерий ских подразделений, имеющих однотип- ные студия. Иначе будут паузы в ведо нии ория, и артиллерийское наступление станет неплаторорным, прерывание что вредно отразится на всем ходе боев вых действий. Идеальным надо считате такое перемещение, когда одна треть ар пиллерии (однотипной) находится в дви- жении, а две трели эо ведут огонь. Сле- дует также иметь в виду, что эффектив ный и непрерывный, т. е. наблюдаемый прицельный огонь будет обеспечен лиш при том условии, капа передовые орга ны разведки и управления батарей и ди визионсв будут двигаться вместе с пере довыми частями пехоты.	vol-5118-page-02-seg-055-3871-1617-4524-2250.png
5118	2	3869	2252	4522	2568	45	0.95280	Совсем по-иному обстоит дело с тем орудиями и минометами, которые прида подразделениям пехоты (рота, баталь он) и предназначены для ведения огн прямой наводкой. Эти орудия сочетаю свой огонь и движения, идя вместе с пе хотой пебольшими скачками от укрыти укрытию по датырость прямого выстре ла.	vol-5118-page-02-seg-056-3869-2252-4522-2568.png
5118	2	3865	2574	4522	2924	47	0.95828	Начало перемещения боевых порядко артиллерийских подразделений (исключа оружия сопровождения) и величину скач ков следует тщательно продумать. Пла перемещения должен быть тщательно раз работан и предусматривать, не только ка кие подразделения артиллерии когда и какой район начинают смену боевого по рядка, но и меры, обеспечивающие эти пе ремещения.	vol-5118-page-02-seg-057-3865-2574-4522-2924.png
5118	2	3861	2928	4520	3483	76	0.95618	Особо важно хорошо учесть реально- состояние средств тяпи (конь, трактор автомашина). Поздно вспоминать о горю чем, фураже, осмотре техники, правила эксплуатации, когда бой начался Все это должно быть заранее предусмот рено, организовано, подготовлено. Требует ся максимально облегчать нередвижени артиллерии улучшением дорог и помощь на трудных участках, избегать пробегом не вызываемых боевой обстановкой, своек ременно заботиться об отдыхе и читании Пренебрежение средствами тяги может при- вести в конечном счете к задержкам ар тиллерийского наступления и излишни потерям.	vol-5118-page-02-seg-058-3861-2928-4520-3483.png
5118	2	3855	3487	4528	6143	360	0.95181	Конечно, сказанию выш только таких перемещений артиллерии которые производятся при развитии про- рыва. В процессе боя за тактическую г.ту. бину обороны скачки будут небольшими Здесь потребуется предельное напряжение средств тяги. - Третий элемент артиллерийского на- ступления - требование, чтобы пехота наступала вместе с артиллерией, под зву Ки с музыки. Это - не случайное тре бование. Оно содержит в себе ту необхо- взаимосвязь, копда действия ар- артиллерии и пехоты: целеустремленны, тес- по связаны единством задач, разрешае Артиллерийские и общевойсковые ко- мандеры сбязаны на местности, а по карте. уточнить все вопросы последова- тельного уничтожения звольев ской обороны противника как в момент атаки переднего края, так и в перевод в глубине. Такое уточнение паю проез- водить на по местных предметам, не п «красным крышался или «белыч труба домов", По конкретным, разведанных (объектам атаки). Ясно, что тщательная подготовка к ат ке пехоты и ее огневых средств являть ся важнейшим условием, предопределяю- успех артиллерийского наступления Без этого самое артиллерийское наступле- ние превратится в неоправдызаемую тра- Ту материальных средств. рамках газетной статьи нельзя рас- "смотреть" детально все вопросы организа- артиллерийского наступления и вза- импействия его с наступлением других войск. Роль артиллеры совре- менном наступательном колоссальна, по она - не самодовлеющий род оружия. Чем тесное артиллерия будет работать бок о бок с пехотой, танками и авиацией в интересах общевойскового боя, тем эффективно будет боевая деятель- Действия советлюй остиллерии в на- ступлении истут характеризоваться хотя бы также Только по одному фронтез за январь артиллеристы уничте- жали 39 вражеских орудий. 87 миноме- тов, 154 пулекста, 45 танков, 5 броне- мошки, 150 автомашни, 15 наблюдатель- ных петитов, 36 дзотов, до 5.000 фа- шистских солдат и офицеров. по- за этот срок 6-1 оружия, 224 номера, 231 пулемет и т. 1. Немалый представь нашей Эти цифры гут быль и должные быть увеличены за счет лучшей организации готилкарыйска- го наступления Метких советских артиллеристов блит- ся и враг, угрожавший им да- Не в листовках, "Сбрасываемых в район боевых действий. Нас, артиллеристов, ли- стовками не запугать, так же, как не заразиться пугать и военной техникой, которая, Та порядке потрепан славный артиманский. Враг не почувствует на секс всю силу сокруши телиюго сгня советской артиллерии, трсм ес выстрелов будет ззучать похорон- ным маршем, сопровождающим уходящий исторической сцены	vol-5118-page-02-seg-059-3855-3487-4528-6143.png
5118	3	496	348	4544	396	6	0.90300	марта 1942 г., пятница. 54 (5118).	vol-5118-page-03-seg-002-0496-0348-4544-0396.png
5118	3	848	462	1395	564	1	0.96928	Сибиряки	vol-5118-page-03-seg-003-0848-0462-1395-0564.png
5118	3	446	580	1113	864	45	0.94498	Они прибыли в разгар великой битвы за Москву. В вагонах, запорошенных сне- ГОМ, звучало неторопливо: «На тихом бреге Иртыша сидел Ермак, об ятый ду- мой». Из вагонов на жестокий мороз сте- пенно выходили в распахнутых ватниках. гимнастерках с раскрытыми воротами, тетовито умывались на ледяном ветру.	vol-5118-page-03-seg-004-0446-0580-1113-0864.png
5118	3	440	874	1109	1095	27	0.94050	- Однако климат у вас легкий, говорили москвичам покровительственно. Обтирались снегом до пояса. Снежок холодит, снежок и монолит. Снегом мойся - никакого этого вашего обморока не будет.	vol-5118-page-03-seg-005-0440-0874-1109-1095.png
5118	3	444	1101	1109	1455	52	0.94870	11 в эту же ночь зазвучал сибирский говор на дорогах к западу от Москвы. По деревням Подмосковья разнеслось сразу: Сибиряки подошли! Они ударили по немцу с хода. Пехотин- цы, разведчики, артиллеристы, они влило в ряды защитников Москвы свежую сп- бирскую мощь. Заскрипели лыжи, приве- зенные из родной тайги. Заработали таеж- ные охотники-следопыты.	vol-5118-page-03-seg-006-0444-1101-1109-1455.png
5118	3	448	1467	1101	1537	9	0.94395	B одних ватниках, скинув шинели. ударили в штыки пехотинцы.	vol-5118-page-03-seg-007-0448-1467-1101-1537.png
5118	3	446	1541	1078	1613	9	0.93399	Сибирь грудь нараспашку! - говорили о себе с гордостью.	vol-5118-page-03-seg-008-0446-1541-1078-1613.png
5118	3	440	1623	1101	2009	58	0.94026	Медленен, даже угрюм и неразговорчив сибиряк, когда делать нечего. Но в бою нет злее, упорнее и веселее его. Опасность захватывает его целиком, и весь он в ней. Сибирский говор промчался за Кубин- ку, раздался у Волоколамска, где сибиря- ки-артиллеристы громили немецкие дзоты, прозвучал у Наро-Фоминска и Рузы и даль- ше к Можайску, и еще за Можайск на запад.	vol-5118-page-03-seg-009-0440-1623-1101-2009.png
5118	3	440	2021	1101	2264	36	0.94810	Немцы очень быстро узнали о приходе сибиряков, вернее, почувствовали его на себе. Входя в деревню, обязательно рас- спрашивали жителей не сибиряки для тут действуют. Начали головами, если ока- зывались сибиряки. Да как тут не зака- чать?	vol-5118-page-03-seg-010-0440-2021-1101-2264.png
5118	3	436	2272	1099	2446	26	0.94896	Зимою и конь того не осилит, с чем сибиряк справится, говорит лейтенант Анатолий Кузнецов, разведчик из дивизии, которой командовал славно погибший пол- ковник Виктор Иванович Полосухин.	vol-5118-page-03-seg-011-0436-2272-1099-2446.png
5118	3	438	2454	1093	2594	22	0.94577	На карте лейтенанта, размеченной неза долго до своей гибели покойным коман диром, только и есть что стрельи, веду- щие в немецкие тылы.	vol-5118-page-03-seg-012-0438-2454-1093-2594.png
5118	3	434	2606	1093	2848	37	0.95436	у них, подлецов, во втором эше- лоне абсолютно свой человек, все тропки знаю. Лес! Меня в нем не возьмешь... Как-то тридцать два его разведчика с младшим лейтенантом Карепиным трое су- ток пробивались лесом к штабу немецкой дивизии.	vol-5118-page-03-seg-013-0434-2606-1093-2848.png
5118	3	432	2862	1093	3000	14	0.93726	Разведчик огромного таланта и редкой изобретательности, любитель руконашного боя, Карепин носил прозвище «шумового мастера».	vol-5118-page-03-seg-014-0432-2862-1093-3000.png
5118	3	432	3010	1099	3220	34	0.94151	Вперед идет, говорили о нем, как лисица, снега не пошевелит, а назад прет, как медведь. Такого шуму даст, у немцев в ушах скребет. Они уж знают. "Сибиряк, сибиряк!" закричат и скорее мордами в снег.	vol-5118-page-03-seg-015-0432-3010-1099-3220.png
5118	3	430	3232	1091	3407	29	0.95686	Трое суток с боями прорывался Карепин к пункту, тде рассчитывал пойти штаб не- мецкой дивизии. Трое суток сбивал немеп- тие дозоры, уходил от преследования и, наконец, ворвался в штаб.	vol-5118-page-03-seg-016-0430-3232-1091-3407.png
5118	3	428	3415	1095	3695	46	0.95293	Штабную избу забросали гранатами. охранение разогнали. Ведя бой, собрали в охапку все штабные документы, запихали их в семь портфелей и один чемодан и с этим грузом, отбиваясь от немецкой ко- мендантской роты, снова три дня возвра- щались к себе. По дороге взорвали у нем- пев мост.	vol-5118-page-03-seg-017-0428-3415-1095-3695.png
5118	3	428	3711	1084	3811	18	0.94912	Напорнет и азартен в бою спбиряк. Любит взять он, что не дается сразу, хо- рош на тяжелое дело.	vol-5118-page-03-seg-018-0428-3711-1084-3811.png
5118	3	426	3823	1084	4033	33	0.93868	Старший сержант Кудашкин отправился с двумя бойцами добывать "языка". Нем- цы укрепились на берегу реки. Кудашкин с бойцами подполз с противоположного бе- рега. У него был автомат, у бойнов вин- ТОВКИ. Вилят блиндаж,	vol-5118-page-03-seg-019-0426-3823-1084-4033.png
5118	3	1137	586	1797	862	44	0.94698	у блиндажа пулемет, а рядом с ним, точно заяц, прыгает немецкий часовой. Кудашкин говорит: Этого положим на месте. Вылезет из блиндажа второй его положим, а третьего, - их тут трое, не меньше, третьего в ноги, чтоб не ушел, и возьмем его в качестве «языка».	vol-5118-page-03-seg-020-1137-0586-1797-0862.png
5118	3	1135	868	1793	1157	40	0.95137	Кудашкин начал действовать. Часовой упал, не шевелится. Замертво упал и второй, третьему дали, как услов- лено, по ногам. Только двинулись к речке, как выскочил из блиндажа четвертый, бросился к пулемету открыл огонь. Старшего сержанта Будашкина ранило в локоть левой руки.	vol-5118-page-03-seg-021-1135-0868-1793-1157.png
5118	3	1133	1163	1791	1409	32	0.94570	Пришлось отойти, залечь в снег. Бойцы говорят: Товарищ старший сержант, плите во взвод, перевяжитесь. Нет, я его так не оставлю, отвечает Кудашкин. --- Меня уж злость взяла, я его так не оставлю.	vol-5118-page-03-seg-022-1133-1163-1791-1409.png
5118	3	1133	1419	1787	1489	10	0.91737	A четвертый немец палит, головы от снега не поднять. Лежат.	vol-5118-page-03-seg-023-1133-1419-1787-1489.png
5118	3	1129	1495	1791	1637	25	0.94640	Один из бойцов замечает, что в тыл к ним тихо заходит пятерка немцев. Медлен- Но плут гуськом по глубокому снегу, вни- мательно всматриваясь в местность.	vol-5118-page-03-seg-024-1129-1495-1791-1637.png
5118	3	1127	1645	1789	1825	31	0.94009	Ну, так мы этих и возьмем, решает Кудашкин. --- Я бью головного. вы второго и третьего, а последних двух испытаем. Либо залягут, либо побегут, тогда и посмотрим, как с ними быть.	vol-5118-page-03-seg-025-1127-1645-1789-1825.png
5118	3	1129	1833	1789	2079	30	0.94000	Первые три немца пали замертво, упе- левшие сначала легли, а затем панически побежали назад. Кудашкин вскочил. Хальт! - закричал он.--- Сдавайся! Двое немцев подняли руки. Разведчики повели их в штаб.	vol-5118-page-03-seg-026-1129-1833-1789-2079.png
