volume_number	page_number	x1	y1	x2	y2	tokens_count	mean_confidence	text	image
4967	2	3679	2101	4353	2954	126	0.94874	3 сентября авиаразведка обнаружила... что на одном из вражеских аэродромов сделало посадку около 40 самолетов. Былс ясно, что враг готовится перейти к актив- e) ным действиям. Но планы его были cop- ваны. Утром 4 сентября наша бомбардиро- вочная авиация уничтожила на это аэродроме 35 фашистских самолетов. Кро- ме того перед этим на других аэродромах было уничтожено около 50 машин. В итоге нескольких дней наступления только узкая горловина соединяла ельнин- скую группировку врага с его тылами. Вы- водя из-под уничтожающего удара свою живую силу, немцы ринулись в оставший- ся узкий проход. Здесь наша артиллерия и авиация нанесли особенно чувствитель- ный урон врагу. Единственная дорога, ос- оставшаяся в распоряжении немцев, сей- час усеяна трупами фашистских солдат и офицеров, брошенным оружием, повозками, боеприпасами, автомашинами и другим во- енным имуществом.	vol-4967-page-02-seg-075-3679-2101-4353-2954.png
4967	2	3677	2960	4347	3543	77	0.95403	Ельнинская группировка врага ликвиди- рована. В этих боях фашистским войскам нанесен огромный урон. Разгромлены ди- визия CC, 15-я пехотная дивизия 17-я мотодивизия, 10-я танковая дивизия... 137-я австрийская пехотная дивизия 178-я, 292-я, 268-я пехотные дивизии... В деревнях и в городе фашистские ма- родеры оставили кровавые следы своего подлого хозяйничанья. Они обобрали до нитки жителей, насиловали женщин, по- дожгли все дома. Население возвра- щается сейчас на родную землю и горячо приветствует красную армию, принесшую освобождение от насилий гитлеровских банд.	vol-4967-page-02-seg-076-3677-2960-4347-3543.png
4967	2	3673	3545	4345	4095	66	0.94705	Фашистское командование возлагало на ельнинский плацдарм большие надежды, именно этим объясняется упорство, прояв ленное им в течение прошедших боев. Фашисты не считались с потерями, под- брасывали сюда все новые и новые под- крепления. Значительное количество отбор- ных немецких войск нашло под Ельней свою могилу. Длительные бор закалили стойкость на- ших войск, еще больше укрепили боевой дух. Полковник И. ХИТРОВ. ЗАПАДНОЕ НАПРАВЛЕНИЕ, 8 сентяб ря. (По телеграфу).	vol-4967-page-02-seg-077-3673-3545-4345-4095.png
4967	2	3052	4161	4269	4333	6	0.88603	Летчики части Грисенко громят вражеские колонны	vol-4967-page-02-seg-078-3052-4161-4269-4333.png
4967	2	3182	4361	4137	4397	5	0.90291	(От специальных корреспондентов "Красной звезды"	vol-4967-page-02-seg-079-3182-4361-4137-4397.png
4967	2	2988	4421	3649	4604	30	0.94791	5 сентября "Красная звезда" сообщала об ожесточенных боях в районе села 0 Понеся огромные потери, особенно от воз- действия нашей авиации и артиллерии враг бросил в бой все свои резервы.	vol-4967-page-02-seg-080-2988-4421-3649-4604.png
4967	2	2970	4610	3647	5739	160	0.96013	Исключительно успешно действует наша авиация. 5 сентября летчики части тов Грисенко атаковали вражескую автоколон- ну, направляющуюся от населенного пунк та Горностайполь к переправе. Колонна состояла примерно 113 200 автомашин Бомбить начали с высоты 1.000 метров Болбы ложились прямо на цель. Было за мечено до десяти очагов пожаров, разда- лось несколько взрывов бомбы попали в цистерны с горючим. Невообразимая паника началась в стане врага. Было видно, как немецкие солдаты, бросая машины, разбегались в разные сто роны. Тогда наши летчики снизились до ста метров и стали поливать свинцом фа- пистов. Особенно отличалась эскадрилья старшего лейтенанта Шишкина. Пролетая над врагом на малой высоте, летчики этой эскадрильи обнаружили в составе колонны пять танков. При следующих заходах все пять машин были уничтожены. На другой день летчики части Грисенко продолжали свою боевую работу столь же успешно. Была замечена автоколонна, пе- ребрасывающая живую силу врага. Два звена истребителей пикировали на колонну. От прямых попаданий бомб взлетели на воздух десятки машин. Немецкая пехота, пытавшаяся укрыться, расстреливалась из пулеметов.	vol-4967-page-02-seg-081-2970-4610-3647-5739.png
4967	2	2966	5745	3637	6291	82	0.95085	7 сентября наша воздушная разведка донесла, что по направлению к Горностай- полю движутся восемь штабных машин сопровождении танкеток и эскадрона ка- валерии. В этот день была низкая облач- пусть. Летчики удачно использовал ее неожиданно для врага вынырнули из-за туч прямо на передвигающийся штаб. Точ- ным попаданием все машины и танкетки были уничтожены. На дороге остались го рящие обломки, трупы людей и лошадей. Возвращаясь к своему аэродрому, летчики заметили на опушке леса замаскированные сооружения немцев. Снизившись до 300 метров, летчик забросали эти сооружения	vol-4967-page-02-seg-082-2966-5745-3637-6291.png
4967	2	3657	4421	4339	6299	266	0.94828	бомбами. Раздавшиеся один за другим взрывы были настолько сильны, что от сотрясения воздуха самолеты подбросил вверх. Впоследствии выяснилось, что здесь находился склад вражеских боеприпасов... Не менее удачны были действия наших самолетов при попытке немцев перепра- виться через реку. Большое количество паромов с войсками неприятеля и артил- лерней было пущено на дно реки. Огромны потери, наносимые врагу на- шей артиллерией. Днем и ночью артилле- ристы массированным огнем уничтожают живую силу немцев и их огневые точки, не давая врагу ни минуты передышки... 0 том, какой большой урон терпят фа- шистские войска, рассказывают все без исключения пленные, взятые здесь в по- следние дни. Вот выдержки из дневника ефрейтора шестой роты 260-го полк3 113-й пехотной дивизии Рупрехта Вайге- ля, взятого в плен 6 сентября. «30 августа. Русские открыли сильный артиллерийский огонь. Много раненых п убитых. Это ужасно. 31 августа. Сегодня еще хуже. Огонь русских усиливается. Офицер Брейдер убиг, офицер Брайглер убит. 1 сентября. Шеф роты А длина тяжело ранен. Налетали русские самолеты. Лежим грязные в ямах, полных воды. 2 сентября. 7 часов утра. Русские на- ступают. Снаряды ложатся совсем близко. 16 часов 30 минут. Русские продолжают наступать с танками и самолетами. От сильного артиллерийского огня дрожит зем- ля. Моя жизнь в большой опасности. 3 сентября. Чудом остался жив. Сильно бомбят русские самолеты. Количество уби- тых и раненых все увеличивается. В роте осталось 30 человек. 4 сентября. Русские продолжают насту- пать. Удивительно, как они метко стре- ляют. Опять танки, самолеты...». Поле боя на берегу реки . усеяно ты- сячами трупов немецких солдат и офице- ров. Наши части продолжают уничтожать живую силу и боевую технику врага. Б. АБРАМОВ. Я. МИСЛАВСКИЙ. ЮГО-ЗАПАДНОЕ НАПРАВЛЕНИЕ	vol-4967-page-02-seg-083-3657-4421-4339-6299.png
4967	3	374	430	1106	468	7	0.91497	сентября 1941 г., вторник. № 212 (4967).	vol-4967-page-03-seg-001-0374-0430-1106-0468.png
4967	3	2083	438	2696	476	8	0.93917	Р А С Н А 3 Е А	vol-4967-page-03-seg-002-2083-0438-2696-0476.png
4967	3	588	546	4107	700	6	0.99018	Женщины всего мира-на борьбу против фашизма	vol-4967-page-03-seg-003-0588-0546-4107-0700.png
4967	3	294	776	980	3691	419	0.95591	Матери, жены, сестры бойцов, сражаю- щихся на фронте против озверелых фаши- стских по.тчиц, прославленные советские женщины, имена известны всему куль- турному человечеству, и труженицы фаб- рик, заводов, транспорта, учреждений все они пришли сюда, в Колонный зал Дома Союзов, чтобы громко, на весь мир, заявить о своей безраздельной преданности родине, Советскому Правительству, товары- ** Сталину, о своей готовности к борьбе против гитлеровских насильников и убийц, Борьбе до полной победы. Митинг открыла Герой Советского Союза Валентина Гризодубова. - Не было. --- говорит она. --- нет и не будет более свирепого и ненавистного врага у женщин всего мира, чем фашизм! Нигде, ни в одной стране женщина так не принижена, как в Германии. Даже во вре- исна татарского что, во времена нашест- гуннов женщина не подвергалась та- надругательствам, таким глуилениям, каким подвергает ее озверелая орда гит- перовских головорезов. В районах Совет- ского Союза, временно захваченных не- мецко-фашистскими ордами, гитлеровские насильники творят такие чудовищные зло- деяния, от которых стынет кровь в жи- лах и разум отказывается: верить, что это сделано зверьем, хотя бы по своему внеш- нему облику напоминающим людей. Женщины нашей страны в дни великой священной отечественной войны против германского фашизма показали всему ми- ру, что сердца их полны пламенной, бла- городной любви своей родине. Тысячи и десятки тысяч советских патриоток само- отверженно работают у станков и машин, управляют комбайнами тракторами, во- дят поезда и автомашины, заменяя своих отцов, сыновей, мужей и братьев, ушед- ших на фронт защищать свою отчизну, свои города и села, свои семьи и очаги. Тысячи женщин беззаветно помогают Красной Армии -- работают медицинскими сестрами в полевых госпиталях, выносят c поля боя наших раненых бойцов командиров, отдают свою кровь для спа- сения жизни воинов нашей славной Крас- ной Армии. Женщины Советского Союза! Еще само- отверженные, еще беззаветнее выполняйте вапи долг перед родиной! Где бы вы ни находились - на поле боя или у станка. за рулем трактора или на боевой вахте возле своего дома, --- помните: вы защи- щаете свою жизнь, свою свободу, честь, вы защищаете своих детей! женщины советских городов сел, временно захваченных фашистскими вар- варамн! Месть, беспощадная, священная несть вот к чему зовет вас память замученных ваших сестер и детей! He щадя сил и самой жизни, помогайте ва- шим отцам, мужьям, сыновьям и братьям, ушедшим в партизанские отряды, воду- пiевляйте их на борьбу с немецко-фашист- ским зверьем. к ван, женщины порабощенных Гит- дером стран, обращаемся мы! Дорогие наши сестры женщины Чехии, Польши, Франции, Сербии, Греции! Будьте достой- ны ваших свободолюбивых народов. Всем, чем только можете, вредите вашим пора- ботителям и насильникам, делайте их су- ществование невыносимым --- уничтожайте	vol-4967-page-03-seg-004-0294-0776-0980-3691.png
4967	3	284	3701	950	5312	238	0.95027	Мы шлем горячий привет вам, женщины Великобритании, достойные дочери вели- кого английского народа! Мы вами сегодня в одном строю. Так будем же стойки в этой священной борьбе, не бу- дем знать ни минуты, ни секунды покоя отдыха, пока проклятый коричневый зверь не палет бездыханным к ногам на- шей Красной Армии и доблестной армии Великобритании. Женщины Соединенных Штатов Аме- рики! Делайте все, что от вас зависит, чтобы ваша помощь бойцам против фаши- стских банд росла, ширилась каждым днем, ибо на полях восточного фронта ре- шается судьба не только нашей страны, но и всех свободолюбивых народов мира, решается судьба всего человечества, суть- ба мировой культуры и прогресса. На долю нашего народа выпала пстори- ческая миссия нанести решающий удар немецко-фашистским варварам. С нами все передовое, мыслящее человечество. С нами все прогрессивное и честное, что есть на нашей планете. Красная Армия наносит сокрушительные удары гитлеровскому зверью - поля сражений покрыты трупа- ми бешеных фашистских псов. Враг исте- кает кровью, напрягает последние силы, но он еще силен, дьявольски коварен и яростен. Добьем зверя! Наши силы растут я множатся с каждым днем, силы врага тают и истощаются, победа будет за нами! именем Сталина, пол его водитель- ством мы смело идем в бой. (Бурная ова- ция). Мы победим любые трудности и испытания. Мы уничтожим гнусную корич- невую гадину и вернем миру счастье мир- ного труда, право свободно дышать, тво- рить, созидать, двигать вперед науку, технику, искусство! Наше лето правое! будет разбит, победа будет за нами!	vol-4967-page-03-seg-005-0284-3701-0950-5312.png
4967	3	280	5374	944	6307	125	0.94637	На трибуне Зинаида Троицкая зна- to менитый советский машинист, депутат Верховного Совета СССР, начальник Мос- ковско-Окружной железной дороги. Дорогие сестры! начинает она свою речь. --- К вам обращаюсь я, как член многотысячного коллектива железно- дорожниц Советского Союза, которые само- отверженным, героическим трудом помога- ют нашим доблестным, славным воинам ко- вать победу над врагом. Скорее доставить на фронт танки, машины, орудия, боепри- пасы, чтобы беспощадно обрушить их на голову фашистских кровавых чудовищ, вот одна мысль, одно стремление, кото- рые руководят нами. Женщины-железнодорожницы, жены, на- тери, сестры железнодорожников! Все, как одна, поднимайтесь на борьбу против фа- шизма. Героическая Красная Армия развея- ла в прах миф о "непобедимости" гитле- ровских орд. Она наносит им сокрушитель- ные, изнуряющие удары. Силы совётского народа, его отпор фашистским полчищам растут и крепнут.	vol-4967-page-03-seg-006-0280-5374-0944-6307.png
4967	3	1367	708	3318	754	11	0.94950	НА МИТИНГЕ В КОЛОННОМ ЗАЛЕ ДОМА СОЮЗОВ 7 СЕНТЯБРЯ 1941 ГОДА	vol-4967-page-03-seg-007-1367-0708-3318-0754.png
4967	3	998	780	1659	1251	66	0.96297	женщины-железнодорожницы великих демократических государств Англии и Аме- рики! Множьте помощь армиям, борющим- ся против фашизма. Пусть быстрее ветра мчатся поезда с боеприпасами, со всем тем, что необходимо для победы над врагом. женщины всего мира! Развертывайте повсеместно широкую агитацию за солидар- ность и действенную помощь Советскому Союзу, стоящему на передовых позициях гигантского антигитлеровского фронта. В бой, друзья, подруги и сестры! За на- ше правое, великое, общее дело!	vol-4967-page-03-seg-008-0998-0780-1659-1251.png
4967	3	988	1321	1651	2404	182	0.95387	Слово предоставляется народной артист ке СССР Валерии Барсовой. вам, - говорит она, матерям, женам, дочерям тех, кто сейчас не на жизнь, а на смерть сражается с презрен- ными гитлеровцами, я обращаю свое слово! Фашизм, как смерч, несется над миром, угрожая разрушением, гибелью свободолю- бивым народам. Враг задался целью разру- шить нашу жизнь, наш мирный труд и культуру, отнять нашу свободу. Он захо- тел, чтобы для него зеленели всходы на- ших полей, чтобы для него работали наши фабрики и заводы. Не бывать этому! B В нашей Советской стране искусство достигло такого расцвета, который и во сне не снился старой России. Родина наша, как мать, бережет таланты, растит их, ле- леет. Мы, люди искусства, знаем, как на- ше государство и наш народ высоко ценит театр, литературу, живопись, музыку. Потерять драгоценное право на свобод- ное творчество! Ни за что! Не бывать это- му! - певица, я хочу петь своему род- ному народу. И я буду петь ему! А если будет нужно, я пойду защищать свой на- род так, как защищают его бойцы нашей Красной Армии. Нам, людям искусства, есть что защищать от дикой фашистской орды!	vol-4967-page-03-seg-009-0988-1321-1651-2404.png
4967	3	982	2408	1639	2802	65	0.94708	Я обращаюсь к вам, женщины-работни- ки искусства, с горячим призывом отдать все свои творческие силы на борьбу с фа- шизмом. Пламенным словом, песней вооду шевляйте сердца людей, борющихся с за- клятым врагом человечества и культуры! Женщины всего мира! Всеми средствами нашего труда на заводе, в поле, на сцене, в лаборатории, на самолете, в гос- питале, с винтовкой на поле боя --- помо- жем нашим братьям-бойцам!	vol-4967-page-03-seg-010-0982-2408-1639-2802.png
