volume_number	page_number	x1	y1	x2	y2	tokens_count	mean_confidence	text	image
5823	2	2239	5144	2899	6102	137	0.95532	«Так как противник, говорится в директиве. в период распутицы не сможет совершать крупных операций ограничится лишь форсированием рекл с целью закрепления на западном берегу. то необходимо учитывать применение тап- ковых и моторизованных соединений задачей своевременного укрепления угро- жаемых участков или с целью обеспече- ния, а в исключительных случаях и сме- ны гренадерских полков... В период распутицы расположение ре- зервов. в зависимости от создавшейся об- становки, должно быть иным (ближе к линии фронта и местам предполагаемого форсирования реки противником), чем во время сухой Погоды и заморозков». Как известно. Красная Армия и на этот раз опрокинула расчеты немецкого коман- дования и нанесла решительный удар как раз в го время года, когда его день- ше всего ожидал противник. Вебезьянтересей взгляд помещкого коман- дования на вопросы внезапности при не- реходе от обороны к наступлению. По- скольку требуется в таких случаях со-	vol-5823-page-02-seg-056-2239-5144-2899-6102.png
5823	2	2922	4147	3580	4436	36	0.95420	средоточивать крупные силы, подводя их из глубоких тылов, немецкое командова- ние считает, что достижение оперативной внезапности при вводе в дело танковых и механизированных резервов мало вероят- но. Это положение подтверждается следу- ющим указанием немецкого верховного командования.	vol-5823-page-02-seg-057-2922-4147-3580-4436.png
5823	2	2920	4451	3576	4774	43	0.95550	«Подход танковых дивизий из глуби- ны, как правило, не может быть скрыт от разведки противника. Оперативная вне- запность, если таковая вообще возможна может иметь место только при значитель- ном количестве сил. Поэтому задачей выс- шего командования является создание предпосылок для обеспечения тактической внезапности"	vol-5823-page-02-seg-058-2920-4451-3576-4774.png
5823	2	2918	4790	3576	5228	54	0.95453	Предпосылками же тактической внезап- пости немцы считают: удержание во что бы то ни стало местности, имеютей так- тическое значение для предполагаемого контрнаступления. невзирая на угрозу прорыва фронта; планомерный отход целью достижения выгодного рубежа, не- обходимого для организации контрнаступ- ления. В ходе контрнаступления немцы стремятся наносить своими танковыми ли- визиями не фронтальные, a фланговые удары.	vol-5823-page-02-seg-059-2918-4790-3576-5228.png
5823	2	2920	5232	3574	5719	59	0.95526	случае, если наше наступление осуществляется превосходящими силами контрнаступление немцев прекращается и они организуют оборону. Продолжать контрнаступление не мелкие верховное ко- мандование разрешает только в том слу- чае. когда захлебнется наступление наших войск в достигнуто значительное превос- Ходство в силах. Категорически запре- щается бросать в контрнаступление опе- ративные резервы (особенно танковые ди- визни) с хода, без предварительной все- сторонней подготовки.	vol-5823-page-02-seg-060-2920-5232-3574-5719.png
5823	2	2918	5732	3576	6102	52	0.94290	Массированное применение танковых соединений оперативного резерва немцев имело место при их попытке контрна- ступления на Житомирском направлении в ноябре прошлого гола и в текущем га- ду на Корсунь-Шевченковском, где враг пытался освободить свою окруженную группировку юго-восточнее Станислава, а совсем недавно в районе севернее и запад- нее Ассы, В каждой из перечисленных опе-	vol-5823-page-02-seg-061-2918-5732-3576-6102.png
5823	2	3597	4151	4262	5599	202	0.95471	раций в немецком контрнаступлении уча- ствовало в среднем от 3 до 6 танковых и до 7 пехотных дивизий. Их действия обеспечивались авиацией, производившей 1500 самолетовылетов в день. Кроме того враг применил большое количество артиллерийских и минометных частей РГК. На Станиславском направлении действия ударной группировки врага подтержива- лись артиллерийской дивизией. Как из- вестно, немцы ни в одном из этих контр- наступлений успеха не добились. Встретив упорно-э сопротивление наших войск и понеся огромные потери в живой силе технике, враг был вынужден прекращать начатые операции, не доводя их до конца. Следует отметить некоторые характер- ные особенности немецкой тактики в пе- риол контрнаступления с частными пе- лями. Прежде всего противник перед на- чалом активных действий ведет одновре- менно на всем фронте помеченного про- рыва разведку боем. Наземные войска поддерживаются авиацией. которая дей- ствует группами до 120 самолетов в каж- лой, четолически обрабатывая боевые по- рядки обороняющихся войск, особенно огневые позиции артиллерии. Артиллерия и шестиствольные минометы применяются массированно. Пехота действует осторож- но, только после сильной авиационной и артиллерийской подготовки, при непосред- ственной поддержке большого количества танков. Обращает на себя внимание так- же быстрота перегруппировок. которые враг организует с целью отвлечения на- ших спл с направления главного удара. На конец. отмечалась повышенная актив- ность немцев в ночное время.	vol-5823-page-02-seg-062-3597-4151-4262-5599.png
5823	2	3597	5605	4261	6011	58	0.95562	Усилить тактические резервы в ливи- знях первой линии и создать оперативные резервы - вот задача, которую пытается разрешить немецкое командование после того, как вражеская армия понесла огром- ные потери в итоге сокрушительных ула- ров наших войск. Недостаток людских ре- сурсов и вооружения, обеталовка, сложив- шаяся теперь на советско-германском фронте и Западе, делают эту задачу труд- неразрешимой для немцев,	vol-5823-page-02-seg-063-3597-5605-4261-6011.png
5823	2	3780	6021	4216	6102	6	0.89204	Полковник Н. ЛОЩАГИН Полковник А. мельничук	vol-5823-page-02-seg-064-3780-6021-4216-6102.png
5823	3	238	265	890	298	8	0.91778	17 июня 1944 г., суббота, № 143 (5323)	vol-5823-page-03-seg-001-0238-0265-0890-0298.png
5823	3	226	380	2143	523	3	0.98810	На Карельском перешейке	vol-5823-page-03-seg-003-0226-0380-2143-0523.png
5823	3	475	538	1896	575	5	0.88081	От специальных корреспондентов «Красной звезды»)	vol-5823-page-03-seg-004-0475-0538-1896-0575.png
5823	3	457	646	1914	734	3	0.91605	Через водную преграду	vol-5823-page-03-seg-005-0457-0646-1914-0734.png
5823	3	167	763	831	2427	267	0.95457	С восходом солнца туман, окутывавший всю приморскую полосу, постепенно рас- сеялся. Теперь уже невооруженным глазом можно было различить очертания западного берега реки, крутого и обрывистого. Самой реки не было видно из долговременных финских укрытий, в которых теперь разме- стились наши бойцы. По мы знали по рассказам разведчиков, что воды этой ре- ки капризны, она быстротечна, достигает в глубину двух метров и довольно широка. Батальон капитана Шестакова пер- вым форсирсзал реку. Его бойцам пришлось связать десятки плотов и Вооружиться длинными шестами, которые служили вес- лами и средством борьбы против течения. Одни бойцы, упираясь шестами в дно ре- и, толкали плоты вперед, а другие, по ставив шесты отвесно, не давали пилотам идти вниз по течению. Артиллеристы пол- ка, обеспечивавшие переправу своим ог- нем, выкатили орудия на открытые позп- ции и били по амбразурам финских до- тов и дзотов с дистанции 100--150 мет- ров. По фронту соединения было установ- лено для прямой наводки более ста ору- дый. Их огонь был наиболее точным, са- мым неприятным для врага. Финны попы- тались массированным минометным огнем воздействовать на наши орудия прямой наводки. Но неприятель дал всего один два залпа, и ему пришлось замолчать са- мому. Наши контрмипометные батареи сде- лали свое дело. Батальон Шестакова, уцепившись за за- :: падный берег реки, шаг за шагом проби- вался вперед, отвоевывал плацдарм. Актив- не действуя ночью, батальон настолько рас- " шерил этот плацдарм, что стало возможно сосредоточить здесь довольно крупные си- лы. Рано утром под покровом тумана сю- да направились по только что наведенному мосту тяжелые танки. Впереди шел танк Героя Советского Союза старшего лейте- напта Ткаченко. Сосредоточившись, танки вместе с пехотой ринулись в атаку. Кава-	vol-5823-page-03-seg-006-0167-0763-0831-2427.png
5823	3	852	763	1513	1340	91	0.95413	лерийская бригада финнов, оборонявшая этот участок в пешем строю, была смята Тогда в ворота прорыва были брошены свежие силы. Советские танки и пехота словно ножом, разрезали финскую оборону, возведенную на западном берегу реки. Танки продвинулись вперед на 3--4 кило- метра, а затем изменили направление, по- вернув фронт на 90°. Следовавшая за ними пехота сделала то же самое. Для финнов, оборонявших берег реки возле устья, создалась угроза быть отрезанными и прижатыми к морскому заливу. Тут же перешли в атаку наши части, расположен- ные у залива, и враг стал поспешно от- : ступать.	vol-5823-page-03-seg-007-0852-0763-1513-1340.png
5823	3	850	1342	1510	2204	134	0.95554	Вот и река. Мы пытаемся перейти па противоположный берег, пользуясь своеоб- разной переправой: доски и не слишком толстые бревна положены с камня на ка- нень. Перейти по ним не так-то легко. Чтобы удержать равновесие, приходится. подобно канатоходцу, выбрасывать руки в стороны. Поднявшись на крутой западный берег, мы сразу попадаем в финскую тран- шею. Она довольно глубока и широка: два человека могут пройти рядом, не пригиба- ясь. Через каждые пять метров отрыты ячейки для стрелков, Вот траншея резко поворачивает влево и переходит в закры- тый ход сообщения. Он приводит нас просторное бетонированное укрытие для солдат. Здесь финны спасались от артил- лерийских обстрелов и авиационных бом- бежек. Укрытие довольно прочное, оно мо- жет выдержать даже прямое попадание крупнокалиберного снаряда. Тускло горит фонарь «Летучая мышь». При свете его рассматриваем пожитки финских солдат, оставленные ими при поспешном бегстве.	vol-5823-page-03-seg-008-0850-1342-1510-2204.png
5823	3	848	2214	1510	2427	35	0.95128	Дальше траншея ведет нас к бетониро- ванной огневой точке, которая разрушена артиллерийским огнем. Мы прошли вдоль гран шен полтора километра, не поднимаясь на поверхность земли, и насчитали девять таких огневых точек и три укрытия для	vol-5823-page-03-seg-009-0848-2214-1510-2427.png
5823	3	1538	763	2194	869	14	0.93533	пехоты. По пути попадались трупы фин- ских солдат, брошенные пулеметы и дру гое оружие.	vol-5823-page-03-seg-010-1538-0763-2194-0869.png
5823	3	1535	871	2194	1450	91	0.95538	Выходим на шоссе. Здесь снова трупы финнов, лежащие в различных поза больше всего спиной к фронту. Во время бегства их накрыла огнем наша артилле- рия или же уложили автоматчики. У од- ного убитого солдата в руках мина. Это вилино, сапер, которому было приказан заминировать Шоссе. Пуля советского стрелка настигла его за этой работой. По обочине шоссе бегут связисты с ка- гушками за плечами. Они торопливо тянут линию. В лесу, в бывших финских дотах, уже организуется командный пункт диви- зии. Вскоре сюда подъезжает высокий ге- пенал с густыми седыми бровями. Связь есть?	vol-5823-page-03-seg-011-1535-0871-2194-1450.png
5823	3	1529	1463	2193	2289	128	0.94668	- Так точно, товарищ генерал, до- кладывает юркий командир роты связи. Генерал вызывает командира высшего соединения и докладывает: Переправа готова, пропускает ар- тиллерию. Недалеко от нее найден брод. Са перы проложили к нему колонный путь. Через два часа будет готов мост у шоссе Лященко всеми силами переходит реку... Преследуем всеми силами. Вечером, когда мы возвращались об- ратно, наступающие войска далеко оста- вили позади реку, о которой шла речь. Мост у тоссе уже был готов, и здесь сто- ял регулировщик. Непрерывным потоком три автомашины, артиллерия на механи- ческой тяге. Мощные тягачи тащили тя- желые орудия. У большой сосны на пово- роте дороги красноармеец сбивал финский указатель, на котором стрелой была отме- чена дорога на Ленинград. Сбросив фин- скую дощечку в канаву, боеп повесил на сосну свой указатель «На Выборг».	vol-5823-page-03-seg-012-1529-1463-2193-2289.png
5823	3	1869	2312	2146	2346	3	0.94587	Майор И. ГАГЛОВ	vol-5823-page-03-seg-013-1869-2312-2146-2346.png
5823	3	1535	2362	2185	2427	6	0.92273	КАРЕЛЬСКИЙ ПЕРЕШЕЕК, 16 июня (По телефону).	vol-5823-page-03-seg-014-1535-2362-2185-2427.png
5823	3	452	2483	1904	2568	2	0.91275	станция звукоразведки	vol-5823-page-03-seg-015-0452-2483-1904-2568.png
5823	3	169	2593	831	2875	36	0.93986	В лесу под мохнатыми лапами елей стоят два грузовика. Узкий проход между ними затянут сверху брезентом. В этой импровизированной палатке помещается центральная станция разведывательной батареи, обслуживающей N артиллерий- ский полк, который ведет контрбатарейную борьбу с финнами.	vol-5823-page-03-seg-016-0169-2593-0831-2875.png
5823	3	165	2879	829	3547	99	0.95454	Брезент палатки поминутно вздраги- вает и перегибается от близких пушеч- ных выстрелов. Сегодня наша артиллерия работает почти такой же интенсив- ностью, как в первый день наступления. Она разрушает железобетонные Финские укрепления. Неприятель довольно актив- но отвечает. Слышны разрывы Финских снарядов и мин. Со стороны может пока- заться мало вероятным, чтобы разведчи- ки, даже вооруженные сложными при- борами, смогли уловить в этом хаотиче- ском нагромождение звуков, в этом бос- прерывном гуло и грохоте слабые вы- стрелы далеких финских батарей. По люди в палатке работают c мудрым, неторопливым спокойствием, в котором угадываются опыт, знание, уверенность в том, что дело идет хорошо.	vol-5823-page-03-seg-017-0165-2879-0829-3547.png
5823	3	163	3558	829	4293	98	0.95946	Где-то впереди, куда уходит темная паутина проводов, пританлись в буйной зелени лесистых пригорков звукоулавли- ватели. Это уши батареи, обладающие необычайно тонким слухом. А впереди них работает пост предупреждения старший сержант Жуган и с ним четыре разведчика. Всё внимание этих людей превращено в зрение и слух. Едва над темными склонами лесистых высот появится еле заметная струйка дыма послышится характерный звук приглу- шейного расстоянием орудийного выстре- ла, старший сержант нажимает кнопку прерывателя. Тогда палатка в еловом ле- су, удаленная от поста предупреждения на несколько километров, наполняется равномерным шумом моторчика и жужжа- прием камертона. На быстробегущей ленте появляются таинственные извилистые ли-	vol-5823-page-03-seg-018-0163-3558-0829-4293.png
5823	3	850	2593	1508	2874	42	0.95710	Человек, работающий на этом хитро- умном приборе записи звуков, обрывает ленту и передает ее на столик дешифров- щика. Поочередно длинный лоскуток про- ходит через несколько рук и вот уже таинственные изгибы и зигзаги за- писи превращены в точные цифры и конкретные понятия.	vol-5823-page-03-seg-019-0850-2593-1508-2874.png
5823	3	850	2887	1504	3031	15	0.92389	Командир взвода звуковой разведки тейтспант Буров берет телефонную трубку. Ялта, Ялта, вызывает офицер. Примите координаты...	vol-5823-page-03-seg-020-0850-2887-1504-3031.png
5823	3	848	3039	1506	3322	37	0.95532	В штаб полка передается одна скупая математическая фраза. Она говорит том, что в 14 часов разведывательная батарея обнаружила в такой-то точке двухорудийную батарею финнов 122-им. калибра, которая только что выпустила двадцать снарядов по нашим боевым по- рядкам.	vol-5823-page-03-seg-021-0848-3039-1506-3322.png
