volume_number	page_number	x1	y1	x2	y2	tokens_count	mean_confidence	text	image
5551	3	2318	5814	2977	6125	47	0.90717	"Достигнуть решительного результата против западных держав при отягчающих условиях позиционной войны было 1 803- можно лишь в том случае, если бы Рос- сия, как мощный фактор, былам устранена это значит разбить решительно русскую армию и получить полную свободу от уг- розы с тыла на Востоке. Прежний второ-	vol-5551-page-03-seg-076-2318-5814-2977-6125.png
5551	3	3007	4091	3681	5431	219	0.93340	степенный (по взглядам германского геп- штаба. -- М. Г.) театр военных действий должен был быть, следовательно, исполь- зуя преимущество ведения войны на внут ренней линии, -- сознательно и планомер- но превращен в главный театр путин всё большего увеличения сил». Однако Фаль- кенгайн в 1915 году прекрасно знал, что никаких дополнительных сил у него нет, а Западного фронта он снял всё, что мог. Проблема двух фронтов была неразрешима, и Фалькенгайн ошибся в обратную сторо- ну: он считал, что Россия, по крайней ме- ре, подорвана тяжелой борьбой 1915 г. Из этого заблуждения его вывел мощный брусиловский удар в 1916 году. Германия была надорвана и сражения- ми, которые ей пришлось вести одновре. менно на Западном фронте. Уже в 1916 году немецкая армия была обескровлена моральный дух ее был подорван. "Атолл- пы немецкой пехоты остались на полях сражений на Марсе и на Сомме", пишет один из немецких авторов, Верден останет- ся на все времена памятником доблести французского солдата, На Сомме (1916 г.) и во Фландрии (1917 г.) заплатила свою дань войне британская армия. Англий- ский солдат выказал здесь свою храб- рость и присущее ему упорство в бога. Эти особо характерные позиционные боп не давали решительных результатов, но они изматывали германскую армию. На- ступления союзников были проявлением активности в единственно возможной тог. форме и без них не было бы конечной по- беды над Германией.	vol-5551-page-03-seg-077-3007-4091-3681-5431.png
5551	3	2998	5442	3660	6129	107	0.92338	Германия истощалась в этой непоспль- ной для нее борьбе на двух фронтах, но она не сдавалась и, наоборот, искала но- вых путей выиграть войну. В 1915 16 гг. она овладела Балканами, что зна- чительно расширило ее сырьевые источ. ники, В 1916 г. она перестраивает сво10 промышленность на базе высоких требова: вий для поставок фронту по таб назы ваемой «программе Гинденбурга». Зажатая в тиски блокады, она пытается в свою очередь блокировать Британские острова. приступив с начала 1917 г. к неограничен- ной подводной войне; в течение несколь- ких месяцев ей удается поставить про. нынленность экономику Англии в тя желое положение. В конце 1917 года в- стро-немецкие войска наносят брупное	vol-5551-page-03-seg-078-2998-5442-3660-6129.png
5551	3	3692	4097	4360	4856	117	0.93749	поражение итальянской армии, которая бы- ла спасена от разгрома только быстрой помощью союзников. В то же время Гер- мания стремится использовать • временную военную слабость России, она навязывает советской республике грабительский мир и, тут же нарушая его, оккупирует часть ее территории, Этими хищническими захвата- ни Германия рассчитывала получить про- довольственные и сырьевые ресурсы для продолжения войны. В первой половине 1918 года ей удается создать численное превосходство на Западном фрон:те. Совет- ская Россия еще только формировала hpac- ную Армию, первые отряды которой спла- чивались и крепли в героической борьбе с немецкими насильниками; однако до кон- па войны немцы так не получили "свои* бады тыла с востока", о которой они ме. стали. Восток продолжал отвлекать круп- ные немецкие силы.	vol-5551-page-03-seg-079-3692-4097-4360-4856.png
5551	3	3683	4871	4353	5673	118	0.93081	В марте 1918 года германское насту- пенис в Раменском направлении создало самый опасный для союзников кризис вой- ны. Этот факт весьма показателен для опенки всего значения активного мочента в ходе первой мировой войны. Несомненно, уже истощенная и подорванная Германии имела шансы в год момент вырвать пайе- ду, пользуясь пассивностью обороны со- юзников и отсутствием единого командова- ния на Западном фронте. Но когда ан- глийские армии, отворачивая свой правый фланг, уже начали отход к портам, французы отходили к югу, прикрывая Париж, и таким образом район Амьена, связывающий обе армии, оставался непри- брытым, - в этот час величайшей опас- ности дух союзной солидарности преодолел все мелочные предубеждения. В течение нескольких минут на поле сражения была достигнута договоренность об едином командовании.	vol-5551-page-03-seg-080-3683-4871-4353-5673.png
5551	3	3679	5681	4343	6074	51	0.91017	В первой мировой войне победа над Германией была одержана благодаря тяж- ким жертвам, смелой активности и упор- ной борьбе союзных армий. Боевая солн- давность на полях сражений против Гер- мании --- залог конечного сокрушения ее. Таков важнейший урок, который свободо- любивые народы делают истории четы- рехлетней кровопролитной войны 1914 1918 гг.	vol-5551-page-03-seg-081-3679-5681-4343-6074.png
5551	3	4011	6089	4298	6127	2	0.91421	M. ГАЛАКТИОНОВСКАЯ	vol-5551-page-03-seg-082-4011-6089-4298-6127.png
5551	4	3497	244	4313	278	6	0.90975	августа 1943 г., воскресенье, 180 (5551)	vol-5551-page-04-seg-003-3497-0244-4313-0278.png
5551	4	514	358	1373	436	4	0.90695	По Положение в Италии	vol-5551-page-04-seg-004-0514-0358-1373-0436.png
5551	4	366	464	1537	601	17	0.92677	Массовые антифашистские демонстрации в итальянских городах. * Забастовка железнодорожников в Северной Италии. Декла- рация пяти политических партий	vol-5551-page-04-seg-005-0366-0464-1537-0601.png
5551	4	269	622	929	1383	95	0.96040	лондон, 31 июля. (TACC). Лондон- ское радио сообщает, что во всех круп ных итальянских городах продолжаются массовые антифашистские демонстрации, несмотря на приказ маршала Бадольо о за- прещении собираться группами более чем в 3 человека. Стачечное движение прини- мает широкий размах. В Северной Италии вспыхнула забастовка железнодорожников. ЖЕНЕВА, 31 июля. (ТАСС): По посту- пившим сюда сведениям, втальянские вла- сти, пытаясь вернуть на работу бастующих рабочих, объявляют милитаризованными це- лые отрасли промышленности. Как сооб- щает римское радио, правительство Ба- дольо издало постановление о том, что все железнодорожники и работники теле- графа, телефона и почт считаются мобили- зованными.	vol-5551-page-04-seg-006-0269-0622-0929-1383.png
5551	4	273	1392	929	1548	19	0.95708	Римский корреспондент швейцарской га- зеты «Нейе цюрхер цайтунг" сообщает что толпы демонстрантов уничтожают по- всюду портреты и бюсты Муссолини.	vol-5551-page-04-seg-007-0273-1392-0929-1548.png
5551	4	271	1557	931	2036	60	0.96195	31 июля. (ТАСС). Бернский корреспондент агентства Ассошиэйтед Пресс сообщает, что в Милане прололжа- ются многотысячные антифашистские де- монстрации. По приказанию властей во многих частях города установлены пуле- меты, однако войска, высланные против демонстрантов, отказались стрелять в них В связи с этим, по имеющимся сведениям, маршал Бадольо отстранил от должности командующего войсками миланского воен- ного округа генерала Канале и назначил на	vol-5551-page-04-seg-008-0271-1557-0931-2036.png
5551	4	952	626	1616	1542	112	0.95156	его место командира альпийской дивизии генерала Руджери. НьЮ-ЙОРК, 31 июля. (ТАСС). По со- общению бернского корреспондента агент- ства Ассошиэйтед Пресс, представители пяти итальянских политических партий опубликовали в некоторых туринских га- зетах новую декларацию. Эта декларация содержит требование о том, чтобы прави- тельство Бадольо прекратило войну «наметило пути социальной и политической реконструкция" Декларация требует также немедленного освобождения из тюрем по- литических заключенных. ЛОНДОН, 31 июля. (ТАСС). Как пере- дает агентство Рейтер, власти Бадольо приказали закрыть новую римскую газету - «Иль мондо». Эта газета начала выходить 26 июля в своей прежней типографии, ко- торую в 1922 году захватили фашисты Запрещен также выход нового журнала под названием «25 июля» (дата падения Муссолини) и газеты "Рискосса".	vol-5551-page-04-seg-009-0952-0626-1616-1542.png
5551	4	956	1559	1614	1793	29	0.94836	ЛОНДОН, 31 июля. (ТАСС). Корреспон- дент агентства Рейтер передает с итало- швейцарской границы о том, что ближе Комо арестован при попытке к бегству бывший секретарь фашистской партии Фа- риначчи.	vol-5551-page-04-seg-010-0956-1559-1614-1793.png
5551	4	954	1802	1614	2032	29	0.95786	лондон, 31 июля. (ТАСС). По сооб- щению агентства Рейтер, большое число рабочих предприятий Милана до сих пор отказывается возвращаться на работу. Га- зета "Пополо д'италия" окончательно пе- рестала выходить.	vol-5551-page-04-seg-011-0954-1802-1614-2032.png
5551	4	406	2115	1482	2174	5	0.97789	Военные действия на острове Сицилия	vol-5551-page-04-seg-012-0406-2115-1482-2174.png
5551	4	271	2191	931	2455	39	0.96268	ЛОНДОН, 31 июля. (ТАСС). Специаль- ный корреспондент агентства Рейтер в Се- верной Африке сообщает, что американ- ские войска на Сицилии вошли в сопри- косновение войсками противника на основной линии вражеской обороны в районе Сан-Стефано, на северном побе- режье Сицилии.	vol-5551-page-04-seg-013-0271-2191-0931-2455.png
5551	4	273	2465	929	2592	20	0.97382	Части 8-и армии, встретив упорное со- противление противника, в настоящее вре мя продолжают разведывать сильно укре пленные позиции войск противника.	vol-5551-page-04-seg-014-0273-2465-0929-2592.png
5551	4	271	2601	931	2895	47	0.95949	ЛОНДОН, 31 июля. (ТАСС) Агентство Рейтер, ссылаясь на марокканское радио, сообщает, что американские войска заняли на острове Сицилия населенный пункт Сперлинга в 5 милях к северо-западу от Никозни. Полагают, что продвижение аме- риканцев несколько замедлилось в связи с тем, что противник при своем отступле- нии уничтожает дороги.	vol-5551-page-04-seg-015-0271-2601-0931-2895.png
5551	4	275	2901	931	2967	13	0.93108	ЛОНДОН, 31 июля. (ТАСС). Штаб со- юзных сил в Северной Африке сообщил о	vol-5551-page-04-seg-016-0275-2901-0931-2967.png
5551	4	958	2195	1616	2324	17	0.96128	безусловной капитуляции гарнизонов трех итальянских островов: Фавиньяна, Леванцо и Мареттимо (группа Эгадских островов у западного побережья Сицилии).	vol-5551-page-04-seg-017-0958-2195-1616-2324.png
5551	4	954	2330	1616	2958	92	0.96359	НьЮ-ЙОРК, 31 июля. (ТАСС). По со- общению вашингтонского корреспондента агентства Ассошиэйтед Пресс, морское ми- нистерство США объявило, что в операциях по вторжению на Сицилию принимало участие 2.500 судов, из них 1.500 амери- канских, управляемых 40 тыс. офицеров и моряков. Месяцы интенсивной тренировки Соединенных Штатах и в Северной Афф Африке предшествовали вторжению на Сп- целью, причем тренировка продолжалась до последнего момента, В заявлении мини- стерства указывается, что успех вторже- ная в значительной мере явился резуль- татом, успешного использования специаль- ного оборудования для высадки, которое предназначено для «прорыва береговых укреплений европейской крепости держав оси».	vol-5551-page-04-seg-018-0954-2330-1616-2958.png
5551	4	409	3059	1489	3104	5	0.91289	УДАРЫ ПО ВОЕННЫМ ОБЪЕКТАМ ИТАЛИИ	vol-5551-page-04-seg-019-0409-3059-1489-3104.png
5551	4	265	3119	931	3776	105	0.96444	ЛОНДОН, 31 июля. (ТАСС). По сооб- щению штаба союзных войск в Северной Африке, в ночь на 29 июля бомбардиров- щики союзников атаковали аэродромы в Монте Корвино Равелла и Каподикино (в районе Неаполя). 29 29 июля днем также продолжались налеты на итальянские аэро- дромы. Тяжелые бомбардировщики совер- шили налет на аэродром Витербо (к северу от Рима), а средние бомбардировщики на аэродром Акино. В районе цели было сброшено большое количество бомб, Лег- кие бомбардировщики союзников совершали налеты на вражеские позиции на острове Сицилия и атаковали порт Милаши) Истребители-бомбардировщики атаковала коммуникации Сицилии, а также суда в Мессине и Рипосто. Кроме того, авиация союзников совершала налеты на остров Сардиния.	vol-5551-page-04-seg-020-0265-3119-0931-3776.png
5551	4	267	3783	924	4064	43	0.96330	Самолеты-торпедоносцы, атаковав в Тир- ренском море суда противника, потопили одно торговое судно и подожгли два воен- ных корабля. Во время дневных операций был сбит один вражеский самолет. Авиа- ция союзников потеряла 4 самолета. ЛОНДОН, 31 июля. (ТАСС). Как пере- цвет специальный корреспондент агентства	vol-5551-page-04-seg-021-0267-3783-0924-4064.png
5551	4	946	3119	1613	4060	154	0.96276	Рейтер из Алжира, в налете на аэродром Витербо участвовали самолеты «Летающая крепость» Истребительная авиация про- тивника не оказала никакого сопротивле- ния, а огонь вражеской зенитной артилле- рии был весьма слабым. Самолеты «Ле- тающая крепость" сбросили бомбы в центр аэродрома и на взлетно-посадочные дорож- ки. Произошел взрыв и возникло несколь- ко пожаров, которые были видны на рас- стоянии 80 километров. ЛОНДОН, 31 июля. (ТАСС). Штаб воз- душных сил союзников в Северной Африке сообщает, что вчера бомбардировщики со- юзников совершили налет на итальянский аэродром в Гроталье. Отмечены прямые попадания в аэродромные сооружения. Воз- никле пожары. Самолеты союзников со- вершили налет на порт Милаццо и суда противника, находившиеся в порту. Поти- плено торговое судно противника. Легкие бомбардировщики атаковали позиции про- тивника восточной части Сицилии. 40 истребителей союзников вели боевые действия в южной части Сардинии. В ре- зультате воздушного боя с истребителями противника был сбит 21 вражеский само- лет. Из всех этих операций не вернулся один самолет союзников,	vol-5551-page-04-seg-022-0946-3119-1613-4060.png
5551	4	1692	356	2239	463	3	0.96888	ДЕЙСТВИЯ АВИАЦИИ союзников	vol-5551-page-04-seg-023-1692-0356-2239-0463.png
5551	4	1643	480	2301	806	52	0.96059	лондон, 31 июля. (ТАСС). Как -пере- дает агентство Рейтер, в Лондоне офици- ально обявлено, что объектом налета авиации союзников в ночь на 31 июля был Ремшейд. Город Ремшейд расположен в южной части Рура и является центром германской станкостроительной промышлен- ности. В районе объекта была ясная види- мость, и бомбардировка была чрезвычайно концентрированной.	vol-5551-page-04-seg-024-1643-0480-2301-0806.png
5551	4	1643	825	2299	982	22	0.97315	Самолеты «Москито» и истребители «Бофайтер» во время патрульных операций атаковали вражеские аэродромы и "желез- нодорожные объекты во Франции и в Гол- ландии.	vol-5551-page-04-seg-025-1643-0825-2299-0982.png
5551	4	1645	1003	2299	1100	14	0.95700	Из всех этих операции на свои базы не вернулись 15 бомбардировщиков и два истребителя.	vol-5551-page-04-seg-026-1645-1003-2299-1100.png
5551	4	1643	1113	2301	1339	37	0.95905	ЛОНДОН, 31 июля. (ТАСС). Англий- ское министерство авиации и штаб коман дования американскими вооруженными си- лами на европейском театре операций со- общают, что 30 июля тяжелые американ- ские бомбардировщики совершили налет на авиационный завод «Физелер» в Касселе.	vol-5551-page-04-seg-027-1643-1113-2301-1339.png
5551	4	1643	1358	2301	1548	34	0.97188	В ночь на 30 июля во время налета на Гамбург, длившегося 45 минут, английские бомбардировщики сбрасывали на город свыше 50 тонн бомб в минуту. Всего было сброшено бомб общим весом свыше 2 тыс. тонн.	vol-5551-page-04-seg-028-1643-1358-2301-1548.png
5551	4	1641	1571	2298	1694	18	0.95292	30 июля английские и американские бом- бардировщики под прикрытием истребите- лей атаковали аэродромы в Голландии и в Бельгии.	vol-5551-page-04-seg-029-1641-1571-2298-1694.png
5551	4	1641	1713	2298	1907	34	0.95653	ЛОНДОН, 31 июля. (ТАСС). Авиацион- ный обозреватель агентства Рейтер сооб щает, что в ночь на 30 июля на Гамбург было сброшено 2.300 тонн бомб. В промы- шленных районах и доках не прекраща- ются пожары.	vol-5551-page-04-seg-030-1641-1713-2298-1907.png
