volume_number	page_number	x1	y1	x2	y2	tokens_count	mean_confidence	text	image
5732	2	904	596	1552	1313	110	0.95411	первоочередные расходы были снижены на 1.349.636 тыс. рублей, и эта сумма вне- сена в союзный бюджет. Государственный бюджет на 1942 год был составлен уже как бюджет военного времени. Следует отметить, что, несмотря на временный за хват гитлеровцами ряда экономически мощных районов, доходная часть бюдже- та в 1942 году была выполнена с пре- вышением против плана почти на 270 млн. рублей. Государственный бюджет РСФСР на 1943 г., по предварительным данным, выполнен с превышением по до- ходной части на 2,3 проп. Докладчик осо- бо отмечает, что за годы войны укрепи- лась доходная база бюджета. Это достиг- нуто, прежде всего, за счет улучшения работы хозяйственных организаций роста производительности труда и увели- чения накоплений.	vol-5732-page-02-seg-022-0904-0596-1552-1313.png
5732	2	909	1333	1548	1437	13	0.93301	Далее тов. Посконов переходит к изло жению Государственного бюджета РСФСР на 1944 г.	vol-5732-page-02-seg-023-0909-1333-1548-1437.png
5732	2	907	1456	1552	1740	42	0.94672	Доходная часть бюджета, говорит он, определена Советом Народных Ко- миссаров в сумме 24.588 млн. рублей на 2.771 илн. больше, чем в прошлом году. При этом собственные и закреплен- ные доходы увеличиваются на 31,4 проц., отчисления от общесоюзных доходов снижаются на 4,4 проп.	vol-5732-page-02-seg-024-0907-1456-1552-1740.png
5732	2	907	1758	1556	2622	119	0.95698	Значительное место в доходах Государ- ственного бюджета занимают отчисления от прибылей промышленности, которая сейчас но только обеспечивает беспере- бойное выполнение всех военных заказов, по и значительно расширяет выпуск това- ров широкого потребления. Только по предприятиям Наркоматов пищевой, мясо- молочной и местной промышленности за прошлый год получено прибылей на 300 млн. рублей больше, чем намечалось по плану. Среди других примеров докладчик указывает московскую кондитерскую фаб- рику им. Бабаева. Благодаря переходу на поточное производство, широкому внедре- нию малой механизации и осуществлению рационализаторских предложений произво- дительность труда на этой фабрике вы- росла на 12,8 проц. производственная программа превышена на 20,3 проц., се- бестоимость значительно ниже, чем пре- лусмотрено планом. Всё это позволило фаб- рике дать в бюджет 2.765 тыс. рублей дополнительных накоплений.	vol-5732-page-02-seg-025-0907-1758-1556-2622.png
5732	2	906	2639	1556	3930	173	0.95763	Докладчик отмечает, что республикан- ская промышленность обладает огромными источниками для дополнительного выпуска продукции и роста накоплений. Одним из таких источников является экономное ис- пользование сырья и материалов. На ряде конкретных примеров тов. Посконов по- казывает, к чему приводит нарушение :: технологического процесса и плохой кон- троль за использованием сырья. Так, шерстяная фабрика «Красный Октябрь» Наркомтекстильпрома РСФСР за 11 меся- цев перерасходовала 143 тонны шерсти и понесла более полутора миллиона рублей убытка. Или взять такой источник, как ликвидация запасов излишних и пенсполь- зуемых материальных ценностей. Стои- мость их по республиканской промышлен- ности определяется, по самым скромным подсчетам, в 341 млн. рублей. Такие излишки приводят к омертвлению огром- пых средств и лишают страну до- сличительной продукции, а Государст- венный бюджет --- значительной сум- мы накоплений. Огромными возможно- стями в смысле мобилизации внутрен- них ресурсов увеличения накоп- теней располагает районная промышлен- ность и промысловая кооперация. Мест- ные советские органы должны уделить больше внимания производству товаров ап про кого потребления и продовольствия из местного сырья. Это даст возможность луч- удовлетворить потребности населения повысить доходы Государственного бюл- жета.	vol-5732-page-02-seg-026-0906-2639-1556-3930.png
5732	2	906	3947	1548	4197	29	0.94979	Борьба за увеличение накоплений и дальнейшая мобилизация материальных и денежных ресурсов нашего хозяйства на нужды фронта и тыла, указывает тов. Посконов, является важнейшей задачей всех советских и хозяйственных органов.	vol-5732-page-02-seg-027-0906-3947-1548-4197.png
5732	2	906	4216	1548	4464	36	0.95946	Изложив основные статьи доходов рес- публиканского бюджета (налог с оборота, налоги и сборы с населения и подоходный налог с колхозов, государственные зай- мы, денежно-вещевые лотереи и вклады в сберегательные кассы), докладчик перехо- к расходной части бюджета.	vol-5732-page-02-seg-028-0906-4216-1548-4464.png
5732	2	902	4488	1546	4666	21	0.93613	Расходы Государственного бюджета РСФСР на 1944 г. намечены в сумме 24.573 млн. рублей. Большинство этих расходов направляется на финансирование социально-культурных мероприятий.	vol-5732-page-02-seg-029-0902-4488-1546-4666.png
5732	2	904	4684	1546	5040	48	0.94785	В высшей степени знаменательно, что Советское государство, несмотря на суро- вые условия военного времени, выделяет крупнейшие средства для дальнейшего развития культуры нашей страны. Бюд- жетные расходы на социально-культурные мероприятия предусмотрены B сумме 17.985 млн. рублей на 4.299 млн. рублей, или на 31,4 проц. больше, чем в 1943 г.	vol-5732-page-02-seg-030-0904-4684-1546-5040.png
5732	2	898	5059	1546	5705	90	0.94797	Наибольший рост бюджетных ассигно- ваний -- 55 проц. --- намечен по расходам на просвещение. Школы, высшие учебные заведения, детские сады и детские дома, политико-просветительные, научные другие культурные учреждения получат из бюджета на 3.251 или. рублей боль- ше, чем в прошлом году. За счет этих огромных дополнительных средств будет значительно расширена сеть учреждений просвещения, в особенности в краях и областях, освобожденных от немецких оккупантов. На 417 млн. рублей превы- шают фактические расходы 1943 года ассигнования на содержание детских до- мов. В этом нашли свое конкретное выра- жение заботы Советского государства тетях.	vol-5732-page-02-seg-031-0898-5059-1546-5705.png
5732	2	894	5721	1542	5940	33	0.93877	Государственный бюджет РСФСР на 1944 год обеспечивает дальнейший рост ассигнований на охрану здоровья трудя- щихся. Расходы на здравоохранение уве- личиваются против 1943 года на 815 млн. рублей или на 13,9 проц. Сеть ос-	vol-5732-page-02-seg-032-0894-5721-1542-5940.png
5732	2	1571	588	2219	836	35	0.95716	новных учреждений здравоохранения в этом году превысит довоенный уровень. Знаменателен тот факт, что почти 1.200 или. рублей ассигнуется на охрану здо- ровья матери и ребенка - на женские и детские консультации, ясли и детские больницы.	vol-5732-page-02-seg-033-1571-0588-2219-0836.png
5732	2	1575	856	2219	992	17	0.93421	Значительный рост расходов предусмот- рен на нужды социального обеспечения 489 млн. рублей против 363 млн. 1943 г.	vol-5732-page-02-seg-034-1575-0856-2219-0992.png
5732	2	1573	1013	2223	2083	152	0.95689	Задачи дальнейшего подъема произ- бодительности труда и восстановления промышленности, сельского и жилищно- коммунального хозяйства в освобожденных от немецких оккупантов областях и кра- ях, говорит далее тов. Посконов, тре- буют осуществления большой программы капитального строительства. На это стро- ительство по бюджету ассигнуется в 3 раза больше средств, чем в 1943 году 809' млн. рублей. Кроме того, 252 или. рублей выделяют из собственных средств Хозяйственные организации. Таким обра- зом, общая сумма капиталовложений сос- тавит в 1944 1.061 млн. рублей. Из них свыше 500 млн. рублей выделяются на восстановительные работы в районах, освобожденных от гитлеровских оккупан- тов. Основная часть этих средств вклады- вается в жилищное и коммунальное хо- зяйство. В 1944 году намечено восстако- ВИТЬ СОТНИ ТЫСЯЧ квадратных метров жилой площади, десятки электростанций много километров водопроводной и кана- лизационной сети, большое количество бань и прачечных, хлебозаводов, мясо- комбинатов, текстильных и обувных фаб- рик. Особенно широкая программа восста- новительных работ намечена в промыш- ленности строительных материалов.	vol-5732-page-02-seg-035-1573-1013-2223-2083.png
5732	2	1575	2098	2221	2383	40	0.96382	Заканчивая этот раздел доклада, тов Посконов указывает, что руководители хо- зяйственных организаций и местных сове- тов обязаны обеспечить безусловное вы- полнение не только плана капитальных работ, но и своевременное проведение ка- питального и текущего ремонта жилого фонда и промышленного оборудования.	vol-5732-page-02-seg-036-1575-2098-2221-2383.png
5732	2	1577	2404	2223	2727	41	0.95083	Война с фашистской Германией, подчеркивает докладчик, требует ог- ромных материальных и денежных ресур- сов. Это с особой остротой ставит вопрос об учете каждой копейки государственных средств, их строжайшей экономии, усиле- нии финансового контроля, улучшении ра- боты контрольно-ревизионных органов Наркомфина. : :	vol-5732-page-02-seg-037-1577-2404-2223-2727.png
5732	2	1577	2743	2221	2987	38	0.93909	Последний раздел доклада тов. Посконов посвящает характеристике бюджетов авто- номных республик, краев, областей и го- ролов. Их общий объем определен в сумме 18.273 млн. рублей на 4.910 млн. рублей, или на 36,7 проц. больше, чем в 1943 г.	vol-5732-page-02-seg-038-1577-2743-2221-2987.png
5732	2	1573	3004	2221	3934	140	0.95999	Наибольший против прошлого года рост намечен в бюджетах областей, краев автономных республик, освобожденных от немецкой оккупации в 1943 году. Это Смоленская, Орловская, Курская, Ростов- ская и Ленинградская области, Краснодар- свий и Ставропольский края и Кабардино- Балкарская АССР. По сравнению с прош- лым годом расходы на социально-культур- ные мероприятия по этим краям, областям и республикам увеличиваются более чем на 100 проц. и па финансирование народ- кого хозяйства - почти в 2,5 раза. Так. например, прирост контингента детей, об- служиваемых детскими домами, составит по этим областям около трети всего при- роста по РСФСР. На освобожденные райо- приходится более половины всех наме- ченных по РСФСР новых изб-читален, 20 проп. клик в городских больницах и около 40 - в сельских и т. д. Такое распре- деление средств на новое строительство полностью вытекает из поставленной то- варищем Сталиным задачи быстрейшей ликвидации последствий хозяйничания немецких оккупантов.	vol-5732-page-02-seg-039-1573-3004-2221-3934.png
5732	2	1571	3959	2218	4609	87	0.95199	На примере Орловской области доклад- чик показывает огромный размах и серь- езные результаты восстановительной рабо- ты в освобожденных областях. За 25 ме- сяцев своего разбойничьего хозяйничания гитлеровские оккупанты панесли Орлов- ской области колоссальный ущерб. Все промышленные предприятия полностью частично были выведены из строя. Раз- рушены почти все коммунальные элек- тростанции, бали, гостиницы, городские косты, тысячи жилых домов, почти все административные здания. Трамвайное хо- зяйство города Орла пемцы уничтольнли, а провода и аппаратуру вывезли в Герма- нию. В рупны превращены города обла- сти Новосиль, Ливны, физра, Мценск другие.	vol-5732-page-02-seg-040-1571-3959-2218-4609.png
5732	2	1569	4626	2216	5347	110	0.95355	Каково же положение в Орловской 65- ласти сейчас? началу этого года вос- становлены и организованы вновь 44 промкомбината, объединяющих 230 приз- водств, 147 артелей промысловой коопера- и 30 артелей кооперации инвалидов Введено в действие 10 электростанций, 8 водопроводных станций, 48 бань. 10 гостиниц. В Орле пущен трамвай. Восста- новлено и вновь построено 99 тыс. квад- ратных метров жилой площади в городах и рабочих поселках и 48 тыс. жилых до- мов в сельских местностях. 257 тые. человек переехали из землянок и подва- лов в благоустроенные жилища. Многое сделано для возрождения культурных уч- реждений. 1 января 1944 г. восстанов- лено и приспособлено 3.207 школьных помещений, свыше 300 учреждений здра. воохнинения и т	vol-5732-page-02-seg-041-1569-4626-2216-5347.png
5732	2	1567	5374	2210	5738	52	0.94957	На примере Орловской области видно, что восстановительная работа в освобож- денных районах уже дала большие ре- зультаты. Но это только начало! В 1944 году предстоит сделать во много раз боль- ше. Восстановление хозяйства, разрушен- ного немецкими оккупантами, стало поис- гине всепородной задачей, и нет сомнения, что она будет разрешена в кратчайший срок.	vol-5732-page-02-seg-042-1567-5374-2210-5738.png
5732	2	1565	5755	2212	5936	23	0.94094	Успешное выполнение Государствен- ного бюджета РСФСР на 1944 год, заканчивает тов. Посконов, явится :крупным вкладом народов Российской Фе- дерации в дело окончательного разгрома	vol-5732-page-02-seg-043-1565-5755-2212-5936.png
5732	2	3530	163	4172	200	7	0.91755	2 марта 1944. г., четверг, 52 (5732	vol-5732-page-02-seg-044-3530-0163-4172-0200.png
5732	2	2243	577	2889	940	47	0.95683	немецко-фашистских оккупантов. Миллио- ны советских патриотов своим героическим трудом и напряжением всех своих усилий обеспечивают непрерывный рост произво- дительных спл страны, мобилизуют все материальные и денежные ресурсы, чтобы приблизить светлый день победы, к кото- рой ведет нас любимый вождь и пулково- лиц Маршал Советского Союза великий Сталин!	vol-5732-page-02-seg-045-2243-0577-2889-0940.png
5732	2	2244	959	2885	1106	18	0.96034	Заключительные слова докладчика вы- зывают бурные аплодисменты. Все вста- ют. Долго не смолкает овация в честь товарища Сталина.	vol-5732-page-02-seg-046-2244-0959-2885-1106.png
5732	2	2244	1119	2883	1260	15	0.93940	Слово для содоклада предоставляется председателю Бюджетной комиссии Вер ховного Совета РСФСР депутату И. А. Власов.	vol-5732-page-02-seg-047-2244-1119-2883-1260.png
5732	2	2243	1275	2885	1706	55	0.95060	Депутат Власов кратко останавливается на выполнении Государственного бюджета РСФСР за прошедшие годы. Основная часть этого отчетного периода совпадает с годами Отечественной войны, когда, как подчеркнул содокладчик, бюджеты были подчинены интересам фронта, задаче раз грома немецко-фашистских захватчиков На финансирование обороны Советского Союза передано за годы войны из бюдже- та РСФСР в союзный бюджет 4.799 млн рублей.	vol-5732-page-02-seg-048-2243-1275-2885-1706.png
5732	2	2244	1723	2889	2291	85	0.95526	Состояние наших финансов за годы великой Отечественной войны, ГОВО- рит тов. Власов, - показывает, что Рос- сийская Советская Федеративная Социали- стическан Республика не только не осла- била свои экономические и финансовые ресурсы, а, наоборот, с каждым годом уве- личивала их. Доходы Государственного бюджета создавались не только за счет накоплений народного хозяйства, но и за счет поступлений средств от населения. Рабочие и работницы, колхозники и кол- хозницы, советская интеллигенция про- яр или высокий патриотизм, отдавая свои личные сбережения на усиление боевой мощи нашей доблестной Красной Армии.	vol-5732-page-02-seg-049-2244-1723-2889-2291.png
5732	2	2248	2306	2887	2520	25	0.95702	От мони Бюджетной комиссии тов Власов вносит предложение утвердить от- четы об исполнении Государственного бюд- жета республики в суммах, представлен- ных Советом Народных Комиссаров РСФСР.	vol-5732-page-02-seg-050-2248-2306-2887-2520.png
5732	2	2246	2539	2885	2608	10	0.92559	Переходя ко второй части своего сада- клада, тов. Власов заявляет:	vol-5732-page-02-seg-051-2246-2539-2885-2608.png
5732	2	2244	2622	2889	2874	33	0.94225	Бюджетная комиссия считает, что Го- сударственный бюджет РСФСР на 1944 : год составлен в полном соответствии с народнохозяйственным планом республи- ки и с Государственным бюджетом СССР, Утвержденным Х сессией Верховного Сове- та СССР.	vol-5732-page-02-seg-052-2244-2622-2889-2874.png
