volume_number	page_number	x1	y1	x2	y2	tokens_count	mean_confidence	text	image
5310	3	3873	815	4544	1311	67	0.96038	рованности, внутренней собранности. ное значение имеет отдача приветствий как внешний знак уважения к воинской дисциплине и воинской чести. Когда воспитательная работа ведется по бельшевистски, целеустремленно и деятель но, каждый боец полностью сознает, что всякий его поступок должен соответство вать почетнейшему званию вопла Красной Армин, что недобросовестное отношение к делу, обман несовместимы с воинским зва нием, что ложь перед начальником, пере товарищем - нарушение, оскорбление во инской чести.	vol-5310-page-03-seg-048-3873-0815-4544-1311.png
5310	3	3869	1315	4544	2467	174	0.96084	Одна из серьезнейших наших задач неустанное воспитание чувства воинского товарищества и взаимной поддержки. Этот лозунг надо связать с требованием и поня тием о воинской чести. Кто оставляет то- варища в беде - тот нарушает воинскую честь. Каковы же средства воинского воспита- ния? Одно из важнейших средств - воспита- ние на боевых примерах, на примерах под видов, совершаемых нашими воинами. Есть уже подвиги, о которых знает вся Красная Армия. Таков, например, бессмертный ге- ровем 28 гвардейцев. Но такие примеры как героическая оборона Ленинграда, разве мы ее показали достаточно? геро- защитников Севастополя? А такие под виги, как подвиг четырех бойцов бронебой- шиков, уничтоживших на Сталинградском фронте 15 немецких танков? Мы еще мало внедряем значение таких подвигов в созна ние бойцов. Наряду с такими выдающимися прояв- лениями доблести наших бойцов надо шп- роко популяризировать яркие примеры из близкой бойцам действительности. Герот есть в каждой части, и все бойцы этой части должны знать них. В полку, где командиром майор Худалов, заведены ротные журналы, в которые записываются подвиги бойцов, и на этом воспитывается новое пополнение, Этот почин заслуживает одобрения.	vol-5310-page-03-seg-049-3869-1315-4544-2467.png
5310	3	3865	2469	4542	3903	218	0.96131	Огромную роль призвано сыграть воспи тание бойцов Красной Армии на истори ческих традициях. Мы имеем замечатель ные традиции суворовских орлов, героев Отечественной войны 1812 года, у нас- есть прекрасные традиции гражданской войны и надо шире, глубже развертывате наглядный, яркий показ их. В одном гвар- дейском танковом соединении при вечерние поверке личного состава выкликается фа- милия Героя Советского Союза старшины Шаповаленко. Правофланговый отвечает "Погиб смертью храбрых в борьбе с немед кем фашизмом под Барвенково". Бойцы должны чувствовать, что имена павини смертью храбрых не умирают. Большое значение имеет воспитание на символах. У нас есть замечательный спм B0.1 боевое знамя. Знамя как бы-кон- центрирует в себе все основные вопросы воинской чести --- преданность родине, напоминание о боевых традициях Красной Армии и данной части, о ее героях. Но этому величайшему символу подходят по- рой не так, как нужно. Часто знамя нахо- дется во втором эшелоне и о нем бойцы даже не знают, не знают того, что знамя представляет собой эмблему символ роди- ны, эмблема и символ полка, что оно во- площает достоинство советского народа. Непростительно мало внимания уделяет ся нередко торжественным церемониалам Красной Армии, играющим большую роль в воспитании воинской чести бойца. Сюда относятся: принятие военной присяги, вру чение боевого оружия, вручение знамени, переименование части в гвардейскую, вру- чение гвардейского знамени, присвоение ордена, вручение нашивок за ранения, принятие пополнения, погребение героев части.	vol-5310-page-03-seg-050-3865-2469-4542-3903.png
5310	3	3841	3909	4535	6295	342	0.95885	Успех воспитания бойда решает бое вое доверие, любовь, уважение бойца командиру политработнику. Чтобы вести бойнов F. побеле, от ксмани- ров требуется очень многое и прежде всего знания; военного дела, умение воевать по-современному. В командире боец дол- жен видеть воплощение самых высоких, са- мых благородных воинских качеств. Реши- тельный и мужественный, он должен быть строг и справедлив в отношениях с похчи- ненными ни в коем случае не допускать унижения чувства собственного доступа- ства байда. Нашим командирам есть чему поучиться у прославленных русских пол- колодиев прошлого и наших полководцев периода гражданской войны. Закаленные военачальники, они были отцамп для своих бойцов, сочетая суровую требовательность с величайшей заботой людях. Когда знакомишься с некоторыми приказами Су- борова, Кутузова, то начинает казаться; что писал их не полководец, a интен- дант-такое большое место в этих прика- зах занимают вопросы здоровья и быта бойцов. Вот приказ Суворова от 31 марта 1794 года: "Здоровье. Драгоценность блю- дения оного естественных правилах. Платье квас; для него двойная посуда; чтобы не было молодого п перекледого; коли-ж вода, то здоровая и несколько про- правленная. Ела - котлы выложенные, припасы здоровые, хлеб выпеченный, пища товарная, не переваренная, не отстоянная, не погретая, горячая; и для того, кто каше не после --- лишен я, на тот раз - воздух. В теплое время отдыхать под тенью, без обленсния; ночью в палатках укрываться, в холодную не ночь отнюдь бы в них сквозной ветер не был. Через ротных фельдшеров довольный задач в ар- телях лекарственных трав". Долг всех наших командиров - повее- дневно заботиться о бойце, его пище, его здоровье. Но только этого мало. Командир должен быть примером в перенесении тл- гот войны, ее трудностей и линейной. Независимости случайно суворовские солдаты говорили: "Наш Суворов всегда с нами в раю". Когда командир умеет говорить бойцам, знает их, понимает их душу; когда строгая Tire- бовательность неотделима него от заботы людях; когда весь распорд- док вся жизнь части построены так, что- бы изо дня в день все больше развивать укреплять в бойцах навыко дисциплины- рованности, мужественного II самоотвер- женного выполнения воинского долга, тогда воинское воспитание дает напболь шие плоды, все более повышая боевую сп-	vol-5310-page-03-seg-051-3841-3909-4535-6295.png
5310	4	2148	516	2736	556	4	0.88932	красная в 3 д	vol-5310-page-04-seg-001-2148-0516-2736-0556.png
5310	4	3663	520	4082	550	4	0.90505	18 ortrode 1942 г.,	vol-5310-page-04-seg-002-3663-0520-4082-0550.png
5310	4	4132	516	4467	546	4	0.91248	чье. № 246 (5310)	vol-5310-page-04-seg-003-4132-0516-4467-0546.png
5310	4	534	631	1606	823	9	0.95707	ДЕНЬ ВОЙНЫ" (Новый документальный фильм производства Центральной студии кинохроники)	vol-5310-page-04-seg-004-0534-0631-1606-0823.png
5310	4	380	849	1048	1656	111	0.96059	Опускаются «сторожа» Москвы сере- бристые аэростаты заграждения, подни- маются с аэродромов баррзанирующие на; городом истребители, в утренней тишине звучит топот копыт всадников-милиционе ров, и воинская часть, десантники, с ор- сестрой проходят по знакомым набереж- ным Москва-реки. Наступает 13 июня 1942 г. насту- пает 356-й день великой отечественной войны советского народа. На крайнем пра- Вом фланге фронта, протянувшегося от Ба- ренцова до Черного моря, на боевом по- сту стоит часовой-краснофлотец. По лет- вену рыхлому снегу Заполярья ведут раз- ведку боем лыжники. Первая пулеметная трель нарушает спо- койствие этого утра. С этого мгновения перед зрителем раз- вертываются потрясающие картины 356-го дня войны - сцены величайшего пафо- са, мужества, страдания, товарищеской верности и самопожертвования.	vol-5310-page-04-seg-005-0380-0849-1048-1656.png
5310	4	376	1662	1044	1975	44	0.95629	Севастополь, город-герой, двайцы све янный вечной славой, встает перед на- шими глазами, Люди Севастополя ----- реки и красноармейцы, крепостные фор- развилины знакомых улиц и над всем --- памятник Ленину, поднимающий- ся над городом и бухтой как неиспепелен- ный знак доблести, славы и прядущей победы.	vol-5310-page-04-seg-006-0376-1662-1044-1975.png
5310	4	376	1979	1040	2222	39	0.96124	Ленинград переживает 286-й день осады. Все так же величественна набе- речная Невы, всо так же прекрасны пер- спективы его улиц, все так же непоко пебичы его защитники ленинградцы. Су- ровое спокойствие и бесстрашие в их строгих, многое видевших глазах.	vol-5310-page-04-seg-007-0376-1979-1040-2222.png
5310	4	372	2232	1038	2441	34	0.95394	Трупик ребенка у входа в детский сад, разрыв с народа над Академией ху- дожеств все это запечатлен кинемато- араф, чтобы миллионы людей у нас за океаном видели страдания и стойкость жи- телей героического Ленинграда.	vol-5310-page-04-seg-008-0372-2232-1038-2441.png
5310	4	366	2449	1036	3010	94	0.96226	На суше, на воде и в воздухе тероис- ходят яростные схватки с врагом. Можно было думать, что гром артиллерии, гро кот моторов, треск пулеметов на протя- жении полутора часов, пока идет фильм, уточнят внимание зрителя, ослабеет его впечатлительность. Восприимчивость эри- теля не ослабевает, он весь во власти фильма - сквозь гром канонады проби- вается и звучит полной силой мощный всепобеждающий голос - голос великого народа, который, не жалея жизни своей и крови, отстаивает все великое и драгоцен- ное, что дали ему века. Отстаивает веко- вую славу, свою науку, искусство, един- ство, свободу и независимость.	vol-5310-page-04-seg-009-0366-2449-1036-3010.png
5310	4	366	3018	1030	3538	87	0.96368	Далеко по полю рассыпаны готовые ри- нуться в воздух боевые самолеты, живо лесными группачи стоят у самолетов лет- чики. Здесь, на аэродроме, звучит кон- цертный рояль, Летчики видят вдохновен- пое лицо одного из лучших пианистов ми- ра, Эмиля Гилельс, слушают в его ис- полнении прелюд Рахманинова. И лет- чик, у которого еще в ушах грохот мо- кора, гром авиалтушки, у которого еще перед глазами силуэт объятого пламенем вражеского истребителя, вдруг забывает соо всем, что было несколько минут на- зад, и весь отдается могучей силе вдохно- военной музыки.	vol-5310-page-04-seg-010-0366-3018-1030-3538.png
5310	4	364	3550	1026	3897	59	0.95797	Еще мгновение, глаз киноаппарата уводит зрителя дальше. Мы видим суро- вые партизанские будни, видим предать для, которого судит и казнит народ за то, что он продал родину. Справедливый, свя- той гнев женщины, чьей мужа, брата или сына выдал этот гад, и лицо предателя в предсмертной тоске все это правда- Bu и сурово показывает документальный фильм об одном дне войны.	vol-5310-page-04-seg-011-0364-3550-1026-3897.png
5310	4	1066	853	1734	2140	194	0.96247	Временами отдельные кадры восхища- ют нас, как батальные картины знамя- художников. Вот на экране возни- кают картины того, что сделал враг с захваченными им районами нашей стра ны, возникает липо врата палача, сади- ста, дрессированной двуногой фашистской собаки, и потому радостное чувство удов- летворения охватывает зрителя, когда он видит обезоруженных, идущих, как стадо, пленных врагов. Победа стоит прови, стоит жертв. горестью и рниманием зритель видит ги- бель летчика Антонова, который все же дотянул горящий самолет до своего аэ- родрома, с горестью он видит сумрачные лица его боевых товарищей. Они отдают последние почести тому, «кто с нами жил нам умирать прилетел». Победа стоит жертв, по какую радость несет с собой любеда, когда, сломаз обо- рону врата и выкурив фашистское зверье из нор, наши бойцы возвращают редные земли. Звонарь сельской церкви, замучен- ный, полуобезумевший от вражеских из- девательств, поднимается на колокольню, звонит в колокола - в этом звоне воскре- сенье из мертвых, праздник пробуждения жизни после страшного сна, после не- мецкого ига. Такие эпизоды фильма трудно забыть. Зритель видит М. П. Калинина в его рабочем кабинете. Товарищ В. М. Молотов возвращается в Москву из поездки в Лон- Дон и Вашингтон. Все это происходило 13 июня 1942 гола.	vol-5310-page-04-seg-012-1066-0853-1734-2140.png
5310	4	1052	2146	1726	3859	267	0.96128	После грозных, полных эпической си- лы фронтовых эпизодов показана жизнь будни трудового тыла. Сталь, свинец для врага, хлеб для защитников родины везут на запад бесчисленные железнодорожные составы. Самоотверженный. напряженный труд народа, работа всей страны для фронта по существу является темой особого документального фильма, но даже в пределах фильма об одном дне войны эта тема нашла достойное выражение. Де- вушки и подростки, старики-пенсионеры, прославленные богатыри труда, целал гал- лерея образов, проходит на экране. Это от- цы, матери, жены, братья и сестры тех, кто сражается на фронте. И когда видишь всенародный труд ради победы, труд рус- ских, украинцев, узбеков, грузин, армян, понимаешь, почему мощная военная маши- на Германии по в силах сделать то, что ей удалось так быстро и просто сделать в других странах. Еще одна глубокая тема раскрывается 5 этом фильме тема братства наро- дов. В Тбилиси с южным темпераментом, восклицаниями, смехом и слезами право- кают на фронт молодых летчиков, дочь белорусского народа артистка Александ- ровская провожает в танковую атаку тал- кистов, мощный бронепоезд носит на бро- но гордое имя советской Армении. Это единение народов - залог нашей побе- ды, нашего торжества над врагом. Фильм "День войны" создан людьми, давно и отлично работающими в нашей кинематографии, режиссером М. Слуц- ким, сценаристом А. Каплером и 160 кн- нооператорами, отважно, в любых усло- ВИЯХ снимавшими фронтовые Эпизоды. Этих людей зизют, уважают на фронте и в тылу, их труды по заслугам оцене- ны. Но кроме заслуженных почестей па- ши кинематографисты должны чувство- вать глубокое удовлетворение при мысли, что каждый зритель, посмотрев фильм «День войны», уходя из кинотеатра, будет говорить себе: Не быть немцу господином на рус- ской земле! Не будет этого!	vol-5310-page-04-seg-013-1052-2146-1726-3859.png
5310	4	1455	3865	1666	3899	1	0.92106	никулин	vol-5310-page-04-seg-014-1455-3865-1666-3899.png
5310	4	564	3938	1544	4018	5	0.96591	КРАСНОАРМЕЙСКИЙ АНСАМБЛЬ МОСКОВСКОЙ ПРОТИВОВОЗДУШНОЙ ОБОРОНЫ	vol-5310-page-04-seg-015-0564-3938-1544-4018.png
5310	4	362	4032	1022	4307	37	0.96336	частях московской зоны протибовоз душной обороны успешно выступает крас- ноармейский ансамбль песни п пляски Выступления ансамбля проходят с успехом Особой любовью слушателей пользуется згузыкально-литературная композиция "Ты защищаешь родину». В композицию вклю- чены песни о мастерстве советских лет-	vol-5310-page-04-seg-016-0362-4032-1022-4307.png
5310	4	1048	4036	1710	4313	35	0.96129	чаков-истребителей, снайперах-зенитчи- ках. Большой популярностью пользуютс: певцы старшина Семенов, старший сержант Бускин, красноармеец Ломанов и другие. Некоторые песни созданы бойцами и командирами, участниками ансамбля. За последнее время ансамбль дал не- сколько концертов на огневых позициях	vol-5310-page-04-seg-017-1048-4036-1710-4313.png
5310	4	1817	635	2376	769	3	0.93119	Дезертирство немецких офицеров	vol-5310-page-04-seg-018-1817-0635-2376-0769.png
5310	4	1760	785	2420	1208	64	0.95593	ЛОНДОН, 17 октября. (ТАСС). Как со- общает газета "Дейли экспресс", за по- следние несколько недель свыше 300 нем- цев из оккупированной Франции перешли через Юрские горы и сдались пгвейцарским властям. Все они дезертировали с целью избежать посылки на советско-германский фронт. Они разоружены и интернированы Среди дезертиров много офицеров. Одна группа, прибывшая в Лелонкль волизи Невшательского озера, состояла из 37 гер- манских офицеров и унтер-офицеров.	vol-5310-page-04-seg-019-1760-0785-2420-1208.png
5310	4	1829	1251	2354	1313	3	0.93973	расстрелы в голландии	vol-5310-page-04-seg-020-1829-1251-2354-1313.png
