volume_number	page_number	x1	y1	x2	y2	tokens_count	mean_confidence	text	image
5446	1	888	209	2112	272	3	0.95819	Смерть немецким оккупантам.	vol-5446-page-01-seg-001-0888-0209-2112-0272.png
5446	1	196	293	2166	631	10	0.89566	. . . ЦЕНТРАЛЬНЫЙ ОРГАН НАРОДНОГО КОМИССАРИАТА ОБОРОНЫ СОЮЗА ССР	vol-5446-page-01-seg-002-0196-0293-2166-0631.png
5446	1	247	665	512	720	2	0.90638	75 (5446)	vol-5446-page-01-seg-003-0247-0665-0512-0720.png
5446	1	954	671	1486	720	5	0.91231	31 марта 1943 г., среда	vol-5446-page-01-seg-004-0954-0671-1486-0720.png
5446	1	1888	673	2142	722	2	0.86243	ЦЕНА 20 коп.	vol-5446-page-01-seg-005-1888-0673-2142-0722.png
5446	1	2289	306	3244	616	41	0.92394	Сообщения Совинформбюро (1 стр. ). Письма товарищу Сталину и его ответы (2 стр. ). Подполковник П. Коломейцев. Использование подвижности танков (2 стр. ). H. Тихонов. Ленинград в марте (3 стр. ). Майор С. Чухнов. Воздушная разведка истре- бителей (3 стр. ).	vol-5446-page-01-seg-007-2289-0306-3244-0616.png
5446	1	2291	618	3240	695	10	0.91658	Подполковник И. Березин. Партийное поруче : ние (3 стр. ).	vol-5446-page-01-seg-008-2291-0618-3240-0695.png
5446	1	3342	300	4294	381	8	0.88066	Информация с фронтов Отечественной войны (3 стр. ).	vol-5446-page-01-seg-009-3342-0300-4294-0381.png
5446	1	3342	383	4294	525	17	0.91199	A. Сурков. --- Он был в Бранденбурге (4 стр. ). Заявление Черчилля положении вунисе (4 стр. ).	vol-5446-page-01-seg-010-3342-0383-4294-0525.png
5446	1	3342	527	4295	693	21	0.92474	Заявление Стеттиниуса о продовольственных по- ставках США (4 стр. ). Налет английских бомбардировщиков на Берлин и на Рур (4 стр. ).	vol-5446-page-01-seg-011-3342-0527-4295-0693.png
5446	1	251	788	1505	947	8	0.96540	УМЕЛО ГРОМИТЬ ВРАГА С ВОЗДУХА НА ПОЛЕ БОЯ	vol-5446-page-01-seg-012-0251-0788-1505-0947.png
5446	1	190	979	862	2720	264	0.95493	Абтивные, мастерские действия авиации на поле сражения одна из вернейших предпосылок успеха как в наступления, так и в обороне. В чем же должны про- Являться эти активность и мастерство? Прежде всего в том, чтобы обеспечить не- прерывность огневой поддержки наземных частей с воздуха. Такая непрерывность возможна лишь тогда, когда взаимодействие авиации с на- земными войсками строится не по прин- ципу поддержки их «вообще», вне времени и пространства, а строго разграничивается этапами боя. Скажем, в наступлении, на- чавшись с авиационной подготовки, осу- ществляемой либо коротким, мощным на- падением на вражескую оборону, либо заблаговременными действиями авиации на широком фронте, это непрерывное воздей- ствие с воздуха должно перейти в силь- ный, сосредоточенный удар, наносимый на главном направлении непосредственно пе- ред атакой пехоты и танков. В поел еду- ющем авиация, действующая на поле боя, Должна неотрывно сопровождать огнем с воздуха свои войска, ведущие борьбу в глубине вражеской обороны. Все усилия авиационных командиров и летчиков, действующих на поле сражения, должны быть направлены к тому, чтобы создать для немцев невыносимые условия борьбы. На ряде участков это достигает- ся правильно слитанированными действиями бомбардировщиков и штурмовиков, которые буквально часами, эшелон за эшелоном висят над головой зарывшегося в землю врага и поражают его метким, расчетли- вым огнем. В других случаях, как пока- зывает опыт, действия авиации на поле боя могут иметь иной характер. Например, обороне не всегда следует спешить с нанесением удара с воздуха по сосредото- чивающемуся противнику. Иной раз вы- годнее выждать некоторое время и, при- стально следя за действиями немцев, прет- принимать нападение с воздуха в тот мо- мент, когда они, обманутые тишиной, день- ше всего ожидают появления нашей авиа- ции.	vol-5446-page-01-seg-013-0190-0979-0862-2720.png
5446	1	187	2726	862	4220	224	0.95463	Однако это не означает, что авиацион- ный командир не должен организовывать ударов по мелкин группам немцев, особен- но тем, которые пытаются обходным ма- невром просочиться в налги тылы. Всё время ведя боевую разведку, авиация обя- зана немедленно наносить мощные удары по маневрирующим подразделениям танков и мотопехоты противника, срывая этим его замыслы, Авиационный командир, поддер- живающий оборону того или другого рубе- то, должен всегда иметь в своих руках резерв с той целью, чтобы обрушиться им на голову немцев в решающие моменты оборонительного боя и в особенности при переходе врага в атаку. Используя бомбардировщиков и штурмо- виков, авиационный командир обязан ста- вить им такие задачи, чтобы с наимень- шей затратой сил достичь наибольшего бое- вого эффекта. Скажем, уничтожение живой силы и подавление мелких огневых точек противника может быть организовано пу- тем бомбардировки и пулеметно-пушечным обстрелом площади. В этом случае в боевой порядок может быть включено несколько подразделений, атакующих по-эшелонов оп- ределенные участки. В другом случае, ког- да понадобится поразить мелкие, точечные дели, командир выгадает на том, что будет посылать на поле боя небольшие группы бомбардировщиков или штурмовиков со строго ограниченными задачами. Нако- нец, для разрушения долговременных обо- ронительных сооружений больше смысла наряжать пикировщиков с крупными бомба- ми, нежели самолеты, бомбардирующие ту же цель с горизонтального полета. Шабло- на и заранее составленного рецепта здесь быть не может. К выполнению каждой за- дачи надо подходить творчески, иници- ативно.	vol-5446-page-01-seg-014-0187-2726-0862-4220.png
5446	1	189	4227	856	4479	42	0.94814	Случается, что, действуя на поле боя, командиры подразделений спешат. Появив- швсь над районом целей, они торопливо... за один заход расходуют боевой запас и сразу же после этого уводят самолеты об- ратно. Между тем, наземные войска ждут от каждого боевого эшелона более эффек	vol-5446-page-01-seg-015-0189-4227-0856-4479.png
5446	1	877	977	1550	4481	519	0.95022	тивной, более расчетливой огневой под- держин с воздуха. Для этого необходимо, прежде всего, правила скомбинировать расход боевого запаса, добиваясь, чтобы каждая бомба, каждая пулеметная очередь поражала определенные цели. Так, если штурмовики, например, в первом заходе сбрасывают часть бомо, то во втором они "... применяют свое артиллерийское вооруже- ние, а в третьем снова обрушиваются на противника бомбами или поливают его пу- зенитным огнем. Более того, опыт лучших штурмовых частей учит, что, действуя на 110. боя, порой выгодно для сковывания противника производить холостые заходы, заставляя вражеских прижиматься земле и прекращать, огонь. Долг летчи- : ков штурмовой и бомбардировочной авиа- цип всячески увеличивать время своего пребывания над полем боя, добиваясь дли- тельной, непрерывной поддержки наземных войск с воздуха. Развитие любого боя неизбежно влечет за собой известное перемешивание боевых порядков наступающих с боевыми порядка- ми обороняющихся. Поэтому при организа- непрерывной поддержки наземных войск с воздуха особенно четко должна быть налажена служба взаимной связи, информации и целеуказания. Сигнальную службу в наземных подразделениях нужно поставить так, чтобы летные экипажи в ходе боя могли надежно поражать объекты находящиеся в удалении 500--1000 ист- ров от нашей пехоты или танков, не опа- сажь случайного поражения последних, Чтобы обеспечить тесное боевое взаимо- действие авиации и наземных войск, обще войсковые штабы совместно с авлационны- обычно составляют плановую таблицу боя. Но план это еще далеко не всё. Как бы хорошо он ни был составлен, в ходе боя обстановка может потребовать ли- бо удара по вновь возникли целях, перенесения оргия с одного объекта на другой и т. д. Поэтому внимание : общевойсковых и авиационных команда- ров должно быть обращено на C03- дание устойчивой бесперебойной связи ме- жду командными пунктами и аэродромами; на устройство специальных контрольно- пропускных пунктов, проходя через кото- рые боевые эшелоны авиации будут полу- чать разрешение для удара по ранее назна- ченной цели; на службу офицеров связи и личное наблюдение за полем боя. Для большей четкости взаимодействия весьма полезно, как показывает опыт, практико- вать предварительные выезды командиров и штурманов с целью ознакомления с ме- стностью и изучения орвентиров и обек- ТОВ командирские разведывательные полеты. Большую пользу могут принести также специальные ориентирные схемы для каждой авиачасти с точно нанесенны- ми объектами бомбометания и т. д. Действия авиации на поле боя следует надежно обеспечивать истребителями. Не- которые командиры порой сводят это обес- печение лишь одному надрупированию над линией фронта. В таких случаях вра- жеская авиация, двигаясь эшелонированно, может быстро измотать наши воздушные патрули, отвлечь их в сторону п обеспе- чить себе этим выгодные условия для про- тиводействия напим бомоардировщикам и штурмовикам. Неизмеримо большего эф- фонтан в работе потребителей добиваются те конанииры, которые всячески варь- приют . формы боевого обеспечения. В зависимости от обстановки они сочетают непосредственное многоярусное патрулиро- вание над полем боя со свободные воз- душными боями за линией фронта на тер- ритории противника, блокировкой вражес- ких аэродромов, внезапным найденном на эти аэродромы, пря одновременно хорошо организованног сопровождении боевых клонов бомбардировщиков и штурмовиков специальными группами истребителей. Задача непрерывного воздействия на противника требует от кадров нашей авиа- большой настойчивости, умения, отва- гн. Дело чести п долг командиров, летчи- ков и питурманов --- образцово выполнить эту важнейшую задачу, неустанно громить немцев на поле боя днем и ночью, в любых условиях наземной и воздушной обстановке.	vol-5446-page-01-seg-016-0877-0977-1550-4481.png
5446	1	285	4564	1471	4604	3	0.93053	ОБЩЕМОСКОВСКОЕ СОБРАНИЕ АГИТАТОРОВ	vol-5446-page-01-seg-017-0285-4564-1471-4604.png
5446	1	189	4623	856	5135	83	0.96744	29 марта в Колонном зале Дома Союзов состоялось собрание агитаторов г. Москвы С докладом о массово-политической и ор- ганизационной работе в связи с разверты- ванием предмайского социалистического со- ревнования выступила секретарь ВЦСПС тов. К. И. Николаева. Охарактеризовав ряд успехов в работе московской промышленности за истекший год и в первые месяцы 1943 года, т. Ни- колаева указывает, что предмайское социа- листическое соревнование должно прохо- дить под знаком сдачи продукции в фона Главного Командования Красной Армии за счет перевыполнения предприятиями уста- новленных для них планов.	vol-5446-page-01-seg-018-0189-4623-0856-5135.png
5446	1	190	5143	861	5432	38	0.96766	Важнейшая задача предмайского социа- листического соревнования -- дальнейшее повышение производительности труда. Не- обходимо добиваться, чтобы рабочие не только выполняли, но и перевыполняли нормы выработки, лучше организовать труд, укрепить трудовую дисциплину. решительно бороться с потерями. Тов. Николаева подчеркнула важность	vol-5446-page-01-seg-019-0190-5143-0861-5432.png
5446	1	877	4626	1542	5233	97	0.96785	вовлечения в предмайское соревнование всех работающих. Необходимо широко раз- вернуть такие формы соревнования, как соревнование на лучшего мастера, по про- фессиям, обеспечить гласность и нагляд- ность соревнования, широко использовать для этого все формы политической работы и массовой агитации. В обсуждении доклада тов. Николаевой приняли участие партийные и профсоюзные работники ряда московских предприятий, в том числе парторг ЦК ВКП(б) одного из заводов т. Гурина, председатель завод- ского комитета завода имени Сталина т. Баранов, агитатор 1-го Государственного подшипникового завода т. Фомина, секре- тарь Москворецкого РК ВКП(б) т. Коз- лова, секретарь парткома завода шлифо- вольных станков тов. Андрианов и др.	vol-5446-page-01-seg-020-0877-4626-1542-5233.png
5446	1	871	5241	1541	5432	29	0.95583	В конце собрания выступил секретарь МГК ВКП(б) тов. Г. М. Попов, подчерк- нувший большое значение предмайского социалистического соревнования для даль- нейшего роста производства в промышлен- ности г. Москвы. (ТАСС).	vol-5446-page-01-seg-021-0871-5241-1541-5432.png
5446	1	506	5521	1213	5553	3	0.95845	ПОМОЩЬ СЕМЬЯМ ФРОНТОВИКОВ	vol-5446-page-01-seg-022-0506-5521-1213-5553.png
5446	1	189	5570	854	5831	35	0.94608	СМОЛЕНСКАЯ ОБЛАСТЬ, 30 марта. (ТАСС). В Андреевском, Вяземском, Тума- невском и других освобожденных от не- мецкой оккупации районах при исполкомах Советов депутатов трудящихся начали ра- ботать отделы по государственному обес- печению и бытовому устройству семей военнослужаших.	vol-5446-page-01-seg-023-0189-5570-0854-5831.png
5446	1	189	5840	856	6001	27	0.96629	В Медынском районе обследованы усло- вия жизни свыше 1.000 семей фронтови- ков. 52 семьям предоставлены лучшие квартиры. 160 человек устроены на рабо- ту, многие получили единовременное де-	vol-5446-page-01-seg-024-0189-5840-0856-6001.png
5446	1	875	5576	1541	5995	63	0.95589	нежное пособие. Нуждающимся выдана обувь, одежда, продовольствие. САМАРКАНД, 30 марта. (ТАСС). Брат- скую помощь оказывают семьям фронтови- ков колхозники сельхозартели «Кзыл-Ку- шун», Самаркандского района. Они засеяли сверх плана 10 гектаров зерновыми куль: турами и один гектар овощами. Весь урожай с этой площади предназначается для семей военнослужащих. Для них же будет снят урожай с двух гектаров вино- градника. Семьям фронтовиков помогли обработать приусадебные участки.	vol-5446-page-01-seg-025-0875-5576-1541-5995.png
5446	1	1588	794	2896	960	10	0.97423	МОСКВА, КРЕМЛЬ ПРЕДСЕДАТЕЛЮ ГОСУДАРСТВЕННОГО КОМИТЕТА ОБОРОНЫ ТОВАРИЩУ СТАЛИНУ И. В.	vol-5446-page-01-seg-026-1588-0794-2896-0960.png
5446	1	1575	977	2919	1365	81	0.96073	Дорогой товарищ Сталин. Личный состав железнодорожных войск спецформирований Управления военно-восстановительных заградительных работ № 2, вдохновленный героиче- скими успехами нашей родной Красной Армии, горя желанием приблизить час окончательного разгрома немецко-фашистских захватчиков, внес в Госбанк из своих личных сбережений 1.482.367 рублей наличными и 698.197 рублей облигациями госзаймов на строительство бронепоезда имени Героя Советского Союза Мирошни- ченко В. II. Поступление средств продолжается. Пусть наши рубли, воплотившись в грозное оружие, несут смерть немецким оккупантам и помогут Красной Армии быстрее освободить советскую землю от фашистской нечисти.	vol-5446-page-01-seg-027-1575-0977-2919-1365.png
5446	1	1576	1368	2917	1546	47	0.94298	Заверяем Вас, дорогой вождь и учитель, что мы в любых условиях восстано- вим в кратчайший срок железные дороги и обеспечим нашей родной красной Ар- мии подвоз всего необходимого. Заверяем Вас, наш родной отец, что мы не пожалеем своих сил и самой жизни для выполнения любого Вашего приказа.	vol-5446-page-01-seg-028-1576-1368-2917-1546.png
5446	1	2146	1550	2875	1627	8	0.93550	И. о. Нач. Управления полковник НИКОЛАЕВ Майор СЛАВГОРОДСКИЙ	vol-5446-page-01-seg-029-2146-1550-2875-1627.png
5446	1	1645	1663	2851	1839	38	0.95736	И. о. НАЧАЛЬНИКА Управления военно- ВОССТАНОВИТЕЛЬНЫХ И ЗАГРАДИТЕЛЬНЫХ РАБОТ № 2 ПОЛКОВНИКУ тов. Н И К О Л А Е В У МАЙОРУ тов. С Л А В Г О Р О Д С К О М У	vol-5446-page-01-seg-030-1645-1663-2851-1839.png
5446	1	1580	1862	2915	2127	47	0.93307	Передайте личному составу железнодорожных войск и спецформа- рований Управления военно-восстановительных и заградительных работ № 2, собравшему 1.482.367 рублей и облигациими госзаймов 698.197 рублей на строительство бронепоезда имени Героя Советского Союза В. П. Мирошниченко, -- мой боевой привет и благодарность Красной Армии. И. С Т А Л И Н.	vol-5446-page-01-seg-031-1580-1862-2915-2127.png
5446	1	1677	2199	2773	2301	11	0.98179	МОСКВА, КРЕМЛЬ ИОСИФУ ВИССАРИОНОВИЧУ С Т А Л И Н У	vol-5446-page-01-seg-032-1677-2199-2773-2301.png
