volume_number	page_number	x1	y1	x2	y2	tokens_count	mean_confidence	text	image
5732	3	213	596	879	1837	180	0.95586	Голубоватая дымка окутала заснежен- ный лес. На опушке заметны следы недавнего бея. Здесь стоит подонтый танк «тигр», несколько немецких автомашин. Подняв жерла вверх, стоит зенитное ору- дие. Недалеко от орудия глубокая ворон- ка красноречивое доказательство мет- кого бомбометания наших летчиков. Справа и слева слышна артиллерийская канонада. Там идет бой. Наши воины ос- гобождают эстонскую землю от фашистской нечисти. Чем ближе к переправе через реку Нарва, тем слышнее становится шум боя. В орудийный гул вплетаются звуки минометов, пулеметная трескотня. Низко, чуть не задевая за верхушки деревьев, проходят наши штурмовики. Вот и переправа, вернее, целая систе- ма переправ. По льду идут пехотинцы. Рядом проложен настил, по которому пе- реправляются легкие системы артиллерии, автомашины. Право настила понтона- ный мост. По нему проходят танки, само- ходные и тяжелые орудия. Река в этом месте широкая, и только когда перейдешь через нее, видишь, насколько упорны здесь были бол. Весь западный берег сплош- ные укрепления. Правда, опи сейчас имеют первоначального вида. Дзоты и от- крытые пулеметные площадки развороче- ны снарядами нашей артиллерии. Но всё же можно представить себе систему вра- жеской обороны на западном берегу Нар- вы.	vol-5732-page-03-seg-005-0213-0596-0879-1837.png
5732	3	217	1844	875	2677	123	0.95840	Неипы рассчитывали задержать здесь наше наступление, загородить советским войскам дорогу в Прибалтику. Они ярост- но цеплялись за каждый клочок террито- рип, за каждый населенный пункт. При- ходилось и приходится брать с бою каж- дую лядь земли, затрачивать огромные усилия, но ничто не останавливает на- ших воинов. Они идут вперед, освобождая землю братской республики от врага, и каждый их шаг знаменуется новыми под- вигами. Старшина Иван Кулясов подполз на ем- близкое расстояние к закопанному в зем- лю немецкому танку и расстрелял его из противотанкового ружья. Старший сержант Николай Савинкин с двумя бойцами тем- ной ночью пробрался в тыл к немцам. Внезапным налетом три смелых воина захватили врасплох гитлеровцев, засев- ших в доме лесника- Они уничтожили де- вять вражеских солдат и троих взяли в плен.	vol-5732-page-03-seg-006-0217-1844-0875-2677.png
5732	3	217	2685	879	3079	54	0.96030	Артиллерийские разведчики корректиро- вали огонь, находясь возле своей пехоты. Когда немцы пошли в контратаку, огонь наших орудий был направлен на танки противника. Немцы несли потери, но всё же лезли вперед. Продолжая корректиро- кать огонь, артиллеристы, вооруженные автоматами, отбивали вражескую контр- атаку. Когда же немцы подошли совсем близко, по проводу понеслась команда: «Огонь на меня!»	vol-5732-page-03-seg-007-0217-2685-0879-3079.png
5732	3	219	3085	875	3406	47	0.95510	Танк «тигр» двигался к высоте, где засела горстка паших бойцов. Разведчик Рябко, с разрешения лейтенанта, пошел навстречу вражескому танку с двумя про- тивотанковыми гранатами в руках. Ма- скируясь в складках местности, он подо- брался вплотную к бронированному чуди- шу и подорвал его. Укрощенный «тигр» остался на месте	vol-5732-page-03-seg-008-0219-3085-0875-3406.png
5732	3	894	588	1556	1325	118	0.95666	Восемнадцать советских воинов во гла- ве с лейтенантом Степаном Гусевым про- чесывали лес. Выйдя к дороге, они уви- дели, что к флангу наших позиций дви- жется немецкая рота с двумя танками. Рас- положив своих бойцов на холмах вдоль дороги, лейтенант Гусев встретил немцев сильным огнем в упор. Значительная часть вражеской роты была сразу же передита, а танковые экипалит, видимо, опешив от неожиданности нападения, по- вернули в лес. Но вскоре немцы оправи- лись и перешли в атану. Она была отби- та. В течение трех часов торстка наших бойцов отразила 11 атак превосходящих сил противника. Последнюю атаку они от- бивали вместе с подошедшей к месту боя нашей ротой, а затем, когда противник, обескровленный потерями, отхлынул, свою очередь дульно атаковали его.	vol-5732-page-03-seg-009-0894-0588-1556-1325.png
5732	3	894	1329	1556	2067	116	0.95637	От разведки было получено сообщение, что по проселочной дороге идет на север колонна помпея в 400 человек с двумя танками. Командир полка решил упичто- унять эту колонну. С этой целью был по- слан батальон гвардейцев. Ночью баталь- он быстро совершил марш через болото и вышел на тыловую дорогу в тот момент, когда вражеская колонна находилась еще в 500 метрах от высланных вперед наших разведчиков. Возле дороги были расстав- лены огневые средства, и когда гитлеров- цы приблизились на 150 метров, их встретил губительный огонь. Стрелки пулеметчики били по пехоте, бропебойщи- по танкач. Вражеская колонна была разгромлена. Сейчас на дороге и по обо- чинам валяется до 300 трупов немецких солдат офицеров. стоят два подбитых тайка, лежит брошенное оружие.	vol-5732-page-03-seg-010-0894-1329-1556-2067.png
5732	3	896	2069	1550	2327	43	0.95893	Разгромив колоппу противника. баталь- он вышел с тыла одному опорному пункту немцев. Это было уже из рассве- те. Связались по родно с частью, которая поступала на этот опорный пункт с фрон- та. Одновременной атакой в лоб и с тыла опорный пункт был взят.	vol-5732-page-03-seg-011-0896-2069-1550-2327.png
5732	3	898	2331	1548	2520	25	0.95609	Мы прибыли в штаб соединения вечером. Штаб разместился в эстоп- ской деревне. Начальник штаба принимал по телефону доклад о продвижении частей. Он рассказал нам следующее:	vol-5732-page-03-seg-012-0898-2331-1548-2520.png
5732	3	898	2521	1554	3404	116	0.95816	Еще одна крепость пала. Несколько дней шли бои за опорный пункт немцев в поселке. Это был не опорный пункт, а скорее крепость. Для обороны немцы при- способили не только каменные дома в по- селке, но даже гранитные памятники на кладбище. Каждый метр земли был здесь укреплен. Трофен взяты такие: шесть зе- нитных орудий, восемь полевых автомати- ческих пушек. двадцать восемь пулемется, много минометов. На подступах опорно- му пункту наши бойцы отбили восемь контратак, каждая силой до батальона с пятью шестью танками. Танки эти и сейчас горят. наступивших сумерках виднелось зарево пожара. Горела немецкая техника, a. еще лалыпе горели эстонские сёла, по- дожженные гитлеровдами. отблесках зарева виднелись очертания большого города. Майор И. ГАГЛОВ. ДЕЙСТВУЮЩАЯ АРМИЯ. (По телеграфу).	vol-5732-page-03-seg-013-0898-2521-1554-3404.png
5732	3	292	3470	1508	3514	4	0.95746	МУЖЕСТВО БАТАЛЬОНА ОФИЦЕРА КУЗИЧЕНКО	vol-5732-page-03-seg-014-0292-3470-1508-3514.png
5732	3	213	3539	879	4118	100	0.97309	3-й УКРАИНСКИЙ ФРОНТ, 1 марта. недавних боях смело и отважно дей- ствовал батальон, которым командует мо- лодой сфицер Кузиченко. Батальону про- тивостоял сильно укрепленный участок обороны немцев, расположенный на вы- сотах. Гитлеровцы держали под сильным обстрелом все подступы к этим высотам- Офицер Кузиченко точно установил распо- ложение огневых точек противника. Сразу же после начала артподготовки он повел своих бойцов на сближение с врагом. Пря- чась от нашего артиллерийского огня, нем- цы глубоко ушла в свои норы. Как только наша артиллерия перенесла огонь в глу- бину обороны противника, гитлеровцы бро- сились к уцелевшим огневым точкам с тем, чтобы помешать приближению советских	vol-5732-page-03-seg-015-0213-3539-0879-4118.png
5732	3	900	3537	1554	3670	19	0.96592	воинов к своему переднему краю. Но было уже поздно. Бойцы офицера Кузиченко ворвались в немецкие окопы. Завязалась рукопашная схватка.	vol-5732-page-03-seg-016-0900-3537-1554-3670.png
5732	3	898	3685	1554	3972	49	0.96414	Бойцы беспощадно истребляли немцев. Рядовые Шестаков и Сезижов уничтожили по 10 гитлеровцев каждый. Когда потре- бовала обстановка, командир батальона вместе с бойцами ворвался в окопы нем- цев и шапкой зарубил 7 гитлеровцев. Не- смотря на быстрый темп наступления сложность обстановки, офицер Кузиченко ни на минуту не терял управления ротами-	vol-5732-page-03-seg-017-0898-3685-1554-3972.png
5732	3	892	3984	1552	4116	18	0.97923	Стремительность действий батальона обеспечила успешное выполнение боевой задачи. Батальон офицера Кузиченко выбил немцев из укреплений и овладел высотами.	vol-5732-page-03-seg-018-0892-3984-1552-4116.png
5732	3	1712	305	2787	371	3	0.93477	На Псковском направлении	vol-5732-page-03-seg-019-1712-0305-2787-0371.png
5732	3	1575	390	2239	750	48	0.94973	ДЕЙСТВУЮЩАЯ АРМИЯ, 1 марта. (По телеграфу от наш. корр. ). Продолжая раз- вивать наступление на Псковском поправ- лепии, наши части за истекшие сутки продвинулись далеко вперед. Занято более 70 населенных пунктов и среди них Невалицы, Большая Малунка. Данева Го- pa, Ореховичи, Олисово, Пересветово, Синицы, железнодорожная станция Ру- саки.	vol-5732-page-03-seg-020-1575-0390-2239-0750.png
5732	3	1575	761	2237	1446	97	0.96111	На одном участке фронта темп продви- жения наступающих особенно стремителен. Он достигнут благодаря тому, что наши части не дают противнику закрепиться и использовать промежуточные оборонитель- ные рубежи. Подвижные отряды, состоял- щие из лыимиков и тапков с десантами автоматчиков, настойчиво преследуют нем- цев, но люзволяя оторваться. Противник пытался закрепиться на ру- беже одной реки и на железнодорожной насыпи. Об этом стало известно нашему командованию. Вперед были высланы лыжные отряды, в задачу которых входи- опередить немцев и захватить перепра- вы через реку. Лыжники отлично выпол- нили свою задачу. Они захватили пере- правы и удержали их до подхода главных сил.	vol-5732-page-03-seg-021-1575-0761-2237-1446.png
5732	3	1615	1454	2239	1490	4	0.92264	Наши части стремительно развивали	vol-5732-page-03-seg-022-1615-1454-2239-1490.png
5732	3	2260	392	2918	723	50	0.95864	наступление. Продолжая продвигаться в ле ред, они в нескольких местах вышли железной дороге Псков--Идрица и пере- резали ее. Все попытки противника контр- атаками сбить наши части с железнодо рожного полотна ни к чему не привели. Контратаки его успеха не имели. Сломив сопротивление немцев, наступающие от- бросили их от железной дороги.	vol-5732-page-03-seg-023-2260-0392-2918-0723.png
5732	3	2258	748	2918	1256	76	0.96526	Успешно действозали также части, по- ступающие с других направлений. Они вышли на оборонительный рубеж немцев, который те готовили в течение долгого времени, и завязали здесь бои. Противник оказывал сильное огневое сопротивление и несколько раз переходил в контратаки. В отличие от прошлых контратак, в которых участвовали небольшие силы, на этот раз немцы бросали в бой батальона пехотье при поддержке танков. контратаки недеше- во стоили немцам, потерявшим изрядное число живой силы и техники, по по дали им результата.	vol-5732-page-03-seg-024-2258-0748-2918-1256.png
5732	3	2258	1275	2914	1487	28	0.95004	В отражении контратак и в подавлении огневых средств противника большую роль играет артиллерия сопровождения. Не- на трудные условия местности, она всё время следует в боевых порядка х пехоты.	vol-5732-page-03-seg-025-2258-1275-2914-1487.png
5732	3	1744	1567	2750	1625	4	0.93606	НАРОДНЫЙ СКАЗ О ВОИНАХ-НОВГОРОДЦАХ	vol-5732-page-03-seg-026-1744-1567-2750-1625.png
5732	3	1577	1646	2239	1833	36	0.95209	Недавно группа народных сказителей по- бывала в гостях у фронтовиков. В состав группы вошли известные сказители А. Е. Суховерхова, А. Е. Рогожникова, Е. И. Чи- чаева, Ф. И. Беззубова, И. Ф. Ковалев и A. П. Новиков.	vol-5732-page-03-seg-027-1577-1646-2239-1833.png
5732	3	1575	1852	2235	2108	40	0.97093	Сказители встретились с бойцами и офи- церами N артиллерийской части, участво- вавшей в боях за Новгород и получившей наименование «Новгородской». Огонь артил- леристов беспощадно сокрушал врага, уничтожал его оборонительные сооружения и прокладывал путь нашей пехоте к стенам древнего русского города.	vol-5732-page-03-seg-028-1575-1852-2235-2108.png
5732	3	1571	2131	2231	2321	27	0.96089	В боях под Новгородом артиллеристы уничтожили большое количество враже- ской техники и свыше 500 гитлеровских солдат и офицеров. Они надавили 16 ар- тиллерийских 14 минометных батарей противника.	vol-5732-page-03-seg-029-1571-2131-2231-2321.png
5732	3	1573	2348	2231	2446	15	0.95552	Славные победы новгородцев вдохновили народных сказителей. Они сложили сказ «Было то под городом под Новгородом».	vol-5732-page-03-seg-030-1573-2348-2231-2446.png
5732	3	2264	1652	2914	1714	9	0.97593	В сказе образно рассказывается о битве за освобождение Новгорода.	vol-5732-page-03-seg-031-2264-1652-2914-1714.png
5732	3	2318	1746	2914	2033	34	0.97519	Тут грянула гроза грозная, От удара, мать сыра-земля вздрогнула Горы крутые пошевелилися, Леса дремучие преклонилися! Волхов река всколыхнулась, Тучи снежные да расходились, Хлопья снежные на землю валилися, Фашистов проклятых осыпали Тут они и подыхали.	vol-5732-page-03-seg-032-2318-1746-2914-2033.png
5732	3	2258	2066	2914	2187	14	0.96599	Заключительные слова сказа говорят с славной победе воинов Красной Армии заслуживших благодарность великого Сталина.	vol-5732-page-03-seg-033-2258-2066-2914-2187.png
5732	3	2291	2225	2770	2254	4	0.93019	Благодарил то великой вождь	vol-5732-page-03-seg-034-2291-2225-2770-2254.png
5732	3	2289	2262	2879	2352	11	0.97587	да рать могучую Он назвал их да почетным званием, да новгородским!	vol-5732-page-03-seg-035-2289-2262-2879-2352.png
5732	3	2258	2385	2908	2448	8	0.97500	Текст сказа перелан народными скази- телями славным воинам-новгородцам.	vol-5732-page-03-seg-036-2258-2385-2908-2448.png
5732	3	1977	2533	2525	2570	2	0.97065	НОВЫЕ КИНОЖУРНАЛЫ	vol-5732-page-03-seg-037-1977-2533-2525-2570.png
5732	3	1575	2595	2237	2987	58	0.95190	B ближайшие дни центральная студия кинохроники выпускает новые киножурналы № 11 и № 12. Киножурнал № 11 (режиссер И. Сеткина) посвящен освобождению доблестными все- сками Красной Армии гор. Ровно и раз- грому немецкой группировки под Никопо- лем. Киножурнал № 12 (режиссер М. Фиде- лева) посвящен празднованию XXVI годов- щины Красной Армии. В номере засняты- торжественное чтение приказа Верховного	vol-5732-page-03-seg-038-1575-2595-2237-2987.png
5732	3	2243	2602	2910	2987	61	0.96558	Главнокомандующего Маршала Советского Союза товарища Сталина в воинских ча- стях, салют в Москве в ознаменование славного юбилея, трудовая вахта тружени- коз тыла в честь Красной Армии. Интересны кадры киножурнала, показы- вающие совместные боевые действия отря- дов советских партизан и частей Красной Армии в боях за освобождение гор. Луги от немецких поработителей. На пленке за- печатлена встреча воинов с населением освобожденного города.	vol-5732-page-03-seg-039-2243-2602-2910-2987.png
5732	3	1629	3993	2877	4078	16	0.94933	ЛЕНИНГРАДСКИЙ ФРОНТ. Район Нарвы. Тяжелая батарея старшего лейтенанта С. Бойкова ведет ночную стрельбу по отступающему противнику.	vol-5732-page-03-seg-040-1629-3993-2877-4078.png
5732	3	2219	4091	2870	4126	5	0.93818	Снимок нашего фотокорр. М. Пригожина	vol-5732-page-03-seg-041-2219-4091-2870-4126.png
5732	3	3027	294	4197	398	4	0.85177	Офицерская учеба в военном	vol-5732-page-03-seg-042-3027-0294-4197-0398.png
5732	3	3449	409	3770	469	1	0.86164	училище	vol-5732-page-03-seg-043-3449-0409-3770-0469.png
