volume_number	page_number	x1	y1	x2	y2	tokens_count	mean_confidence	text	image
5118	4	1125	706	1791	1369	107	0.96147	Плен напомнил палате 0 заявление, которого он сделал 30 августа, определяя позицию правительства по отношению к Германии. Он сказал тогда, что английская политика по отношению Германии после войны должна преследовать две цели. одной стороны, Германия должна быть по- ставлена в условия, при которых для нее было бы невозможным снова вооружиться и возобновить борьбу за господство над свободолюбивыми народами. Они уже до- статочно настрадались от Германии. С дру- гой стороны, столь же важно, чтобы Гер- мания но превратилась в источник беспо- койства для ее соседей и всего мира в ре- зультате экономического краха. Очевидно, что ни одна из этих полей недостижима, пока в Германии продолжает существовать нынешний режим.	vol-5118-page-04-seg-005-1125-0706-1791-1369.png
5118	4	478	1421	1743	1541	9	0.96870	ОБЗОР ДЕЙСТВИЙ АНГЛИЙСКОЙ АВИАЦИИ Выступление Синклера в палате общин	vol-5118-page-04-seg-006-0478-1421-1743-1541.png
5118	4	434	1561	1099	1769	26	0.95518	ЛОНДОН, 5 марта. (ТАСС). Как передает агентство Рейтер, вчера министр авиации Синклер, внеся на утверждение палаты общин проект ассигнований на английские военно-воздушные силы, сделал созор тействий,	vol-5118-page-04-seg-007-0434-1561-1099-1769.png
5118	4	430	1775	1095	3531	260	0.96192	Вначале Синклер напомни. сделанное им год назад в палате общин заявление том, что если противник уситит налеты на Англию, то это приведет лишь к увеличе- нию потерь его ночных бомбардировщиков. Это обещание, заявил Синклер, было пол- ностью выполнено. Синктер заявит далее, что с июня 1941 года английская авиация поставила cene задачу «оказания максимальной помощи русским союзникам в их гигантской борьбе с главными германскими армиями ». На Мальте и в Африке, продолжат Синк- лер, английская авиация вынуждает нем- дев держать в этом районе большое коли- чество истребителей. Эта же сеть дости- гается налетами английских истребителей и бомбардировщиков Северо-Западную Францию, организацией активной патруль- ной службы истребителей, нападениями атг.тайских самолетов на супа противника проливах, на промышленные районы Германии и на объекты на оккупированных территориях, имеющих большое значение для Германии. От этих налетов сильно по- страдали ттольные шахты и предприятия в Бельгии и Северной Франции, работающие на противника. Например, промышленное производство в обширном районе вокруг Лилля в течение 5 месяцев было сокраще- но до 50 проц. обычного уровня вследст- вие повреждений, причиненных электро- саловым станциям. Во время наступатель- ных операций, проводившихся с англий- сках баз, английская авиация уничтожила за последний год 823 истребителя против- нака, потеряв 537 истребителей. Во вза- имодействии с морским флотом авиация фактически закрыла для противника про- лив Па-де-Кале. Истребительная авиация в течение пос- теднето года совершила в целях охраны караванов судов свыше 50 тысяч выле- тов. течение 6 месяцев, предшествовал- них наступлению англичан Ливни, индийская авиация потопила торговые туда противника общим тоннажем в 175 тыс. тонн. Потопление каждого судна 50 танками было существенным вкладом в обеспечение успеха битвы на суше.	vol-5118-page-04-seg-008-0430-1775-1095-3531.png
5118	4	430	3541	1093	3747	31	0.96455	Синклер высоко оценил действия защит- яиков Мальты и заявит, ЧТО на этот остров-крепость днем и ночью обрушивает- ся ярость врата. За последние два месяца на Мальту было совершено 394 воздушных налета,	vol-5118-page-04-seg-009-0430-3541-1093-3747.png
5118	4	426	3753	1095	4063	49	0.95811	Далее Синклер отметил имевшее место за последний год значительное расширение подготовки летного состава авиации. План подготовки летчиков в канаде былолняется на много месяцев раньше срока. Летчиков готовят также школы в Новой Зеландии, Родезаи, Южной Африке. Летчикет, про- шедшие подготовку в Индии, принимают частие в боях с японцами. Летом прош-	vol-5118-page-04-seg-010-0426-3753-1095-4063.png
5118	4	1121	1561	1781	1663	11	0.95622	того года США предоставили в распоряже Англии значительную часть своих авиашкол.	vol-5118-page-04-seg-011-1121-1561-1781-1663.png
5118	4	1105	1665	1783	4065	348	0.95660	Говоря о техническом оснащении ап- глийской авиации, Синклер заявил, что вооружение английских истребителей зна чительно превосходит вооружение сериал- ских истребителей наилучших типов. По- следние модели "Харрикейнов" и "Спит- файеров" фактически являются новыми типами самолетов, подготовляется про пз- водство совершенно новых типов самоле тов небывалой конструкции. Анериканцы посылают в Анталию самолеты повых ти- пов и линпрующие бомбардировщикл. Синклер сказал далее, что германские пикирующие бомбардировщики оказались эффективным оружием только на тех те- атрах военных действий, где противник уже достиг превосходства в воздухе, По- этому немцы за последние два года умель- шили число пикирующий бонбарлировщи- ков в их отношении к числу других бол- бардировщиков. Синклер сообщил, что Ан- вскоре получит Америки пикирую- щие бомбардировщики, качественно превос- ходящие "Юнкерс-87". Появляется все " больше тяжелых бомбардировщиков типа «Стпржинг», «Галифакс». и «Манчестер», также новые более крупные бомбарди- «Ланкастер» наиболее мощ- ные самолеты этого типа. Спиклер сообщил, что в ногу с разви- днем конструкции самолетов идет также усовершенствование конструкций бомб. Вес бомб, сброшенных англичанами в 1941 году, больше веса бомб, сброс- пленных в 1940 году. "Мы намерены, заявил Синклер, --- возобновить воздуш- - ные бомбардировки Германии в максималь- но широких масштабах и по возможности в ближайшее время». Касаясь дальнейших перспектив, Сип- клер заявил, что Гитлер подготовляет ве- сеннее поступление, которое будет опора- шепот против России, "Но, --- сказал Син- клер, не будем стоять стороне. Английская бомбардировочная авиация на- несет сильные удары по жизненным пен- трам германской военной промышленности транспорта. Она не допустит, чтобы про- производство танков, моторов для танков, авиационных моторов и грузовиков осу- ществлялось беспрепятственно только по- тому, что все это производится на окку- пированной территории Францип. Заводы Рено в Бийянкуре близ Парижа особенно обращают на себя внимание в этом отно- нения. В связи с этту прошлой ночью английские бомбардировщики совершили на налет». что Синило сообщил, этот полет прошел успешно, Крупные бол- бы упали па здания завода, которые ру- шились, как карточные домики, и взлета- ли на сотни футов в воздух. Один из пи- вилел, как газохранилище совершп- ло "рекордный полет". Англичане в этой операция потеряли два самолета. В заключение Синклер заявил, что в этом году английская авиация пожнет плоды большого и упорного труда.	vol-5118-page-04-seg-012-1105-1665-1783-4065.png
5118	4	552	4101	1659	4145	5	0.93868	ПОДРОБНОСТИ НАЛЕТА НА ЗАВОДЫ РЕНО	vol-5118-page-04-seg-013-0552-4101-1659-4145.png
5118	4	422	4155	1082	4370	32	0.94667	лондон, 5 марта. (ТАСС). Английское радио приводит подробности, свидетель- ствующие об успешных результатах пале- На английской авиации на заводы Рено в предместье Парижа. Сообщают, что при разрывах тяжелых фугасных бомб в воз-	vol-5118-page-04-seg-014-0422-4155-1082-4370.png
5118	4	1107	4161	1769	4370	31	0.96445	дух взлетали целые заводские здания. Лондонское радио в передаче для Фран- ции отмечает, что этот налет не изменит политики Англии по отношению к Фран- ции и не направлен против французского народа.	vol-5118-page-04-seg-015-1107-4161-1769-4370.png
5118	4	1861	522	2422	732	8	0.93846	«ПРИШЛО ВРЕМЯ ДЛЯ НАСТУПАТЕЛЬНЫХ операций i. ПРОТИВ ВРАГА»	vol-5118-page-04-seg-016-1861-0522-2422-0732.png
5118	4	1897	762	2382	794	3	0.91489	Призыв генерала Маршалла	vol-5118-page-04-seg-017-1897-0762-2382-0794.png
5118	4	1809	818	2474	1771	143	0.96128	5 марта. (TACC). hak co- общает вашингтонский корреспондент агентства Юнайтед Пресс, начальник шта- ба американской армии генерал Маршалл в письме лидеру республиканцев в сенате Остину заявляет, что пришло время для наступательных операций против врага. «Сейчас, - говорится в письме, --- на- ступило время, когда мы не должны до- пускать, чтобы большая часть наших во- оруженных сил и ценных материалов бы- ла иммобилизована в пределах США. Враг, рассчитывая повлиять на общественное мнение США, без сомнения, использует свои подводные лодки около нашего по- бережья с целью ограничить наши воен- ные усилия и отвлечь наши самолеты и сухопутные войска. Кроме того, я счи- таю, что мы должны ожидать изолирован- ных воздушных налетов небольших групп самолетов непосредственно на США целью вызвать такую общественную реак- цию, которая бы неблагоприятно повлияла на основную военную цель защиту Америки путем схваток и разгрома врага на театрах войны, удаленных от наших берегов».	vol-5118-page-04-seg-018-1809-0818-2474-1771.png
5118	4	1807	1821	2458	1909	4	0.95607	реорганизация американских ВООРУЖЕННЫХ СИЛ	vol-5118-page-04-seg-019-1807-1821-2458-1909.png
5118	4	1807	1933	2468	2464	72	0.95995	ВАШИНГТОН, 5 марта. (ТАСС). Руз- вельт отдал приказ с 9 марта провести реорганизацию вооруженных сил. Соглас но этому приказу вооруженные силы раз- деляются на три основные группы сухо путные силы, воздушные силы группа снабжения. Рузвельт предоставил военно- му министру право провести такую реор- ганизацию заморских вооруженных сил, какую он сочтет необходимой. Командую- щим сухопутными силами назначен гене- рал Макнэр, командующим воздушными силами - генерал Арнольд. Начальником группы снабжения назначен генерал Са- мервилл.	vol-5118-page-04-seg-020-1807-1933-2468-2464.png
5118	4	1827	2522	2442	2610	7	0.97103	НОВЫЕ НАЛОГИ НА ВОЕННЫЕ НУЖДЫ В США	vol-5118-page-04-seg-021-1827-2522-2442-2610.png
5118	4	1801	2626	2464	2986	50	0.95920	ВАШИНГТОН, 5 марта. (ТАСС). Министр финансов США Моргентау предложил кон- грессу одобрить введение новых налогов в сумме 9.610 или, долларов на усиление финансирования правительственных воен- ных мероприятий. Он указал, что вместе предложенными новыми налогами общая сумма доходов будет составлять в следую- щем бюджетном году (начинающемся 1 июля) 27 млрд. долларов.	vol-5118-page-04-seg-022-1801-2626-2464-2986.png
5118	4	1879	3062	2376	3154	5	0.97374	МОРСКАЯ БАЗА США ПОБЕРЕЖЬЯ ЭКВАДОРА	vol-5118-page-04-seg-023-1879-3062-2376-3154.png
5118	4	1801	3164	2462	3701	81	0.95241	ВАШИНГТОН, 5 марта. (ТАСС). Испол- няющий обязанности государственного сек- ретаря Уэллес в беседе с представителем печати заявил, что США не имеют мор- ской базы в Эквадоре, однако последнее соглашение между США и Эквадором на основе закона о передаче взаймы или в аренду вооружения предусматривает меры совместной защиты обеих стран. Нью-йорк, 5 марта. (ТАСС). Как со- общает корреспондент агентства Ассоши- эйтед Пресс из (Эквадор), президент Арройо Дель Рио заявил, что Эквадор раз- решил США создать морскую базу при входе в Тваяквильский залив.	vol-5118-page-04-seg-024-1801-3164-2462-3701.png
5118	4	1869	3781	2386	3885	4	0.95762	ГИТЛЕРОВЦЫ НАСИЛЬСТВЕННО Гармонизируют эстонию	vol-5118-page-04-seg-025-1869-3781-2386-3885.png
5118	4	1795	3901	2460	4366	61	0.95966	ЛОНДОН, 5 марта. (ТАСС). По госту- пившим сюда сведениям, гитлеровны про- родят во временно оккупированной Эстонской ССР насильственную горманиза цию. В известном Тартуском университете все преподаватели и профессора-эстонцы изгнаны и заменены немцами. Все местные банки закрыты и заменены отделениями Дрезденского и Ганзейского банков. Насе ление непрерывно полытиется на принушк тельные работы. Приведены массовые аре- сты. Арестовываются все заподозренные в антигитлеровских настроениях.	vol-5118-page-04-seg-026-1795-3901-2460-4366.png
5118	4	2756	514	3547	556	4	0.92089	ВРУТ, «КАК НА ПОКОЙНИКОВ	vol-5118-page-04-seg-027-2756-0514-3547-0556.png
5118	4	2870	578	3825	726	25	0.95559	Германское информационное бюро 2 марта опублико- вало несусветную чушь о мифических победах немецкой авиадесантной дивизии, давно разбитой нашими войсками на Ленинградском фронте. Рис. Бор. Ефимова.	vol-5118-page-04-seg-028-2870-0578-3825-0726.png
5118	4	2644	2081	3693	2161	3	0.90365	Война на океане	vol-5118-page-04-seg-029-2644-2081-3693-2161.png
5118	4	2536	2184	3108	2222	2	0.97974	АМЕРИКАНСКИЕ СООБЩЕНИЯ	vol-5118-page-04-seg-030-2536-2184-3108-2222.png
5118	4	2494	2234	3154	2518	39	0.95545	НьЮ-ЙОРК, 5 марта. (ТАСС). В ком- мюнике военного министерства США сооб щается, что воздушные силы, имеющиеся в распоряжении командующего американ- скими войсками на Батаанском полуостро ве (Филиппины), атаковали японские су- в заливе Субики и серьезно повредили несколько японских судов.	vol-5118-page-04-seg-031-2494-2234-3154-2518.png
5118	4	2564	2550	3082	2582	2	0.97556	английские сообщения	vol-5118-page-04-seg-032-2564-2550-3082-2582.png
5118	4	2494	2598	3154	2810	30	0.95354	ЛОНДОН, 5 марта. (ТАСС). В коммю- нике английского командования в Бирис указывается, что японские войска форси- ровали реку Ситтанг. Английские патрули находятся в соприкосновении с японскими войсками в районе северо-восточнее	vol-5118-page-04-seg-033-2494-2598-3154-2810.png
5118	4	2526	2838	3122	2924	4	0.97463	сообщения командования голландской индии	vol-5118-page-04-seg-034-2526-2838-3122-2924.png
5118	4	2492	2936	3154	3150	34	0.95784	БАТАВИЯ, 5 марта. (ТАСС). В коммю нике командования Голландской Индии указывается, что на острове Ява повсе- местно идут бои с японскими войсками. В связи с тем, что японские войска приме- няют тактику просачивания, определить	vol-5118-page-04-seg-035-2492-2936-3154-3150.png
5118	4	3184	2188	3847	2360	26	0.95644	постоянную линию фронта совершенно не возможно. Трудно также дать ясную кар тину положения на фронте. Японские вой- ска имеют численное превосходство и бес прерывно продвигаются вперед.	vol-5118-page-04-seg-036-3184-2188-3847-2360.png
5118	4	3182	2370	3849	2750	55	0.94850	Несмотря на героизм войск Голландской Индии, японцам удалось занять Соло Восточной части Явы) и несколько дру- гих пунктов. Господство японцев в возду- хе способствовало их успеху. В западной части острова войска Гол- ландской Индии эвакуировали Караван Тангеранг, которые заняты противником. Вчера утром 60 бомбардировщиков ата- ковали аэродром вблизи Бандунга. Разру - шения незначительные. Убитых нет.	vol-5118-page-04-seg-037-3182-2370-3849-2750.png
5118	4	3281	2784	3747	2816	2	0.98095	японские сообщения	vol-5118-page-04-seg-038-3281-2784-3747-2816.png
5118	4	3178	2832	3841	3148	46	0.95431	ТОКИО, 5 марта. (ТАСС). По официаль ным сведениям, японские войска на Фи- липпинах 2 марта заняли город Замбонта в юго-западной части острова Минданао На острове Ява крупное соединение япон- ской авиации бомбардировало аэродром Бандунге, причинив серьезные поврежде- ния военным объектам. Японские войска достигли пункта вблизи Батавин.	vol-5118-page-04-seg-039-3178-2832-3841-3148.png
5118	4	2874	3206	3441	3242	2	0.97855	японо-китайская война	vol-5118-page-04-seg-040-2874-3206-3441-3242.png
5118	4	2490	3266	3152	3401	22	0.94722	В провинции Чжэцзян китайские войска успешно атаковали японские гарнизоны в городах Юхан и Фуян (западнее Ханчжоу) В провинции Хубэй китайские войска пред-	vol-5118-page-04-seg-041-2490-3266-3152-3401.png
5118	4	3174	3266	3837	3401	24	0.95203	приняли внезапную атаку на японские по зиции в районе Даняна. В результате бо- ев, которые длились несколько дней, япон- мы вынуждены были отойти. (TACC).	vol-5118-page-04-seg-042-3174-3266-3837-3401.png
5118	4	2848	3473	3481	3527	3	0.91972	Сражение за яву	vol-5118-page-04-seg-043-2848-3473-3481-3527.png
