volume_number	page_number	x1	y1	x2	y2	tokens_count	mean_confidence	text	image
5446	1	2932	5341	3598	5589	43	0.96166	B числе получивших награды майор H. Д. Карасев, полковник И. И. Внуков генерал-майор авиации Г. Г. Гурьянов, ге- нерал лейтенант авиации Н. С. Скрипко полковник А. Р. Бурлыга, гвардии генерал- майор авиации Е. Ф. Логинов. От имени награжденных выступил подполковник А. И. Лаптев.	vol-5446-page-01-seg-076-2932-5341-3598-5589.png
5446	1	2932	5604	3594	5795	33	0.96315	Награды за доблесть и мужество, прояв ленные в партизанской борьбе против не мецко-фашистских захватчиков, получают партизаны А. Ф. Гаврилюк, В. Ф. Кононов A. Я. Коржень, А. С. Ничипоренко, В. М Фролов и др.	vol-5446-page-01-seg-077-2932-5604-3594-5795.png
5446	1	2926	5802	3594	5997	26	0.96413	Орден Трудового Красного Знамени че рез представителей получает московский завод "Компрессор" Наркомата минометно го вооружения, награжденный за образцо- вое выполнение заданий правительства по производству специального вооружения.	vol-5446-page-01-seg-078-2926-5802-3594-5997.png
5446	1	3615	4940	4292	5997	179	0.96436	Принимая высокую награду, директор за- вода Б. М. Киселев заверил правительство и паргию, что коллектив орденоносного за- вода приложит все силы для того, чтобы давать Красной Армии еще больше воору- жения и тем помочь в ее борьбе против ненавистного врага. За образцовое выполнение заданий пра- вительства по производству специального вооружения ордена и медали были вруче- ны большой группе рабочих-стахановцев, инженерно-технических работников, дирек- торов предприятий. В числе награжденных Народный Комиссар минометного вооруже- ния П. И. Паршин, его заместитель М. Н. Сулоев, главный конструктор В. П. Бармин и др. Ордена и медали за отличное выполне- ние заданий правительства и военного командования были вручены также генерал- майору авиации Н. А. Журавлева, капита- ну 2 ранга А. Т. Караваеву, главному ре- визору Центрального управления паровоз- ного хозяйства НКПС А. С. Огневу, А. С. Черному и др. Тов. И. Я. Варес после вручения орде- нов и медалей обратился к награжденным с краткой речью. В заключение тов. Варес сердечно поздравил получивших награды товарищей и пожелал им дальнейших успе- хов в общей борьбе против немецких за- хватчиков - на полях сражений и на тру- довом фронте.	vol-5446-page-01-seg-079-3615-4940-4292-5997.png
5446	2	2057	192	2354	223	2	0.73462	на я	vol-5446-page-02-seg-001-2057-0192-2354-0223.png
5446	2	3605	181	4295	219	8	0.88656	31 марта 1943 г., среда № 75 (5446)	vol-5446-page-02-seg-003-3605-0181-4295-0219.png
5446	2	334	293	1147	404	10	0.96336	МОСКВА, КРЕМЛЬ ТОВАРИЩУ С Т А Л И Н У	vol-5446-page-02-seg-004-0334-0293-1147-0404.png
5446	2	228	417	1238	969	109	0.94328	Дорогой Иосиф Виссарионович! Ваш привет и благодарность Красной Армии трудящимся Иркутской области вызвали у горняков Ленских золотых при- исков, Мамских слюдяных рудников, колхозников, колхознии Бодайбинского района новую волну патриотических чувств к нашей любимой Родине, героической Красной Армии. В лопол- не ние к ранее внесенным на постройку вооружения для крас- ной Армии 3.028.000 рублей леньтами и 5 килограммов золота трудящиеся района собрали и внесли в Госбанк 643.000 руб- лей и 2:666 граммов золота. Наступление средств продолжается. Пусть боевая техника, построенная на наши средства, помо- жет Красной Армии разгромить и изгнать гитлеровских варва- из пределов нашей Родины. Шлем Вам, дорогой Изсиф Виссарнонович, сердечный привет 11 пожелания доброго здоровья на долгие годы.	vol-5446-page-02-seg-005-0228-0417-1238-0969.png
5446	2	429	985	1189	1021	3	0.93574	Секретарь Бодайбинского ЧУКАН03	vol-5446-page-02-seg-006-0429-0985-1189-1021.png
5446	2	228	1056	1229	1151	13	0.96120	СЕКРЕТАРЮ БОДАЙБИНСКОГО РАЙКОМА ВКП(б товарищу Ч У К А Н О В У	vol-5446-page-02-seg-007-0228-1056-1229-1151.png
5446	2	225	1170	1230	1406	38	0.94151	Передайте трудящимся Бодайбинского района, со- бравшим, кроме ранее внесенных 3.028.000 руб. лей деньгами и 5 килограммов золота, дополнительно 643.000 рублей деньгами и 2.666 граммов золота на строительство вооружения для Красной Армии, мой братский привет и благодарность Красной Армии.	vol-5446-page-02-seg-008-0225-1170-1230-1406.png
5446	2	883	1420	1187	1452	3	0.86760	И. СТАЛИ Н.	vol-5446-page-02-seg-009-0883-1420-1187-1452.png
5446	2	321	1516	1126	1610	4	0.95810	МОСКВА, КРЕМЛЬ товарищу сталину	vol-5446-page-02-seg-010-0321-1516-1126-1610.png
5446	2	219	1631	1225	2140	98	0.95699	Дорогой Посиф Виссарионович! Преисполненные великой радостью п охваченные огромным трудовым под'смом при известно о присуждении налему кол- лективу геологов-нефтяников Сталинской премии в размере сто тысяч рублей за исследование и освоение новых нефтеносных месторождений, мы приносим глубокую благодарность нашему правительству и лично Вам гениальному полководец и вели- кому вождю за внимание и отеческую заботу. Мы прилож из все свои силы и знания к открытию еще новых нефтеносных месторождений в нашей стране. Охваченные могучим желанием усилить мощь нашей героп- ческой Красной Армии и приблизить час окончательного разгро- ма немецко-фашистских варваров, мы полностью вносим свою премию в Особый фонд Главного Командования.	vol-5446-page-02-seg-011-0219-1631-1225-2140.png
5446	2	257	2253	363	2291	1	0.90558	БАКУ	vol-5446-page-02-seg-012-0257-2253-0363-2291.png
5446	2	376	2157	1177	2236	16	0.93063	Геологи А. А. АЛИ-ЗАДЕ, В. С. МЕЛИК-ПАШАЕВ E. Я. ДМИТРИЕВ, Г. П. ОВАНЕСОВ, А. Н. КОРНЕВ	vol-5446-page-02-seg-013-0376-2157-1177-2236.png
5446	2	257	2306	678	2344	1	0.97363	АЗНЕФТЕКОМБИНАТ	vol-5446-page-02-seg-014-0257-2306-0678-2344.png
5446	2	266	2355	1168	2507	17	0.93725	ГЕОЛОГАМ товарищам А. А. АЛИ-ЗАДЕ, B. С. МЕЛИК-ПАШАЕВУ, Е. Я. ДМИТРИЕВУ Г. П. ОВАНЕСОВУ, А. Н. КОРНЕВУ.	vol-5446-page-02-seg-015-0266-2355-1168-2507.png
5446	2	211	2529	1219	2679	22	0.93293	Примите мой привет и благодарность Красной Армии, товарищи Али-Заде, Мелик-Пашаев, Дмитриев Аванесов, Корнев, за вашу заботу о вооруженных си- лах Советского Союза.	vol-5446-page-02-seg-016-0211-2529-1219-2679.png
5446	2	879	2686	1179	2717	2	0.76248	СТАЛИ Н.	vol-5446-page-02-seg-017-0879-2686-1179-2717.png
5446	2	313	2785	1119	2879	10	0.94447	МОСКВА, КРЕМЛЬ ТОВАРИЩУ С Т А Л И Н У	vol-5446-page-02-seg-018-0313-2785-1119-2879.png
5446	2	213	2900	1215	3342	83	0.94038	Дорогой Иосиф Виссарионович! С огромной радостью узнал я о присуждении мне премии Вашего имени. Не нахожу слов, чтобы выразить глубокую благо- дарность Правительству и Вам, Иосиф Виссарионович, за высо- кую оценку моей работы. Награда побуждает меня работать еще лучше. Обещаю Вам весь свой опыт, все свои силы, всю свою жизнь отдать на победу и славу нашей великой Родины. Прошу Вас принять от меня в фонд Главного Командования всю причитающуюся мне премию. Желаю Вам, любимый Иосиф Виссарионович, здоровья и сил на долгие, долгие годы.	vol-5446-page-02-seg-019-0213-2900-1215-3342.png
5446	2	308	3344	1168	3573	23	0.93484	Искренне преданный Вам главный металлург Нарномтяжмаша Н. А: ШАМИН ГЛАВНОМУ МЕТАЛЛУРГУ НАРКОМАТА ТЯЖЕЛОГО МАШИНОСТРОЕНИЯ тов. Н. А. Ш А М И Н У	vol-5446-page-02-seg-020-0308-3344-1168-3573.png
5446	2	211	3596	1213	3707	18	0.91198	Примите мой привет и благодарность Красной Армии, Николай Алексеевич, за Вашу заботу о воору- женных силах Советского Союза.	vol-5446-page-02-seg-021-0211-3596-1213-3707.png
5446	2	869	3721	1172	3753	7	0.88388	И. С Т А Л И Н.	vol-5446-page-02-seg-022-0869-3721-1172-3753.png
5446	2	281	3813	1130	4070	8	0.96835	ВЕРХОВНОМУ ГЛАВНОКОМАНДУЮЩЕМУ МАРШАЛУ СОВЕТСКОГО СОЮЗА ИОСИФУ ВИССАРИОНОВИЧУ СТАЛИНУ	vol-5446-page-02-seg-023-0281-3813-1130-4070.png
5446	2	207	4095	1208	4314	37	0.94775	Дорогой Иосиф Виссарионович! Всякий советский гражданин считает своим священным дол- гом и величайшим счастьем отдавать все свои силы на служе- ние своей Родине, на служение тому делу, которым руководит величайший человек современности --- Вы, Иосиф Виссарионо- вич!	vol-5446-page-02-seg-024-0207-4095-1208-4314.png
5446	2	207	4320	1210	4424	18	0.92151	После напряженной 50-летней работы я вновь нахожу вдох- новение в гении, ведущем пашу доблестную Красную Армию к победе.	vol-5446-page-02-seg-025-0207-4320-1210-4424.png
5446	2	204	4428	1206	4572	27	0.94514	Позвольте мне присужденную премию Вашего имени в раз- мере 200.000 рублей вручить Вам в фона восстановление эвакогоспиталей и здравоохранения в местах, освобожденных Красной Армией от фашистских захватчиков.	vol-5446-page-02-seg-026-0204-4428-1206-4572.png
5446	2	283	4589	1166	4660	9	0.91035	Лауреат Сталинской премии заслуженный деятель науки академик М. АВЕРБАХ,	vol-5446-page-02-seg-027-0283-4589-1166-4660.png
5446	2	200	4687	1202	4974	43	0.93751	ЗАСЛУЖЕННОМУ ДЕЯТЕЛЮ НАУКИ АКАДЕМИКУ тов. М. И. А В Е Р Б А Х Примите мой привет и благодарность Красной Ар- мии, Михаил Иосифович, за Вашу заботу о восстано влении эвакогоспиталей и органов здравоохранения в районах, освобожденных Красной Армией от немец- ких захватчиков.	vol-5446-page-02-seg-028-0200-4687-1202-4974.png
5446	2	1289	298	2257	470	7	0.97732	МОСКВА, КРЕМЛЬ ПРЕДСЕДАТЕЛЮ СОВНАРКОМА СССР ТОВАРИЩУ СТАЛИНУ	vol-5446-page-02-seg-030-1289-0298-2257-0470.png
5446	2	1272	487	2274	710	42	0.94944	Дорогой Иосиф. Виссарионович! Больная радость сегодня в моей жизни -- знать, что моя скромная многолетняя работа принесла пользу Родине. Благо- даря поддержке партии и правительства, с помощью всего кол- лектива нашего совхоза инс удалось создать новое стадо отече- ственного высокопродуктивного молочного скота.	vol-5446-page-02-seg-031-1272-0487-2274-0710.png
5446	2	1268	718	2272	971	49	0.94783	Глубоко воодушевленный высокой наградой Правительства - присуждением премии Вашего имени, обещаю Вам и дальше отдавать все свои силы и поет дальнейшему развитию социа листического животноводства. Вношу г. Особый фонд Главного Командования мою премию в сумме 100.000 рублей и прошу разрешить построить самолст. назвав его именем народного героя "Иван Сусанин".	vol-5446-page-02-seg-032-1268-0718-2272-0971.png
5446	2	1268	977	2267	1049	13	0.93546	желаю Вам, дорогой Иосиф Виссарионович, здравствовать дол- гис годы на благо нашей Родины.	vol-5446-page-02-seg-033-1268-0977-2267-1049.png
5446	2	1529	1064	2231	1179	9	0.92562	Старинный зоотехник племсовхоза "Карачаево" Ярославской области ШТЕЙМАН Станислав Иванович.	vol-5446-page-02-seg-034-1529-1064-2231-1179.png
5446	2	1268	1223	2261	1374	10	0.96233	СТАРШЕМУ ЗООТЕХНИКУ ПЛЕМСОВХОЗА «КАРАВАЕВО» ЯРОСЛАВСКОЙ ОБЛАСТИ товарищу ШТЕЙМАН СТАНИСЛАВУ ИВАНОВИЧ	vol-5446-page-02-seg-035-1268-1223-2261-1374.png
5446	2	1266	1397	2265	1552	23	0.91553	Примите мой привет и благодарность Красной Ар- мии, Станислав Иванович, за Вашу заботу о воздуш ных силах Красной Армии. Ваше желание будет исполнено.	vol-5446-page-02-seg-036-1266-1397-2265-1552.png
5446	2	1259	1663	2234	1890	14	0.97364	МОСКВА, КРЕМЛЬ ПРЕДСЕДАТЕЛЮ ГОСУДАРСТВЕННОГО КОМИТЕТА ОБОРОНЫ ТОВАРИЩУ С Т А Л И Н У	vol-5446-page-02-seg-038-1259-1663-2234-1890.png
5446	2	1257	1911	2261	2637	146	0.94596	Наш любимый и родной Иосиф Виссарионович! этих скупых строках трудно полностью выразить огром- ную благодарность, которую мы шлем Вам за высокую оценку нашей скромной работы. Нет ничего почетнее для советского инженера, мастера получить такую высокую награду, особенно в грозные дни отечественной войны, за выполнение своего долга перед Родиной, как премию Вашего имени. Только в па- шей стране, благодаря Вашему дурдому водительству, честная работа каждого трудящегося, направленная на благо Родины, развитие науки, техники и искусства, не может остаться неза- меченной. Полученная награда воодушевляет нас трудиться еще энергичней, с полной отдачей сил и знания на благо любимой Родины для скорейшего и полного разгрома фашистской грабь- армии. Заверяем Вас, Иосиф Виссарионович, что мы неустанно будем развивать рационализаторскую и изобретательскую работу в области увеличения производства стали других отраслей народного хозяйства, необходимых нашей славной Красной Армии для ускорения ее победы над злейшим и ненавистным врагом всего свободолюбивого, прогрессивного человечества немецким фашизмом.	vol-5446-page-02-seg-039-1257-1911-2261-2637.png
5446	2	1257	2647	2257	2753	17	0.93760	Просим из причитающейся нам премии перечислить в фонд обороны на усиление вооружения героической Красной Армии 25.000 рублей.	vol-5446-page-02-seg-040-1257-2647-2257-2753.png
5446	2	1255	2754	2255	2858	18	0.93262	Горячо желаем Вам, напе дорогой вождь и учитель, сил здоровья на счастье и радость трудящихся пашей великой Родины.	vol-5446-page-02-seg-041-1255-2754-2255-2858.png
5446	2	1314	2866	2219	3051	21	0.93473	Заместитель начальника ремонтного цехКузнецкого завода имени Сталина инженер УРАЛЬСКИЙ Леон Яковлевич Мастер ремонтного цеха Кузнецкого завода имени Сталина ДМИТРИЕНКО Иван Иванович	vol-5446-page-02-seg-042-1314-2866-2219-3051.png
5446	2	1255	3091	2251	3361	28	0.97323	заместителю начальника ремонтного ЦЕХА КУЗНЕЦКОГО ЗАВОДА ИМЕНИ СТАЛИНА ИНЖЕНЕРУ тов. Л. Я. У Р А Л С К О М У МАСТЕРУ РЕМОНТНОГО ЦЕХА КУЗНЕЦКОГО ЗАВОДА ИМЕНИ СТАЛИНА	vol-5446-page-02-seg-043-1255-3091-2251-3361.png
5446	2	1442	3365	2064	3409	13	0.92338	тов. И. И. Д М И Т Р И Е Н К О	vol-5446-page-02-seg-044-1442-3365-2064-3409.png
5446	2	1253	3429	2251	3577	26	0.92272	Примите мой привет и благодарность Красной Армии, Леон Яковлевич и Иван Иванович, за Вашу заботу о вооружении Красной Армии. И. С Т А Л И Н.	vol-5446-page-02-seg-045-1253-3429-2251-3577.png
5446	2	1297	3654	2168	3859	9	0.96173	москва, кремль НАРКОМУ ОБОРОНЫ МАРШАЛУ СОВЕТСКОГО СОЮЗА ТОВАРИЩУ СТАЛИНУ	vol-5446-page-02-seg-046-1297-3654-2168-3859.png
5446	2	1242	3879	2246	4496	125	0.95026	Дорогой Иосиф Виссарионович! Глубоко взволнованный присуждением мне сталинской пре- мии, я хочу выразить Вам, нашему гениальному полководцу свою бесконечную благодарность за ту отеческую заботу, кото- рую вы неустанно проявляете по отношению к работникам со ветской науки и искусства. Столь высокая почетная награда. увенчавшая мои скромные заслуги перед страной, ко многому обязывает меня, как работника советской медицины и граждани- на нашей великой Родины. Я счастлив, что являюсь полезным для своей страны, восстанавливая здоровье возвращая в строй доблестных советских воинов. Я прошу присужденную мне премию в размере 100 тысяч рублей передать в фонд главнокомандующего для еще большего усиления мощи нашей доблестной Красной Армии. Заверяю Вас, дорогой товарищ Сталин, что я до последнего биения сердца буду служить своей Родине и советскому народу, героически борющемуся против нашествия фашистских варваров.	vol-5446-page-02-seg-047-1242-3879-2246-4496.png
5446	2	1843	4502	2204	4543	2	0.92555	Мустафа ТОПЧИБАШЕВ	vol-5446-page-02-seg-048-1843-4502-2204-4543.png
5446	2	1298	4579	2182	4838	23	0.96275	ЗАСЛУЖЕННОМУ ДЕЯТЕЛЮ НАУКИ АЗЕРБАЙДЖАНСКОЙ ССР ПРОФЕССОРУ АЗЕРБАЙДЖАНСКОГО МЕДИЦИНСКОГО ИНСТИТУТА товарищу Т О П Ч И Б А Ш Е В У МУСТАФА АГАБЕК	vol-5446-page-02-seg-049-1298-4579-2182-4838.png
5446	2	1240	4857	2242	5006	19	0.91545	Примите мой привет и благодарность Красной Армии, товарищ Топчибашев, за Вашу заботу о Крас: ной Армии. И. СТАЛИ Н.	vol-5446-page-02-seg-050-1240-4857-2242-5006.png
5446	2	2346	304	4305	440	4	0.96166	Использование подвижности та танков	vol-5446-page-02-seg-051-2346-0304-4305-0440.png
