volume_number	page_number	x1	y1	x2	y2	tokens_count	mean_confidence	text	image
4967	3	3697	1078	4361	1743	93	0.95252	На героизм и усилия этих наших се- стер, на огромные жертвы, приносимые народами Советского Союза и Великобри- тании, надо ответить неограниченной под- держкой их со стороны всех народов зем- ного шара, всяческой помощью и соли- дарностью со стороны женщин великого американского континента. Пусть каждая женщина сможет с гор- достью заявить в день победы над гитле- ровской гадиной: Я помогла уничтожению злейшего врага человечества; я способствовала сво- ими усилиями уничтожению цепей! Я вы- полнила свой долг женщины и матери, бо- рясь против кровавого гитлеризма, унич- тожающего женщину, ввергающего наро- ды в рабство и смерть!	vol-4967-page-03-seg-038-3697-1078-4361-1743.png
4967	3	3685	1759	4355	3080	179	0.94900	Митинг прошел исключительных подъемом. В зале часто раздавались воз- гласы приветствий в честь доблестной Красной Армии, Советского Правительства, товарища Сталина, в честь славных совет- ских патриотов и патриоток и всех са- моотверженных борцов единого антигитле- ровского фронта народов. На митинге были зачитаны приветствия от женщин Соединенных Штатов Амери- ки, Англии и Швеции. Участницы митин- га встретили их бурными аплодисментами, горячо приветствуя эти новые проявления солидарности и единства всего передового человечества, ведущего борьбу против фа- шистского варварства. В заключение митинга единодушно при- нимается обращение к женщинам всего мира. Боевым призывом к активной борь- бе за свободу, независимость и честь зву- чит этот документ, выражающий мысли и думы десятков миллионов женщин матерей, жен, сестер, дочерей. Этот при- зыв воодушевит советских патриоток на еще более самоотверженную работу на благо родины, для укрепления ее сборон- ной мощи, для помощи Красной Армии. Этот призыв будет услышан и женщинами в странах, задавленных гитлеровским са- погом. Призывные слова обращения дойдут через моря и океаны к женщинам Англии и Америки, к женщинам всех стран мира. Они зовут к священной борьбе против злейшего врага человечества --- против гитлеризма.	vol-4967-page-03-seg-039-3685-1759-4355-3080.png
4967	3	3689	3082	4341	3156	8	0.93829	Выступления участников митинга транс- лировались по радпо. (ТАСС).	vol-4967-page-03-seg-040-3689-3082-4341-3156.png
4967	3	3310	3182	4037	3391	4	0.97961	К женщинам всего мира!	vol-4967-page-03-seg-041-3310-3182-4037-3391.png
4967	3	3000	3417	3663	3999	79	0.94664	вам, независимо от ваших политиче ских убеждений, религиозных верований социального положения, обращаемся мы имени миллионов советских женщин. Перед лицом общей опасности, угро- жающей всему цивилизованному человече- ству, мы обращаемся вашему чувств и разуму. Изверг Гитлер, заливший кровью Евро- пу, ведет войну не только против Совет- ского Союза и Великобритании. Он хочет поработить все свободолюбивые народы Европы и Америки. Фашистские орды Гипера не знают ни веры, ни закона, ни права, ни морали, ни чести. Они зна ют лишь одно: убивать.	vol-4967-page-03-seg-042-3000-3417-3663-3999.png
4967	3	2986	4005	3657	5100	163	0.95815	Гитлер внушил своим ордам --- этих отбросам человечества, ЧТО ОНИ--«выс. шая раса», призванная господствовать на всеми нациями и народами. Он посадил выдрессированных им зверей на моторы танки и самолеты и приказал им громпте одну страну за другой. С неслыханной кровавой жестокостью выполняют эти зве ero приказ. Они разрушают мирные города, превращают в пепелища селения... Они убивают женщин и детей. На глазах обезумевших жен и дочерей они пытают и уничтожают их мужей и отцов. Они го- няются на самолетах за беженцами, рас- стреливая их с воздуха. Они выкалывают пленным глаза и добивают раненых. Немецким солдатам разрешают, в на- граду за совершенные злодеяния, грабить частные дома и насиловать женщин, де вушек и подростков. Женщины матери, жены и сестры. Гитлеризм самый злейший враг жен- шин всего мира! Неизмеримы страдания женщин в ок- купированных фашизмом странах. Там, где прошла нога фашистских бандитов, - повсюду плач и стенания женщин. Фа- шистские злоден не только обесчестили сотни тысяч женщин и девушек, но и за- разили их дурными болезнями. Сколько	vol-4967-page-03-seg-043-2986-4005-3657-5100.png
4967	3	2981	5108	3655	5667	79	0.95524	загнали они в публичные дома, сколько жизней разбили они и сколько самоубийств посеяли в окровавленной ими Польше! Женщины Франции никогда не знали более черных дней. Гитлер отнял у них мужей и братьев, у их детей фашистская солдатчина отняла последний кусок хлеба последнюю каплю молока. Чье материнское сердце не сожмется от боли при виде ужасающей смертности де- тей во Франции, Бельгии, Голландии других оккупированных странах? Бездом- ные и голодные бродят по дорогам Греции и Югославии матери с детьми, побираясь подаянием.	vol-4967-page-03-seg-044-2981-5108-3655-5667.png
4967	3	2976	5673	3641	6285	84	0.96022	Опьяненные кровью, орды фашистских варваров глумятся над религиозными чув- ствами женщин - католичек и протестан- ток, оскверняя храмы и грабя церковнюк утварь. Нельзя передать словами того, что чи- нят фашистские злоден с женщиной в временно захваченных ими районах Совет- ской страны. садизму нет предела. Эти подлые трусы гонят впереди себя жен- щин, детей и стариков, чтобы укрыться от огня Красной Армии. Изнасилованным ими жертвам они вспарывают животы, вы- резают груди, они давят их машинами, разрывают танками. Слушайте, сестры, 0 кровавых пре- ступлениях немецко-фашистских мерзав	vol-4967-page-03-seg-045-2976-5673-3641-6285.png
4967	3	3675	3413	4337	3769	51	0.95749	цев! В украинском селении они изнаси- ловали Евгению Пазур, затем отрезали груди и натерли израненное тело солью. На глазах матерей они пытают п уби- вают малолетних детей. B белорусско: деревне озверелый немецкий солдат изби. прикладом мальчика Сашу Сергуна. Обез- умевшая мать пыталась телом своим за- щитить мальчика. Ее закололи вместе сыной	vol-4967-page-03-seg-046-3675-3413-4337-3769.png
4967	3	3653	3775	4335	6207	376	0.95059	В самой Германии у немецких лотерея Гитлер украл детей, превратив их в банд озверелых убийц и преступников. Порт- ванную немецкую женщину он низвел до унизительного положения рабыни. Мен- шина B гитлеровской Германии - ЭТС машина для производства солдат. Гитле- ровское государство обращается с ней, каб хозяин стада со скотиной, дающей приплод Женщина-мать! К тебе взывает кровь де- тей, убитых в Варшаве и растерзанных Бресте! Вчера фашистские самолеты бох- били детей в Пандоке, Pare и Пскове, завтра они будут пытаться уничтожить детей в Нью-Парке. Невесты и жены! Фашизм отнимает у вас семью и любовь, он истребляет ваших мужей, женихов и братьев. Во имя свободы ваших народов, во счастья ваших детей вставайте все на священную войну с гитлеризмом. Не сломить фашистским извергам муже- ства советской женщины. Рука об руку с красной Армии ii, принявшей на себя глав- ную тяжесть удара гитлеровских полчищ, непоколебимо стоит советская женщина на своем посту. Чем больше свирепствует враг, тем крепче ее сердце п воля к побе- де. На передовых позициях она оказывает помощь раненым. Она тушит пожары, вы- званные (фашистскими летчиками. Она стоит у станка, производя оружие и сна- ряды. Она дерется в партизанских отрядах вместе с мужем и сыном. Ее мысли, ее волю выразила простая русская мать, Мар- фа Никифоровна Заболотная, написавшая своему сыну-красноармейцу: «Благослов- ляю тебя гневом моего отечества». Лозунгом советских женщин в борьбе гитлеровским зверьем стал КЛИЧ - кровь за кровь! Смерть за смерть! женщины всего мира! Дорогие сестры! От нас самих зависит наша свобода, судьба любимых детей, братьев, женихов, мужей! Сейчас не время для слез. Только упорная и ожесточенная война с фашиз- мом до полной победы над гитлеровцами спасет наши народы и наши семьи от раб- ства и позора. Красная Армия ведет героические битвы за свободу и счастье всего человечества. Сейчас на полях сражений Советского Союза решается будущее всего мира. В боях под Смоленском и на Днепре ре- шается судьба Лондона и Парижа, Варша- вы и Роттердама. Женщины Польши. Чехословакии, Фран- ции, Югославии, Румынии, Норвегия других оккупированных германским фашиз- стран! Мы зовем вас на борьбу за ва- шу родину, за честь, за жизнь ваших де- тей, за ваши домашние очаги. Будьте вер- ными помощниками своих отцов, мужей п братьев в священной войне против гитле- ровских налачей! Не миритесь с городом! Требуйте хлеба, одежды и угля у ограбивших вас прете-	vol-4967-page-03-seg-047-3653-3775-4335-6207.png
4967	3	3797	6251	4163	6283	4	0.91157	Окончание на 4 стр	vol-4967-page-03-seg-048-3797-6251-4163-6283.png
4967	4	2374	446	2628	482	3	0.95668	3 В Е	vol-4967-page-04-seg-001-2374-0446-2628-0482.png
4967	4	3571	428	4317	474	8	0.92674	9 сентября 1941 г., вторник. № 212 (4967)	vol-4967-page-04-seg-002-3571-0428-4317-0474.png
4967	4	1307	448	4359	504	15	0.92090	P A H A 3 B E 3 Д А сентября 1941 г., вторник. 212	vol-4967-page-04-seg-003-1307-0448-4359-0504.png
4967	4	502	560	1419	638	3	0.94326	Женщинам всего мира.	vol-4967-page-04-seg-004-0502-0560-1419-0638.png
4967	4	646	652	1279	690	6	0.88142	Окончание. Начало на 3 стр. ).	vol-4967-page-04-seg-005-0646-0652-1279-0690.png
4967	4	272	706	954	1619	108	0.95508	ровцев, сопротивляйтесь реквизициям) Скрывайте продовольствие! Мстите всеми доступными вам средствами гитлеров- дам - убийцам ваших сыновей и мужей, мучителям ваших дочерей! Немецкая женщина! На тебе лежит наибольшая ответственность. Позорной черной страницей войдет в историю германского народа страшный период власти гитлеризма. Германская женщина! Включайся борьбу всех свободо.любивых народов про- фашизма. Препятствуй отправке военных эшелонов на фронт! Требуй хлеба для своих голодных детей. Всеми доступ- ными средствами мешай военного произ- водству. женщины Англии! Вы, мужественно обороняющие свою родную землю от вар- варских налетов фашистских стервятни- ков, мстите вашим заклятым врагам за разрушенные города, за осиротевшие семьи, за бомбардировки Лондона, Ковен- три, Бирмингема! Советский Союз оказал Англии серьезную помощь, оттянув на	vol-4967-page-04-seg-006-0272-0706-0954-1619.png
4967	4	954	706	1629	1619	125	0.95011	восток главные силы гитлеровской армии. Мы верим, что в ответ на это вы, англий- ские женщины и весь английский народ. полны решимости оказать помощь совет- скому народу и его героической армии. женщины Америки и всех свободолю- бивых стран! Помогайте всеми средствами справедливой войне Советского Союза в Англии, борющихся не только за свою свободу, но и за свободу и независимость ваших стран. Увеличивайте военное про- изводство и усиливайте снабжение армий, воюющих против гитлеризма, разоблачай- те гитлеровских агентов, подрывающих единый фронт свободолюбивых народов в борьбе с фашизмом. Посылайте медикамен- ты, теплое белье, подарки славным бой- цам, уничтожающим фашистские полчища. Женщины всего мира! Создавайте еди- ный фронт борьбы против кровавого гит- леризма ! В нашем единении сила и за.того победы! Наше дело правое, враг будет разбит, мы победим!	vol-4967-page-04-seg-007-0954-0706-1629-1619.png
4967	4	366	1631	1579	2732	314	0.95986	Валентина Гризодубова - Герой Советского Союза; В. Барсова - народная артистка СССР; Гастелло мать летчика Героя Советского Союза; Анна Ка- раваева-писательница; Коонен-народная артистка РСФСР; Кузнецова - работница завода им. Сталина; Малькова - председатель ЦК союза швей- наков: Мухина скульптор; Клавдия Николаева секретарь ВЦСПС; 9 Панкратова - чл.-корреспондент Академии наук; Марина Раскова - Советского Союза; Симанженкова - председатель обкома союза текстильщи- ков; Зинаида Троицкая - начальник Московской окружной дороги; Кукуш- кина Клавдия - врач-фронтовик; Соколовская Ольга - медсестра с фронта; Жаворонкова Елена - медсестра с фронта; Долорес Ибаррури; Анна Паукер; Ершова - медсестра с фронта; Мишакова Ольга; Федорова Татьяна - инже- нер Метростроя; Голубева - ткачиха; Зайцева - директор 1-й ткацкой ф-ки, Орехово-Зуево; Евсеева - нач-к Главшелкирова; Никитина - председатель ЦК союза рабочих шерстяной промышленности; Вавилова П.- работника Ярцевской фабрики; Ермаченкова Екатерина --работница Ярцерской фаб- рика; Попова Нина - председатель Краснопресненского райсовета г Москвы; Полякова - председатель Октябрьского райсовета г. Москвы; Кузнецова Л. работница ф-ки "Красный Восток": Архипова К.-- технолог машинострои- тельного завода им. Калинина № 3; Журавлева Д. - мастер цеха завода «Шарикоподшипник»; Колосова 3. -- работница швейной ф-ки «Красная швея»; Емельянова К. - работница завода им. Сталина; Яблочкина А. народная артистка СССР; Упанова Г. - народная артистка РСФСР; Андрев- ва м. - директор Дома ученых; Прохорова К. работница связи; Матю- шина -- инженер з-да «Красный Богатырь»; Федорова - начальник техниче- ского контроля завода «Каучук»: Макарова - директор ф-ки «Пролетарский труд»; Лосева - гл. инженер фабрики «Кардолента»; Рубинович - началь- ник производства Краснопресненского машиностроительного завода; Коло- сова; Смит-Фалькнер М. -- чл.-корреспондент Академии наук; Коросты- лева Е. - инженер завода "Фрезер"; Крейпайтес 0. - фрезеровщица з-да 9 "Калибр"; Зайцева А. - работница завода им. Ленина; Тенихина А. --- pa- ботница завода им. Калинина; Крестовникова В. -доктор медицинских наук, профессор; Молчанова О. - доктор физиологических наук, профессор; Близ- нянская А. - доктор медицинских наук, профессор; Смирнова Л. - доктор биологических наук: Шахова; Л. Штерн - академик.	vol-4967-page-04-seg-008-0366-1631-1579-2732.png
4967	4	380	2792	1523	2900	6	0.95533	ПРИВЕТСТВИЕ ЖЕНЩИН АНГЛИИ ЖЕНЩИНАМ СОВЕТСКОГО СОЮЗА	vol-4967-page-04-seg-009-0380-2792-1523-2900.png
4967	4	264	2922	936	3397	63	0.93734	ЛОНДОН, 7 сентября. (ТАСС). Группа женщин- видных общественных деятелей, представителей различных женских орга- низаций, деятелей науки, культуры и ис- кусства-обратилась женскому митингу Москве со следующим приветствием: «Женщинам России. Мы, английские женщины, приветст- вуем советских женщин, как товарищей по борьбе всех свободных народов против угрозы нацизма. Подобно вам, мы стоим днем и ночью у своих очагов, на заводах в армии плечом плечу с мужчинами	vol-4967-page-04-seg-010-0264-2922-0936-3397.png
4967	4	942	2924	1613	3393	70	0.95157	на передовых позициях. Нас волнует в бодрит ваш героизм и стойкость. Нас об" здиняет с вами общая ненависть гитле- ризму и злодействам нацистского режима... Будем слушать передачу вашего митинга живым интересом и твердой уверен- ностью в том, что наши общие усилия приведут победе нашего общего дела Мы ждем с нетерпением того дня, когда женщины всего мира сыграют свою роль в строительстве свободного, обеспеченного и справедливого будущего для всего челове- чества»,	vol-4967-page-04-seg-011-0942-2924-1613-3393.png
