volume_number	page_number	x1	y1	x2	y2	tokens_count	mean_confidence	text	image
5118	1	1099	350	2336	414	3	0.95808	Смерть немецким оккупантам.	vol-5118-page-01-seg-002-1099-0350-2336-0414.png
5118	1	454	464	2422	772	7	0.98675	ЦЕНТРАЛЬНЫЙ ОРГАН НАРОДНОГО КОМИССАРИАТА ОБОРОНЫ СОЮЗА ССР	vol-5118-page-01-seg-004-0454-0464-2422-0772.png
5118	1	476	810	2535	880	9	0.92848	54 (5118) 6 марта 1942 г., пятница ЦЕНА 15 КОП.	vol-5118-page-01-seg-006-0476-0810-2535-0880.png
5118	1	2666	358	4554	824	31	0.94130	Части Красной Армии, отражая контратак немцев и нанося им большой урон в людях и - технике, продолжают продвигаться вперед. Наши войска заняли несколько населенных --- пунктов и в числе их г. Юхнов.	vol-5118-page-01-seg-007-2666-0358-4554-0824.png
5118	1	494	942	1789	1149	4	0.98359	Организаторские способности начальствующего состава	vol-5118-page-01-seg-008-0494-0942-1789-1149.png
5118	1	462	1177	1129	1347	20	0.94951	Одним из факторов, решающих теперь судьбу войны, являются, как указано в приказе товарища Сталина, организатор- ские способности начальствующего состава армии.	vol-5118-page-01-seg-009-0462-1177-1129-1347.png
5118	1	456	1351	1123	1911	78	0.95647	Роль организационного начала исключи тельно велика на войне. В любые истори- ческие эпохи успешно воевали те армии, начальствующий состав которых обладал Большими организаторскими способностями. Эти армии выдвигали великих полковод- цев, обладающих кипучей энергией и же- лезной волей, способных организационно обеспечить любое сражение и в любых условиях добиться четкой деятельности Войск. Они выдвигали тысячи больших вналых начальников, подлинных военных руководителей, которые сколачивали вой- сковые единицы, направляли усилия ты- сяч людей к единой цели и, преодолевая все преграды, добывали победу.	vol-5118-page-01-seg-010-0456-1351-1123-1911.png
5118	1	452	1917	1117	2194	38	0.95269	История России знает много выдающих- ся военных деятелей. Из эпохи в эпоху наша родина выдвигала крупнейших пол- ководцев, людей незаурядного организа- торского дарования и неукротимой воли, глубоко познавших все законы военного дела и умевших господствовать на полях- сражений.	vol-5118-page-01-seg-011-0452-1917-1117-2194.png
5118	1	448	2206	1117	2724	77	0.96361	Но никогда еще организаторские способ- ности наших военных кадров не разверты- вались так во всю свою богатырскую тверь, наб это произошло после Великой Октябрьской революции. Партия большеви- ков, выпестованная Лениным и Сталиным. подняла из толщи народных масс тысячи и тысячи блестящих организаторов. Изо в день партия настойчиво воспитывала в рядах армии стальную выдержку, уме- ние ясно видеть цель и готовность любой ценой преодолеть все препятствия на пути сети, дисциплинированность и умение решительно насаждать дисциплину и поря- док.	vol-5118-page-01-seg-012-0448-2206-1117-2724.png
5118	1	444	2738	1113	3192	61	0.95915	В годы гражданской войны красная Ар- мия выдвинула много тысяч способных командиров и начальников, которые труднейшей обстановке, при самых небла- гоприятных условиях твердой рукой велкi войска к разгрому врагов. Это орлиное племя наших талантливых военачальников вырастили возглавлял товарищ Сталин- организатор побед на фронтах гражданской войны. С тех пор организаторские способ- ности нашего начальствующего состава неизмеримо развились, организаторское его умение значительно окрепло.	vol-5118-page-01-seg-013-0444-2738-1113-3192.png
5118	1	436	3200	1111	4676	210	0.96246	Гитлеровские планы «молниеносной» войны строились в расчете также и на то, чтобы первыми же ударами нарализо- вать управление в войсках Красной Ad- мии, нарушить их монолитное организа- пионное единство. Но эти расчеты, оправ- давшиеся в войне с Францией, сразу же провалились на советско-германском фрон- те. В наиболее тяжелые дни отечественной войны наши командные кадры, не ослаб- ляя ни на миг руководства войсками, на- чали закладывать организационные основы грядущих побед. Навстречу гитлеровским полчищам шли все новые и новые диви- и полки, всюду деятельно возводились укрепления, упорно велись сдерживаю- щие бои, в результате которых силы вра- га изматывались и обескровливались. Наступательные бои наших войск, как и самый факт перехода Красной Армии в наступление, явились новым свидетельст- вом больших организаторских способностей нашего начальствующего состава. Это, однако, не означает, что мы уже зюжем считать нашу организованность вполне достаточной. что уже все наши командиры являются военными организа- торами такого типа, какой нужен Красной Армии. Организаторские способности свой- ственны подавляющему большинству на- ших командиров, но некоторые из них еще не в полной мере развили эти спо- собности, не обладают еще достаточными практическими навыками. Впереди нас дет много ожесточенных битв, мы встре- тамся на пути к победе еще со многими трудностями. Это обязывает неустанно раз- вивать организаторские способности наше- го начальствующего состава, настойчиво совершенствовать его организаторское уме-	vol-5118-page-01-seg-014-0436-3200-1111-4676.png
5118	1	440	4684	1093	4876	24	0.94149	Организаторские способности началь- ствующего состава проявляются в умении всегда и везде обеспечить достижение на- моченной цели, решение поставленной боевой задачи. Что для этого нужно?	vol-5118-page-01-seg-015-0440-4684-1093-4876.png
5118	1	1143	1179	1809	2402	188	0.96196	Для того, чтобы правильно организовать бой, нужно, во-первых, ясно и четко опре- делить пути решения боевой задачи. Тща- тельно продуманный план боя перво- основа успеха. Действовать наобум озна- чает бросаться навстречу неудаче. Чем от- четливее каждый род войск, каждая часть и подразделение понимают свои задачи и свое место в предстоящем бою, тем слаженнее будут действия войск, тем крепче будет удар. Бой полон неожиданно- стей, он требует кипучей инициативы, смелого частного почина от каждого своего участника, но основой его всегда и везде должен являться всесторонне разработан- ный, четкий план. Для того, чтобы правильно организо- вать бой, нужно, во-вторых, обеспечить организационно решение боевой задачи. Это значит, расставить силы так, чтобы в нужном месте, в нужный момент иметь подавляющий перевес над противником. Это значит, правильно использовать все имеющиеся средства борьбы, взять от них все, что они могут дать. Командир должен быть хорошо осведомлен о состоянии и возможностях всех подчиненных ему войск. В частности, для общевойскового команди- ра совершенно обязательно знать основные свойства авиации, танков, артиллерии. Без этого он не сможет правильно ставить им боевые задачи и рискует. или не исполь- зовать их возможностей или, переоценив эти возможности, допустить опасный про- счет.	vol-5118-page-01-seg-016-1143-1179-1809-2402.png
5118	1	1139	2404	1801	2718	47	0.95561	Организационно подготавливая бой, командир должен вникнуть во все сторо- пы боевой деятельности своих частей, в том числе и в работу тылов. Командир- организатор понимает, что на войне нет мелочей. Все, что хоть в какой-то мере касается боевой деятельности войск, в равной мере важно, требует внимания и Заботы.	vol-5118-page-01-seg-017-1139-2404-1801-2718.png
5118	1	1121	2720	1801	4884	340	0.96401	Для того, чтобы правильно организо- вать бой, нужно, в-третьих, искусно и твердо управлять боем. Здесь от команды- ра требуется большая гибкость, настойчи- вость и прежде всего --- железная целе- устремленность. Он должен смотреть лицо самым страшным положениям гла- зоу, которого не мутит опасность. Он дол- жен не подаваться влияниям тех или иных неожиданностей и трений, неизбеж- ных в бою. Его закон: что бы ни про- изошло, - не отклоняться от поставлен- ной цели. Гибко управляя боем, гибко ма- неврируя своими средствами, он в то же время настойчиво, упорно бьет в одну точ- 9 Командир должен быть поватором во- енного дела. Он должен действовать, не ог- лядываясь назад, умея брать на себя всю полноту ответственности, не боясь разум- ного риска, не страшась смелых решений. В энергии и инициативе командира, в его непреклонной решимости во что бы то ни стало достигнуть цели, до конца выпол- нить боевую задачу -- сила организатора, единственно верный путь к успеху. В войне против Советского Союза немцы израсходовали полностью момент внезап- ности и неожиданности, как резерв своих войск. Теперь судьба войны - указывает товарищ Сталин будет решаться рядом постоянно действующих факторов и в том числе организаторскими способностями начальствующего состава армии. Чем боль- ше внимания и сил наши кадры, начиная с фронтов и кончая частями, будут удэ- Лять организационным вопросам, чем боль- ше будет организованности, порядка и дис- пиплины во всех звеньях войск, тем быстрее мы решим стоящие теперь перед нами задачи. Задачи эти ясны сломить сопротивление врага, вышибая его из опор- ных пунктов, окружая и уничтожая его живую силу и технику, неотступно пресле- дуя его, не только отражая, но и пара- лизуя все его контратаки. Высокая орта- низованность поможет нам безостановочно гнать немецко-фашистских захватчиков на залад, ускорить день их полного разгрома. Тысячи и тысячи командиров Красной Армии обладают незаурядными орга- низаторскими способностями. Надо, что- бы они изо дня в день развивать эти способности, обогащали и совершенство- вали свои организаторские навыки. Надо, чтобы безукоризненная организованность каждого боя стала нерушимым законом. Усилиями командиров-организаторов, осу- ществляющих волю нашего вождя товарища Сталина, мы должны выковать и выкуем победу над озверелым врагом.	vol-5118-page-01-seg-018-1121-2720-1801-4884.png
5118	1	606	4958	1605	5098	5	0.94683	Советские войска взламывают вражескую оборону	vol-5118-page-01-seg-019-0606-4958-1605-5098.png
5118	1	428	5112	1101	6105	152	0.96058	Южный фронт, 5 марта. (По теле- графу от наш. спец. корр. ). Враг яростно сопротивляется. Он опоясывает подступы к населенным пунктам минными полями, пы- тается отсидеться в подготовленных к обо- роне домах. Нередко фашисты при поддержке танков переходят в контратаки с целью вер- нуть утраченные позиции. Однако, под не- отвратимым натиском частей N соедине- ния они вынуждены оставлять захвачен- ные села, бросая убитых, оружие, боепри- пасы. Наша пехота, артиллерия, танки, тесно взаимодействуя, преодолевают оборо- ну врага. В течение одного дня частями - соединения освобождено несколько населен- ных пунктов. Наиболее ожесточенными были бои за два населенных пункта. Здесь борьба шла буквально за каждый дом. Фашистские ав- томатчики пытались использовать любое укрытке, но повсюду их настигали пули, гранаты, советский штык. Командир роты старший лейтенант Марухин заметил, что помпы закрепились в центре села, заняв выгодную позицию в нескольких домах. Марухин сковал вражеских автоматчиков сильным огнем и под его прикрытием уме- по организоват перебежки своих бойцов	vol-5118-page-01-seg-020-0428-5112-1101-6105.png
5118	1	1119	5120	1785	6107	150	0.95835	Рота быстро достигла центра села и пере- била засевших там фашистов. Большой урон наносят врагу наши авто- матчики. Укренившись в одном доме, нем- ны держали под огнем все подступы к не- му. Однако командир взвода сержант Пав- линов перехитрил врага. Вместе с группой автоматчиков он вплотную подобрался к этому дому. Фашистов ошеломили ливнем свинца, забросали гранатами, 10 гитле- ровцев было убито, 25 взято в плен. ряде случаев успех был достигнут смелым ударом во фланг и тыл врагу. В бою за одно село командир гвардейского подразделения капитан Пелевин, сковав противника с фронта, -обрушился главными силами на южную и юго-восточную окраи- ны села, отрезав фашистам путь отхода. Этот маневр ускорил и облегчил овладение населенным пунктом. Был момент, когда враг, стремясь оста- новить натиск гвардейцев, двинул в бой есть танов. Путь ну прекратили сержант Ползунов, красноармейцы. Пикура, Ганджа и Петров. Огнем противотанковых ружей они подбили два танка и заставили осталь- матины повернуть обратно	vol-5118-page-01-seg-021-1119-5120-1785-6107.png
5118	1	1929	934	3100	1034	3	0.97448	ОТ СОВЕТСКОГО ИНФОРМБЮРО	vol-5118-page-01-seg-023-1929-0934-3100-1034.png
5118	1	2023	1048	3000	1119	3	0.93745	Утреннее сообщение марта	vol-5118-page-01-seg-024-2023-1048-3000-1119.png
5118	1	1835	1139	2498	1275	16	0.94927	B течение ночи на 5 марта наши войска продолжали вести активные боевые действия против немецко-фашистских войск.	vol-5118-page-01-seg-025-1835-1139-2498-1275.png
5118	1	1831	1313	2494	1689	55	0.95114	Бойцы под командованием тов. Попова (Северо-Западный фронт) успешно отбили атаку противника, затем, преследуя отходящих немцев, захватили у них не- сколько орудий и открыли из них огонь по врагу. Развивая успех, наши бойцы заняли 3 населенных пункта, захватили еще 10 немецких орудий, несколько пуле- метов и иного боеприпасов. На поле боя осталось свыше ста вражеских трупов.	vol-5118-page-01-seg-026-1831-1313-2494-1689.png
5118	1	1831	1709	2492	2015	43	0.96030	3 марта в районе окруженной советски- ми войсками 16 немецкой армии призем- лились два фашистских транспортных са монета "10-52". Об этом было сообщено на командный пункт нашего артиллерийского подразделения. Артиллеристы открыли огонь по аэродрому и с первых же выстре- лов уничтожили немецкие самолеты.	vol-5118-page-01-seg-027-1831-1709-2492-2015.png
5118	1	1829	2029	2488	2206	25	0.94825	Артиллеристы части тов. Иовлева (За падный фронт) за один день подавили немецкую минометную батарею, уничтожи- ли орудие, 2 пулемета и рассеяли до роты пехоты противника.	vol-5118-page-01-seg-028-1829-2029-2488-2206.png
5118	1	1825	2242	2488	2558	43	0.95440	На одном из участков Ленинградского фронта группа советских разведчиков во главе с сержантом Беляевым забросала гранатами землянки, в которых укрыва- лись петлюровцы. Разведчики уничтожили 25 немецких солдат и, офицера. Захватив пленного, пулемет и несколько винтовок, группа разведчиков без потерь вернулась в свою часть.	vol-5118-page-01-seg-029-1825-2242-2488-2558.png
5118	1	1825	2598	2488	2912	52	0.95223	Подведены итоги боевой деятельности страда белорусских партизан под командо- ванием тов. Ч. Бойцы отряда вывели из строя более 700 гитлеровских солдат, офи- церов и полицейских, разбили и сожгли 19 автомашин с грузом, 2 бронемашины, 30 мотоциклов. Партизаны 14 раз разби- рали железнодорожное полотно, взорвали сложили 9 мостов. В одном из боев совет-	vol-5118-page-01-seg-030-1825-2598-2488-2912.png
5118	1	2524	1137	3182	1237	12	0.93983	ские патриоты захватили у противника радиостанцию и использовали ее для нужд. отряда.	vol-5118-page-01-seg-031-2524-1137-3182-1237.png
5118	1	2520	1281	3180	1631	56	0.95330	Пленный унтер-офицер 9 роты 164 полка 62 немецкой пехотной дивизии Георг Дранке рассказал: «Огромные потери немецких войск приводят солдат в ужас... B нашем 3 батальоне, насчитывавшем около 1000 человек, сейчас едва ли на- берется две сотни солдат. В 12 роте оста- лось всего-навсего 18 человек. В послед- них боях были разгромлены и уничтожены остатки нашего полка».	vol-5118-page-01-seg-032-2520-1281-3180-1631.png
5118	1	2514	1695	3178	2079	62	0.95617	вражеском оконе найдено письмо немецкого солдата Ганса. В нем он писал своим родным: "Я нахожусь в районе, где сейчас идут большие бои. Все мои това- рищи погибли. Среди них Конрад Ифау Шамбергер. Я ношу валенки, снятые с ног одной русской, которую я расстрелял не- давно. Завтра мы ожидаем атаки русских на наши позиции. Мы определенно по гибнем. Нам некуда отступать, всюду русские».	vol-5118-page-01-seg-033-2514-1695-3178-2079.png
