volume_number	page_number	x1	y1	x2	y2	tokens_count	mean_confidence	text	image
5299	2	3105	4927	3771	5535	89	0.96445	ВОЛХОВСКИЙ ФРОНТ, 5 октября. (Пс телеграфу). Батарея под командованием старшего лейтенанта Хачирова находилась составе противотанкового опорного пункта. Орудийные расчеты вместе с бро небойщиками, располагаясь впереди бое- вых порядков пехоты, прочно прикрывали танкодоступные места. Вакоре певцы по- шли в контратаку. На этот раз вражеская пехота двигалась без танков. Недалеко 01 пео шло несколько автомашин с грузом Старший сержант Гудков, выплав удоб- ный момент, открыл огонь и прямыми по- падениями разбил две автомашины, кото- рые были загружены боеприпасами. Немцы в ответ взяти под жестокий обстрел наше огневые позиции. Вражеские снаряды вы-	vol-5299-page-02-seg-062-3105-4927-3771-5535.png
5299	2	3793	4933	4453	5075	22	0.94652	вели из строя командира взвода. Его не сто занял сержант Воротников. Орудия этого взвода открыли огонь прямой навод- кой по вражеской пехоте.	vol-5299-page-02-seg-063-3793-4933-4453-5075.png
5299	2	3793	5077	4455	5531	68	0.96047	Контратака немцев стала захлебываться по враг ввел в бой подкрепления. Ценой больших усилий ему удаюсь подойти нашим позициям на расстояние 30 -50 метров. Артиллеристы и бронебойщики про должали вести интенсивный огонь. Израс ходовав все осколочные снаряды, орудий- ные расчеты начали стрелять бронебой- ными, а затем пустили в ход автоматы. Около роты вражеской пехоты полегло впереди наших позиций от меткого огня артиллеристов и бронебойщиков. Подоспев- петре подкрепление отбросило противника.	vol-5299-page-02-seg-064-3793-5077-4455-5531.png
5299	2	3307	5585	4243	5705	3	0.97391	Взаимодействие разведчиков минометчиками	vol-5299-page-02-seg-065-3307-5585-4243-5705.png
5299	2	3103	5721	3767	6243	75	0.95743	КАРЕЛЬСКИЙ ФРОНТ. 5 октября. (Пс телеграфу). Разведывательная группа по командой лейтенанта Шахмана проникла за передний край вражеской обороны. Вы- двинувшиеся ползком разведчики Горецкий и Цепкало заметили, что в одном месте немцы собираются к кухне за ужином... Когда возле кухни собралось около фашистов, Шахман передал данные для стрельбы на огневую позицию минометной батареи. Мощным огневым налетом был с уничтожено 25 фашистов. В другой ра- разведчики передали данные для стрельбы по станковому пулемету, который также быт уничтожен	vol-5299-page-02-seg-066-3103-5721-3767-6243.png
5299	2	3791	5725	4453	5900	26	0.94946	Мощным огневым налетом было уничтожено по 25 фашистов. В другой раз разведчики передали данные для стрельбы по станко вому пулемету, который также был уни что ждет	vol-5299-page-02-seg-067-3791-5725-4453-5900.png
5299	2	3789	5908	4455	6245	49	0.95873	Разведывательная группа с тов. Бозлов ским во главе, незаметно проникнув в ты врага, напала на позиции финнов и, за бросав их гранатами, истребила более 10 солдат. Копа финны стали выскакивать из землянок, то по указанным разведчиками целям открыли огонь минометчики, кото рые уложили еще несколько солдат и офи перов,	vol-5299-page-02-seg-068-3789-5908-4455-6245.png
5299	3	422	544	1164	576	5	0.92308	октября 1942 г., 235 (5299)	vol-5299-page-03-seg-001-0422-0544-1164-0576.png
5299	3	2081	538	2669	572	12	0.92017	К Р А С Н А Я 3 В Е Д А	vol-5299-page-03-seg-002-2081-0538-2669-0572.png
5299	3	464	653	1584	761	3	0.88930	У ДУБОВОЙ ИГРАТЬ	vol-5299-page-03-seg-003-0464-0653-1584-0761.png
5299	3	558	783	1489	819	5	0.89806	От специального корреспондента «Красной звезды»	vol-5299-page-03-seg-004-0558-0783-1489-0819.png
5299	3	356	847	1020	1650	134	0.96218	27 дней занимали немцы одну станицу в горах, и вся жизнь ее протекала как бы в тяжелом, гнетущем полусне. Улицы опу- стели, и казалось, что даже солнце не по- решает их. В первый же день своего при- хода гитлеровцы заперли в сарае 36 кол- хозников. Это были старики, больные, вер нувшиеся с фронта инвализы отечествен- ной войны. Подгоняя своих пленников прикладами, немцы оповестили всех жите- лей, что в случае смерти хоть одного сол лата 36 заложников будут публично каз- нены. Люди были брошены в темницу, их почти не кормили и не разрешали прино- сить им пищу, их каждый день избивали... и матери просили, чтобы им дали возможность увидеться сыновьями, мужьями. Толпу беззащитных женщин немцы разогнали. Военный комендант ста- нипы капитан Отто предупредил, что в случае повторения такой демонстра- заложники и их родственники будут расстреляны.	vol-5299-page-03-seg-005-0356-0847-1020-1650.png
5299	3	356	1654	1020	2134	80	0.96108	жители станицы познали ярию немецко го рабства. Весь скот и домашнюю птицу немцы забрали себе. Они потребовали чтобы население сдало им все продозоль- ственные запасы. Потом расклеили об яв- ление, в котором сообщалось, что после семи часов вечера появляться нельзя. За нарушение - расстрел. Пожилая пицца Марфа Ширшова вышла под вечер на улицу. Она не знала об этом приказе. Раздался выстрел, и женщина замертво упала на пороге своего дома. В этот же день недоцы расстреляли 14-летнего кол- хозного пастушонка Илью.	vol-5299-page-03-seg-006-0356-1654-1020-2134.png
5299	3	350	2148	1016	2561	61	0.96693	На площади стоял памятник борцам ре- волюции. Немцы разбили памятник и на этом месте похоронили своих офицеров. Недавно построенная амбулатория превра щена была в казарму. В сельском клубе остановился сам комендант. Из этого дома постоянно доносились крики людей, кото- гых пытали немцы. Убежать из станицы было нельзя - повсюду расхаживали па- трули. Немцы собирались умертвить совет- ских граждан медленной мучительной смертью...	vol-5299-page-03-seg-007-0350-2148-1016-2561.png
5299	3	346	2563	1016	3051	86	0.95707	А недалеко отсюда днем и ночью не умолкал бой. Рота наших бойцов под командованием лейтенанта Шипа подни- малась по узким горным тропам. Дорога была тяжелая. Часто людям казалось, что больше нахватит сил. Пройденное расстоя- ние считали не километрами, а десятками и сотнями метров. Здесь было скользко от вечных туманов. Люди падали, поднима- лись и снова карабкались вверх по ска- лам. Выбившись из сил, они лежали на земле, тяжело дыша, но потом опять под- яимались и шли. Надо было забраться еще выше, чтобы оттуда ударить по врагу.	vol-5299-page-03-seg-008-0346-2563-1016-3051.png
5299	3	348	3059	1014	3267	30	0.95814	Вскоре на узких тропах стали появлять ся немецкие автоматчики. Они возникали 23-33 больших камней, неожиданно начи- нали стрелять из пещер и ущелий. Нужно было продолжать тяжелый путь, все вре- отстреливаясь.	vol-5299-page-03-seg-009-0348-3059-1014-3267.png
5299	3	346	3279	1012	3801	94	0.95970	Впереди роты шел политрук Зиновьев. Он был такой же, как и все, не отличался «собой выносливостью. Но он крепко верил в победу, и эта вера передавалась его бой- цам. Во время коротких привалов, забрав- шись в холодную пещеру, Зиновьев раз сказывал красноармейцам о том, кто ждет их там впереди. Он говорил о сестрах, ма- детях и женах, которых каждый оставил далеко отсюда, в родных деревнях и горо- дах. Он говорил, что в горах живут род- ные таких же бойцов, как они, н сейчас всячески издеваются на этими людьми. Мы идем освобождать свой народ -	vol-5299-page-03-seg-010-0346-3279-1012-3801.png
5299	3	1046	847	1708	948	16	0.94454	говорил политрук. Это самое священное. Как бы ни были высоки горы, мы дол- жны их пройти.	vol-5299-page-03-seg-011-1046-0847-1708-0948.png
5299	3	1046	950	1704	1052	14	0.95767	Политрука Зиновьева любили все, и ка каждое его слово глубоко западало в осрща бойцов.	vol-5299-page-03-seg-012-1046-0950-1704-1052.png
5299	3	1044	1058	1708	1927	153	0.95907	Они были уже почти у цели, когда не ожиданно навстречу горсточке красноар мейцев, двигавшихся впереди, вышыа не мецкая рота. Она до этого скрывалась в ущелье. Немцы стали стрелять из автома тов и требовали, чтобы наши бойцы сда лись в плен. Рядом политруком повьевым находились в этот момент сер кант Габов и красноармеец Цхададзе. Втроем они зеленой между камней и стали вести огонь по приближающимся фаши- стам. Они уложили 8 офицеров и 23 сол- дата. Но за первой группой фашистов по явилась другая. Политрук Зиновьев поднял своих бой- цов в атаку. Со словами "В атаку за ро- дину» он ринулся вперед. За ним пошли все. В этом бою смертью храбрых погибли 1юлитруй Зиновьев, сержант Габов и кра- ноарнеец Цхададзе. Но подоспела вся ро та, враг был отбит, и наши бойцы в этот же день вступили в горную станицу, освобожденную от немецких захватчиков. Три героя не увидели станицы, за кото- рую они так храбро дрались...	vol-5299-page-03-seg-013-1044-1058-1708-1927.png
5299	3	1040	1935	1706	2384	77	0.95452	гор медленно спускались в долину три повозки, и на каждой стоял гроб. За повозками шли бойцы. Лица их были через ны от пыли. Навстречу траурной процес- сии шли люди с венками и букетами цветов. Они появлялись из-за скал, выхо лили из ущелий, спускались с соседних высот. Здесь были старики, старухи, мо- голые женщины и дети. Когда повозки остановились у свежевырытой могилы, вокруг собралось все окрестное население А рядом шумел водопад, и тонкие облака проплывали над гробами героев.	vol-5299-page-03-seg-014-1040-1935-1706-2384.png
5299	3	1040	2394	1708	2599	30	0.95995	Колхозники станицы трогательно про- щались с воанами, отдавшими свою жизнь за их освобождение. Здесь стояли и 36 за- ложников, которые только что вырвались фашистской темницы. По щекам их катились слезы	vol-5299-page-03-seg-015-1040-2394-1708-2599.png
5299	3	1040	2605	1706	2990	60	0.95753	Старший политрук Баграмов открыл ми- тинг. Он сказал, что три героя погибли защищая подступы к главному Бавказско му хребту, к сердцу Кавказа, к нашим нефтяным промыслам. Они дрались храб- ро, не жалея себя и не щадя врага... Втроем они уничтожили 31 фашиста Образы этих самоотверженных воинов на всегда останутся в сердцах бойцов и командиров, в сердцах освобожденных жи- телей гор.	vol-5299-page-03-seg-016-1040-2605-1706-2990.png
5299	3	1040	2992	1704	3267	48	0.96109	Старший политрук Баграмов громко про изнес слова священной клятвы --- драться так, как дрались три героя. Голос его эхом отдавался в горах, и казалось, что повсю ущельях, на горных вершинах, в пещерах - раздаются те же слова, что это клянутся все воины, защищающие в эти для Кавказский хребет.	vol-5299-page-03-seg-017-1040-2992-1704-3267.png
5299	3	1036	3279	1700	3765	70	0.95559	Троекратный салют и энамена скло- бились над гробами. Вот уже тела героев опускают в могилу, брошена первая горсть земли. Среди гор возле водопада поднялся маленький курган. Его окружили дубовой оградой. Женщины убрали его цветами венками. Поставлен столб со звездочкой появилась маленькая табличка: «Здесь покоится прах погибших за социалистиче- свою родину политрука Зиновьева, сер- жанта Габова и красноармейца Три героя обрели бессмертие. Их никогда не забудут в горах Кавказа. 3. ХИРЕН	vol-5299-page-03-seg-018-1036-3279-1700-3765.png
5299	3	1070	3763	1419	3793	2	0.90019	СЕВЕРНЫЙ КАВКАЗ	vol-5299-page-03-seg-019-1070-3763-1419-3793.png
5299	3	502	3859	1546	3986	4	0.96682	Праздничные подарки защитникам Сталинграда	vol-5299-page-03-seg-020-0502-3859-1546-3986.png
5299	3	342	4014	1002	4397	56	0.95126	По всей стране развернулся сбор подар ков фронтовикам в ознаменование XXV го Годовщины Великой Октябрьской революции. Трудящиеся Башкирской АССР отправляют 95 загонов с праздничными подарками славным защитникам Сталинграда. Населе- на других советских республик посылает на этот участок фронта еще 20 вагонов исдарков. Защитники Сталинграда получат всего 115 вагонов с подарками. 42 вагона с подарками отправят жители	vol-5299-page-03-seg-021-0342-4014-1002-4397.png
5299	3	1022	4012	1690	4403	62	0.95309	Кировской области и 38 вагонов населе- Горьковской области, 15 вагонов по сылает Бурят-Монгольская АССР, 30 - Таджикская ССР и 12-Азербайджанская... 17 вагонов праздничных подарков готовят охотники Якутии, по 6 вагонов отправля- ют трудящиеся Киргизии и Мордовии. Сс- ветские граждане посылают на фронт шер- с тенью носки, теплое белье и одежду, ры- бу, копчености, печенье, сухари, мясо, масло, овощи, табак и другие продукты.	vol-5299-page-03-seg-022-1022-4012-1690-4403.png
5299	3	1800	2549	3045	2742	45	0.95537	зверства немецких захватчиков в оккупированных со ВЯТСКИХ РАЙОНАХ. Два снимка, найденные у убитого немецкого офицера рисуют страшную картину расправы в одном селе. Груда мертвых тел - это насе- ление села, выгнанные из домов и расстрелянное фашистскими извергами. После кровавого побоища немцы подожгли опустевшее, разоренное село,	vol-5299-page-03-seg-023-1800-2549-3045-2742.png
5299	3	1939	2834	2872	2964	6	0.95757	Документ о новых изуверствах гитлеровских мерзавцев	vol-5299-page-03-seg-024-1939-2834-2872-2964.png
5299	3	1730	2984	2394	3327	40	0.94081	БРЯНСКИЙ леграфу от наш. захвачен документ, ровских бандитов в злодеяниях. Это - личительных знаков пленных. Приводим изуверского документа: ФРОНТ, 5 октября. (По те- корр. ). Партизанами изобличающий гитле- новых чудовищных приказ о введении от- для советских военно- дословный текст этого	vol-5299-page-03-seg-025-1730-2984-2394-3327.png
5299	3	1728	3332	2388	3454	13	0.93143	«Приказ № 15 штаба венгерской груп- пы оккупационных войск. Отличительные знаки советских военнопленных.	vol-5299-page-03-seg-026-1728-3332-2388-3454.png
5299	3	2420	2990	3081	3195	21	0.95832	Зачастую советские военнопленные пре побегах снимают с себя отличительные знаки, и, таким образом, нет возможности установить, являются ли они советскими пленными.	vol-5299-page-03-seg-027-2420-2990-3081-3195.png
5299	3	2416	3209	3079	3454	30	0.93104	Для предотвращения подобных случае главный штаб вооруженных сил Германии распорядился каждому советскому военно- пленному делать отметку адским камнем (ляписам) на нижней части левой руки с внутренней стороны знаком косого креста»	vol-5299-page-03-seg-028-2416-3209-3079-3454.png
5299	3	2117	3550	2677	3596	2	0.94350	книжная полка	vol-5299-page-03-seg-029-2117-3550-2677-3596.png
5299	3	1714	3630	2386	4403	104	0.94946	Вышел в свет № 6 блокнота апататора Красной Армии, издаваемого Главным по- литическим управлением РККА. В номере напечатаны статьи корвоенюриста В. Но- сова "Бдительность - залог победы на, врагом" и гвардии подполковника Г. Зве рева «Секрет наших боевых успехов» (на тему о боевом умении). Обе эти статьи предназначены для агитаторов, проводящих беседы. Под рубрикой «Советы командира» дан очерк подполковника Н. Баканова «Ружейно-пулеметным огнем отражайте атаки с воздуха». В блокноте помещен ряд Фактических данных и цитат. Особый интерес представляют высказывания Ленина, Сталина, Орджоникидзе и Кирова защите Кавказа в годы гражданской войны. Среди остальных материалов мысли Суворова об умении воевать, фак- ты о зверствах немецких оккупантов.	vol-5299-page-03-seg-030-1714-3630-2386-4403.png
5299	3	2408	3628	3075	4399	94	0.94723	Вышел из печати № 17 двухнедель- ного литературно-художественного журнала Главного политического управления Образ- ной Армии «Красноармеец». В номере на печатаны: статья Ех. Ярославского «Оста- новин разгромим врага», рассказы II. Павленко «Мой земляк Юсупов» K. Федина «Ленинградские рассказы» E. Габриловича «Фронтовое письмо Б. Лавренева "Боец Степана Неруды" очерки: II. Эренбурга «Своя жизнь» Вл. Бахметьева «Труд и слово», С. Го- леваневского "Мои дети"; стихотворения: A. Корова "Комиссары", С. Щипачев «Поединок», A. Твардовского «Василий Термин" (книга про бойца, продолжение). Номер журнала, к участию в котором при- влечены лучшие литературные силы, чи- тается с интересом и хорошо оформлен.	vol-5299-page-03-seg-031-2408-3628-3075-4399.png
5299	3	3253	631	4331	845	7	0.95515	В БРЯНСКИХ ЛЕСАХ 1. Бой на реке	vol-5299-page-03-seg-032-3253-0631-4331-0845.png
