volume_number	page_number	x1	y1	x2	y2	tokens_count	mean_confidence	text	image
5155	2	3823	4746	4498	6047	177	0.95769	Особенности действий штаба полка вы ражаются в сокращенной документации широком использовании устных распоря- жений и методов полевой работы. Требу- ются непосредственное руководство под разделениями и полная взаимозаменяемость командиров штаба. Каждый помощник на- чальника штаба полка должен всегда пол- ностью знать обстановку и в любой мо мент быть готовым заменить другого. Что касается батальона, то ого боевые действия протекают в условиях ближнего боя. Поэтому наставление указывает, что командир батальона лично управляет боем путем живого общения и отдачи исклю- чительно устных приказов и распоряже- ний. Штаб батальона является рабочих аппаратом командира батальона и помогает ему в управлении. В своем приказе, в связи с 24-й го- довщиной Красной Армии, товарищ Сталин указал: "Теперь судьба войны будет ре- шаться не таким привходящим моментом, как момент внезапности. а постоянно дей- ствующими факторами: прочность тыта, моральный дух армии, количество и каче- ство дивизий, вооружение армии, органи- заторские способности начальствующего состава армии». Новое Наставление по по левой службе штабов, несомненно, помо- жет нашему начальствующему составу штабам укрепить свои организаторские спо- собности и, выполняя приказ великого Сталина, с еще большим искусствоч гро- чуть немелких затватотков	vol-5155-page-02-seg-049-3823-4746-4498-6047.png
5155	2	4007	6069	4432	6103	3	0.94030	Полковник С. Броневские	vol-5155-page-02-seg-050-4007-6069-4432-6103.png
5155	3	442	462	1169	498	7	0.90269	18 апреля 1942 г., суббота. 91 (5155)	vol-5155-page-03-seg-001-0442-0462-1169-0498.png
5155	3	560	570	1547	742	3	0.96532	ПРОПАГАНДА БОЕВОГО ОПЫТА	vol-5155-page-03-seg-003-0560-0570-1547-0742.png
5155	3	574	770	1533	814	6	0.93732	От нашего корреспондении по Карельскому фронту	vol-5155-page-03-seg-004-0574-0770-1533-0814.png
5155	3	374	836	1036	1355	73	0.96321	рассвото немецко-Финские войска предпринима штуры нашей левофлантовой По всему было видно, что эта контратака готовилась ягротивником долго и тщательно. Шторы начался интенсив- ным артиллерийским и минометными ог- В воздухе кружили вражеские санкт- леты. Казалось, что после такого сильного и прэдолжнтельного обстрола сопки с земли воздуха на ней не останется живого ме- ста. Во всяком случае солдаты противни- на были твердо уверены в подавлении ос- новных очагов сопротивления и рынок под: нялись в атаку.	vol-5155-page-03-seg-005-0374-0836-1036-1355.png
5155	3	368	1359	1032	1843	83	0.95867	Их было несколько сог, а наших на сошка - рота. Но стоит только финнам выйти на линию налиего боевого охране- ния, как сопка сразу ожила. Рота от- крыла по ним огонь из всех видов пе- хотного оружия. От неожиданности в ря- противника сразу же возникло заме- тательство. Финны в начале залегли, за- тем попробовали обтекать высоту по флан- там, но, встретив и здесь уторное сопро- тивление, в конце концов стали откаты- ваться назад. Вражеская контратака за- хлейнулась. Противник отступил, - понеся немалые потери.	vol-5155-page-03-seg-006-0368-1359-1032-1843.png
5155	3	362	1845	1024	2326	75	0.95854	Сразу же после этого боя капитан Дол- гов, руководивший обороной сопки, и ин- структор пропаганды полка потитрук Xo- монако собрали боевой актив. Надо было модем глубже осмыслить суть то- го, что произошло, разъяснить им, благо- даря чему рота сумела нанести такое же- стокое поражение врапу, силы которого многократно превосходили наши. И капи- тан сделал это. Он наглядно показал, ка- кую большую роль в отражении этой хо- рошо подготовленной контратаки против- ника сыграло заблаговременное окапыва- ние.	vol-5155-page-03-seg-007-0362-1845-1024-2326.png
5155	3	352	2334	1020	2988	105	0.96866	Захватив эту соньку, напомни ка- артан,-- мы, не теряя времени, сразу же занялись закреплением нового рубеска: от- рыбкой окопов, сооружением надежных блиадаскей. результат этого труда оку- сегодня полностью. Как ни свиреп- ствовали финны, сколько пи сыпали он на нас и мин, и снарядов, и авиабомб сотка по прежнему в наших руках, мы по- теряли 2 человека убитыми 3 ранены- ми, а каковы потери противника, можете прочитать сами. Выслушав капитана и инструктора про- паганды, боевой актив разошелся по отде- лениям, и там началась уже работа по до- ведению итогов боя ло кандого красноар- мейца. Времени на это ушло относительно немного, а польза была изречена огром- ная.	vol-5155-page-03-seg-008-0352-2334-1020-2988.png
5155	3	348	2994	1014	3583	93	0.96061	Приходится только сожалеть, что по- добные мероприятия в полку, где ко- миссаром тов. Давыдов, являются относи- тельно редким исключением. Пропаганда боевого опыта еще не стала здесь лемой частью практической деятельности каждого политработника. Загляните в планы политруков рот. Ред- во в каком из них встретитесь вы с та- кили мероприятиями, как сбор боевого актива или беседа агитатора на военную тену. И объяснить это непрушю. Главной причиной является элесь отсутствие долж- фото руководства пропагандой боевого опы- га стороны военкома полка и палитру- рот. До сих пор они не возглавили еще работы по обобщению боевого опыта,	vol-5155-page-03-seg-009-0348-2994-1014-3583.png
5155	3	1062	838	1717	1161	49	0.95697	но занялись всерьез с боевью активом. Когда с политруком заговариваешь о недо статках в пропаганде актуальнейших во- енных вопросов, всегда обычно слышишь одно и то же "оправдание": Для меня главное - это политиче- ская агитация и пропаганда. Что же ка- сается пропаганды боевого опыта, то этому ближе стоит командир.	vol-5155-page-03-seg-010-1062-0838-1717-1161.png
5155	3	1058	1169	1715	1477	49	0.95601	Едва ли есть нужда доказывать оши00ч- ность такого рода рассуждений. Палитра- от них не может стоять в стороне от про- паганды боевого опыта. В этом важном деле всегда необходимо объединение усилий командиров и политработников. Хороший пример в этой отношении показывает по- мощник командира пулеметной роты млад- ший лейтенант Станкевич.	vol-5155-page-03-seg-011-1058-1169-1715-1477.png
5155	3	1048	1479	1713	2145	101	0.96452	Недавно был такой случай. В момент ожесточенной контратаки противника пу- леметчик Гужилев получил приказание прикрывать выеюс раленых. Неожи- данно в самый разгар боя пулемет вдруг смолк. Произошел поперечный разрыв гиль- зы. Вральеские автоматчики сразу же об- рушились па санитаров. Но буквально че- рез полминуты гумилевский пулемет зара- ботал вновь задержка была устранена. Едва закончился бой, младший лейте- нант собрал всех пулеметчиков и обстоя- только рассказал им, каким образом Гужи- лев сумел так быстро снова ввести свой пулемет в действие. Беседа была дополне- на практическим показом. Гужилев на- глядно продемонстрировал товарищам, как на ю в минимальное время устранять по- добного рэда задержки.	vol-5155-page-03-seg-012-1048-1479-1713-2145.png
5155	3	1038	2155	1707	3571	209	0.96087	Такие беседы вошми здесь в систему. Ни один поучительный боевой эпизод по проходит мимо внимания лейте- навта Сгажевича. Он лучший в роте по- поляризатор боевого опыта. Пример тов. Станкевича достоин пода- жания. К пропаганде боевого опыта надо привлечь командиров всех степеней и в особенности младший начальствующий со- став. На глазах у младшего командира проходит вся боевая деятельность бойдов, и кто-кто, а уж он-то всегда сумеет рас- сказать во всех деталях об умелых или ошибочных действиях того или иного крас- ноармейца. Пропаганда боевого опыта не мыслится без самой широкой популяризации героев. И внешне эта сторона дела выглядит в полку как будто неплохо. Политработники часто упоминают в своих беседах имена отличившихся товарищей. Не так давно инструктор пропаганды тов. Хомелко выс- тутил даже со специальным докладом о героях полка. Но вся беда в том, что и Хоменко и остальные политработники, про- славляя героев и их боевые успехи, не считают себя обязанными обстоятельно разъяснять, а каким же образоч достигну- ты эти успехи. В каждом факте проявления героиз- ма, в каждом боевом подвиге наших красноармейцев и командиров всегда, как правило, заложены какие-то элементы умения, смекалки, инициативы. Палитра- ботник должен уметь подмечать это, обоб- щать и обнародовать вместе с героев. Без этого не достигнешь правиль- ного сочетания политического воспитания красноармейцев c пропагандой боевого опыта. МИЛОВАНОВ,	vol-5155-page-03-seg-013-1038-2155-1707-3571.png
5155	3	402	3633	1633	3733	9	0.98052	ГЕРОЙ СОВЕТСКОГО СОЮЗА КАПИТАН СИМОНОК ПРИНЯТ В ЧЛЕНЫ ВКП(б)	vol-5155-page-03-seg-014-0402-3633-1633-3733.png
5155	3	342	3755	1012	4141	64	0.94552	СЕВАСТОПОЛЬ, 17 апреля. (По телегра- фу от наш. корр. ). Партийной организаци- ей N части принят в члены ВКП(б) Герой Советского Союза капитан Симонок. Начиная с 22 июня 1941 года, тов. Си- непрерывно находится на фронте. Бывший председатель колхоза, ныне ко- мандир батальона, Владимир Симонок слу- жит для своих подчиненных образном храб- рости и находчивости в бою. Однажды оп натолкнулся на фашистскую засаду. Пе	vol-5155-page-03-seg-015-0342-3755-1012-4141.png
5155	3	1030	3757	1695	4133	60	0.96298	растерявшись, командир открыл огонь убил десять солдат. Остальные пятеро фа- гестоз во главе с ефрейтором подняли руки. Капитан взял их в плен. Здесь же были захвачены два легких орудия. День вступления в члены большевист ской гарантии прославленный минометчик от- метил новым боевым успехом. Управляя огневым полетом на немецкие укрепления, гов. Симонок разбил дзот, пулеметный блин- так и наблюдательный пункт врага,	vol-5155-page-03-seg-016-1030-3757-1695-4133.png
5155	3	1783	564	3050	632	4	0.93540	БЛЕСТЯЩИЙ УСПЕХ ВОЕННОГО ЗАЙМА	vol-5155-page-03-seg-017-1783-0564-3050-0632.png
5155	3	1911	698	2910	840	7	0.95554	Грузовые рубли - дополнительные снаряды и бомбы	vol-5155-page-03-seg-018-1911-0698-2910-0840.png
5155	3	1743	862	2404	1357	67	0.95569	ДЕЙСТВУЮЩАЯ АРМИЯ, 17 апреля. (От наш. корр. ). Сообщение по радио о выпуске тювого зайна нашло горячий от- клик среди бойцов и командиров танковой части, где комиссаром тов. Аганин. В под- разделениях состоялись митинги. Красноармеец Полевщиков, выступая на митинге, заявил: Каждый из нас, подписываясь на новый зам, понимает, что его трудовые рубли это дополнительные бомбы снаряды, которые обрушатся на головы не- мелких захватчиков. После митингов уполномоченные присту-	vol-5155-page-03-seg-019-1743-0862-2404-1357.png
5155	3	2426	866	3084	1351	75	0.95442	пили к оформлению подписки. Воентехник 2-го ранга Полеваха подписался на 1.000 рублей и внес половину этой суммы па личными. Старший лейтенант Сосин дал взаймы государству 1.500 рублей, сер- жант Заболотнов --- 600 рублей, замести тель политрука Филимонов-500 рублей... В батальоне, которым командует капи- тан Граторенко, боiщы и командиры под писались на 180 процентов месячного ок- лада, в батарее старшего политрука Кат- ганова на 205 процентов. Часть в цо дом закончила оформление подписки на новый заем.	vol-5155-page-03-seg-020-2426-0866-3084-1351.png
5155	3	1893	1423	2928	1481	4	0.95103	тысяч рублей внесено наличными	vol-5155-page-03-seg-021-1893-1423-2928-1481.png
5155	3	1737	1503	2394	1887	48	0.95340	огромным подъемом проходила подпис как на Государственный Военный Заем 1942 года на постах и в подразделениях, где комиссаров тов. Захватаев. После ко- ротких митингов, посвященных выпуску займа, бойцы и начальствующий состав приступили к оформлению подписки. Пер вами закончили это дело бойцы подраз теления, которым командует лейтенант Бра- гинский.	vol-5155-page-03-seg-022-1737-1503-2394-1887.png
5155	3	1741	1891	2394	1957	11	0.96311	Сам тов. Братинокий подписался на 1.200 рублей и вес 600 наличными.	vol-5155-page-03-seg-023-1741-1891-2394-1957.png
5155	3	2418	1499	3078	1947	68	0.95363	Такую же сумму отдал при подписка старший лейтенант Леготин. Многие командиры сразу погасили задолженность по новому займу: тов. Бирибаум, попы савшийся на 3.000 рублей, тов. Захватает на 2.500 рублей, младший политрук Кузин - на 1.000 рублей, и другие. В первый же день после объявления выпуске займа подписка в части была полностью закончена. Личный состав под- писался на 167 процентов месячного ок лада. 48 тысяч рублей внесено налич- ными	vol-5155-page-03-seg-024-2418-1499-3078-1947.png
5155	3	1837	2015	2990	2077	5	0.96847	Подписка завершена в короткий срок	vol-5155-page-03-seg-025-1837-2015-2990-2077.png
5155	3	1733	2095	2392	2366	32	0.94776	КАЛИНИНСКИЙ ФРОНТ, 17 апреля (По телеграфу). Быстро и организованно завершена подписка на новый заем в сти, которой командует тов. Куприянов. Немного времени потребовалось уполномо- ченным, чтобы оформить подписку среди бойцов и командиров.	vol-5155-page-03-seg-026-1733-2095-2392-2366.png
5155	3	1773	2376	2386	2408	6	0.92902	Личный состав части дал взаймы госу	vol-5155-page-03-seg-027-1773-2376-2386-2408.png
5155	3	2412	2091	3074	2406	43	0.95829	дарству 335 процентов месячного ок- лада. подразделении политрука Глу- хова все лица среднего командного соста- ва подписались на 4.000 рублей каждый Политрук Дзоз подписался на 5. 000 руб лей и внес наличными 2.800 рублей. В подразделении капитана Медведева многи красноармейцы подписались на 50--100 рублей.	vol-5155-page-03-seg-028-2412-2091-3074-2406.png
5155	3	1817	2476	2972	2522	3	0.93297	ФРОНТОВИКИ ПРИВЕТСТВУЮТ ЗАЙМ	vol-5155-page-03-seg-029-1817-2476-2972-2522.png
5155	3	1729	2546	2388	3070	77	0.95710	КАРЕЛЬСКИЙ ФРОНТ, 17 апреля. (По телеграфу от наш. корр. ). Во всех ластях Карельского фронта состоялись митинги собрания по поводу выпуска нового зай- ма. В горячих патриотических речах, в единогласно принятых резолюциях фрон- товики приветствуют Военный Заем 1942 года, подчеркивая, что он помольет быстро разгромить немецких оккупантов. «Каждый из нас, пишут бойцы части, где комиссаром тов. Дмитриев, готов отдать все силы за честь, свободу и независимость любимой родины. Мы с радостью, как один, подписываемся на Военный Заем».	vol-5155-page-03-seg-030-1729-2546-2388-3070.png
5155	3	2412	2546	3072	2860	51	0.95734	Сумма подписки личного состава этой части равна двухмесячному окладу, как и во многих других частях. Ряд коман жиров и политработников тут же вносит наличными всю подписную сумму или Часть ее. В части, где комиссаром тов. Ре- кин, внесено наличными 48 тькяч руб- лей, в N гвардейской части --- 45 тысяч рублей.	vol-5155-page-03-seg-031-2412-2546-3072-2860.png
5155	3	2410	2864	3066	3070	32	0.94450	В одной из частей сержант Мязин, вы ступивший на митинге, сказал: Я с радостью подписываюсь на че тырехмесячное денежное содержание Каждый из нас знает, что Всенный Зае! пойдет на дело разгрома врага.	vol-5155-page-03-seg-032-2410-2864-3066-3070.png
5155	3	1849	4055	3000	4121	13	0.95676	ЮЖНЫЙ ФРОНТ. На передовые позиции прибыли свежие газеты, Снимок лишнего спец фотокор Ф	vol-5155-page-03-seg-033-1849-4055-3000-4121.png
5155	3	568	4231	1469	4349	2	0.93924	Горные орлы	vol-5155-page-03-seg-034-0568-4231-1469-4349.png
5155	3	342	4390	1004	4840	71	0.95525	Узкая тропа огибает лощину, бежит по кустарникам и, минуя паши окопы, ухо- дит в горы, к переднему краю немецкой обороны. С вечера, когда отряд младшего лейтенанта Агафонова ступил на эту троп- ку, было сравнительно светло. Бойцы ви- дели повороты, без труда перепрыгивали через расщелины. Теперь же все вокруг окутал густой туман, и что на шаг, то какая-нибудь оказия. Товарищ командир, шегчет Агафо- нову маленький кряжистый краснофлотец Апас, берите правее. Здесь обрыв...	vol-5155-page-03-seg-035-0342-4390-1004-4840.png
