volume_number	page_number	x1	y1	x2	y2	tokens_count	mean_confidence	text	image
5744	4	940	2839	1598	3458	89	0.96449	В декабре 1943 года на вооружение немецких пехотных и саперных подразде- лений поступили новое противотанковое ружье "Офенрор" реактивного действия, 88-мм. калибра и реактивная противотан- ковая граната «Фаустграната». Как ру- жье, так и граната настолько примитив- ны и несовершенны, что в первых же боях не оправдали возлагавшихся на них на- дежд. Кстати сказать, это противотапко- вое ружье является образцом пового сек- ретного оружия, о котором так много тру- била гитлеровская пропаганда. Пленные немецкие солдаты пронически заявляют: "Такое новое оружие действительно нуж- по держать в секрете, чтобы не показать пашу немощь».	vol-5744-page-04-seg-016-0940-2839-1598-3458.png
5744	4	940	3476	1594	3984	62	0.95957	Немецкое командование, напуганное стремительным наступлением войск Крас- ной Армии, проводит пелую серию меро- приятий по усилению своей противотан- ковой обороньг. Но это пока что не дает гитлеровцам достаточного эффекта. Модер- газированная противотанковая осорова врага рушится под ударами советских войск. Однако нашим офицерам, особенно танкистан, необходимо внимательно при- сматриваться к тактные немнез, противо- поставляя ей свою более совершенную так- тику. Подполковник Н. КУПЕНКО.	vol-5744-page-04-seg-017-0940-3476-1594-3984.png
5744	4	973	3993	1392	4034	2	0.93728	ДЕЙСТВУЮЩАЯ АРМИЯ.	vol-5744-page-04-seg-018-0973-3993-1392-4034.png
5744	4	1696	367	2231	471	4	0.97082	ВОЕННЫЕ ДЕЙСТВИЯ В ИТАЛИИ	vol-5744-page-04-seg-019-1696-0367-2231-0471.png
5744	4	1631	490	2291	682	35	0.96649	ЛОНДОН, 15 марта. (ТАСС). Главный штаб войск союзников в Италии сообща- ет, что на предмостном укреплении у Ан- цио союзники улучшили свои позиции. На основном фронте американской 5-й и ан- глийской 8-й армий действовали патрули.	vol-5744-page-04-seg-020-1631-0490-2291-0682.png
5744	4	1631	692	2289	979	46	0.97597	Авиация союзников произвела вчера на- леты на железнодорожную сортировочную станцию в Риме Пренестина, а также на узловые станции в Орле и Терни (севернее Рима). Эти объекты подверглись концентри- рованной бомбардировке. Самолеты союз- ников сбросили бомбы также на Пьомбино и Марина ди Пиза (на западном бере- Италии).	vol-5744-page-04-seg-021-1631-0692-2289-0979.png
5744	4	1762	1036	2164	1069	3	0.97504	БОИ В ЮГОСЛАВИИ	vol-5744-page-04-seg-022-1762-1036-2164-1069.png
5744	4	1625	1090	2287	1781	118	0.97227	ЖЕНЕ НА, 15 марта. (ТАСС). Как сооб- щают из Югославии, части народно-осво- бодительной армии ведут упорные бои гитлеровцами в Савинской долине в Сло- вении. В окрестностях города Ново Место отражены все немецкие атаки. В этих бо- ях уничтожено более 300 гитлеровцев. B Бании части народно-освободительной армии отбросили к Костайнице войска про- тивника, которые пробивались из Двора на освобожденную территорию. В Славонии на железнодорожной линии Белорар -- Гареш- кица уничтожен поезд с вражескими вой- сками. В результате катастрофы погибло 33 и ранено 17 вражеских солдат и офи- церов. Другой вражеский поезд уничтожен на линии Беловар -- Крижевны. Движение по дороге было прекращено на 150 часов. B Восточной Боснии, близ Хан Пиесака одна из частей народно-освободительной армии уничтожила группу четников.	vol-5744-page-04-seg-023-1625-1090-2287-1781.png
5744	4	1648	1860	2258	1983	6	0.91227	НОВЫЕ ДОКУМЕНТЫ, разоблачающие деятельность ГЕН. МИХАЙЛОВИЧА	vol-5744-page-04-seg-024-1648-1860-2258-1983.png
5744	4	1623	2000	2277	2289	41	0.98097	лондон, 14 марта. (ТАСС). Как пере- дает агентство Рейтер, штаб маршала Тито в сегодняшнем коммюнике сообщает что в Македонии открыты новые локумен- ты, предусматривающие соглашение между болгарскими войсками и четниками Михай- ловича о сотрудничестве в борьбе против югославской народно-освободительной ар- мии.	vol-5744-page-04-seg-025-1623-2000-2277-2289.png
5744	4	1656	2368	2248	2456	5	0.98720	БЕГСТВО ЗА ГРАНИЦУ РУМЫНСКОГО ГУБЕРНАТОРА	vol-5744-page-04-seg-026-1656-2368-2248-2456.png
5744	4	1619	2475	2275	2762	45	0.94946	СТОКГОЛЬМ, 15 марта. (ТАСС). Лон- донский корреспондент шведской газеты «Дагенс нюхетер» передает, что, по сооб- щениям из Анкары, румынский губернатор Заднестровья (так именуются румынами оккупированные ими и немцами советские области) вместе с женой бежал на само- лете за границу, захватив с собой казен- ные деньги.	vol-5744-page-04-seg-027-1619-2475-2275-2762.png
5744	4	1639	2831	2256	2906	5	0.87171	НАЛЕТ ГЕРМАНСКИХ САМОЛЕТОВ на англию	vol-5744-page-04-seg-028-1639-2831-2256-2906.png
5744	4	1615	2925	2273	3605	115	0.98165	ЛОНДОН, 15 марта. (ТАСС). Как пере- дает агентство Рейтер, в ночь на 15 марта около 100 германских самолетов соверши- ло налет на Лондон и районы Южной и Юго-Восточной Англии. Германские бом- бардировщики пытались одновременно подойти к Лондону с востока и с юга. Интенсивный заградительный огонь зенит- ной артиллерии вынудил их беспорядочно сбросить бомбы. Английские ночные истре- бители, отражая налет германских самоле- тов, провели одно из самых ожесточенных сражений в этом году. Сбито 13 герман- ских самолетов, причем два из них -- над Голландией. В одном из районов Лондона разрушены жилые дома. Повреждена дет- ская больница. На центральный район Лондона было сброшено большое коли- чество зажигательных бомб. Работа спаса- тельных команд продолжалась всю ночь. Имеются человеческие жертвы.	vol-5744-page-04-seg-029-1615-2925-2273-3605.png
5744	4	1683	3689	2202	3814	6	0.95744	ПРИГЛАШЕНИЕ ЧЛЕНОВ АМЕРИКАНСКОГО КОНГРЕССА в англию	vol-5744-page-04-seg-030-1683-3689-2202-3814.png
5744	4	1615	3832	2271	4022	26	0.95291	ЛОНДОН, 15 марта. (ТАСС). Как пере- лает агентство Рейтер, обе палаты англий- ского парламента 14 марта единогласно приняли резолюцию, приглашающую чле- нов американского конгресса посетить Анг-	vol-5744-page-04-seg-031-1615-3832-2271-4022.png
5744	4	2396	369	3562	430	4	0.94567	Замечательные вести из России	vol-5744-page-04-seg-032-2396-0369-3562-0430.png
5744	4	2414	459	3531	502	6	0.93722	Английский радиокомментатор о наступлении красной Армии	vol-5744-page-04-seg-033-2414-0459-3531-0502.png
5744	4	2306	517	2968	1065	85	0.96290	ЛОНДОН, 15 марта. (ТАСС). Выступая по лондонскому радио, радиокомментатор Патрик Лейси вчера заявил: "Мы получи- ли замечательные вести из России. Рус- ские войска заняли город Херсон в устье Днепра. События в южном секторе совет- ско-германского фронта свидетельствуют о выполнении Красной Армией блестящего стратегического плана». Патрик Лейси от- мечает, что германские войска несут боль- шие потери. Русские захватывают множе- ство трофеев. Однако, заявляет он, особен- но большое значение имеют стратегические последствия новых побед Красной Армии. Ее успешные военные действия порождают панику среди немецких войск. Русские на-	vol-5744-page-04-seg-034-2306-0517-2968-1065.png
5744	4	2985	521	3643	836	53	0.96820	ступают на широком фронте, продвигаясь ежедневно на большие расстояния, и не за- иедляют своего победонссного шествия Наступление частей Красной Армии прово- дится настолько блестяще и сокрушающе, что германское командование думает толь- ко о том, как бы спасти свои войска и бросает большое количество вооружения, как это было, в частности, в районе Ума- ни.	vol-5744-page-04-seg-035-2985-0521-3643-0836.png
5744	4	2983	840	3645	1061	32	0.96328	Патрик Лейси отмечает, что «американ- цы и англичане будут исключительно бла- голарны их русским союзникам, когда, на- чав наступление на Западе, они встретят германскую армию значительно ослабевший под сокрушительными ударами Красной Армии».	vol-5744-page-04-seg-036-2983-0840-3645-1061.png
5744	4	2450	1142	3499	1246	5	0.96558	ОПУБЛИКОВАНИЕ ПОСЛАНИЯ РУЗВЕЛЬТА ПРЕМЬЕР-МИНИСТРУ ЭФИРЕ	vol-5744-page-04-seg-037-2450-1142-3499-1246.png
5744	4	2302	1267	2968	1752	83	0.94772	ВАШИНГТОН, 15 марта. (ТАСС). Госу- дарственный департамент США опублико- вал текст послания президента Рузвельта премьер-министру Эйре де Балера от 26 февраля 1942 года в связи с прибытием американских войск на Британские острова. В послании говорится, что решение об от- правке войск на Британские острова было принято после консультации с английским правительством как часть стратегического плана разгрома агрессоров - держав оси. «У нас, -- указывается в послании, не было и нет сейчас ни малейшей мысли или намерения вторгнуться на ирландскую территорию или угрожать ирландской	vol-5744-page-04-seg-038-2302-1267-2968-1752.png
5744	4	2972	1267	3643	1752	72	0.96378	безопасности. Далеко не угрожая Ирлан- дии, присутствие этих войск на соседней с ней территории может лишь обеспечить безопасность Ирландии и Британских остро- вов, а также содействовать общим военным усилиям». Отметил, что и Эйре связаны кров- ными и дружественными узами, Рузвельт заявляет в своем послании, что "ирланд- скому правительству в его собственных интересах следовало бы не стоять одиноко, a быть в обществе своих традиционных друзей и в том числе Соединенных Шта- тов Америки».	vol-5744-page-04-seg-039-2972-1267-3643-1752.png
5744	4	2435	1814	3501	1860	5	0.95187	отношение канады к позиции эйре	vol-5744-page-04-seg-040-2435-1814-3501-1860.png
5744	4	2296	1879	2954	2627	121	0.97623	OTTABA, 15 марта. (TACC). Касаясь сообщений из Лондона о том, что премьер- министр Эйре де Валера обратился к канадскому правительству с просьбой о посредничестве связн требование американского правительства к ирландско- му правительству об отозвании германских японских дипломатов из Ирландии, премьер-министр Канады Маккензи Кинг заявил в палате общин 14 марта, что «канадское правительство никоим образом не пыталось посредничать между ирланд ским и американским правительствами». Кинг указал, что вскоре после получе- ния американской ноты де Валера заявил канадскому чрезвычайному уполномоченно- му в Ирландии Кирни: «Было бы в общих интересах Ирландии и Объединенных наций, если бы через посредство дружественной нации эта нота могла бы быть взята обратно». По словам Кинга, де Валера предложил, чтобы Канада взяла на себя эту задачу, и дал указания ирландскому	vol-5744-page-04-seg-041-2296-1879-2954-2627.png
5744	4	2975	1877	3633	2160	41	0.97160	чрезвычайному уполномоченному в Канаде Хирну передать эту точку зрения лично премьер-министру Кингу. Кинг указал, что его ответ состоял в том, что канадское правительство полностью сочувствует дей ствиям Соединенных Штатов и что канал ское правительство не желает вмешивать- ся в этот вопрос.	vol-5744-page-04-seg-042-2975-1877-3633-2160.png
5744	4	2972	2162	3635	2616	71	0.97447	В заключение Кинг заявил: «Де Валер ясно дал понять, что его правительство будет продолжать принимать все меры к тому, чтобы помешать представителям держав оси на ирландской территории использовать свое положение для получе- ния информации, наносящей ущерб - Обе- денежным нациям. В то же время предста- вители держав оси. конечно, не задумы- ваясь, будут злоупотреблять своими дипломатическими привилегиями, если по- лобным злоупотреблением они могут в какой-то мере нанести ущерб Об'единен- ным нациям».	vol-5744-page-04-seg-043-2972-2162-3635-2616.png
5744	4	2604	2695	3326	2741	3	0.93897	НАЛЕТ НА ДЮССЕЛЬДОРФ	vol-5744-page-04-seg-044-2604-2695-3326-2741.png
5744	4	2294	2762	2952	2987	36	0.95119	ЛОНДОН, 15 марта. (ТАСС). Как сооб- шает английское министерство авиации, в ночь на 15 марта английские бомбардиров- щики «Москито» совершили налет на Дюс- сельдорф. Все самолеты вернулись на свои базы. ЛОНДОН, 15 марта. (ТАСС). Как пе-	vol-5744-page-04-seg-045-2294-2762-2952-2987.png
5744	4	2970	2760	3626	2985	32	0.96751	редает агентство Рейтер, соединение аме- риканских тяжелых бомбардировщиков входящих в состав 8-го авиационного кор- пуса, днем 15 марта атаковало военные объекты в Центральной Германии. Бомбар- дировщики шли в сопровождении крупных сил истребителей.	vol-5744-page-04-seg-046-2970-2760-3626-2985.png
5744	4	2381	3049	3533	3139	11	0.95683	ОТЧЕТ КРОУЛИ ОБ ИСПОЛНЕНИИ ЗАКОНА О ПЕРЕДАЧЕ ВЗАЙМЫ ИЛИ В АРЕНДУ	vol-5744-page-04-seg-047-2381-3049-3533-3139.png
5744	4	2291	3154	2950	3606	75	0.98184	ВАШИНГТОН, 14 марта. (ТАСС). В связи с 1ретьей годовщиной принятия за- кона о передаче вооружения взаймы или в аренду председатель Управления по ру- ководству экономической деятельностью в иностранных государствах Кроули опубли- ковал 14-й квартальный отчет об исполне- нии этого закона за три месяца, окон- чившиеся 31 декабря 1943 года. Кроули отмечает, что в отличие от по- ложения, существовавшего 3 года тому на- зад, вооруженные силы Объединенных на- ций наступают сейчас на всех фронтах военных действий.	vol-5744-page-04-seg-048-2291-3154-2950-3606.png
5744	4	2291	3610	2950	3737	23	0.97207	Далее Косули указывает, что к концу 1943 года на осуществление программы пе- редачи взаймы или в аренду приходилось 14 процентов общих военных расходов	vol-5744-page-04-seg-049-2291-3610-2950-3737.png
5744	4	2966	3154	3624	3735	120	0.97117	США. С начала осуществления этой про- граммы, т. е. с марта 1941 года, до конца 1943 года, общие поставки оцениваются в 19.986 млн. долларов, из коих 11.733 млн приходится на 1943 год против 7.009 млн. в 1942 году и 1.244 млн. - в 1941 году. Самолеты, бомбы, танки, суда, орудия и другое вооружение составили 54 проц. об- ших поставок за весь период осушествле- ния указанной программы и 22 проц. по- сказок 1941 года, 47 проц. поставок 1942 года и 62 проц. поставок 1943 года. В декабре прошлого года на долю этих ма- териглов приходилось 67 проц. общих по- ставок. Затем Кроули приводит цифровые данные о поставках разным странам, про изведенных на основе закона о передаче взаймы или в аренду вооружения.	vol-5744-page-04-seg-050-2966-3154-3624-3735.png
5744	4	2379	3805	3549	3841	5	0.96164	ПЕРВОЕ ЗАСЕДАНИЕ ЕВРОПЕЙСКОГО КОМИТЕТА ЮНРРА	vol-5744-page-04-seg-051-2379-3805-3549-3841.png
5744	4	2293	3860	2949	4020	25	0.94287	ЛОНДОН, 15 марта. (ТАСС). Как сооб- щает агентство АФИ. 14 марта в Лондоне под председательством канцлера герцогства Ланкастерского Брауна состоялось первое заседание европейского комитета ЮНРРА.	vol-5744-page-04-seg-052-2293-3860-2949-4020.png
5744	4	2966	3860	3618	4022	19	0.95874	Советский Союз был представлен Илю- шенко. В повестке дня стоял вопрос о ме- тодах определения потребностей освобож- денных стран.	vol-5744-page-04-seg-053-2966-3860-3618-4022.png
5744	4	769	4124	1088	4157	2	0.96290	Е, ГАБРИЛОВИЧ	vol-5744-page-04-seg-055-0769-4124-1088-4157.png
5744	4	328	4212	1512	4347	1	0.93159	украинки	vol-5744-page-04-seg-056-0328-4212-1512-4347.png
5744	4	253	4374	907	4701	50	0.95276	Пламя свечи, колеблясь, озаряет сту пенька, лестница кажется крутой и сколь- зкой. На втором этаже свеча гаснет, мы долго и безуспешно зажигаем спичку за спичкой: ветер порывисто дует из раз- битых окон. Наконец, всё в порядке свеча горит опять. Оградив пламя ладонью, мой провожатый, Сергей Иванович, вхо- дит в квартиру.	vol-5744-page-04-seg-057-0253-4374-0907-4701.png
5744	4	255	4707	904	4818	15	0.95260	На кухне мы находим лампу и зажига- ем ее. При лампе кое-что можно осмот- реть.	vol-5744-page-04-seg-058-0255-4707-0904-4818.png
