volume_number	page_number	x1	y1	x2	y2	tokens_count	mean_confidence	text	image
5299	2	370	2278	1030	2625	53	0.96058	В районе Моздока наши войска отбива- ли атаки танков пехоты противника. В результате безуспешных атак гитлеров- мы потеряли 6 танков и свыше роты пе- хоты. На другом участке вражеский батальон пытался игрорваться через одно горное ущелье. Встретив упорное сотротн- вление, немцы отступили, оставив на поле боя 80 трупов своих солдат и офи- церов.	vol-5299-page-02-seg-013-0370-2278-1030-2625.png
5299	2	372	2665	1028	2836	26	0.95118	Севернее Воронежа в бою на окраине одного населенного пункта нашими частя мн уничтожено до 400 солдат и офицеров противника, подбито 11 и сожжено 6 не- танков.	vol-5299-page-02-seg-014-0372-2665-1028-2836.png
5299	2	372	2874	1032	3255	56	0.94791	На одном из участков Северо-Западного фронта наша часть под командованием т. Васильева отбила ожесточенную атаку немецкой пехоты и нанесла противнику большие потери. Артиллеристы батареи старшего лейтенанта т. Дякуна сожгла. 2 танка, уничтожили 2 противотанковых орудия и 6 огневых точек противника. Восемь летчиков-штурмовиков во главе с Героем Советского Союза т. Носовым совер- налет на скопление врага. Уничто-	vol-5299-page-02-seg-016-0372-2874-1032-3255.png
5299	2	1058	1299	1714	1385	13	0.94167	жено 6 немецких автомашин с грузами танк и свыше 50 сосет и офицеров.	vol-5299-page-02-seg-017-1058-1299-1714-1385.png
5299	2	1056	1405	1718	1642	32	0.96413	Советские летчики совершили налет на крупный аэродром противника. Нападение Башей авиации было настолько внезап- яым, что немцы не успели оказать сколь- ко-нибудь серьезного противодействия. В результате налета уничтожено до 60 немецких самолетов.	vol-5299-page-02-seg-018-1056-1405-1718-1642.png
5299	2	1054	1682	1714	2292	107	0.96193	Перешедший на сторону Красной Армии солдат 178 полка 76 немецкой пехотной Эмиль Т. рассказал: "Еще недавно в ротах нашего полка было 110 150 солдат. 3 теперь даже в батальоне осталось в два раза меньше. меня нет никакого жела- ния сложить свою голову за Гитлера на поле боя или замерзнуть в снежных сугро бах. Я договорился с группой солдат сдаче в плен. Накануне боя нас 8 солдат вышли из окопов и ползли к русским. По дороге мы заметили командира роты - лейтенанта фоп-Мельцена. выстрелил в Мельница из автомата и вместе с товари- щами скрылся в лощине. Приблизившись русским, мы бросили оружие, подняли руки и сдались в плен». *	vol-5299-page-02-seg-019-1054-1682-1714-2292.png
5299	2	1056	2312	1712	2645	58	0.94532	У немецкого солдата Альфреда найден письмо от жены из Фалькензее. В письме говорится: «Поляк, который был у Лизы Вом, снова украл. Он добрался до грани- ны, но там быть настигнут. Тогда он бро сился под поезд. Не ом и не думает горевать из-за таких пустяков. Взамен поляка она получила одного русского да еще русскую девушку 16 лет». *	vol-5299-page-02-seg-020-1056-2312-1712-2645.png
5299	2	1054	2661	1714	3255	83	0.96049	Группа бойцов и командиров Н-ской ча- если Ленинградского фронта составила акт Чудовищных зверствах немецко-фин- ских бандитов над пленными советскими бойцами. В акте говорится, что после за нятия Красной Армией вражеских позиций в овраге были обнаружены изуродованные трупы 13 бойцов, зверски замученных гитлеровскими палачами. Труп младшего командира Лунина Алексея Борисовича трупы остальных неопознанных красноар мейщев носят следы нечеловеческих пыток Фашистские мерзавцы отрубили пленным красноармейцам пальцы, выкололи глаза под распороли животы. Ают подписали: воен Фельдшер Хамитов Г. Х., красноармейцы Синицын С., Клочко В. и другие.	vol-5299-page-02-seg-021-1054-2661-1714-3255.png
5299	2	540	3285	1556	3342	3	0.93420	Вечернее сообщение октября	vol-5299-page-02-seg-022-0540-3285-1556-3342.png
5299	2	370	3368	1028	3612	36	0.95038	В течение 5 октября наши войска вели бои с противником в районе Сталинграда и в районе Моздока. На других фронтах существенных изменений не произошло. Нашими кораблями в Балтийском море потоплен немецкий транспорт водоизмеще- нием 10.000 тонн.	vol-5299-page-02-seg-023-0370-3368-1028-3612.png
5299	2	364	3649	1028	3990	51	0.95003	За 4 октября частями нашей авиации на различных участках фронта уничто- жено или повреждено 10 немецких тан- гов, 30 автомашин с войсками, 4 авто- цистерны с горючим, взорвано 2 склада боеприпасов, разбит железнодорожный со- став, подавлен огонь 3 артиллерийских батарей, рассеяно и частью уничтожено до двух рот пехоты противника. * *	vol-5299-page-02-seg-024-0364-3649-1028-3990.png
5299	2	364	4010	1028	4517	76	0.96206	B районе Сталинграда продолжались ожесточенные бои. В направлении завод- ского поселка противник бросил в на- ступление до трех пехотных дивизий и 100 танков, действующих при поддержке авиации. Советские войска отбили много- численные атаки гитлеровцев и нанесли им большой урон. В этом бою, по неполным данным, подбито и сожжено 14 немецких танков и истреблено до 1.000 солдат офицеров противника. Огнем нашей артил- лерии и гвардейцев-минометчиков уничто жено 5 минометных батарей, 85 автома- и до батальона немецкой пехоты.	vol-5299-page-02-seg-025-0364-4010-1028-4517.png
5299	2	366	4535	1028	5085	86	0.95828	Северо-западнее Сталинграда на одном из участков наши войска вели активные боевые действия и улучшили свои пози- На поле боя осталось до 200 враже трушов. Уничтожено 3 немецких танка, бронемашина, 4 орудия 6 пуле- четов. Группа бойцов во главе со стар- шиной т. Свиридовым ворвалась в тран- шеи противника, перебила находившихся в них гитлеровцев и закрепилась на но- рубеже. Вскоре немцы перешли контратаку. Наши бойцы в течение двух часов вести борьбу против численно пре восходящих сил противника, отбили атаку и истребили более 50 немецких солдат и офицеров,	vol-5299-page-02-seg-026-0366-4535-1028-5085.png
5299	2	362	5121	1028	5467	56	0.95990	районе Моздока продолжались оже- сточенные бол в одном населенном пункте. Части Н-ского соединения отбили четыре атаки пехоты и танков противника. В те- челие дня нашими бойцами подбито нечетких тип гов, уничтожено 6 миноме- тов, 6 пулеметов, убито и ранено до 600 солдат и офицеров противника. 5 октября в расположении одной нашей части приземлился вражеский самолет. Не-	vol-5299-page-02-seg-027-0362-5121-1028-5467.png
5299	2	1056	3368	1710	3502	23	0.96335	мецкий летчик добровольно сдался в плен... Он заявил, что не верит в победу Герма- нии и не хочет проливать свою кровь за Гитлера.	vol-5299-page-02-seg-028-1056-3368-1710-3502.png
5299	2	1054	3540	1714	4094	90	0.95652	На Брянском фронте наши части ру- кейно-пулеметным огнем уничтожали жи- BV10 силу противника. В течение дня потреблено 230 гитлеровцев. Заместятель политрука т. Мажора и красноармейцы тт. Латышев и Травка проникли в расло- ложение обороны противника. Когда до немецких окопов осталось 40-50 метров, смельчаки поднялись во весь рост. Гитле резцы, решив, что бойцы сдаются в плен, вышли из окопов не пошли им навстречу. Тов. Мажора и красноармейцы выхватили гранаты и метнули их в группу немцев. Уничтожив 12 немецких солдат и офице- ров, наши бойцы вернулись в свое под- разделение, * *	vol-5299-page-02-seg-029-1054-3540-1714-4094.png
5299	2	1056	4096	1712	4690	93	0.96570	Немецко-фашистские мерзавцы заливают кровью улицы и площади Ростова. Мас- совые аресты и расстрелы мирных совет- ских жителей не прекращаются ни на один день. 14 сентября банда эсэсовцев погрузила многочисленную группу аресто- ванных в барку. Всю ночь эсэсовцы их зверски мучили, а потом утопили в реке. 21 сентября немецкие палачи расстреляли в камышевахинском парке 80 мужчин и женщин. Недавно на Буденновском про- спекте среди белого дня неизвестными бы. убит немецкий офицер. Фашистские бан- диты оцепили все прилегающие улицы схватили первых попавшихся 100 40.10 - век, в том числе женщин и подростков и расстреляли их.	vol-5299-page-02-seg-030-1056-4096-1712-4690.png
5299	2	1056	4726	1712	5463	119	0.96316	Обстановка в Румынии обостряется с каждым днем. Многие румыны не скры- вают своей ненависти к гитлеровцам, пре- вратившим их страну в немецкую провин- цию. В связи с этим встревожились ру- мынские лакеи Гитлера. За каких-нибудь пять дней Антонеску подписал несколько свирепых законов. Опубликовано постано- вление о смертной казни за саботаж и раз- глашение данных о положении в стране. Принят закон о расстреле за дезертирство и неявку на призыв, а также за укло- нение от работы на военных предприятиях Введена смертная казнь для крестьян, от- казывающихся сдавать продовольствие На палец, принят ряд новых поправок уголовному кодексу. Все эти меры рассчи- таны на то, чтобы в крови потопить не- довольство румын, все более и более от- крыто выступающих против немецких за	vol-5299-page-02-seg-031-1056-4726-1712-5463.png
5299	2	514	5517	1572	5569	4	0.94720	Ожесточенные схватки в траншеях	vol-5299-page-02-seg-032-0514-5517-1572-5569.png
5299	2	364	5577	1028	6251	101	0.95785	СЕВЕРО-ЗАПАДНЫЙ ФРОНТ, 5 октября. (По телеграфу от наш. корр. ). В течение последних трех дней одно подразделение части вело ожесточенный бой в немец- ких траншеях. Это подразделение, ворвав- шись на передний край обороны против- ника, овладеть большой траншеей, истре- бив несколько десятков немцев. Но потом гитлеровцам под покровом темноты удалось вернуть утраченные позиции. 3 октября наши бойцы вновь овладели немецкой траншеей. причинив врагу боль- шой урон. В этом бою- мастерски действо- вали штурмовые группы лейтенанта Пол- нощекова и сертанта Бережнева. Они скрытно подбирались вражеским бленда- жам и стремительно атаковывали их. Очи от немцев траншею длиной в 700 по- метров, красноармейцы захватили	vol-5299-page-02-seg-033-0364-5577-1028-6251.png
5299	2	1054	5579	1712	6129	85	0.95357	38 блиндажей, 12 ручных пулеметов, 106 винтовок, 2 противотанковых пушки, 5 тяжелых минометов, много патронов, гра- нат, мин и другого военного имущества. Вскоре фашисты предприняли несколько контратак, но все их попытки отбить по терянный рубеж были безуспешны. Особен. но яростная контратака последовала утром 4 октября. Немцы шли группами в 40 50 солдат, причем многие из них не име ли винтовок и были вооружены только гранатами и кинжалами. Наши бойцы встретили врага интенсивный огнем и от- разили контратаку. Немцы понести боль- шне потери и отошли назад.	vol-5299-page-02-seg-034-1054-5579-1712-6129.png
5299	2	1056	6135	1708	6241	13	0.93844	За три дня боев противник потеря. здесь до 300 человек убитыми и ране	vol-5299-page-02-seg-035-1056-6135-1708-6241.png
5299	2	2067	1495	3039	1560	11	0.94049	НА СЕВЕРНОМ КАВКАЗЕ. Перед атакой. Слимок нашего спец. фотокорр. Я. Халиг	vol-5299-page-02-seg-036-2067-1495-3039-1560.png
5299	2	1865	1650	2966	1704	4	0.96684	Активные действия наших войск	vol-5299-page-02-seg-037-1865-1650-2966-1704.png
5299	2	1740	1728	2398	2144	66	0.96240	ДЕЙСТВУЮЩАЯ АРМИЯ, 5 октября. (По телеграфу от наш. ксрр.). На-днях на од- ном участке в районе Воронежа наши ча- сти натали активные действия. Отп обл жили с трех сторон один населенный пункт и высоту юго-восточнее его. Эти вральастис опорные пункты имеют боль шое тактическое значение и были сильно укреплены. Немцы создали здесь густую сеть проволочных заграждений, минных полей и дзотов, отрыли несколько линий траншей и оконов,	vol-5299-page-02-seg-038-1740-1728-2398-2144.png
5299	2	1740	2148	2396	2527	55	0.96338	После внушительной артиллерийской авиационной обработки позиций противни- Ка наши танки во взаимодействии с лехо- той ворвались на южную окраину насе- ленного пункта. Одновремено две другие части атаковали немцев с северо-запада и северо-востока. Бросок атакующих был на- столько стремителен, что отдельные немцы стали поспешно отходить в глубь насе- ленного пункта. Развивая успех на южной окраине, на	vol-5299-page-02-seg-039-1740-2148-2396-2527.png
5299	2	2421	1736	3081	2533	123	0.96498	танки и пехота завязали здесь жаркий бой. Уничтожив до 60 4 танка, они закрепились на достигнутом рубеже. Части, действующие с северо-за- пада и северо-востока, преодолев проволоч- ные заграждения, ворвались во вражеские окопы и траншеи. В ход пошли штыки гранаты. Врат упорно сопротивлялся. результато ожесточенной борьбы наши бойцы уничтожили более 250 немцев. Отлично действовала соседняя часть атаковавшая противника в районе высо- ты. Она прорвала передний край обороны немцев и вклинилась на два километра глубину. За день боя, по предварительный данным, здесь уничтожено более 700 фа- шистов, 4 минометные батареи, 14 пуле метных гнезд, подавлены 4 артиллерий- ские батареи. Бои продолжаются. Успешно действовали на этом участке фронта наши летчики и зенитчики. В воз- душных боях за день стоит пять племенных самолетов, а зенитным огнем- четыре.	vol-5299-page-02-seg-040-2421-1736-3081-2533.png
5299	2	1915	2601	2906	2661	4	0.93740	Немцы несут большие потери	vol-5299-page-02-seg-041-1915-2601-2906-2661.png
5299	2	1738	2681	2396	3562	137	0.95676	ЛЕНИНГРАДСКИЙ ФРОНТ, 5 октября (По телеграфу от наш. корр. ). На участке где наши подразделения силой ночной атакой выбили немцев из их траншей, все эти дни происходят ожесточенные бои Стянув сюда болыпие авиационные силы подбросив танки и артиллерию. немцы предпринимают одну яростную атаку за другой, пытаясь вернуть утерянные пози- ции. Наши подразделения, которые много поработали над закреплением занятого ру- бежа, успешно отражают вражеские атаки и наносят немцам большие потери. После сильной бомбежки с воздуха, а также артиллерийского и минометного об- стрела немецкий батальон с шестью тан- ками двинулся к позициям одного нашего подразделения. Бойцы настороженно ждали приближения врага и вскоре обрушили весь огонь своего оружия на немецкие танки и пехоту. В первые же минуты боя три вражеских танка были выведены из строл. Сстальные танки повернули об ратно, а вслед за ними поспешили уб- раться уцелевшие немецкие пехотинцы.	vol-5299-page-02-seg-042-1738-2681-2396-3562.png
5299	2	2420	2689	3079	3562	142	0.96588	Стать же ожесточенным атакам с воз- луха и с земли подверглись позиции, за- нимаемые соседними подразделениями. Ата- кующий немецкий батальон здесь поддер- живали восемь танков. Фашисты потеря ли на этом участке пять боевых машин много солдат и офицеров, по не смогли от- бить ни одного окопа. В последние дни немны значительно ви- доизменили характер своих атак. Они ста- раются нащупать «щели» в налпих бое- вых порядках и проникнуть в них мел- кими группами. Однако эта тактика врага терпит крах. Мелкие группы немец- ких автоматчиков, которым удается про сочиться через наши боевые порядки, по падают в окружение и уничтожаются. Большой урон терпит в этих боях вра- жеская авиация. За день лишь одно наше зенитное подразделение сбило семь фашист- ских бомбардировщиков. По снижающимся немецкий самолетам упорную борьбу ве дует и наши пехотинцы. Недавно лейте нант Федоров из винтовки сбил бомбарди- ровщик, пикировавший на окоп,	vol-5299-page-02-seg-043-2420-2689-3079-3562.png
5299	2	2039	3639	2784	3703	3	0.97563	Дерзкий ночной поиск	vol-5299-page-02-seg-044-2039-3639-2784-3703.png
