volume_number	page_number	x1	y1	x2	y2	tokens_count	mean_confidence	text	image
6084	2	1020	5792	1673	6154	51	0.95117	В тот же день г-жа Черчилль была принята председателем исполкома Ростов- ского городского Совета депутатов трудя- щихся К. Г. Гаркушенко. За время пребывания в Ростове г-жа Черчилль и сопровождающие ее лица ос мотрели город, посетили один из госпита- лей, который восстанавливается за счет «Фонда помощи России», Дом ребенка, Центральную городскую больницу.	vol-6084-page-02-seg-028-1020-5792-1673-6154.png
6084	2	1694	5673	2343	5968	40	0.95733	Председатель исполкома горсовета K. Г. Гаркушенко дал честь г-жи Черчилль ужин и вручил ей подарок картину «Руководители трех великих дер- жав на Крымской конференции» работы молодого ростовского художника Лелькова и альбом «Ростов до войны и после окку- тации его немцами»	vol-6084-page-02-seg-029-1694-5673-2343-5968.png
6084	2	1692	5980	2338	6154	21	0.95844	22 апреля г-жа Черчилль и сопровож- дающие ее лица выехали из Ростова. На вокзале ее провожали представители го- род ских организаций	vol-6084-page-02-seg-030-1692-5980-2338-6154.png
6084	2	2813	479	4067	556	2	0.94376	ОПРОВЕРЖЕНИЕ ТАСС	vol-6084-page-02-seg-031-2813-0479-4067-0556.png
6084	2	2430	585	3085	836	35	0.95961	Некоторая часть иностранной печати и том числе лондонская газета «Санди Таймс» распространяет слухи, что на Крымской Конференции якобы было реше- но, что на Конференцию в Сан-Франциско могут быть приглашены лишь представи- тели реорганизованного Польского Прави-	vol-6084-page-02-seg-032-2430-0585-3085-0836.png
6084	2	3103	573	3767	830	36	0.96275	тельства, но не должны быть приглашены представители Временного Польского Пра- вительства в Варшаве. ТАСС уполномочен заявить, что сообще- ния такого рода совершенно не соответст- вуют действительности. На Крымской Кон- ференции этот вопрос не только не был	vol-6084-page-02-seg-033-3103-0573-3767-0830.png
6084	2	3777	575	4430	813	33	0.95281	решен, но вовсе и не оосуждался. Таким об- разом, решения Крымской Конференции не являются каким-либо препятствием к то- му, чтобы на Конференцию в Сан-Фран- циско были приглашены представители Временного Польского Правительства в Варшаве.	vol-6084-page-02-seg-034-3777-0575-4430-0813.png
6084	2	2554	894	4326	1004	4	0.89814	* ОТ СОВЕТСКОГО ИНФОРМБЮРО	vol-6084-page-02-seg-035-2554-0894-4326-1004.png
6084	2	2575	1016	3619	1078	5	0.97549	Оперативная сводка за 23 апреля	vol-6084-page-02-seg-036-2575-1016-3619-1078.png
6084	2	2419	1087	3748	2222	288	0.95687	Войска 1-го БЕЛОРУССКОГО фронта, перейдя в наступление с плацдармов на западном берегу ОДЕРА, при поддержке массированных ударов артиллерии и авиа- ции, прорвали сильно укрепленную, глубоко эшелонированную оборону немцев, прикрывавшую БЕРЛИН с востока, продвинулись вперед от 60 до 100 километров, обладали городами ФРАНКФУРТ на ОДЕРЕ, ВАНДЛИТЦ, ОРАНИЕНБУРГ, БИРКИН- ВЕРДЕР, ГЕННИГСДОРФ, ПАНКОВ, ФРИДРИХСФЕЛЬДЕ, КАРЛСХОВст, кепеник и ворвались в столицу Германии БЕРЛИН. В боях за 22 апреля войска фронта Взяли в плен свыше 4.000 немецких солдат и офицеров и захватили 85 полевых студий, 3.100 автомашин, 67 паровозов, 1.800 железнодорожных вагонов и складов с различным военным имуществом. :: Войска 1-го УКРАИНСКОГО фронта, перейдя в наступление, прорвали, при поддержке массированных ударов артиплерии и авиации, сильно укрепленную глубоко эшелонированную оборону немцев на реке НЕЙСЕ, продвинулись вперед от 80 до 160 километров, овладели городами КОТТБУС, ЛЮББЕН, ЦОССЕН, БЕЕЛИТЦ, ЛУКЕНВАЛЬДЕ, ТРОЙЕНБРИТЦЕН, ЦЕНА, МАРИЕНФЕЛЬДЕ, ТРЕББИН, РАНГСДОРФ, ДИДЕРСДОРФ, ТЕЛЬТОВ и ворвались с юга в столицу Германии БЕРЛИН. ПАЗ) важным узлом дорог и сильным опорным пунктом обороны немцев. заняли Одновременно на ДРЕЗДЕНСКОМ направлении войска фронта с боями города ЭССЕН, КИРХХАЙН, ФАЛЬКЕНБЕРГ, МЮЛЬБЕРГ, вышли на реку ЭЛЬБА северо-западнее ДРЕЗДЕНА. В боях за 22 апреля Войска фронта взяли в плен более 7.000 немецких сол- дат и офицеров и захватили 200 танков, 105 полевых орудий и 3.000 автомашин. Войска 4-го УКРАИНСКОГО фронта, продолжая наступление, ИСХОДУ 22 апреля на территории Чехословакии штурмом овладели городом СПАВА (ТРОП- На территории Чехословакии, юго-западнее ГОДОНИНА, войска 2-го УНРАИН- СКОГО фронта с боями заняли город МИКУЛОВ и населенные пункты ЛЕДНИЦЕ, БУЛГАРИ, ПАВЛОВ, ПЕРНА, ПРАТЛСБРУН, ДОЛЬНЫЕ ДУНАЕВИЦЕ, ДОБРОЕ ПОЛЕ. -- На других участках фронта --- существенных изменений не было. За 22 апреля наши войска на всех фронтах подбили и уничтожили 165 не- мецких танков и самоходных орудий. В воздушных боях и огнем зенитной артил- лерии сбит 61 самолет противника.	vol-6084-page-02-seg-037-2419-1087-3748-2222.png
6084	2	2397	2318	3066	3468	165	0.96042	Войска 1-го Белорусского фронта раз- вивали успешное наступление и ворвались в столицу Германии Берлин. Противник яростно сопротивляется, но под ударами советских войск оставляет одну позицию за другой. В результате обходного маневра решительного штурма занят город Франкфурт на Одере --- мощная крепость немцев на реке Одер и крупный промыш- ленный пентр. Обходя Берлин с севера, наши войска в результате стремительных ударов заняли город Биркенвердер. Про двигаясь по густонаселенной местности, уничтожая вражеские узлы сопротивле- ния и преодолевая на своем пути всевоз- можные препятствия, наши бойцы с хода переправились через Гогенцоллерн-ка- кал. После упорных боев занят город Тен- нигедорф на западном берегу канала. Од- новременно советская пехота и конница овладели городом Ораниенбургом цент- ром металлургической и химической про- мышленности. Ожесточенные бон произо- шли в северо-восточной части Берлина. Немцы ввели в бой несколько пехотных полков и до 40 отдельных батальонов. Опираясь на укрепления, построенные линии окружной железной дороги, против- ник неоднократно переходил в контратаки. После сильного артиллерийского обстрела вражеских позиций наши войска прорвали немецкую оборону. Занят газовый завод и	vol-6084-page-02-seg-039-2397-2318-3066-3468.png
6084	2	3080	2309	3748	3105	116	0.96134	ряд городских кварталов. Советские тан- кисты и пехотинцы, наступающие с во- стока, выбили гитлеровцев из города Кепеник и, наращивая удары, ворвались в пригород Берлина Карлсхорст. Занят аэродром и несколько заводов. В ходе боев противник несет огромные потери. Места боев завалены трупами вражеских солдат и офицеров. По неполным данным, за день сожжено и подбито 53 танка и учичто- жено более 160 орудий противника. Немецкое командование принимает са- мые крутые меры для усиления сопротив- линия своих войск. Вчера немецким ар- тиллерийским частям был передан по ра- дио приказ стрелять по своей отсту- поющей пехоте осколочными снарядами. На все просьбы командиров частей разре- пить отход немецкое командование неиз- менно отвечает: "Держитесь при любых обстоятельствах. Кто отойдет, тот будет расстрелян».	vol-6084-page-02-seg-040-3080-2309-3748-3105.png
6084	2	3074	3143	3740	3466	46	0.95120	Войска 1-го Украинского фронта про- должали успешное наступление. Ожесто- ченные бои произошли за город Коттбус - сильно укрепленный пункт обороны немцев на реке Шпрее. Усилив гарнизон города танковой дивизией, противник ока- зывал упорное сопротивление. Сильными ударами советские части выбили гитлеров- цев из восточной части города. Олновре-	vol-6084-page-02-seg-041-3074-3143-3740-3466.png
6084	2	3773	1010	4428	2127	173	0.95598	Менно наши войска переправились через реку Шпрее, обошли Коттбус с запада, а затем предприняли штурм города. В улич- ных боях вражеский гарнизон был разбит и в беспорядке отступил. Коттбус является важным узлом путей сообщения. нему сходятся восемь железных и ряд шоссей- ных дорог. Кроме текстильной промышлен- ности в городе имеются 25 военных заво- дов. В боях за Коттбус войсками фронта уничтожено до 5 тысяч немецких солдат офицеров и захвачены большие тро- фси, в числе которых 100 танков и само- ходных орудий. Северо-западнее города Шпремберг наши войска ликвидировали окруженную группу немецких войск. B состав этой группы входили части 10 танковой дивизии СС, танковой дивизии «Охрана фюрера» и других соединений противника. Только в этом районе зато в плен свыше 3 тысяч гитлеровцев. Уничтожая подходящие к фронту резервы противника, наши войска за день продвину- лись вперед на 50 километров и встретили сильно укрепленную и глубоко эшелони- рованную оборону немцев, прикрывавшую Берлин с юга. Мощными ударами артил- лерии, авиации, танковых соединений и не хаты советские войска сокрушили вра- жескую оборону и с юга ворвались на улицы Берлина.	vol-6084-page-02-seg-042-3773-1010-4428-2127.png
6084	2	3764	2166	4419	3306	169	0.96112	Войска 4-го Украинского фронта про- должали наступление. Советские части, переправившиеся через реку Опава, встре- тили развитую сеть долговременных желе- зобетонных укреплений немцев. Особенно ожесточенный бой произошел за укреплен- ную высоту, прикрывающую подступы к городу Опава с востока. Наши подразделе- ния блокировали на склонах высоты более тридцати дотов и дзотов и ликвидировали их гарнизоны. Развивая успех, войска фронта завязали бои на подступах к го- роду Опава. Немцы построили на окраи- нах города ряд восьмиамбразурных железо- бетонных дотов. Все каменные здания были превращены в узлы сопротивления. Советские танки с десантами пехоты на броне стремительным броском ворвались в восточную часть города. Действуя умело и решительно, наши штурмовые группы вы- бивали гитлеровцев из зданий и очищали от врага квартал за кварталом. Вчера к исходу дня наши войска завершили раз- гром вражеского гарнизона и полностью овладели Опавой - крупным промышлен- ным городом Чехословакии и важным уз- лом железных и шоссейных дорог. Только на восточной окраине города уничтожено два батальона немецкой пехоты. Захвачены большие трофеи и взято в плен более 800 немецких солдат и офицеров.	vol-6084-page-02-seg-043-3764-2166-4419-3306.png
6084	2	3758	3329	4399	3468	21	0.96522	Кораблями Краснознаменного Балтийско- го флота в южной части Балтийского моря потоплены два немецких транспорта об- щим водоизмещением в 12 тысяч тонн.	vol-6084-page-02-seg-044-3758-3329-4399-3468.png
6084	2	2660	3539	4135	3680	3	0.97367	По Берлину. -огонь.	vol-6084-page-02-seg-045-2660-3539-4135-3680.png
6084	2	2368	3698	3052	5292	247	0.95722	Берлин начинается с кольцевой авто- страды, опоясывающей город. Широкая по- лоса железобетонного шоссе разделена по- полам трехметровой лентой зеленой травы. На каждой половинке шоссе могут идти в ряд три автомашины, и травяной барьер посредине сделан для того, чтобы шоферы не заезжали на левую сторону магистра- ли. Вступление наших танков на террито- рию гитлеровской столицы ознаменовалось нарушением немецких правил пользования автострадой. Танки, самоходные орудия, бронетранспортеры, автомашины с орудия ми и минометами на прицепе, грузовики, всё сразу хлынуло во всю ширь авто- страды и могучим потоком ринулась впе- ред. Берлинская кольцевая автострада не могла вместить весь поток нашей боевой техники, и нарушение правил движения было, таким образом, вызвано военной не- обходимостью. Впрочем, сквозного встреч- ного движения в эти часы и не планиро- валось. Наоборот, всё, что двигалось нав- стречу, со стороны центра Берлина и тех пригородов, где еще сидели немцы, немед- ленно уничтожалось огнем всех видов со- ветского оружия и смешалось с пути. Нелегок был путь наших танков от бе- регов Одера к хмурым окраинам Берлина. Нем Немецкая линия обороны у озер Штраус- зее и Штиниц-зее упорно держалась, и гитлеровцам уже казалось, что наступил какой-то перелом B операции, и самое страшное уже позади, Правда, где-то севернее, в лесах, линия обороны была смята, и советские войска начали проса- чиваться в лесные массивы. Это немцам не показалось слишком опасным. Но тем временем танкисты Героя Советского Сою- за полковника Шевченко передали свой участок подошедшей пехоте, а сами, со- бершив сложный ночной марш в густом лесу, вышли в тыл всей немецкой груп- пировке,	vol-6084-page-02-seg-046-2368-3698-3052-5292.png
6084	2	2357	5296	3014	6158	133	0.95902	Опасаясь новых ударов с запада, немцы решили эвакуировать город Штраусберг. Местные правители вместе со своими семьями двинулись поздним вечером на Берлин. Через полчаса охраняемая поли- цейскими вышла на запад большая ко- лонна украинских и русских девушек Первый привал был намечен в городе Альт-Ландсберг, лежащем на половине пу- ти между Штраусбергом и Берлином. А в это время ПОЛКОВНИК Шевченко от- давал боевой приказ на захват Альт- Ландсоерга. Ночной бой танков в населенном пунк- те чрезвычайно труден и сложен. К тому же город был наводнен "фаустниками", а прислуга берлинских зенитных батарей в последнее время специально тренировалась в стрельбе по танкам. В этих условиях от каждого танкиста требовалось особое уме- ние в сочетании с отвагой и дерзостью. Завязав бои на северной окраине, танки- сты привлекли сюда внимание всего гар- низона, а в это время другие подразделе-	vol-6084-page-02-seg-047-2357-5296-3014-6158.png
6084	2	3143	3746	3657	3814	5	0.96152	(От специального корреспондента «Красной звезды»)	vol-6084-page-02-seg-048-3143-3746-3657-3814.png
6084	2	3058	3893	3725	4792	139	0.95672	ния звездным штурмом прорвали оборону немцев и ворвались в город. Два часа шла очистка улиц и домов от гитлеров- ских «фаустников», и только к рассвету здесь водворилось относительное спокойст- вие. Штраусбергские нечцы дальше на Берлин уже не пошли. В эти дни решающих боев за Берлин в наших войсках царит особая приподня- тость. Особенно часто слышатся жалобы наших врачей и медицинских сестер, что раненые не хотят эвакуироваться в тыл, иногда вовсе отказываются идти на пе ревязку, оставаясь в боевых порядках. Командир батальона капитан Брызгалов был ранен в ногу, но отказался, несмотря на настойчивые требования санитарного инструктора Зины Березиной, лечь в дву- колку и уехать в тыл. Ведь не пойдете вы, товарищ капи- тан! Только зря ногу растревожить. Нет, пойду. от самой Курской ду- ги сюда шагаю, пять пар сапог износил. Не дойду, так на локтях доползу, а в Берлине буду.	vol-6084-page-02-seg-049-3058-3893-3725-4792.png
